nombre,apellidos,tweet_screen_name,tweet_text,tweet_date
Jaime Rubén,Chugchilan Cisaguano,ChugchilanJaime,Vengo organizaciones sociales Movimiento Indigena Ecuador pertenezco ninguna tendencia partidista Jipijapa CafeRadio TuParticipacionEsLaSolucion JaimeChugchilanEsParticipacion,2019-02-19
Jaime Rubén,Chugchilan Cisaguano,ChugchilanJaime,Vengo organizaciones sociales Movimiento Indigena Ecuador pertenezco ninguna tendencia partidista Jipijapa CafeRadio TuParticipacionEsLaSolucion JaimeChugchilanEsParticipacion,2019-02-19
Jaime Rubén,Chugchilan Cisaguano,ChugchilanJaime,Gracias periodistas LimberChilanCh CesarDelgado CafeRadio Jipijapa entrevista TuParticipacionEsLaSolucion JaimeChugchilanEsParticipacion,2019-02-19
Jaime Rubén,Chugchilan Cisaguano,ChugchilanJaime,RadioCaribe Manabi periodista Franklin Castro conversamos propuestas CPCCS TuparticipacionEsLaSolucion JaimeChugchilanEsParticipacion,2019-02-19
Jaime Rubén,Chugchilan Cisaguano,ChugchilanJaime,Gracias Jefferson Calle recibimiento invitarme mercado Jipijaja degustar ricos bolones chicharron socializar propuestas CPCCS TuparticipacionEsLaSolucion JaimeChugchilanEsParticipacion,2019-02-19
Jaime Rubén,Chugchilan Cisaguano,ChugchilanJaime,Fortalecimos participacion ciudadana Conversatorio candidatos CPCCS Jipijaja Gracias Manabi acogida,2019-02-19
Jaime Rubén,Chugchilan Cisaguano,ChugchilanJaime,Buen Manabi invitados sintonizar medios estare invitada hablar CPCCS SofiaAlmeida,2019-02-20
Jaime Rubén,Chugchilan Cisaguano,ChugchilanJaime,Manabi compartimos jovenes importancia CPCCS jovenes viven participacion TuparticipacionEsLaSolucion JaimeChugchilanEsParticipacion,2019-02-20
Jaime Rubén,Chugchilan Cisaguano,ChugchilanJaime,Vengo Movimiento Indigena Ecuador organizaciones sociales pertenezco ninguna tendencia partidista represento ecuatorianos quieren pais mejor RadioMorena Guayaquil TuparticipacionEsLaSolucion JaimeChugchilanEsParticipacion,2019-02-20
Jaime Rubén,Chugchilan Cisaguano,ChugchilanJaime,Guayaquil entrevista WQRadio compartimos microfono FranklinMorenoQuezada dialogamos retos propuestas CPCCS TuparticipacionEsLaSolucion JaimeChugchilanEsParticipacion,2019-02-20
Jaime Rubén,Chugchilan Cisaguano,ChugchilanJaime,Guayaquil participamos Asamblea Ciudadana Ecuador TuparticipacionEsLaSolucion JaimeChugchilanEsParticipacion,2019-02-20
Jaime Rubén,Chugchilan Cisaguano,ChugchilanJaime,Invito ecuatorianos escoger buenos ciudadanos CPCCS marzo ManasurTV Manabi TuparticipacionEsLaSolucion JaimeChugchilanEsParticipacion,2019-02-20
Jaime Rubén,Chugchilan Cisaguano,ChugchilanJaime,Estimados colegas feliz,2019-02-20
Jaime Rubén,Chugchilan Cisaguano,ChugchilanJaime,trabajo enseno responsabilidad dignifico vida impulsamos jovenes participen procesos ciudadanos CPCCS escuchando TuparticipacionEsLaSolucion JaimeChugchilanEsParticipacion,2019-02-20
Jaime Rubén,Chugchilan Cisaguano,ChugchilanJaime,Feliz colegas abogados,2019-02-20
Jaime Rubén,Chugchilan Cisaguano,ChugchilanJaime,importante medios comunicacion esten atentos clamor ciudadano herramientas objetivos transparentes Gracias Angelita Colegio Periodistas Guayas Franklin Moreno TuParticipacionEsLaSolucion JaimeChugchilanEsParticipacion,2019-02-20
Jaime Rubén,Chugchilan Cisaguano,ChugchilanJaime,vandocilla CPCCS davidroserow SofiaAlmeidaEc Gracias amigo saludos,2019-02-23
Jaime Rubén,Chugchilan Cisaguano,ChugchilanJaime,voto nulo dejar sectores secuestraron CPCCS pasado regrese voto sera davidroserow SofiaAlmeidaEc ChugchilanJaime,2019-02-23
Jaime Rubén,Chugchilan Cisaguano,ChugchilanJaime,Recorriendo Guayaquil conversando gente dando conocer propuestas CPCCS Franklin Moreno Quezada TuParticipacionEsLaSolucion JaimeChugchilanEsParticipacion,2019-02-24
Jaime Rubén,Chugchilan Cisaguano,ChugchilanJaime,ciudadanos derecho conocer cuales seran funciones CPCCS candidatos participaran marzo Guayaquil junto Franklin Moreno Quezada TuParticipacionEsLaSolucion JaimeChugchilanEsParticipacion,2019-02-24
Jaime Rubén,Chugchilan Cisaguano,ChugchilanJaime,CANDIDATOS CPCCS Colectivo Integracion Democracia democracia analizado hoja vida candidatos establecido CORREISTAS VOTAREMOS eleccion ideal PUEBLOS ChugchilanJaime,2019-02-24
Jaime Rubén,Chugchilan Cisaguano,ChugchilanJaime,Peguche Otavalo compartiendo disfrutando Pawkar Raymi Fiestas Florecimiento TuParticipacionEsLaSolucion JaimeChugchilanEsParticipacion,2019-02-24
Jaime Rubén,Chugchilan Cisaguano,ChugchilanJaime,Aprovechamos visita Peguche Otavalo Pawkar Raymi Fiestas Florecimiento conversar personas funciones CPCCS beneficios consejo ciudadania TuParticipacionEsLaSolucion JaimeChugchilanEsParticipacion,2019-02-24
Jaime Rubén,Chugchilan Cisaguano,ChugchilanJaime,PedrLucasPachay BERTHAMORALESC PoderCiuEC MaJosefaCoronel CarlosVerareal diegooquendo AndresCarrion2 ramirogarciaf janethinostroza JusticeVeraEC DrRobertoLopez2 raguilarandrade CesarMontufar51 Gracias amigo Pedro,2019-02-25
Jaime Rubén,Chugchilan Cisaguano,ChugchilanJaime,jovenes futuro participacion ciudadana gracias FEUE apoyo TuParticipacionEsLaSolucion JaimeChugchilanEsParticipacion,2019-02-26
Jaime Rubén,Chugchilan Cisaguano,ChugchilanJaime,Universitarios labor importante futuro elecciones CPCCS vamos votar davidroserow SofiaAlmeidaEc ChugchilanJaime manos continuar lucha corrupcion Mensaje mauricio Fese,2019-02-26
Jaime Rubén,Chugchilan Cisaguano,ChugchilanJaime,jovenes futuro participacion ciudadana gracias FEUE apoyo TuParticipacionEsLaSolucion JaimeChugchilanEsParticipacion,2019-02-26
Jaime Rubén,Chugchilan Cisaguano,ChugchilanJaime,companeros comunidades indigenas rendicion cuentas Secretaria Agua TuparticipacionEsLaSolucion JaimeChugchilanEsParticipscion,2019-02-27
Jaime Rubén,Chugchilan Cisaguano,ChugchilanJaime,ChristianCruzLa HernanUlloa FaustoLupera ALANDMOLESTINAM PabloRicaurte73 gervasachi SofiaAlmeidaEc jcarlostuarez ChugchilanJaime chugchilan germanachi1 viviecuador,2019-02-27
Jaime Rubén,Chugchilan Cisaguano,ChugchilanJaime,participamos posesion coordinador provincial Nacionalidad Waorani Pastaza TuParticipacionEsLaSolucion JaimeChugchilanEsParticipacion,2019-02-28
Jaime Rubén,Chugchilan Cisaguano,ChugchilanJaime,Junto companeros Nacionalidad Waorani Pastaza,2019-02-28
Jaime Rubén,Chugchilan Cisaguano,ChugchilanJaime,Pastaza compartimos companeros nacionalidad Waorani TuParticipacionEsLaSolucion JaimeChugchilanEsParticipacion,2019-02-28
Jaime Rubén,Chugchilan Cisaguano,ChugchilanJaime,derechos Candidaturas Consejeros CPCCS INDEPENDIENTES elegidas aceptan firmar Pacto Etico COMPROMISOS SofiaAlmeidaEc jobafonfay2019 MariaCatalinaPerezAvila HernanUlloa davidroserow JamesMcpccs ChugchilanJaime,2019-02-28
Jaime Rubén,Chugchilan Cisaguano,ChugchilanJaime,Gracias invitacion Colectivo Quito Juventudes escuchar propuestas CPCCS apoyo participacion tambien jovenes TuParticipacionEsLaSolucion JaimeChugchilanEsParticipacion,2019-02-28
Jaime Rubén,Chugchilan Cisaguano,ChugchilanJaime,Mesa permanente Educacion Imbabura escuchamos pedido reapertura escuelas bilingues gracias confiar TuParticipacionEsLaSolucion JaimeChugchilanEsParticipacion,2019-02-28
Jaime Rubén,Chugchilan Cisaguano,ChugchilanJaime,cosas impulsan parte CPCCS poder escuchar gente saber necesidades aqui junto habitantes barrio Sauces Valle Quito TuParticipacionEsLaSolucion JaimeChugchilanEsParticipacion,2019-02-28
Jaime Rubén,Chugchilan Cisaguano,ChugchilanJaime,Explicar personas funciones CPCCS propuestas hacemos cada TuParticipacionEsLaSolucion JaimeChugchilanEsParticipacion,2019-02-28
Jaime Rubén,Chugchilan Cisaguano,ChugchilanJaime,Explicar personas funciones CPCCS propuestas hacemos cada junto Jorge Leon dueno restaurante TuParticipacionEsLaSolucion JaimeChugchilanEsParticipacion,2019-02-28
Jaime Rubén,Chugchilan Cisaguano,ChugchilanJaime,RadioMia Sonovision Puyo gracias recibirnos ayudar difundir propuestas CPCCS TuParticipacionEsLaSolucion JaimeChugchilanEsParticipacion,2019-03-01
Jaime Rubén,Chugchilan Cisaguano,ChugchilanJaime,Gracias Asociacion Parque Ejido invitacion permitirnos conocer fondo realidad hacerles conocer propuestas CPCCS junto Franklin Moreno Quezada TuParticipacionEsLaSolucion JaimeChugchilanEsParticipacion,2019-03-02
Jaime Rubén,Chugchilan Cisaguano,ChugchilanJaime,Gracias Comite Desarrollo Integral Parroquia Rural Veintimilla Guaranda invitacion carnaval TuParticipacionEsLaSolucion JaimeChugchilanEsParticipacion,2019-03-03
Jaime Rubén,Chugchilan Cisaguano,ChugchilanJaime,Guaranda gracias recibimiento TuParticipacionEsLaSolucion JaimeChugchilanEsParticipacion,2019-03-03
Jaime Rubén,Chugchilan Cisaguano,ChugchilanJaime,Raul Mora activista derechos humanos carnavaldeGuaranda TuParticipacionEsLaSolucion JaimeChugchilanEsParticipacion,2019-03-03
Jaime Rubén,Chugchilan Cisaguano,ChugchilanJaime,marzo sabemos votar ChugchilanJaime TuParticipacionEsLaSolucion,2019-03-04
Jaime Rubén,Chugchilan Cisaguano,ChugchilanJaime,derechos CorporacionGES nomina Candidaturas Consejeros CPCCS HernanUlloa davidroserow JamesMcpccs SofiaAlmeidaEc jobafonfay2019 KariPonce11 ChugchilanJaime Firmar Pacto Etico COMPROMISOS identifica INDEPENDIENTES meritos,2019-03-06
Jaime Rubén,Chugchilan Cisaguano,ChugchilanJaime,SofiaAlmeidaEc RadioMorena640 informando ciudadania funciones cumple CPCCS importancia existencia TuParticipacionEsLaSolucion JaimeChugchilanEsParticipacion,2019-03-06
Jaime Rubén,Chugchilan Cisaguano,ChugchilanJaime,dias encontre RadioMorena640 davidroserow ChugchilanJaime candidatos CPCCS conversando falta hacer lucha corrupcion coincidimos puntos SofiaAlmeida SomosAnticorrupcion,2019-03-07
Jaime Rubén,Chugchilan Cisaguano,ChugchilanJaime,emprendimiento fundamental desarrollo sociedad conversando Gino Maquilon vicepresidente Asociacion Jovenes Emprendedores Ecuador Guayaquil TuParticipacionEsLaSolucion JaimeChugchilanEsParticipacion,2019-03-07
Jaime Rubén,Chugchilan Cisaguano,ChugchilanJaime,emprendimiento fundamental desarrollo sociedad conversando GINOMAQUILON miembro ajeecuadororg Asociacion Jovenes Emprendedores Ecuador Guayaquil TuParticipacionEsLaSolucion JaimeChugchilanEsParticipacion,2019-03-07
Jaime Rubén,Chugchilan Cisaguano,ChugchilanJaime,empezamos entrevista LuisaDelgadillo radioelite9971 TuParticipacionEsLaSolucion JaimeChugchilanEsParticipacion,2019-03-07
Jaime Rubén,Chugchilan Cisaguano,ChugchilanJaime,empezamos entrevista LuisaDelgadillo radioelite9971 TuParticipacionEsLaSolucion JaimeChugchilanEsParticipacion,2019-03-07
Jaime Rubén,Chugchilan Cisaguano,ChugchilanJaime,invitados conversatorio ITBolivariano hablaremos CPCCS TuParticipacionEsLaSolucion JaimeChugchilanEsParticipacion,2019-03-07
Jaime Rubén,Chugchilan Cisaguano,ChugchilanJaime,CPCCS impulsaremos veedurias herramientas efectivas control publico ITBolivariano Guayaquil TuParticipacionEsLaSolucion JaimeChugchilanEsParticipacion,2019-03-08
Jaime Rubén,Chugchilan Cisaguano,ChugchilanJaime,gran representante sector Indigena Abogado ChugchilanJaime,2019-03-08
Jaime Rubén,Chugchilan Cisaguano,ChugchilanJaime,JaimeEsParticipacion Guayaquil participa ChugchilanJaime SofiaAlmeidaEc,2019-03-08
Jaime Rubén,Chugchilan Cisaguano,ChugchilanJaime,ChugchilanJaime SofiaAlmeidaEc Consejo Participacion Ciudadana Control Social JaimeesParticipacion Voto2019 CONAIE Ecuador confeniae1 fenocinecuador,2019-03-08
Jaime Rubén,Chugchilan Cisaguano,ChugchilanJaime,ChugchilanJaime Consejo Participacion Ciudadana Control Social joven humilde valores JaimeesParticipacion Voto2019 CONAIE Ecuador confeniae1 fenocinecuador,2019-03-08
Jaime Rubén,Chugchilan Cisaguano,ChugchilanJaime,Conocemos trayectoria companero ChugchilanJaime Consejo Participacion Coudadana ROSCGAE bchimborazo1 CONAIE Ecuador MujeresCONAIE davidroserow SofiaAlmeidaEc,2019-03-08
Jaime Rubén,Chugchilan Cisaguano,ChugchilanJaime,DiaInternacionalDeLaMujer conmemoramos todas mujeres lucharon derechos construir mundo mejor equitativo TuParticipacionEsLaSolucion JaimeChugchilanEsParticipacion,2019-03-08
Jaime Rubén,Chugchilan Cisaguano,ChugchilanJaime,CPCCS defendere acciones afirmativas minorias GualaceoMegatv TuParticipacionEsLaSolucion JaimeChugchilanEsParticipacion,2019-03-08
Jaime Rubén,Chugchilan Cisaguano,ChugchilanJaime,Protegeremos trabajo autonomo ciudadanos CPCCS Gualaceo,2019-03-08
Jaime Rubén,Chugchilan Cisaguano,ChugchilanJaime,Protegeremos trabajo autonomo ciudadanos CPCCS Gualaceo TuParticipacionEsLaSolucion JaimeChugchilanEsParticipacion,2019-03-08
Jaime Rubén,Chugchilan Cisaguano,ChugchilanJaime,FelizDiaDeLaMujer quiero dormir desear pasado feliz todas mujeres fuente amor dice cancion dedico carino mama abuelas familiares amigas todas ecuatorianas SofiaAlmeida CPCCS,2019-03-09
Jaime Rubén,Chugchilan Cisaguano,ChugchilanJaime,marzo invito ciudadania votar civicamente CPCCS demostremos poder ciudadano ninguna tendencia incoherente pretenda dirigir pais RadioNexoCuenca TuParticipacionEsLaSolucion JaimeChugchilanEsParticipacion,2019-03-09
Jaime Rubén,Chugchilan Cisaguano,ChugchilanJaime,ITBolivariano hablamos Radio Migrantes Unidos Acciones Afirmativas grupo minoritario Pueblos Indigenas Afroecuatorianos Montubios Ecuatorianos Exterior TuParticipacionEsLaSolucion JaimeChugchilanEsParticipacion,2019-03-09
Jaime Rubén,Chugchilan Cisaguano,ChugchilanJaime,CPCCS defendere acciones afirmativas minorias GualaceoMegatv TuParticipacionEsLaSolucion JaimeChugchilanEsParticipacion,2019-03-09
Jaime Rubén,Chugchilan Cisaguano,ChugchilanJaime,invitados conversatorio ITBolivariano hablaremos CPCCS TuParticipacionEsLaSolucion JaimeChugchilanEsParticipacion,2019-03-09
Jaime Rubén,Chugchilan Cisaguano,ChugchilanJaime,CONAIE Consejo Ampliado resolvio respaldar candidatura ChugchilanJaime CPCCS definitivo apoyo Elecciones2019EC marzo trayectoria lucha beneficio pueblos nacionalidades confeniae1 ecuachaskiecua SomosCONAIE,2019-03-09
Jaime Rubén,Chugchilan Cisaguano,ChugchilanJaime,CPCCS protegeremos veedores daremos herramientas proteccion concebimos sacrifiquen tranquilidad bienestar muchas veces amenazados RadioSplendid Cuenca TuParticipacionEsLaSolucion JaimeChugchilanEsParticipacion,2019-03-09
Jaime Rubén,Chugchilan Cisaguano,ChugchilanJaime,CPCCS exigiremos cumpla acciones afirmativas minorias Pueblos Nacionalidades Indigenas Afroecuatorianos Montubios Ecuatorianos Exterior HernanUlloa SofiaAlmeidaEc Pachaa TuParticipacionEsLaSolucion JaimeChugchilanEsParticipacion,2019-03-09
Jaime Rubén,Chugchilan Cisaguano,ChugchilanJaime,Gracias chicos Fundacion Jovenes Ecuador companeros colectivos invitacion TuParticipacionEsLaSolucion JaimeChugchilanEsParticipacion,2019-03-09
Jaime Rubén,Chugchilan Cisaguano,ChugchilanJaime,Felicito Colegio Benigno Malo Cuenca siento complacido participar festejos BenignoMalo TuParticipacionEsLaSolucion JaimeChugchilanEsParticipacion,2019-03-09
Jaime Rubén,Chugchilan Cisaguano,ChugchilanJaime,ChugchilanJaime radioelite9971 jaimevargasnae fenocinecuador SofiaAlmeidaEc HernanUlloa excelente triunfamos,2019-03-09
Jaime Rubén,Chugchilan Cisaguano,ChugchilanJaime,CONAIE Ecuador ChugchilanJaime CPCCS confeniae1 ecuachaskiecua Adelante Jaime Chugchilan ejemplo perseverancia constancia,2019-03-09
Jaime Rubén,Chugchilan Cisaguano,ChugchilanJaime,CoPLACGpRD VotoCiudadanoINDEPENDIENTE Considera Candidaturas Consejeros nominadas CorporacionGES destacan COMPROMISOS Pacto Etico favoritas HernanUlloa davidroserow SofiaAlmeidaEc KariPonce11 ChugchilanJaime,2019-03-10
Jaime Rubén,Chugchilan Cisaguano,ChugchilanJaime,voto CPCCS SofiaAlmeidaEc HernanUlloa ChugchilanJaime ciudadanos comprometidos combatir corrupcion altos valores,2019-03-10
Jaime Rubén,Chugchilan Cisaguano,ChugchilanJaime,Suscribo davidroserow HernanUlloa SofiaAlmeidaEc JaimeChugchilan opciones esperanzadoras gente preparada capaz seria,2019-03-10
Jaime Rubén,Chugchilan Cisaguano,ChugchilanJaime,eliminar Decreto Ejecutivo tener Codigo Organico Sistema Participacion Ciudadana Control Social Reformar Codigo Democracia VotoMujerJuventudINDEPENDIENTE papeleta Pueblos Nacionalidades ChugchilanJaime Pacto Etico COMPROMISOS,2019-03-10
Jaime Rubén,Chugchilan Cisaguano,ChugchilanJaime,jcaicedo86 HernanUlloa SofiaAlmeidaEc Muchas gracias,2019-03-11
Jaime Rubén,Chugchilan Cisaguano,ChugchilanJaime,Gracias apoyo,2019-03-11
Jaime Rubén,Chugchilan Cisaguano,ChugchilanJaime,Gracias apoyo,2019-03-11
Jaime Rubén,Chugchilan Cisaguano,ChugchilanJaime,amigo innumerables luchas sociales ChugchilanJaime respaldo incondicional nuevo reto candidato CPCCS JaimeChugchilanEsParticipacion,2019-03-12
Jaime Rubén,Chugchilan Cisaguano,ChugchilanJaime,Gracias apoyo,2019-03-12
Jaime Rubén,Chugchilan Cisaguano,ChugchilanJaime,PuebloMontubio respalda Abogado ChugchilanJaime Ingeniera SofiaAlmeidaEc JaimeEsParticipacion SofiaLaSolucion CONAIE Ecuador MujeresCONAIE JuventudConaie,2019-03-12
Jaime Rubén,Chugchilan Cisaguano,ChugchilanJaime,amigo innumerables luchas sociales ChugchilanJaime respaldo incondicional nuevo reto candidato CPCCS JaimeChugchilanEsParticipacion,2019-03-12
Jaime Rubén,Chugchilan Cisaguano,ChugchilanJaime,JaimeEsParticipacion firmeza nunca CPCCS ChugchilanJaime,2019-03-12
Jaime Rubén,Chugchilan Cisaguano,ChugchilanJaime,Amigos invito seguir agenda medios ProvinciaDeBolivar TuParticipacionEsLaSolucion JaimeEsParticipacion,2019-03-12
Jaime Rubén,Chugchilan Cisaguano,ChugchilanJaime,cvsimport 2015 NemySantacruz CorporacionGES ChugchilanJaime SofiaAlmeidaEc KariPonce11 HernanUlloa davidroserow JamesMcpccs,2019-03-12
Jaime Rubén,Chugchilan Cisaguano,ChugchilanJaime,Empezamos jornada Guaranda Radio Universidad Bolivar TuParticipacionEsLaSolucion JaimeChugchilanEsParticipacion,2019-03-12
Jaime Rubén,Chugchilan Cisaguano,ChugchilanJaime,Debemos elegir mejores ciudadanos marzo CPCCS accionemos ciudadania Guaranda RadioUniversidaddeBolivar TuParticipacionEsLaSolucion JaimeChugchilanEsParticipacion,2019-03-12
Jaime Rubén,Chugchilan Cisaguano,ChugchilanJaime,tendencias partidistas promueven voto nulo miedo lleguemos CPCCS personas respondemos intereses fuerza votar mejores marzo RadioMatiavi Guaranda TuParticipacionEsLaSolucion JaimeChugchilanEsParticipacion,2019-03-12
Jaime Rubén,Chugchilan Cisaguano,ChugchilanJaime,Pueblo Nuevo frontera Manabi Esmeraldas autoridades llegan socializamos funcion CPCCS moradores agradezco invitacion TuParticipacionEsLaSolucion JaimeChugchilanEsParticipacion,2019-03-12
Jaime Rubén,Chugchilan Cisaguano,ChugchilanJaime,Gracias Radio Mundo Guaranda TuParticipacionEsLaSolucion JaimeChugchilanEsParticipacion,2019-03-12
Jaime Rubén,Chugchilan Cisaguano,ChugchilanJaime,seguimos Guaranda ahora canal CPCCS TuParticipacionEsLaSolucion JaimeChugchilanEsParticipacion,2019-03-12
Jaime Rubén,Chugchilan Cisaguano,ChugchilanJaime,OvidioBayas exgobernador Bolivar celebrando carnaval segun tradicion extiende domingo Pascua Ademas compartiendo informacion participacion ciudadana CPCCS TuParticipacionEsLaSolucion JaimeChugchilanEsParticipacion,2019-03-12
Jaime Rubén,Chugchilan Cisaguano,ChugchilanJaime,NuevaFotoDePerfil,2019-03-13
Jaime Rubén,Chugchilan Cisaguano,ChugchilanJaime,marzo oportunidad escribir nuevo capitulo historia Ecuador Aspiro primer miembro indigena CPCCS luchar corrupcion devolver esperanza dias mejores todas JaimeChugchilanEsParticipacion,2019-03-13
Jaime Rubén,Chugchilan Cisaguano,ChugchilanJaime,Echeandia Angel Rochina gracias recibimiento CPCCS TuParticipacionEsLaSolucion JaimeChugchilanEsParticipacion,2019-03-13
Jaime Rubén,Chugchilan Cisaguano,ChugchilanJaime,Bajo resolucion Consejo Ampliado CONAIE ChugchilanJaime candidato parte pueblos nacionalidades CPCCS marzo 2019 decide PARTICIPACION Jaime Chugchilan SomosCONAIE,2019-03-14
Jaime Rubén,Chugchilan Cisaguano,ChugchilanJaime,gracias amigo Angel Rochina lider Canton Echeandia Provincia Bolivar apoyo incondicional candidatura Consejo Participacion Ciudadana Control Social confeniae1 CONAIE Ecuador CADHUECUADOR,2019-03-14
Jaime Rubén,Chugchilan Cisaguano,ChugchilanJaime,intereses partidistas pueden voluntad popular Vamos firmes hacia Consejo Participacion Ciudadana Control Social JaimeChugchilanEsParticipacion TuParticipacionEsLaSolucion SofiaAlmeidaEc HernanUlloa CONAIE Ecuador CADHUECUADOR confeniae1,2019-03-14
Jaime Rubén,Chugchilan Cisaguano,ChugchilanJaime,viernes CUARTOPODER Jaime Chugchilan ChugchilanJaime Candidato Consejo Participacion Ciudadana Control Social CPCCS tema Plan trabajo RadioRumbaNetwork,2019-03-15
Jaime Rubén,Chugchilan Cisaguano,ChugchilanJaime,Leonidas Salazar presidente Movimiento Indigena Campesino Cotopaxi conversamos importancia CPCCS inclusion sector indigena sector publico TuParticipacionEsLaSolucion JaimeChugchilanEsParticipacion,2019-03-15
Jaime Rubén,Chugchilan Cisaguano,ChugchilanJaime,Guayaquil,2019-03-15
Jaime Rubén,Chugchilan Cisaguano,ChugchilanJaime,Iniciando actividades Perla Pacifico Guayaquil,2019-03-15
Jaime Rubén,Chugchilan Cisaguano,ChugchilanJaime,necesidad crear burocracia CPCCS solo nombrar mejores hombres mujeres voluntad combatan corrupcion fomenten participacion RadioRumbaEc Guayaquil TuParticipacionEsLaSolucion JaimeChugchilanEsParticipacion,2019-03-15
Jaime Rubén,Chugchilan Cisaguano,ChugchilanJaime,Guayaquil junto HernanUlloa solo debatimos voto nulo futuro CPCCS tambien aprovechamos degustar encebollado famoso PezAzul Puerto Principal TuParticipacionEsLaSolucion JaimeChugchilanEsParticipacion,2019-03-15
Jaime Rubén,Chugchilan Cisaguano,ChugchilanJaime,Luis Rivera presidente Asociacion Octubre afiliados Guayaquil tratamos fondo importancia CPCCS beneficios ciudadania TuParticipacionEsLaSolucion JaimeChugchilanEsParticipacion,2019-03-15
Jaime Rubén,Chugchilan Cisaguano,ChugchilanJaime,planteo Candidaturas manifestacion interes explicito implicito aceptar Pacto Lista Hombres davidroserow David Rosero HernanUlloa Hernan Ulloa JamesMcpccs James Montenegro Pueblos Nacionalidades ChugchilanJaime Jaime Chugchilan,2019-03-15
Jaime Rubén,Chugchilan Cisaguano,ChugchilanJaime,Dicen desconocidos quieren CPCCS queremos hacer bien ciudadania podemos permitir caudillo cualquier bancada politica tome control pais radio sucre TuParticipacionEsLaSolucion JaimeChugchilanEsParticipacion,2019-03-16
Jaime Rubén,Chugchilan Cisaguano,ChugchilanJaime,Agradecemos espacio entrevista Cristhian Cardenas permitirme llegar comunidad propuestas CPCCS TuParticipacionEsLaSolucion JaimeChugchilanEsParticipacion,2019-03-16
Jaime Rubén,Chugchilan Cisaguano,ChugchilanJaime,Gracias amigos Movimiento Indigena Pueblo Kichwa Costa Ecuatoriana MOPKICE acompaneme actividades Guayaquil CPCCS TuParticipacionEsLaSolucion JaimeChugchilanEsParticipacion,2019-03-16
Jaime Rubén,Chugchilan Cisaguano,ChugchilanJaime,Gracias amigos Movimiento Indigena Pueblo Kichwa Costa Ecuatoriana MOPKICE acompanarme actividades Guayaquil CPCCS TuParticipacionEsLaSolucion JaimeChugchilanEsParticipacion,2019-03-16
Jaime Rubén,Chugchilan Cisaguano,ChugchilanJaime,CorporacionGES HernanUlloa Feliz cumpleanos amigo Hernan ulloa,2019-03-16
Jaime Rubén,Chugchilan Cisaguano,ChugchilanJaime,AniMeGalarza PabloRicaurte73 HernanUlloa ChristianCruzLa ChugchilanJaime FaustoLupera ALANDMOLESTINAM bernieperezs miltonperezsh alperezs SofiaAlmeidaEc LuisAlmeidaM RadioMorena640 FRM87 FranklinMorenoM RicardoRivasBr jcarlostuarez fernandobalda Lisset EstradaC,2019-03-16
Jaime Rubén,Chugchilan Cisaguano,ChugchilanJaime,Malecon Salado Guayaquil Socializando propuestas representantes Organizaciones Cristianas Fundacion Abogados Ecuador FACE Consejo Nacional Asociaciones Cristianas Ecuador CONASE Fernanda Aurelia Ortiz Olmedo HernanArias,2019-03-17
Jaime Rubén,Chugchilan Cisaguano,ChugchilanJaime,recorrido Ecuador compartido grandes amig especialmente aquell preocupados comunidad gracia Frente Accion Ciudadana Veronica Loaiza Vera Directora PabloAlvarado Director Juventudes TaniaUlloa Directora Frente Femenino,2019-03-17
Jaime Rubén,Chugchilan Cisaguano,ChugchilanJaime,solo voto correistas ChristianCruzLa HernanUlloa CarlosFigueroa SofiaAlmeidaEc JobaFonfay CatalinaPerez ChugchilanJaime PabloRicaurte73 RadioMorena640 CarlosVerareal fernandobalda germanachi1 AniMeGalarza Lisset EstradaC ecuavisa teleamazonasec,2019-03-18
Jaime Rubén,Chugchilan Cisaguano,ChugchilanJaime,JohannaJesy radio sucre Micc SofiaAlmeidaEc CorporacionGES jaimevargasnae fenocinecuador HernanUlloa confeniae1 ARUB99090270 0995060491,2019-03-18
Jaime Rubén,Chugchilan Cisaguano,ChugchilanJaime,Gracias Juan Carlos Meneces apoyo camino CPCCS entender ciudadanos necesitamos organismo escuchados TuParticipacionEsLaSolucion JaimeChugchilanEsParticipacion,2019-03-18
Jaime Rubén,Chugchilan Cisaguano,ChugchilanJaime,Amigos comparto actividades buen,2019-03-18
Jaime Rubén,Chugchilan Cisaguano,ChugchilanJaime,consejeros respondian intereses partidistas candidatos CPCCS respondemos ciudadania compromisos politicos marzo poder sera ciudadano Corape TuParticipacionEsLaSolucion JaimeChugchilanEsParticipacion,2019-03-18
Jaime Rubén,Chugchilan Cisaguano,ChugchilanJaime,VotoMujerJuventudINDEPENDIENTE garantice CPCCS Potencie Fortalecimiento Institucional permitan desaparezca pierda capacidad designar Autoridades Control Luche Corrupcion Pueblos Nacionalidades ChugchilanJaime,2019-03-18
Jaime Rubén,Chugchilan Cisaguano,ChugchilanJaime,Amig sigan actividades,2019-03-19
Jaime Rubén,Chugchilan Cisaguano,ChugchilanJaime,erickmacr CPCCS davidroserow RicardoRivasBr SofiaAlmeidaEc ChugchilanJaime sugiero propuesta complementar Candidatos Candidaturas Consejeros INDEPENDIENTES representantivas Zonas Ecuador,2019-03-19
Jaime Rubén,Chugchilan Cisaguano,ChugchilanJaime,VotoCiudadaniaINDEPENDIENTE ChugchilanJaime jobafonfay2019 KariPonce11 SofiaAlmeidaEc HernanUlloa davidroserow JamesMcpccs Representan Zonas Candidaturas CPCCS,2019-03-19
Jaime Rubén,Chugchilan Cisaguano,ChugchilanJaime,buenos ciudadanos decidieron ChugchilanJaime CPCCS,2019-03-19
