nombre,apellidos,tweet_screen_name,tweet_text,tweet_date
Jaime Rubén,Chugchilan Cisaguano,ChugchilanJaime,Gracias respaldo dirigencia Union Taxis Ejecutivos Ecuador Unatec marzo CPCCS,2019-03-19
Jaime Rubén,Chugchilan Cisaguano,ChugchilanJaime,Conozca candidato Consejo Participacion Ciudadana tvcecuador ChugchilanJaime,2019-03-19
Jaime Rubén,Chugchilan Cisaguano,ChugchilanJaime,ChugchilanJaime voto papeleta nacionalidades pueblos indigenas usted Saludos,2019-03-19
Jaime Rubén,Chugchilan Cisaguano,ChugchilanJaime,bueno escuchar estudiantes decir votaran SofiaAlmeidaEc ChugchilanJaime cuenta ustedes hora presupuesto calidad infraestructura soprecios hecha estudiantes necesitan calidad,2019-03-20
Jaime Rubén,Chugchilan Cisaguano,ChugchilanJaime,PATODIAZGUEVARA HernanUlloa SofiaAlmeidaEc davidroserow ChugchilanJaime estan primeros candidatos decentes apoyare momento,2019-03-20
Jaime Rubén,Chugchilan Cisaguano,ChugchilanJaime,miren link Facebook difundan debemos anular voto CPCCS PabloRicaurte73 HernanUlloa UlloaAsoCom SofiaAlmeidaEc LuisAlmeidaM gervasachi ChristianCruzLa ChugchilanJaime jobafonfay2019 Lisset EstradaC,2019-03-20
Jaime Rubén,Chugchilan Cisaguano,ChugchilanJaime,chrisviteri HernanUlloa davidroserow ChugchilanJaime,2019-03-20
Jaime Rubén,Chugchilan Cisaguano,ChugchilanJaime,nombres personas votar CPCCS Hombres Hernan Ulloa HernanUlloa David Rosero davidroserow Carlos Figueroa Mujeres Catalina Perez Avila Sofia Almeida Karina Ponce Nacionalidades Jaime Chugchilan ChugchilanJaime,2019-03-20
Jaime Rubén,Chugchilan Cisaguano,ChugchilanJaime,representante Pueblos Nacionalidades defensa derecho participacion ciudadana democracia decimos VotoNulo CPCCS TuParticipacionEsLaSolucion JaimeChugchilanEsParticipacion,2019-03-20
Jaime Rubén,Chugchilan Cisaguano,ChugchilanJaime,Martinminguchi logro miembros recapacitaron menos Nebot debe lucha autoridades luchan democracia seguridad juridica transparencia voto HernanUlloa ChugchilanJaime NoAlVotoNulo,2019-03-21
Jaime Rubén,Chugchilan Cisaguano,ChugchilanJaime,representante Pueblos Nacionalidades exigimos Consejo Nacional Electoral respetar Constitucion Codigo Democracia llamamos Ciudadania votar positivamente rechazar VotoNulo CPCCS TuParticipacionEsLaSolucion JaimeChugchilanEsParticipacion,2019-03-21
Jaime Rubén,Chugchilan Cisaguano,ChugchilanJaime,Gracias companeros Quito acogida TuParticipacionEsLaSolucion JaimeChugchilanEsParticipacion,2019-03-21
Jaime Rubén,Chugchilan Cisaguano,ChugchilanJaime,marzo oportunidad escribir nuevo capitulo historia Ecuador Aspiro primer indigena eleccion popular llegar CPCCS luchar corrupcion devolver esperanza dias mejores todas ecuatorianos,2019-03-21
Jaime Rubén,Chugchilan Cisaguano,ChugchilanJaime,TROTE SALUD DANDO APOYO CANDIDATOS CPCCS CUALES ChugchilanJaime SofiaAlmeidaEc monka78 HernanUlloa ChristianCruzLa Graciela Estupinan Teddy Tama DIOS SIEMPRE BENDIGA,2019-03-21
Jaime Rubén,Chugchilan Cisaguano,ChugchilanJaime,Adelante ChugchilanJaime VOTES NULO Tomate tiempo analiza voto,2019-03-22
Jaime Rubén,Chugchilan Cisaguano,ChugchilanJaime,ARUB99090270 CPCCS ChugchilanJaime SofiaAlmeidaEc monka78 HernanUlloa ChristianCruzLa Excelente recomendacion,2019-03-22
Jaime Rubén,Chugchilan Cisaguano,ChugchilanJaime,Gracias medios comunicacion permitir lleguemos hogares ecuatorianos conozcan CPCCS candidatos elecciones marzo TuParticipacionEsLaSolucion JaimeChugchilanEsParticipacion,2019-03-22
Jaime Rubén,Chugchilan Cisaguano,ChugchilanJaime,CPCCS votar nulo error maniobra Trujillo candidatos CPCCS carlosfigueroa6 RicardoRivasBr varones nacionalidades JaimeChigchilan mujeres escogere mejores,2019-03-23
Jaime Rubén,Chugchilan Cisaguano,ChugchilanJaime,voto CPCCS davidroserow SofiaAlmeidaEc ChugchilanJaime,2019-03-23
Jaime Rubén,Chugchilan Cisaguano,ChugchilanJaime,desperdicies voto continuar lucha corrupcion Marzo vota davidroserow SofiaAlmeidaEc ChugchilanJaime CPCCS,2019-03-23
Jaime Rubén,Chugchilan Cisaguano,ChugchilanJaime,Gracias Elvia Pacha comunidad Francisco Pueblo Chibuleo permitirme compartir aprender ustedes socializar CPCCS TuParticipacionEslaSolucion JaimeChugchilanEsParticipacion,2019-03-23
Jaime Rubén,Chugchilan Cisaguano,ChugchilanJaime,Ayuda elecciones CPCCS RoseroAlCpccs AlmeidaAlCpccs ChugchilanAlCpccs davidroserow ChugchilanJaime,2019-03-23
Jaime Rubén,Chugchilan Cisaguano,ChugchilanJaime,Rosa Unug comunidad Francisco Pueblo Chibuleo aprendi frutillas ensene importancia tener CPCCS pais TuParticipacionEslaSolucion JaimeChugchilanEsParticipacion,2019-03-23
Jaime Rubén,Chugchilan Cisaguano,ChugchilanJaime,votar CPCCS vicepresidente Nacional FEUE PabloCastro10L junto EnverAguirre dirigente nacional JRECUADOR indican Papeleta Hombres davidroserow Mujeres SofiaAlmeidaEc Interculturalidad ChugchilanJaime,2019-03-24
Jaime Rubén,Chugchilan Cisaguano,ChugchilanJaime,Muchas gracias amigo LuisAlfonsChango ponerme lista domingo marzo camino ConsejoDeParticipacionCiudadana TuParticipacionEsLaSolucion JaimeEsParticipacion,2019-03-24
Jaime Rubén,Chugchilan Cisaguano,ChugchilanJaime,ChugchilanJaime Jaime voto usted solo recordarle hace anos Fiscal Yavar correista Duran dijo indios ensuciaban oficina creo Fiscalia indigena triunfo pobre,2019-03-24
Jaime Rubén,Chugchilan Cisaguano,ChugchilanJaime,elegidos siempre siempre HernanUlloa ALANDMOLESTINAM TamaApoyo jobafonfay2019 PerezCatalina SofiaAlmeidaEc ChugchilanJaime poder brinde poder pueblo elijo bien sabes solo,2019-03-24
Jaime Rubén,Chugchilan Cisaguano,ChugchilanJaime,postulante CPCCS manifeste voluntad positiva favor candidatos HernanUlloa davidroserow Teddy Tama SofiaAlmeidaEc Catalina Perez Karina Ponce ChugchilanJaime,2019-03-24
Jaime Rubén,Chugchilan Cisaguano,ChugchilanJaime,Muchas gracias amigo LuisAlfonsChango ponerme lista domingo marzo camino ConsejoDeParticipacionCiudadana TuParticipacionEsLaSolucion JaimeEsParticipacion,2019-03-24
Jaime Rubén,Chugchilan Cisaguano,ChugchilanJaime,apoyo incondicional miembros universidad Guayaquil SofiaAlmeidaEc ChugchilanJaime exitos michas bendiciones Ecuador cuenta ustedes,2019-03-24
Jaime Rubén,Chugchilan Cisaguano,ChugchilanJaime,HernanUlloa wgomezr VickyDesintonio davalos2019 LassoGuillermo 4pelagatos4 larreategui diegoordonezg Martinminguchi janethinostroza ChugchilanJaime jaimenebotsaadi JacquelineRodas JarajeinlawyerM JaimeDamerval jimmyjairala SofiaAlmeidaEc FLOR MPALOMEQUE andrespaezec PROHIBIDO OLVIDAR PROMOTORES NULO DEJARON MESA SERVIDA CORREA CAMPANA VOTO NULO Notese usado lemas autoria ladron MashiRafael acordes PROMOTORES VOTO NULO NEFA,2019-03-26
Jaime Rubén,Chugchilan Cisaguano,ChugchilanJaime,HernanUlloa eluniversocom tinocotania TelediarioEC telegrafo Raultellob jriofriofiscal2 reyesteveng VEEDUR1AFCorrea ChugchilanJaime JarajeinlawyerM voto usted humano diria integro candidatos,2019-03-26
Jaime Rubén,Chugchilan Cisaguano,ChugchilanJaime,HernanUlloa eluniversocom tinocotania TelediarioEC telegrafo Raultellob jriofriofiscal2 reyesteveng VEEDUR1AFCorrea ChugchilanJaime JarajeinlawyerM,2019-03-26
Jaime Rubén,Chugchilan Cisaguano,ChugchilanJaime,Aquellos sugieren presentar denuncia wgomezr VickyDesintonio davalos2019 decepciono respondiendo hare hagan lideres PorElNulo LassoGuillermo 4pelagatos4 larreategui diegoordonezg Martinminguchi VotoEC ReporteElectoral2019,2019-03-26
Jaime Rubén,Chugchilan Cisaguano,ChugchilanJaime,HernanUlloa eluniversocom tinocotania TelediarioEC telegrafo Raultellob jriofriofiscal2 reyesteveng VEEDUR1AFCorrea ChugchilanJaime JarajeinlawyerM Gracias demostrarnos caracter ganas servir podemos alcanzar suenos recien comienza gran camino delante espero personas integren CPCCS luchen hagan justicia robaron Ortega estafadosterrabienes,2019-03-26
Jaime Rubén,Chugchilan Cisaguano,ChugchilanJaime,HernanUlloa diegol1969 eluniversocom tinocotania TelediarioEC telegrafo Raultellob jriofriofiscal2 reyesteveng VEEDUR1AFCorrea ChugchilanJaime JarajeinlawyerM,2019-03-26
Jaime Rubén,Chugchilan Cisaguano,ChugchilanJaime,HernanUlloa eluniversocom tinocotania TelediarioEC telegrafo Raultellob jriofriofiscal2 reyesteveng VEEDUR1AFCorrea ChugchilanJaime JarajeinlawyerM pena consiguio objetivo siga mostrandose gente identifica luchador pueblo Exitos,2019-03-26
Jaime Rubén,Chugchilan Cisaguano,ChugchilanJaime,HernanUlloa eluniversocom tinocotania TelediarioEC telegrafo Raultellob jriofriofiscal2 reyesteveng VEEDUR1AFCorrea ChugchilanJaime JarajeinlawyerM respetos USTED MERECIA GANAR candidato mejor opcionado preparado Ecuador perdio gran Servidor insista futuro cuenta apoyo usted futuro politico siga preparandose,2019-03-26
Jaime Rubén,Chugchilan Cisaguano,ChugchilanJaime,HernanUlloa eluniversocom tinocotania TelediarioEC telegrafo Raultellob jriofriofiscal2 reyesteveng VEEDUR1AFCorrea ChugchilanJaime JarajeinlawyerM,2019-03-26
Jaime Rubén,Chugchilan Cisaguano,ChugchilanJaime,davidroserow jtnt IbethEstupinan HernanUlloa ChugchilanJaime Felicitaciones davidroserow designacion consejero CPCCS exitos etapa gestiones,2019-03-26
Jaime Rubén,Chugchilan Cisaguano,ChugchilanJaime,Collaguazon garay hijadeivan HernanUlloa LassoGuillermo 4pelagatos4 larreategui diegoordonezg Martinminguchi janethinostroza jaimenebotsaadi JacquelineRodas JarajeinlawyerM JaimeDamerval jimmyjairala SofiaAlmeidaEc FLOR MPALOMEQUE andrespaezec omarmaluk AveFenix ghidalgoandrade DrRobertoLopez2 PoderCiuEC davidroserow ALANDMOLESTINAM CarlosVerareal InsistAlfredo caacosta1962 Pauli8g RonPeper CPCCS JCTrujilloCPCCS,2019-03-26
Jaime Rubén,Chugchilan Cisaguano,ChugchilanJaime,Collaguazon garay hijadeivan HernanUlloa LassoGuillermo 4pelagatos4 larreategui diegoordonezg Martinminguchi janethinostroza ChugchilanJaime jaimenebotsaadi JacquelineRodas JarajeinlawyerM JaimeDamerval jimmyjairala SofiaAlmeidaEc FLOR MPALOMEQUE andrespaezec omarmaluk AveFenix ghidalgoandrade DrRobertoLopez2 PoderCiuEC davidroserow ALANDMOLESTINAM CarlosVerareal InsistAlfredo caacosta1962 Pauli8g RonPeper CPCCS JCTrujilloCPCCS autenticos sapos Grecia,2019-03-26
Jaime Rubén,Chugchilan Cisaguano,ChugchilanJaime,Collaguazon garay hijadeivan HernanUlloa LassoGuillermo 4pelagatos4 larreategui diegoordonezg Martinminguchi janethinostroza jaimenebotsaadi JacquelineRodas JarajeinlawyerM JaimeDamerval jimmyjairala SofiaAlmeidaEc FLOR MPALOMEQUE andrespaezec omarmaluk AveFenix ghidalgoandrade DrRobertoLopez2 PoderCiuEC davidroserow ALANDMOLESTINAM CarlosVerareal InsistAlfredo caacosta1962 Pauli8g RonPeper CPCCS JCTrujilloCPCCS Sinverguenzas,2019-03-26
Jaime Rubén,Chugchilan Cisaguano,ChugchilanJaime,AveFenix InsistAlfredo hijadeivan Patrici02306665 elumo60 RonPeper Collaguazon garay HernanUlloa LassoGuillermo 4pelagatos4 larreategui diegoordonezg Martinminguchi janethinostroza jaimenebotsaadi JacquelineRodas JarajeinlawyerM JaimeDamerval jimmyjairala SofiaAlmeidaEc FLOR MPALOMEQUE andrespaezec omarmaluk ghidalgoandrade DrRobertoLopez2 PoderCiuEC davidroserow ALANDMOLESTINAM CarlosVerareal caacosta1962 Pauli8g CPCCS JCTrujilloCPCCS Sinverguenzas,2019-03-26
Jaime Rubén,Chugchilan Cisaguano,ChugchilanJaime,garay HernanUlloa LassoGuillermo 4pelagatos4 larreategui diegoordonezg Martinminguchi janethinostroza ChugchilanJaime jaimenebotsaadi JacquelineRodas JarajeinlawyerM JaimeDamerval jimmyjairala SofiaAlmeidaEc FLOR MPALOMEQUE andrespaezec omarmaluk ghidalgoandrade DrRobertoLopez2 PoderCiuEC davidroserow ALANDMOLESTINAM CarlosVerareal Collaguazon InsistAlfredo caacosta1962 Pauli8g RonPeper IMPOSIBLE olvidar BARBARIDAD cometida LassoBoys ECUADOR,2019-03-26
Jaime Rubén,Chugchilan Cisaguano,ChugchilanJaime,Quiero brindar sinceras felicitaciones gran amigo ChristianCruzLa electo consejero CPCCS mereces caballero integro apartidista humanista patriota estadista Unidad Ciudadana brindo apoyo primer siento bien representado,2019-03-28
Jaime Rubén,Chugchilan Cisaguano,ChugchilanJaime,raulmoraUC ChristianCruzLa Felicitaciones amigo Cristian Cruz sabemos mucha experiencia conocimiento quiero felicitarte nuevo Consejero electo Consejo Participacion Ciudadana Control Social Exitos,2019-03-28
Jaime Rubén,Chugchilan Cisaguano,ChugchilanJaime,raulmoraUC ChristianCruzLa Felicitaciones amigo Cristian Cruz sabemos mucha experiencia conocimiento quiero felicitarte nuevo Consejero electo Consejo Participacion Ciudadana Control Social Exitos,2019-03-28
Jaime Rubén,Chugchilan Cisaguano,ChugchilanJaime,Felicitaciones ChristianCruzLa parte CPCCS definitivo,2019-03-28
Jaime Rubén,Chugchilan Cisaguano,ChugchilanJaime,raulmoraUC ChristianCruzLa Felicitaciones amigo Cristian Cruz sabemos mucha experiencia conocimiento quiero felicitarte electo Consejero Consejo Participacion Ciudadana Control Social CONAIE Ecuador CarlosVerareal HernanUlloa confeniae1 andrespaezec,2019-03-28
Jaime Rubén,Chugchilan Cisaguano,ChugchilanJaime,manababravo JuanPabloPozoB DianaAtamaint Confiando fraude,2019-03-28
Jaime Rubén,Chugchilan Cisaguano,ChugchilanJaime,pueblo ganado muchisimo eleccion CPCCS mayoria siento confiado figuras ChristianCruzLa jcarlostuarez SofiaAlmeidaEc mrivadeneirac hagan pueblo pidio urnas ACABAR CORRUPCION,2019-03-28
Jaime Rubén,Chugchilan Cisaguano,ChugchilanJaime,raulmoraUC ChristianCruzLa jcarlostuarez SofiaAlmeidaEc mrivadeneirac siento representando CristianCruz SofiaAlmeidaEc MariaFernandaRivaden hombres mujeres comprometidos pais LenninMoreno JaimeNebot,2019-03-28
Jaime Rubén,Chugchilan Cisaguano,ChugchilanJaime,Tonsupa familia,2019-03-31
