nombre,apellidos,tweet_screen_name,tweet_text,tweet_date
Jaime Rubén,Chugchilan Cisaguano,ChugchilanJaime,Vengo organizaciones sociales Movimiento Indigena Ecuador pertenezco ninguna tendencia partidista,2019-02-19
Jaime Rubén,Chugchilan Cisaguano,ChugchilanJaime,Vengo organizaciones sociales Movimiento Indigena Ecuador pertenezco ninguna tendencia partidista,2019-02-19
Jaime Rubén,Chugchilan Cisaguano,ChugchilanJaime,Gracias periodistas entrevista,2019-02-19
Jaime Rubén,Chugchilan Cisaguano,ChugchilanJaime,periodista Franklin Castro conversamos propuestas,2019-02-19
Jaime Rubén,Chugchilan Cisaguano,ChugchilanJaime,Gracias Jefferson Calle recibimiento invitarme mercado degustar ricos bolones chicharron socializar propuestas,2019-02-19
Jaime Rubén,Chugchilan Cisaguano,ChugchilanJaime,Fortalecimos participacion ciudadana Conversatorio candidatos Gracias acogida,2019-02-19
Jaime Rubén,Chugchilan Cisaguano,ChugchilanJaime,Buen invitados sintonizar medios estare invitada hablar,2019-02-20
Jaime Rubén,Chugchilan Cisaguano,ChugchilanJaime,compartimos jovenes importancia jovenes viven participacion,2019-02-20
Jaime Rubén,Chugchilan Cisaguano,ChugchilanJaime,Vengo Movimiento Indigena Ecuador organizaciones sociales pertenezco ninguna tendencia partidista represento ecuatorianos quieren pais mejor,2019-02-20
Jaime Rubén,Chugchilan Cisaguano,ChugchilanJaime,entrevista compartimos microfono dialogamos retos propuestas,2019-02-20
Jaime Rubén,Chugchilan Cisaguano,ChugchilanJaime,participamos Asamblea Ciudadana Ecuador,2019-02-20
Jaime Rubén,Chugchilan Cisaguano,ChugchilanJaime,Invito ecuatorianos escoger buenos ciudadanos marzo,2019-02-20
Jaime Rubén,Chugchilan Cisaguano,ChugchilanJaime,Estimados colegas feliz,2019-02-20
Jaime Rubén,Chugchilan Cisaguano,ChugchilanJaime,trabajo enseno responsabilidad dignifico vida impulsamos jovenes participen procesos ciudadanos escuchando,2019-02-20
Jaime Rubén,Chugchilan Cisaguano,ChugchilanJaime,Feliz colegas abogados,2019-02-20
Jaime Rubén,Chugchilan Cisaguano,ChugchilanJaime,importante medios comunicacion esten atentos clamor ciudadano herramientas objetivos transparentes Gracias Colegio Periodistas Guayas Franklin Moreno,2019-02-20
Jaime Rubén,Chugchilan Cisaguano,ChugchilanJaime,Gracias amigo saludos,2019-02-23
Jaime Rubén,Chugchilan Cisaguano,ChugchilanJaime,voto nulo dejar sectores secuestraron pasado regrese voto sera,2019-02-23
Jaime Rubén,Chugchilan Cisaguano,ChugchilanJaime,Recorriendo conversando gente dando conocer propuestas Franklin Moreno Quezada,2019-02-24
Jaime Rubén,Chugchilan Cisaguano,ChugchilanJaime,ciudadanos derecho conocer cuales seran funciones candidatos participaran marzo junto Franklin Moreno Quezada,2019-02-24
Jaime Rubén,Chugchilan Cisaguano,ChugchilanJaime,CANDIDATOS CPCCS Colectivo Integracion Democracia analizado hoja vida candidatos establecido CORREISTAS VOTAREMOS eleccion ideal PUEBLOS,2019-02-24
Jaime Rubén,Chugchilan Cisaguano,ChugchilanJaime,compartiendo disfrutando Pawkar Raymi Fiestas Florecimiento,2019-02-24
Jaime Rubén,Chugchilan Cisaguano,ChugchilanJaime,Aprovechamos visita Pawkar Raymi Fiestas Florecimiento conversar personas funciones beneficios consejo ciudadania,2019-02-24
Jaime Rubén,Chugchilan Cisaguano,ChugchilanJaime,Gracias amigo Pedro,2019-02-25
Jaime Rubén,Chugchilan Cisaguano,ChugchilanJaime,jovenes futuro participacion ciudadana gracias FEUE apoyo,2019-02-26
Jaime Rubén,Chugchilan Cisaguano,ChugchilanJaime,Universitarios labor importante futuro elecciones vamos votar manos continuar lucha corrupcion Mensaje,2019-02-26
Jaime Rubén,Chugchilan Cisaguano,ChugchilanJaime,jovenes futuro participacion ciudadana gracias FEUE apoyo,2019-02-26
Jaime Rubén,Chugchilan Cisaguano,ChugchilanJaime,companeros comunidades indigenas rendicion cuentas Secretaria Agua,2019-02-27
Jaime Rubén,Chugchilan Cisaguano,ChugchilanJaime,,2019-02-27
Jaime Rubén,Chugchilan Cisaguano,ChugchilanJaime,participamos posesion coordinador provincial Nacionalidad Waorani Pastaza,2019-02-28
Jaime Rubén,Chugchilan Cisaguano,ChugchilanJaime,Junto companeros Nacionalidad Waorani,2019-02-28
Jaime Rubén,Chugchilan Cisaguano,ChugchilanJaime,compartimos companeros nacionalidad Waorani,2019-02-28
Jaime Rubén,Chugchilan Cisaguano,ChugchilanJaime,Candidaturas Consejeros INDEPENDIENTES elegidas aceptan firmar Pacto Etico COMPROMISOS,2019-02-28
Jaime Rubén,Chugchilan Cisaguano,ChugchilanJaime,Gracias invitacion Colectivo Quito Juventudes escuchar propuestas apoyo participacion tambien jovenes,2019-02-28
Jaime Rubén,Chugchilan Cisaguano,ChugchilanJaime,Mesa permanente Educacion Imbabura escuchamos pedido reapertura escuelas bilingues gracias confiar,2019-02-28
Jaime Rubén,Chugchilan Cisaguano,ChugchilanJaime,cosas impulsan parte poder escuchar gente saber necesidades aqui junto habitantes barrio Sauces Valle,2019-02-28
Jaime Rubén,Chugchilan Cisaguano,ChugchilanJaime,Explicar personas funciones propuestas hacemos cada,2019-02-28
Jaime Rubén,Chugchilan Cisaguano,ChugchilanJaime,Explicar personas funciones propuestas hacemos cada junto Jorge Leon dueno restaurante,2019-02-28
Jaime Rubén,Chugchilan Cisaguano,ChugchilanJaime,Puyo gracias recibirnos ayudar difundir propuestas,2019-03-01
Jaime Rubén,Chugchilan Cisaguano,ChugchilanJaime,Gracias Asociacion Parque Ejido invitacion permitirnos conocer fondo realidad hacerles conocer propuestas junto Franklin Moreno Quezada,2019-03-02
Jaime Rubén,Chugchilan Cisaguano,ChugchilanJaime,Gracias Comite Desarrollo Integral Parroquia Rural Veintimilla invitacion,2019-03-03
Jaime Rubén,Chugchilan Cisaguano,ChugchilanJaime,gracias recibimiento,2019-03-03
Jaime Rubén,Chugchilan Cisaguano,ChugchilanJaime,Raul Mora activista derechos humanos,2019-03-03
Jaime Rubén,Chugchilan Cisaguano,ChugchilanJaime,marzo sabemos votar,2019-03-04
Jaime Rubén,Chugchilan Cisaguano,ChugchilanJaime,nomina Candidaturas Consejeros Firmar Pacto Etico COMPROMISOS identifica INDEPENDIENTES meritos,2019-03-06
Jaime Rubén,Chugchilan Cisaguano,ChugchilanJaime,informando ciudadania funciones cumple importancia existencia,2019-03-06
Jaime Rubén,Chugchilan Cisaguano,ChugchilanJaime,dias encontre candidatos conversando falta hacer lucha corrupcion coincidimos puntos,2019-03-07
Jaime Rubén,Chugchilan Cisaguano,ChugchilanJaime,emprendimiento fundamental desarrollo sociedad conversando Gino Maquilon vicepresidente Asociacion Jovenes Emprendedores Ecuador,2019-03-07
Jaime Rubén,Chugchilan Cisaguano,ChugchilanJaime,emprendimiento fundamental desarrollo sociedad conversando miembro Asociacion Jovenes Emprendedores Ecuador,2019-03-07
Jaime Rubén,Chugchilan Cisaguano,ChugchilanJaime,empezamos entrevista,2019-03-07
Jaime Rubén,Chugchilan Cisaguano,ChugchilanJaime,empezamos entrevista,2019-03-07
Jaime Rubén,Chugchilan Cisaguano,ChugchilanJaime,invitados conversatorio hablaremos,2019-03-07
Jaime Rubén,Chugchilan Cisaguano,ChugchilanJaime,impulsaremos veedurias herramientas efectivas control publico,2019-03-08
Jaime Rubén,Chugchilan Cisaguano,ChugchilanJaime,gran representante sector Indigena Abogado,2019-03-08
Jaime Rubén,Chugchilan Cisaguano,ChugchilanJaime,Guayaquil participa,2019-03-08
Jaime Rubén,Chugchilan Cisaguano,ChugchilanJaime,Consejo Participacion Ciudadana Control Social,2019-03-08
Jaime Rubén,Chugchilan Cisaguano,ChugchilanJaime,Consejo Participacion Ciudadana Control Social joven humilde valores,2019-03-08
Jaime Rubén,Chugchilan Cisaguano,ChugchilanJaime,Conocemos trayectoria companero Consejo Participacion Coudadana,2019-03-08
Jaime Rubén,Chugchilan Cisaguano,ChugchilanJaime,conmemoramos todas mujeres lucharon derechos construir mundo mejor equitativo,2019-03-08
Jaime Rubén,Chugchilan Cisaguano,ChugchilanJaime,defendere acciones afirmativas minorias,2019-03-08
Jaime Rubén,Chugchilan Cisaguano,ChugchilanJaime,Protegeremos trabajo autonomo ciudadanos,2019-03-08
Jaime Rubén,Chugchilan Cisaguano,ChugchilanJaime,Protegeremos trabajo autonomo ciudadanos,2019-03-08
Jaime Rubén,Chugchilan Cisaguano,ChugchilanJaime,quiero dormir desear pasado feliz todas mujeres fuente amor dice cancion dedico carino mama abuelas familiares amigas todas ecuatorianas,2019-03-09
Jaime Rubén,Chugchilan Cisaguano,ChugchilanJaime,marzo invito ciudadania votar civicamente demostremos poder ciudadano ninguna tendencia incoherente pretenda dirigir pais,2019-03-09
Jaime Rubén,Chugchilan Cisaguano,ChugchilanJaime,hablamos Radio Migrantes Unidos Acciones Afirmativas grupo minoritario Pueblos Indigenas Afroecuatorianos Montubios Ecuatorianos Exterior,2019-03-09
Jaime Rubén,Chugchilan Cisaguano,ChugchilanJaime,defendere acciones afirmativas minorias,2019-03-09
Jaime Rubén,Chugchilan Cisaguano,ChugchilanJaime,invitados conversatorio hablaremos,2019-03-09
Jaime Rubén,Chugchilan Cisaguano,ChugchilanJaime,Consejo Ampliado resolvio respaldar candidatura definitivo apoyo marzo trayectoria lucha beneficio pueblos nacionalidades,2019-03-09
Jaime Rubén,Chugchilan Cisaguano,ChugchilanJaime,protegeremos veedores daremos herramientas proteccion concebimos sacrifiquen tranquilidad bienestar muchas veces amenazados,2019-03-09
Jaime Rubén,Chugchilan Cisaguano,ChugchilanJaime,exigiremos cumpla acciones afirmativas minorias Pueblos Nacionalidades Indigenas Afroecuatorianos Montubios Ecuatorianos Exterior Pachaa,2019-03-09
Jaime Rubén,Chugchilan Cisaguano,ChugchilanJaime,Gracias chicos Fundacion Jovenes Ecuador companeros colectivos invitacion,2019-03-09
Jaime Rubén,Chugchilan Cisaguano,ChugchilanJaime,Felicito Colegio Benigno Malo siento complacido participar festejos,2019-03-09
Jaime Rubén,Chugchilan Cisaguano,ChugchilanJaime,excelente triunfamos,2019-03-09
Jaime Rubén,Chugchilan Cisaguano,ChugchilanJaime,Adelante Jaime Chugchilan ejemplo perseverancia constancia,2019-03-09
Jaime Rubén,Chugchilan Cisaguano,ChugchilanJaime,Considera Candidaturas Consejeros nominadas destacan COMPROMISOS Pacto Etico favoritas,2019-03-10
Jaime Rubén,Chugchilan Cisaguano,ChugchilanJaime,voto CPCCS ciudadanos comprometidos combatir corrupcion altos valores,2019-03-10
Jaime Rubén,Chugchilan Cisaguano,ChugchilanJaime,Suscribo opciones esperanzadoras gente preparada capaz seria,2019-03-10
Jaime Rubén,Chugchilan Cisaguano,ChugchilanJaime,eliminar Decreto Ejecutivo tener Codigo Organico Sistema Participacion Ciudadana Control Social Reformar Codigo Democracia papeleta Pueblos Nacionalidades Pacto Etico COMPROMISOS,2019-03-10
Jaime Rubén,Chugchilan Cisaguano,ChugchilanJaime,Muchas gracias,2019-03-11
Jaime Rubén,Chugchilan Cisaguano,ChugchilanJaime,Gracias apoyo,2019-03-11
Jaime Rubén,Chugchilan Cisaguano,ChugchilanJaime,Gracias apoyo,2019-03-11
Jaime Rubén,Chugchilan Cisaguano,ChugchilanJaime,amigo innumerables luchas sociales respaldo incondicional nuevo reto candidato CPCCS,2019-03-12
Jaime Rubén,Chugchilan Cisaguano,ChugchilanJaime,Gracias apoyo,2019-03-12
Jaime Rubén,Chugchilan Cisaguano,ChugchilanJaime,respalda Abogado Ingeniera,2019-03-12
Jaime Rubén,Chugchilan Cisaguano,ChugchilanJaime,amigo innumerables luchas sociales respaldo incondicional nuevo reto candidato CPCCS,2019-03-12
Jaime Rubén,Chugchilan Cisaguano,ChugchilanJaime,firmeza nunca CPCCS,2019-03-12
Jaime Rubén,Chugchilan Cisaguano,ChugchilanJaime,Amigos invito seguir agenda medios,2019-03-12
Jaime Rubén,Chugchilan Cisaguano,ChugchilanJaime,,2019-03-12
Jaime Rubén,Chugchilan Cisaguano,ChugchilanJaime,Empezamos jornada Radio Universidad Bolivar,2019-03-12
Jaime Rubén,Chugchilan Cisaguano,ChugchilanJaime,Debemos elegir mejores ciudadanos marzo accionemos ciudadania,2019-03-12
Jaime Rubén,Chugchilan Cisaguano,ChugchilanJaime,tendencias partidistas promueven voto nulo miedo lleguemos personas respondemos intereses fuerza votar mejores marzo,2019-03-12
Jaime Rubén,Chugchilan Cisaguano,ChugchilanJaime,Pueblo Nuevo frontera autoridades llegan socializamos funcion moradores agradezco invitacion,2019-03-12
Jaime Rubén,Chugchilan Cisaguano,ChugchilanJaime,Gracias Radio Mundo,2019-03-12
Jaime Rubén,Chugchilan Cisaguano,ChugchilanJaime,seguimos ahora canal,2019-03-12
Jaime Rubén,Chugchilan Cisaguano,ChugchilanJaime,exgobernador celebrando carnaval segun tradicion extiende domingo Pascua Ademas compartiendo informacion participacion ciudadana,2019-03-12
Jaime Rubén,Chugchilan Cisaguano,ChugchilanJaime,,2019-03-13
Jaime Rubén,Chugchilan Cisaguano,ChugchilanJaime,marzo oportunidad escribir nuevo capitulo historia Ecuador Aspiro primer miembro indigena luchar corrupcion devolver esperanza dias mejores todas,2019-03-13
Jaime Rubén,Chugchilan Cisaguano,ChugchilanJaime,Angel Rochina gracias recibimiento,2019-03-13
Jaime Rubén,Chugchilan Cisaguano,ChugchilanJaime,Bajo resolucion Consejo Ampliado candidato parte pueblos nacionalidades marzo 2019 decide PARTICIPACION Jaime Chugchilan,2019-03-14
Jaime Rubén,Chugchilan Cisaguano,ChugchilanJaime,gracias amigo Angel Rochina lider Canton Echeandia Provincia Bolivar apoyo incondicional candidatura Consejo Participacion Ciudadana Control Social,2019-03-14
Jaime Rubén,Chugchilan Cisaguano,ChugchilanJaime,intereses partidistas pueden voluntad popular Vamos firmes hacia Consejo Participacion Ciudadana Control Social,2019-03-14
Jaime Rubén,Chugchilan Cisaguano,ChugchilanJaime,viernes Jaime Chugchilan Candidato Consejo Participacion Ciudadana Control Social CPCCS tema Plan trabajo,2019-03-15
Jaime Rubén,Chugchilan Cisaguano,ChugchilanJaime,Leonidas Salazar presidente Movimiento Indigena Campesino Cotopaxi conversamos importancia inclusion sector indigena sector publico,2019-03-15
Jaime Rubén,Chugchilan Cisaguano,ChugchilanJaime,Guayaquil,2019-03-15
Jaime Rubén,Chugchilan Cisaguano,ChugchilanJaime,Iniciando actividades Perla Pacifico Guayaquil,2019-03-15
Jaime Rubén,Chugchilan Cisaguano,ChugchilanJaime,necesidad crear burocracia solo nombrar mejores hombres mujeres voluntad combatan corrupcion fomenten participacion,2019-03-15
Jaime Rubén,Chugchilan Cisaguano,ChugchilanJaime,junto solo debatimos voto nulo futuro tambien aprovechamos degustar encebollado famoso Puerto Principal,2019-03-15
Jaime Rubén,Chugchilan Cisaguano,ChugchilanJaime,Luis Rivera presidente Asociacion Octubre afiliados tratamos fondo importancia beneficios ciudadania,2019-03-15
Jaime Rubén,Chugchilan Cisaguano,ChugchilanJaime,planteo Candidaturas manifestacion interes explicito implicito aceptar Pacto Lista Hombres David Rosero Hernan Ulloa James Montenegro Pueblos Nacionalidades Jaime Chugchilan,2019-03-15
Jaime Rubén,Chugchilan Cisaguano,ChugchilanJaime,Dicen desconocidos quieren queremos hacer bien ciudadania podemos permitir caudillo cualquier bancada politica tome control pais,2019-03-16
Jaime Rubén,Chugchilan Cisaguano,ChugchilanJaime,Agradecemos espacio entrevista Cristhian Cardenas permitirme llegar comunidad propuestas,2019-03-16
Jaime Rubén,Chugchilan Cisaguano,ChugchilanJaime,Gracias amigos Movimiento Indigena Pueblo Kichwa Costa Ecuatoriana MOPKICE acompaneme actividades,2019-03-16
Jaime Rubén,Chugchilan Cisaguano,ChugchilanJaime,Gracias amigos Movimiento Indigena Pueblo Kichwa Costa Ecuatoriana MOPKICE acompanarme actividades,2019-03-16
Jaime Rubén,Chugchilan Cisaguano,ChugchilanJaime,Feliz cumpleanos amigo ulloa,2019-03-16
Jaime Rubén,Chugchilan Cisaguano,ChugchilanJaime,,2019-03-16
Jaime Rubén,Chugchilan Cisaguano,ChugchilanJaime,Malecon Salado Guayaquil Socializando propuestas representantes Organizaciones Cristianas Fundacion Abogados Ecuador FACE Consejo Nacional Asociaciones Cristianas Ecuador CONASE Fernanda Aurelia Ortiz Olmedo,2019-03-17
Jaime Rubén,Chugchilan Cisaguano,ChugchilanJaime,recorrido Ecuador compartido grandes amig especialmente aquell preocupados comunidad gracia Frente Accion Ciudadana Veronica Loaiza Vera Directora Director Juventudes Directora Frente Femenino,2019-03-17
Jaime Rubén,Chugchilan Cisaguano,ChugchilanJaime,solo voto correistas,2019-03-18
Jaime Rubén,Chugchilan Cisaguano,ChugchilanJaime,0995060491,2019-03-18
Jaime Rubén,Chugchilan Cisaguano,ChugchilanJaime,Gracias Juan Carlos Meneces apoyo camino entender ciudadanos necesitamos organismo escuchados,2019-03-18
Jaime Rubén,Chugchilan Cisaguano,ChugchilanJaime,Amigos comparto actividades buen,2019-03-18
Jaime Rubén,Chugchilan Cisaguano,ChugchilanJaime,consejeros respondian intereses partidistas candidatos respondemos ciudadania compromisos politicos marzo poder sera ciudadano,2019-03-18
Jaime Rubén,Chugchilan Cisaguano,ChugchilanJaime,garantice Potencie Fortalecimiento Institucional permitan desaparezca pierda capacidad designar Autoridades Control Luche Corrupcion Pueblos Nacionalidades,2019-03-18
Jaime Rubén,Chugchilan Cisaguano,ChugchilanJaime,Amig sigan actividades,2019-03-19
Jaime Rubén,Chugchilan Cisaguano,ChugchilanJaime,sugiero propuesta complementar Candidatos Candidaturas Consejeros INDEPENDIENTES representantivas Zonas Ecuador,2019-03-19
Jaime Rubén,Chugchilan Cisaguano,ChugchilanJaime,Representan Zonas Candidaturas,2019-03-19
Jaime Rubén,Chugchilan Cisaguano,ChugchilanJaime,buenos ciudadanos decidieron,2019-03-19
Jaime Rubén,Chugchilan Cisaguano,ChugchilanJaime,Gracias respaldo dirigencia Union Taxis Ejecutivos Ecuador Unatec marzo,2019-03-19
Jaime Rubén,Chugchilan Cisaguano,ChugchilanJaime,Conozca candidato Consejo Participacion Ciudadana,2019-03-19
Jaime Rubén,Chugchilan Cisaguano,ChugchilanJaime,voto papeleta nacionalidades pueblos indigenas usted Saludos,2019-03-19
Jaime Rubén,Chugchilan Cisaguano,ChugchilanJaime,bueno escuchar estudiantes decir votaran cuenta ustedes hora presupuesto calidad infraestructura soprecios hecha estudiantes necesitan calidad,2019-03-20
Jaime Rubén,Chugchilan Cisaguano,ChugchilanJaime,estan primeros candidatos decentes apoyare momento,2019-03-20
Jaime Rubén,Chugchilan Cisaguano,ChugchilanJaime,miren link Facebook difundan debemos anular voto CPCCS,2019-03-20
Jaime Rubén,Chugchilan Cisaguano,ChugchilanJaime,,2019-03-20
Jaime Rubén,Chugchilan Cisaguano,ChugchilanJaime,nombres personas votar CPCCS Hombres Hernan Ulloa David Rosero Carlos Figueroa Mujeres Catalina Perez Avila Sofia Almeida Karina Ponce Nacionalidades Jaime Chugchilan,2019-03-20
Jaime Rubén,Chugchilan Cisaguano,ChugchilanJaime,representante Pueblos Nacionalidades defensa derecho participacion ciudadana democracia decimos,2019-03-20
Jaime Rubén,Chugchilan Cisaguano,ChugchilanJaime,logro miembros recapacitaron menos Nebot debe lucha autoridades luchan democracia seguridad juridica transparencia voto,2019-03-21
Jaime Rubén,Chugchilan Cisaguano,ChugchilanJaime,representante Pueblos Nacionalidades exigimos Consejo Nacional Electoral respetar Constitucion Codigo Democracia llamamos Ciudadania votar positivamente rechazar,2019-03-21
Jaime Rubén,Chugchilan Cisaguano,ChugchilanJaime,Gracias companeros Quito acogida,2019-03-21
Jaime Rubén,Chugchilan Cisaguano,ChugchilanJaime,marzo oportunidad escribir nuevo capitulo historia Ecuador Aspiro primer indigena eleccion popular llegar luchar corrupcion devolver esperanza dias mejores todas ecuatorianos,2019-03-21
Jaime Rubén,Chugchilan Cisaguano,ChugchilanJaime,TROTE SALUD DANDO APOYO CANDIDATOS CUALES Graciela Estupinan Teddy Tama DIOS SIEMPRE BENDIGA,2019-03-21
Jaime Rubén,Chugchilan Cisaguano,ChugchilanJaime,Adelante VOTES NULO Tomate tiempo analiza voto,2019-03-22
Jaime Rubén,Chugchilan Cisaguano,ChugchilanJaime,Excelente recomendacion,2019-03-22
Jaime Rubén,Chugchilan Cisaguano,ChugchilanJaime,Gracias medios comunicacion permitir lleguemos hogares ecuatorianos conozcan candidatos elecciones marzo,2019-03-22
Jaime Rubén,Chugchilan Cisaguano,ChugchilanJaime,CPCCS votar nulo error maniobra Trujillo candidatos varones nacionalidades mujeres escogere mejores,2019-03-23
Jaime Rubén,Chugchilan Cisaguano,ChugchilanJaime,voto,2019-03-23
Jaime Rubén,Chugchilan Cisaguano,ChugchilanJaime,desperdicies voto continuar lucha corrupcion Marzo vota,2019-03-23
Jaime Rubén,Chugchilan Cisaguano,ChugchilanJaime,Gracias Elvia Pacha comunidad Francisco Pueblo Chibuleo permitirme compartir aprender ustedes socializar,2019-03-23
Jaime Rubén,Chugchilan Cisaguano,ChugchilanJaime,Ayuda elecciones,2019-03-23
Jaime Rubén,Chugchilan Cisaguano,ChugchilanJaime,Rosa Unug comunidad Francisco Pueblo Chibuleo aprendi frutillas ensene importancia tener pais,2019-03-23
Jaime Rubén,Chugchilan Cisaguano,ChugchilanJaime,votar vicepresidente Nacional junto dirigente nacional indican Papeleta Hombres Mujeres Interculturalidad,2019-03-24
Jaime Rubén,Chugchilan Cisaguano,ChugchilanJaime,Muchas gracias amigo ponerme lista domingo marzo camino,2019-03-24
Jaime Rubén,Chugchilan Cisaguano,ChugchilanJaime,Jaime voto usted solo recordarle hace anos Fiscal Yavar correista Duran dijo indios ensuciaban oficina creo Fiscalia indigena triunfo pobre,2019-03-24
Jaime Rubén,Chugchilan Cisaguano,ChugchilanJaime,elegidos siempre siempre poder brinde poder pueblo elijo bien sabes solo,2019-03-24
Jaime Rubén,Chugchilan Cisaguano,ChugchilanJaime,postulante CPCCS manifeste voluntad positiva favor candidatos Teddy Tama Catalina Perez Karina Ponce,2019-03-24
Jaime Rubén,Chugchilan Cisaguano,ChugchilanJaime,Muchas gracias amigo ponerme lista domingo marzo camino,2019-03-24
Jaime Rubén,Chugchilan Cisaguano,ChugchilanJaime,apoyo incondicional miembros universidad Guayaquil exitos michas bendiciones Ecuador cuenta ustedes,2019-03-24
Jaime Rubén,Chugchilan Cisaguano,ChugchilanJaime,PROHIBIDO OLVIDAR PROMOTORES NULO DEJARON MESA SERVIDA CORREA CAMPANA VOTO NULO Notese usado lemas autoria ladron acordes PROMOTORES VOTO NULO NEFA,2019-03-26
Jaime Rubén,Chugchilan Cisaguano,ChugchilanJaime,voto usted humano diria integro candidatos,2019-03-26
Jaime Rubén,Chugchilan Cisaguano,ChugchilanJaime,,2019-03-26
Jaime Rubén,Chugchilan Cisaguano,ChugchilanJaime,Aquellos sugieren presentar denuncia decepciono respondiendo hare hagan lideres,2019-03-26
Jaime Rubén,Chugchilan Cisaguano,ChugchilanJaime,Gracias demostrarnos caracter ganas servir podemos alcanzar suenos recien comienza gran camino delante espero personas integren CPCCS luchen hagan justicia robaron Ortega,2019-03-26
Jaime Rubén,Chugchilan Cisaguano,ChugchilanJaime,,2019-03-26
Jaime Rubén,Chugchilan Cisaguano,ChugchilanJaime,pena consiguio objetivo siga mostrandose gente identifica luchador pueblo Exitos,2019-03-26
Jaime Rubén,Chugchilan Cisaguano,ChugchilanJaime,respetos USTED MERECIA GANAR candidato mejor opcionado preparado Ecuador perdio gran Servidor insista futuro cuenta apoyo usted futuro politico siga preparandose,2019-03-26
Jaime Rubén,Chugchilan Cisaguano,ChugchilanJaime,,2019-03-26
Jaime Rubén,Chugchilan Cisaguano,ChugchilanJaime,Felicitaciones designacion consejero exitos etapa gestiones,2019-03-26
Jaime Rubén,Chugchilan Cisaguano,ChugchilanJaime,,2019-03-26
Jaime Rubén,Chugchilan Cisaguano,ChugchilanJaime,autenticos sapos Grecia,2019-03-26
Jaime Rubén,Chugchilan Cisaguano,ChugchilanJaime,Sinverguenzas,2019-03-26
Jaime Rubén,Chugchilan Cisaguano,ChugchilanJaime,Sinverguenzas,2019-03-26
Jaime Rubén,Chugchilan Cisaguano,ChugchilanJaime,IMPOSIBLE olvidar BARBARIDAD cometida ECUADOR,2019-03-26
Jaime Rubén,Chugchilan Cisaguano,ChugchilanJaime,Quiero brindar sinceras felicitaciones gran amigo electo consejero CPCCS mereces caballero integro apartidista humanista patriota estadista Unidad Ciudadana brindo apoyo primer siento bien representado,2019-03-28
Jaime Rubén,Chugchilan Cisaguano,ChugchilanJaime,Felicitaciones amigo Cristian Cruz sabemos mucha experiencia conocimiento quiero felicitarte nuevo Consejero electo Consejo Participacion Ciudadana Control Social Exitos,2019-03-28
Jaime Rubén,Chugchilan Cisaguano,ChugchilanJaime,Felicitaciones amigo Cristian Cruz sabemos mucha experiencia conocimiento quiero felicitarte nuevo Consejero electo Consejo Participacion Ciudadana Control Social Exitos,2019-03-28
Jaime Rubén,Chugchilan Cisaguano,ChugchilanJaime,Felicitaciones parte CPCCS definitivo,2019-03-28
Jaime Rubén,Chugchilan Cisaguano,ChugchilanJaime,Felicitaciones amigo Cristian Cruz sabemos mucha experiencia conocimiento quiero felicitarte electo Consejero Consejo Participacion Ciudadana Control Social,2019-03-28
Jaime Rubén,Chugchilan Cisaguano,ChugchilanJaime,Confiando fraude,2019-03-28
Jaime Rubén,Chugchilan Cisaguano,ChugchilanJaime,pueblo ganado muchisimo eleccion CPCCS mayoria siento confiado figuras hagan pueblo pidio urnas ACABAR CORRUPCION,2019-03-28
Jaime Rubén,Chugchilan Cisaguano,ChugchilanJaime,siento representando hombres mujeres comprometidos pais,2019-03-28
Jaime Rubén,Chugchilan Cisaguano,ChugchilanJaime,Tonsupa familia,2019-03-31
