nombre,apellidos,tweet_screen_name,tweet_text,tweet_date
Victoria Tatiana,Desintonio Malave,VickyDesintonio,ManabiEsVictoria Amigas amigos deseo ustedes FelizMartes querida Manabi VictoriaDeLaPatria Ecuador EleccionesCPCCS Elecciones2019EC CPCCS,2019-02-19
Victoria Tatiana,Desintonio Malave,VickyDesintonio,ManabiEsVictoria Resumen actividades Participe Conversatorio Organizaciones Sociedad Civil invitada ciudad Portoviejo VictoriaDeLaPatria EleccionesCPCCS CPCCS,2019-02-19
Victoria Tatiana,Desintonio Malave,VickyDesintonio,AHORA Conversatorio Participacion Ciudadana EleccionesCPCCS Invitadas VickyDesintonio GracielaMora candidatas CPCCS,2019-02-19
Victoria Tatiana,Desintonio Malave,VickyDesintonio,20H30 invito seguir transmision vivo lineaduraec VictoriaDeLaPatria Casillero6,2019-02-19
Victoria Tatiana,Desintonio Malave,VickyDesintonio,20H30 invito seguir transmision vivo lineaduraec VictoriaDeLaPatria Casillero6,2019-02-20
Victoria Tatiana,Desintonio Malave,VickyDesintonio,VickyDesintonio voto familia,2019-02-20
Victoria Tatiana,Desintonio Malave,VickyDesintonio,grata conversacion Xavier Lasso kolectiVOZ presento ideas historia vida propuesta cambio democracia real participativa traves candidatura CPCCS VictoriaDeLaPatria Casillero6 EleccionesCPCCS,2019-02-22
Victoria Tatiana,Desintonio Malave,VickyDesintonio,Xavier Lasso entrevista VickyDesintonio candidata CPCCS Temas Semblanza entrevistada Retos frente restricciones campana PalabraSueltaEnKolectiVOZ Youtube FBLive,2019-02-22
Victoria Tatiana,Desintonio Malave,VickyDesintonio,PalabraSueltaEnKolectiVOZ Xavier Lasso entrevista VickyDesintonio candidata CPCCS,2019-02-22
Victoria Tatiana,Desintonio Malave,VickyDesintonio,PalabraSueltaEnKolectiVOZ VickyDesintonio Constituyente planteamos participacion ciudadana poder fundamental pretender desaparecer CPCCS desconocer lucha social organizacion trabajadores mujeres jovenes,2019-02-22
Victoria Tatiana,Desintonio Malave,VickyDesintonio,entendi bien cambio moneda senti llorar padres angustia poder educar mantener hijos entendi Jubileo2000 VickyDesintonio Xavier Lasso PalabraSueltaEnKolectiVOZ,2019-02-22
Victoria Tatiana,Desintonio Malave,VickyDesintonio,VickyDesintonio jorgeCorella5 VickyDesintonio CPCCS casillero,2019-02-24
Victoria Tatiana,Desintonio Malave,VickyDesintonio,Ademas embolsillaron beca diciembre enero embolsillaron beca enero febrero pagan deben sencillamente robaron beca luisferochoa RichardM cara BecariosSinBecas EstudiantesSinBecas,2019-02-24
Victoria Tatiana,Desintonio Malave,VickyDesintonio,wilfridolaz OlindoParticipa davalos2019 GracielaMoraEc VickyDesintonio MashiRafael espinozaec CPCCS elegido democraticamente inconveniente Barbarie escuche hablar aquel entrevistado grupo tomar CPCCS pueblo elige sera democracia actuales puestos DEDO,2019-02-24
Victoria Tatiana,Desintonio Malave,VickyDesintonio,jorge araujo90 MashiRafael Cuente voto familia estimada VickyDesintonio,2019-02-24
Victoria Tatiana,Desintonio Malave,VickyDesintonio,VickyDesintonio definicion amor Constitucion Republica Ecuador bien comun justicia social equidad genero hombres mujeres sumak kawsay VictoriadelaPatria,2019-02-24
Victoria Tatiana,Desintonio Malave,VickyDesintonio,VictoriaDeLaPatria ecuatorianas ecuatorianos hacemos valer voto marzo escogeremos consejeros consejeras Participacion Ciudadana Control Social mujeres hombres representante pueblos nacionalidades VictoriaCPCCS,2019-02-24
Victoria Tatiana,Desintonio Malave,VickyDesintonio,camino voto informado EleccionesCPCCS lunes febrero diversas radios querida Guayaquil espero VictoriaDeLaPatria Casillero6 Victoria2019,2019-02-24
Victoria Tatiana,Desintonio Malave,VickyDesintonio,querida Guayaquil igual inmensa mayoria pueblo ecuatoriano votara firmeza marzo pais justo equitativo transparente VictoriaDeLaPatria GuayaquilEsVictoria EleccionesCPCCS VictoriaDesintonio Casillero6 CPCCS,2019-02-25
Victoria Tatiana,Desintonio Malave,VickyDesintonio,AHORA vivo Guayaquil RadioSantiagoEC VictoriaDeLaPatria Casillero6 EleccionesCPCCS Elecciones2019EC,2019-02-25
Victoria Tatiana,Desintonio Malave,VickyDesintonio,AHORA vivo Guayaquil RadioSantiagoEC VictoriaDeLaPatria Casillero6 EleccionesCPCCS Elecciones2019EC,2019-02-25
Victoria Tatiana,Desintonio Malave,VickyDesintonio,ciudadania mayoria pueblo ecuatoriano voto elegir CPCCS definitivo urnas voluntad popular debe respetar VictoriaDeLaPatria Casillero6 EleccionesCPCCS Elecciones2019EC,2019-02-25
Victoria Tatiana,Desintonio Malave,VickyDesintonio,Consejo Participacion Ciudadana Control Social mandatos Constituyente 2008 aprobacion inmensa mayoria pueblo ecuatoriano procesos participativos inclusion propuestas gente VictoriaDeLaPatria Casillero6,2019-02-25
Victoria Tatiana,Desintonio Malave,VickyDesintonio,poder solo radica pueblo pregunta clave miedo ciudadanos pronunciaran candidatos candidatas defenderan legitimamente demandas VictoriaDeLaPatria GuayaquilEsVictoria Casillero6 EleccionesCPCCS,2019-02-25
Victoria Tatiana,Desintonio Malave,VickyDesintonio,MashiRafael Vamos recuperar patria VickyDesintonio pueblo respalda VictoriaDeLaPatria,2019-02-26
Victoria Tatiana,Desintonio Malave,VickyDesintonio,cabina rcristal870AM comunicare propuestas pais justo equitativo transparente jovenes marzo haremos escuchar VictoriaDeLaPatria GuayaquilEsVictoria Casillero6 EleccionesCPCCS Elecciones2019EC,2019-02-25
Victoria Tatiana,Desintonio Malave,VickyDesintonio,denunciado cnegobec difusion desigual videos promocionales trayectoria propuestas Exigimos transparencia procesos tratamiento justo ciudadanos debemos informados oportunamente VictoriaDeLaPatria GuayaquilEsVictoria,2019-02-25
Victoria Tatiana,Desintonio Malave,VickyDesintonio,ciudadanos vamos expresar contundentemente urnas respaldo CPCCS mandato popular constitucion Montecristi 2008 VictoriaDeLaPatria GuayaquilEsVictoria Casillero6,2019-02-25
Victoria Tatiana,Desintonio Malave,VickyDesintonio,democracia transitoria descartable funciona discrecion tomaron ilegitimamente funciones ecuatorianos podemos caer trampa silenciar marzo votaremos VictoriaDeLaPatria Casillero6 Guayaquil,2019-02-25
Victoria Tatiana,Desintonio Malave,VickyDesintonio,deber pais difundir forma correcta votar EleccionesCPCCS maximo mujeres maximo hombres representante pueblos nacionales voto informado consciente Casillero6 VotoValido VictoriaDeLaPatria GuayaquilEsVictoria,2019-02-25
Victoria Tatiana,Desintonio Malave,VickyDesintonio,breves minutos compartire oyentes ecuantena 1030 GuayaquilEsVictoria VictoriaDeLaPatria Casillero6 EleccionesCPCCS Guayaquil,2019-02-25
Victoria Tatiana,Desintonio Malave,VickyDesintonio,podemos permitir sigan suscitando actos violencia mujeres Ecuador Propongo crear Observatorio violencia genero GuayaquilEsVictoria VictoriaDeLaPatria Casillero6 CPCCS Elecciones2019EC EleccionesCPCCS,2019-02-25
Victoria Tatiana,Desintonio Malave,VickyDesintonio,buscando justicia buscando venganza Todas actuaciones deberan revisadas transparentadas poder radica pueblo ciudadanos haremos control social real GuayaquilEsVictoria VictoriaDeLaPatria Casillero6 CPCCS,2019-02-25
Victoria Tatiana,Desintonio Malave,VickyDesintonio,ecuatorianos exigimos respeto voluntad importante urnas reflejara VotoValido miedo mandato popular VictoriaDeLaPatria Casillero6 EleccionesCPCCS GuayaquilEsVictoria,2019-02-25
Victoria Tatiana,Desintonio Malave,VickyDesintonio,Existen portavoces voceros promueven medios silenciar pueblo deben saber ecuatorianos ecuatorianas apostamos VotoValido EleccionesCPCCS VictoriaDesintonio VictoriaDeLaPatria Casillero6 FelizLunes,2019-02-25
Victoria Tatiana,Desintonio Malave,VickyDesintonio,marzo ecuatorianos oportunidad cambiar pais miedo mandato popular podemos permitir intenten anular VotoValido EleccionesCPCCS GuayaquilEsVictoria VictoriaDeLaPatria Casillero6,2019-02-25
Victoria Tatiana,Desintonio Malave,VickyDesintonio,breves minutos podran escuchar RadioHuancavilk GuayaquilEsVictoria VictoriaDeLaPatria Casillero6 CPCCS,2019-02-25
Victoria Tatiana,Desintonio Malave,VickyDesintonio,niveles impunidad administracion justicia casos violencia mujeres alarmantes Ecuador urgente crear Observatorio violencia genero VictoriaDeLaPatria Victoria2019,2019-02-25
Victoria Tatiana,Desintonio Malave,VickyDesintonio,alegria juventud energia compromiso patria actores estrategicos cambio Construyamos unidad pais justo equitativo transparente GuayaquilEsVictoria VictoriaDeLaPatria VictoriaDesintonio Casillero6 EleccionesCPCCS Elecciones2019EC,2019-02-26
Victoria Tatiana,Desintonio Malave,VickyDesintonio,invito sintonizar entrevistas participare calida Provincia SantaElena martes febrero SantaElenaEsVictoria VictoriaDeLaPatria Casillero6 EleccionesCPCCS Elecciones2019EC CPCCS,2019-02-26
Victoria Tatiana,Desintonio Malave,VickyDesintonio,Quieren privatizar patrimonio ecuatorianos detras dicho ciudadanos criterio tecnico excepcionalidad privatizaciones espaldas pueblo podemos permitirlas SantaElenaEsVictoria VictoriaDeLaPatria,2019-02-26
Victoria Tatiana,Desintonio Malave,VickyDesintonio,ocultan ciudadania puede saber miedo quieren impedir revisen designaciones dedo consejo transitorio SantaElenaEsVictoria VictoriaDeLaPatria Casillero6 EleccionesCPCCS Elecciones2019EC,2019-02-26
Victoria Tatiana,Desintonio Malave,VickyDesintonio,protegemos mujeres ninas ninos adolescentes Crearemos Observatorio aplicacion erradicacion violencia genero Revisaremos regimen actual redujo presupuesto destinado materia SantaElenaEsVictoria,2019-02-26
Victoria Tatiana,Desintonio Malave,VickyDesintonio,Consejo transitorio dedicado solo designar autoridades manera irregular Pretenden consejo definitivo electo legitimamente ciudadania capacidad miedo unico mandante PUEBLO SantaElenaEsVictoria VictoriaDeLaPatria,2019-02-26
Victoria Tatiana,Desintonio Malave,VickyDesintonio,VIVO RadioSalinasFM presento propuestas Consejo Participacion Ciudadana Control Social SantaElenaEsVictoria VictoriaDeLaPatria Link,2019-02-26
Victoria Tatiana,Desintonio Malave,VickyDesintonio,propuestas Crear Observatorio vigilar aplicacion erradicacion violencia genero Control social privatizaciones Apoyar iniciativas ciudadanas revocatorias mandato Revisar designaciones dedo Consejo Transitorio,2019-02-26
Victoria Tatiana,Desintonio Malave,VickyDesintonio,instancias oficiales traves medios comunicacion haga campana VotoNulo antitesis democracia ecuatorianos votamos favor Consejo participacion garantice democracia real creado mandato constitucional,2019-02-26
Victoria Tatiana,Desintonio Malave,VickyDesintonio,instancias oficiales traves medios comunicacion haga campana VotoNulo antitesis democracia ecuatorianos votamos favor Consejo participacion garantice democracia real creado mandato constitucional,2019-02-26
Victoria Tatiana,Desintonio Malave,VickyDesintonio,explicando ciudadania votar marzo papeletas adicionales pueblos nacionalidades puede elegir candidato mujeres puede elegir candidatas hombres puede elegir candidatos Casillero6,2019-02-26
Victoria Tatiana,Desintonio Malave,VickyDesintonio,ciudadana conozco realidad organizaciones democracia construye abajo bases gente tener politicas publicas realmente garanticen derechos resuelvan problemas SantaElenaEsVictoria VictoriaDeLaPatria,2019-02-26
Victoria Tatiana,Desintonio Malave,VickyDesintonio,politico banquero medios comunicacion estan campana VotoNulo Quieren desaparecer Consejo Participacion miedo control social esconden escondemos votar VictoriaDeLaPatria Casillero6,2019-02-26
Victoria Tatiana,Desintonio Malave,VickyDesintonio,posible contralor obtuvo cargo rompiendo manos documento Coordinador Nacional Administrativo hermano Presidente nivel llegado SantaElenaEsVictoria VictoriaDeLaPatria Casillero6 EleccionesCPCCS,2019-02-26
Victoria Tatiana,Desintonio Malave,VickyDesintonio,partido repartido pugnas internas muestran cronica SuperFraudeElectoral anunciado Quieren evitar conteo votos CPCCS mesas electorales sino Juntas provinciales cooptadas solo partido politico,2019-02-26
Victoria Tatiana,Desintonio Malave,VickyDesintonio,entrevista Radio Fragata96 Consejo Transitorio solo dedicado designar autoridades dedo interesado participacion ciudadana Revisaremos actuado Consejo Transitorio SantaElenaEsVictoria VictoriaDeLaPatria Casillero6,2019-02-26
Victoria Tatiana,Desintonio Malave,VickyDesintonio,Apoyaremos iniciativas revocatoria mandato impulsadas ciudadania traicionada puesto cumplen proyectos eligieron urnas voto pueblo valor haremos respetar SantaElenaEsVictoria VictoriaDeLaPatria,2019-02-26
Victoria Tatiana,Desintonio Malave,VickyDesintonio,MashiRafael Vamos recuperar patria VickyDesintonio pueblo respalda VictoriaDeLaPatria,2019-02-26
Victoria Tatiana,Desintonio Malave,VickyDesintonio,VickyDesintonio misma gente pretende desaparecer gusta mejoralo fortalecerlo decision soberano tener organo designe controle poderes Victoria cuente Voto,2019-02-26
Victoria Tatiana,Desintonio Malave,VickyDesintonio,voto estimada VickyDesintonio,2019-02-26
Victoria Tatiana,Desintonio Malave,VickyDesintonio,Propongo Observatorio erradicacion violencia genero regimen redujo presupuesto materia actualizado mallas establecimientos educativos romper patrones culturales violencia SantaElenaEsVictoria,2019-02-26
Victoria Tatiana,Desintonio Malave,VickyDesintonio,salas acogidas suficientes falencias sensibilizado funcionarios salud administracion justicia tratamiento justo pertinente casos violencia mujeres SantaElenaEsVictoria VictoriaDeLaPatria,2019-02-26
Victoria Tatiana,Desintonio Malave,VickyDesintonio,garantiza unas elecciones justas transparentes presion ciudadania invitan observadores atan manos ponen mordaza cocina SuperFraude ciudadanos permitiremos VictoriaDeLaPatria,2019-02-26
Victoria Tatiana,Desintonio Malave,VickyDesintonio,SantaElena recibiendo respaldo organizaciones sociales escuchando preocupaciones actuacion transitorio Vamos revisar designaciones dedo compromiso ciudadanos SantaElenaEsVictoria VictoriaDeLaPatria,2019-02-26
Victoria Tatiana,Desintonio Malave,VickyDesintonio,SantaElena recibiendo respaldo organizaciones sociales escuchando preocupaciones actuacion transitorio Vamos revisar designaciones dedo compromiso ciudadanos SantaElenaEsVictoria VictoriaDeLaPatria,2019-02-26
Victoria Tatiana,Desintonio Malave,VickyDesintonio,VickyDesintonio Fragata96 voto familia,2019-02-26
Victoria Tatiana,Desintonio Malave,VickyDesintonio,VickyDesintonio Fragata96 Bien cuenta voto,2019-02-26
Victoria Tatiana,Desintonio Malave,VickyDesintonio,VickyDesintonio Fragata96 Venceremos apoyo,2019-02-26
Victoria Tatiana,Desintonio Malave,VickyDesintonio,VickyDesintonio Fragata96 voto mujer,2019-02-26
Victoria Tatiana,Desintonio Malave,VickyDesintonio,VickyDesintonio Fragata96 alegro Alma mujer Joven frontal miedo voto,2019-02-26
Victoria Tatiana,Desintonio Malave,VickyDesintonio,carino respaldo gente experiencias invaluables vida Agradezco invitacion companeros habitantes lideres calido Chanduy VictoriaDeLaPatria CPCCS Elecciones2019EC SantaElenaEsVictoria TienenDerechoAVotar,2019-02-26
Victoria Tatiana,Desintonio Malave,VickyDesintonio,carino respaldo gente experiencias invaluables vida Agradezco invitacion companeros habitantes lideres calido Chanduy VictoriaDeLaPatria CPCCS Elecciones2019EC SantaElenaEsVictoria TienenDerechoAVotar,2019-02-26
Victoria Tatiana,Desintonio Malave,VickyDesintonio,Chanduy ecuatorianos decimos claro fuerte proximas EleccionesCPCCS mandato popular debe respetar vigilantes intentos SuperFraudeElectoral Hagamos Elecciones2019EC VictoriaDeLaPatria VictoriaDesintonio Casillero6,2019-02-27
Victoria Tatiana,Desintonio Malave,VickyDesintonio,Definitivamente candidatas favoritas VickyDesintonio excelente propuestas todas voces escuchadas ginitammxv1 MashiRafael JuanVer28584885,2019-02-27
Victoria Tatiana,Desintonio Malave,VickyDesintonio,VickyDesintonio VOTO,2019-02-27
Victoria Tatiana,Desintonio Malave,VickyDesintonio,VickyDesintonio Adelante Vicky Marzo victoria sera Patria,2019-02-27
Victoria Tatiana,Desintonio Malave,VickyDesintonio,VickyDesintonio Fragata96 voto familia suman Vamos Victoria,2019-02-27
Victoria Tatiana,Desintonio Malave,VickyDesintonio,VickyDesintonio Fragata96 voto,2019-02-27
Victoria Tatiana,Desintonio Malave,VickyDesintonio,VickyDesintonio Fragata96 Vamos Victoria total apoyo,2019-02-27
Victoria Tatiana,Desintonio Malave,VickyDesintonio,VickyDesintonio Fragata96 voto,2019-02-27
Victoria Tatiana,Desintonio Malave,VickyDesintonio,coherente VickyDesintonio voto,2019-02-27
Victoria Tatiana,Desintonio Malave,VickyDesintonio,VictoriaDeLaPatria ecuatorianas ecuatorianos hacemos valer voto marzo escogeremos consejeros consejeras Participacion Ciudadana Control Social mujeres hombres representante pueblos nacionalidades VictoriaCPCCS,2019-02-27
Victoria Tatiana,Desintonio Malave,VickyDesintonio,wilfridolaz espinozaec davalos2019 wgomezr GracielaMoraEc OlindoParticipa Sandinin xaguilarv Efrancoloor increible Consejo Transitorio busca ultimo minuto blindar actuaciones ilegitimas deja claro mensaje Consejo electo popularmente primera tarea sera revisar absolutamente Cero impunidad actos ilegitimos VictoriaDeLaPatria,2019-02-28
Victoria Tatiana,Desintonio Malave,VickyDesintonio,calida ciudad Milagro participare entrevistas radiales conversare ciudadanos derecho participacion forma correcta votar EleccionesCPCCS construccion pais justo transparente VictoriaDeLaPatria Casillero6,2019-02-28
Victoria Tatiana,Desintonio Malave,VickyDesintonio,VickyDesintonio Estimada Victoria sabemos llegara CPCCS pido revisar actuado personajes transitorios sancionarlos nunca repita abuso poder violacion Constitucion Devolvamos institucionalidad pais favor,2019-02-28
Victoria Tatiana,Desintonio Malave,VickyDesintonio,calida ciudad Milagro participare entrevistas radiales conversare ciudadanos derecho participacion forma correcta votar EleccionesCPCCS construccion pais justo transparente VictoriaDeLaPatria Casillero6,2019-02-28
Victoria Tatiana,Desintonio Malave,VickyDesintonio,VickyDesintonio amandaasubiar Adelante mujer preparece madre todas luchas recien empieza Dios ayude jornada electoral bendiga decisiones llegue CPCCS bien pais,2019-02-28
Victoria Tatiana,Desintonio Malave,VickyDesintonio,VickyDesintonio voto,2019-02-28
Victoria Tatiana,Desintonio Malave,VickyDesintonio,VickyDesintonio Cuente votos familia estimada orgullosos poder apoyar RESTABLECIMIENTO DERECHO PUEBLO UNIDO JAMAS SERA VENCIDO nunca debemos juntar fuerzas sacar Patria adelante CualEsTuMiedoMoreno,2019-02-28
Victoria Tatiana,Desintonio Malave,VickyDesintonio,entrevista Radio Radio AtalayaMi Milagro solidaridad familias afectadas inundaciones costa ecuatoriana Especialmente habitantes querida ciudad Babahoyo declarada emergencia VictoriaDeLaPatria Casillero6,2019-02-28
Victoria Tatiana,Desintonio Malave,VickyDesintonio,VickyDesintonio seguimos luchas sola VictoriaDeLaPatria,2019-02-28
Victoria Tatiana,Desintonio Malave,VickyDesintonio,Consejo Transitorio desesperado propuso eliminar Consejo Participacion Luego propuso blindar actuaciones revisadas miedo vamos revisar actuaciones ilegitimas CombateALaCorrupcion VictoriaDeLaPatria Casillero6 Mujeres,2019-02-28
Victoria Tatiana,Desintonio Malave,VickyDesintonio,medios partidos politicos tradicionales claramente articulados estan campana votonulo miedo ciudadania empoderada Todas marzo votar VictoriaDeLaPatria Casillero6 Mujeres,2019-02-28
Victoria Tatiana,Desintonio Malave,VickyDesintonio,presidente Moreno siendo senalado posibles gravisimos actos corrupcion presuntas transacciones vinculadas paraisos fiscales Contralor puesto dedo dice investigara caso competencia instaurado impunidad,2019-02-28
Victoria Tatiana,Desintonio Malave,VickyDesintonio,AngamarcaWilson GracielaMoraEc wilfridolaz espinozaec davalos2019 wgomezr OlindoParticipa Sandinin xaguilarv Efrancoloor agradecimiento sincero estimado AngamarcaWilson,2019-02-28
Victoria Tatiana,Desintonio Malave,VickyDesintonio,VickyDesintonio Sume tres votos VickyDesintonio familia familia migrantes profesores emprendedores comprometida recuperar patria traicion entreguismo,2019-02-28
Victoria Tatiana,Desintonio Malave,VickyDesintonio,VickyDesintonio kolectiVOZ Palabra Suelta Xavier Lasso entrevista Victoria Desintonio candidata CPCCS,2019-02-28
Victoria Tatiana,Desintonio Malave,VickyDesintonio,sandratoapanta MashiRafael VickyDesintonio votos usted importante llegue CPCCS cumpla promesas importante REVISAR TRANSPARENTAR realizado Consejo Transitorio,2019-02-28
Victoria Tatiana,Desintonio Malave,VickyDesintonio,Naranjito tambien vivira marzo contundente VictoriaDeLaPatria VickyDesintonio Casillero6 CPCCS EleccionesCPCCS Elecciones2019EC Guayas Ecuador,2019-02-28
Victoria Tatiana,Desintonio Malave,VickyDesintonio,vital importancia informe ciudadania forma correcta votar EleccionesCPCCS maximo mujeres maximo hombres representante pueblos nacionales VickyDesintonio Casillero6 VictoriaDeLaPatria,2019-02-28
Victoria Tatiana,Desintonio Malave,VickyDesintonio,mujeres estan matando regimen reduce presupuesto erradicacion violencia mujeres crearemos Observatorio vigilar aplicacion VictoriaDeLaPatria Casillero6 EleccionesCPCCS,2019-02-28
Victoria Tatiana,Desintonio Malave,VickyDesintonio,Estan privatizando patrimonio ecuatorianos permitiremos Aplicaremos control social ciudadano actos inconstitucionales NoALaPrivatizacion VictoriaDeLaPatria Casillero6 EleccionesCPCCS Victoria2019,2019-02-28
Victoria Tatiana,Desintonio Malave,VickyDesintonio,Mientras actual presidente senalado supuesto caso corrupcion sumamente grave Contralor puesto dedo dice investigara competencia estan jugando Apoyaremos iniciativas ciudadanas revocatoria mandato VictoriaDeLaPatria,2019-02-28
Victoria Tatiana,Desintonio Malave,VickyDesintonio,totalmente partido pugnas internas garantiza proceso electoral justo transparente Alertan SuperFraudeElectoral quieren conteo votos Consejo Participacion lleve cabo juntas receptoras VictoriaDeLaPatria,2019-02-28
Victoria Tatiana,Desintonio Malave,VickyDesintonio,vivo Semanario Buenas Nuevas querido canton Naranjito continuamos mision informar ciudadania derecho participacion EleccionesCPCCS marzo Naranjito vivira VictoriaDeLaPatria,2019-02-28
Victoria Tatiana,Desintonio Malave,VickyDesintonio,ciudadanos podemos permitir inaccion autoridades control graves denuncias senalan presidente actual Cero impunidad VictoriaDeLaPatria Casillero6 CPCCS Elecciones2019EC EleccionesCPCCS,2019-02-28
Victoria Tatiana,Desintonio Malave,VickyDesintonio,calido saludo agradezco lideres organizaciones sociales ciudadanos Naranjito invitado conversatorio tratar importancia participacion control social construir verdadera democracia VictoriaDeLaPatria,2019-02-28
Victoria Tatiana,Desintonio Malave,VickyDesintonio,LuisVerdesotoo1 exhortarte puedo descalificarte menos constitucional legalmente TeExhortoAqueMeExhortes DaLaCaraMorenoCorrupto CNEcorrupto CPCCS,2019-03-02
Victoria Tatiana,Desintonio Malave,VickyDesintonio,comparto entrevista Diario querida ciudad Portoviejo Gracias eldiarioec invitacion Victoria Desintonio Casillero6 EleccionesCPCCS VickyDesintonio CPCCS,2019-03-02
Victoria Tatiana,Desintonio Malave,VickyDesintonio,Comparto entrevista mantuve GuayasAhora presento propuestas Creacion Observatorio erradicacion violencia genero control social privatizaciones respaldo iniciativas revocatoria revisar actos CPCCS,2019-03-03
Victoria Tatiana,Desintonio Malave,VickyDesintonio,anos vincule procesos organizaciones sociales 2007 participe construccion Mandato Juvenil Constituyente junto cientos jovenes Constitucion siento VictoriaDeLaPatria Casillero6 LaPrensaInforma,2019-03-04
Victoria Tatiana,Desintonio Malave,VickyDesintonio,VickyDesintonio LaPrensaInforma apoyo,2019-03-05
Victoria Tatiana,Desintonio Malave,VickyDesintonio,VickyDesintonio LaPrensaInforma Cuenta respaldo familia VictoriaDeLaPatria,2019-03-05
Victoria Tatiana,Desintonio Malave,VickyDesintonio,sergiocrc21 VickyDesintonio LaPrensaInforma apoyo tambien,2019-03-05
Victoria Tatiana,Desintonio Malave,VickyDesintonio,VickyDesintonio Apoyo propuestas estimada VickyDesintonio serias reales abrazo fuerte,2019-03-05
Victoria Tatiana,Desintonio Malave,VickyDesintonio,Pertenezco movimientos organizaciones fuerza social amplifica ciudadanos lista proponer pais queremos construir VictoriaDeLaPatria Casillero6 Transparencia CPCCS EleccionesCPCCS,2019-03-06
Victoria Tatiana,Desintonio Malave,VickyDesintonio,ocultando Consejo Transitorio actitud oscura preside organismo Deben responder ciudadanos exigen transparencia Impulsaremos revision designaciones autoridades poderoso control social VictoriaDeLaPatria,2019-03-06
Victoria Tatiana,Desintonio Malave,VickyDesintonio,Angel Rojas Quiroz profesor anos estudie Escuela Juan Bautista Pascuales sector popular Guayaquil habla corazon legado dejado agradezco carino apoyo VictoriaDeLaPatria Casillero6,2019-03-06
Victoria Tatiana,Desintonio Malave,VickyDesintonio,VickyDesintonio PublicosEC cnegobec buenas tardes distinguida Victoria gusto conocerla buen camino sera elegida consejera hacen usted censura previa injenuos,2019-03-06
Victoria Tatiana,Desintonio Malave,VickyDesintonio,cnegobec PublicosEC reprogramacion realizan realiza medio publico Espero contar verdadera participacion igualitaria venido reprogramando ahora,2019-03-06
Victoria Tatiana,Desintonio Malave,VickyDesintonio,Ecuatorianas ecuatorianos marzo arrebaten VictoriaDeLaPatria VickyDesintonio Casillero6 oficial Almagro OEA2015 pacoguerreroa65 gerardodeicaza brendaindc KevinCasasZ yerutimendez,2019-03-07
Victoria Tatiana,Desintonio Malave,VickyDesintonio,denuncie mediante oficio dirigido gerardodeicaza acto canalla oscuro personaje referirse mujeres ejercemos derechos politicos calificativos humillantes VIOLENCIA MUJERES Almagro OEA2015 pacoguerreroa65 oficial,2019-03-07
