nombre,apellidos,tweet_screen_name,tweet_text,tweet_date
Victoria Tatiana,Desintonio Malave,VickyDesintonio,solidarizo servidoras servidores publicos estan siendo despedidos Ecuador reclama TRANSPARENCIA gobierno dialogo hablo nadie cuentan miles servidores publicos despedidos nivel operativo administrativo VictoriaDeLaPatria,2019-03-07
Victoria Tatiana,Desintonio Malave,VickyDesintonio,aspiramos Consejo Participacion Ciudadana venimos luchas sociales organizaciones movimientos trabajamos dias territorio ciudadanos diferencia Consejo Transitorio actua espaldas pueblo VictoriaDeLaPatria,2019-03-07
Victoria Tatiana,Desintonio Malave,VickyDesintonio,Consejo Participacion Ciudadana definitivo debe independiente responder solo ciudadanos Consejo Transitorio sido puesto dedo obedece regimen turno Revisaremos acciones Consejo transitorio VictoriaDeLaPatria,2019-03-07
Victoria Tatiana,Desintonio Malave,VickyDesintonio,Proponemos Observatorio aplicacion erradicacion violencia mujer pues regimen quitado presupuesto efecto abandonado ecuatorianas lucharemos seguridad VictoriaDeLaPatria,2019-03-07
Victoria Tatiana,Desintonio Malave,VickyDesintonio,Inicia entrevista Radio Ondas Quevedenas calida ciudad Quevedo provincia LosRios VictoriaDeLaPatria Casillero6,2019-03-07
Victoria Tatiana,Desintonio Malave,VickyDesintonio,debo organizacion social participacion ciudadana anos participo barrios comunidades construir Ecuador mejor VictoriaDeLaPatria Casillero6,2019-03-07
Victoria Tatiana,Desintonio Malave,VickyDesintonio,Junto cientos jovenes nivel nacional participamos construccion Mandato Juvenil reconozca sujetos derechos actores estrategicos Constitucion Montecristi primer ejercicio democracia real VictoriaDeLaPatria,2019-03-07
Victoria Tatiana,Desintonio Malave,VickyDesintonio,doloroso debido condiciones aproximadamente servidores publicos despedidos Volvimos decada regimen ahorcando pueblo ecuatoriano reaccion sera contundente marzo VictoriaDeLaPatria Casillero6,2019-03-07
Victoria Tatiana,Desintonio Malave,VickyDesintonio,regimen junto Consejo Transitorio medios inducen votonulo eliminar eleccion Consejo Participacion pueblo ecuatoriano saldra votar decididamente recuperar institucionalidad derechos VictoriaDeLaPatria Casillero6,2019-03-07
Victoria Tatiana,Desintonio Malave,VickyDesintonio,Iniciamos entrevista OndasQuevedenas agradezco invitacion total apertura VictoriaDeLaPatria Casillero6 LosRios Quevedo,2019-03-07
Victoria Tatiana,Desintonio Malave,VickyDesintonio,presidente senalado posibles gravisimos actos corrupcion Contralor puesto dedo dice investigara mientras hermano presidente Coordinador Administrativo Contraloria montado corrupcion sistema impunidad,2019-03-07
Victoria Tatiana,Desintonio Malave,VickyDesintonio,digo frontalmente ecuatorianos Respaldare iniciativas ciudadanas revocatoria mandato pueblo primer fiscalizador unico poder patria pueblo sido traicionado digo cuenta respaldo frontal VictoriaDeLaPatria,2019-03-07
Victoria Tatiana,Desintonio Malave,VickyDesintonio,regimen actual informo bombos platillos prestamo ahora miles miles despidos servidoras servidores publicos tendra repercusion directa prestacion servicios publicos VictoriaDeLaPatria Casillero6,2019-03-07
Victoria Tatiana,Desintonio Malave,VickyDesintonio,VickyDesintonio voto,2019-03-07
Victoria Tatiana,Desintonio Malave,VickyDesintonio,Comparto actividades desarrollare Quevedo Vinces Babahoyo calida Provincia LosRios tambien vivira VictoriaDeLaPatria marzo Casillero6,2019-03-07
Victoria Tatiana,Desintonio Malave,VickyDesintonio,VickyDesintonio PublicosEC cnegobec IGUALMENTE VENCEREMOS COMPANERA VOTAREMOS VICTORIA DESINTONIO CPCCS TRIUNFO SEGURO HLVS,2019-03-07
Victoria Tatiana,Desintonio Malave,VickyDesintonio,regimen actual informo bombos platillos prestamo ahora miles miles despidos servidoras servidores publicos tendra repercusion directa prestacion servicios publicos VictoriaDeLaPatria Casillero6,2019-03-07
Victoria Tatiana,Desintonio Malave,VickyDesintonio,Manana marzo celebra mujer queremos rosas Saldremos calles marchar exigir derechos tener politicas publicas garanticen seguridad VictoriaDeLaPatria Casillero6,2019-03-07
Victoria Tatiana,Desintonio Malave,VickyDesintonio,Impulsaremos potente control social ciudadano impedir intento inconstitucional privatizacion patrimonio nacional espaldas pueblo VictoriaDeLaPatria Casillero6 CPCCS EleccionesCPCCS Elecciones2019EC,2019-03-07
Victoria Tatiana,Desintonio Malave,VickyDesintonio,Iniciamos entrevista ReyTvCanal39 saludo fraterno ciudadanos LosRios VictoriaDeLaPatria Casillero6 Victoria2019 LosRiosEsVictoria,2019-03-07
Victoria Tatiana,Desintonio Malave,VickyDesintonio,Revisaremos todas acciones Consejo Transitorio actuado ilegitimidad ilegalidad esconden escondemos pueblo empoderado organizado sera implacable marzo viviremos VictoriaDeLaPatria,2019-03-07
Victoria Tatiana,Desintonio Malave,VickyDesintonio,Ayer denuncie oficial agresion verbal objeto lugar rebatir propuestas insultan atacando moral sexual quieren debatir quieren humillar VictoriaDeLaPatria Casillero6,2019-03-07
Victoria Tatiana,Desintonio Malave,VickyDesintonio,Ayer grupo cancidatos Consejo Participacion Ciudadana presentamos oficial denuncia irregularidades campana VotoNulo solicitar audiencia Almagro OEA2015 pacoguerreroa65 gerardodeicaza brendaindc kevinCasasZ yerutimendez,2019-03-07
Victoria Tatiana,Desintonio Malave,VickyDesintonio,Ayer grupo candidatos Consejo Participacion Ciudadana presentamos oficial denuncia irregularidades campana VotoNulo solicitar audiencia Almagro OEA2015 pacoguerreroa65 gerardodeicaza brendaindc kevinCasasZ yerutimendez,2019-03-07
Victoria Tatiana,Desintonio Malave,VickyDesintonio,RadioEiffel conversamos derecho participacion propuestas Observatorio violencia genero control social privatizaciones respaldo iniciativas revocatoria mandato revision acciones Consejo Transitorio,2019-03-07
Victoria Tatiana,Desintonio Malave,VickyDesintonio,ciudadanas ciudadanos podemos permitir complicidad inaccion ciertas autoridades control graves denuncias senalan presidente actual Cero impunidad VictoriaDeLaPatria Casillero6 CPCCS Elecciones2019EC EleccionesCPCCS,2019-03-07
Victoria Tatiana,Desintonio Malave,VickyDesintonio,mujeres estan violentando reduce presupuesto erradicacion violencia genero urgente crear Observatorio vigile aplicacion erradicacion violencia genero VictoriaDeLaPatria,2019-03-07
Victoria Tatiana,Desintonio Malave,VickyDesintonio,CastanedaObando VickyDesintonio VOTO FAMILIA VICTORIA DESINTONIO CPCCS,2019-03-07
Victoria Tatiana,Desintonio Malave,VickyDesintonio,VickyDesintonio oficial Excelente decision debe actuar valentia frontalidad Total apoyo estimada Victoria,2019-03-07
Victoria Tatiana,Desintonio Malave,VickyDesintonio,LosRiosEsVictoria Recordemos correcta votar proximas EleccionesCPCCS marzo maximo mujeres maximo hombres representante pueblos nacionales VickyDesintonio Casillero6 VictoriaDeLaPatria,2019-03-07
Victoria Tatiana,Desintonio Malave,VickyDesintonio,CastanedaObando VickyDesintonio VOTO FAMILIA VICTORIA DESINTONIO CPCCS,2019-03-07
Victoria Tatiana,Desintonio Malave,VickyDesintonio,VickyDesintonio oficial Excelente decision debe actuar valentia frontalidad Total apoyo estimada Victoria,2019-03-07
Victoria Tatiana,Desintonio Malave,VickyDesintonio,regimen aplican politicas empobrecimiento importaciones control destruyen industria nacional campesinos sufren estan solos hermanos VictoriaDeLaPatria Casillero6 CPCCS Victoria2019,2019-03-07
Victoria Tatiana,Desintonio Malave,VickyDesintonio,peor historia partido repartido pelea dias pugna interna CREO cooptado organismo Estan cocinando super fraude,2019-03-07
Victoria Tatiana,Desintonio Malave,VickyDesintonio,peor historia partido repartido pugna interna permanente CREO cooptado organismo Estan cocinando super fraude VictoriaDeLaPatria Casillero6 Victoria2019,2019-03-07
Victoria Tatiana,Desintonio Malave,VickyDesintonio,LosRiosEsVictoria presidente envuelto gravisimos casos corrupcion Asamblea Nacional cambia orden tratarlo cirugia mayor corrupcion mentira plan Gobierno incumplido VictoriaDeLaPatria,2019-03-07
Victoria Tatiana,Desintonio Malave,VickyDesintonio,Respaldare frontalmente iniciativas revocatoria mandato impulsadas ciudadania VictoriaDeLaPatria Victoria2019 Casillero6 LosRiosEsVictoria,2019-03-07
Victoria Tatiana,Desintonio Malave,VickyDesintonio,Creo participacion ciudadana parte activa construccion Constitucion Cientos jovenes logramos mediante Articulo reconocidos sujetos derechos actores estrategicos desarrollo pais LosRiosEsVictoria Casillero6,2019-03-07
Victoria Tatiana,Desintonio Malave,VickyDesintonio,Victoria Desintonio candidata provengo organizaciones sociales debo ciudadania marzo vamos votar Victoria patria Casillero6 LosRiosEsVictoria VictoriaDeLaPatria LosRios Quevedo Babahoyo CPCCS EleccionesCPCCS,2019-03-07
Victoria Tatiana,Desintonio Malave,VickyDesintonio,CastanedaObando VickyDesintonio VOTO FAMILIA VICTORIA DESINTONIO CPCCS,2019-03-07
Victoria Tatiana,Desintonio Malave,VickyDesintonio,VickyDesintonio PublicosEC cnegobec Exitos companera,2019-03-07
Victoria Tatiana,Desintonio Malave,VickyDesintonio,VickyDesintonio oficial Excelente decision debe actuar valentia frontalidad Total apoyo estimada Victoria,2019-03-07
Victoria Tatiana,Desintonio Malave,VickyDesintonio,Millones ecuatorianos confiaron palabras estan desempleo basta solidaridad revocatoria ahora VictoriaDeLaPatria haremos marzo,2019-03-08
Victoria Tatiana,Desintonio Malave,VickyDesintonio,VickyDesintonio Total apoyo Victoria luchar causa justa retorne verdadera democracia,2019-03-08
Victoria Tatiana,Desintonio Malave,VickyDesintonio,VickyDesintonio incumplimiento plan gobierno parte Lenin Moreno voto familia estimado VickyDesintonio impulsar sentir ciudadano revocatoria mandato,2019-03-08
Victoria Tatiana,Desintonio Malave,VickyDesintonio,VickyDesintonio Ecuatorianos gente necesitamos CPCCS Jovenes representen conviccion oportunidad cambiar asquerosa actual situacion vive pais voto toda familia,2019-03-08
Victoria Tatiana,Desintonio Malave,VickyDesintonio,VickyDesintonio IvanSolano5 total conviccion dare voto mujeres frontales defienden intereses pais siento representada,2019-03-08
Victoria Tatiana,Desintonio Malave,VickyDesintonio,invito escuchar entrevistas marzo Radio Tropicana RADIOAMERICAEC VictoriaDeLaPatria Casillero6 Victoria2019 EleccionesCPCCS CPCCS Elecciones2019EC,2019-03-08
Victoria Tatiana,Desintonio Malave,VickyDesintonio,Amigas amigos invito escuchar entrevista RADIOAMERICAEC seguir actividades desarrollare viernes marzo querida Guayaquil VictoriaDeLaPatria Casillero6 Victoria2019 EleccionesCPCCS CPCCS Elecciones2019EC,2019-03-08
Victoria Tatiana,Desintonio Malave,VickyDesintonio,Amigas amigos invito escuchar entrevista RADIOAMERICAEC seguir actividades desarrollare viernes marzo querida Guayaquil VictoriaDeLaPatria Casillero6 Victoria2019 EleccionesCPCCS CPCCS Elecciones2019EC,2019-03-08
Victoria Tatiana,Desintonio Malave,VickyDesintonio,RadioAmerica importante ciudadanos exijamos transparencia absoluta designacion autoridades posible solo pueda llegar autoridad nacional VictoriaDeLaPatria Casillero6,2019-03-08
Victoria Tatiana,Desintonio Malave,VickyDesintonio,ecuatorianas ecuatorianos sufriendo concecuencias contratacion nueva deuda Ecuador debe ceder soberania institucion multilateral impone politica presupuestos,2019-03-08
Victoria Tatiana,Desintonio Malave,VickyDesintonio,ciudadanos necesitan conocer forma correcta votar EleccionesCPCCS maximo mujeres maximo hombres representante pueblos nacionales VictoriaDeLaPatria Casillero6 Mujeres Mujer Ecuador,2019-03-08
Victoria Tatiana,Desintonio Malave,VickyDesintonio,ecuatorianas ecuatorianos sufriendo consecuencias contratacion nueva deuda Ecuador debe ceder soberania institucion multilateral impone politica presupuestos VictoriaDeLaPatria Casillero6,2019-03-08
Victoria Tatiana,Desintonio Malave,VickyDesintonio,breves minutos iniciamos conversatorio Poder Ciudadano costa,2019-03-08
Victoria Tatiana,Desintonio Malave,VickyDesintonio,marzo debemos decir mujeres derechos necesitamos sigan matando VictoriaDeLaPatria,2019-03-08
Victoria Tatiana,Desintonio Malave,VickyDesintonio,Acepto reto llegar CPCCS canalice democracia participativa ciudadanos ciudadanas tambien,2019-03-08
Victoria Tatiana,Desintonio Malave,VickyDesintonio,momento vivimos despido masivo servidores servidoras publicos atender centros salud fuere invierno,2019-03-08
Victoria Tatiana,Desintonio Malave,VickyDesintonio,marzo 1999 vivimos peores traiciones ciudadanos dijeron jamas incautarian dineros ahorristas historia posterior conocemos VictoriaDeLaPatria Casillero6 VictoriaCPCCS,2019-03-08
Victoria Tatiana,Desintonio Malave,VickyDesintonio,junto cientos companeras companeros conmemoramos luchas historicas defensa derechos mujeres hora Ecuador viva libre violencia genero VictoriaDeLaPatria Casillero6 CPCCS 8M2019 8deMarzo DiaInternacionaDeLaMujer,2019-03-09
Victoria Tatiana,Desintonio Malave,VickyDesintonio,VictoriaDeLaPatria Casillero vamos panas VickyDesintonio siempre placer visites ManabiEsVictoria tierra,2019-03-11
Victoria Tatiana,Desintonio Malave,VickyDesintonio,Sabias marzo tambien votaremos consejeros consejeras participacion ciudadana puede escoger maximo mujeres hombres representante pueblos nacionalidades seleccionas anularas voto VictoriaDeLaPatria Casillero6 CPCCS,2019-03-10
Victoria Tatiana,Desintonio Malave,VickyDesintonio,VickyDesintonio amandaasubiar voto familia,2019-03-10
Victoria Tatiana,Desintonio Malave,VickyDesintonio,VickyDesintonio Confiamos palabras propuestas VENCEREMOS Victoria Patria,2019-03-10
Victoria Tatiana,Desintonio Malave,VickyDesintonio,ManabiEsVictoria Manabi marzo tambien vivira VictoriaDeLaPatria Manana lunes marzo visitare medios Manta Casillero6 EleccionesCPCCS CPCCS GanamosEcuador,2019-03-11
Victoria Tatiana,Desintonio Malave,VickyDesintonio,ManabiEsVictoria anos participo organizaciones sociales primer ejercicio democracia real Asamblea Constituyente cientos jovenes incorporamos Constitucion Articulo reconoce actores estrategicos Casillero6,2019-03-11
Victoria Tatiana,Desintonio Malave,VickyDesintonio,mujeres Ecuador asesinadas agredidas dias personas deberian quererlas Impulsare Observatorio aplicacion erradicacion violencia genero ecuatorianas debemos vivir seguras ManabiEsVictoria VictoriaDeLaPatria,2019-03-11
Victoria Tatiana,Desintonio Malave,VickyDesintonio,regimen anuncio obtencion credito quiere privatizar sectores estrategicos segun sirven inversionista compra empresas sirven Impulsaremos fuerte control social intentos ilegitimos privatizacion VictoriaDeLaPatria,2019-03-11
Victoria Tatiana,Desintonio Malave,VickyDesintonio,instaurado corrupcion autoridades ilegitimas creado sistema impunidad Revisaremos todas acciones Consejo Transitorio ManabiEsVictoria VictoriaDeLaPatria EleccionesCPCCS Victoria2019 Casillero6,2019-03-11
Victoria Tatiana,Desintonio Malave,VickyDesintonio,rincones amado Ecuador ciudadania dice casas bonos obras regimen traiciono pueblo cumplido Apoyaremos frontalmente iniciativas ciudadanas revocatorio mandato VictoriaDeLaPatria GanaremosEcuador,2019-03-11
Victoria Tatiana,Desintonio Malave,VickyDesintonio,vivo Victoria Desintonio candidata Consejo Participacion Ciudadana Control Social Radio Marejada ManabiEsVictoria VictoriaDeLaPatria GanaremosEcuador,2019-03-11
Victoria Tatiana,Desintonio Malave,VickyDesintonio,GanaremosEcuador Toda gratitud querida provincia Manabi brindo Montecristi primer ejercicio democracia real organizaciones juveniles calles incorporando articulo Constitucion Republica ManabiEsVictoria,2019-03-11
Victoria Tatiana,Desintonio Malave,VickyDesintonio,Llamo Manabi pais participar nunca calles plazas recuperar institucionalidad democracia autoridades actuales ilegitimas muchas puestas dedo responden ciudadania GanaremosEcuador VictoriaDeLaPatria,2019-03-11
Victoria Tatiana,Desintonio Malave,VickyDesintonio,presidente acusado gravisimos casos corrupcion Contralor puesto dedo anuncia investigara Sera hermano presidente coordinador administrativo Investigaremos transparentaremos quedaran impunes VictoriaDeLaPatria CPCCS,2019-03-11
Victoria Tatiana,Desintonio Malave,VickyDesintonio,regimen repartido CREO llaman votonulo obliga llamar elecciones nuevo traera altisimo costo pais llevandose sueldos despedidos presupuesto obras mitigar inundaciones VictoriaDeLaPatria,2019-03-11
Victoria Tatiana,Desintonio Malave,VickyDesintonio,continua vulnerando derechos forma sistematica equidad publicidad candidatos CPCCS afecta hermanos migrantes peor historia garantiza unas elecciones justas GanaremosEcuador VictoriaDeLaPatria,2019-03-11
Victoria Tatiana,Desintonio Malave,VickyDesintonio,legitimidad regimen autoridades puestas dedo presidenta Asamblea vista paciencia llama ministra interior cambiar votos impedir fiscalizar actos corrupcion ecuatorianos tontos Exigimos transparencia,2019-03-11
Victoria Tatiana,Desintonio Malave,VickyDesintonio,VickyDesintonio Excelente voto familia,2019-03-11
Victoria Tatiana,Desintonio Malave,VickyDesintonio,VickyDesintonio adelante victoria llegara consejo definitivo podra revisar corregir inconstitucionalidades transitorio cuidar votos,2019-03-11
Victoria Tatiana,Desintonio Malave,VickyDesintonio,Montecristi empezo ciudadanos ciudadanas forjamos Constitucion Venceremos VictoriaDeLaPatria GanamosEcuador,2019-03-11
Victoria Tatiana,Desintonio Malave,VickyDesintonio,Cada evidente costoso sociedad ecuatoriana corrupcion instaurado autoridades ilegitimas Vamos recuperar institucionalidad democracia CPCCS junto companeros ciudadania permitiremos queden impunes,2019-03-11
Victoria Tatiana,Desintonio Malave,VickyDesintonio,VictoriaDeLaPatria Casillero vamos panas VickyDesintonio siempre placer visites ManabiEsVictoria tierra,2019-03-11
Victoria Tatiana,Desintonio Malave,VickyDesintonio,VickyDesintonio adelante victoria llegara consejo definitivo podra revisar corregir inconstitucionalidades transitorio cuidar votos,2019-03-11
Victoria Tatiana,Desintonio Malave,VickyDesintonio,VickyDesintonio gusta firmeza candidata Sabe pueblo espera ahora nadie cree gobierno cuantico Atentos actuacion CPCCS Seguro Llegara,2019-03-11
Victoria Tatiana,Desintonio Malave,VickyDesintonio,Ecuador diversidad alegria esperanza gente Sebastiana Romulo artesanos Montecristi ciudadanos derechos exigen transparencia voluntad respetada Manabi pais vive VictoriaDeLaPatria GanaremosEcuador,2019-03-11
Victoria Tatiana,Desintonio Malave,VickyDesintonio,cnegobec CPCCS,2019-03-13
Victoria Tatiana,Desintonio Malave,VickyDesintonio,VickyDesintonio Total apoyo Vicky,2019-03-12
Victoria Tatiana,Desintonio Malave,VickyDesintonio,Ecuador expectativa presidente denunciado grave caso corrupcion presidenta Asamblea ministra interior manipulan bloquean fiscalizacion verdaderamente cirugia mayor corrupcion exigimos abra cuenta,2019-03-12
Victoria Tatiana,Desintonio Malave,VickyDesintonio,ElOroEsVictoria Agradezco invitacion medios querida ciudad Machala provincia ElOro mediante ciudadania podra informarse derecho participacion EleccionesCPCCS VictoriaDeLaPatria,2019-03-13
Victoria Tatiana,Desintonio Malave,VickyDesintonio,vivo Victoria Desintonio candidata Consejo Participacion Ciudadana Control Social RadioMachala ElOroEsVictoria VictoriaDeLaPatria GanaremosEcuador,2019-03-13
Victoria Tatiana,Desintonio Malave,VickyDesintonio,Ayer encuentro cnegobec organizaciones politicas decidieron cada voto nulo multiplique siete Jamas contabilizado Quieren anular eleccion forma ilegal RadioMachala ElOroEsVictoria VictoriaDeLaPatria GanaremosEcuador,2019-03-13
Victoria Tatiana,Desintonio Malave,VickyDesintonio,vamos permitir anule eleccion miedo ciudadania mandara casa pueblo ecuatoriano saldra votar marzo recuperar democracia RadioMachala ElOroEsVictoria VictoriaDeLaPatria GanaremosEcuador,2019-03-13
Victoria Tatiana,Desintonio Malave,VickyDesintonio,anos lucha social traves organizaciones sociales Brisa Azul ElOroEsVictoria VictoriaDeLaPatria GanaremosEcuador,2019-03-13
Victoria Tatiana,Desintonio Malave,VickyDesintonio,inadmisible presidenta Asamblea ministra Interior bloqueen fiscalizacion gravisimos actos corrupcion presidente regimen Apoyamos revocatoria mandato Radio Brisa Azul ElOroEsVictoria VictoriaDeLaPatria GanaremosEcuador,2019-03-13
Victoria Tatiana,Desintonio Malave,VickyDesintonio,cnegobec bloqueado ciertos candidatos hora spots publicitarios mitad Radio Brisa Azul ElOroEsVictoria VictoriaDeLaPatria GanaremosEcuador,2019-03-13
Victoria Tatiana,Desintonio Malave,VickyDesintonio,CPCCS unica funcion creada mandato popular Incorporada constitucion Montecristi pueblo pronuncio elegidos elegidas voto popular permitiremos deslegitimar eleccion ElOroEsVictoria VictoriaDeLaPatria GanaremosEcuador,2019-03-13
Victoria Tatiana,Desintonio Malave,VickyDesintonio,voces ciudadanas exigen Ecuador justo transparente envian mensaje claro contundente SoyDeEcuador marzo voto VictoriaDeLaPatria,2019-03-13
Victoria Tatiana,Desintonio Malave,VickyDesintonio,primer concurso vamos llamar Contraloria Recordemos Contralor actual accion personal rompio manos notificacion irregular gestion diariocorreoweb ElOroEsVictoria VictoriaDeLaPatria GanaremosEcuador,2019-03-13
Victoria Tatiana,Desintonio Malave,VickyDesintonio,presidente informa credito miles despidos sector publico intentos privatizar empresas publicas rentables Proponemos potente control social patrimonio ElNacional1964 ElOroEsVictoria VictoriaDeLaPatria GanaremosEcuador,2019-03-13
Victoria Tatiana,Desintonio Malave,VickyDesintonio,implementando estrategia voto nulo regimen transitorios ciertos partidos politicos Quieren ciudadano contabilicen votos nulos antidemocratico radiofiesta1060 ElOroEsVictoria VictoriaDeLaPatria GanaremosEcuador,2019-03-13
Victoria Tatiana,Desintonio Malave,VickyDesintonio,posible fiscal encargada sacado bachilleres graduan mejores calificaciones embargo quieren imponer fiscal puesta dedo radiofiesta1060 ElOroEsVictoria VictoriaDeLaPatria GanaremosEcuador,2019-03-13
Victoria Tatiana,Desintonio Malave,VickyDesintonio,ministra interior Presidenta Asamblea nacional bloquean investigar actos corrupcion Presidente acusado Exigimos fiscalizacion etica transparencia quedaran impunes radiofiesta1060 ElOroEsVictoria VictoriaDeLaPatria GanaremosEcuador,2019-03-13
Victoria Tatiana,Desintonio Malave,VickyDesintonio,Denunciamos ocho dias medio campana todavia existe equidad publicidad pautada cnegobec monitoreo realizado corporacion ParticipacionPC minutos candidato difundido minutos VickyDesintonio,2019-03-13
Victoria Tatiana,Desintonio Malave,VickyDesintonio,Denunciamos dias campana existe equidad publicidad pautada cnegobec monitoreo realizado corporacion ParticipacionPC minutos candidato difundido minutos spot equidad,2019-03-13
Victoria Tatiana,Desintonio Malave,VickyDesintonio,Denunciamos dias campana existe equidad publicidad pautada cnegobec monitoreo realizado corporacion ParticipacionPC minutos candidato difundido minutos spot equidad,2019-03-13
Victoria Tatiana,Desintonio Malave,VickyDesintonio,violencia politica mujeres sera documentada informe Recibimos respuesta denuncia presente Seguire luchando evitar toda clase violencia mujeres GanaremosEcuador VictoriaDeLaPatria oficial,2019-03-14
Victoria Tatiana,Desintonio Malave,VickyDesintonio,violencia politica mujeres sera documentada informe Recibimos respuesta denuncia presente Seguire luchando evitar toda clase violencia mujeres GanaremosEcuador VictoriaDeLaPatria oficial,2019-03-14
Victoria Tatiana,Desintonio Malave,VickyDesintonio,violencia politica mujeres sera documentada informe Recibimos respuesta denuncia presente Seguire luchando evitar toda clase violencia mujeres GanaremosEcuador VictoriaDeLaPatria oficial,2019-03-14
Victoria Tatiana,Desintonio Malave,VickyDesintonio,SantaElenaEsVictoria Agradezco invitacion medios calida provincia SantaElena mediante ciudadania informara derecho participacion EleccionesCPCCS VictoriaDeLaPatria,2019-03-14
Victoria Tatiana,Desintonio Malave,VickyDesintonio,VickyDesintonio oficial ecuavisa telegrafo eluniversocom teleSURtv tctelevision Gamavisionecu CNNEE pichinchauniver RADIOAMERICAEC RadioHuancavilk parece bien dejar centado precedente politiqueros burgueses ataques represivos bulgares discriminatorios mujeres solo dejan entrever complejos bajos instintos basta abuso VICTORIA siempre,2019-03-14
Victoria Tatiana,Desintonio Malave,VickyDesintonio,Constitucion reconoce Consejo Participacion Ciudadana parte estructura decidimos ecuatorianos urnas 2008 eliminarlo deberan llamar Asamblea Nacional Constituyente VictoriaDeLaPatria GanaremosEcuador,2019-03-14
Victoria Tatiana,Desintonio Malave,VickyDesintonio,regimen subordinados estan tremendamente desesperados aqui candidatos ciudadania decimos verdad gente denunciamos actos corrupcion regimen iremos luchar precisamente actos VictoriaDeLaPatria,2019-03-14
Victoria Tatiana,Desintonio Malave,VickyDesintonio,presidenta Asamblea cuestionada legitimidad bloquea junto ministra interior fiscalizacion presidente graves acusaciones casos corrupcion Desesperadamente propone reforma elijan autoridades inconstitucional,2019-03-14
Victoria Tatiana,Desintonio Malave,VickyDesintonio,CPCCS institucion refrendada ciudadania Creada mediante constitucion Montecristi ratificada referendum sera democratica ciudadania elija SantaElenaEsVictoria VictoriaDeLaPatria GanaremosEcuador,2019-03-14
Victoria Tatiana,Desintonio Malave,VickyDesintonio,Realice primer ejercicio democracia real participativa Montecristi 2008 calle jovenes incorporamos Articulo Constitucion primera reconocidos sujetos derechos actores estrategica desarrollo,2019-03-14
