nombre,apellidos,tweet_screen_name,tweet_text,tweet_date
Victoria Tatiana,Desintonio Malave,VickyDesintonio,Gracias ecuainm recoger arbitrariedad horas comicios cnegobec intenta desesperadamente anular VictoriaDeLaPatria descalificandome inaceptable Seguire denunciando instancias internacionales arbitrariedades CNEesFraude,2019-03-23
Victoria Tatiana,Desintonio Malave,VickyDesintonio,VickyDesintonio MashiRafael cnegobec oficial Almagro OEA2015 KevinCasasZ leonelaacf DianeRodriguezZ estrella AuraCarrilloUn JoseValdiviezoF Feue Guayaquil AnaPaulaAzanza Fuerza fuerza companeros aqui Canada voto toda familia,2019-03-23
Victoria Tatiana,Desintonio Malave,VickyDesintonio,VickyDesintonio cnegobec oficial Almagro OEA2015 KevinCasasZ leonelaacf DianeRodriguezZ estrella AuraCarrilloUn JoseValdiviezoF Feue Guayaquil AnaPaulaAzanza Terrible venceremos VictoriaDeLaPatria,2019-03-23
Victoria Tatiana,Desintonio Malave,VickyDesintonio,EXCLUSIVO busca bajar candidatura CPCCS CPCCS elecciones estan desesperados advierte Victoria Desintonio VickyDesintonio AUDIO Entrevista,2019-03-23
Victoria Tatiana,Desintonio Malave,VickyDesintonio,DianeRodriguezZ YITZAKESPINEL VickyDesintonio cnegobec oficial Almagro OEA2015 KevinCasasZ leonelaacf estrella AuraCarrilloUn JoseValdiviezoF Feue Guayaquil AnaPaulaAzanza Estan desesperados quieren realmente conocer voluntad popular urnas,2019-03-24
Victoria Tatiana,Desintonio Malave,VickyDesintonio,VickyDesintonio MashiRafael cnegobec oficial Almagro OEA2015 KevinCasasZ leonelaacf DianeRodriguezZ estrella AuraCarrilloUn JoseValdiviezoF Feue Guayaquil AnaPaulaAzanza Fuerza fuerza companeros aqui Canada voto toda familia,2019-03-24
Victoria Tatiana,Desintonio Malave,VickyDesintonio,viviremos grandioso democracia valentia optimismo Ecuador luchas demandas elegimos recuperar institucionalidad todas Invito ciudadanos votar forma positiva esperanza Elecciones2019Ec CPCCS2019,2019-03-24
Victoria Tatiana,Desintonio Malave,VickyDesintonio,manana desayune acompanada familia querida parroquia Pascuales Guayaquil Gracias mama papa forjar principios guian Gracias amor companero desmaya construccion pais mejor,2019-03-24
Victoria Tatiana,Desintonio Malave,VickyDesintonio,Eleccciones2019EC AHORA encuentro Escuela Carlos Julio Arosemena acompanada familia amigos esperanza conviccion mejor pais vengo darle voto futuro CPCCS2019,2019-03-24
Victoria Tatiana,Desintonio Malave,VickyDesintonio,VickyDesintonio VictoriaDeLaPatria recuperar democracia Eleccciones2019EC,2019-03-24
Victoria Tatiana,Desintonio Malave,VickyDesintonio,URGENTE Entregue cnegobec Delegacion Provincial Guayas oficio ademas exponer pruebas descargo exijo manera inmediata disponga archivo irrisorio informe BUSCA sino seguirme perjudicando CPCCS2019,2019-03-24
Victoria Tatiana,Desintonio Malave,VickyDesintonio,URGENTE Entregue Delegacion Provincial Guayas oficio ademas exponer pruebas descargo exijo manera inmediata disponga archivo irrisorio informe busca seguir perjudicandome CPCCS2019,2019-03-24
Victoria Tatiana,Desintonio Malave,VickyDesintonio,abrazo companeros migrantes Londres Malaga Madrid toda Europa recibido reportes cierre jornada resultados esperanzadores Agradezco entrega compromiso pronto viviremos VictoriaDeLaPatria Elecciones2019EC,2019-03-24
Victoria Tatiana,Desintonio Malave,VickyDesintonio,recibido reportes cierre jornada resultados esperanzadores Londres Malaga Madrid toda Europa abrazo companeros migrantes Agradezco entrega compromiso pronto viviremos VictoriaDeLaPatria Elecciones2019EC,2019-03-24
Victoria Tatiana,Desintonio Malave,VickyDesintonio,Alertamos persiste intento descalificacion candidatos proponemos fuerte control social regimen suerte estrategia sistematica burlarse decision millones ecuatorianas ecuatorianos votaron varios candidatos oficial,2019-03-26
Victoria Tatiana,Desintonio Malave,VickyDesintonio,irregularidades confiamos trabajo cnegobec Pediremos revisen absolutamente todas inconsistencias evitar vulneren decision millones ecuatorianas ecuatorianos CNEteVigilamos,2019-03-26
Victoria Tatiana,Desintonio Malave,VickyDesintonio,Informe Preliminar Mision Observacion Electoral oficial recoge denuncias particular,2019-03-26
Victoria Tatiana,Desintonio Malave,VickyDesintonio,Mision considera problematico curso procedimiento tipo descalificacion marcha votacion,2019-03-26
Victoria Tatiana,Desintonio Malave,VickyDesintonio,violencia mujeres Revisar marco normativo incorporar disposiciones permitan atender prevenir detectar sancionar tipo violencia periodo electoral electoral Exigimos cumpla recomendaciones,2019-03-26
Victoria Tatiana,Desintonio Malave,VickyDesintonio,violencia mujeres Revisar marco normativo incorporar disposiciones permitan atender prevenir detectar sancionar tipo violencia periodo electoral electoral Exigimos cumpla recomendaciones,2019-03-26
Victoria Tatiana,Desintonio Malave,VickyDesintonio,denunciado principio comprueba Informe Preliminar oficial vulnero libertad expresion candidatos CPCCS nego ciudadania conocer propuestas campana CNEteVigilamos,2019-03-26
Victoria Tatiana,Desintonio Malave,VickyDesintonio,Informe Preliminar ultimas elecciones presentado Mision observacion electoral Organizacion Americanos oficial recoge varias episodios dias campana denunciamos manera sostenida CNEteVigilamos,2019-03-26
Victoria Tatiana,Desintonio Malave,VickyDesintonio,presente nuevos argumentos cnegobec respecto informe recibi pocas horas inicio votacion pretenden descalificarme CNEteVigilamos oficial KevinCasasZ yerutimendez Almagro OEA2015,2019-03-29
Victoria Tatiana,Desintonio Malave,VickyDesintonio,invito escucharme manana viernes marzo traves RadioMorena640 radioelite9971 Compartire plan trabajo ciudadanos VictoriaEsCPCCS,2019-03-29
Victoria Tatiana,Desintonio Malave,VickyDesintonio,reafirmo victoria ustedes hermanos migrantes Patria entera Seguimos venciendo cada intento evitar VictoriaDeLaPatria VictoriaEsCPCCS,2019-03-29
Victoria Tatiana,Desintonio Malave,VickyDesintonio,encuentro RadioMorena640 informar ciudadanas ciudadanos plan trabajo Pueden seguir entrevista tambien VictoriaEsCPCCS VictoriaDeLaPatria,2019-03-29
Victoria Tatiana,Desintonio Malave,VickyDesintonio,Quiero agradecer ecuatorianas ecuatorianos voto confianza ganado Ecuador Vamos impulsar plan trabajo ciudadania VictoriaEsCPCCS VictoriaDeLaPatria,2019-03-29
Victoria Tatiana,Desintonio Malave,VickyDesintonio,CPCCS instituciones legitimas creada Constitucion Montecristi amplia aprobacion consulta febrero 2018 seleccionan integrantes mediante elecciones marzo ciudadania escogido Consejeros,2019-03-29
Victoria Tatiana,Desintonio Malave,VickyDesintonio,invito seguir entrevista radioelite9971 transmision vivo,2019-03-29
Victoria Tatiana,Desintonio Malave,VickyDesintonio,invito senor Trujillo iniciar recoleccion firmas ademas lleve formularios consultar ciudadania privatizaciones casos corrupcion gobierno VictoriaEsCPCCS VictoriaDeLaPatria,2019-03-29
Victoria Tatiana,Desintonio Malave,VickyDesintonio,Debemos construir participacion ciudadana realmente incluyente escuche voces todas Impulsare proceso formacion permanente participacion ecuatorianas ecuatorianos VictoriaEsCPCCS VictoriaDeLaPatria,2019-03-29
Victoria Tatiana,Desintonio Malave,VickyDesintonio,invito seguir entrevista vivo traves kolectiVOZ VictoriaEsCPCCS VictoriaDeLaPatria,2019-03-29
Victoria Tatiana,Desintonio Malave,VickyDesintonio,ENTREVISTA VickyDesintonio nueva consejera electa habla kolectiVOZ cuenta propuestas cara nuevo periodo CPCCS 2019 ademas pronuncia intentos descalificacion eleccion AQUI VOTOSkolectiVOZ 1Abr,2019-04-01
Victoria Tatiana,Desintonio Malave,VickyDesintonio,invito entrevista manana ecuavisa programa ContactoDirecto Compartire plan trabajo VictoriaEsCPCCS,2019-04-02
Victoria Tatiana,Desintonio Malave,VickyDesintonio,invito entrevista manana ecuavisa programa ContactoDirecto Compartire plan trabajo VictoriaEsCPCCS,2019-04-02
Victoria Tatiana,Desintonio Malave,VickyDesintonio,Ahora encuentro momento EcuavisaInforma compartiendo apreciaciones contienda electoral marzo sido elegido consejera CPCCS2019,2019-04-02
Victoria Tatiana,Desintonio Malave,VickyDesintonio,posible elegido autoridades control calificacion baja mitad nota Fiscal nacion bachiller permite graduarse puntaje CPCCS2019,2019-04-02
Victoria Tatiana,Desintonio Malave,VickyDesintonio,comprometi primer concurso impulsare sera contralor general hare pais merece retorno institucionalidad,2019-04-02
Victoria Tatiana,Desintonio Malave,VickyDesintonio,posible elegido autoridades control calificacion baja mitad nota caso Fiscal General bachiller permite graduarse puntaje CPCCS2019,2019-04-02
Victoria Tatiana,Desintonio Malave,VickyDesintonio,posible elegido autoridades control calificacion baja mitad nota caso Fiscal General bachiller permite graduarse puntaje CPCCS2019,2019-04-02
Victoria Tatiana,Desintonio Malave,VickyDesintonio,FEUE NACIONAL rechaza pretension descalificar candidatos Consejo Participacion Ciudadana Control Social CPCCS legal legitimamente electos pueblo Ecuatoriano VickyDesintonio wgomezr SomosFEUENacional,2019-04-02
Victoria Tatiana,Desintonio Malave,VickyDesintonio,invito seguir entrevista traves RadioLatina Quito compartire plan trabajo VictoriaEsCPCCS,2019-04-03
Victoria Tatiana,Desintonio Malave,VickyDesintonio,breves minutos iniciaremos entrevista RadioLatina Tambien pueden escucharme VictoriaEsCPCCS,2019-04-03
Victoria Tatiana,Desintonio Malave,VickyDesintonio,Consejeras Consejeros electos vamos seguir juego ocultar casos corrupcion debemos ciudadanas ciudadanos crearemos concursos realmente tecnicos transparentes VictoriaEsCPCCS,2019-04-03
Victoria Tatiana,Desintonio Malave,VickyDesintonio,alegra ayer primer mandatario reconocido existe cuenta paraiso fiscal Ahora pedimos abra demuestre lucha corrupcion VictoriaEsCPCCS,2019-04-03
Victoria Tatiana,Desintonio Malave,VickyDesintonio,Informe Preliminar oficial reconocio candidatas CPCCS2019 objeto violencia politica Mientras respuesta cnegobec inaccion segun habia normativa respecto VictoriaEsCPCCS,2019-04-03
Victoria Tatiana,Desintonio Malave,VickyDesintonio,Quiero agradecer ecuatorianas ecuatorianos respaldo voto confianza depositado tambien hermanos migrantes puesto Consejera votada exterior VictoriaEsCPCCS,2019-04-03
Victoria Tatiana,Desintonio Malave,VickyDesintonio,concurso Fiscal postulante obtuvo solo nota sirve graduarse bachiller Consejeras Consejeros electos vamos seguir juego ocultar casos corrupcion crearemos concursos realmente tecnicos transparentes VictoriaEsCPCCS,2019-04-03
Victoria Tatiana,Desintonio Malave,VickyDesintonio,Agradezco todas muestras respaldo votos confianza recibido expresion popular ecuatorianas ecuatorianos sido clara debe respetada VictoriaEsCPCCS,2019-04-03
Victoria Tatiana,Desintonio Malave,VickyDesintonio,invito seguir entrevista 18H15 traves radiosonorama Pueden tambien escucharla Compartire plan trabajo CPPCS2019 VictoriaEsCPCCS,2019-04-03
Victoria Tatiana,Desintonio Malave,VickyDesintonio,Quiero agradecer voto confianza recibido parte ecuatorianos ecuatorianas Ratifico ciudadanos vamos regresar pasado reparto partidos solo importa retirarle competencias CPCCS2019 VictoriaEsCPCCS,2019-04-03
Victoria Tatiana,Desintonio Malave,VickyDesintonio,Debemos apostarle participacion todas Creo ciudadania empoderada haciendo control social miedo voluntad popular debo ciudadania VictoriaEsCPCCS,2019-04-03
Victoria Tatiana,Desintonio Malave,VickyDesintonio,obligacion todas servidores publicos transparentar acciones miedo senor Trujillo pretende blindar acciones VictoriaEsCPCCS,2019-04-03
Victoria Tatiana,Desintonio Malave,VickyDesintonio,anos vincule organizaciones sociales movimientos mujeres jovenes vigilancia ciudadana deuda publica debo ciudadanas ciudadanos VictoriaEsCPCCS,2019-04-03
Victoria Tatiana,Desintonio Malave,VickyDesintonio,deslegitimar pueblo ecuatoriano respetar voluntad popular millones ciudadanos votaron algun candidato consejero consejera CPPCS2019 VictoriaEsCPCCS,2019-04-03
Victoria Tatiana,Desintonio Malave,VickyDesintonio,anos vincule organizaciones sociales movimientos mujeres jovenes vigilancia ciudadana deuda publica debo ciudadanas ciudadanos VictoriaEsCPCCS,2019-04-04
Victoria Tatiana,Desintonio Malave,VickyDesintonio,Comparto actividades desarrollare manana Jueves Abril Pueden seguir entrevistas RadioHuancavilk ecuainm Hispantv VictoriaEsCPCCS,2019-04-04
Victoria Tatiana,Desintonio Malave,VickyDesintonio,posible maxima autoridad seleccionada nota Vamos impulsar concursos realmente tecnicos transparentes mano ciudadanos ciudadanas VictoriaEsCPCCS,2019-04-04
Victoria Tatiana,Desintonio Malave,VickyDesintonio,CPCCS2019 Impulsare creacion Observatorio erradicacion violencia genero mujeres debemos seguir siendo objeto violencia machista inaccion autoridades VictoriaEsCPCCS,2019-04-04
Victoria Tatiana,Desintonio Malave,VickyDesintonio,CPCCS2019 definitivo legitimamente electo voluntad popular debe fortalecer transparencia mano ciudadania consultarle pueblo ecuatoriano quiere acuerdo privatizaciones VictoriaEsCPCCS,2019-04-04
Victoria Tatiana,Desintonio Malave,VickyDesintonio,vengo hablar futuro vamos trabajar demandas ciudadanas debo ecuatorianas ecuatorianos vamos trabajar construir participacion ciudadana real VictoriaEsCPCCS,2019-04-04
Victoria Tatiana,Desintonio Malave,VickyDesintonio,Agradezco ecuatorianas ecuatorianos respaldo voto confianza depositado hermanos migrantes Consejera votada exterior VictoriaEsCPCCS,2019-04-04
Victoria Tatiana,Desintonio Malave,VickyDesintonio,VIVO invito seguir entrevista ecuainm traves Compartire plan trabajo ejecutare CPCCS2019 legitimamente conformado mandato popular,2019-04-04
Victoria Tatiana,Desintonio Malave,VickyDesintonio,CPCCS entidades mayor legitimidad Ecuador creado mediante Constitucion 2008 amplia aprobacion popular 2018 ecuatorianos decidimos escoger elecciones integrantes marzo escogimos consejeros,2019-04-04
Victoria Tatiana,Desintonio Malave,VickyDesintonio,ecuatorianos queremos designacion autoridades realice mediante cuestionada Asamblea Nacional ciudadanas ciudadanos permitiremos regrese hombre maletin VictoriaEsCPCCS,2019-04-04
Victoria Tatiana,Desintonio Malave,VickyDesintonio,miedo voluntad popular Creo mecanismos accion importantes Consejo Participacion crear espacios debate inclusion participacion ciudadana VictoriaEsCPCCS ecuainm,2019-04-04
Victoria Tatiana,Desintonio Malave,VickyDesintonio,ciudadanos queremos payasadas discusiones solo invitan panelistas actores favor retirar competencias CPCCS2019 legitimo,2019-04-04
Victoria Tatiana,Desintonio Malave,VickyDesintonio,teme senor Trujillo voluntad popular anunciado iniciara proceso recoleccion firmas consultarle tambien pueblo privatizaciones acuerdo VictoriaEsCPCCS,2019-04-04
Victoria Tatiana,Desintonio Malave,VickyDesintonio,ecuatorianos podemos permitir sigan dando concursos designacion Fiscal calificacion determina alto cargo Impulsare concursos profesionales tecnicos mano ciudadania VictoriaEsCPCCS,2019-04-04
Victoria Tatiana,Desintonio Malave,VickyDesintonio,converse robinobles corresponsal cadena internacional Hispantv plan trabajo CPCCS2019 breve compartire entrevista publicada portal VictoriaEsCPCCS,2019-04-04
Victoria Tatiana,Desintonio Malave,VickyDesintonio,converse robinrobles corresponsal cadena internacional Hispantv plan trabajo CPCCS2019 breve compartire entrevista publicada portal VictoriaEsCPCCS,2019-04-04
Victoria Tatiana,Desintonio Malave,VickyDesintonio,invito seguir entrevistas manana majestadfm Tropicana Plataforma VocesLatinoamericanas,2019-04-05
Victoria Tatiana,Desintonio Malave,VickyDesintonio,VIVO breve inicia entrevista majestadfm fabriciovelav Tambien puedes escuchar transmision vivo,2019-04-05
Victoria Tatiana,Desintonio Malave,VickyDesintonio,Agradezco millon seiscientas ecuatorianas ecuatorianos votaron apostaron propuestas Envio saludo hermanos migrantes exterior Consejera votada VictoriaEsCPCCS,2019-04-05
Victoria Tatiana,Desintonio Malave,VickyDesintonio,Vamos cumplir propuestas vamos revisar actuado CPCCS Transitorio teme senor Trujillo pretende blindar acciones deber servidores publicos transparentar todas acciones VictoriaEsCPCCS,2019-04-05
Victoria Tatiana,Desintonio Malave,VickyDesintonio,Impulsare concursos tecnicos profesionales transparentes Vamos revisar acciones Consejo Transitorio cumplido debido proceso ordena Constitucion Republica VictoriaEsCPCCS,2019-04-05
Victoria Tatiana,Desintonio Malave,VickyDesintonio,Ahora majestadfm acompana VickyDesintonio vocal electa CPCCS Escuchanos Pichincha Manabi Esmeraldas Tambien FacebookLive,2019-04-05
Victoria Tatiana,Desintonio Malave,VickyDesintonio,debo pueblo ecuatoriano organizaciones sociales ciudadanos ciudadanas depositado confianza Impulsare propuestas mano gente VictoriaEsCPCCS,2019-04-05
Victoria Tatiana,Desintonio Malave,VickyDesintonio,debo pueblo ecuatoriano organizaciones sociales ciudadanos ciudadanas depositado confianza Impulsare propuestas mano gente VictoriaEsCPCCS,2019-04-05
Victoria Tatiana,Desintonio Malave,VickyDesintonio,VickyDesintonio quiero pensar intento descalificarme direccionado Solo notificados candidatos segun habrian cometido alguna infraccion majestadfm,2019-04-05
Victoria Tatiana,Desintonio Malave,VickyDesintonio,VickyDesintonio siempre candidata organizaciones sociales ciudadano majestadfm,2019-04-05
Victoria Tatiana,Desintonio Malave,VickyDesintonio,Escucha nuevamente criterios opiniones VickyDesintonio MasAlladelosHechos ESTEFANIESPIN aqui,2019-04-05
Victoria Tatiana,Desintonio Malave,VickyDesintonio,VickyDesintonio Seria falta respeto ecuatorianos deciden conforme CPCCS menos semana electos quieran eliminarlo asusta pongamos ejecucion proceso fiscalizacion MasAlladelosHechos,2019-04-05
Victoria Tatiana,Desintonio Malave,VickyDesintonio,VickyDesintonio Ahora vamos crear verdadera ParticipacionCiudadana inclusiva actores estan asustados estan poder importa quieren eliminar Consejo MasAlladelosHechos,2019-04-05
Victoria Tatiana,Desintonio Malave,VickyDesintonio,VickyDesintonio pedimos 2008 incorpore Constitucion incluya ParticipacionCiudadana 2018 volvimos urnas reafirmamos debe garantizar institucionalidad Escuchanos MasAlladelosHechos,2019-04-05
Victoria Tatiana,Desintonio Malave,VickyDesintonio,VickyDesintonio intentos restarle competencias CPCCS pesar legitimo definitivo podemos retroceder pasado MasAlladelosHechos,2019-04-05
Victoria Tatiana,Desintonio Malave,VickyDesintonio,Escucha nuevamente criterios opiniones VickyDesintonio MasAlladelosHechos ESTEFANIESPIN aqui,2019-04-05
Victoria Tatiana,Desintonio Malave,VickyDesintonio,Mantengo compromiso ustedes Impulsare requisito cada concurso postulantes cometido violencia genero designacion autoridades sera caracter tecnico profesional invito acompanarme vigilar juntos procesos VictoriaEsCPCCS,2019-04-05
Victoria Tatiana,Desintonio Malave,VickyDesintonio,VickyDesintonio MashiRafael vote,2019-04-06
Victoria Tatiana,Desintonio Malave,VickyDesintonio,VickyDesintonio Loja abrazo grande cargado mejores vibras nuevo reto estimada VickyDesintonio,2019-04-06
Victoria Tatiana,Desintonio Malave,VickyDesintonio,VickyDesintonio voto Victoria esperanza investigue todas anomalias gobierno haga justicia pais dolido,2019-04-06
Victoria Tatiana,Desintonio Malave,VickyDesintonio,VickyDesintonio Exito cargo gano mediante voto popular,2019-04-06
Victoria Tatiana,Desintonio Malave,VickyDesintonio,VickyDesintonio MashiRafael vote,2019-04-06
Victoria Tatiana,Desintonio Malave,VickyDesintonio,VickyDesintonio MashiRafael Vamos siempre adelante pueblo respalda tambien,2019-04-06
Victoria Tatiana,Desintonio Malave,VickyDesintonio,VickyDesintonio MashiRafael Vamos siempre adelante pueblo respalda tambien,2019-04-06
Victoria Tatiana,Desintonio Malave,VickyDesintonio,VickyDesintonio Loja abrazo grande cargado mejores vibras nuevo reto estimada VickyDesintonio,2019-04-06
Victoria Tatiana,Desintonio Malave,VickyDesintonio,VickyDesintonio MashiRafael vote,2019-04-06
Victoria Tatiana,Desintonio Malave,VickyDesintonio,Juan Javier davalos2019 solidarizo contigo respaldo justo pedido ciudadanos vigilantes cnegobec actue marco resultados electorales deben reflejar claridad expresion popular,2019-04-08
Victoria Tatiana,Desintonio Malave,VickyDesintonio,preocupan irregularidades proceso electoral exigimos repitan elecciones CPCCS recintos realizaran elecciones seccionales recuenten todas actas EleccionesCPCCS impugnadas Convocamos movilizacion ciudadana,2019-04-09
Victoria Tatiana,Desintonio Malave,VickyDesintonio,consejeros Participacion Ciudadana electos VickyDesintonio wgomezr ademas candidato davalos2019 convocan manana protesta irregularidades detectadas proceso electoral,2019-04-09
Victoria Tatiana,Desintonio Malave,VickyDesintonio,problemas presentados UdeGuayaquil pedimos respuestas demandas estudiantiles respeto principio autonomia universitaria fundamental convivencia dentro Universidad,2019-04-12
Victoria Tatiana,Desintonio Malave,VickyDesintonio,Impulsare revision denuncias irregularidades designacion autoridades Consejo Transitorio ecuatorianos merecemos concursos favoritismos haremos verdadera transparencia participacion ciudadana VictoriaEsCPPCS,2019-04-18
Victoria Tatiana,Desintonio Malave,VickyDesintonio,Dolorosamente mujeres seguimos siendo victimas violencia machista primeros dias impulsare firmeza creacion Observatorio erradicacion violencia genero defensa derechos mujeres prioridad VictoriaEsCPCCS,2019-04-30
Victoria Tatiana,Desintonio Malave,VickyDesintonio,acuerdo Moreno desaparecio informe semanal labores mandantes guarda silencio acuerdo corrupcion empresa shore familia Investment temas importantes ecuatorianos AcuerdoNacionalEcuador,2019-05-06
Victoria Tatiana,Desintonio Malave,VickyDesintonio,quieren atropellar decision pueblo ecuatoriano Despues dias pretenden burlarse nuevamente descalificarnos wgomezr consejeros defender ciudadania abusos Consejo Transitorio NuevaTraicionCNE,2019-05-08
Victoria Tatiana,Desintonio Malave,VickyDesintonio,consejera Participacion Ciudadana electa VickyDesintonio denuncia hora cnegobec intenta descalificar candidatura igual consejero electo wgomezr,2019-05-08
Victoria Tatiana,Desintonio Malave,VickyDesintonio,Cuanto miedo tendran Trujillo transitorios conforme ordenar cnegobec desconozca votos VickyDesintonio obtuvo Consejera electa pedir CorteConstEcu dictamen blinde Caso mayo,2019-05-09
Victoria Tatiana,Desintonio Malave,VickyDesintonio,morei VickyDesintonio cnegobec wgomezr Senores transitorios cnegobec mandantes ecuatorianos elegimos voto wgomezr VickyDesintonio pueblo Defenderemos voto sagrado democracia defenderemos vida posible,2019-05-09
Victoria Tatiana,Desintonio Malave,VickyDesintonio,VickyDesintonio wgomezr quiere incumplir mandato popular Senores cumplan Constitucion deber defender democracia basta acciones inconstitucionales cumplir voluntad pueblo,2019-05-09
Victoria Tatiana,Desintonio Malave,VickyDesintonio,espera cnegobec salga cuentos argumentos disparatados destruir representan intereses pueblo argumentos traicionar mandato popular querer descalificar VickyDesintonio wgomezr NuevaTraicionCNE,2019-05-09
Victoria Tatiana,Desintonio Malave,VickyDesintonio,VIVO 09H30 estare radioelite9971 pueden seguir entrevista transmision vivo siguientes links,2019-05-09
Victoria Tatiana,Desintonio Malave,VickyDesintonio,prioritario generar cuerpo colegiado supra constitucional Respetaremos Constitucion leyes VictoriaEsCPCCS radioelite9971,2019-05-09
Victoria Tatiana,Desintonio Malave,VickyDesintonio,Quiero decirle senor Trujillo pedi permiso candidata tampoco pedi Corte Constitucional senor Trujillo miedo Rafael Correa miedo pueblo VickyDesintonio consejera electa CPCCS definitivo,2019-05-09
Victoria Tatiana,Desintonio Malave,VickyDesintonio,VIVO ElPoderDeLaPalabra Entrevista VickyDesintonio Escuchanos vivo,2019-05-14
Victoria Tatiana,Desintonio Malave,VickyDesintonio,EXCLUSIVO VickyDesintonio queremos crear inestabilidad justicia seguridad juridica institucionalidad AUDIO consejera electa Participacion Ciudadana critico decision transitorios prorrogarse funciones,2019-05-14
Victoria Tatiana,Desintonio Malave,VickyDesintonio,pasado marzo ustedes ciudadanos ciudadanas decidieron consejera Manana defender VictoriaDeLaPatria iniciativa organizaciones sociales gran vigilia entreguen credenciales,2019-05-16
Victoria Tatiana,Desintonio Malave,VickyDesintonio,conseguimos juntos vencer posturas antidemocraticas cnegob obtenido nueva VictoriaDeLaPatria archivarse burdo intento descalificarnos VictoriaEsCPCCS,2019-05-17
Victoria Tatiana,Desintonio Malave,VickyDesintonio,ATENCION resuelve archivar informe descalificacion Victoria Desintonio Walter Gomez oficialmente nuevos consejeros Consejo Participacion Ciudadana Control Social CPCCS VickyDesintonio waltwr,2019-05-17
Victoria Tatiana,Desintonio Malave,VickyDesintonio,oficial VickyDesintonio consejera Participacion Ciudadana electa igual wgomezr desecho proceso amenazaba descalificar candidatura,2019-05-18
Victoria Tatiana,Desintonio Malave,VickyDesintonio,impuso voluntad popular manipulacion odio Desgobierno Excelente VickyDesintonio Excelente wgomezr Excelente pueblo Excelente Patria Resistiremos Combatiremos Venceremos,2019-05-18
Victoria Tatiana,Desintonio Malave,VickyDesintonio,oficial VickyDesintonio consejera Participacion Ciudadana electa igual wgomezr desecho proceso amenazaba descalificar candidatura,2019-05-18
Victoria Tatiana,Desintonio Malave,VickyDesintonio,ganado VickyDesintonio gano democracia gano pueblo gano Pais primer paso largo caminar esfuerzo sacrificio llegara exito deseado Felicidades Vicky Suerte CPCCS,2019-05-18
Victoria Tatiana,Desintonio Malave,VickyDesintonio,Millones conquistamos Victoria VickyDesintonio jamas traicionara pueblo viene debe Seguiremos construyendo historia profundo America,2019-05-18
