nombre,apellidos,tweet_screen_name,tweet_text,tweet_date
Victoria Tatiana,Desintonio Malave,VickyDesintonio,Recuerdo jovenes SantaElena acompanamos lucha poblacion Ayangue Ustedes podran recordar pobladores opusieron privatizacion Portete organizamos marchamos juntos hermoso participacion GanaremosEcuador,2019-03-14
Victoria Tatiana,Desintonio Malave,VickyDesintonio,Propongo crear Observatorio Ciudadano vigilar aplicacion erradicacion violencia mujer presidente dice dias menos embargo quita presupuesto aplicacion GanaremosEcuador,2019-03-14
Victoria Tatiana,Desintonio Malave,VickyDesintonio,Revisaremos todas designaciones Consejo Transitorio quieren blindar actuaciones sido supuestamente pulcras Usted senor Trujillo servidor publico obligacion rendir cuentas ciudadania,2019-03-14
Victoria Tatiana,Desintonio Malave,VickyDesintonio,ciudadanos participan voto cuenta voces jovenes migrantes mujeres hombres rincones hacen escuchar exigen pais justo transparente VictoriaDeLaPatria GanaremosEcuador Victoria2019 EleccionesCPCCS,2019-03-14
Victoria Tatiana,Desintonio Malave,VickyDesintonio,calida SantaElena defendemos democracia derecho participacion todas CPCCS entidad mayor legitimidad pais creada mandato constitucional ratificada consulta popular ahora Consejeros elegidos democraticamente,2019-03-14
Victoria Tatiana,Desintonio Malave,VickyDesintonio,derecho elegir elegidos ciudadania movimientos organizaciones sociales peligro Hacemos llamado organismos DDHH observadores internacionales mision oficial vigilar cumpla mandato popular,2019-03-14
Victoria Tatiana,Desintonio Malave,VickyDesintonio,Solicite DEFENSORIAEC intervenga precautelar derechos humanos participacion elegir elegidos demanda inconstitucionalidad presentada grupo abogados escogieron CorteConstEcu ahora debe resolver atentatoria DDHH,2019-03-14
Victoria Tatiana,Desintonio Malave,VickyDesintonio,VictoriaDeLaPatria vive Guayaquil rincones marzo GanaremosEcuador EleccionesCPCCS Elecciones2019EC CPCCS Ecuador FelizViernes,2019-03-15
Victoria Tatiana,Desintonio Malave,VickyDesintonio,JCicedo,2019-03-15
Victoria Tatiana,Desintonio Malave,VickyDesintonio,Recorro pais informando ciudadania ELECCIONESCPPCS semana Manabi ElOro SantaElena querida Guayaquil Seguimos fuerza ciudadania VictoriaDeLaPatria GanaremosEcuador,2019-03-15
Victoria Tatiana,Desintonio Malave,VickyDesintonio,sanfrancisco850 CPCCS regalado resultado lucha ciudadanas ciudadanos mayor proceso democratico vivido Ecuador Asamblea Constituyente VictoriaDeLaPatria GanaremosEcuador,2019-03-15
Victoria Tatiana,Desintonio Malave,VickyDesintonio,sanfrancisco850 CPCCS regalado resultado lucha ciudadanas ciudadanos mayor proceso democratico vivido Ecuador Asamblea Constituyente VictoriaDeLaPatria GanaremosEcuador,2019-03-15
Victoria Tatiana,Desintonio Malave,VickyDesintonio,corte retrocede presion ciudadana suspenden EleccionesCPCCS embargo admite proceso clara amenaza atentar voluntad popular soberano VictoriaDeLaPatria GanaremosEcuador CPCCS Victoria2019,2019-03-15
Victoria Tatiana,Desintonio Malave,VickyDesintonio,Ningun proceso designacion autoridades sido transparente ecuatorianas ecuatorianos exigimos respete voluntad popular terminen designaciones dedo VictoriaDeLaPatria GanaremosEcuador,2019-03-15
Victoria Tatiana,Desintonio Malave,VickyDesintonio,voces jovenes migrantes mujeres hombres exigen respeto voluntad autoridades respondan ciudadanos voto cuenta VictoriaDeLaPatria GanaremosEcuador Victoria2019 EleccionesCPCCS,2019-03-15
Victoria Tatiana,Desintonio Malave,VickyDesintonio,Amigos amigas vemos 10H30 Universidad Guayaquil Foro Consejo Participacion Ciudadana Control Social importancia significado historico espero VictoriaDeLaPatria GanaremosEcuador Victoria2019 EleccionesCPCCS CPCCS,2019-03-15
Victoria Tatiana,Desintonio Malave,VickyDesintonio,Informamos foro podra realizarse organizadores acaban comunicar recibido fuertes amenazas realizan actividad Lamentamos espacios deben academicos debate intercambio ideas susciten actos tipo GanaremosEcuador,2019-03-15
Victoria Tatiana,Desintonio Malave,VickyDesintonio,proxima reunion oficial informare documentadamente boicot sistematico permanente sido objeto proceso elecciones Consejeros Consejeras Participacion Ciudadana Cambios extemporaneos reglas Campana voto nulo,2019-03-15
Victoria Tatiana,Desintonio Malave,VickyDesintonio,Podran impedir desarrollo foro jamas podran silenciar voces ciudadanas estudiantes UdeGuayaquil manifiestan viene VictoriaDeLaPatria miedo voluntad popular GanaremosEcuador,2019-03-15
Victoria Tatiana,Desintonio Malave,VickyDesintonio,Agradezco invitacion companeros companeras asociaciones economia popular solidaria Guayaquil invitacion Foro Rumbo CPCCS construccion poder ciudadano VictoriaDeLaPatria GanaremosEcuador,2019-03-15
Victoria Tatiana,Desintonio Malave,VickyDesintonio,distintos ambitos regimen impulsa intentos desesperados detener silenciar voluntad popular eleccion democratica Consejeros Consejeras Participacion Ciudadana Control Social VictoriaDeLaPatria GanaremosEcuador,2019-03-15
Victoria Tatiana,Desintonio Malave,VickyDesintonio,VickyDesintonio qwalter31 UdeGuayaquil Milan siempre gran VictoriaDeLaPatria,2019-03-16
Victoria Tatiana,Desintonio Malave,VickyDesintonio,VickyDesintonio respaldo Jersey ganaremos,2019-03-16
Victoria Tatiana,Desintonio Malave,VickyDesintonio,VickyDesintonio qwalter31 UdeGuayaquil Milan siempre gran VictoriaDeLaPatria,2019-03-16
Victoria Tatiana,Desintonio Malave,VickyDesintonio,VIVO Sigue traves Radio Xtrema Ecuador transmision vivo VictoriaDeLaPatria GanaremosEcuador,2019-03-16
Victoria Tatiana,Desintonio Malave,VickyDesintonio,sabado domingo marzo conversare derecho participacion ciudadanas ciudadanos cantones ElEmpalme Balzar Colimes SantaLucia Daule querido Guayas VictoriaDeLaPatria GanaremosEcuador,2019-03-16
Victoria Tatiana,Desintonio Malave,VickyDesintonio,digo frontalmente proceso EleccionesCPCCS presentado fuertes irregularidades denunciado oficial boicot sistematico permanente ciudadanos exigen respete voluntad popular VictoriaDeLaPatria GanaremosEcuador,2019-03-16
Victoria Tatiana,Desintonio Malave,VickyDesintonio,semana presion ciudadana impedido corte suspenda EleccionesCPCCS ecuatorianos vigilantes posibles amenazas atentar voluntad popular pueblo VictoriaDeLaPatria GanaremosEcuador CPCCS Victoria2019,2019-03-16
Victoria Tatiana,Desintonio Malave,VickyDesintonio,EleccionesCPCCS recibido fuerte bloqueo parte instituciones deberian fomentar garantizar derecho elegir elegidos miedo marzo VictoriaDeLaPatria sera contundente GanaremosEcuador,2019-03-16
Victoria Tatiana,Desintonio Malave,VickyDesintonio,VictoriaDeLaPatria participacion convierte agentes cambio construir colectivamente Ecuador Comparto entrevista diario eluniversocom GanaremosEcuador Casillero6 Victoria2019 CPCCS EleccionesCPCCS Elecciones2019EC,2019-03-16
Victoria Tatiana,Desintonio Malave,VickyDesintonio,Barcelona vive VictoriaDeLaPatria Impulsare creacion Observatorio erradicacion violencia genero fuerte abrazo hermanos ecuatorianos Espana Gracias darnos fuerza seguir construyendo pais mejor GanaremosEcuador,2019-03-17
Victoria Tatiana,Desintonio Malave,VickyDesintonio,,2019-03-17
Victoria Tatiana,Desintonio Malave,VickyDesintonio,ecuatorianas ecuatorianos exigimos respeto Constitucion aprobada inmensa mayoria pueblo voluntad popular juega senores transitorios marzo ciudadanos celebraremos VictoriaDeLaPatria GanaremosEcuador,2019-03-17
Victoria Tatiana,Desintonio Malave,VickyDesintonio,Comparto entrevista diariocorreoweb propuestas CPCCS Observatorio violencia genero Control social privatizaciones Respaldo revocatorias mandato Revision designaciones Consejo Transitorio VictoriaDeLaPatria GanaremosEcuador,2019-03-18
Victoria Tatiana,Desintonio Malave,VickyDesintonio,ucsgradio Cada depositamos voto entregamos confianza sido burlada cumplio plazo revocatoria mandato admitida tramite planteada hermanos migrantes VictoriaDeLaPatria GanaremosEcuador,2019-03-18
Victoria Tatiana,Desintonio Malave,VickyDesintonio,ucsgradio Cada depositamos voto entregamos confianza sido burlada cumplio plazo revocatoria mandato admitida tramite planteada hermanos migrantes VictoriaDeLaPatria GanaremosEcuador,2019-03-18
Victoria Tatiana,Desintonio Malave,VickyDesintonio,ucsgradio Cada depositamos voto entregamos confianza sido burlada cumplio plazo revocatoria mandato admitida tramite planteada hermanos migrantes VictoriaDeLaPatria GanaremosEcuador,2019-03-18
Victoria Tatiana,Desintonio Malave,VickyDesintonio,ucsgradio hablando elegir presidente curso Existen candidatas candidatos autoridades bajas calificaciones caso Fiscalia ciudadanos exigimos transparencia queremos autoridades puestas dedo,2019-03-18
Victoria Tatiana,Desintonio Malave,VickyDesintonio,ucsgradio Cada depositamos voto entregamos confianza sido burlada cumplio plazo revocatoria mandato admitida tramite planteada hermanos migrantes VictoriaDeLaPatria GanaremosEcuador,2019-03-18
Victoria Tatiana,Desintonio Malave,VickyDesintonio,ucsgradio hablando elegir presidente curso Existen candidatas candidatos autoridades bajas calificaciones caso Fiscalia ciudadanos exigimos transparencia queremos autoridades puestas dedo,2019-03-18
Victoria Tatiana,Desintonio Malave,VickyDesintonio,Impulsare creacion Observatorio actue defensa derechos mujeres evitar revictimizacion casos violencia alcancen justicia VictoriaDeLaPatria GanaremosEcuador,2019-03-19
Victoria Tatiana,Desintonio Malave,VickyDesintonio,Agradezco todas organizaciones sociales invitacion Foro participacion ciudadana transparencia Juntos llegaremos CPPCS2019 marzo celebraremos VictoriaDeLaPatria GanaremosEcuador,2019-03-19
Victoria Tatiana,Desintonio Malave,VickyDesintonio,Agradezco todas organizaciones sociales invitacion Foro participacion ciudadana transparencia Juntos llegaremos CPCCS2019 marzo celebraremos VictoriaDeLaPatria GanaremosEcuador,2019-03-19
Victoria Tatiana,Desintonio Malave,VickyDesintonio,Agradezco todas organizaciones sociales invitacion Foro participacion ciudadana transparencia Juntos llegaremos CPCCS2019 marzo celebraremos VictoriaDeLaPatria GanaremosEcuador,2019-03-19
Victoria Tatiana,Desintonio Malave,VickyDesintonio,ciudadanos llegado firme mision revisar transparentar designaciones todas autoridades Impulsare control verdaderamente social VictoriaDeLaPatria GanaremosEcuador,2019-03-19
Victoria Tatiana,Desintonio Malave,VickyDesintonio,Continua discriminacion cnegobec difusion video promocional propuestas dias elecciones segun ParticipacionPC destinado solo minutos Pese obstaculos marzo lograremos VictoriaDeLaPatria GanaremosEcuador,2019-03-19
Victoria Tatiana,Desintonio Malave,VickyDesintonio,vigilar cumpla establece Constitucion inversion educacion calidad derechos progresivos domingo marzo vota CPCCS2019 ciudadano Vota VictoriaDeLaPatria GanaremosEcuador,2019-03-20
Victoria Tatiana,Desintonio Malave,VickyDesintonio,Advertimos hace semana querian modificar forma contabilizar votos nulos acomodar resultados conveniencia nego mintiendonos descaradamente viajare Quito defender democracia ciudadania VictoriaDeLaPatria,2019-03-20
Victoria Tatiana,Desintonio Malave,VickyDesintonio,Advertimos hace semana querian modificar forma contabilizar votos nulos acomodar resultados conveniencia nego mintiendonos descaradamente viajare Quito defender democracia ciudadania VictoriaDeLaPatria,2019-03-20
Victoria Tatiana,Desintonio Malave,VickyDesintonio,poder radica pueblo ciudadania debo ello invito acompanarme Quito vayan elites pasado tiemblan voluntad popular VictoriaDeLaPatria,2019-03-20
Victoria Tatiana,Desintonio Malave,VickyDesintonio,poder radica pueblo Demando autoridades electorales respeten Codigo Democracia advierto voluntad ciudadana juega CNEesFraude,2019-03-20
Victoria Tatiana,Desintonio Malave,VickyDesintonio,VictoriaDeLaPatria participare junto davalos2019 programa EnClavePolitik teleSURtv tema riesgo eliminado Consejo Participacion Ciudadana Control Social GanaremosEcuador,2019-03-20
Victoria Tatiana,Desintonio Malave,VickyDesintonio,deje EnClavePolitik proposito decision cnegobec modo contabilizar votos nulos CPCCS comicios marzo VickyDesintonio davalos2019 teleSURtv,2019-03-20
Victoria Tatiana,Desintonio Malave,VickyDesintonio,Consejeros Consejeras cnegobec digo firmemente Articulo Codigo Democracia obliga asegurar votaciones escrutinios traduzcan expresion autentica libre democratica espontanea ciudadania GanaremosEcuador,2019-03-20
Victoria Tatiana,Desintonio Malave,VickyDesintonio,oficial Almagro OEA2015 pacoguerreroa65 gerardodeicaza brendaindc kevinCasasZ yerutimendez ActualidadRT EFEnoticias teleSURtv telegrafo ecuainm Expresoec eluniversocom pichinchauniver elcomerciocom teleamazonasec Gamanoticiasec RutaKritica,2019-03-20
Victoria Tatiana,Desintonio Malave,VickyDesintonio,ciudadanos exigimos cumpla normativa Articulo Codigo Democracia absolutamente claro prohibe realizar reformas legales materia electoral entren vigencia anterior celebracion elecciones norma,2019-03-20
Victoria Tatiana,Desintonio Malave,VickyDesintonio,oficial Almagro OEA2015 pacoguerreroa65 gerardodeicaza brendaindc kevinCasasZ yerutimendez ActualidadRT EFEnoticias teleSURtv telegrafo ecuainm Expresoec eluniversocom pichinchauniver elcomerciocom teleamazonasec Gamanoticiasec RutaKritica,2019-03-20
Victoria Tatiana,Desintonio Malave,VickyDesintonio,vencido democracia ganado esperanza nunca digo vamos ganar VictoriaDeLaPatria GanaremosEcuador,2019-03-20
Victoria Tatiana,Desintonio Malave,VickyDesintonio,Video jueves marzo rueda prensa expuse postura intentos desesperados atentar voluntad popular multiplicando votos nulos marzo GanaremosEcuador VictoriaDeLaPatria,2019-03-20
Victoria Tatiana,Desintonio Malave,VickyDesintonio,Ecuatorianos ecuatorianas solo presion social pudo impedir atropello voluntad popular candidatura nacio ilusion canal verdadera participacion mediante llegada CPCCS ciudadana VictoriaDeLaPatria,2019-03-21
Victoria Tatiana,Desintonio Malave,VickyDesintonio,ciudadanos exigimos transparencia vamos permitir designaciones autoridades sigan siendo dedo Impulsare procesos claros transparentes marzo VictoriaDeLaPatria,2019-03-21
Victoria Tatiana,Desintonio Malave,VickyDesintonio,ciudadanos exigimos transparencia vamos permitir designaciones autoridades sigan siendo dedo Impulsare procesos claros transparentes marzo VictoriaDeLaPatria GanaremosEcuador,2019-03-21
Victoria Tatiana,Desintonio Malave,VickyDesintonio,momento encuentro teleSURtv davalos2019 programa EnClavePolitik OrlandoPerezEC compartiendo globalmente viviendo Ecuador EleccionesCPCCS GanaremosEcuador,2019-03-21
Victoria Tatiana,Desintonio Malave,VickyDesintonio,teleSURtv Revisare procesos designacion autoridades parte Consejo Transitorio sido apegados principios normas constitucionales legales GanaremosEcuador VictoriaDeLaPatria,2019-03-21
Victoria Tatiana,Desintonio Malave,VickyDesintonio,teleSURtv Revisare procesos designacion autoridades parte Consejo Transitorio sido apegados principios normas constitucionales legales GanaremosEcuador VictoriaDeLaPatria,2019-03-21
Victoria Tatiana,Desintonio Malave,VickyDesintonio,teleSURtv Revisare procesos designacion autoridades parte Consejo Transitorio sido apegados principios normas constitucionales legales GanaremosEcuador VictoriaDeLaPatria,2019-03-21
Victoria Tatiana,Desintonio Malave,VickyDesintonio,Comparto actividades realizare ciudad Guayaquil jueves marzo FelizJueves VictoriaDeLaPatria GanaremosEcuador,2019-03-21
Victoria Tatiana,Desintonio Malave,VickyDesintonio,AHORA invito escuchar entrevista Tropicana mediante link VictoriaDeLaPatria GanaremosEcuador,2019-03-21
Victoria Tatiana,Desintonio Malave,VickyDesintonio,pretendia forma direccionada EleccionesCPCCS contabilizar votos nulos multiplicandolos artificialmente lograron presion ciudadana obligo retroceder GanaremosEcuador,2019-03-21
Victoria Tatiana,Desintonio Malave,VickyDesintonio,Consejo Participacion Ciudadana Control Social debe responder demandas pueblo radica poder debo gente sere Consejera GanaremosEcuador VictoriaDeLaPatria EleccionesCPCCS CPCCS,2019-03-21
Victoria Tatiana,Desintonio Malave,VickyDesintonio,ecuatorianas ecuatorianos exigimos transparencia respeto voluntad popular posible pretendan anular mandato ciudadano escritorio marzo GanaremosEcuador VictoriaDeLaPatria,2019-03-21
Victoria Tatiana,Desintonio Malave,VickyDesintonio,Agradezco organizaciones sociales invitacion Foro participacion ciudadana transparencia CPCCS 2019 candidata debo ciudadania marzo ecuatorianos celebraremos VictoriaDeLaPatria GanaremosEcuador,2019-03-21
Victoria Tatiana,Desintonio Malave,VickyDesintonio,rostros participacion ciudadana rostros ecuatorianas ecuatorianos exigen pais justo transparente ciudadanos haremos marzo VictoriaDeLaPatria,2019-03-21
Victoria Tatiana,Desintonio Malave,VickyDesintonio,ayer evitamos golpeen democracia impidiendo resolucion antidemocratica VictoriaDeLaPatria gusto encontrarme tantos companeros dirigentes,2019-03-21
Victoria Tatiana,Desintonio Malave,VickyDesintonio,vengo educacion publica saben duele saber volvemos escuelas unidocentes condenando exclusion ninos ninas pueden pagar educacion privada ciudadanos debemos participar decidir futuro pais,2019-03-21
Victoria Tatiana,Desintonio Malave,VickyDesintonio,democracia representativa intentado destruir institucionalidad pais vamos ciudadanas elegir representen,2019-03-21
Victoria Tatiana,Desintonio Malave,VickyDesintonio,politica anos queria saber profesores tenian protestar clases Gobierno pagaba VickyDesintonio Candidata Consejo Participacion,2019-03-21
Victoria Tatiana,Desintonio Malave,VickyDesintonio,compartido propuestas pesar todas trabas puesto sido candidata menos espacio spots televisivos segun reporte coorporacion Participacion Ciudadana,2019-03-21
Victoria Tatiana,Desintonio Malave,VickyDesintonio,Candidata VickyDesintonio denuncia campana sistematica deslegitimar eleccion Consejo Participacion Ciudadana Control Social incluso amenazas descalificacion maniobras dice Elecciones2019Ec,2019-03-21
Victoria Tatiana,Desintonio Malave,VickyDesintonio,primer concurso impulsare sera Contralor General imagen rompiendo notificacion puede olvidarsenos pais prepotencia arbitrariedad acabarse Vamos recuperar institucionalidad pais VictoriaDeLaPatria,2019-03-21
Victoria Tatiana,Desintonio Malave,VickyDesintonio,momento firmamos compromiso candidata Graciela Mora propuestas recuperar institucionalidad pais marzo gana pueblo gana voluntad popular VictoriaDeLaPatria,2019-03-21
Victoria Tatiana,Desintonio Malave,VickyDesintonio,VickyDesintonio anuncia primer concurso convocara Consejo Participacion Ciudadana definitivo sera Contralor Elecciones2019EC,2019-03-21
Victoria Tatiana,Desintonio Malave,VickyDesintonio,VickyDesintonio jugamos ahora pais candidaturas defensa constitucion Montecristi recuperacion derecho kolectiVOZ LaMochila LaKolmenaEC ForoCPCCS,2019-03-21
Victoria Tatiana,Desintonio Malave,VickyDesintonio,Gracias companeros dirigentes estudiantiles becarios dirigentes barriales colectivos GLBTI ciudadanos confianza vamos marzo recuperar pais miedo miedo 24MarzoTrujilloASuCasa VictoriaDeLaPatria,2019-03-21
Victoria Tatiana,Desintonio Malave,VickyDesintonio,encuentro ucsg compartiendo Consejo Participacion proceso EleccionesCPCCS sido atropellado sistematicamente distintos actores VictoriaDeLaPatria GanaremosEcuador,2019-03-21
Victoria Tatiana,Desintonio Malave,VickyDesintonio,convencida participacion ciudadana camino debo ecuatorianas ecuatorianos trabajare Ayer triunfo democracia presion ciudadana impidio anule voluntad popular GanaremosEcuador VictoriaDeLaPatria,2019-03-21
Victoria Tatiana,Desintonio Malave,VickyDesintonio,Ayer logramos hacer retroceder autoridades puestas dedo responden regimen turno Querian imponer voto nulo silenciar voluntad popular GanaremosEcuador VictoriaDeLaPatria,2019-03-21
Victoria Tatiana,Desintonio Malave,VickyDesintonio,anos involucre organizaciones sociales lucha defensa derechos jovenes mujeres vigilancia ciudadana deuda publica ello debo ecuatorianas ecuatorianos VictoriaDeLaPatria GanaremosEcuador,2019-03-21
Victoria Tatiana,Desintonio Malave,VickyDesintonio,Agradezco canal ucsg invitacion vital defender voluntad popular EleccionesCPCCS ecuatorianas ecuatorianos exigimos transparencia respeto mandato ciudadano GanaremosEcuador VictoriaDeLaPatria,2019-03-21
Victoria Tatiana,Desintonio Malave,VickyDesintonio,Ayer ratifique firme compromiso fortalecer participacion ciudadana grupos historicamente excluidos violentados firma Acuerdo Igualdad LGBT VictoriaDeLaPatria GanaremosEcuador,2019-03-22
Victoria Tatiana,Desintonio Malave,VickyDesintonio,Sigue entrevista vivo RadioEstrella Hablaremos elecciones Consejo Participacion Ciudadana Control Social atropellos cometido voluntad popular marzo viviremos VictoriaDeLaPatria GanaremosEcuador,2019-03-22
Victoria Tatiana,Desintonio Malave,VickyDesintonio,Ayer presion ciudadana impidio EleccionesCPCCS vulnere voluntad popular multiplicando votos nulos segura construiremos juntos Ecuador justo transparente GanaremosEcuador marzo viene VictoriaDeLaPatria,2019-03-22
Victoria Tatiana,Desintonio Malave,VickyDesintonio,primer concurso impulsare cargo Contralor General posible sostengan autoridades sido seleccionadas bajo concursos publicos transparentes segura marzo viviremos VictoriaDeLaPatria,2019-03-22
Victoria Tatiana,Desintonio Malave,VickyDesintonio,VickyDesintonio Nicolas02639906 Lenin JCTrujilloCPCCS Victoria mucha esperanza domingo votar usted corazon digo favor falle hijas,2019-03-22
Victoria Tatiana,Desintonio Malave,VickyDesintonio,noticiasec MashiRafael VickyDesintonio Fuerza Vicky confiamos usted,2019-03-22
Victoria Tatiana,Desintonio Malave,VickyDesintonio,VickyDesintonio Lenin JCTrujilloCPCCS Victoria mucha confianza iremos domingo votar usted VOTOS familia incluida madre anos admira inteligencia liderazgo favor falle familia,2019-03-22
Victoria Tatiana,Desintonio Malave,VickyDesintonio,Carlosbolmo MashiRafael VickyDesintonio Lenin JCTrujilloCPCCS familia confiamos propuesta votos confiamos devolvera institucionalidad pais,2019-03-22
Victoria Tatiana,Desintonio Malave,VickyDesintonio,VickyDesintonio APOYO TOTAL BELLA DAMA CORAZON VALIENTE,2019-03-22
Victoria Tatiana,Desintonio Malave,VickyDesintonio,breves minutos llevara cabo reunion Mision Observadores Electorales oficial presentare documentos respaldo irregularidades proceso EleccionesCPCCS 2019 VictoriaDeLaPatria Almagro OEA2015 kevinCasasZ,2019-03-22
Victoria Tatiana,Desintonio Malave,VickyDesintonio,oficial VickyDesintonio Segun monitoreo ParticipacionPC cinco candidatas CPCCS sido violentadas traves redes sociales ataques vino presidente Republica Almagro OEA2015 pacoguerreroa65 KevinCasasZ yerutimendez,2019-03-22
Victoria Tatiana,Desintonio Malave,VickyDesintonio,marzo esperanza decision elegimos votar recuperar patria hacer querido Ecuador pais justo transparente Vamos VictoriaDeLaPatria,2019-03-22
Victoria Tatiana,Desintonio Malave,VickyDesintonio,estudiantes confiamos VickyDesintonio victoriadelapatriaUG,2019-03-23
Victoria Tatiana,Desintonio Malave,VickyDesintonio,Ayer noche recibi notificacion cnegobec mediante pretenden forma arbitraria descalificar candidatura CPCCS intento impedir VictoriaDeLaPatria digo nuevo obstaculo venceremos juntos GanaremosEcuador,2019-03-23
Victoria Tatiana,Desintonio Malave,VickyDesintonio,menos horas elecciones cnegobec abre proceso candidata Consejo Participacion Ciudadana VickyDesintonio podria descalificar postulacion Elecciones2019,2019-03-23
Victoria Tatiana,Desintonio Malave,VickyDesintonio,VickyDesintonio cnegobec oficial Almagro OEA2015 KevinCasasZ leonelaacf DianeRodriguezZ estrella AuraCarrilloUn JoseValdiviezoF Feue Guayaquil AnaPaulaAzanza Fuerza Victoria sola pueblo contigo domingo voto,2019-03-23
Victoria Tatiana,Desintonio Malave,VickyDesintonio,VickyDesintonio cnegobec oficial Almagro OEA2015 KevinCasasZ leonelaacf DianeRodriguezZ estrella AuraCarrilloUn JoseValdiviezoF Feue Guayaquil AnaPaulaAzanza Victoria Democracia cuentas voto,2019-03-23
Victoria Tatiana,Desintonio Malave,VickyDesintonio,VickyDesintonio cnegobec oficial Almagro OEA2015 KevinCasasZ leonelaacf DianeRodriguezZ estrella AuraCarrilloUn JoseValdiviezoF Feue Guayaquil AnaPaulaAzanza Victoria total respaldo convierta atropello Adelante VictoriaDeLaPatria seras consejera CPCCS,2019-03-23
Victoria Tatiana,Desintonio Malave,VickyDesintonio,VickyDesintonio cnegobec oficial Almagro OEA2015 KevinCasasZ leonelaacf DianeRodriguezZ estrella AuraCarrilloUn JoseValdiviezoF Feue Guayaquil AnaPaulaAzanza nota nerviosismo gente miedo descubra toda corrupcion ultimos anos pueblo apoya VickyDesintonio,2019-03-23
Victoria Tatiana,Desintonio Malave,VickyDesintonio,VickyDesintonio cnegobec oficial Almagro OEA2015 KevinCasasZ leonelaacf DianeRodriguezZ estrella AuraCarrilloUn JoseValdiviezoF Feue Guayaquil AnaPaulaAzanza tantas trabas hecho cnegobec candidatura unico hecho visibilizarla apoyo York cuidar votos,2019-03-23
Victoria Tatiana,Desintonio Malave,VickyDesintonio,VickyDesintonio cnegobec oficial Almagro OEA2015 KevinCasasZ leonelaacf estrella AuraCarrilloUn JoseValdiviezoF Feue Guayaquil AnaPaulaAzanza Terrible VickyDesintonio poblaciones LGBT apoyo oficial atender vulnerando derecho participacion ciudadana Ecuador,2019-03-23
Victoria Tatiana,Desintonio Malave,VickyDesintonio,ATRACO cnegobec ladrones democracia CNEEsFraude MorenoEsFraude TrujilloEsFraude,2019-03-23
Victoria Tatiana,Desintonio Malave,VickyDesintonio,EXCLUSIVO busca bajar candidatura CPCCS CPCCS elecciones estan desesperados advierte Victoria Desintonio VickyDesintonio AUDIO Entrevista,2019-03-23
Victoria Tatiana,Desintonio Malave,VickyDesintonio,cnegobec persecucion selectiva ahora quieren descalificar candidata merito propio ganado lugar CPCCS,2019-03-23
