nombre,apellidos,tweet_screen_name,tweet_text,tweet_date
Joba Aminta,Fon Fay Vasquez,jobafonfay2019,votare nulo EleccionesCPCCS apoyare Pueblos Nacionalidades Rosa Chala RosaChalaEc Mujeres Joba Fon Fay jobafonfay2019 Karina Ponce KariPonce11 Hombres Carlos Pauta carlosrpauta Hugo Ludena VICENTELUDEA1 Carlos Figueroa carlosfigueroa6,2019-02-28
Joba Aminta,Fon Fay Vasquez,jobafonfay2019,votare nulo EleccionesCPCCS apoyare Pueblos Nacionalidades Rosa Chala RosaChalaEc Mujeres Joba Fon Fay jobafonfay2019 Karina Ponce KariPonce11 Hombres Carlos Pauta carlosrpauta Hugo Ludena VICENTELUDEA1 Carlos Figueroa carlosfigueroa6,2019-02-28
Joba Aminta,Fon Fay Vasquez,jobafonfay2019,ONU derechos 7 Candidaturas Consejeros CPCCS INDEPENDIENTES ser elegidas si aceptan firmar Pacto Etico 4 COMPROMISOS SofiaAlmeidaEc jobafonfay2019 MariaCatalinaPerezAvila HernanUlloa davidroserow JamesMcpccs ChugchilanJaime,2019-02-28
Joba Aminta,Fon Fay Vasquez,jobafonfay2019,fernandobalda CPCCS LassoGuillermo HernanUlloa SofiaAlmeidaEc voto familia HernanUlloa ALANDMOLESTINAM davidroserow jobafonfay2019 SofiaAlmeidaEc Maria Catalina Perez Francisco Bravo VIVA ECUADOR CARCEL CORRUPTOS,2019-03-01
Joba Aminta,Fon Fay Vasquez,jobafonfay2019,Coincidimos Lasso derecha llaman nulo voto nulo voto candidatos provenientes organizaciones sociales Pueblos nacionalidades RosaChalaEc Mujeres KariPonce11 jobafonfay2019 Hombres CarlosPauta Hugo Ludena carlosfigueroa6,2019-03-01
Joba Aminta,Fon Fay Vasquez,jobafonfay2019,LuisLaraParedes voz ec ALANDMOLESTINAM HernanUlloa jobafonfay2019 SofiaAlmeidaEc davidroserow Aqui polla casilleros NoAlVotoNulo,2019-03-01
Joba Aminta,Fon Fay Vasquez,jobafonfay2019,voz ec RonPeper voto ALANDMOLESTINAM HernanUlloa jobafonfay2019 SofiaAlmeidaEc davidroserow Maria Catalina Perez Francisco Bravo Srs asi q llegar pueblo solo puno siete candidatos opinon respeto demas Buen viento buena mar,2019-03-01
Joba Aminta,Fon Fay Vasquez,jobafonfay2019,TamaApoyo Elige mejores VOTA 24 marzo CPCCS,2019-03-02
Joba Aminta,Fon Fay Vasquez,jobafonfay2019,voto iba ser CesarMontufar51 Esteban Moscoso HernanUlloa davidroserow Sofia Almeida Joba Fon Fay M Catalina Perez Javier Molestina F Lorenzo Bravo padron voto menos candidatos cnegobec CNEVice BorisVianII,2019-03-02
Joba Aminta,Fon Fay Vasquez,jobafonfay2019,Declaro x votare proximo CPCCS Puede equivoque aviso dando voto tendre derecho reclamarle promesas campana SofiaAlmeidaEC HernanUlloa 8 Caty jobafonfay2019 manababravo apoyoDrFigueroa alandmolestinam,2019-03-04
Joba Aminta,Fon Fay Vasquez,jobafonfay2019,gorihuela SofiaAlmeidaEc HernanUlloa 8 caty jobafonfay2019 manababravo ApoyoDrFigueroa ALANDMOLESTINAM Totalmente acuerdo 7 q pueden garantizarnos ecuanimidad CPCCS APOYO TOTALMENTE NOMBRES,2019-03-04
Joba Aminta,Fon Fay Vasquez,jobafonfay2019,verdadera participacion ciudadana impulsando valores etica acabar corrupcion,2019-03-05
Joba Aminta,Fon Fay Vasquez,jobafonfay2019,lucha conseguir liberarnos corrupcion sociedad principal compromiso llegar CPCCS haremos impulsando valores motivando participacion ciudadanos,2019-03-05
Joba Aminta,Fon Fay Vasquez,jobafonfay2019,Gracias todas organizaciones sociales pais unido apoyar candidatura dar conocer propuesta ciudadania,2019-03-06
Joba Aminta,Fon Fay Vasquez,jobafonfay2019,SofiaAlmeidaEc ChugchilanJaime davidroserow jobafonfay2019 buenas opciones lista falta solo falta doctor HernanUlloa voto 5 candidatos momento,2019-03-06
Joba Aminta,Fon Fay Vasquez,jobafonfay2019,CorporacionGES ONU derechos ONUMujeres onumujeresEcu KariPonce11 SofiaAlmeidaEc jobafonfay2019 NemySantacruz KarinaEsMiVoz,2019-03-06
Joba Aminta,Fon Fay Vasquez,jobafonfay2019,Acompane hoy Coalicion Nacional Organizaciones Movimientos Sociales presentar denuncia CNE detener campana sucia Guillermo Lasso candidatos CPCCS,2019-03-07
Joba Aminta,Fon Fay Vasquez,jobafonfay2019,invitados hoy conversatorio ITBolivariano hablaremos CPCCS TuParticipacionEsLaSolucion JaimeChugchilanEsParticipacion,2019-03-08
Joba Aminta,Fon Fay Vasquez,jobafonfay2019,eps red hijadeivan shababaty JusticeVeraEC CarlosVerareal ramirogarciaf Lenin FRM87 economista33 luisevivanco DrRobertoLopez2 jobafonfay2019 TamaApoyo jcarlostuarez CarlosEscuderoS GorkiAguirreT ingcarlosville1 fernandobalda VOTAR CPCCS Ecuador elije,2019-03-08
Joba Aminta,Fon Fay Vasquez,jobafonfay2019,Fernand49222209 carlosjijon Fernando talvez vieja igual mama parientes mujer principios rabo paja decir pienso siento invito seguirme jobafonfay2019 gracias comentario interes,2019-03-10
Joba Aminta,Fon Fay Vasquez,jobafonfay2019,OscarAyerve RicardoRivasBr carlosfigueroa6 jcarlostuarez SofiaAlmeidaEc manababravo TVCEcuador Gracias considerar nombre servicio ecuatorianos candidata coalicion organizaciones movimientos sociales luchando usted toda vida vida debe ser defraudada hare,2019-03-10
Joba Aminta,Fon Fay Vasquez,jobafonfay2019,m visita Guayaquil gusto poder compartir ideas jobafonfay2019 mujer comprometida luchas sociales Gracias espacio calidez,2019-03-10
Joba Aminta,Fon Fay Vasquez,jobafonfay2019,Gracias calidez querida jobafonfay2019 juntos llegaremos CPCCS combatir corrupcion,2019-03-10
Joba Aminta,Fon Fay Vasquez,jobafonfay2019,Elecciones7ConsejerosCPCCS potenciar Fortalecimiento Institucional CPCCS VotoMujerJuventudINDEPENDIENTE sera HernanUlloa davidroserow JamesMcpccs KariPonce11 SofiaAlmeidaEc jobafonfay2019 ChugchilanJaime,2019-03-10
Joba Aminta,Fon Fay Vasquez,jobafonfay2019,recibido CNE formularios recoleccion firmas propuesta Ley Iniciativa Popular Normativa derogar pensiones vitalicias Si deseas apoyar causa escriba jovitafonfay gmail com,2019-03-12
Joba Aminta,Fon Fay Vasquez,jobafonfay2019,cvsimport 2015 NemySantacruz CorporacionGES ChugchilanJaime SofiaAlmeidaEc KariPonce11 HernanUlloa davidroserow JamesMcpccs,2019-03-12
Joba Aminta,Fon Fay Vasquez,jobafonfay2019,Mujeres KariPonce11 SofiaAlmeidaEc jobafonfay2019 Hombres HernanUlloa davidroserow JamesMcpccs Pueblos Nacionalidades ChugchilanJaime Miguel Ernesto Santacruz Paredes ceomespecuador Autor Propuesta Representante Legal CorporacionGES,2019-03-12
Joba Aminta,Fon Fay Vasquez,jobafonfay2019,mgvelardet lavajatoec Debemos votar positivo candidatos anti correistas creo jaimenebotsaadi apoye jobafonfay2019 sabiendo presumiendo correista entreviste parece bien centrada,2019-03-14
Joba Aminta,Fon Fay Vasquez,jobafonfay2019,Entrevista FluminenseFM 101 5 FM Babahoyo jobafonfay2019 candidata CPCCS,2019-03-15
Joba Aminta,Fon Fay Vasquez,jobafonfay2019,Apoya firma terminar pensiones vitalicias cobran expresidentes exvicepresidentes NoMasPrivilegios NoMasCorrupcion,2019-03-15
Joba Aminta,Fon Fay Vasquez,jobafonfay2019,CorporacionGES CarlosP45782513 KariPonce11 SofiaAlmeidaEc HernanUlloa davidroserow JamesMcpccs ChugchilanJaime ceomespecuador Apoya firma terminar pensiones vitalicias cobran expresidentes exvicepresidentes NoMasPrivilegios NoMasCorrupcion,2019-03-15
Joba Aminta,Fon Fay Vasquez,jobafonfay2019,RonPeper OscarAyerve RicardoRivasBr carlosfigueroa6 jcarlostuarez SofiaAlmeidaEc manababravo TVCEcuador dicho voy revisar hecho transitorio cosas buenas evaluacion cesacion autoridades bien preservarlo,2019-03-16
Joba Aminta,Fon Fay Vasquez,jobafonfay2019,jorgef18 RonPeper OscarAyerve RicardoRivasBr carlosfigueroa6 jcarlostuarez SofiaAlmeidaEc manababravo TVCEcuador Gracias haberme escuchado seguridad sabe dicho voy revisar hecho transitorio cosas buenas evaluacion cesacion autoridades bien preservarlo Gracias opiniones,2019-03-16
Joba Aminta,Fon Fay Vasquez,jobafonfay2019,Fernand49222209 OscarAyerve colbertgame62 RicardoRivasBr carlosfigueroa6 jcarlostuarez SofiaAlmeidaEc manababravo TVCEcuador Nunca sido sere correista mujer principios valores jamas participado hecho negocios turbos ninguna persona jamas participado negocios gobierno,2019-03-16
Joba Aminta,Fon Fay Vasquez,jobafonfay2019,FOSPEecu jcarlostuarez CarlosEscuderoS jobafonfay2019 TamaApoyo eps red joesgu ingcarlosville1 manabi noticias,2019-03-16
Joba Aminta,Fon Fay Vasquez,jobafonfay2019,CorporacionGES HernanUlloa davidroserow JamesMcpccs ChugchilanJaime KariPonce11 SofiaAlmeidaEc apoyar Objetivos Desarrollo Sostenible,2019-03-17
Joba Aminta,Fon Fay Vasquez,jobafonfay2019,Gracias personas organizaciones Ecuador USA Europa expresiones apoyo defraudare confianza hare mejor posible tener CpccsSinamarresNiComponendas independiente autonomo autoridades control elegidas transparentemente,2019-03-17
Joba Aminta,Fon Fay Vasquez,jobafonfay2019,Josernandez1 nuevo CPCCS sera independiente autonomo partidos gobiernos caudillos compromiso Mujer principios valores jobafonfay2019 economista33,2019-03-17
Joba Aminta,Fon Fay Vasquez,jobafonfay2019,c larreategui CPCCS Senor c larreategui nuevo CPCCS sera independiente autonomo partidos gobiernos caudillos compromiso Mujer principios valores jobafonfay2019 Si vamos consulta vamos nuevamente ganar 4 Febrero 2018,2019-03-17
Joba Aminta,Fon Fay Vasquez,jobafonfay2019,diegoJfranco nuevo CPCCS sera independiente autonomo partidos gobiernos caudillos compromiso Mujer principios valores jobafonfay2019 diegoJfranco osvaldohurtado1,2019-03-17
Joba Aminta,Fon Fay Vasquez,jobafonfay2019,jobafonfay2019 Adelante Doctora Fon Fay trayectoria dice pais requiere Consejo Participacion Ciudadana personas nobles acostumbrado servicio integral comunidad,2019-03-18
Joba Aminta,Fon Fay Vasquez,jobafonfay2019,jamas sere correista,2019-03-19
Joba Aminta,Fon Fay Vasquez,jobafonfay2019,Dr DavidMontece JCTrujilloCPCCS diegoordonezg jaimenebotsaadi sido sancionada notificada presunta infraccion electoral presentamos descargo seguimos contienda Gracias apoyos valoro hace comprometer mas ciudadania organizaciones sociales,2019-03-19
Joba Aminta,Fon Fay Vasquez,jobafonfay2019,sido sancionada notificada presunta infraccion electoral presentamos descargo seguimos contienda Gracias apoyos valoro hace comprometer mas ciudadania organizaciones sociales,2019-03-19
Joba Aminta,Fon Fay Vasquez,jobafonfay2019,LuisLaraParedes SofiaAlmeidaEc Gracias confianza notificada presunta infraccion electoral presentamos descargo seguimos contienda Gracias apoyos valoro hace comprometer mas ciudadania organizaciones sociales,2019-03-19
Joba Aminta,Fon Fay Vasquez,jobafonfay2019,clandiv OscarAyerve RicardoRivasBr carlosfigueroa6 jcarlostuarez SofiaAlmeidaEc manababravo TVCEcuador notificada presunta infraccion electoral presentamos descargo seguimos contienda Gracias apoyos valoro hace comprometer mas ciudadania organizaciones sociales,2019-03-19
Joba Aminta,Fon Fay Vasquez,jobafonfay2019,rafaco8 ALANDMOLESTINAM FaustoRLuperaM SofiaAlmeidaEc Gracias confianza Gracias confianza apoyos valoro hace comprometer mas ciudadania organizaciones sociales,2019-03-19
Joba Aminta,Fon Fay Vasquez,jobafonfay2019,jobafonfay2019 galobonifaz Doctora seguido trayectoria merece reconocimiento detractores siempre falacias Acabo ver video Dr Andres Paez ex presidente Lucio Gutierrez ponderan nombre suficiente Votare usted,2019-03-19
Joba Aminta,Fon Fay Vasquez,jobafonfay2019,jobafonfay2019 Sigue adelante Jobita lucha recien empieza pais necesita gente honesta ud total respaldo,2019-03-19
Joba Aminta,Fon Fay Vasquez,jobafonfay2019,jobafonfay2019 Tranquila amiga jobafonfay2019 tanta persecucion impedir llegues CPCCS TodosEstamosContigoFonFay,2019-03-19
Joba Aminta,Fon Fay Vasquez,jobafonfay2019,jobafonfay2019 Total Respaldo Companera amiga DRA JOBA FONFAY atentos Felicitaciones comprometida Pueblo FOSPE Ing Carlos Villegas Cruz,2019-03-19
Joba Aminta,Fon Fay Vasquez,jobafonfay2019,jobafonfay2019 si nuevas cadenas preparan TodosEstamosContigoFonFay,2019-03-19
Joba Aminta,Fon Fay Vasquez,jobafonfay2019,Tranquila amiga jobafonfay2019 tanta persecucion impedir llegues CPCCS TodosEstamosContigoFonFay,2019-03-19
Joba Aminta,Fon Fay Vasquez,jobafonfay2019,davidroserow decidi votar 24 marzo candidatos CPCCS HernanUlloa RicardoRivasBr SofiaAlmeidaEc jobafonfay2019 MariaCatalinaPerez FranciscoBravo,2019-03-20
Joba Aminta,Fon Fay Vasquez,jobafonfay2019,CANDIDATOS HernanUlloa ALANDMOLESTINAM FranklinMorenoM jobafonfay2019 SofiaAlmeidaEc Maria Catalina Perz Francisco Bravo,2019-03-20
Joba Aminta,Fon Fay Vasquez,jobafonfay2019,Asi prepara CNE recibir aliado JuanPabloPozoB gracias complicidad politicos oportunistas observado NoAnulesTuVoto VillaFernando carlosfigueroa6 ALANDMOLESTINAM jobafonfay2019 SofiaAlmeidaEc perezmariacata2,2019-03-20
Joba Aminta,Fon Fay Vasquez,jobafonfay2019,FaustoLupera PabloPonce jobafonfay2019,2019-03-20
Joba Aminta,Fon Fay Vasquez,jobafonfay2019,miren link Facebook difundan debemos anular voto CPCCS PabloRicaurte73 HernanUlloa UlloaAsoCom SofiaAlmeidaEc LuisAlmeidaM gervasachi ChristianCruzLa ChugchilanJaime jobafonfay2019 Lisset EstradaC,2019-03-20
Joba Aminta,Fon Fay Vasquez,jobafonfay2019,chrisviteri HernanUlloa davidroserow ChugchilanJaime,2019-03-20
Joba Aminta,Fon Fay Vasquez,jobafonfay2019,byronalberivad2 EdgarEscobarVi3 galobonifaz Buenas tardes gracias opinion valiosa sido correista mujer principios apoyo bueno critico propositivamente malo Nunca dicho anulare hecho CPCCS transitorio,2019-03-20
Joba Aminta,Fon Fay Vasquez,jobafonfay2019,Manana entrevista ecuavisa invito escuchar propuestas,2019-03-20
Joba Aminta,Fon Fay Vasquez,jobafonfay2019,GINOMAQUILON chrisviteri HernanUlloa davidroserow ChugchilanJaime Gracias confianza defraudaremos haremos mejor posible,2019-03-20
Joba Aminta,Fon Fay Vasquez,jobafonfay2019,raulmoravicuna PabloRicaurte73 HernanUlloa UlloaAsoCom SofiaAlmeidaEc LuisAlmeidaM gervasachi ChristianCruzLa ChugchilanJaime Lisset EstradaC Gracias defraudare confianza,2019-03-20
Joba Aminta,Fon Fay Vasquez,jobafonfay2019,FOSPEecu jobafonfay2019 jcarlostuarez CarlosEscuderoS TamaApoyo IngCarlosVille2 GorkiAguirreT Expresoec eluniversocom,2019-03-21
Joba Aminta,Fon Fay Vasquez,jobafonfay2019,LuisLaraParedes HernanUlloa ALANDMOLESTINAM FranklinMorenoM jobafonfay2019 SofiaAlmeidaEc,2019-03-21
Joba Aminta,Fon Fay Vasquez,jobafonfay2019,ENVIDEO jobafonfay2019 candidata Cpccs ira tras rastro capitales fugados,2019-03-21
Joba Aminta,Fon Fay Vasquez,jobafonfay2019,Sabes candidatas CPCCS presentamos lista candidatas partir casillero 1 5 mujeres constaran papeleta monka78 jobafonfay2019 mrivadeneirac GinaAguilarEc DemocraciaEs VotoInformadoCPCCS,2019-03-21
Joba Aminta,Fon Fay Vasquez,jobafonfay2019,apoyo SofiaAlmeidaEc jobafonfay2019,2019-03-21
Joba Aminta,Fon Fay Vasquez,jobafonfay2019,amandaasubiar LA6MDG RicardoRivasBr davidroserow jobafonfay2019 cnegobec Srs cnegobec tambien notificados,2019-03-23
Joba Aminta,Fon Fay Vasquez,jobafonfay2019,Mismos candidatos encuentran promocionados partido LA6MDG Junto RicardoRivasBr davidroserow jobafonfay2019 Marcos Molina Maria Chala Maria Perez Teddy Tama Jaime Chugchillan Senores cnegobec notificado amenazando descalificarlos,2019-03-23
Joba Aminta,Fon Fay Vasquez,jobafonfay2019,opcion mujeres CPCCS tambien Joba Fon Fay aqui hoja vida ademas insigne luchadora corrupcion mas suficiente jobafonfay2019,2019-03-24
Joba Aminta,Fon Fay Vasquez,jobafonfay2019,VeroGaby Hombres DMarcosmolina FranklinMorenoM HernanUlloa TamaApoyo carlosfigueroa6 Mujeres SofiaAlmeidaEc jobafonfay2019 Catalina Perez pueblos nacionalidades davidroserow RosaChalaEc Francisco Bravo Jaime Chugchilan,2019-03-24
Joba Aminta,Fon Fay Vasquez,jobafonfay2019,GRACIAS confianza Sali ejerciendo derecho elegir ser elegida,2019-03-24
Joba Aminta,Fon Fay Vasquez,jobafonfay2019,Grato encontrarme madre hija gianella ayude venir mundo hace 15 anos siento bendecida,2019-03-24
Joba Aminta,Fon Fay Vasquez,jobafonfay2019,Hoy restaurante cajape Chinita chaleco amarillo reconocida meseros familias presentes dijeron habian votado hoy manana,2019-03-24
Joba Aminta,Fon Fay Vasquez,jobafonfay2019,Apoya firma terminacion pensiones vitalicias exmandatarios NoMasPrivilegiosExMandatarios nomascorrupcion,2019-04-02
Joba Aminta,Fon Fay Vasquez,jobafonfay2019,RECOLECCION FIRMAS TERMINAR PENSIONES VITALICIAS EXMANDATARIOS APOYO PAIS Ciudadanos varias provincias organizado recoger firmas apoyo terminacion pensiones vitalicias exmandatarios nomasprivilegiosexmandatarios,2019-04-05
Joba Aminta,Fon Fay Vasquez,jobafonfay2019,golkof Claro gusto favor escriba mail nomasprivilegiosexmandatarios gmail com enviamos toda informacion Gracias civico interes,2019-04-13
