nombre,apellidos,tweet_screen_name,tweet_text,tweet_date
Walter Javier,Gomez Ronquillo,wgomezr,Comparto ustedes Agenda actividades Canar Azuay manana martes,2019-02-19
Walter Javier,Gomez Ronquillo,wgomezr,manzanitas lograremos mejores dias,2019-02-19
Walter Javier,Gomez Ronquillo,wgomezr,Entrevista Semanario Impulsare conformacion veedurias ciudadanas evaluen fiscalicen Transitorio autoridades financieras caso paren concesiones empresas publicas,2019-02-19
Walter Javier,Gomez Ronquillo,wgomezr,Entrevista Radio Genesis Azogues prov Canar plan trabajo sido hecho base necesidades ciudadania,2019-02-19
Walter Javier,Gomez Ronquillo,wgomezr,Entrevistado Martha Calle evaluacion sera dado ciudadania indicaran pasos seguir partir mayo 2019,2019-02-19
Walter Javier,Gomez Ronquillo,wgomezr,Entrevistado ciudad Cuenca prov Azuay pugnas vocales electos Trujillo seguridad Transparencia comicios dignidad deben renunciar,2019-02-19
Walter Javier,Gomez Ronquillo,wgomezr,Cafe Parque Cuenca prov Azuay Recomendado lindo lugar,2019-02-19
Walter Javier,Gomez Ronquillo,wgomezr,Lideres organizacionales urbanos rurales prov Azuay apoyando candidatura AVANZANDO,2019-02-20
Walter Javier,Gomez Ronquillo,wgomezr,Felicitaciones Juan Xavier,2019-02-20
Walter Javier,Gomez Ronquillo,wgomezr,gente solo critican quieren amamos animales hagamos trabajo municipios exponemos creen reditos politicos simplistas mentes,2019-02-20
Walter Javier,Gomez Ronquillo,wgomezr,Solo saber haces bienestar animal ensenes hacer,2019-02-20
Walter Javier,Gomez Ronquillo,wgomezr,Muchas gracias entonces debido trabajo invitare apoyes todas gestiones impulsar normativas impulsare CPCCS,2019-02-20
Walter Javier,Gomez Ronquillo,wgomezr,Amig explico CPCCS impulsa creacion normativas ordenanzas objetivo poder tener proyectos bienestar animal beneficiar sociales mejoramiento animales debemos hacer juntos juntas,2019-02-20
Walter Javier,Gomez Ronquillo,wgomezr,Amigo juzgues conocerme trata posible primero saber tildarme descalificarme,2019-02-20
Walter Javier,Gomez Ronquillo,wgomezr,Gracias amigo siempre positivo apreciaciones actos gracias nuevamente,2019-02-20
Walter Javier,Gomez Ronquillo,wgomezr,Amigo parece comprendes modos invitado participar partir posesion seria mayo,2019-02-20
Walter Javier,Gomez Ronquillo,wgomezr,Radio Benemerita Santa Rosa prov Dejemos tener actitudes simplistas Presidente lider social politico agrade propuesta permito etiqueten quieran sumarse propuesta BIENVENIDOS nueva,2019-02-20
Walter Javier,Gomez Ronquillo,wgomezr,Santa Rosa visitando medios comunidad,2019-02-20
Walter Javier,Gomez Ronquillo,wgomezr,miercoles 2019 mecanismos control vitales vigilar recursos publicos impulsara Walter Gomez llegar,2019-02-20
Walter Javier,Gomez Ronquillo,wgomezr,Felicidades profesionales buscan justicia,2019-02-20
Walter Javier,Gomez Ronquillo,wgomezr,representantes Federacion Nacional Pescadores Artesanales Puerto Bolivar prov apoyo sera incondicional nuevo pescadores artesanales activaremos varios mecanismos exigibilidad,2019-02-20
Walter Javier,Gomez Ronquillo,wgomezr,Reunion Consejo Parroquial Puerto Jely Canton Santa Rosa prov obras Canton deben vigiladas evitar corrupcion invito traves Walter Gomez logremos unidad,2019-02-20
Walter Javier,Gomez Ronquillo,wgomezr,Puerto Jely rincon turistico Santa Rosa fieles devotos Virgen Cisne GRACIAS APOYO,2019-02-20
Walter Javier,Gomez Ronquillo,wgomezr,gran saludo Amazonia tierra guerrera ORGULLO ECUATORIANO,2019-02-21
Walter Javier,Gomez Ronquillo,wgomezr,Gracias Tierra sagrada misteriosa acogida apoya propuesta trabajo ustedes ustedes trabajare ahinco dedicacion bella Amazonia,2019-02-21
Walter Javier,Gomez Ronquillo,wgomezr,Inicio jueves pidiendole Dios bendiga proteja seres Amen,2019-02-21
Walter Javier,Gomez Ronquillo,wgomezr,Minutos entrevista Radio Infinito Santa Rosa prov,2019-02-21
Walter Javier,Gomez Ronquillo,wgomezr,Entrevista enamore beneficio ciudadano candidato lograre union banderas politicas discriminacion siempre apegado Constitucion,2019-02-21
Walter Javier,Gomez Ronquillo,wgomezr,Diario Correo Machala prov plan ejes estan basado necesidades ciudadania estan invitados involucrarse bienestar Ecuador,2019-02-21
Walter Javier,Gomez Ronquillo,wgomezr,Entrevistado Machala prov Lograremos apoyo ciudadania redireccionar Ecuador hacer ciudadano nuevamente poder,2019-02-21
Walter Javier,Gomez Ronquillo,wgomezr,Machala prov compromiso ciudadania conciencia venta cumplire gente lograra gran cambio Ecuador,2019-02-21
Walter Javier,Gomez Ronquillo,wgomezr,Entrevista Noticiero Machala prov Asambleas locales parroquiales cantonales provinciales seran Punto importante gestion,2019-02-21
Walter Javier,Gomez Ronquillo,wgomezr,Conversatorio lideres sociales prov,2019-02-22
Walter Javier,Gomez Ronquillo,wgomezr,solidaridad Morona Santiago Guayas espero todas esten bien tierra hace entender,2019-02-22
Walter Javier,Gomez Ronquillo,wgomezr,Comparto agenda viernes 2019 prov Guayas,2019-02-22
Walter Javier,Gomez Ronquillo,wgomezr,Entrevista Daule Vision canal compromiso Ecuador elegiremos consejeros tendre votos gente pensamiento positivo desean cambiar pais,2019-02-22
Walter Javier,Gomez Ronquillo,wgomezr,plan trabajo basado necesidades ecuatorianos estan cansados politiqueros devolveremos PODER ciudadanos quieren pais unido,2019-02-22
Walter Javier,Gomez Ronquillo,wgomezr,Entrevista programa USTED CREE ciudadania sera encargada legitimar actuado momento transitorio guste actual presidente,2019-02-22
Walter Javier,Gomez Ronquillo,wgomezr,Entrevista puedo evitar lider politico social agrade propuesta trabajo voto exhorto sumen hagan,2019-02-22
Walter Javier,Gomez Ronquillo,wgomezr,Conversatorio ciudadano Floresta Guayaquil prov Guayas ciudad debe organizarse jamas permitir atropelle derechos,2019-02-22
Walter Javier,Gomez Ronquillo,wgomezr,evitar desinformacion clara intencion desestabilizacion violacion Constitucion incremente promocion rincones Ecuador BRIGADAS SPOTS tecnicos territorio,2019-02-23
Walter Javier,Gomez Ronquillo,wgomezr,Charla estudiantes universitarios Guayaquil ente promueve verdadera ciudadania fomentan voto nulo simples zombies politiqueros,2019-02-23
Walter Javier,Gomez Ronquillo,wgomezr,Conversatorio moradores Monte Sinai Debemos activar varios mecanismos control exigibilidad patrocinados mejorar condiciones vida,2019-02-24
Walter Javier,Gomez Ronquillo,wgomezr,podemos sumar mentalmente utilicemos calculadora computadora Excel averiado mejor dejen nuevo legitimo PAREN CONCURSOS,2019-02-24
Walter Javier,Gomez Ronquillo,wgomezr,Comparto ustedes agenda tierra caliente verde devolverle,2019-02-25
Walter Javier,Gomez Ronquillo,wgomezr,Construire diferente transparente cientos miles ninos ninas adolescentes COMPROMISO ECUATORIANO,2019-02-25
Walter Javier,Gomez Ronquillo,wgomezr,Gracias apoyo cosechando camino Walter Gomez encuentras Casillero papeleta hombres,2019-02-25
Walter Javier,Gomez Ronquillo,wgomezr,Previa entrevista Telemar Esmeraldas prov Esmeraldas,2019-02-25
Walter Javier,Gomez Ronquillo,wgomezr,Telecosta Canal Esmeraldas prov Esmeraldas lucha corrupcion tarea consejeros nuevo alguno alineado lucha estara fiscalizado ciudadania,2019-02-25
Walter Javier,Gomez Ronquillo,wgomezr,Radio Polanco Stereo Esmeraldas Detras voto nulo zombies politiqueros importa necesidades ciudadania politicos doble moral aplastarlos voto consciente,2019-02-25
Walter Javier,Gomez Ronquillo,wgomezr,postura sera positiva apoyare candidatos autoridades acojan necesidades aportes ciudadanos jamas candidatos apoyados zombies politiqueros Basta atropellos pueblo necesitamos Patria nueva,2019-02-25
Walter Javier,Gomez Ronquillo,wgomezr,Articulo,2019-02-25
Walter Javier,Gomez Ronquillo,wgomezr,Radio amigo Esmeraldas concursos meritos actuales vergonzosos estan tiempo paren procesos manosos participacion ciudadania,2019-02-25
Walter Javier,Gomez Ronquillo,wgomezr,amigo valido voto menos solo caso papeleta pueblos solo,2019-02-25
Walter Javier,Gomez Ronquillo,wgomezr,Vayamos patriotismo conciencia familia presente futuro lograr Ecuador inclusivo democracia participativa respeto diferencias VOTEMOS CANDIDATOS DEMUESTREN AMOR ECUADOR,2019-02-26
Walter Javier,Gomez Ronquillo,wgomezr,carino sinceridad elabore video amigos seguidores DEVOLVERLE PODER CIUDADANOS ECUADOR,2019-02-26
Walter Javier,Gomez Ronquillo,wgomezr,prov Esmeraldas ejes fortalecer sera crear campana promocion involucrar medios comunicacion responsabilidad social,2019-02-26
Walter Javier,Gomez Ronquillo,wgomezr,Radio Comunitaria Chachi prov Esmeraldas respetuoso Constitucion apoyare toda iniciativa ciudadana lograr avanzar DDHH exigibilidad,2019-02-26
Walter Javier,Gomez Ronquillo,wgomezr,Entrevista Stereo Quininde Canton Quininde prov Esmeraldas luchas sociales seran patrocinadas avaladas principio institucion,2019-02-26
Walter Javier,Gomez Ronquillo,wgomezr,Entrevista Radio Maranon prov Esmeraldas Quininde debe activar mecanismos Control exigir obra publica nueva administracion incentivara Escuela formacion Participacion,2019-02-26
Walter Javier,Gomez Ronquillo,wgomezr,Jordy Zambrano Quininde prov Esmeraldas propuesta basada necesidades ciudadania incluiran todas tendencias politicas sociales,2019-02-26
Walter Javier,Gomez Ronquillo,wgomezr,Entrevista Radio Yumbo parroquia Union prov Esmeraldas velara transparencia inclusion reinvindicacion DDHH metida mano politiqueros atentan derecho participacion control,2019-02-26
Walter Javier,Gomez Ronquillo,wgomezr,Entrevista Radio Colorado prov Santo Domingo Tsachilas cumplido mandato tiempos acciones solo perseguido cesado debido proceso,2019-02-27
Walter Javier,Gomez Ronquillo,wgomezr,Santo Domingo Tsachilas Bomboli mirador espectacular HERMOSA CIUDAD,2019-02-27
Walter Javier,Gomez Ronquillo,wgomezr,comuna Timbre Mateo prov Esmeraldas ciudadan Timbre deben exigir obras Alcalde bajo respaldo nuevo conformara Escuela Formacion participacion,2019-02-27
Walter Javier,Gomez Ronquillo,wgomezr,Respondiendo invitacion ciudadania Esmeraldena hablando competencias,2019-02-27
Walter Javier,Gomez Ronquillo,wgomezr,Entrevista Canal Telemar prov Esmeraldas perdio tiempo odios persecucion perdio legitimidad legalidad,2019-02-27
Walter Javier,Gomez Ronquillo,wgomezr,Apoyo total campana impulsare campana Municipios ordenanza proteccion animal,2019-02-27
Walter Javier,Gomez Ronquillo,wgomezr,respeto pueblo Tsachila impulsare ETNOEDUCACION conocimiento historia pueblos etnias tradiciones cultura logros enriquecen,2019-02-27
Walter Javier,Gomez Ronquillo,wgomezr,Tsara Santo domingo Tscahila empezamos Radio Comunitaria SombaPamin potestad activar veeduria presupuesto maneja Presidente Republica darle transparencia gestion,2019-02-27
Walter Javier,Gomez Ronquillo,wgomezr,Agradecimiento constante pueblo aguerridoTsachilas fomentan integracion solidaridad equidad patriotismo orgullo nacional,2019-02-27
Walter Javier,Gomez Ronquillo,wgomezr,Santo Domingo Tsachilas propuesta fortalece unica institucion promueve derecho participacion control publico zombies politiqueros Voto nulo interesa ciudadano,2019-02-27
Walter Javier,Gomez Ronquillo,wgomezr,Entusiasmado alegre dirigiendome comunas Tsachilas llamada Chiguilpe visitare Centro Cultural Yupi,2019-02-27
Walter Javier,Gomez Ronquillo,wgomezr,Recorrido costumbres tradiciones parte Henry Calazacon Museo Etnografico Tsachila COMPROMISO CIUDADANO llegar,2019-02-27
Walter Javier,Gomez Ronquillo,wgomezr,Practicando eliminar corrupcion jajaja solo practicando punteria,2019-02-27
Walter Javier,Gomez Ronquillo,wgomezr,Trujillo Transitorios gracias recomendacion ciudadania pide REVISAR EVALUAR ACTUADO ejecutado Constitucion enderezar barco COMPADRES PANITAS,2019-02-27
Walter Javier,Gomez Ronquillo,wgomezr,Radio Matovelle Santo Domingo Tsachilas respaldo institucional Fundamental Vida Libre Fulev Yunta tambien estan sumando Afros jovenes Indigenas gremios profesionales,2019-02-27
Walter Javier,Gomez Ronquillo,wgomezr,Parece dado cuenta ENTE TRANSITORIO pueblo elegira definitivo desliz origino ejecutivo llegan legitimos Veamos dice pueblo EVALUAR RECTIFICAR,2019-02-28
Walter Javier,Gomez Ronquillo,wgomezr,Conversatorio poblacion LGBTI Santo Domingo Tsachilas poblaciones vulnerables derechos deben parte importante debe apoyar construccion normativas territoriales,2019-02-28
Walter Javier,Gomez Ronquillo,wgomezr,Santo Domingo Tsachilas cumplido verdadera mision promocionar proceso debidamente quedo grande puesto igual atentos,2019-02-28
Walter Javier,Gomez Ronquillo,wgomezr,Entrevista Santo Domingo Tsachilas debe volverse ente sancionador sirva ciudadania ello propuesta reforma vital,2019-02-28
Walter Javier,Gomez Ronquillo,wgomezr,Entrevistado Santo Domingo Tsachilas gestion estara basada transparencia objetividad inclusion tener institucion operativa ayude realmente ciudadania,2019-02-28
Walter Javier,Gomez Ronquillo,wgomezr,Constitucion manda numeral discriminacion ninguna razon institucion acoje sectores luchara respeto DDHH Todas,2019-02-28
Walter Javier,Gomez Ronquillo,wgomezr,encima resoluciones institucion estatal encima todas leyes poderes politicos economicos Constitucion HORA TODAS RESPETEMOS NORMA MAXIMA tambien digo celan justicia,2019-02-28
Walter Javier,Gomez Ronquillo,wgomezr,Stock Domingo Tsachilas actuado revisara hara sera misma ciudadania rectificar hara miedos presiones,2019-02-28
Walter Javier,Gomez Ronquillo,wgomezr,amigo Domingo Tsachilas precio conversatorio pepudos Force,2019-02-28
Walter Javier,Gomez Ronquillo,wgomezr,Conversatorio Force Domingo gran responsabilidad votar informados patriotismo,2019-03-01
Walter Javier,Gomez Ronquillo,wgomezr,ganar voto nulo unico lograria volver llamar elecciones mismos candidatos Seria desperdicio recursos Guayaquil,2019-03-01
Walter Javier,Gomez Ronquillo,wgomezr,Comparto agenda actividades hospitalaria pujante Manabi,2019-03-01
Walter Javier,Gomez Ronquillo,wgomezr,Portoviejo prov Manabi cumplido mandato ciudadano sera evaluado misma ciudadania llegar veremos corregir complices caos pais,2019-03-01
Walter Javier,Gomez Ronquillo,wgomezr,Rico encebollado manaba empezar activo Reeeco Pilas,2019-03-01
Walter Javier,Gomez Ronquillo,wgomezr,Contento Portoviejo Manabi super pilas,2019-03-01
Walter Javier,Gomez Ronquillo,wgomezr,Radio Gregorio Univ Gregorio Portoviejo prov Manabi Manabi probado verdadero poder conformar consejos barriales hizo Transitorio,2019-03-01
Walter Javier,Gomez Ronquillo,wgomezr,Entrevista Manabi Apoyare companer discapacidad fortaleciendo Observatorios discapacidad redireccionamiento fortaleza,2019-03-01
Walter Javier,Gomez Ronquillo,wgomezr,Entrevistado Portoviejo Manabi provincia apoyara cambio traves consejeria devolveremos poder ciudadano Confio hermanos Manabi,2019-03-01
Walter Javier,Gomez Ronquillo,wgomezr,fortalezas haber aprendido amar seres leales amorosos toda vida dedican servir humano Gracias Dios permitirme respetar amar angeles cuidadores,2019-03-01
Walter Javier,Gomez Ronquillo,wgomezr,Entregue petitorio dirigido Delegacion Manabi aclarar Escrutinio votos Designacion delegados Manera escrutar votos,2019-03-01
Walter Javier,Gomez Ronquillo,wgomezr,Entrevista Diario Hora,2019-03-01
Walter Javier,Gomez Ronquillo,wgomezr,pasos Manabi gratificante pueblo informado pueblo derechos,2019-03-02
Walter Javier,Gomez Ronquillo,wgomezr,Seguimos Higueron Rocafuerte Manabi inolvidable carino admiracion gente pueblo FUERZA SALTAR OBSTACULOS,2019-03-02
Walter Javier,Gomez Ronquillo,wgomezr,Manabi sinonimo lucha orgullo pasion patriotismo union soberania VIVA MANABI CARAJOOOO,2019-03-02
Walter Javier,Gomez Ronquillo,wgomezr,Comparto agenda Sabado Marzo Manabi,2019-03-02
Walter Javier,Gomez Ronquillo,wgomezr,Playita conversando lideres Asociaciones comerciantes pesqueros ciudad Manta,2019-03-02
Walter Javier,Gomez Ronquillo,wgomezr,Conversatorio lideres sociales ciudadania Manabi Poder Ciudadania vital planificacion obras lograr presupuesto participativo adecuado,2019-03-02
Walter Javier,Gomez Ronquillo,wgomezr,Siguiendo pasos Eloy Alfaro visitando Ciudad Alfaro ENERGIA REVOLUCION CUNA CONSTITUCION 2008 Gracias Dios gran oportunidad recargarme energia seguir rumbo,2019-03-02
Walter Javier,Gomez Ronquillo,wgomezr,Invitado conversatorio Parroquia Sancan Jipijapa Manabi Debemos informarnos lograr impulsemos voto consciente afirmativo,2019-03-02
Walter Javier,Gomez Ronquillo,wgomezr,Entrega reconocimiento floral respetos Gral Eloy Alfaro lucha incansable verdaderos derechos ciudadanos,2019-03-02
Walter Javier,Gomez Ronquillo,wgomezr,Ciudad Alfaro cuna HONOR PISAR EMBLEMATICO LUGAR,2019-03-02
Walter Javier,Gomez Ronquillo,wgomezr,Marejada Radio Manta Manabi fortalecimiento elaborar campana promocion competencias funciones haran convenios medios comunicacion responsabilidad social,2019-03-03
Walter Javier,Gomez Ronquillo,wgomezr,Entrevista Activare veedurias nacionales Evaluar Informe dineros incautados devueltos Parar concesiones empresas publicas enfoque social,2019-03-03
Walter Javier,Gomez Ronquillo,wgomezr,Conversatorio Manos Unidas Manta Manabi designacion autoridades siempre debe vigilancia ciudadana nuevo estara apegado demostrando objetivo participativo legal inclusivo,2019-03-03
Walter Javier,Gomez Ronquillo,wgomezr,Comparto seguidores entrevista Semanario Tena prov Napo Gracias hicieron acogedora visita tierra hermosa,2019-03-03
Walter Javier,Gomez Ronquillo,wgomezr,derecho seguire luchando,2019-03-03
Walter Javier,Gomez Ronquillo,wgomezr,tambien migrantes,2019-03-05
Walter Javier,Gomez Ronquillo,wgomezr,Video promocional apoyando candidatura Recuerden primer casillero papeleta hombres,2019-03-05
Walter Javier,Gomez Ronquillo,wgomezr,,2019-03-05
Walter Javier,Gomez Ronquillo,wgomezr,Descansado optimista ganas continuar acumulando exitos Rumbo Quito,2019-03-06
Walter Javier,Gomez Ronquillo,wgomezr,Invitado Conversatorio lideres territoriales Quito debera evaluado comision transitoria debe ciudadania despejar dudas accionar,2019-03-07
Walter Javier,Gomez Ronquillo,wgomezr,Impulsare poblaciones vulneradas historicamente promuevan politicas incluyentes,2019-03-07
Walter Javier,Gomez Ronquillo,wgomezr,comprometo llegar revisar veeduria iniciativa ciudadana acreditada requisitos planteados Veamos forma tratar ciudadanos,2019-03-07
Walter Javier,Gomez Ronquillo,wgomezr,RECONOCIMIENTO JUSTICIA DESARROLLO pilares DECENIO AFRO ECUATORIANO compromiso sera retomar concepto lograr impulsar politicas inclusion respeto etnoeducacion Trabajo digno Espacios desarrollo integral,2019-03-07
Walter Javier,Gomez Ronquillo,wgomezr,recibido llamada cambio hora fecha entrevista parte olvidaron candidatos,2019-03-07
Walter Javier,Gomez Ronquillo,wgomezr,institucion encargada recoger necesidades Pueblo Afro mecanismos participacion Control herramientas concretar politicas publicas COMPROMISO,2019-03-07
Walter Javier,Gomez Ronquillo,wgomezr,Solidaridad Manabi Cantones lluvias estan pasando contratiempos problemas,2019-03-07
Walter Javier,Gomez Ronquillo,wgomezr,desayuno mucha camaraderia conocimientos lograremos activar verdaderas Veedurias mejor gusten politiqueros modo seran favor ciudadanos,2019-03-07
Walter Javier,Gomez Ronquillo,wgomezr,Quiero informar seguidores lectores servidor publico llamo pactar entrevista habian cancelado orden manana 16H00 Considero ello demuestran interesamos presion ciudadana,2019-03-08
Walter Javier,Gomez Ronquillo,wgomezr,Guayaquil prov Guayas Transitorio debe evaluado solo digo acogen candidatos hecho,2019-03-09
Walter Javier,Gomez Ronquillo,wgomezr,Triunfo prov Guayas propuesta basada ejes necesitamos nueva sirva ciudadanos actualmente deja desear,2019-03-09
Walter Javier,Gomez Ronquillo,wgomezr,Radio Triunfo prov Guayas Sere consejero nueva propuesta ciudadana basada necesidades deseos cambio devolverle Poder ciudadano,2019-03-09
Walter Javier,Gomez Ronquillo,wgomezr,Milagro prov Guayas Pediremos explicaciones incautacion dineros devolucion,2019-03-09
Walter Javier,Gomez Ronquillo,wgomezr,Milagro prov Guayas concesiones privatizaciones empresas publicas enfoque social deben parar dispone ciudadania,2019-03-09
Walter Javier,Gomez Ronquillo,wgomezr,Radio Milagro Canton Milagro Guayas respetuoso leyes Constitucion rectificaremos hecho exigen mandantes guste Transitorio,2019-03-09
Walter Javier,Gomez Ronquillo,wgomezr,Guayaquil huevada matan violan gobierno hace,2019-03-09
Walter Javier,Gomez Ronquillo,wgomezr,Invitado Conmemoracion Asociacion Abogados Afros Guayas,2019-03-09
Walter Javier,Gomez Ronquillo,wgomezr,Invitado Conversatorio Economia Popular Solidaria Pacific World Excelentes ciudadanos compromiso aportar desarrollo,2019-03-09
Walter Javier,Gomez Ronquillo,wgomezr,Debido acontecimientos actuales despidos masivos instituciones estatales urgente ACTIVAR VEEDURIA CIUDADANA VIGILAR PARAMETROS DESPIDO 13000 SERVIDORES PUBLICOS Compromiso pais,2019-03-09
Walter Javier,Gomez Ronquillo,wgomezr,,2019-03-10
Walter Javier,Gomez Ronquillo,wgomezr,Comparto ustedes Agenda manana Lunes marzo 2019 acompanenme,2019-03-10
Walter Javier,Gomez Ronquillo,wgomezr,agrado enlazarne Plataforma Migrantes Ecuatorianos oportunidad exponer Plan Fortalecimiento experiencia maravillosa conoci personas sensibles valerosas Gracias seguire luchando junto ustedes,2019-03-10
Walter Javier,Gomez Ronquillo,wgomezr,Entrevistado Luis Almeida Guayaquil gestion Transitorio quedo participacion control social lucha corrupcion designacion autoridades,2019-03-12
Walter Javier,Gomez Ronquillo,wgomezr,Milagro prov Guayas Impulsare Veeduria Nacional pediremos informe oficial devolucion dineros incautados,2019-03-12
Walter Javier,Gomez Ronquillo,wgomezr,Quiero recordarles politiqueros miedo resolveremos nueva apegados Constitucion Evaluaremos actuado Transitorio demanda ciudadania,2019-03-12
Walter Javier,Gomez Ronquillo,wgomezr,Radio Mega Vega ciudad Milagro prov Guayas demostrado trabajo objetividad servicio comunidad estan queriendo voto nulo permitiremos,2019-03-12
Walter Javier,Gomez Ronquillo,wgomezr,Encuentro fraterno conversatorio lideres lideresas diferentes organizaciones sociales equipo apoyo junto,2019-03-12
Walter Javier,Gomez Ronquillo,wgomezr,cara solo dormir horas rumbo Huaquillas espero tener exitos DECRETE,2019-03-12
Walter Javier,Gomez Ronquillo,wgomezr,Entrevista Radio Genesis Radio Fiesta Machala prov devolvera poder ciudadano guste corte,2019-03-12
Walter Javier,Gomez Ronquillo,wgomezr,Entrevista Radio Ovacion Machala prov sera evaluado rectificara actuado segun visto Constitucion,2019-03-12
Walter Javier,Gomez Ronquillo,wgomezr,Entrevista Machala prov plan fortalecer voto positivo consciente piden voto nulo simplemente quieren perjudicar pueblo,2019-03-12
Walter Javier,Gomez Ronquillo,wgomezr,Entrevistado Radio Machala prov conocimientos necesidades ciudadania deseo servir razones debo llegar Consejero,2019-03-12
Walter Javier,Gomez Ronquillo,wgomezr,Conversatorio Derecho participacion Control Social Cuerpo Bomberos Santa Rosa prov,2019-03-12
Walter Javier,Gomez Ronquillo,wgomezr,compartiendo ideas participacion ciudadana efectiva prov,2019-03-12
Walter Javier,Gomez Ronquillo,wgomezr,Conversatorio Ciudadano sector Leonor Aguilar Machala prov experiencia fascinante,2019-03-13
Walter Javier,Gomez Ronquillo,wgomezr,Dando charla competencias Escuela capacitacion Choferes profesionales ciudad Pasaje prov,2019-03-13
Walter Javier,Gomez Ronquillo,wgomezr,Entrevista Sistema Radial Cuenca prov Azuay voto nulo solo lastimarla bolsillo ecuatorianos debera llamar nuevas elecciones dias,2019-03-13
Walter Javier,Gomez Ronquillo,wgomezr,nueva impulsare continuidad DECENIO AFRO importantes compromiso presidencial gobierno CPCCS definitivo sera,2019-03-13
Walter Javier,Gomez Ronquillo,wgomezr,Invitado desayunar lider territorial amigo companero formula asesor Fabian Garcia bella Cuenca prov Azuay,2019-03-13
Walter Javier,Gomez Ronquillo,wgomezr,conocimiento quienintenta descalificarme informo sido militante seguia Correa presente propuesta tecnica mediatica aceptan promocionan fajado visitando prov Ecuador gusta mayoria,2019-03-13
Walter Javier,Gomez Ronquillo,wgomezr,Cuenca prov Azuay exigira parar privatizaciones empresas publicas enfoque social podemos permitir vender patrimonio,2019-03-13
Walter Javier,Gomez Ronquillo,wgomezr,gran honor lucir traje autoctono bella Cuenca prov Azuay,2019-03-13
Walter Javier,Gomez Ronquillo,wgomezr,Conversatorio mecanismos exigibilidad Comerciantes minoristas plaza Francisco Cuenca prov Azuay,2019-03-13
Walter Javier,Gomez Ronquillo,wgomezr,psiquiatra,2019-03-14
Walter Javier,Gomez Ronquillo,wgomezr,Conversatorio lideres barriales cantonales parroquiales organizaciones sociales Azuay debido posible nefasto bloqueo derecho participacion parte respaldan candidaturas,2019-03-14
Walter Javier,Gomez Ronquillo,wgomezr,Radio Splendid Cuenca prov Azuay pretenciones cuantos perdedores bloquear ocasionaran pueblo levante muchas perdidas economicas debe permitir,2019-03-14
Walter Javier,Gomez Ronquillo,wgomezr,Conversatorio derechos participacion control social gremios consejos barriales Gualaceo prov Azuay,2019-03-14
Walter Javier,Gomez Ronquillo,wgomezr,Jajaja inaudito increible,2019-03-14
Walter Javier,Gomez Ronquillo,wgomezr,democracia prevalecido presto pretensiones politiqueras esperamos ustedes tampoco hagan pueblo ecuatoriano pendiente decisiones,2019-03-14
Walter Javier,Gomez Ronquillo,wgomezr,Esperamos traves paso propuesta manosa Elizabeth Cabezas intentando cersenar PUEBLO VIGILA,2019-03-14
Walter Javier,Gomez Ronquillo,wgomezr,Entrega pruebas posible persecusion alteracion derechos elegir elegido pueblo vigila,2019-03-15
Walter Javier,Gomez Ronquillo,wgomezr,Denuncia presentada intento violacion derechos elegir elegido ciudad Guayaquil PERMITIRE JAMAS pueblo vigila,2019-03-15
Walter Javier,Gomez Ronquillo,wgomezr,invitado conversatorio Agricultores Canton Santa Lucia prov Guayas solicitaron llegando respaldo exigir obras territorio COMPROMISO ACEPTADO,2019-03-15
