nombre,apellidos,tweet_screen_name,tweet_text,tweet_date
Walter Javier,Gomez Ronquillo,wgomezr,primera tarea amigo muchas gracias,2019-04-07
Walter Javier,Gomez Ronquillo,wgomezr,respuesta dada estimado pueblo exige anular ilegitimo ilegal CPCCS hecho caiga peso menos caduco apestan corrupcion pura,2019-04-07
Walter Javier,Gomez Ronquillo,wgomezr,Hacer desaparecer consejo participacion mismo puntos nueva fiscal tenerla favor Trujillo,2019-04-07
Walter Javier,Gomez Ronquillo,wgomezr,Estimado Walter primer,2019-04-07
Walter Javier,Gomez Ronquillo,wgomezr,favor lcdo Ayudenos recuperar Derecho tanta falta hace garantias ningun area salud laboral judicial peor legislativo ejecutivo Merced opinion,2019-04-07
Walter Javier,Gomez Ronquillo,wgomezr,Bueno veces,2019-04-07
Walter Javier,Gomez Ronquillo,wgomezr,auditen cuanto gestion arrogo funciones competen implacable Walter hora alguien pare mano abuso corrupcion gente gobernando Saludos Dios Bendiga ilumine Gestion,2019-04-07
Walter Javier,Gomez Ronquillo,wgomezr,Estimado Walter amigo pueblo ustedes gran reto devolver institucionalidad Ecuador sido electos voto pupular actuaciones legitimas dentro marco Constitucion Deben revisar actuado transitorios sido terrible,2019-04-07
Walter Javier,Gomez Ronquillo,wgomezr,Deberia evaluarse sancionar alla tener afecto desafectos CPCCS TRANSITORIO nombramineto inconstitucional actuaciones,2019-04-07
Walter Javier,Gomez Ronquillo,wgomezr,orden dejar salir,2019-04-07
Walter Javier,Gomez Ronquillo,wgomezr,favor Licenciado debe principal actividad evaluar hecho Trujillo gavilla delincuentes sanar pais ayudaran pais salvaran,2019-04-07
Walter Javier,Gomez Ronquillo,wgomezr,bien felicito estimado,2019-04-07
Walter Javier,Gomez Ronquillo,wgomezr,Adelante Walter apoyo justo firme serlo,2019-04-07
Walter Javier,Gomez Ronquillo,wgomezr,Abogado lenin moreno juicio enfermera 2007 julio hermano andres michelena secretario comunicacion,2019-04-07
Walter Javier,Gomez Ronquillo,wgomezr,acuerdo impugne Salgado probo comision calificadira actuo parcializadamente debido estan,2019-04-07
Walter Javier,Gomez Ronquillo,wgomezr,SANCIONE MOUNSTRUJILLO,2019-04-07
Walter Javier,Gomez Ronquillo,wgomezr,Evaluarlos Carcel Viejito Trujillo deben permitir lleve solo vasenilla,2019-04-07
Walter Javier,Gomez Ronquillo,wgomezr,broma deben rendir cuentas odiador Trujillo solapados bultos secundan todas barbaras canallescas decisiones pisotearon Constitucion Patria,2019-04-07
Walter Javier,Gomez Ronquillo,wgomezr,Rectifique necesario usted representante,2019-04-07
Walter Javier,Gomez Ronquillo,wgomezr,Totalmente,2019-04-07
Walter Javier,Gomez Ronquillo,wgomezr,apoyo gestion busque mejores hombres mujeres aplique constitucion,2019-04-07
Walter Javier,Gomez Ronquillo,wgomezr,encargarse cara loco Celi Contralor bucarameco ilegitimo ilegal corrupto,2019-04-07
Walter Javier,Gomez Ronquillo,wgomezr,comision anticorrupcion denuncie trujillo hicieron locos Igualmente dedo,2019-04-07
Walter Javier,Gomez Ronquillo,wgomezr,colegio abogados trujillo tribunal honor Alberto wray junto trujillo seleccionaron 1997 corte suprema,2019-04-07
Walter Javier,Gomez Ronquillo,wgomezr,Macas pachakutek hernandez catolica pachakutek mayoria zabala hermano jorge defensor isaias,2019-04-07
Walter Javier,Gomez Ronquillo,wgomezr,profesor catolica simon bolivar anios conoce aquellos pupilos ahora jueces,2019-04-07
Walter Javier,Gomez Ronquillo,wgomezr,Favor caso duda pruebas erte2009 MOTIVO LAJUSTICIA MANOS,2019-04-07
Walter Javier,Gomez Ronquillo,wgomezr,Universidades catolica simon bolivar defiende caudas pantalla medios comunicacion trabaja julio michelena ayala,2019-04-07
Walter Javier,Gomez Ronquillo,wgomezr,Seguro querido Walter queremos volver tener democracia,2019-04-07
Walter Javier,Gomez Ronquillo,wgomezr,,2019-04-07
Walter Javier,Gomez Ronquillo,wgomezr,caramba acomdados gusta seran pelucones,2019-04-07
Walter Javier,Gomez Ronquillo,wgomezr,Completamente acuerdo senor debe responder acciones anticonstitucionales Ecuador organismos internacionales tiempo terrenal debe excusa evaluar desatinos,2019-04-07
Walter Javier,Gomez Ronquillo,wgomezr,Evidentemente sufriendo demas transitorios saben actuaron conveniencia desgobierno perseguir,2019-04-07
Walter Javier,Gomez Ronquillo,wgomezr,Esperemos resultado encuesta tomen consideracion,2019-04-07
Walter Javier,Gomez Ronquillo,wgomezr,Oportunidad afirmar decision pueblo leyes,2019-04-07
Walter Javier,Gomez Ronquillo,wgomezr,FELICITACIONES HAGALO FIRMESA VERDAD CULPAR LESA HUMANIDAD INDUCIR CRISIS CAOS ROMPER CONSTITUCION TENER AUTORIDADES PARAISOS FISCALES PRIVATIZAR ENGANAR INFORMAR FRAUDE TENER INOCENTES PRESO,2019-04-07
Walter Javier,Gomez Ronquillo,wgomezr,CENTURY SABE DESAPARECER CPCCS SOSTIENE MAFIOSOS ASAMBLEISTAS SERVILES VENDIDOS CORRUPTO LENIN MORENO CARONDELET LATACUNGA,2019-04-07
Walter Javier,Gomez Ronquillo,wgomezr,acuerdo debe inmediato,2019-04-07
Walter Javier,Gomez Ronquillo,wgomezr,CANSE PRUEBAS TOMADAS CUENTA JUEZ ORDENO RINDAMOS JURAMENTO DEFERIDO LLAMADO ACUDI RENDIR VERSION MARTIRIO VIVO BANCA LLAMARON OCASIONES GERENTE AURELIO POZO CRESPO JAMAS ASISTIO JUEZ DECLARO CONFESO MIRE ADJUNTO,2019-04-07
Walter Javier,Gomez Ronquillo,wgomezr,actuado CPCCST presidido gallo hervido debe evaluado haber alguna irregularidad sancion debe ejemplar,2019-04-07
Walter Javier,Gomez Ronquillo,wgomezr,Querer poder Sigan adelante quieren hacer pais justicia,2019-04-07
Walter Javier,Gomez Ronquillo,wgomezr,familia apoyamos,2019-04-07
Walter Javier,Gomez Ronquillo,wgomezr,Totalmente acuerdo sancione rigor,2019-04-07
Walter Javier,Gomez Ronquillo,wgomezr,Eatamos elaborando raticida evitar nefasto infausto personaje Ecuador,2019-04-07
Walter Javier,Gomez Ronquillo,wgomezr,lugar duda estimado CPCCS primero purgar sancionar actores vigentes cuales violado constitucion institucionalidad senor Cesar Trujillo piensa CPCCS casa,2019-04-07
Walter Javier,Gomez Ronquillo,wgomezr,sabe pendientes,2019-04-07
Walter Javier,Gomez Ronquillo,wgomezr,Nombres numero xedula celular vive,2019-04-07
Walter Javier,Gomez Ronquillo,wgomezr,correo comitedefensaciudadana,2019-04-08
Walter Javier,Gomez Ronquillo,wgomezr,respeta derecho ejercemos mediante elegido pueblo basta atropello derecho pagamos sueldo,2019-04-08
Walter Javier,Gomez Ronquillo,wgomezr,lugar duda estimado CPCCS primero purgar sancionar actores vigentes cuales violado constitucion institucionalidad senor Cesar Trujillo piensa CPCCS casa,2019-04-08
Walter Javier,Gomez Ronquillo,wgomezr,7781 Ecuatorianos encuestados reafirman debe EVALUAR TRANSITORIO ciudadania sigue vigilante DECISION POPULAR RESPETA,2019-04-09
Walter Javier,Gomez Ronquillo,wgomezr,INAUDITO astucia decir ecuatorianos saben votaron cinismo cuantico puede APODERARSE VOTOS LEYES CONSTITUCION LUCHA RECUPERAR PATRIA,2019-04-09
Walter Javier,Gomez Ronquillo,wgomezr,conscientes asqueados toda burocracia morenista acolita plutocracia Consejo transitorio debe encarcelado todas inconstitucionalidades cometidas Nunca sufrido desgobierno rastrero nefasto misero traidor Moreno,2019-04-09
Walter Javier,Gomez Ronquillo,wgomezr,Bendiciones tambien,2019-04-09
Walter Javier,Gomez Ronquillo,wgomezr,tiempo traspaso hecho autoridades permitir,2019-04-09
Walter Javier,Gomez Ronquillo,wgomezr,olvidar 2021,2019-04-10
Walter Javier,Gomez Ronquillo,wgomezr,mucha razon,2019-04-09
Walter Javier,Gomez Ronquillo,wgomezr,Previos entrevista,2019-04-09
Walter Javier,Gomez Ronquillo,wgomezr,Entrevista ciudadano derecho recoger firmas quiera procesos deben respetar cierto tambien recogeremos defender Constitucion notables,2019-04-09
Walter Javier,Gomez Ronquillo,wgomezr,Asambleista quiere haga designacion autoridades Control importa opinion gestion pueblo Ecuatoriano pidio voto interesaba poder ciudadano,2019-04-10
Walter Javier,Gomez Ronquillo,wgomezr,Eliseo Azuero hijo Julio Cesar Trujillo Diputado Sucumbios Prefectura Lago Agrio democracia cristiana Jamil Mahuad Prohibido olvidar,2019-04-10
Walter Javier,Gomez Ronquillo,wgomezr,Urgente posesion integrantes nombrados pueblo necesario caigan tentacion hagan valer etica valores siempre manteniendo dignidad alto depende futuro pais HLVS,2019-04-10
Walter Javier,Gomez Ronquillo,wgomezr,Apuraditos andan revolando puedan,2019-04-11
Walter Javier,Gomez Ronquillo,wgomezr,imagen quedara retina Ecuatorianos anos Ecuatoriano doble nacionalidad tratado delincuente sacado fuerza embajada Londres pena,2019-04-11
Walter Javier,Gomez Ronquillo,wgomezr,twit referia pactar partidos perseguir alguien pesar mereciera referia sere objetivo apegado Constitucion Caeran propias acciones seguridad,2019-04-11
Walter Javier,Gomez Ronquillo,wgomezr,Tarea ordena ciudadania,2019-04-11
Walter Javier,Gomez Ronquillo,wgomezr,Estimado Ciudadano gracias sugerencias puede hacerlo swxj1017,2019-04-11
Walter Javier,Gomez Ronquillo,wgomezr,Elementos legales Ecuador considero Assange,2019-04-12
Walter Javier,Gomez Ronquillo,wgomezr,senores capacitan personal respete derecho demas obra seguir negocios partidistas ponga atencion verdaderamente importante,2019-04-12
Walter Javier,Gomez Ronquillo,wgomezr,seguridad sera,2019-04-13
Walter Javier,Gomez Ronquillo,wgomezr,amig seguidores,2019-04-15
Walter Javier,Gomez Ronquillo,wgomezr,tambien compromiso Consejero,2019-04-15
Walter Javier,Gomez Ronquillo,wgomezr,resurgimiento tierra prospera,2019-04-16
Walter Javier,Gomez Ronquillo,wgomezr,resurgimiento tierra prospera,2019-04-16
Walter Javier,Gomez Ronquillo,wgomezr,misma camada Trujillo,2019-04-16
Walter Javier,Gomez Ronquillo,wgomezr,Seria interesante plantear Veeduria Ciudadana evidenciar aciertos falencias,2019-04-17
Walter Javier,Gomez Ronquillo,wgomezr,Hace horas 2dias escrutado resultados Hombres Nacional oficializa cifras necesitamos resultados finales,2019-04-17
Walter Javier,Gomez Ronquillo,wgomezr,deberia consultar existe Comite Usuarios caso existir crearlo partir exigir legalmente contemplado,2019-04-18
Walter Javier,Gomez Ronquillo,wgomezr,supuesto interesa investigue necesitamos ciudadanos responsables miedos deseen crear VEEDURIA tema inmediatamente posesion mayo Ecuatorianos podremos conocer realidades convenios instituciones,2019-04-18
Walter Javier,Gomez Ronquillo,wgomezr,facil solo esperemos posesion mayo normalmente existe formulario sencillo llenar copia presentarlo cualquier Delegacion provincial,2019-04-18
Walter Javier,Gomez Ronquillo,wgomezr,seguridad Dario hare propuse campana activare mecanismos control ciudadano trasparentar inversiones convenios Ecuador Esmeraldas hace falta mucha atencion curul Consejero Nacional hare,2019-04-18
Walter Javier,Gomez Ronquillo,wgomezr,Acepto recomendacion pias siempre escribo mente corazon siempre dirigido hacia beneficio pueblo ecuatoriano,2019-04-18
Walter Javier,Gomez Ronquillo,wgomezr,Buque Escuela Guayas familia Abril,2019-04-20
Walter Javier,Gomez Ronquillo,wgomezr,bien ganastes,2019-04-22
Walter Javier,Gomez Ronquillo,wgomezr,dolor,2019-04-22
Walter Javier,Gomez Ronquillo,wgomezr,Jajaja tranquilo pedi respeto depende ciudadanos hagan respetar Senor,2019-04-22
Walter Javier,Gomez Ronquillo,wgomezr,Bien contestado famoso,2019-04-22
Walter Javier,Gomez Ronquillo,wgomezr,mismo animal selva companero vida mismo golpear vestirlo companera peluda encanta vestirse abrigada protegida cuestion SOLO HACERLE DANO AMARLOS PARTE FAMILIA,2019-04-23
Walter Javier,Gomez Ronquillo,wgomezr,Listo,2019-04-23
Walter Javier,Gomez Ronquillo,wgomezr,penas posesionemos debemos escuchar todas ESTAN CORDIALMENTE INVITADOS REUNIONES TRABAJO,2019-04-23
Walter Javier,Gomez Ronquillo,wgomezr,Gracias Manabi nuevo abre puertas ustedes Ecuador,2019-04-24
Walter Javier,Gomez Ronquillo,wgomezr,claro,2019-04-24
Walter Javier,Gomez Ronquillo,wgomezr,claro IRRESPETUOSO,2019-04-24
Walter Javier,Gomez Ronquillo,wgomezr,,2019-04-24
Walter Javier,Gomez Ronquillo,wgomezr,cierto,2019-04-24
Walter Javier,Gomez Ronquillo,wgomezr,fecha solo espero cumplan mayo,2019-04-24
Walter Javier,Gomez Ronquillo,wgomezr,Claro,2019-04-24
Walter Javier,Gomez Ronquillo,wgomezr,perla transitorio,2019-04-24
Walter Javier,Gomez Ronquillo,wgomezr,Entrevista acciones definitivo seran basadas logicamente revisar actuado transitorio manda soberano guste,2019-04-25
Walter Javier,Gomez Ronquillo,wgomezr,Justicia seres vamos cambiar realidad nacional DEFENDEREMOS DERECHOS ANIMALES,2019-04-26
Walter Javier,Gomez Ronquillo,wgomezr,invito sintonizar Radio Latina sabado abril partir 7H30,2019-04-26
Walter Javier,Gomez Ronquillo,wgomezr,respetos Yunda accion dada proteccion animal Seguiremos atentos,2019-04-26
Walter Javier,Gomez Ronquillo,wgomezr,pais miserable traidor podrido espere Fiscal menos llame atencion gallo hervido pleno silencio electoral lanzo video vota nulo anuncia formacion Notables adulto mayor apoyarse recorrido,2019-04-26
Walter Javier,Gomez Ronquillo,wgomezr,Confio actuacion basados legal existen pruebas responsabilidad directa tampoco acciones terceros PROCESO DEBE ARCHIVADO,2019-04-26
Walter Javier,Gomez Ronquillo,wgomezr,leistes twit,2019-04-27
Walter Javier,Gomez Ronquillo,wgomezr,disculpa pense entendio mensaje,2019-04-27
Walter Javier,Gomez Ronquillo,wgomezr,Siento tener semana excelente bendicion madre DIOS siempre corazon,2019-04-28
Walter Javier,Gomez Ronquillo,wgomezr,Feliz mayo TRABAJADOR,2019-04-30
Walter Javier,Gomez Ronquillo,wgomezr,Hermoso,2019-05-01
Walter Javier,Gomez Ronquillo,wgomezr,Seguro sera mejores mayos vida,2019-05-01
Walter Javier,Gomez Ronquillo,wgomezr,Conmemoramos glorioso mucha historia Disfrutemos alcemos voces lograr mejor diferente,2019-05-01
Walter Javier,Gomez Ronquillo,wgomezr,Trabajando ganarme honradamente llevo mesa atendiendo negocio hace anos orgullo,2019-05-01
Walter Javier,Gomez Ronquillo,wgomezr,Cada merece,2019-05-01
Walter Javier,Gomez Ronquillo,wgomezr,plena seguridad Walter Gomez devolver etica justicia recuperar institucionalidad tiempo Transitorio utilizado ente persecucion,2019-05-02
Walter Javier,Gomez Ronquillo,wgomezr,caratucada seudos dirigentes trabajadores Marchando longevo odiador culpable descalabro institucional hipocritas oportunistas partes gobierno neoliberal,2019-05-02
Walter Javier,Gomez Ronquillo,wgomezr,necesitamos operativos frenar abusos,2019-05-02
Walter Javier,Gomez Ronquillo,wgomezr,partir pido comuniquen conmigo activar Observatorio Ciudadano vigilar Ordenanzas Municipales proteccion animal lograr municipios organismos frenen abusos animales,2019-05-02
Walter Javier,Gomez Ronquillo,wgomezr,oculto bajo responsabilidad normada respeta guste,2019-05-02
Walter Javier,Gomez Ronquillo,wgomezr,Tranquil compromiso hara,2019-05-02
Walter Javier,Gomez Ronquillo,wgomezr,Consejero Electo solicito forma respetuosa decline orden cambiarse local Tamayo afecta ciudadanos permita nuevos consejeros decidan inconveniente,2019-05-02
Walter Javier,Gomez Ronquillo,wgomezr,verdades siempre saldran excelente logre esclarecer inconsistencias super excelente ejerza derecho Esperemos lunes consejero,2019-05-03
Walter Javier,Gomez Ronquillo,wgomezr,,2019-05-03
Walter Javier,Gomez Ronquillo,wgomezr,Siempre listo equipo trabajo Guayas cuidando votos reconteo,2019-05-03
Walter Javier,Gomez Ronquillo,wgomezr,Atencion mayo crea Comite Ciudadano Defensa Nacional nuevo evaluar transitorio anuncia consejero electo,2019-05-04
Walter Javier,Gomez Ronquillo,wgomezr,,2019-05-08
Walter Javier,Gomez Ronquillo,wgomezr,cabeza entregaran instalaciones edificio DESTRUIDO OPERATIVO debe intervenir inmediatamente denuncio destruccion bien,2019-05-08
Walter Javier,Gomez Ronquillo,wgomezr,mismito,2019-05-08
Walter Javier,Gomez Ronquillo,wgomezr,Cafe nuevo CPCCS debe fiscalizar Transitorio habrian denunciado irregularidades casi procesos,2019-05-08
Walter Javier,Gomez Ronquillo,wgomezr,debe respetar decision PUEBLO ECUATORIANO Necesitamos conocer fechas entrega credenciales PUEBLO ELIGIO CONSEJERO,2019-05-08
Walter Javier,Gomez Ronquillo,wgomezr,irregularidades Pido organismos internacionales pronuncien bien democracia vigilen eleccion Consejeros alertas denuncias,2019-05-08
Walter Javier,Gomez Ronquillo,wgomezr,intentado romper determinacion pueblo elegido representantes vuelven intentarlo argumentos,2019-05-08
Walter Javier,Gomez Ronquillo,wgomezr,Solicitamos ecuatorianos residebtes EUROPA respete decision votamos,2019-05-08
Walter Javier,Gomez Ronquillo,wgomezr,transitoriedad tratado cara cuestionado fraudulento pretende descalificar VOTO RESPETA CARAJO,2019-05-08
Walter Javier,Gomez Ronquillo,wgomezr,quieren atropellar decision pueblo ecuatoriano Despues dias pretenden burlarse nuevamente descalificarnos consejeros defender ciudadania abusos Consejo Transitorio,2019-05-08
Walter Javier,Gomez Ronquillo,wgomezr,pasa exigimos CPCCS PUEBLO ELIGIO VOTO POPULAR ESPERANDO paso ABRAN,2019-05-08
Walter Javier,Gomez Ronquillo,wgomezr,resultados vuantos meses necesitan resultados parecen negocian voto,2019-05-08
Walter Javier,Gomez Ronquillo,wgomezr,seguir queriendo robar resultados voluntad pueblo,2019-05-08
Walter Javier,Gomez Ronquillo,wgomezr,permitiremos basta intentar ganado urnas saludos ciudadano Walter,2019-05-08
Walter Javier,Gomez Ronquillo,wgomezr,pueblo elegio representantes saludos,2019-05-08
Walter Javier,Gomez Ronquillo,wgomezr,respeta voto carajo,2019-05-08
Walter Javier,Gomez Ronquillo,wgomezr,respeta voto,2019-05-08
Walter Javier,Gomez Ronquillo,wgomezr,Sera hacer mismo Manabi Avisaran,2019-05-08
Walter Javier,Gomez Ronquillo,wgomezr,respetar decision Pueblo,2019-05-08
Walter Javier,Gomez Ronquillo,wgomezr,jueguen voluntad pueblo,2019-05-08
Walter Javier,Gomez Ronquillo,wgomezr,Debemos hacer respetar voto verdadero pueblo,2019-05-08
Walter Javier,Gomez Ronquillo,wgomezr,respeten decision pueblo Ecuatoriano DESCALIFICACION ELEGIDOS PUEBLO RESPETA,2019-05-08
Walter Javier,Gomez Ronquillo,wgomezr,pegarle sacudon kiosco infamia fraude hizo pueblo manabita evitat roben Prefectura Orlando Victoria debe denunciar barbaridad llamar movilizacion protesta injusticia,2019-05-08
Walter Javier,Gomez Ronquillo,wgomezr,unico debe primar clamor ciudadano voluntad popular Elegimos consejeros haremos respetar voto Inverosimil dias posesion pretenden descalificarlos,2019-05-08
Walter Javier,Gomez Ronquillo,wgomezr,PUEBLO ECUATORIMO TANTA TRAICION PUEBLO VAMOS ROMARNOS RSPETEN PUEBLO CARAJO,2019-05-08
Walter Javier,Gomez Ronquillo,wgomezr,Respeten Decision Pueblo Miserables Ratas Caninos,2019-05-08
Walter Javier,Gomez Ronquillo,wgomezr,Vivimos pais RESPETA voto ciudadano mismo corrupcion pretende descalificarlos pueblo eligio consejeros defender patria abusos consejo transitorio,2019-05-08
Walter Javier,Gomez Ronquillo,wgomezr,acojo publicacion garantice respete voluntad ciudadana urnas respecto consejero electos pueblo eligio autoridades electas,2019-05-08
Walter Javier,Gomez Ronquillo,wgomezr,Toda institucionalidad debe respetar pueblo eligio,2019-05-08
Walter Javier,Gomez Ronquillo,wgomezr,pretende descalificar Consejer elect Basta tantas arbitrariedades voluntad pueblo respeta vamos permitir roben,2019-05-08
Walter Javier,Gomez Ronquillo,wgomezr,debe respetar decision PUEBLO ECUATORIANO Necesitamos conocer fechas entrega credenciales PUEBLO ELIGIO CONSEJERO,2019-05-08
Walter Javier,Gomez Ronquillo,wgomezr,,2019-05-08
Walter Javier,Gomez Ronquillo,wgomezr,Necesitamos pronunciamiento intenta descalificar,2019-05-08
Walter Javier,Gomez Ronquillo,wgomezr,senores dejen jugar voluntad mandate elegido Consejeros CPCCS,2019-05-09
Walter Javier,Gomez Ronquillo,wgomezr,Terrible intenta hacer Atencion estan quita ecuatorianos,2019-05-09
Walter Javier,Gomez Ronquillo,wgomezr,transitorios mediocres tiembla hacen fraudes pueblo defendera votos igual hicieron prefecto electo votacion popular defensa democracia manos,2019-05-09
Walter Javier,Gomez Ronquillo,wgomezr,electorado dijo urnas respeta senores pretendan burlarse,2019-05-09
Walter Javier,Gomez Ronquillo,wgomezr,Salgamos calles venga venga vasta cuantos puestos dedo burlen gente,2019-05-09
Walter Javier,Gomez Ronquillo,wgomezr,quieren levante pueblos arrastres,2019-05-09
Walter Javier,Gomez Ronquillo,wgomezr,consejera Participacion Ciudadana electa denuncia hora intenta descalificar candidatura igual consejero electo,2019-05-09
Walter Javier,Gomez Ronquillo,wgomezr,claramente pasaron unas ratas disfrazadas consejeros pierdo esperanza justicia culpables complices Walter Gomez lucha lucha,2019-05-09
Walter Javier,Gomez Ronquillo,wgomezr,Fizcalizacion inmediata transitorios apoyamos Walter,2019-05-09
Walter Javier,Gomez Ronquillo,wgomezr,demas consejeros pueden elegir pasar pena gloria 4anos agachando cabeza PASAR HISTORIA abriendo trinchera permita recuperar democracia querer destituir duda perder supuesto,2019-05-09
Walter Javier,Gomez Ronquillo,wgomezr,atropello pueblo ecuatoriano democracia electa representantes DEBEN LIDERAR LUCHA FRAUDE ELECTORAL dentro pais Unidos organizados VERDAD LADO ADELANTE,2019-05-09
Walter Javier,Gomez Ronquillo,wgomezr,Trujillo tiembla tantos atropellos Constitucion Republica debe asegurarse nadie denuncie oscurantismo transitorio puesto dedo,2019-05-09
Walter Javier,Gomez Ronquillo,wgomezr,hora ponerle infames vende patria aprovechandose paciencia ecuatorianos siguen haciendo Adelante desmayar pais recupere institucionalidad,2019-05-09
Walter Javier,Gomez Ronquillo,wgomezr,mismo sucedio Leonardo Orlando Manabi pueblo manaba paro duro tieso noche ahora vamos Guayas vamos pais calles vasta jodernos vida pueblo pacifico cierto limite INDIGNATE ECUADOR LIBERTAD JORGE GLASS,2019-05-09
Walter Javier,Gomez Ronquillo,wgomezr,permitiremos CneRespetaMiVoto RCEC,2019-05-09
Walter Javier,Gomez Ronquillo,wgomezr,Atentos,2019-05-09
Walter Javier,Gomez Ronquillo,wgomezr,inventaron cuentos pretextos despues ultimo proceso electoral pudo puede podra voluntad determinacion pueblo ecuatoriano decidio representantes,2019-05-09
Walter Javier,Gomez Ronquillo,wgomezr,Pueblo debemos reaccionar calles defendio pueblo manabita prefecto cpccs manipulado locura seguira pais colapse sera pronto espalda pared reaccionar pueblo,2019-05-09
Walter Javier,Gomez Ronquillo,wgomezr,espera salga cuentos argumentos disparatados destruir representan intereses pueblo argumentos traicionar mandato popular querer descalificar,2019-05-09
Walter Javier,Gomez Ronquillo,wgomezr,pueblo permitir SALDREMOS DEFENDER BASTA ABUSO,2019-05-09
Walter Javier,Gomez Ronquillo,wgomezr,Hacer respetar derechos virtuales ganadores elecciones,2019-05-09
Walter Javier,Gomez Ronquillo,wgomezr,crimen perfecto minimo cabello dejen caido vamos exterminar ratas,2019-05-09
Walter Javier,Gomez Ronquillo,wgomezr,satrapas inquisidores mantendremos firmes respaldamos consejeros electos Pueblo Gomez Desintonio,2019-05-09
Walter Javier,Gomez Ronquillo,wgomezr,jueves entrevistado nuevo debe obediente leyes Constitucion caso sere Fidcalizador grupo trabajare pueblo territorio,2019-05-09
Walter Javier,Gomez Ronquillo,wgomezr,ECUADOR DIRECTO decisiones transitorio estan ahora blindadas debemos respetuosos Constitucion igual esclarecer procesos,2019-05-09
Walter Javier,Gomez Ronquillo,wgomezr,Tendra explicar deja destruido CPCCS AUDIO unico estan intentando hacer dobleguemos poderes cuenta fortalece remarco consejero electo,2019-05-09
Walter Javier,Gomez Ronquillo,wgomezr,Basta tanta infamia atropello parte seudos funcionarios corruptos voluntad pueblo defenderemos sangre,2019-05-09
Walter Javier,Gomez Ronquillo,wgomezr,respeta voto,2019-05-09
Walter Javier,Gomez Ronquillo,wgomezr,Sere quiera solo mentalizarlo materializarlo conviccion trabajarlo atraccion,2019-05-09
Walter Javier,Gomez Ronquillo,wgomezr,pueblo ecuatoriano manda urnas,2019-05-09
Walter Javier,Gomez Ronquillo,wgomezr,voto repeta vote PUEBLO lucha derechos vamos permitir veran calle reclamado respete nueatra voluntad,2019-05-09
Walter Javier,Gomez Ronquillo,wgomezr,hacen proposito deben haber escondido documentacion comprometedora luego diran extraviado segura consejero investigara todas acciones noto asustados,2019-05-09
Walter Javier,Gomez Ronquillo,wgomezr,Manana Walter Gomez Consejero electo CPCCS tema Postura ultimas resoluciones tomadas CPCCS Transitorio,2019-05-10
Walter Javier,Gomez Ronquillo,wgomezr,unira tendran salir corriendo mediotres vendidos,2019-05-10
Walter Javier,Gomez Ronquillo,wgomezr,hicimos respetar voluntad popular expresada urnas Prefecto llegaremos nuevamente ciudad capital decirle basta atropello querer violentar voto consejeros electos,2019-05-10
Walter Javier,Gomez Ronquillo,wgomezr,Walter pilas transitorio podrido tomar decisiones,2019-05-10
Walter Javier,Gomez Ronquillo,wgomezr,pueblo apoyara adelante,2019-05-10
Walter Javier,Gomez Ronquillo,wgomezr,Leyendo documento senala cumplieron todavia candidatos dmisible actuaciones nombre tambien parte reparto Ecuador,2019-05-10
Walter Javier,Gomez Ronquillo,wgomezr,nuevo golpe lastimado derecho podra voluntad popular hizo escuchar apoyo representantes podemos permitir siga jugando voluntad popular,2019-05-10
Walter Javier,Gomez Ronquillo,wgomezr,Interesante dato,2019-05-11
Walter Javier,Gomez Ronquillo,wgomezr,Feliz MAMI seres importantes vida espero tenerte anos,2019-05-12
Walter Javier,Gomez Ronquillo,wgomezr,Domingo familia mamis,2019-05-13
Walter Javier,Gomez Ronquillo,wgomezr,ATENTOS SIENDO ustedes oficializado Consejeros electos CPCCS jueguen paciencia pueblo acerca candela puede quemar Oficialicen resultados ciudadania exigimos,2019-05-13
Walter Javier,Gomez Ronquillo,wgomezr,presidenta esperando llegar ultima hora eliminarles siguiendo mismo libreto Alianza Pais luego firmas misterio argumentaran cualesquier barbarie eliminados,2019-05-13
Walter Javier,Gomez Ronquillo,wgomezr,Responsabilizo cualquier afectacion integridad trabajadora permiten posesionarse consejeros electos pueblo,2019-05-13
Walter Javier,Gomez Ronquillo,wgomezr,sale rata todas maneras gracias patriotas encaran trujillo,2019-05-13
