nombre,apellidos,tweet_screen_name,tweet_text,tweet_date
Walter Javier,Gomez Ronquillo,wgomezr,informo salio consulados hacen migrantes encima fraguo fraude ultimo cambiando lugar votacion socializar provoco gente inscrita voto,2019-04-02
Walter Javier,Gomez Ronquillo,wgomezr,consigo nombre,2019-04-02
Walter Javier,Gomez Ronquillo,wgomezr,colaborador Xavier Guerrero indica Sacerdote asevero entrevista momento hablar Consulta Popular eliminar Walter Gomez momento union destruccion,2019-04-02
Walter Javier,Gomez Ronquillo,wgomezr,atentos evaluacion Transitorio encabezado,2019-04-02
Walter Javier,Gomez Ronquillo,wgomezr,Creo miembros toda capacidad dirigir mejor manera entidad momento abrazo fraterno presentado carta pidiendo reciba Comision General,2019-04-02
Walter Javier,Gomez Ronquillo,wgomezr,vigilantes gobierno traicionero,2019-04-02
Walter Javier,Gomez Ronquillo,wgomezr,bien Lcdo Walter voto confio investigue sancione haga justicia pais destruccion,2019-04-02
Walter Javier,Gomez Ronquillo,wgomezr,Felicidades conteo voto voto evidencio cambio voluntad popular papeletas nuevas dobladas manipuladas,2019-04-02
Walter Javier,Gomez Ronquillo,wgomezr,Super contento,2019-04-02
Walter Javier,Gomez Ronquillo,wgomezr,FEUE NACIONAL rechaza pretension descalificar candidatos Consejo Participacion Ciudadana Control Social CPCCS legal legitimamente electos pueblo Ecuatoriano,2019-04-02
Walter Javier,Gomez Ronquillo,wgomezr,esperanza defraude hizo haciendo MORENO,2019-04-02
Walter Javier,Gomez Ronquillo,wgomezr,Excelente olvide ofrecio campana defruade victoria siempre,2019-04-02
Walter Javier,Gomez Ronquillo,wgomezr,primera medida esterilizacion gratuita controlar poblacion existen refugios campanas intensivas adopcion empatia animales solucion,2019-04-02
Walter Javier,Gomez Ronquillo,wgomezr,prohibir venta reproduccion animales buen tiempo poblacion mascotas controle exigir lucran venta mascotas vendan esterilizados,2019-04-02
Walter Javier,Gomez Ronquillo,wgomezr,Puede hacer quiera SANCIONADO atribuirse funciones colmo Ecuador tierra nadie burla CONSTITUCION DEFINITIVO RECUPEREN institucionalidad bien pais,2019-04-03
Walter Javier,Gomez Ronquillo,wgomezr,Ingreso clinica periodistica ciudadana magister RRII experiencia participacion ciudadana consejero electo definitivo,2019-04-03
Walter Javier,Gomez Ronquillo,wgomezr,Migrantes Barcelona Espana felicitamos nuevos consejeros Aunque pasado dias elecciones oficializa siendo claros ganadores llamado cuidado vigilandoles,2019-04-03
Walter Javier,Gomez Ronquillo,wgomezr,Excelente postura respeto pueblo Ecuatoriano,2019-04-03
Walter Javier,Gomez Ronquillo,wgomezr,Balzar sumergido basura Ministra cupula Policia permiten persona representante legal siga dentro autoridad,2019-04-03
Walter Javier,Gomez Ronquillo,wgomezr,atentos defender voluntad popular defender voto voto voto ecuatorianos,2019-04-03
Walter Javier,Gomez Ronquillo,wgomezr,atentos 10H00 instalaria pleno tratar proceso abierto responsabilizan pruebas podria proceder descalificacion violentar decision popular,2019-04-03
Walter Javier,Gomez Ronquillo,wgomezr,BASTA ENGANO,2019-04-03
Walter Javier,Gomez Ronquillo,wgomezr,Vote,2019-04-03
Walter Javier,Gomez Ronquillo,wgomezr,apoyo alos ciudadanos pueblo walter Gomez victoria Sintonio 3000 Asociaciones repaldamos exijimos respete votos Aquienes elejimos Reprecentantes Concejo Participacion Ciudadana,2019-04-03
Walter Javier,Gomez Ronquillo,wgomezr,Atamaint vote DESCALIFICARLOS seria atentar acudimos URNAS Delegados encontrado inconsistencias cuenta manipulacion votos pueblo permitira abusos,2019-04-03
Walter Javier,Gomez Ronquillo,wgomezr,tambien vote Respeta voto,2019-04-03
Walter Javier,Gomez Ronquillo,wgomezr,Estan provocando ECLOSION SOCIAL quieren habra VOLUNTAD PUEBLO RESPETA buenas malas,2019-04-03
Walter Javier,Gomez Ronquillo,wgomezr,Hablan respetar democracia quieren bajo artimanas descalificar elegido pueblo ciudadania voto conformar basta irrespetar pueblo,2019-04-03
Walter Javier,Gomez Ronquillo,wgomezr,vote Esperamos voto miles ecuatorianos respetado democracia lectura quedara clara votacion debe aceptada pese pese,2019-04-03
Walter Javier,Gomez Ronquillo,wgomezr,Senores vote quiero esten permito califiquen personas ecuatoriano mandante ustedes elegi Exijo dejen artimanas aprendan respetar democracia sino vayanse casa,2019-04-03
Walter Javier,Gomez Ronquillo,wgomezr,Haber Sres pretenden crear caos pais ciudadania respondio propuestas realidad actual mano sucia burla ganadores llamado urgente,2019-04-03
Walter Javier,Gomez Ronquillo,wgomezr,Basta vulnerar democratico Ecuador vote exijo respete voluntad popular manifestada urnas,2019-04-03
Walter Javier,Gomez Ronquillo,wgomezr,Descalificar constituiria ataque directo voluntad popular debe garantizarla violacion flagrante acarreara respuesta categorica pueblo Basta abusos,2019-04-03
Walter Javier,Gomez Ronquillo,wgomezr,Senores vote quiero esten permito descalifiquen personas ecuatoriano mandante ustedes elegi Exijo dejen artimanas aprendan respetar democracia sino vayanse casa,2019-04-03
Walter Javier,Gomez Ronquillo,wgomezr,PUEBLO ELIGIO conformar quieren descalificarlos forma arbitraria antidemocratica pretenden carta continue atropellando institucionalidad pais,2019-04-03
Walter Javier,Gomez Ronquillo,wgomezr,pueblo cansado respete voto caterva ungidos desgobierno rabo paja quieren descalificar fiscalizar,2019-04-03
Walter Javier,Gomez Ronquillo,wgomezr,RECHAZAMOS PRETENDIDA DESCALIFICACION VICTORIA DESINTONIO WALTER GOMEZ UNICO MOTIVO ABERRANTE ACTO SABEN MALAS OBRAS AUDITADAS TEMOR SUCEDERA PERMITIREMOS RESPETEN VOLUNTAD PUEBLO,2019-04-03
Walter Javier,Gomez Ronquillo,wgomezr,,2019-04-03
Walter Javier,Gomez Ronquillo,wgomezr,tambien vote Respeto decision democratica Alerta,2019-04-03
Walter Javier,Gomez Ronquillo,wgomezr,ORGANIZACIONES SOCIALES vigilantes Consejero jueguen pueblo,2019-04-03
Walter Javier,Gomez Ronquillo,wgomezr,vote retorno democracia derecho,2019-04-03
Walter Javier,Gomez Ronquillo,wgomezr,tambien vote exigimos respeto voluntad pueblo queremos cambio corrupto Trujillo verguenza,2019-04-03
Walter Javier,Gomez Ronquillo,wgomezr,vote toleraremos burla voluntad popular parte transitocracia trujillana proceso plagado irregularidades miedo FISCALIZACION,2019-04-03
Walter Javier,Gomez Ronquillo,wgomezr,tambien vote respeten votos,2019-04-03
Walter Javier,Gomez Ronquillo,wgomezr,Gracias respaldo ciudadano Seguimos defendiendo democracia,2019-04-03
Walter Javier,Gomez Ronquillo,wgomezr,Trollls jajaj,2019-04-03
Walter Javier,Gomez Ronquillo,wgomezr,vote quiere desconocer voto Trujillo vote ahora gobierna,2019-04-03
Walter Javier,Gomez Ronquillo,wgomezr,JUEGUEN VOTO ECUATORIAN Respaladamos consejero,2019-04-03
Walter Javier,Gomez Ronquillo,wgomezr,Trujillo siniestro busca impunidad todas arbitrariedades juridicas cometidas unicos pueden parar tantas atrocidades Descalificarlos golpe democracia,2019-04-03
Walter Javier,Gomez Ronquillo,wgomezr,prepararnos compatriotas Aqui correr sangre mediocres atreven hacer sinverguenzada,2019-04-03
Walter Javier,Gomez Ronquillo,wgomezr,Entrevista prog CUARTO PODER respetuoso conviccion revisar actuado transitorio,2019-04-03
Walter Javier,Gomez Ronquillo,wgomezr,Gracias respaldo ciudadano Seguimos defendiendo democracia,2019-04-04
Walter Javier,Gomez Ronquillo,wgomezr,Rechazamos intento descalificar candidatos CPCCS acto golpe democracia llevaria Ecuador derecho,2019-04-04
Walter Javier,Gomez Ronquillo,wgomezr,vote Quieren descalificar Walter Gomez candidato defensor pueblo ecuatoriano,2019-04-04
Walter Javier,Gomez Ronquillo,wgomezr,permitamos parte quieren descalificar,2019-04-04
Walter Javier,Gomez Ronquillo,wgomezr,FEUE NACIONAL rechaza pretension descalificar candidatos Consejo Participacion Ciudadana Control Social legal legitimamente electos pueblo Ecuatoriano total solidaridad,2019-04-04
Walter Javier,Gomez Ronquillo,wgomezr,prioridad pueblo hacer valer voto nota verdad gobiernistas estan ensenados hacer chanchullo provecho sobretodo jacta incorruptible resultaron asquerosos cara tuco,2019-04-04
Walter Javier,Gomez Ronquillo,wgomezr,vote solicito respete decision,2019-04-04
Walter Javier,Gomez Ronquillo,wgomezr,podran callar familia amigos comunidad defenderemos democracia,2019-04-04
Walter Javier,Gomez Ronquillo,wgomezr,vote basta abuso verdad basta,2019-04-04
Walter Javier,Gomez Ronquillo,wgomezr,Expreso solidaridad companeros consejeros electos voto pueblo sido objeto discriminacion selectiva parte fecha resuelven amenazas descalificacion,2019-04-04
Walter Javier,Gomez Ronquillo,wgomezr,fiscalizar gallo hervido trujillo,2019-04-04
Walter Javier,Gomez Ronquillo,wgomezr,Alertamos ataque democracia pretenden descalificar debe actuar evidente manipulacion,2019-04-04
Walter Javier,Gomez Ronquillo,wgomezr,tambien vote Gomez Desintonio,2019-04-04
Walter Javier,Gomez Ronquillo,wgomezr,cansa Maria Paula Romo romper institucionalidad independencia gobierno canallezco siquiera guarda formas,2019-04-04
Walter Javier,Gomez Ronquillo,wgomezr,vote corrupcion paraisos fiscales cobros fraudulentos privatizaciones designados dedo vote democracia recuperar Patria vote,2019-04-04
Walter Javier,Gomez Ronquillo,wgomezr,,2019-04-04
Walter Javier,Gomez Ronquillo,wgomezr,llega informacion portal informativo confirmaria abria reunion representante Moreno descalificar candidatos ganadores,2019-04-04
Walter Javier,Gomez Ronquillo,wgomezr,,2019-04-04
Walter Javier,Gomez Ronquillo,wgomezr,vote,2019-04-04
Walter Javier,Gomez Ronquillo,wgomezr,Canada candidatos propuestas defender patria ganaron resultados migrantes alzan defienden votos,2019-04-04
Walter Javier,Gomez Ronquillo,wgomezr,Migrantes piden respeto voluntad popular debe dejarse artilugios legales candidatos Aplicar supuestas reglas solo personas escogidas corrupcion doble,2019-04-04
Walter Javier,Gomez Ronquillo,wgomezr,suena piedras trae esconde Trujillo gallada quieren fiscalicen Descalificar seria burdo democracia,2019-04-04
Walter Javier,Gomez Ronquillo,wgomezr,vote injustificable quieran descalificar Walter Gomez Victoria Desintonio defensores pueblo,2019-04-04
Walter Javier,Gomez Ronquillo,wgomezr,vote,2019-04-04
Walter Javier,Gomez Ronquillo,wgomezr,EXIJO RESPETE VOTO VIOLENTEN VOLUNTAD PUEBLO,2019-04-04
Walter Javier,Gomez Ronquillo,wgomezr,vote creo ayudaran salvar patria HLVS,2019-04-04
Walter Javier,Gomez Ronquillo,wgomezr,elegimos respeten Esconden pronto saldra trabajo presidente gabinete CALLARAN,2019-04-04
Walter Javier,Gomez Ronquillo,wgomezr,movilizarnos estan conformes haber cometido monumental fraude Luisa Maldona tranquera Yunda candidatos iban liderando votaciones CPCCS manosamente dejaron quieren sacarlos basta barbarie,2019-04-04
Walter Javier,Gomez Ronquillo,wgomezr,Seria terrible dictadura violenta democracia desconoce voto ciudadano maneja instituciones puede permitir burla derechos BASTA debe pronunciarse calles defenderemos,2019-04-04
Walter Javier,Gomez Ronquillo,wgomezr,vote Gomez,2019-04-04
Walter Javier,Gomez Ronquillo,wgomezr,Basta abusos Gobierno facista,2019-04-04
Walter Javier,Gomez Ronquillo,wgomezr,quieren destituirlo tarea covardes respetan voluntad pueblo vote respeta voto,2019-04-04
Walter Javier,Gomez Ronquillo,wgomezr,vote voto respeta Trujillo enfermo odio venganza actuando ultima burrada nombrar fiscal subrogante,2019-04-04
Walter Javier,Gomez Ronquillo,wgomezr,sabe Trujillo corrupto miedo carcel lugar hijo,2019-04-04
Walter Javier,Gomez Ronquillo,wgomezr,pasa respeten voto Pueblo CARAJO,2019-04-04
Walter Javier,Gomez Ronquillo,wgomezr,Nadie puede doble moral iran parar carcel ATENTO ECUADOR,2019-04-04
Walter Javier,Gomez Ronquillo,wgomezr,respeta voto hace entonces,2019-04-04
Walter Javier,Gomez Ronquillo,wgomezr,Bien dicho temen electos,2019-04-04
Walter Javier,Gomez Ronquillo,wgomezr,ESTIMADA GABI CONVOQUE TODA MITANCIA VAMOS ABUSO UNICOS FISCALIZAR CORRUPTOS QUIEREN DESCALIFICAR,2019-04-04
Walter Javier,Gomez Ronquillo,wgomezr,Pretenden descalificar,2019-04-04
Walter Javier,Gomez Ronquillo,wgomezr,nervioso iracundo periodistas acorralado lean bien jueguen paciencia,2019-04-04
Walter Javier,Gomez Ronquillo,wgomezr,siguen apareciendo seguro escano pelearlo ultimo,2019-04-04
Walter Javier,Gomez Ronquillo,wgomezr,,2019-04-04
Walter Javier,Gomez Ronquillo,wgomezr,Cuenten conmigo ayudar combatir corrupcion Moreno secuases,2019-04-07
Walter Javier,Gomez Ronquillo,wgomezr,podemos permitir servidor publico doble nombramiento haga deshaga voluntad pueblo debemos exigir respete voluntad popular,2019-04-04
Walter Javier,Gomez Ronquillo,wgomezr,Sinverguenzas roban voto,2019-04-04
Walter Javier,Gomez Ronquillo,wgomezr,Cerdos maldecidos,2019-04-04
Walter Javier,Gomez Ronquillo,wgomezr,Ustedes cansados toda eleccion manchada dudas irregularidades resultados ello presentado denuncia presunto hora acabar incertidumbre,2019-04-04
Walter Javier,Gomez Ronquillo,wgomezr,Cuidado tambien candidato perdedor suplente recuerden PUEBLO VIGILA CANSADO INTENTEN FRAUDE DESPIERTEN BESTIA,2019-04-04
Walter Javier,Gomez Ronquillo,wgomezr,solidarizo perjudicados miedo revisen inconstitucionalidades pueblo olvida poder termina nazi Alemania,2019-04-04
Walter Javier,Gomez Ronquillo,wgomezr,Gallo hervido terror esten CPCCS saben estan haciendo pais RESPETEN VOTO VOTO PUEBLO CARAJO COVARDES,2019-04-04
Walter Javier,Gomez Ronquillo,wgomezr,vote respetar voto carajo miedo,2019-04-04
Walter Javier,Gomez Ronquillo,wgomezr,presion Moreno sequito hienas evidente,2019-04-04
Walter Javier,Gomez Ronquillo,wgomezr,respete Democracia basta tiemblan miedo nuevos vayan recuperar derecho violentado hacer respetar vote,2019-04-04
Walter Javier,Gomez Ronquillo,wgomezr,nervioso iracundo periodistas acorralado lean bien jueguen paciencia,2019-04-04
Walter Javier,Gomez Ronquillo,wgomezr,vote usted acuerdo accionar Basta manoserias electorales instrucciones fraude hace mesa Ojala sirva tambien analizar implementacion sistema electronico elimine riesgos patranas,2019-04-04
Walter Javier,Gomez Ronquillo,wgomezr,tambien vote solo sino pruebas irregularidades contar votos irregularidades querido atender resolver ciudadanos,2019-04-04
Walter Javier,Gomez Ronquillo,wgomezr,Realizare proximos dias tres acciones Denunciare actas manipuladas Pedire revise todas actas inconsistencias numericas Pedire aclare errores informaticos necesario abra todas urnas,2019-04-04
Walter Javier,Gomez Ronquillo,wgomezr,BIEN WALTER FELICITACIONES,2019-04-04
Walter Javier,Gomez Ronquillo,wgomezr,pueblo vigila sabra castigar,2019-04-04
Walter Javier,Gomez Ronquillo,wgomezr,viaje pague peaje gasolina votar ahora quieres robar descarados verguenzas respeten voto,2019-04-04
Walter Javier,Gomez Ronquillo,wgomezr,,2019-04-04
Walter Javier,Gomez Ronquillo,wgomezr,llegarse tremenda sinverguenzada tendras pueblo enfurecido Aqui salvara pueblo juega,2019-04-04
Walter Javier,Gomez Ronquillo,wgomezr,Cuidado tambien candidato perdedor suplente recuerden PUEBLO VIGILA CANSADO INTENTEN FRAUDE ENFUREZCAN PUEBLO,2019-04-04
Walter Javier,Gomez Ronquillo,wgomezr,Respaldo ciudadano equivoquen PUEBLO BURLA DEBE RESPETAR VOLUNTAD,2019-04-04
Walter Javier,Gomez Ronquillo,wgomezr,Informacion llega portal senor Darwin Seraquive Secretario General estaria presionando descalificacion nuevos consejeros ganadores fraude,2019-04-04
Walter Javier,Gomez Ronquillo,wgomezr,hace voluntad pueblo tocara decirle SERA VIVE SERAQUIVE,2019-04-05
Walter Javier,Gomez Ronquillo,wgomezr,estimado Consejero igual representantes legitimos pretendan caldear animos danado institucionalidad Trujillo respeten voluntad llamamos abusos,2019-04-05
Walter Javier,Gomez Ronquillo,wgomezr,Acompanenme entrevista line,2019-04-05
Walter Javier,Gomez Ronquillo,wgomezr,seraquive juegues fuego puedes quemar pueblo limite provocando,2019-04-05
Walter Javier,Gomez Ronquillo,wgomezr,respetan obligamos respetar voto Rufianes atracadores voluntad ciudadana utilizaron legalizar GOLPE Robando votos reemplazando votos favor tambien sumando Gracias Atamaint Nebot,2019-04-05
Walter Javier,Gomez Ronquillo,wgomezr,Ecuatorianos debemos pararnos bien permitir voluntad tiren basura,2019-04-05
Walter Javier,Gomez Ronquillo,wgomezr,inadmisible pretendan descalificar consejeros electos parte solo razones odio parte joven politico derecha Dictadura Basta abusos pueblo pronto reaccionara,2019-04-05
Walter Javier,Gomez Ronquillo,wgomezr,Entrevistado debe respetar decision popular aceptar diversidad ahora,2019-04-05
Walter Javier,Gomez Ronquillo,wgomezr,Entrevistado debe respetar decision popular consejeros devolverle Poder ciudadano,2019-04-05
Walter Javier,Gomez Ronquillo,wgomezr,pueblo ecuatoriano exige respeto voluntad popular elegidos manera democratica urnas pretende artimanas respetar voto ejercimos ciudadanos tener,2019-04-05
Walter Javier,Gomez Ronquillo,wgomezr,pregunta pregunta supone pueblo burla gobierno ganado elecciones estarian calladitos,2019-04-05
Walter Javier,Gomez Ronquillo,wgomezr,botados hacian imposible descalificarlos electos decidido inhabilitarlos ojala gota derrame vaso popular tanta falta verdad gobierno antipopular Sentadito destruyendo PATRIA,2019-04-05
Walter Javier,Gomez Ronquillo,wgomezr,Quieren traves consulta eliminar CPCCS Hicieron gana CPCCS perdidos quieren eliminar clase pais viviendo Ecuatorianos reaccionar protestar,2019-04-05
Walter Javier,Gomez Ronquillo,wgomezr,razon motivo quieren descalificar Tiemblan miedo descubra canalladas hecho tiempo asustan fiscalice transitorios demonio Cuanta podredumbre dentro,2019-04-05
Walter Javier,Gomez Ronquillo,wgomezr,pueblo ecuatoriano expresado voto candidatos senores cuanto tiempo debemos esperar resolucion,2019-04-05
Walter Javier,Gomez Ronquillo,wgomezr,Senor Walter voto cambio quiero tener justicia social respeten derechos gobierno buen vivir necesitados Dios bendiga senor Walter inmigrantes esperamos regreso Lider Rafael Correa,2019-04-05
Walter Javier,Gomez Ronquillo,wgomezr,hablen plena creen cojudos piensan ecuatorianos tontos pretendan callar voluntad popular VAMOS PERMITIR vote,2019-04-05
Walter Javier,Gomez Ronquillo,wgomezr,Corruptos,2019-04-05
Walter Javier,Gomez Ronquillo,wgomezr,naturaleza vida mata hombres Misoginos mujeres pervertidos Heterosxuales honestos mujeres adnegadas sentimientos mata,2019-04-05
Walter Javier,Gomez Ronquillo,wgomezr,Estimado igual dicho colevtico Esmeraldenos Revolucionarios Alfaristas listos ayudarles medida podamos articulacion Tierra Verde Encocao Tapao Esmeraldas,2019-04-06
Walter Javier,Gomez Ronquillo,wgomezr,Muchas gracias amigos ahora debemos pendientes archive expediente abierto luego datos finales,2019-04-06
Walter Javier,Gomez Ronquillo,wgomezr,calidad CONSEJERO impulsare conformacion COMITE DEFENSA CONSTITUCION CPCCS quieran hacer historia DEFENSORES DEMOCRACIA DECISION POPULAR Inscribirse correo electronico sexj2017,2019-04-06
Walter Javier,Gomez Ronquillo,wgomezr,Vamos sacarlos posesionemos demas miembros realmente elegidos ciudadanos merecen frente Consejo poner transitorio dano hecho pais,2019-04-06
Walter Javier,Gomez Ronquillo,wgomezr,calidad CONSEJERO impulsare conformacion COMITE DEFENSA CONSTITUCION CPCCS quieran hacer historia DEFENSORES DEMOCRACIA DECISION POPULAR Inscribirse correo electronico swxj2017,2019-04-06
Walter Javier,Gomez Ronquillo,wgomezr,pueblo Ecuatoriano decidio emprenderemos partir mayo COMITE DEFENSA CONSTITUCION,2019-04-06
Walter Javier,Gomez Ronquillo,wgomezr,apunto conformar comite aclaro correista eliminar revisare actuado senor saber afan apunta,2019-04-06
Walter Javier,Gomez Ronquillo,wgomezr,Bien licenciado buena iniciativa Vamos abogados honestos pueblo general,2019-04-06
Walter Javier,Gomez Ronquillo,wgomezr,Excelente gracias apoyo,2019-04-06
Walter Javier,Gomez Ronquillo,wgomezr,Cuente apoyo Estimado,2019-04-06
Walter Javier,Gomez Ronquillo,wgomezr,Ahora segura equivocamos darle voto usted devuelve esperanza agradecida lucha recien empieza junto funcionarios usted sera facil recuperar Patria trabajo espero impaciente ejerza funciones,2019-04-06
Walter Javier,Gomez Ronquillo,wgomezr,Veras hijo emperador transitorio Ecuador senil sabe mierda hace verdaderamente manejan consejo panas tapan cagadas bajar,2019-04-06
Walter Javier,Gomez Ronquillo,wgomezr,actuado irregularidades vergonzosas nivel nacional persecucion politica realizada grupo candidatos CPCCS,2019-04-06
Walter Javier,Gomez Ronquillo,wgomezr,sumar esfuerzos evaluar todas decisiones caprichos CPCCS transitorio,2019-04-06
Walter Javier,Gomez Ronquillo,wgomezr,medios comunicacion perdido credibilidad dicho miles despidos hablado FRAUDE electoral muchomenos caso,2019-04-06
Walter Javier,Gomez Ronquillo,wgomezr,Apoyo total eliminar Tauromaquia planeta especial Ecuador,2019-04-06
Walter Javier,Gomez Ronquillo,wgomezr,Excelente Lcdo felicitaciones favor siga informandonos realidad viviendo pais,2019-04-07
Walter Javier,Gomez Ronquillo,wgomezr,invito parte COMITE NACIONAL CIUDADANO DEFENSA CONSTITUCION CPCCS,2019-04-07
Walter Javier,Gomez Ronquillo,wgomezr,necesita momia perdedora urnas haber sido parte rancia partidocracia parte pendejada,2019-04-07
Walter Javier,Gomez Ronquillo,wgomezr,Patria necesite,2019-04-07
Walter Javier,Gomez Ronquillo,wgomezr,Cuente apoyo dejaremos vende patrias Aniquilen Ecuador,2019-04-07
Walter Javier,Gomez Ronquillo,wgomezr,Inscribete correo comitedefensaciudadana,2019-04-07
Walter Javier,Gomez Ronquillo,wgomezr,Asostado Galleto Hervedo,2019-04-07
Walter Javier,Gomez Ronquillo,wgomezr,olviden robo pueblo parte banqueros corruptos nadie dicho,2019-04-07
Walter Javier,Gomez Ronquillo,wgomezr,Solo quedan calles haremos pagar deshonestos negocios dedicados desinformacion Venceremos tanta traicion,2019-04-07
Walter Javier,Gomez Ronquillo,wgomezr,Cuente conmigo Espero poder servir Patria util victoria siempre,2019-04-07
Walter Javier,Gomez Ronquillo,wgomezr,supuesto,2019-04-07
Walter Javier,Gomez Ronquillo,wgomezr,hice,2019-04-07
Walter Javier,Gomez Ronquillo,wgomezr,Listo apunto Cuente conmigo,2019-04-07
Walter Javier,Gomez Ronquillo,wgomezr,Cuente apoyo,2019-04-07
Walter Javier,Gomez Ronquillo,wgomezr,odio fuerte razon Abgdo olvido CPCCS nacio Constituyente haga ridiculo querer mayo hacerse corre camino baston maximo llega Guamani coge fatiga anciano delirando debe venir Martin desaznarle,2019-04-07
Walter Javier,Gomez Ronquillo,wgomezr,hara,2019-04-07
Walter Javier,Gomez Ronquillo,wgomezr,Cuente apoyo,2019-04-07
Walter Javier,Gomez Ronquillo,wgomezr,ordenes Walter,2019-04-07
Walter Javier,Gomez Ronquillo,wgomezr,EXCELENTE ESTIMADO PROPUESTAS ESTAN HACEN PATRIA COBRE RESPIRO TRANQUILIDAD PLASMADAS VUELVEN REFERENTES MUNDO FELICITACIONES,2019-04-07
Walter Javier,Gomez Ronquillo,wgomezr,Buena iniciativa deberia haber comision solo dedique vigilar violaciones Constitucion defienda primeros denunciados serias transitorios sienta presedente pais vuelva pasar,2019-04-07
Walter Javier,Gomez Ronquillo,wgomezr,Apoyo total,2019-04-07
Walter Javier,Gomez Ronquillo,wgomezr,Cuente apoyo,2019-04-07
Walter Javier,Gomez Ronquillo,wgomezr,Cuente apoyo acabar verdadera corrupcion,2019-04-07
Walter Javier,Gomez Ronquillo,wgomezr,Dale Walter quiero ayudar,2019-04-07
Walter Javier,Gomez Ronquillo,wgomezr,Inscribase correo comitedefensaciudadana,2019-04-07
Walter Javier,Gomez Ronquillo,wgomezr,Gracias enviamos confirmacion,2019-04-07
Walter Javier,Gomez Ronquillo,wgomezr,Solo ganas defender Ecuador,2019-04-07
Walter Javier,Gomez Ronquillo,wgomezr,expuse consejeros apoyo parte consejeros Tuarez Cruz Desintonio,2019-04-07
Walter Javier,Gomez Ronquillo,wgomezr,Inscribase correo comitedefensaciudadana,2019-04-07
Walter Javier,Gomez Ronquillo,wgomezr,Total apoyo iniciativa ciudadana,2019-04-07
Walter Javier,Gomez Ronquillo,wgomezr,Cuenta conmigo,2019-04-07
Walter Javier,Gomez Ronquillo,wgomezr,suficiente companeros organizarnos sacar basura Ecuador habra compasion ratas quieren destruir querido pais buscaron pasar encima Constitucion AHORA TOCA ACTUAR PUEBLO SOLO MANOS,2019-04-07
Walter Javier,Gomez Ronquillo,wgomezr,Claro,2019-04-07
Walter Javier,Gomez Ronquillo,wgomezr,Completamente acuerdo voto,2019-04-07
Walter Javier,Gomez Ronquillo,wgomezr,apoyo,2019-04-07
Walter Javier,Gomez Ronquillo,wgomezr,pila iniciativa CONCEJERO,2019-04-07
Walter Javier,Gomez Ronquillo,wgomezr,TOTALMENTE ACUERDO COMPANERITO,2019-04-07
Walter Javier,Gomez Ronquillo,wgomezr,Wahington favor desea inscribirse debe hacerlo correo comitedefensaciudadana,2019-04-07
Walter Javier,Gomez Ronquillo,wgomezr,favor incribase correo comitedefensaciudadana,2019-04-07
Walter Javier,Gomez Ronquillo,wgomezr,convencido investigaciones deben hacerse adecuadamente objetividad utiliza SHOW MEDIATICO impresentable Transitorio debe PARAR declaraciones haga trabajo elegido,2019-04-07
Walter Javier,Gomez Ronquillo,wgomezr,acuerdo pude conversar Consejeros PODEMOS PERMITIR PERDIDA TIEMPO ECUADOR NECESITA MIRADA CIUDADANA RESPETO DECISION,2019-04-07
Walter Javier,Gomez Ronquillo,wgomezr,favor incribase correo comitedefensaciudadana,2019-04-07
Walter Javier,Gomez Ronquillo,wgomezr,Excelente,2019-04-07
Walter Javier,Gomez Ronquillo,wgomezr,veces aplaudirles aplaudir paguen errores violaciones cometidas,2019-04-07
Walter Javier,Gomez Ronquillo,wgomezr,Apoyo,2019-04-07
Walter Javier,Gomez Ronquillo,wgomezr,Entonces exijamos lunes resultados finales CPCCS,2019-04-07
Walter Javier,Gomez Ronquillo,wgomezr,preocupacion mutua informacion informes seran expuestos ciudadania,2019-04-07
Walter Javier,Gomez Ronquillo,wgomezr,Toda Latinoamerica unirnos Obejetivo principal Equidad social buena economia familias trabajo decente tener mismas oportunidades,2019-04-07
Walter Javier,Gomez Ronquillo,wgomezr,hara,2019-04-07
Walter Javier,Gomez Ronquillo,wgomezr,Siiiii millon veces,2019-04-07
Walter Javier,Gomez Ronquillo,wgomezr,respaldo votamos ustedes puestos dedo verdad Tendran rendir cuentas pais,2019-04-07
