nombre,apellidos,tweet_screen_name,tweet_text,tweet_date
Walter Javier,Gomez Ronquillo,wgomezr,Comparto Agenda provincia Loja 2019,2019-03-15
Walter Javier,Gomez Ronquillo,wgomezr,venido Loja jamas debe irse comer REPE LOJANO DELICIOSO AGUACATE mmmm sueno,2019-03-15
Walter Javier,Gomez Ronquillo,wgomezr,Loja Patria Walter Gomez Defendere derechos juntos lucharemos pais libre corrupcion VIVA CORRUPCION,2019-03-15
Walter Javier,Gomez Ronquillo,wgomezr,Entrevista Loja prov Loja Loja activo revocatoria mandato seccional efectiva apoyare todas necesarias derecho ciudadano,2019-03-15
Walter Javier,Gomez Ronquillo,wgomezr,Entrevista derecho participacion vital planificacion obra publica certifica,2019-03-15
Walter Javier,Gomez Ronquillo,wgomezr,Teatro Benjamin Carrion Loja DARE APOYO CONTINUE CULTURA ARTE,2019-03-15
Walter Javier,Gomez Ronquillo,wgomezr,Loja Patria Walter Gomez defendere derechos Ecuador libre corrupcion,2019-03-15
Walter Javier,Gomez Ronquillo,wgomezr,Entrevista Macas prov Morona Santiago creado estrategias adecuadas promocion candidatos vislumbra problemas,2019-03-16
Walter Javier,Gomez Ronquillo,wgomezr,Reunion combatientes poblacion Macas prov Morona Santiago,2019-03-17
Walter Javier,Gomez Ronquillo,wgomezr,AYAMPACO pollo alma Gracias Iralda equipo trabajo Morona Santiago,2019-03-17
Walter Javier,Gomez Ronquillo,wgomezr,,2019-03-17
Walter Javier,Gomez Ronquillo,wgomezr,Exhorto seguidores amigos multipliquemos esfuerzos alcanzar objetivo faltan dias lograremos devolverle PODER CIUDADANO Ecuatorianos urnas darle paliza destruido Patria,2019-03-17
Walter Javier,Gomez Ronquillo,wgomezr,,2019-03-17
Walter Javier,Gomez Ronquillo,wgomezr,Periodista ecuatoriano rompe veda encuestas pronostica triunfo frente base encuestas pueden publicar asesor,2019-03-17
Walter Javier,Gomez Ronquillo,wgomezr,iniciativas creativas companeros exterior creen propuestas VALIDAS Agradezco cientos miles seguidores exhorto vayamos urnas patriotismo conocimientos Recuperemos,2019-03-17
Walter Javier,Gomez Ronquillo,wgomezr,votemos personas capacidad conocimiento deseo servir ciudadania,2019-03-17
Walter Javier,Gomez Ronquillo,wgomezr,Plan Fortalecimiento claro operativo Reformas Comunicacion Efectiva Participacion Ciudadana Fiscalizacion Control Social Transparencia Veeduria Veeduria dineros incautados Veeduria parar privatizaciones Publicas,2019-03-17
Walter Javier,Gomez Ronquillo,wgomezr,Fortalecimiento claro operativo Reformas Comunicacion Efectiva Participacion Ciudadana Fiscalizacion Control Social Transparencia Veeduria Veeduria dineros incautados Veeduria parar privatizaciones Publicas,2019-03-17
Walter Javier,Gomez Ronquillo,wgomezr,Quiere llorar quiere llora quiere llorar Seran miembros legitimamente electo mayoria ecuatorianos mandato popular devolveran institucionalidad derecho,2019-03-17
Walter Javier,Gomez Ronquillo,wgomezr,Vamos activar veeduria obsequios Autoridades Ejecutivo respaldados decreto impuesto tiempo Presidente Correa llegamos poner orden devolverle poder ciudadania,2019-03-17
Walter Javier,Gomez Ronquillo,wgomezr,Entrevista Causa Justa Everlyn Cabezas carcel dada servidor publico institucion estatal promueva voto nulo,2019-03-18
Walter Javier,Gomez Ronquillo,wgomezr,Aporte mujer afro profesional incentivando ejercer Poder Ciudadano,2019-03-18
Walter Javier,Gomez Ronquillo,wgomezr,perjudicada TERRABIENES solicitando intervencion nuevo informan absolutamente Pediremos informes seguridad Daysi,2019-03-18
Walter Javier,Gomez Ronquillo,wgomezr,Propuesta ciudadana Gracias diferentes iniciativas apoyo,2019-03-18
Walter Javier,Gomez Ronquillo,wgomezr,Invitado Conversatorio cierre campana Babahoyo prov Rios representantes varios cantones parroquias,2019-03-19
Walter Javier,Gomez Ronquillo,wgomezr,Invitacion Especial Conversatorio Escenario Electoral manana Ciudad prov,2019-03-19
Walter Javier,Gomez Ronquillo,wgomezr,Apoyo ciudadano Mujer Profesional Afro Madre Abuela Esposa Guerrera Enis Estupinan,2019-03-19
Walter Javier,Gomez Ronquillo,wgomezr,Participando Conversatorio Asoc jubilados junto,2019-03-19
Walter Javier,Gomez Ronquillo,wgomezr,sera poder lograrlo necesitamos ganadores,2019-03-19
Walter Javier,Gomez Ronquillo,wgomezr,acuerdo analisis,2019-03-19
Walter Javier,Gomez Ronquillo,wgomezr,acuerdo analisis claro,2019-03-19
Walter Javier,Gomez Ronquillo,wgomezr,apoyo sera recompensado trabajo recuperar poder ciudadano,2019-03-19
Walter Javier,Gomez Ronquillo,wgomezr,quieren llevar peso pais buenos ciudadanos iremos urnas civismo patriotismo votaremos hombres mujeres pueblos nacionalidades,2019-03-20
Walter Javier,Gomez Ronquillo,wgomezr,fraguado atentado democracia 1era interesado voto nulo PUEBLO PERDONA iremos patrioticame urnas lograremos legal legitimo guste,2019-03-20
Walter Javier,Gomez Ronquillo,wgomezr,Trujillo pagara accionar creces pueblo vigila votara RESPETO necesidades pais CORRUPCION VENDE PATRIAS VAYAMOS PATRIOTISMO VOTAR,2019-03-20
Walter Javier,Gomez Ronquillo,wgomezr,imposible creer estan tiempo cambiar resoluciones contrarias quiere pueblo ecuatoriano PUEBLO VIGILA TENDRAN GRAN RECES MANTIENEN,2019-03-20
Walter Javier,Gomez Ronquillo,wgomezr,debemos incentivar voto positivo candidaturas ciudadanos conocen metodologia,2019-03-20
Walter Javier,Gomez Ronquillo,wgomezr,burlan comun,2019-03-20
Walter Javier,Gomez Ronquillo,wgomezr,habian enterado importante mantener legalidad oportunidad historica cometer gran asalto Constitucion denuncias,2019-03-20
Walter Javier,Gomez Ronquillo,wgomezr,Sres explicacion didactica mejor entendimiento,2019-03-20
Walter Javier,Gomez Ronquillo,wgomezr,claro oportunidad cambiar historia limpiar imagen pueblo vigila,2019-03-20
Walter Javier,Gomez Ronquillo,wgomezr,entendio estan manzanitas Pilas,2019-03-20
Walter Javier,Gomez Ronquillo,wgomezr,,2019-03-20
Walter Javier,Gomez Ronquillo,wgomezr,envio opinion lider politico suma protestar parapeto estan haciendo FRAUDE,2019-03-20
Walter Javier,Gomez Ronquillo,wgomezr,Manta Manabi debe velar democracia reglas claras parece acciones responden intereses politicos ciudadanos lamentable,2019-03-20
Walter Javier,Gomez Ronquillo,wgomezr,Manta Manabi cumplido ciudadania mandato consulta popular debe evaluado ciudadania encargar,2019-03-20
Walter Javier,Gomez Ronquillo,wgomezr,conozco deseo servirte Vota consciente civismo patriotismo DEVOLVERLE PODER CIUDADANO,2019-03-20
Walter Javier,Gomez Ronquillo,wgomezr,Diario Manta Manabi cambios ultimo momento haciendo ponen manifiesto incapacidad parcialidad ciertos actores politicos evidencia,2019-03-20
Walter Javier,Gomez Ronquillo,wgomezr,Cesar Andy Tapuy hermano kichwa amazonico pide voto Nastacuaz Walter Juan Carlos,2019-03-20
Walter Javier,Gomez Ronquillo,wgomezr,Grupo gestor conformacion Asamblea Provincial Ciudadana Manabi Cierre Campana realizada Montecristi,2019-03-21
Walter Javier,Gomez Ronquillo,wgomezr,Iniciativas ciudadanas Isabel Aguavil Profesional Tsachila Mujer emprendedora Madre,2019-03-21
Walter Javier,Gomez Ronquillo,wgomezr,principales seran mejores votados suplentes siguientes caso hombres mujeres pueblos principal sera mayor votado suplente segundo mejor votado,2019-03-21
Walter Javier,Gomez Ronquillo,wgomezr,respeto ciudadana creo primero pueblo defiende derechos participacion respeto Constitucion quiero Lasso gobierne quiero vaya Trujillo corte imperial papel,2019-03-21
Walter Javier,Gomez Ronquillo,wgomezr,espero tarde,2019-03-21
Walter Javier,Gomez Ronquillo,wgomezr,Conversatorio organizado Integracion Economica Pacific World Guayaquil Guayas emocione termino evento pirotecnicnia amor esperanzas Ecuador diferente devolviendole PODER CIUDADANO,2019-03-21
Walter Javier,Gomez Ronquillo,wgomezr,Conversatorio Cierre Guayas gente gente sencilla poses entusiasmo patriotismo esperanza Ecuador diferente traves devolvuelva PODER CIUDADANO,2019-03-22
Walter Javier,Gomez Ronquillo,wgomezr,Espero mentira PUEBLO VIGILA JAMAS PERMITIREMOS FRAUDE ELECTORAL BURLEN EXIGE PUEBLO ORGANIZADO diferente,2019-03-22
Walter Javier,Gomez Ronquillo,wgomezr,Apoyo ciudadano Carlos Rodriguez prov Napo Lider amazonico Profesional Honesto Defensor DDHH mucha personalidad,2019-03-22
Walter Javier,Gomez Ronquillo,wgomezr,Trabajadoras sexuales Ecuador apoyo candidatura honrado siento merecen Ecuador diferente discriminacion estigmas,2019-03-22
Walter Javier,Gomez Ronquillo,wgomezr,Iniciativa Ciudadana Migrantes Luchadores Valientes Hermanos Ecuatorianos,2019-03-22
Walter Javier,Gomez Ronquillo,wgomezr,organizados Control Electoral mayoria provincias estructura debidamente acreditada certificada territorio exterior VENCEREMOS,2019-03-22
Walter Javier,Gomez Ronquillo,wgomezr,Evitar violencia genero mujeres prioridad hombres parte aquel cambio Claro tambien mujeres Vamos Ecuador diferente equitativo machismo misoginia,2019-03-22
Walter Javier,Gomez Ronquillo,wgomezr,atencion inmediata estaria violando derechos participacion ciudadanos exterior URGENTE ACREDITAR DELEGADOS ELECTORALES,2019-03-22
Walter Javier,Gomez Ronquillo,wgomezr,Entrevista Mision Quito Ecuador exponiendo anomalias actores politicos,2019-03-22
Walter Javier,Gomez Ronquillo,wgomezr,Continua PERSECUSION hacia candidatura parte responsabilizandome iniciativas ciudadanas PUEBLO VIGILA RESPONDERA ATENTADO DERECHO PARTICIPACION,2019-03-23
Walter Javier,Gomez Ronquillo,wgomezr,PERSECUSION hacia candidatura parte responsabilizandome iniciativas ciudadanas PUEBLO VIGILA RESPONDERA ATENTADO DERECHO PARTICIPACION,2019-03-23
Walter Javier,Gomez Ronquillo,wgomezr,Ayer 19H42 envio notificacion intentar descalificar candidatura tener responsabilidad polla electoral TANTA DESESPERACION TERROR REPRESENTACION PUEBLO,2019-03-23
Walter Javier,Gomez Ronquillo,wgomezr,seguridad actuare base legal,2019-03-23
Walter Javier,Gomez Ronquillo,wgomezr,credencial oficial cuidar votos manana,2019-03-23
Walter Javier,Gomez Ronquillo,wgomezr,,2019-03-24
Walter Javier,Gomez Ronquillo,wgomezr,Hace pocos minutos entregue descargos maliciosa acusacion intencion descalificacion PUEBLO VIGILA EMITIRA JUICIO MANANA,2019-03-23
Walter Javier,Gomez Ronquillo,wgomezr,,2019-03-24
Walter Javier,Gomez Ronquillo,wgomezr,Roma Italia Martha Alava amedrentando Ecuatorianos permitiendoles tomen fotografia votos queriendolos acusar Consul atentos,2019-03-24
Walter Javier,Gomez Ronquillo,wgomezr,Estan impidiendo telef Roma parte Martha Alava amedrentan Ecuatorianos Consul sigue fraguando fraude,2019-03-24
Walter Javier,Gomez Ronquillo,wgomezr,mwjor nombres numeros,2019-03-24
Walter Javier,Gomez Ronquillo,wgomezr,descalificados intento hacerlo debemos entregar descargos seguimos papeleta,2019-03-24
Walter Javier,Gomez Ronquillo,wgomezr,Manana elecciones inician proceso descalificar candidatos apoyados ganas VOTO Walter Gomez Juan Javier Davalos Espinoza Victoria Desintonio Graciela Mora Olindo Nastacuaz,2019-03-24
Walter Javier,Gomez Ronquillo,wgomezr,Tranquilo derecho,2019-03-24
Walter Javier,Gomez Ronquillo,wgomezr,ninguno Exijo resuelva inmediatamente pare persecucion cuestionamos gobierno instancias elegidas transitorio,2019-03-24
Walter Javier,Gomez Ronquillo,wgomezr,,2019-03-24
Walter Javier,Gomez Ronquillo,wgomezr,,2019-03-24
Walter Javier,Gomez Ronquillo,wgomezr,Muchas gracias amigos Francisco debemos cuidar votos,2019-03-24
Walter Javier,Gomez Ronquillo,wgomezr,Gracias Minessota apoyo,2019-03-24
Walter Javier,Gomez Ronquillo,wgomezr,Ejerciendo derecho voto parte pueblo quiere,2019-03-24
Walter Javier,Gomez Ronquillo,wgomezr,Equipo cuidando votos pueblo Guayas devolverle poder ciudadano,2019-03-25
Walter Javier,Gomez Ronquillo,wgomezr,esperar,2019-03-25
Walter Javier,Gomez Ronquillo,wgomezr,,2019-03-26
Walter Javier,Gomez Ronquillo,wgomezr,Senores vamos permitir descaro seguir fraude alzaremos calles,2019-03-27
Walter Javier,Gomez Ronquillo,wgomezr,Senores vamos permitir descaro seguir fraude candidatos electos Pueblo Ecuatoriano BASTA alzaremos calles ustedes toda entidad siga violado Constitucion,2019-03-27
Walter Javier,Gomez Ronquillo,wgomezr,,2019-03-27
Walter Javier,Gomez Ronquillo,wgomezr,pueblo vamos permitir descaro votos hablaron,2019-03-27
Walter Javier,Gomez Ronquillo,wgomezr,pueblo decidio BURLEN MANDATO PUEBLO ECUATORIANO,2019-03-27
Walter Javier,Gomez Ronquillo,wgomezr,voluntad pueblo respeta,2019-03-27
Walter Javier,Gomez Ronquillo,wgomezr,caer juego siertos politicos,2019-03-27
Walter Javier,Gomez Ronquillo,wgomezr,permitiremos vulneren desicion ecuatorianos,2019-03-27
Walter Javier,Gomez Ronquillo,wgomezr,alerta senores,2019-03-27
Walter Javier,Gomez Ronquillo,wgomezr,permitiremos vulneren desicion ecuatorianos,2019-03-27
Walter Javier,Gomez Ronquillo,wgomezr,respeta desicion pueblo elegidos votacion popular,2019-03-27
Walter Javier,Gomez Ronquillo,wgomezr,VOTEN CORRUPTOS dijo Traidor pueblo escucho VOTO Tiban Bucaram Lenin 35AP Rodas Galo Lara Lasso Falquez Tooooda Prensa corrupta AHORA DEBEMOS HACER RESPETAR DECISION,2019-03-27
Walter Javier,Gomez Ronquillo,wgomezr,Senores vamos permitir descaro seguir fraude candidatos electos Pueblo Ecuatoriano BASTA alzaremos calles ustedes toda entidad siga violando Constitucion,2019-03-27
Walter Javier,Gomez Ronquillo,wgomezr,dejarse arrebatar ganado confianza depositada ustedes lucha Pueblo nadie cansa,2019-03-27
Walter Javier,Gomez Ronquillo,wgomezr,pasan descarados,2019-03-27
Walter Javier,Gomez Ronquillo,wgomezr,Senores candidatos electos pueblo ecuatoriano puede permitir descaro pueden violentar Constitucion ente,2019-03-27
Walter Javier,Gomez Ronquillo,wgomezr,basta tantas anomalias,2019-03-27
Walter Javier,Gomez Ronquillo,wgomezr,verguenza lacayos Traidores voluntad popular respeta votos pueblo deposito urnas basto robar votos resto candidatos,2019-03-27
Walter Javier,Gomez Ronquillo,wgomezr,proclamabas redes puro teatro Hablabas respetar voluntad pueblo haces contrario respeta falta reconteo votos resto candidatos,2019-03-27
Walter Javier,Gomez Ronquillo,wgomezr,descalificacion pueblo eligio,2019-03-27
Walter Javier,Gomez Ronquillo,wgomezr,limite ganadores urnas pueden descalificarse legitimos ganadores voluntad popular respeta atentos organismos internacionales siguen fraude,2019-03-27
Walter Javier,Gomez Ronquillo,wgomezr,voluntad pueblo pueden cambiar porq pueblo Dios pueblo eligio,2019-03-27
Walter Javier,Gomez Ronquillo,wgomezr,voto,2019-03-27
Walter Javier,Gomez Ronquillo,wgomezr,Senores respeten voluntad pueblo Ecuatoriano respeten Democracia verdaderos ganadores CPCCS,2019-03-27
Walter Javier,Gomez Ronquillo,wgomezr,marcha verdad levantar voluntad cuidadana candidatos electos esperanza mejor Patria Unidos volveremos brillar tanta falsedad humana ineptitud gubernamental HLVS COMPANEROS,2019-03-27
Walter Javier,Gomez Ronquillo,wgomezr,,2019-03-27
Walter Javier,Gomez Ronquillo,wgomezr,MOVILIZAREMOS fumigar seguro,2019-03-27
Walter Javier,Gomez Ronquillo,wgomezr,,2019-03-27
Walter Javier,Gomez Ronquillo,wgomezr,Exigimos Respete voluntad pueblo archiven descalificacion,2019-03-28
Walter Javier,Gomez Ronquillo,wgomezr,respete voluntad pueblo Verguenza elegimos,2019-03-28
Walter Javier,Gomez Ronquillo,wgomezr,FAMILIA VOTAMOS EXIGIMOS RESPETO DESICION QUIEMNES DIERON VOTO JUEGUEN PACIENCIA PUEBLO,2019-03-28
Walter Javier,Gomez Ronquillo,wgomezr,permitir despojo parte espurio decision tomada pueblo ecuatoriano,2019-03-28
Walter Javier,Gomez Ronquillo,wgomezr,Claro ustedes exigen quiere impedir presiones politicas,2019-03-28
Walter Javier,Gomez Ronquillo,wgomezr,Estan destruyendo ganado ecuatorianos,2019-03-28
Walter Javier,Gomez Ronquillo,wgomezr,Walter Victoria CONSEJEROS exigo respete voluntad pueblo,2019-03-28
Walter Javier,Gomez Ronquillo,wgomezr,pueblo decidio BURLEN MANDATO PUEBLO ECUATORIANO,2019-03-28
Walter Javier,Gomez Ronquillo,wgomezr,Entrevistado plan fortalecer necesidades pueblo mandato nuevos consejeros,2019-03-28
Walter Javier,Gomez Ronquillo,wgomezr,Entrevistado proceso descalificacion sustento legal parece persecusion verdaderos representantes ciudadania,2019-03-28
Walter Javier,Gomez Ronquillo,wgomezr,manzanitas,2019-03-28
Walter Javier,Gomez Ronquillo,wgomezr,descalifican Arde Troya cansados sapo delincuente tirado vivo,2019-03-28
Walter Javier,Gomez Ronquillo,wgomezr,Gracias Hernan usted demostro gran candidato pronto esperemos oficialicen resultados,2019-03-28
Walter Javier,Gomez Ronquillo,wgomezr,Migrante exigen burlen decision pueblo Ecuatoriano,2019-03-28
Walter Javier,Gomez Ronquillo,wgomezr,hace ciudadana Exigimos RESPETO decision popular,2019-03-28
Walter Javier,Gomez Ronquillo,wgomezr,apoyo total Walter Gomez Victor Desintorio clave cambiar pais andaremos derrocaremos traidores hecho dana pueblo victoria siempre Companero,2019-03-28
Walter Javier,Gomez Ronquillo,wgomezr,respaldo sincero Walter saludo Machala,2019-03-28
Walter Javier,Gomez Ronquillo,wgomezr,Tambien Londres dejen robar elecciones,2019-03-28
Walter Javier,Gomez Ronquillo,wgomezr,horror pueblo gano urnas derecho tener dignidad permitir dormidos dejando actue descaro conocerlos dudar apice,2019-03-28
Walter Javier,Gomez Ronquillo,wgomezr,Muchas gracias apoyo Hermanos Migrantes EEUU,2019-03-28
Walter Javier,Gomez Ronquillo,wgomezr,pueblo decidio urnas garras morenistas clara persecucion quieren descaradamente descalificar candidatos,2019-03-28
Walter Javier,Gomez Ronquillo,wgomezr,campana SUCIA solo hacia tambien mismo lamentable ciertos medios comunicacion politiqueros pidan eliminacion unica institucion respeta ciudadanos,2019-03-28
Walter Javier,Gomez Ronquillo,wgomezr,llegar suceder PUEBLO HACER VALER DECISIONES,2019-03-28
Walter Javier,Gomez Ronquillo,wgomezr,Gracias respaldo Migrantes Ecuatorianos Barcelona Espana,2019-03-28
Walter Javier,Gomez Ronquillo,wgomezr,,2019-03-28
Walter Javier,Gomez Ronquillo,wgomezr,Invitacion amigos amigas seguidores DEFENSORES DEMOCRACIA aconpanen,2019-03-28
Walter Javier,Gomez Ronquillo,wgomezr,fuerza pueblo apoyamos voto ganaron luchen final,2019-03-29
Walter Javier,Gomez Ronquillo,wgomezr,invita ciudadania general demostrar apoyo Consejero Electo CPCCS mandante decidio cualquier poder politico deben respetar decision Ecuador libre democratico,2019-03-29
Walter Javier,Gomez Ronquillo,wgomezr,Publicando forma popular toda banda gallo hervidos caterva pseudo periodistas pago confabulado pudientes neoliberales MIEDO domador deshonestos regrese MASHI sera INEVITABLE HLVS,2019-03-29
Walter Javier,Gomez Ronquillo,wgomezr,Gracias respaldo Migrantes Ecuatorianos Barcelona Espana,2019-03-29
Walter Javier,Gomez Ronquillo,wgomezr,Ecuador pais debe respetar decision urnas Exhorto datos oficiales declare ganadores semana evitar violencia,2019-03-29
Walter Javier,Gomez Ronquillo,wgomezr,Respaldo Migrantes Europa Urge declarar datos finales CPCCS,2019-03-29
Walter Javier,Gomez Ronquillo,wgomezr,Bien pais tener valiente digno representante CPCCS,2019-03-29
Walter Javier,Gomez Ronquillo,wgomezr,violacion democracia Ecuador pasando justicia Ecuador ecuatorianos exijimos resultados claros transparente,2019-03-29
Walter Javier,Gomez Ronquillo,wgomezr,paciencia pueblo Pita enfermo odio incontrolable hacia legal justo debe someterse tratamiento ayude entender siempre anduvo errado miserable existencia,2019-03-30
Walter Javier,Gomez Ronquillo,wgomezr,Senores vamos permitir descaro seguir fraude candidatos electos Pueblo Ecuatoriano BASTA alzaremos calles ustedes toda entidad siga violado Constitucion,2019-03-30
Walter Javier,Gomez Ronquillo,wgomezr,ToTal Respaldo Walter Victoria Pueblo Ecuatoriano Elejimos hurnas vamos Permitir LADRON CORRUPCORRU Trujillo Quiera vurlarse voto Popular Quiera intente Perseguir danar imagen electos,2019-03-30
Walter Javier,Gomez Ronquillo,wgomezr,apoyo infinito Licenciado hombre probo defensor Derechos Humanos respetado Organizaciones Sociales Sociedad Civil,2019-03-30
Walter Javier,Gomez Ronquillo,wgomezr,roben verguenza hecho resto candidatos,2019-03-30
Walter Javier,Gomez Ronquillo,wgomezr,Estan haciendo tiempo dejar designado fiscal sabemos honesta,2019-03-30
Walter Javier,Gomez Ronquillo,wgomezr,vigilando saldremos calle quieren robar CPCCS punto creemos busca cometer FRAUDE sino cometio hermetismo bueno esconden Saldremos calle quedan avisados,2019-03-30
Walter Javier,Gomez Ronquillo,wgomezr,FRAUDE RESPETEN VOTO pueblo ecuatoriano voto entreguen resultados,2019-03-30
Walter Javier,Gomez Ronquillo,wgomezr,demas miembros nuevo CPCCS OBLIGACION solucionarlo demuestren transparencia necesita funcion HAGAN HISTORIA,2019-03-30
Walter Javier,Gomez Ronquillo,wgomezr,,2019-03-30
Walter Javier,Gomez Ronquillo,wgomezr,esperando resultados elecciones CPCCS miembros alta votacion querian descalificarlos seria ilegitimo raro conocer resultados definitivos,2019-03-30
Walter Javier,Gomez Ronquillo,wgomezr,elegi eligio familia eligieron vecinos ningun derecho autoridad robar votos,2019-03-30
Walter Javier,Gomez Ronquillo,wgomezr,vamos desmayen peleen cumplimos voto dejes partidocracia maneje,2019-03-30
Walter Javier,Gomez Ronquillo,wgomezr,resultados Exigimos resultados oficiales,2019-03-30
Walter Javier,Gomez Ronquillo,wgomezr,Tambien elegimos personas familia,2019-03-30
Walter Javier,Gomez Ronquillo,wgomezr,pueden descalificar Consejero elegido forma democratica mandante puesto dedo pueden tomar accion acciones terceros demuestren cometio infraccion electoral,2019-03-30
Walter Javier,Gomez Ronquillo,wgomezr,espera respuesta clara basta perdida tiempo pais puede esperar incapacidad transitorios delegados dedo estan destrozando Patria,2019-03-30
Walter Javier,Gomez Ronquillo,wgomezr,demasiado grave,2019-03-30
Walter Javier,Gomez Ronquillo,wgomezr,veia venir Motivar crisis solucion solo favorezca allegados perjudicar pueblo Espero nuevo permitan tremenda canallada,2019-03-30
Walter Javier,Gomez Ronquillo,wgomezr,Exigimos datos oficiales saber realmente candidatos ganadores CPCCS,2019-03-30
Walter Javier,Gomez Ronquillo,wgomezr,Atentos firmes,2019-03-30
Walter Javier,Gomez Ronquillo,wgomezr,desgastarse zombies politiqueros segun propias palabras SOLO OBEDECER NONLES INTERESA PUEBLO SOLO BOLSILLOS,2019-03-30
Walter Javier,Gomez Ronquillo,wgomezr,Exigimos datos oficiales elecciones respete voluntad popular,2019-03-30
Walter Javier,Gomez Ronquillo,wgomezr,diko aprovechemos ayude firmas evitar privatizaciones revocatoria,2019-03-30
Walter Javier,Gomez Ronquillo,wgomezr,resultados,2019-03-30
Walter Javier,Gomez Ronquillo,wgomezr,elegimos representen ciudadanos consejeros calidad moral descalificarlos Lucharemos calles necesario defender FAMILIA VECINOS ELEGIMOS,2019-03-30
Walter Javier,Gomez Ronquillo,wgomezr,Felicitaciones compatriota triunfo exterior Ecuador siempre ganador,2019-03-30
Walter Javier,Gomez Ronquillo,wgomezr,importante venga Guayaquil,2019-03-30
Walter Javier,Gomez Ronquillo,wgomezr,voto descaro importa voluntad pueblo paga tierra cayendo tronco Moereno pronto pedir asilo corruptos llegara hora,2019-03-31
Walter Javier,Gomez Ronquillo,wgomezr,Tranquilidad inteligencia expresiones madre tierra vayamos espacios seguros mesura mucha astucia,2019-03-31
Walter Javier,Gomez Ronquillo,wgomezr,vigilando ratas piensen burlar voluntad popular bien,2019-03-31
Walter Javier,Gomez Ronquillo,wgomezr,voto atenten democracia,2019-03-31
Walter Javier,Gomez Ronquillo,wgomezr,burlen voluntad popular expresada urnas,2019-03-31
Walter Javier,Gomez Ronquillo,wgomezr,necesitamos urgentemente atencion Pedro,2019-03-31
Walter Javier,Gomez Ronquillo,wgomezr,denuncia Salinas urgente pueblo Santa Elena necesita ayuda respuestas,2019-03-31
Walter Javier,Gomez Ronquillo,wgomezr,estimado Consejero usted parte CPCCS elegido legitimamente mandante decidimos,2019-03-31
Walter Javier,Gomez Ronquillo,wgomezr,Debemos exigir resultados finales,2019-04-01
Walter Javier,Gomez Ronquillo,wgomezr,exactamente pedido hace algun tiempo PAREN CONCURSOS,2019-04-01
Walter Javier,Gomez Ronquillo,wgomezr,Ojala mayoria cambiar actuado CPCCS PROVISIONAL pais recuperarse colocando gente honesta capaz puestos claves,2019-04-01
Walter Javier,Gomez Ronquillo,wgomezr,dias elecciones ojala determine tema consejero elegido votacion popular votacion pretenden irespetar,2019-04-01
Walter Javier,Gomez Ronquillo,wgomezr,Puro teatro vote robaron espinoza davalos increible respetan voto espero licenciado falle,2019-04-01
Walter Javier,Gomez Ronquillo,wgomezr,hora fraudulento quiere Resultados traen manos Exigimos hagan roben pueblo voto,2019-04-01
Walter Javier,Gomez Ronquillo,wgomezr,Consejero electo votado pueblo ecuatoriano actuare base Constitucion fiscalizare informare mandante cuantas veces necesario,2019-04-01
Walter Javier,Gomez Ronquillo,wgomezr,Solo necesitamos consejeros confirmen actuaran apegados constitucion hace Correistas anti Correistas,2019-04-01
Walter Javier,Gomez Ronquillo,wgomezr,presidente nacional confirmo defenderan decision millones ecuatorianos eligieron urnas nuevos miembros NOTA,2019-04-01
Walter Javier,Gomez Ronquillo,wgomezr,atentos evaluacion Transitorio encabezada,2019-04-02
Walter Javier,Gomez Ronquillo,wgomezr,pueblo ecuatoriano usted Walther Gomez,2019-04-01
Walter Javier,Gomez Ronquillo,wgomezr,Biennnn siga adelante vamos recuperar patria,2019-04-01
Walter Javier,Gomez Ronquillo,wgomezr,Reconteo votos Guayas Pilas,2019-04-01
Walter Javier,Gomez Ronquillo,wgomezr,colmo ilegalidad existe respeto pueblo reaccionamos,2019-04-01
Walter Javier,Gomez Ronquillo,wgomezr,dejes walter cuidado fraude,2019-04-02
Walter Javier,Gomez Ronquillo,wgomezr,Aplique segun gobierno pais democratico respeta derechos pueblo solo epoca campana,2019-04-02
Walter Javier,Gomez Ronquillo,wgomezr,Lideres politicos mientras apoyaban candidato hablaban eliminacion puede recoger todas firmas puede paso parece importa participacion,2019-04-02
Walter Javier,Gomez Ronquillo,wgomezr,Companero deje luche final buenos,2019-04-02
Walter Javier,Gomez Ronquillo,wgomezr,grato mantener entrevista ustedes informar pueblo ecuatoriano VERDADEROS MANDANTES NUEVA,2019-04-02
