nombre,apellidos,tweet_screen_name,tweet_text,tweet_date
Francisco,Jimenez Sanchez,fcojimenez21,problema drogas trabajaremos ejes PREVENCION programas deportivos culturales REHABILITACION Centros Municipales subsidiados REINSERCION Bolsa Municipal Empleo programas emprendimiento,2019-03-12
Francisco,Jimenez Sanchez,fcojimenez21,aqui CAMBIO Queremos Guayaquil transparencia gestion obra llegue sectores ciudad solucionar problemas ciudad medidas efectivas,2019-03-12
Francisco,Jimenez Sanchez,fcojimenez21,marzo decides Garrote EMPLEO,2019-03-12
Francisco,Jimenez Sanchez,fcojimenez21,Acompananos GRAN CARAVANA junto,2019-03-12
Francisco,Jimenez Sanchez,fcojimenez21,Queremos ciudad segura incluyente obra municipal llegue sectores Guayaquil gente quiere continuismo populismo quiere CAMBIO,2019-03-12
Francisco,Jimenez Sanchez,fcojimenez21,principal necesidad guayaquilenos empleo todas propuestas estan enfocadas mejorar condiciones vida prosperidad guayaquilenos familias,2019-03-12
Francisco,Jimenez Sanchez,fcojimenez21,Seguimos recorriendo Guayaquil manana Mercado Sauces junto,2019-03-12
Francisco,Jimenez Sanchez,fcojimenez21,20h00 pierdas candidatos concejal espero,2019-03-12
Francisco,Jimenez Sanchez,fcojimenez21,artista guayaquileno necesita oportunidades,2019-03-12
Francisco,Jimenez Sanchez,fcojimenez21,GRAN CARAVANA Vamos lograr juntos CAMBIO queremos Gracias masivo apoyo,2019-03-12
Francisco,Jimenez Sanchez,fcojimenez21,VIVO junto Conectate ahora,2019-03-13
Francisco,Jimenez Sanchez,fcojimenez21,Agenda actividades miercoles marzo,2019-03-13
Francisco,Jimenez Sanchez,fcojimenez21,Buenos dias Arrancamos jornada sintonicen tambien online siguiente link,2019-03-13
Francisco,Jimenez Sanchez,fcojimenez21,Maltrato olvido palabras escuchado gente recorridos Guayaquil cosas llegan alma guayaquilenos quieren continuismo populismo quieren CAMBIO responsabilidad futuro,2019-03-13
Francisco,Jimenez Sanchez,fcojimenez21,Vamos implementar Metro Fluvial medio transporte masivo complementario Metrovia Guayaquil necesita transporte publico integrado diversificado alternativa acorde realidad,2019-03-13
Francisco,Jimenez Sanchez,fcojimenez21,sintonicen tambien online siguiente link,2019-03-13
Francisco,Jimenez Sanchez,fcojimenez21,Organizaremos ciudad zonas cada Unidad Municipal Independiente presupuesto propio implementaremos Polideportivos Municipales chicos hagan deporte ademas actividades recreativas jovenes adultos,2019-03-13
Francisco,Jimenez Sanchez,fcojimenez21,vision Guayaquil menos multas empleo menos represion apoyo menos cemento arboles menos trafico deporte libre drogas obra municipal llegue sectores ciudad,2019-03-13
Francisco,Jimenez Sanchez,fcojimenez21,Casuarina junto compartiendo recorriendo junto gente linda sector quiere CAMBIO Guayaquil,2019-03-14
Francisco,Jimenez Sanchez,fcojimenez21,Agenda actividades jueves marzo,2019-03-14
Francisco,Jimenez Sanchez,fcojimenez21,jueves Francisco Jimenez candidato Alcaldia Guayaquil Movimiento CREO tema Plan trabajo,2019-03-14
Francisco,Jimenez Sanchez,fcojimenez21,Buenos dias tambien puede escuchar entrevista online siguiente link,2019-03-14
Francisco,Jimenez Sanchez,fcojimenez21,gente quiere continuismo populismo quiere CAMBIO Quieren propuestas forma Guayaquil cercano empleo,2019-03-14
Francisco,Jimenez Sanchez,fcojimenez21,sucede ciudad compete Municipio bien cierto funcion generar empleo puede promoverlo facilitarlo ejemplo Bolsa Empleo Municipal Corredores Comerciales reduccion tramites,2019-03-14
Francisco,Jimenez Sanchez,fcojimenez21,VIVO noticiero Cuarto Poder sintonicen online siguiente link,2019-03-14
Francisco,Jimenez Sanchez,fcojimenez21,Vamos mejorar facilitar vida guayaquilenos organizando ciudad zonas cada Unidad Municipal Independiente presupuesto propio,2019-03-14
Francisco,Jimenez Sanchez,fcojimenez21,marzo decides Achicharrado fresquito VOTA CREO,2019-03-14
Francisco,Jimenez Sanchez,fcojimenez21,Seguimos recorriendo Guayaquil junto futura Prefecta Guayas Gran caravana Acuarela Sauces Guayacanes Alborada,2019-03-14
Francisco,Jimenez Sanchez,fcojimenez21,marzo llega Guayaquil quieres Guayaquil Jimenez,2019-03-14
Francisco,Jimenez Sanchez,fcojimenez21,Buenos dias Arrancamos jornada sintonicen online,2019-03-15
Francisco,Jimenez Sanchez,fcojimenez21,visitado sectores Guayaquil escuchado testimonios impactado sectores llega obra Municipal propuestas fruto recorridos podemos defraudar esperanza quieren cambio,2019-03-15
Francisco,Jimenez Sanchez,fcojimenez21,coherente proponer campana propuestas reales factibles mejoren condiciones vida guayaquilenos,2019-03-15
Francisco,Jimenez Sanchez,fcojimenez21,procesos cambio hacen hechos palabras recorrido Guayaquil hace casi anos queremos organizar ciudad zonas cada Unidad Municipal Independiente obra llegue sectores,2019-03-15
Francisco,Jimenez Sanchez,fcojimenez21,Guayaquil ciudad puerto Necesitamos conciliar orden requiere ciudad apoyo trabajo requiere gente proponemos Corredores Comerciales calles existe comercio carnetizados censados puedan trabajar orden,2019-03-15
Francisco,Jimenez Sanchez,fcojimenez21,problematica drogas vamos trabajar ejes Prevencion rehabilitacion reinsercion Construiremos polideportivos verticales alejar chicos drogas centros rehabilitacion implementaremos Bolsa Municipal Empleo,2019-03-15
Francisco,Jimenez Sanchez,fcojimenez21,multas mijo marzo VOTA CREO,2019-03-15
Francisco,Jimenez Sanchez,fcojimenez21,acompananos GRAN CARAVANA CAMBIO,2019-03-15
Francisco,Jimenez Sanchez,fcojimenez21,Junto seguimos recorriendo Guayaquil Vamos lograr CAMBIO queremos,2019-03-15
Francisco,Jimenez Sanchez,fcojimenez21,viernes recorrimos GRAN CARAVANA varias ciudadelas norte Alborada Sauces Guayacanes Urdesa junto candidatos Concejal,2019-03-16
Francisco,Jimenez Sanchez,fcojimenez21,Guayaquil entero quiere CAMBIO Junto equipo candidatos Concejales Lista recorrimos gran caravana Gracias apoyo carino,2019-03-16
Francisco,Jimenez Sanchez,fcojimenez21,Terminamos GRAN CARAVANA centro Guayaquil GRACIAS acompanarnos tarde noche marzo VOTA CREO,2019-03-16
Francisco,Jimenez Sanchez,fcojimenez21,viene CAMBIO Junto vamos lograr,2019-03-16
Francisco,Jimenez Sanchez,fcojimenez21,manana Feria Libre Chemisse Parroquia Tarqui Gran recibimiento propuesta votaran CREO marzo,2019-03-16
Francisco,Jimenez Sanchez,fcojimenez21,Vamos implementar politica permanente Arborizacion Guayaquil marzo VOTA CREO,2019-03-16
Francisco,Jimenez Sanchez,fcojimenez21,compartimos guayaquilenos Bingo Pascuales Recibimos carino gente sectores visitamos GRACIAS apoyo,2019-03-16
Francisco,Jimenez Sanchez,fcojimenez21,almorzando Terminal Terrestre preguntaron quiero Alcalde respuesta Quiero Guayaquil menos multas empleo menos represion apoyo menos cemento arboles menos trafico deporte libre drogas,2019-03-17
Francisco,Jimenez Sanchez,fcojimenez21,Agenda actividades domingo marzo,2019-03-17
Francisco,Jimenez Sanchez,fcojimenez21,Gracias Cerecita Progreso Posorja recibirnos manana tarde domingo Masivo apoyo propuesta CAMBIO marzo VOTA CREO,2019-03-17
Francisco,Jimenez Sanchez,fcojimenez21,Vamos Guayaquil contaminacion,2019-03-18
Francisco,Jimenez Sanchez,fcojimenez21,domingo llevamos mensaje CAMBIO Morro Gracias recibirnos marzo VOTA CREO,2019-03-18
Francisco,Jimenez Sanchez,fcojimenez21,Agenda actividades lunes marzo,2019-03-18
Francisco,Jimenez Sanchez,fcojimenez21,Implementaremos Metro Fluvial Guayaquil complemento transporte masivo ciudad Ofrecemos soluciones impacten positivamente calidad vida guayaquilenos,2019-03-18
Francisco,Jimenez Sanchez,fcojimenez21,VIVO sintonicen,2019-03-18
Francisco,Jimenez Sanchez,fcojimenez21,vision seguridad asociativa integrada Policia Metropolitana trabajara directamente Policia Nacional patrullaje ciudad represion delitos criterio cercania organizara ciudad,2019-03-18
Francisco,Jimenez Sanchez,fcojimenez21,problema drogas trabajaremos ejes PREVENCION programas deportivos culturales REHABILITACION Centros Municipales subsidiados REINSERCION Bolsa Municipal Empleo programas emprendimiento,2019-03-18
Francisco,Jimenez Sanchez,fcojimenez21,GRAN CAMINATA Blvd Octubre junto 16h00 Acompananos,2019-03-18
Francisco,Jimenez Sanchez,fcojimenez21,Vamos implementar Metro Fluvial conectando ciudad guayaquilenos transporte publico rapido eficiente calidad marzo VOTA CREO,2019-03-18
Francisco,Jimenez Sanchez,fcojimenez21,Vamos implementar Metro Fluvial Conectaremos ciudad guayaquilenos transporte publico rapido eficiente calidad marzo VOTA CREO,2019-03-18
Francisco,Jimenez Sanchez,fcojimenez21,Dejemos lado continuismo abusivo vamos Guayaquil futuro marzo gran decision tomar Vamos construir juntos,2019-03-18
Francisco,Jimenez Sanchez,fcojimenez21,marzo VOTA CREO,2019-03-18
Francisco,Jimenez Sanchez,fcojimenez21,momento recorriendo centro Guayaquil junto futura Prefecta Guayas acompananos,2019-03-18
Francisco,Jimenez Sanchez,fcojimenez21,propuesta transporte fluvial justamente permitira movilizarte,2019-03-18
Francisco,Jimenez Sanchez,fcojimenez21,propone implemetar Metro Fluvial complemento transporte Guayaquil,2019-03-18
Francisco,Jimenez Sanchez,fcojimenez21,Gran inicio semana Recorrimos centro ciudad junto masivo apoyo guayaquilenos quieren CAMBIO marzo VOTA CREO,2019-03-19
Francisco,Jimenez Sanchez,fcojimenez21,Manana 11h00 GRAN CAMINATA Flor Bastion Acompananos,2019-03-19
Francisco,Jimenez Sanchez,fcojimenez21,Agenda actividades martes marzo,2019-03-19
Francisco,Jimenez Sanchez,fcojimenez21,Buenos dias Guayaquil Arrancamos jornada martes VIVO ahora,2019-03-19
Francisco,Jimenez Sanchez,fcojimenez21,Necesitamos obra favor ciudadanos empleo llegue sectores ciudad vamos organizar ciudad zonas casa Unidad Municipal Independiente presupuesto propio,2019-03-19
Francisco,Jimenez Sanchez,fcojimenez21,Guayaquil necesita policia integrada cooperativa Activaremos Policia Metropolitana patrullaje resguardo zonas inseguras control entrada salida escuelas colegios,2019-03-19
Francisco,Jimenez Sanchez,fcojimenez21,Necesitamos obra favor ciudadanos empleo llegue sectores ciudad vamos organizar ciudad zonas cada Unidad Municipal Independiente presupuesto propio,2019-03-19
Francisco,Jimenez Sanchez,fcojimenez21,ahora Pueden escuchar entrevista online siguiente link,2019-03-19
Francisco,Jimenez Sanchez,fcojimenez21,Guayaquil descuidada maltratada necesita cambio bien debe ciudada menos multas trabajo,2019-03-19
Francisco,Jimenez Sanchez,fcojimenez21,vision menos multas empleo menos represion apoyo menos cemento arboles menos trafico deporte libre drogas obra municipal llegue sectores ciudad,2019-03-19
Francisco,Jimenez Sanchez,fcojimenez21,Guayaquil Mercados Municipales debemos tener guarderias Necesitamos guarderias madres trabajan necesitan tener seguridad hijos esten buenas manos,2019-03-19
Francisco,Jimenez Sanchez,fcojimenez21,CAMBIO cada cerca marzo VOTA CREO,2019-03-19
Francisco,Jimenez Sanchez,fcojimenez21,Gran caminata Flor Bastion 11h00 acompananos,2019-03-19
Francisco,Jimenez Sanchez,fcojimenez21,programa Hora Pocho invito sintonizar online,2019-03-19
Francisco,Jimenez Sanchez,fcojimenez21,vision seguridad asociativa integrada Policia Metropolitana trabajara directamente Policia Nacional patrullaje ciudad prevencion represion delitos criterio cercania organizara ciudad,2019-03-19
Francisco,Jimenez Sanchez,fcojimenez21,Vamos reducir multas transito desproporcionadas afectan exageradamente bolsillo guayaquilenos complementaremos educacion vial horas trabajo comunitario,2019-03-19
Francisco,Jimenez Sanchez,fcojimenez21,GRAN CARAVANA junto 15h30 arrancamos Casuarina esperamos,2019-03-19
Francisco,Jimenez Sanchez,fcojimenez21,GRAN CAMINATA Flor Bastion manana alcaldia vamos lograr obra municipal llegue sectores ciudad marzo VOTA CREO,2019-03-19
Francisco,Jimenez Sanchez,fcojimenez21,Guayaquil quieres Guayaquil Jimenez llega CAMBIO marzo VOTA CREO,2019-03-19
Francisco,Jimenez Sanchez,fcojimenez21,juventud necesita lugares puedan desarrollar potencial mantenerse alejados drogas construiremos Polideportivos Municipales,2019-03-19
Francisco,Jimenez Sanchez,fcojimenez21,equipo CAMBIO sigue recorriendo Guayaquil GRAN CARAVANA Monte Sinai junto,2019-03-19
Francisco,Jimenez Sanchez,fcojimenez21,Agenda actividades miercoles marzo,2019-03-20
Francisco,Jimenez Sanchez,fcojimenez21,Buenos dias Guayaquil Arrancamos momento jornada online siguiente link,2019-03-20
Francisco,Jimenez Sanchez,fcojimenez21,alcaldia Policia Metropolitana tendra apoyo cercano ciudadanos Trabajara coordinacion constante Policia Nacional base criterios zonificacion ciudad,2019-03-20
Francisco,Jimenez Sanchez,fcojimenez21,Vamos implementar Metro Fluvial Conectaremos ciudad guayaquilenos transporte publico rapido eficiente calidad estara integrado sistema Metrovia,2019-03-20
Francisco,Jimenez Sanchez,fcojimenez21,falta CAMBIO marzo VOTA CREO,2019-03-20
Francisco,Jimenez Sanchez,fcojimenez21,ahora entrevista presentando propuesta guayaquilenos,2019-03-20
Francisco,Jimenez Sanchez,fcojimenez21,multas transito pueden equivalentes salario basico vamos reducirlas marzo VOTA CREO,2019-03-20
Francisco,Jimenez Sanchez,fcojimenez21,Gracias Martha Roldos recibirnos manana vienen grandes cosas Guayaquil llega CAMBIO,2019-03-20
Francisco,Jimenez Sanchez,fcojimenez21,sintonicen online,2019-03-20
Francisco,Jimenez Sanchez,fcojimenez21,Recuperemos patrimonio natural,2019-03-20
Francisco,Jimenez Sanchez,fcojimenez21,Seguimos caravana Guayaquil CAMBIO viene fuerza marzo Vota CREO,2019-03-20
Francisco,Jimenez Sanchez,fcojimenez21,Casa llena Cerramos jornada Flor Bastion GRACIAS carino marzo VOTA CREO voto vamos lograr,2019-03-21
Francisco,Jimenez Sanchez,fcojimenez21,GRAN CIERRE CAMPANA Junto cerramos campana iniciamos CAMBIO quieres esperamos,2019-03-21
Francisco,Jimenez Sanchez,fcojimenez21,Agenda actividades jueves marzo,2019-03-21
Francisco,Jimenez Sanchez,fcojimenez21,Buenos dias Arrancamos ultimo campana sintonicen,2019-03-21
Francisco,Jimenez Sanchez,fcojimenez21,empezamos GRAN CARAVANA cierre campana 10h00 Vergeles vamos recorrer toda ciudad junto,2019-03-21
Francisco,Jimenez Sanchez,fcojimenez21,esperamos 10h00 recorreremos GRAN CARAVANA CIERRE CAMPANA,2019-03-21
Francisco,Jimenez Sanchez,fcojimenez21,ahora,2019-03-21
Francisco,Jimenez Sanchez,fcojimenez21,Nadie regalado Meses atras dije recorreriamos toda ciudad hicimos Sabemos necesita Guayaquil propuestas carta presentacion llevar obra municipal sectores ciudad,2019-03-21
Francisco,Jimenez Sanchez,fcojimenez21,,2019-03-21
Francisco,Jimenez Sanchez,fcojimenez21,Guayaquil ciudad puerto existe comercio Vamos priorizar empleo medidas inteligentes Implementaremos Corredores Comerciales calles existe comercio modulos plegables censados carnetizados orden,2019-03-21
Francisco,Jimenez Sanchez,fcojimenez21,realidades guayaquilenos deben conocer,2019-03-21
Francisco,Jimenez Sanchez,fcojimenez21,Empezamos GRAN CARAVANA cierre campana junto,2019-03-21
Francisco,Jimenez Sanchez,fcojimenez21,Iniciamos gran caravana cambio junto domingo vota CAMBIO Vota,2019-03-21
Francisco,Jimenez Sanchez,fcojimenez21,Apoyando caravana CAMBIO Guayaquil junto,2019-03-21
Francisco,Jimenez Sanchez,fcojimenez21,Reportaje Televistazo GRAN CARAVANA cierre campana,2019-03-21
Francisco,Jimenez Sanchez,fcojimenez21,Muchas gracias Guayaquil acompanarnos GRAN CARAVANA CAMBIO cierre campana marzo VOTA CREO,2019-03-21
Francisco,Jimenez Sanchez,fcojimenez21,Reportaje GRAN CARAVANA cierre campana,2019-03-21
Francisco,Jimenez Sanchez,fcojimenez21,falta CAMBIO lograr marzo VOTA CREO,2019-03-22
Francisco,Jimenez Sanchez,fcojimenez21,Guayaquilenos marzo nueva oportunidad cambiar,2019-03-22
Francisco,Jimenez Sanchez,fcojimenez21,populismo continuismo Guayaquil quiere CAMBIO,2019-03-22
Francisco,Jimenez Sanchez,fcojimenez21,Guayaquilenos marzo nueva oportunidad cambiar,2019-03-23
Francisco,Jimenez Sanchez,fcojimenez21,Atencion VIVO conectate ahora,2019-03-23
Francisco,Jimenez Sanchez,fcojimenez21,Gracias Guayaquil,2019-03-23
Francisco,Jimenez Sanchez,fcojimenez21,Guayaquilenos Manana voto iniciaremos verdadero CAMBIO necesita Guayaquil,2019-03-23
Francisco,Jimenez Sanchez,fcojimenez21,Gracias increibles meses gran oportunidad Vamos optimismo construir sueno conjunto Vamos merecemos,2019-03-24
Francisco,Jimenez Sanchez,fcojimenez21,Ejerciendo derecho voto acompanado familia equipo seguro saldremos triunfantes jornada CAMBIO llegara favor guayaquilenos,2019-03-24
Francisco,Jimenez Sanchez,fcojimenez21,candidato Alcaldia movimiento CREO pidio respetar voluntad pueblo guayaquileno tras sufragar pasadas colegio Matilde Amador Video,2019-03-24
Francisco,Jimenez Sanchez,fcojimenez21,Acompanamos sufragar compania simpatizantes partidarios,2019-03-24
Francisco,Jimenez Sanchez,fcojimenez21,Guayaquil,2019-03-25
Francisco,Jimenez Sanchez,fcojimenez21,concienciar inclusion tolerancia respeto hacia personas Autismo dejemos lado malas etiquetas facilitemos mejor herramientas metas ponen,2019-04-02
Francisco,Jimenez Sanchez,fcojimenez21,hace anos terremoto solidaridad gran abrazo hermanos manabitas esmeraldenos familias victimas coraje valor trabajo superando lamentable tragedia,2019-04-16
Francisco,Jimenez Sanchez,fcojimenez21,invito sintonizar entrevistas manana,2019-04-21
Francisco,Jimenez Sanchez,fcojimenez21,celebra reflexionemos cuidado planeta comprometamonos realizar acciones evitar siga contaminando Cuidemos hogar futuras generaciones,2019-04-22
Francisco,Jimenez Sanchez,fcojimenez21,celebra reflexionemos cuidado planeta comprometamonos realizar acciones evitar siga contaminando Cuidemos hogar futuras generaciones,2019-04-22
Francisco,Jimenez Sanchez,fcojimenez21,invito seguir entrevistas manana,2019-04-23
Francisco,Jimenez Sanchez,fcojimenez21,proposito recomiendo gran libro Alquimistas narrativa apasionante poderosos mundo afrontan crisis financieras planetarias ustedes libro recomiendan,2019-04-23
Francisco,Jimenez Sanchez,fcojimenez21,invito seguir entrevistas manana,2019-04-24
Francisco,Jimenez Sanchez,fcojimenez21,fallecio Julio Juan Romero Rivas director hombre bueno siempre mostro apertura pluralismo radio descanse abrazo fuerte consuelo familias hora pesar,2019-04-28
Francisco,Jimenez Sanchez,fcojimenez21,fallecio Julio Juan Romero Rivas director hombre bueno siempre mostro apertura pluralismo radio descanse abrazo fuerte consuelo familiares hora pesar,2019-04-28
Francisco,Jimenez Sanchez,fcojimenez21,Batalla tras batalla libertad lucha respaldo presidente pueblo venezolano Dios bendiga Venezuela,2019-04-30
Francisco,Jimenez Sanchez,fcojimenez21,Feliz aquellos esfuerzo dedicacion aportan construir mejor Ecuador cada,2019-05-01
Francisco,Jimenez Sanchez,fcojimenez21,Conversatorio Reformas Codigo Democracia expuesto Apreciamos espacio discusion dejamos claro necesitamos sistema electoral transparente eficiente,2019-05-10
Francisco,Jimenez Sanchez,fcojimenez21,fuerte abrazo todas madres capacidad amar incondicionalmente entrega compromiso familia especial feliz mama acompanado siempre cada momento vida,2019-05-12
Francisco,Jimenez Sanchez,fcojimenez21,Arrastramos deficit instititucional agudizado correismo sistema pesos contrapesos destruido,2019-05-13
Francisco,Jimenez Sanchez,fcojimenez21,invito sintonizar manana entrevista,2019-05-15
Francisco,Jimenez Sanchez,fcojimenez21,Pongamos practica planeta necesita,2019-05-17
