nombre,apellidos,tweet_screen_name,tweet_text,tweet_date
Francisco,Jimenez Sanchez,fcojimenez21,Seguimos recorriendo Guayaquil Mercado Santa Teresita Parroquia Febres Cordero presentando propuesta comerciantes sector Vamos potenciar infraestructura mercados darles connotacion turistica,2019-02-19
Francisco,Jimenez Sanchez,fcojimenez21,Radio VIVO conversando propuestas,2019-02-19
Francisco,Jimenez Sanchez,fcojimenez21,Vamos organizar ciudad zonas cada Unidad Municipal Independiente presupuesto propio elaborado propuestas funcion buscar progreso guayaquilenos,2019-02-19
Francisco,Jimenez Sanchez,fcojimenez21,realidades duras Guayaquil veces cuesta aceptarlas vamos mejorarlas Queremos construir ilusiona,2019-02-19
Francisco,Jimenez Sanchez,fcojimenez21,Gracias recibirme minutos conversar vida futbol pasion comparto pequeno,2019-02-19
Francisco,Jimenez Sanchez,fcojimenez21,radio pueden entrevista VIVO,2019-02-19
Francisco,Jimenez Sanchez,fcojimenez21,Amigos Manana presentando guayaquilenos propuestas Cuentanos temas gustaria debata,2019-02-20
Francisco,Jimenez Sanchez,fcojimenez21,llevara cabo debate candidatos Alcaldes organizado Camara Comercio negado asistir actitud antidemocratica falta respeto votantes,2019-02-20
Francisco,Jimenez Sanchez,fcojimenez21,llevara cabo debate candidatos Alcaldes organizado Camara Comercio negado asistir actitud antidemocratica falta respeto votantes,2019-02-20
Francisco,Jimenez Sanchez,fcojimenez21,Candidato debate merece voto,2019-02-20
Francisco,Jimenez Sanchez,fcojimenez21,Amigos 20h00 presentes VIVO streaming oficial,2019-02-20
Francisco,Jimenez Sanchez,fcojimenez21,listos breves momentos arranca,2019-02-21
Francisco,Jimenez Sanchez,fcojimenez21,partido tercero llegar Escucha propuestas 20h00 FbLive YouTube,2019-02-21
Francisco,Jimenez Sanchez,fcojimenez21,Vamos bajar multas transito desproporcionadas,2019-02-21
Francisco,Jimenez Sanchez,fcojimenez21,Vamos organizar ciudad zonas cada Unidad Municipal Independiente presupuesto propio,2019-02-21
Francisco,Jimenez Sanchez,fcojimenez21,Felicito candidatos asistieron debate critico frontalmente asistieron quitarle oportunidad guayaquilenos conocer propuestas,2019-02-21
Francisco,Jimenez Sanchez,fcojimenez21,Candidato debate merece voto,2019-02-21
Francisco,Jimenez Sanchez,fcojimenez21,Vamos recuperar navegabilidad Guayas,2019-02-21
Francisco,Jimenez Sanchez,fcojimenez21,Alcalde EMPLEO,2019-02-21
Francisco,Jimenez Sanchez,fcojimenez21,candidato GANADOR sera NUEVO ALCALDE hizo candidatos,2019-02-21
Francisco,Jimenez Sanchez,fcojimenez21,vision futuro posible,2019-02-21
Francisco,Jimenez Sanchez,fcojimenez21,Vamos bajar multas transito,2019-02-21
Francisco,Jimenez Sanchez,fcojimenez21,GANADOR Excelentes propuestas,2019-02-21
Francisco,Jimenez Sanchez,fcojimenez21,Gracias apoyo noche Cumplimos guayaquilenos presentando propuestas Gracias invitacion,2019-02-21
Francisco,Jimenez Sanchez,fcojimenez21,Gracias apoyo noche Cumplimos guayaquilenos presentando propuestas Gracias invitacion,2019-02-21
Francisco,Jimenez Sanchez,fcojimenez21,Agenda actividades jueves febrero,2019-02-21
Francisco,Jimenez Sanchez,fcojimenez21,VIVO pueden acceder entrevista siguiente link,2019-02-21
Francisco,Jimenez Sanchez,fcojimenez21,proponemos cosas ejemplo Metro Fluvial complemento transporte masivo ciudad Ofrecemos soluciones sencillas buscan impactar positivamente calidad vida guayaquilenos,2019-02-21
Francisco,Jimenez Sanchez,fcojimenez21,problematica drogas vamos trabajar ejes Prevencion rehabilitacion reinsercion Construiremos Polideportivos Municipales alejar chicos drogas centros rehabilitacion implementaremos Bolsa Empleo Municipal,2019-02-21
Francisco,Jimenez Sanchez,fcojimenez21,Vamos bajar multas transito busco combinar multas razonables educacion vial trabajo comunitario,2019-02-21
Francisco,Jimenez Sanchez,fcojimenez21,Vamos lograr obra municipal llegue sectores ciudad vamos organizar ciudad zonas cada Unidad Municipal Independiente presupuesto propio,2019-02-21
Francisco,Jimenez Sanchez,fcojimenez21,Policia Metropolitana trabajara directamente colaboracion Policia Nacional patrullaje ciudad prevencion represion delitos criterio cercania organizara ciudad,2019-02-21
Francisco,Jimenez Sanchez,fcojimenez21,juventud necesita lugares puedan desarrollar potencial mantenerse alejados drogas construiremos Polideportivos Municipales,2019-02-21
Francisco,Jimenez Sanchez,fcojimenez21,Candidato debate merece voto,2019-02-21
Francisco,Jimenez Sanchez,fcojimenez21,tarde Fortin Parroquia Tarqui recorriendo sector presentando propuesta Vamos lograr obra municipal llegue sectores ciudad,2019-02-22
Francisco,Jimenez Sanchez,fcojimenez21,tarde Fortin Parroquia Tarqui recorriendo sector presentando propuesta Vamos lograr obra municipal llegue sectores ciudad,2019-02-22
Francisco,Jimenez Sanchez,fcojimenez21,Atencion noche 20h00 transmision semanal junto acompanara conversar propuestas esperamos,2019-02-22
Francisco,Jimenez Sanchez,fcojimenez21,Amigos VIVO conversando debate propuestas,2019-02-22
Francisco,Jimenez Sanchez,fcojimenez21,Alcalde EMPLEO,2019-02-22
Francisco,Jimenez Sanchez,fcojimenez21,Manana 11h00 junto Flor Bastion Encuentro Mujeres Proyecto Emprende actua mujer,2019-02-22
Francisco,Jimenez Sanchez,fcojimenez21,Agenda actividades viernes febrero,2019-02-22
Francisco,Jimenez Sanchez,fcojimenez21,Agenda actividades viernes febrero,2019-02-22
Francisco,Jimenez Sanchez,fcojimenez21,tema habitacional Guayaquil afrontar tema legalizaciones estan pendientes sectores Monte Sinai Ciudad Dios lugares necesitan regularizados,2019-02-22
Francisco,Jimenez Sanchez,fcojimenez21,Organizaremos ciudad zonas cada unidad municipal independiente presupuesto propio implementaremos Polideportivos Municipales chicos hagan deporte ademas actividades recreativas jovenes adultos,2019-02-22
Francisco,Jimenez Sanchez,fcojimenez21,Vamos construir Alcaldia rostro humano cercania obra municipal llegue sectores ciudad,2019-02-22
Francisco,Jimenez Sanchez,fcojimenez21,guayaquilenos necesitan facilitemos empleo,2019-02-22
Francisco,Jimenez Sanchez,fcojimenez21,manana Flor Bastion encuentro mujeres proyecto Emprende actua mujer junto equipo candidatos concejal alcaldia vamos apoyar emprendimiento Gracias invitacion,2019-02-22
Francisco,Jimenez Sanchez,fcojimenez21,VIVO Radio Comunicacion Efectiva online,2019-02-22
Francisco,Jimenez Sanchez,fcojimenez21,candidato alcaldia enfatiza construira polideportivos alejar jovenes drogas,2019-02-22
Francisco,Jimenez Sanchez,fcojimenez21,fortalecer comercio tarde viernes recorrimos Bahia Guayaquil Gracias comerciantes gran recibimiento,2019-02-23
Francisco,Jimenez Sanchez,fcojimenez21,Vamos implementar Metro Fluvial sistema transporte moderno agradable,2019-02-23
Francisco,Jimenez Sanchez,fcojimenez21,tarde noche sabado recorrimos hermoso Barrio Penas lluvia detiene camino lograr,2019-02-24
Francisco,Jimenez Sanchez,fcojimenez21,Vamos construir administracion municipal cercana moderna segura,2019-02-24
Francisco,Jimenez Sanchez,fcojimenez21,manana domingo visitamos Mercado Sauces Gran recibimiento GRACIAS escuchar propuestas,2019-02-24
Francisco,Jimenez Sanchez,fcojimenez21,tarde realizamos minga Estero Salado alcaldia vamos recuperarlo base criterios Oxigenacion agua restauracion redireccionamiento alcantarillado cumplimiento regulaciones medioambientales,2019-02-24
Francisco,Jimenez Sanchez,fcojimenez21,CREO Vota CREO,2019-02-25
Francisco,Jimenez Sanchez,fcojimenez21,guayaquilenos necesitan facilitemos empleo,2019-02-25
Francisco,Jimenez Sanchez,fcojimenez21,18h00 VIVO canal Cable canal Claro canal Univisa canal Tambien pueden acceder streaming,2019-02-25
Francisco,Jimenez Sanchez,fcojimenez21,Estero necesita necesitamos Estero,2019-02-26
Francisco,Jimenez Sanchez,fcojimenez21,VIVO Ecuador Decide 2019 canal Cable canal Claro canal Univisa canal Tambien pueden acceder streaming,2019-02-25
Francisco,Jimenez Sanchez,fcojimenez21,entrevistado Francisco Jimenez Sanchez candidato alcadia Guayaquil,2019-02-25
Francisco,Jimenez Sanchez,fcojimenez21,noche semaforo Policentro saludando transitaban vehiculos cada cerca,2019-02-26
Francisco,Jimenez Sanchez,fcojimenez21,Agenda actividades martes febrero,2019-02-26
Francisco,Jimenez Sanchez,fcojimenez21,Buenos dias VIVO sintonicen,2019-02-26
Francisco,Jimenez Sanchez,fcojimenez21,candidatura distinta concebi escritorio sino caminando gente escuchando necesidades sentir presente proyectarse futuro,2019-02-26
Francisco,Jimenez Sanchez,fcojimenez21,Guayaquil vivido control politico eficiencia servicios quedado atras comparacion ciudades mundo proponemos organizacion ciudad zonas cada presupuesto propio,2019-02-26
Francisco,Jimenez Sanchez,fcojimenez21,trata mirar pasado trata medir presente mirar futuro candidato Alcaldia Guayaquil,2019-02-26
Francisco,Jimenez Sanchez,fcojimenez21,Vamos aumentar unidades Metrovia terminar Troncales Ademas recuperaremos navegabilidad Guayas Metro Fluvial,2019-02-26
Francisco,Jimenez Sanchez,fcojimenez21,Vamos inundar canchas deportivas ciudad Polideportivos Municipales medio alejar jovenes drogas mantenerlos ocupados practicas positivas construir disciplina,2019-02-26
Francisco,Jimenez Sanchez,fcojimenez21,comercio informal emprendimiento estan relacionados ciudad emprendedores legalizar corredores comerciales repontenciar mercados obra debe funcion gente,2019-02-26
Francisco,Jimenez Sanchez,fcojimenez21,ciudad explotar Guayas habilitar muelles ciudad conectar cantones vecinos,2019-02-26
Francisco,Jimenez Sanchez,fcojimenez21,Proponemos organizacion distritalizada decentralizar presupuesto obras,2019-02-26
Francisco,Jimenez Sanchez,fcojimenez21,noche VIVO vamos conversar vamos recuperar Estero Salado pierdas,2019-02-26
Francisco,Jimenez Sanchez,fcojimenez21,Hola Juan Hace meses hicimos video opinion respecto Saludos,2019-02-26
Francisco,Jimenez Sanchez,fcojimenez21,programa Aprendiendo Valientes Muchas gracias invitacion,2019-02-26
Francisco,Jimenez Sanchez,fcojimenez21,Amigos Pueden noche siguiente link,2019-02-27
Francisco,Jimenez Sanchez,fcojimenez21,tarde recorrimos Avenida Victor Emilio Estrada Urdesa junto Vamos lograr juntos,2019-02-27
Francisco,Jimenez Sanchez,fcojimenez21,Agenda actividades miercoles febrero,2019-02-27
Francisco,Jimenez Sanchez,fcojimenez21,ATENCION 11h00 convocamos medios RUEDA PRENSA Central Quito Gomez Rendon denunciar hechos sucedidos Puente Unidad Nacional noche ayer,2019-02-27
Francisco,Jimenez Sanchez,fcojimenez21,invito RUEDA PRENSA hechos noche ayer Puente Unidad Nacional siguiente link,2019-02-27
Francisco,Jimenez Sanchez,fcojimenez21,noche ayer acto prepotencia propaganda puente Unidad Nacional retirada Municipio Guayaquil Justicia Vigilancia solo dejaron propaganda Abro hilo,2019-02-27
Francisco,Jimenez Sanchez,fcojimenez21,suceso recorrido tarde noche ayer Urdesa terminando mismo Guayarte increpo presencia solicito retirarnos pasando Acaso dueno guayaquilenos,2019-02-27
Francisco,Jimenez Sanchez,fcojimenez21,acompanara Francisco Jimenez fcojimenez21 candidato Alcalde Guayaquil movimiento CREO Sintonizanos,2019-02-27
Francisco,Jimenez Sanchez,fcojimenez21,VIVO sintonicen tambien streaming siguiente link,2019-02-27
Francisco,Jimenez Sanchez,fcojimenez21,abuso,2019-02-27
Francisco,Jimenez Sanchez,fcojimenez21,gente cree duena ciudad Quieres saber paso Guayarte Enterate siguiente video,2019-02-27
Francisco,Jimenez Sanchez,fcojimenez21,VIVO programa sintonicen tambien pueden acceder siguiente link,2019-02-27
Francisco,Jimenez Sanchez,fcojimenez21,completar Metrovia actualmente unidades aumentaremos unidades Terminaremos Troncales lado implementaremos Metro Fluvial medio transporte recuperaremos navegabilidad Guayas,2019-02-27
Francisco,Jimenez Sanchez,fcojimenez21,marzo oportunidad dejar represion pasado,2019-02-28
Francisco,Jimenez Sanchez,fcojimenez21,Buenos dias radio sintonicen,2019-02-28
Francisco,Jimenez Sanchez,fcojimenez21,Vamos implementar Metro Fluvial servicio transporte masivo Guayaquil proyecto puede implementar meses aportara descongestionar trafico ciudad,2019-02-28
Francisco,Jimenez Sanchez,fcojimenez21,Vamos reducir multas transito desproporcionadas afectan exageradamente bolsillo guayaquilenos,2019-02-28
Francisco,Jimenez Sanchez,fcojimenez21,Vamos reducir multas transito desproporcionadas afectan exageradamente bolsillo guayaquilenos complementaremos educacion vial horas trabajo comunitario,2019-02-28
Francisco,Jimenez Sanchez,fcojimenez21,noche sera transmitido streaming,2019-02-28
Francisco,Jimenez Sanchez,fcojimenez21,Guayaquil artista,2019-02-28
Francisco,Jimenez Sanchez,fcojimenez21,GRABA celular numero 8745 escribenos nombre apellido agregaremos Linea Oficial Francisco Jimenez Recibiras contenido EXCLUSIVO Francisco dias ademas podras contarnos,2019-02-28
Francisco,Jimenez Sanchez,fcojimenez21,noche sera transmitido streaming,2019-02-28
Francisco,Jimenez Sanchez,fcojimenez21,noche 21h00 transmitido streaming,2019-02-28
Francisco,Jimenez Sanchez,fcojimenez21,Arrancamos Conoce perfil academico,2019-03-01
Francisco,Jimenez Sanchez,fcojimenez21,Arrancamos Conoce perfil academico,2019-03-01
Francisco,Jimenez Sanchez,fcojimenez21,Guayaquil proyectarse futuro acercar obra municipal gente vamos organizar ciudad zonas cada Unidad Municipal Independiente presupuesto propio,2019-03-01
Francisco,Jimenez Sanchez,fcojimenez21,problema drogas trabajaremos ejes PREVENCION programas deportivos culturales REHABILITACION Centros Municipales subsidiados REINSERCION Bolsa Municipal Empleo programas emprendimiento,2019-03-01
Francisco,Jimenez Sanchez,fcojimenez21,Alcalde EMPLEO,2019-03-01
Francisco,Jimenez Sanchez,fcojimenez21,economia mueve incentivos desincentivos propuestas buscan alternativas jovenes superen,2019-03-01
Francisco,Jimenez Sanchez,fcojimenez21,economia mueve incentivos desincentivos propuestas buscan alternativas jovenes empleo,2019-03-01
Francisco,Jimenez Sanchez,fcojimenez21,Guayaquil necesita transporte publico calidad diversificado vamos implementar Metro Fluvial,2019-03-01
Francisco,Jimenez Sanchez,fcojimenez21,puede hacer propuesta transporte fluvial investigacion previa hecho Escucha detalles,2019-03-01
Francisco,Jimenez Sanchez,fcojimenez21,mensaje acerca adolescentes importante informarse construir futuro hace apoyandolos olvidandolos,2019-03-01
Francisco,Jimenez Sanchez,fcojimenez21,vision futuro Guayaquil Visiten conozcan todas propuestas,2019-03-01
Francisco,Jimenez Sanchez,fcojimenez21,Agenda actividades marzo,2019-03-01
Francisco,Jimenez Sanchez,fcojimenez21,Implementaremos Metro Fluvial complemento medio transporte masivo Guayaquil Ademas reduciremos multas transito complementado programas educacion vial horas trabajo comunitario,2019-03-01
Francisco,Jimenez Sanchez,fcojimenez21,lograr obra municipal llegue sectores ciudad vamos organizar ciudad zonas cada Unidad Municipal Independiente presupuesto propio,2019-03-01
Francisco,Jimenez Sanchez,fcojimenez21,lograr obra municipal llegue sectores Guayaquil vamos organizar ciudad zonas cada Unidad Municipal Independiente presupuesto propio,2019-03-01
Francisco,Jimenez Sanchez,fcojimenez21,Vamos conciliar orden ciudad progreso merece gente Implementaremos corredores comerciales calles existe comercio censados carnetizados modulos plegables comerciantes desarrollen actividad comercial,2019-03-01
Francisco,Jimenez Sanchez,fcojimenez21,radio VIVO sintonicen streaming,2019-03-01
Francisco,Jimenez Sanchez,fcojimenez21,alcalde EMPLEO Guayaquil solo ciudad trabajadores sino tambien emprendedores Vamos mejorar condiciones empleo guayaquilenos,2019-03-01
Francisco,Jimenez Sanchez,fcojimenez21,Policia Metropolitana tendra apoyo cercano ciudadanos Trabajara coordinacion constante Policia Nacional base criterios zonificacion ciudad,2019-03-01
Francisco,Jimenez Sanchez,fcojimenez21,VIVO Canal Digital,2019-03-01
Francisco,Jimenez Sanchez,fcojimenez21,Quieres conocer propuestas Mira siguiente video Visita pagina,2019-03-01
Francisco,Jimenez Sanchez,fcojimenez21,tarde viernes recorrimos Monte Sinai alcaldia vamos lograr obra municipal llegue sectores ciudad,2019-03-01
Francisco,Jimenez Sanchez,fcojimenez21,Queremos Guayaquil conectado,2019-03-02
Francisco,Jimenez Sanchez,fcojimenez21,peaje Costa Manejen cuidado Saludanos quieres CAMBIO Guayaquil,2019-03-02
Francisco,Jimenez Sanchez,fcojimenez21,Gran actividad manana tarde peaje Costa Aprovechamos saludar viajeros desearles buen viaje gente quiere CAMBIO,2019-03-02
Francisco,Jimenez Sanchez,fcojimenez21,Vamos recuperar Estero Salado,2019-03-03
Francisco,Jimenez Sanchez,fcojimenez21,Vamos recuperar Estero Salado,2019-03-03
Francisco,Jimenez Sanchez,fcojimenez21,Vamos construir administracion municipal cercana moderna segura,2019-03-04
Francisco,Jimenez Sanchez,fcojimenez21,Vamos llenar ciudad arboles,2019-03-05
Francisco,Jimenez Sanchez,fcojimenez21,Agenda actividades miercoles marzo,2019-03-06
Francisco,Jimenez Sanchez,fcojimenez21,Buenos dias VIVO sintonicen 1030 tambien streaming,2019-03-06
Francisco,Jimenez Sanchez,fcojimenez21,Abuso olvido palabras ecuchado recorridos justamente vamos cambiar abuso maltrato comerciantes olvido lograremos obra llegue sectores ciudad,2019-03-06
Francisco,Jimenez Sanchez,fcojimenez21,Guayaquil ciudad proyectarse futuro empleo medidas inteligentes mirada humana ganas generar cambio grandes cualquier obstaculo camino,2019-03-06
Francisco,Jimenez Sanchez,fcojimenez21,pueden esperar trabajo comprension problemas aquejan Guayaquil hacer ciudad verdadero compromiso guayaquilenos,2019-03-06
Francisco,Jimenez Sanchez,fcojimenez21,hecho vamos seguir haciendo distrito,2019-03-06
Francisco,Jimenez Sanchez,fcojimenez21,VIVO Hora Pocho pueden verlo siguiente link,2019-03-06
Francisco,Jimenez Sanchez,fcojimenez21,modelo administracion actual cumplio ciclo solo edificio puede administrar ciudad vamos organizar ciudad zonas cada Unidad Municipal Independiente presupuesto propio,2019-03-06
Francisco,Jimenez Sanchez,fcojimenez21,modelo administracion actual cumplio ciclo solo edificio puede administrar Guayaquil vamos organizar ciudad zonas cada Unidad Municipal Independiente presupuesto propio,2019-03-06
Francisco,Jimenez Sanchez,fcojimenez21,Guayaquil Mercados Municipales debemos tener guarderias Necesitamos guarderias madres trabajan necesitan tener seguridad hijos esten buenas manos,2019-03-06
Francisco,Jimenez Sanchez,fcojimenez21,manana Garcia Aviles Colon junto candidatos concejal presentando propuestas ciudadanos,2019-03-06
Francisco,Jimenez Sanchez,fcojimenez21,20h00 VIVO conversando recientes inundaciones Guayaquil contestando todas inquietudes espero,2019-03-06
Francisco,Jimenez Sanchez,fcojimenez21,Multas desproporcionadas multas justas marzo DECIDETE cambiar,2019-03-06
Francisco,Jimenez Sanchez,fcojimenez21,marzo acompanara candidato Alcadia reservas,2019-03-06
Francisco,Jimenez Sanchez,fcojimenez21,tarde Isla Trintaria presentando propuesta habitantes sector Gracias recibirnos carino esperanza CAMBIO,2019-03-06
Francisco,Jimenez Sanchez,fcojimenez21,Agenda actividades jueves marzo,2019-03-07
Francisco,Jimenez Sanchez,fcojimenez21,Buenos dias manana Machala Padre Solano saludando presentando propuesta guayaquilenos temprano salen trabajar,2019-03-07
Francisco,Jimenez Sanchez,fcojimenez21,VIVO sintonicen streaming siguiente link,2019-03-07
Francisco,Jimenez Sanchez,fcojimenez21,propongo novelerias botar plata vamos darle prioridad obra llegue sectores ciudad obras basicas legalizaciones alcantarillado agua potable asfaltado,2019-03-07
Francisco,Jimenez Sanchez,fcojimenez21,propuestas hechas consultor comodamente sentado sillon elaboradas base escuchamos gente recorridos Guayaquil,2019-03-07
Francisco,Jimenez Sanchez,fcojimenez21,Guayaquil CREO,2019-03-07
Francisco,Jimenez Sanchez,fcojimenez21,Gran jornada tarde recorrimos Pascuales recibimos carino apoyo quieren verdadero cambio Guayaquil Gracias,2019-03-08
Francisco,Jimenez Sanchez,fcojimenez21,noche conversatorio Universidad Casa Grande estudiantes Ciencias Politicas Comunicacion Gracias amable invitacion,2019-03-08
Francisco,Jimenez Sanchez,fcojimenez21,noche compartimos Conversatorio moradores Ciudadela Gracias recibirnos escuchar propuestas,2019-03-08
Francisco,Jimenez Sanchez,fcojimenez21,Buenos dias 07h00 sintoniza tambien online siguiente link,2019-03-08
Francisco,Jimenez Sanchez,fcojimenez21,Agenda actividades viernes marzo,2019-03-08
Francisco,Jimenez Sanchez,fcojimenez21,Vamos conciliar orden ciudad progreso merece gente Implementaremos corredores comerciales calles existe comercio censados carnetizados modulos plegables comerciantes desarrollen actividad comercial,2019-03-08
Francisco,Jimenez Sanchez,fcojimenez21,Guayaquil hacer aprovechar recursos naturales vamos implementar Metro Fluvial medio transporte masivo lograr descongestionar transito ciudad,2019-03-08
Francisco,Jimenez Sanchez,fcojimenez21,Guayaquil proyectarse futuro Acercaremos obra municipal gente vamos organizar ciudad zonas cada Unidad Municipal Independiente presupuesto propio,2019-03-08
Francisco,Jimenez Sanchez,fcojimenez21,Arriba mujeres suenan luchan alegria contagian hermoso FELIZ MUJER,2019-03-08
Francisco,Jimenez Sanchez,fcojimenez21,disfrutamos delicioso almuerzo mujeres emprendedoras guayaquilenas Gracias apoyo compartir junto,2019-03-08
Francisco,Jimenez Sanchez,fcojimenez21,marzo decides Guayaquil gris Guayaquil COLORES ECOLOGICO,2019-03-08
Francisco,Jimenez Sanchez,fcojimenez21,Recorrimos tarde viernes Octubre compania candidatos concejal guayaquilenos quieren CAMBIO,2019-03-08
Francisco,Jimenez Sanchez,fcojimenez21,Recorrimos tarde viernes Octubre compania candidatos concejal guayaquilenos quieren CAMBIO,2019-03-08
Francisco,Jimenez Sanchez,fcojimenez21,acompanara Candidato Alcalde Guayaquil Escuchanos vivo Guayas,2019-03-09
Francisco,Jimenez Sanchez,fcojimenez21,noche Bastion Popular Bloque conversatorio moradores sector Gran recibimiento Gracias permitirnos visitarlos presentar propuesta,2019-03-09
Francisco,Jimenez Sanchez,fcojimenez21,Agenda actividades sabado marzo,2019-03-09
Francisco,Jimenez Sanchez,fcojimenez21,19h00,2019-03-09
Francisco,Jimenez Sanchez,fcojimenez21,noche invitados Salud Pueden transmision vivo cuenta fcojimenez21,2019-03-10
Francisco,Jimenez Sanchez,fcojimenez21,soportamos prepotencia creen duenos ciudad marzo manifiestate abusos quieren perpetuarse poder,2019-03-10
Francisco,Jimenez Sanchez,fcojimenez21,soportamos prepotencia creen duenos ciudad marzo manifiestate abusos quieren perpetuarse poder,2019-03-10
Francisco,Jimenez Sanchez,fcojimenez21,soportamos prepotencia creen duenos ciudad marzo manifiestate abusos quieren perpetuarse poder,2019-03-10
Francisco,Jimenez Sanchez,fcojimenez21,decides marzo Estero olvidado Estero salvado VOTA CREO,2019-03-11
Francisco,Jimenez Sanchez,fcojimenez21,domingo Pascuales Gracias recibirnos apoyar alegria esperanza CAMBIO propuestas marzo VOTA CREO,2019-03-11
Francisco,Jimenez Sanchez,fcojimenez21,Agenda actividades lunes marzo,2019-03-11
Francisco,Jimenez Sanchez,fcojimenez21,Buenos dias 1190 pueden escucharlo online siguiente link,2019-03-11
Francisco,Jimenez Sanchez,fcojimenez21,Alcalde EMPLEO Implementaremos Corredores Comerciales calles existe comercio comerciantes puedan trabajar orden tranquilidad,2019-03-11
Francisco,Jimenez Sanchez,fcojimenez21,Alcalde EMPLEO Implementaremos Corredores Comerciales calles existe comercio comerciantes puedan trabajar orden tranquilidad,2019-03-11
Francisco,Jimenez Sanchez,fcojimenez21,ahora VIVO sintonicen tambien pueden escuchar entrevista online siguiente link,2019-03-11
Francisco,Jimenez Sanchez,fcojimenez21,claro guayaquilenos quieren continuismo populismo gente quiere CAMBIO vamos llevar obra sectores ciudad,2019-03-11
Francisco,Jimenez Sanchez,fcojimenez21,Guayaquil necesita policia integrada cooperativa Activaremos Policia Metropolitana patrullaje resguardo zonas inseguras control entrada salida escuelas colegios,2019-03-11
Francisco,Jimenez Sanchez,fcojimenez21,recorrimos Pascuales junto futura Prefecta Guayas viene CAMBIO,2019-03-11
Francisco,Jimenez Sanchez,fcojimenez21,tarde recorriendo Guerreros Fortin junto Gracias recibirnos,2019-03-11
Francisco,Jimenez Sanchez,fcojimenez21,Vamos crear Minga Municipal,2019-03-11
Francisco,Jimenez Sanchez,fcojimenez21,tarde recorrimos Lomas Florida Nueva Prosperina Socio Vivienda Gran recibimiento propuestas lograr CAMBIO,2019-03-12
Francisco,Jimenez Sanchez,fcojimenez21,equipo CAMBIO defendera derecho trabajar dignidad temor atropellos llevando obra sectores olvidados Perla Pacifico,2019-03-12
Francisco,Jimenez Sanchez,fcojimenez21,Vamos recuperar Estero Salado marzo VOTA CREO,2019-03-12
Francisco,Jimenez Sanchez,fcojimenez21,Agenda actividades martes marzo,2019-03-12
Francisco,Jimenez Sanchez,fcojimenez21,Buenos dias Arrancamos jornada invito sintonizar ahora online,2019-03-12
Francisco,Jimenez Sanchez,fcojimenez21,gente quiere soluciones demagogicas mismo siempre quiere ciudad menos multas empleo menos cemento verde menos represion apoyo gestion cercana,2019-03-12
Francisco,Jimenez Sanchez,fcojimenez21,Guayaquil ciudad hecha distintos barrios realidades proponemos organizar ciudad zonas cada Unidad Municipal Independiente presupuesto propio Queremos obra municipal llegue sectores ciudad,2019-03-12
Francisco,Jimenez Sanchez,fcojimenez21,candidato alcaldia Guayaquil Hablamos plan trabajo ciudad Escucha,2019-03-12
Francisco,Jimenez Sanchez,fcojimenez21,Implementaremos politica permanente arborizacion ciudad priorizando rescate arboles nativos Guayaquil,2019-03-12
Francisco,Jimenez Sanchez,fcojimenez21,Candidato alcaldia Guayaquil Escucha declaraciones vivo,2019-03-12
Francisco,Jimenez Sanchez,fcojimenez21,VIVO sintonicen,2019-03-12
Francisco,Jimenez Sanchez,fcojimenez21,invito sintonizar tambien online siguiente link,2019-03-12
Francisco,Jimenez Sanchez,fcojimenez21,multas transito deben proporcionales realidad economica guayaquilenos vamos reducirlas,2019-03-12
