nombre,apellidos,tweet_screen_name,tweet_text,tweet_date
Paco,Moncayo,PacoMoncayo,Escuchamos necesidades planteamientos quitenos cada recorrido visita barrios historias impulsan juntos hacer,2019-02-17
Paco,Moncayo,PacoMoncayo,cada accion cuente beneficio ciudad trabajaremos junto quitenos hacer,2019-02-18
Paco,Moncayo,PacoMoncayo,seguridad ciudadana competencia Municipio trabajaremos recuperarla quitenos,2019-02-18
Paco,Moncayo,PacoMoncayo,semana vecinos Atucucho Calderon varios recorridos barrios comparten esperanza recuperar quebradas juntos recuperaremos haremos,2019-02-18
Paco,Moncayo,PacoMoncayo,cada visita barrios sentimos cerca quitenos Juntos convertiremos mercados lugares turista quiera visitar,2019-02-18
Paco,Moncayo,PacoMoncayo,Municipio cosas funcionan gente vive miedo problemas basura trafico invivible quitenos comparan recuerdo grato quedo Quito luego administraciones,2019-02-19
Paco,Moncayo,PacoMoncayo,seguridad transito problemas convivencia ciudadana principales causas victimas competencia Municipio Junto quitenos retomaremos competencias,2019-02-19
Paco,Moncayo,PacoMoncayo,puede decirse continuismo mamarrachada alcaldia recupere Itchimbia saque botadero Zambiza dote agua potable alcantarillado recupere Centro Historico Solo cuestion remitirse hechos,2019-02-19
Paco,Moncayo,PacoMoncayo,Emaseo debe reestructurarse fondo ciudades recoleccion tonelada basura cuesta dolares cuesta pagando tener ciudad sucia,2019-02-19
Paco,Moncayo,PacoMoncayo,gente recuerda trabajo realice Alcalde saluda afecto carino quitenos motiva juntos hacer,2019-02-19
Paco,Moncayo,PacoMoncayo,termine Alcaldia deje Quito limpio mejores ciudades turisticas Latinoamerica volvamos sentirnos orgullosos ciudad juntos recuperaremos belleza haremos,2019-02-20
Paco,Moncayo,PacoMoncayo,zona Mariscal vuelva espacio seguro cultural convivencia ciudadana pacifica turistico calidad trabajaremos mano gestores culturales vecinos sector juntos hacer,2019-02-20
Paco,Moncayo,PacoMoncayo,Visitamos mercado Francisco almorzamos rica comida caseritas lindos espacios mercados volvamos sentirnos familia ciudad trabajaremos recuperar identidad orgullo quiteno hacer juntos,2019-02-20
Paco,Moncayo,PacoMoncayo,gusto visitar locales gente honesta trabajadora recorridos quitenos puedan hacer realidad suenos tener negocio propio fomentaremos acceso credito emprendimientos Hagamos juntos,2019-02-21
Paco,Moncayo,PacoMoncayo,juntos hagamos movilidad sostenible construiremos ciclovias nuevas articularemos ciclo parqueaderos estaciones paradas transporte publico Hagamos juntos,2019-02-21
Paco,Moncayo,PacoMoncayo,familia puedan vivir entorno limpio saludable haremos juntos Quito ciudad responsable manejo desechos solidos recuperaremos sistema recoleccion basura promoveremos reciclaje reutilizacion,2019-02-22
Paco,Moncayo,PacoMoncayo,puedas disfrutar tranquilidad barrio ciudad seguros familia fortaleceremos coordinacion interinstitucional garantizar seguridad convivencia ciudadana hacer juntos,2019-02-22
Paco,Moncayo,PacoMoncayo,vivamos ciudad lidere Region cuidado ambiental juntos trabajaremos reemplazar plasticos solo hacer,2019-02-23
Paco,Moncayo,PacoMoncayo,Seguimos recorriendo ciudad recibiendo necesidades carino barrios volvamos sentirnos orgullosos tener ciudad limpia ordenada implementaremos sistema recoleccion basura eficiente Hagamos juntos,2019-02-23
Paco,Moncayo,PacoMoncayo,gusto invitado varias organizaciones ciclistas recorrido luego conversatorio compartir experiencias grato saber recuerdan apoye ciclopaseos alcalde Fortaleceremos hacer,2019-02-24
Paco,Moncayo,PacoMoncayo,vivamos nuevo entornos naturales cuidados protegidos priorizaremos limpieza quebradas bordes taludes ademas velaremos proteccion mediante construccion obra publica arborizacion hacer juntos,2019-02-24
Paco,Moncayo,PacoMoncayo,,2019-02-25
Paco,Moncayo,PacoMoncayo,recicladores mejoren situacion laboral familias mejores condiciones vida dotaremos equipos proteccion personal apoyaremos conformacion microempresas Hagamos juntos,2019-02-25
Paco,Moncayo,PacoMoncayo,dejar banderas colores politicos ponerse camiseta ciudad trabajar conjunto hacer,2019-02-25
Paco,Moncayo,PacoMoncayo,seguridad multinivel Alcalde corresponde trabajar prevencion control seguridad vial relaciones sociales convivencia ciudadana inseguridad coarta libertades vivimos miedo debemos cambiarlo,2019-02-25
Paco,Moncayo,PacoMoncayo,elementos fundamentales hacen alcaldia exitosa planificar adecuadamente gobernar mejores expertos escuchar consejos tecnicos gobernar gente ciudad mueva ritmo necesario desarrollo hacer,2019-02-25
Paco,Moncayo,PacoMoncayo,inauguracion significar cambio radical forma transportamos ciudad Debemos hablar sistema multimodal integrado moderno eficiente servicio quitenos,2019-02-25
Paco,Moncayo,PacoMoncayo,ningun acuerdo actual administracion hecho desesperado Alcade solicitado colaboracion exfuncionarios administracion significa,2019-02-25
Paco,Moncayo,PacoMoncayo,Cesar Cesar bicicleta recordamos caso ganar debe continuar potenciar comenzo Gracias,2019-02-25
Paco,Moncayo,PacoMoncayo,hacer movilidad sostenible priorice peatones ciclistas transporte publico vamos fortalecer sistema bicicleta publica hacer transporte publico servicio eficiente calidad Hagamos juntos,2019-02-25
Paco,Moncayo,PacoMoncayo,quitenos sistema transporte publico digno eficiente modernizaremos sistema metropolitano transporte articularemos manera integral beneficie barrios ciudad Hagamos juntos,2019-02-26
Paco,Moncayo,PacoMoncayo,meses reunido conversatorios gente escuchar preocupaciones Plan Gobierno acciones enfrentar problemas ciudad hacer juntos,2019-02-26
Paco,Moncayo,PacoMoncayo,planteando sistema multimodal Metro Trole Ecovia alimentadores funcionen tecnologia punta ciudades sistema transporte moderno eficiente servicio quitenos,2019-02-26
Paco,Moncayo,PacoMoncayo,Haremos alianza publico privada organizaciones animalistas generar acciones apoyen construccion cultura tenencia responsable mascotas sistema tener programas desparasitacion adopcion esterilizacion,2019-02-26
Paco,Moncayo,PacoMoncayo,hizo entrevista temas importancia quitenos ciudad invito leer soluciones planteamos,2019-02-26
Paco,Moncayo,PacoMoncayo,hizo entrevista temas importancia quitenos ciudad invito leer soluciones planteamos,2019-02-26
Paco,Moncayo,PacoMoncayo,resulte comodo agil viajar implementaremos sistema tarjeta unica transporte Hagamos juntos,2019-02-27
Paco,Moncayo,PacoMoncayo,liderazgo ciudad entender ciudad conjunto actores estrategicos liderazgo lograr actores pongan acuerdo beneficio ciudad Debemos ponernos trabajar obreros escritorio,2019-02-27
Paco,Moncayo,PacoMoncayo,oportunidad tener desayuno trabajo sector privado actor fundamental crecimiento progreso Quito trabajo tener,2019-02-27
Paco,Moncayo,PacoMoncayo,oportunidad reunirnos sector privado actor fundamental crecimiento progreso Quito trabajo tener,2019-02-27
Paco,Moncayo,PacoMoncayo,tiempo actividades familia aplicaremos medios tecnologicos punta gestionar trafico manera eficiente Hagamos juntos,2019-02-27
Paco,Moncayo,PacoMoncayo,comercio justo organizado fortaleceremos mercados controlaremos ventas informales Visitamos mercado Santa Clara esperanza caseritas ventas ambulantes terminen Hagamos juntos,2019-02-28
Paco,Moncayo,PacoMoncayo,puedas caminar obstaculos espacio publico trabajaremos construccion mantenimiento aceras Hagamos juntos,2019-03-01
Paco,Moncayo,PacoMoncayo,puedas transitar calles vias afectar vehiculo bicicleta trabajaremos pavimentacion mantenimiento vial toda ciudad Hagamos juntos,2019-03-01
Paco,Moncayo,PacoMoncayo,Mitad Mundo verdadero atractivo turistico visitantes nacionales extranjeros genere movimiento economico plazas empleo mejoraremos infraestructura accesibilidad oferta turistica Hagamos juntos,2019-03-01
Paco,Moncayo,PacoMoncayo,feriados experiencia viajar ciudad pais rapida comoda remodelaremos ampliaremos terminales terrestres ciudad Hagamos juntos,2019-03-02
Paco,Moncayo,PacoMoncayo,trabajar promocion turismo ciudad atractivo genere fuentes empleo mejoraremos simplificaremos regulaciones operacion servicios turisticos juntos hacer,2019-03-03
Paco,Moncayo,PacoMoncayo,saliste Quito feriado varias opciones disfrutar invito apoyes oferta turistica ciudad hagamos juntos,2019-03-03
Paco,Moncayo,PacoMoncayo,motivarte dejes auto uses transporte publico facilitaremos estacionamientos proximos estaciones Metro terminales transporte accesos hipercentro Hagamos juntos,2019-03-03
Paco,Moncayo,PacoMoncayo,Quiero vivas ciudad aproveche capacidad turistica genere empleos Quito sera destino convenciones reuniones eventos internacionales Hagamos juntos,2019-03-04
Paco,Moncayo,PacoMoncayo,Quiero familia miles turistas extranjeros olviden estres disfrutando sitios aguas termales ofrece ciudad Quito sera destino salud Hagamos juntos,2019-03-04
Paco,Moncayo,PacoMoncayo,Quiero movilices toda ciudad llegues destino solo pasaje Mejoraremos fortaleceremos Sistema Integrado Transporte Publico Hagamos juntos,2019-03-04
Paco,Moncayo,PacoMoncayo,Quiero disfrutes Mariscal caminando calma Zona tendra amplia oferta cultural entretenimiento sera lugar seguro Hagamos juntos,2019-03-05
Paco,Moncayo,PacoMoncayo,Quiero movilices toda ciudad llegues destino solo pasaje Mejoraremos fortaleceremos Sistema Integrado Transporte Publico Hagamos juntos,2019-03-05
Paco,Moncayo,PacoMoncayo,equipo trabajo listo asumir Alcaldia Quito llegar experiencia puede experimentar temas administracion publica ciudad crisis,2019-03-06
Paco,Moncayo,PacoMoncayo,Alcalde Quito primera ciudad realizar propuesta cambio climatico Paris primera ciudad presentar Nueva York cumplimiento objetivos milenio Quito ciudad regresar,2019-03-06
Paco,Moncayo,PacoMoncayo,politicas publicas tratan cerrar brechas desigualdad atencion prioritaria barrio servicios basicos servicios,2019-03-06
Paco,Moncayo,PacoMoncayo,sirve usted lugar servir gente puede esperar arreglar principios negocia jamas pondre principios servicio ciudad junto quitenos hacer,2019-03-06
Paco,Moncayo,PacoMoncayo,gradue alcalde deje general deje doctor ninos llamaron Paquito alcalde persona amigable accesible cercana pueda gente cara,2019-03-06
Paco,Moncayo,PacoMoncayo,Quiero recuperes identidad quiteno nombre Quito reconocido internacionalmente Crearemos Marca Ciudad Quito atraer inversiones generen empleos hacer juntos,2019-03-06
Paco,Moncayo,PacoMoncayo,quitenos memoria gran corazon barrios gente acuerda gestion recibe brazos abiertos Pondremos orden municipalidad servicio ciudadania,2019-03-07
Paco,Moncayo,PacoMoncayo,Nunca alcalde cediendo espacios poder Nunca concejales compitiendo alcalde grilletes primera prioridad Quito municipalidad confiable cercana gente,2019-03-07
Paco,Moncayo,PacoMoncayo,Implementaremos sistema integrado multimodal transporte moderno seguro Buses camaras paradas tecnologia anuncio llegada proximo sistema mando control unificado semaforos inteligentes,2019-03-07
Paco,Moncayo,PacoMoncayo,siempre ofrecido Quito trabajo serio honesto tecnico equipo experiencia junto quitenos vamos hacer,2019-03-07
Paco,Moncayo,PacoMoncayo,Quiero enamores Quito veas turismo opcion laboral real Promoveremos formacion operadores guias turismo turistas conozcan mejor ciudad gente Hagamos juntos,2019-03-07
Paco,Moncayo,PacoMoncayo,bicicleta parte importante movilidad sostenible Apoyaremos fomentaremos medio transporte,2019-03-08
Paco,Moncayo,PacoMoncayo,revolucion mayor Siglo duda feminismo largo historia relegada mujeres ganando espacios luchas logrado ocupar posicion importante aunque todavia justa,2019-03-08
Paco,Moncayo,PacoMoncayo,suma trabajo hombres mujeres enriquece productividad gestion habra paridad genero cargos claves Municipio cuestion voluntad politica hacer justicia quitenas accedan puestos liderazgo estrategico,2019-03-08
Paco,Moncayo,PacoMoncayo,reconocimiento todas mujeres luchan sociedades justas igualitarias dado vida aquellas viven diario conseguir derechos justicia Pensemos igualdad,2019-03-08
Paco,Moncayo,PacoMoncayo,conmemoracion quiero mejor pais mujeres derechos justicia tambien quiero sociedad violencia mujeres vivan tranquilas seguras Hagamos juntas juntos Ecuador,2019-03-08
Paco,Moncayo,PacoMoncayo,Quiero miles turistas disfruten nuevo Centro Historico activaremos eventos culturales actividades economicas genere empleo Hagamos juntos,2019-03-09
Paco,Moncayo,PacoMoncayo,recorrimos barrios ciudad Cocha Franco Mendez Venecia Manuelita Saenz Nuevos Horizontes Necesitan soluciones viales movilidad atencion servicios basicos Juntos vamos hacerlo tener merecemos,2019-03-09
Paco,Moncayo,PacoMoncayo,disfrutes Guapulo hagas hermoso lugar Quito activaremos circuitos peatonales fomentaremos oferta cultural entretenimiento Hagamos juntos,2019-03-10
Paco,Moncayo,PacoMoncayo,cada visita barrios gente recibe afecto recuerda gestion hice comparte preocupaciones actuales Juntos recuperaremos ciudad haremos,2019-03-10
Paco,Moncayo,PacoMoncayo,aqui hablar encuestas hablar problemas Quito buscar soluciones junto quitenos hacer,2019-03-11
Paco,Moncayo,PacoMoncayo,hace trabajando presentamos Plan Estrategico vision ciudad vision grandeza Quito merece construiremos juntos,2019-03-11
Paco,Moncayo,PacoMoncayo,Reformaremos fondo destrozo hecho tema gestion desechos funciona Quito puede basurero sacamos botadero Zambiza relleno sanitario,2019-03-11
Paco,Moncayo,PacoMoncayo,Vamos inaugurar nuevo modelo gestion movilidad sistema transporte integral multimodal eficiente sistema unico recaudo,2019-03-11
Paco,Moncayo,PacoMoncayo,Vamos disminuir tramitologia creado decenas cuellos botella tramites municipales Gestionare Municipio calificacion Anti Soborno Conmigo vagos pillos Vamos darle ciudad municipalidad decente eficiente,2019-03-11
Paco,Moncayo,PacoMoncayo,Fomentaremos bicicleta medio transporte apoya movilidad sostenible ayuda medio ambiente Hagamos juntos,2019-03-11
Paco,Moncayo,PacoMoncayo,Hagamos juntos confianza seguro alcanzamos,2019-03-11
Paco,Moncayo,PacoMoncayo,noche propuestas candidato Alcaldia Quito programa 22h00 senal Gamavision Desliza,2019-03-12
Paco,Moncayo,PacoMoncayo,ciclopaseo nacio administracion convirtio actividad compartir disfrutar amigos familia Recuperaremos sistema bicicleta publica Quito avance hacia movilidad sustentable Hagamos juntos,2019-03-12
Paco,Moncayo,PacoMoncayo,gente certeza trabajare Quito hice Hagamos juntos,2019-03-12
Paco,Moncayo,PacoMoncayo,Quiero apuestes turismo ciudad genere empleo Promocionaremos formulacion incubacion proyectos servicios turisticos apoyaremos inyeccion capital inversores privados publicos Hagamos juntos,2019-03-12
Paco,Moncayo,PacoMoncayo,Agradezco reconocimiento excelencia servicio publico invitarme foro seguridad vial hablar tema fundamental ciudad parte Quito Seguro dentro Plan Gobierno,2019-03-13
Paco,Moncayo,PacoMoncayo,invito hagamos juntos,2019-03-13
Paco,Moncayo,PacoMoncayo,Gobernar Quito tareas dificiles Ecuador tarea venir experimentar requiere conocimiento contar gran equipo humano involucrar toda ciudadania hacer,2019-03-14
Paco,Moncayo,PacoMoncayo,quitenos votaran saben mentir robar saben pusimos Quito mejores ciudades mundo Saben conmigo experimentar conmigo cosas hacen pueden ojos,2019-03-14
Paco,Moncayo,PacoMoncayo,aqui resultados encuestas hecho hace cabeza gente querido darle espalda Quito trabajado tiempo equipo escuchando requerimientos gente,2019-03-14
Paco,Moncayo,PacoMoncayo,estara Escucha 10h00,2019-03-14
Paco,Moncayo,PacoMoncayo,municipalidad lugar aporte solucion problemas quitenos convertido problema Pondremos casa orden equipo conformado mujeres hombres comprometidos ciudad gente experiencia jovenes preparados,2019-03-14
Paco,Moncayo,PacoMoncayo,Quiero vivas barrio seguro juntos recuperemos organizacion barrial Promoveremos redes voluntarios seguridad promover espacios publicos conciencia cuidado mutuo Hagamos juntos,2019-03-14
Paco,Moncayo,PacoMoncayo,vuelvas disfrutar ciudad familia amigos ambiente seguridad reactivaremos haremos espacios publicos seguros Hagamos juntos,2019-03-15
Paco,Moncayo,PacoMoncayo,condecoro medalla Simon Bolivar recuperacion patrimonio Centro Historico volveremos recuperar quitenos turistas nacionales extranjeros,2019-03-15
Paco,Moncayo,PacoMoncayo,Quito ciudad sufre empleo burocratico fundamental recuperar productividad competitividad mano turismo generacion emprendimientos empleos parte ejes estrategicos,2019-03-15
Paco,Moncayo,PacoMoncayo,exito trabajamos ciudad volveremos hacerlo Hagamos juntos,2019-03-15
Paco,Moncayo,PacoMoncayo,semana visitamos vecinos Carapungo preocupacion contar mejor transporte hablamos mejorar rutas horarios generar sistema integrado permita llegar destinos Hagamos juntos,2019-03-15
Paco,Moncayo,PacoMoncayo,puedas transitar seguro Simon Bolivar realizaremos estudios implementaremos plan remediacion seguridad vial Hagamos juntos,2019-03-15
Paco,Moncayo,PacoMoncayo,quitenos recuerdan trabaje Quito volvere hacer Hagamos juntos,2019-03-16
Paco,Moncayo,PacoMoncayo,semana recibimos inmenso carino vecinos Comuna Diego Conocoto Susana Letor Carapungo Asociacion Artistas Profesionales Pichincha visitamos Museo Diego Quito gente Hagamos juntos,2019-03-16
Paco,Moncayo,PacoMoncayo,experiencia capacidad recuperar ciudad hacer juntos,2019-03-16
Paco,Moncayo,PacoMoncayo,sientas agentes transito estan ayudarte puedas confiar capacitaremos mejor gestion operativa transito atencion servicio ciudadania Hagamos juntos,2019-03-16
Paco,Moncayo,PacoMoncayo,confianza llegaremos alcaldia trabajar juntos,2019-03-17
Paco,Moncayo,PacoMoncayo,Vota ciudad priorice cuidado ambiental Hagamos juntos,2019-03-17
Paco,Moncayo,PacoMoncayo,Vota ciudad responsable manejo desechos solidos Hagamos juntos,2019-03-17
Paco,Moncayo,PacoMoncayo,quitenos quieren honestidad experiencia trabajar juntos,2019-03-17
Paco,Moncayo,PacoMoncayo,Vota movilices bicicleta forma segura eficiente Hagamos juntos,2019-03-17
Paco,Moncayo,PacoMoncayo,Domingo votemos trabajar juntos Quito seguro ordenado productivo,2019-03-18
Paco,Moncayo,PacoMoncayo,trabajar sociedad libre violencia acoso vota Hagamos juntos,2019-03-18
Paco,Moncayo,PacoMoncayo,vincular contactos laborales bolsas empleo vota Hagamos juntos,2019-03-18
Paco,Moncayo,PacoMoncayo,Vota soluciones congestion trafico movilidad fluida Hagamos juntos,2019-03-18
Paco,Moncayo,PacoMoncayo,Vota soluciones claras comerciantes juntos hagamos,2019-03-18
Paco,Moncayo,PacoMoncayo,estudiantes seran parte,2019-03-18
Paco,Moncayo,PacoMoncayo,estudiantes seran parte,2019-03-18
Paco,Moncayo,PacoMoncayo,Vota ciudad recupere capacidad excelencia turistica Hagamos juntos,2019-03-18
Paco,Moncayo,PacoMoncayo,sabado hicimos recorrido barrio Carcelen Bajo norte Quito ciudad puede basurero debe cambiar Recuperaremos sistema recoleccion basura quebradas Hagamos juntos,2019-03-19
Paco,Moncayo,PacoMoncayo,Mejoraremos movilidad Quito Hagamos juntos,2019-03-19
Paco,Moncayo,PacoMoncayo,pueblo concede voto dignidad humildes Creo virtud excelencia politico deberia humildad,2019-03-19
Paco,Moncayo,PacoMoncayo,Conozco Quito realidad Camino barrios conversatorios vecinos escucho necesidades barrios pobres creados traficantes tierras plan Cerrando Brechas invertiremos problemas,2019-03-19
Paco,Moncayo,PacoMoncayo,barrio Arcadia Quito emociono recibir afecto vecinos acompanaron recorrido calles saber confian domingo votemos juntos hacer,2019-03-19
Paco,Moncayo,PacoMoncayo,domingo votemos mujeres juntos hacer,2019-03-19
Paco,Moncayo,PacoMoncayo,domingo votemos profesionales juntos hacer,2019-03-19
Paco,Moncayo,PacoMoncayo,domingo votemos respeto peatones juntos hacer,2019-03-20
Paco,Moncayo,PacoMoncayo,quitenos interesa hara sacar Quito crisis Haber feudalizado Concejo crimen duele ciudadano administracion dejado ciudad plan equipo hacer juntos,2019-03-20
Paco,Moncayo,PacoMoncayo,Quiero decirles candidatos campanas sucias nunca votos Aqui,2019-03-20
Paco,Moncayo,PacoMoncayo,Quiero invitar incitar jovenes hacer politica lado esperar votaciones colaborar proximo alcalde porvenir Quito,2019-03-20
Paco,Moncayo,PacoMoncayo,creo tarea Ecuador recomponer sistema politico Aqui,2019-03-20
Paco,Moncayo,PacoMoncayo,Tomare medidas necesarias ciudad limpia meses Quito puede convertida basurero Juntos recuperaremos voto haremos fragmento entrevista marzo 2019,2019-03-20
Paco,Moncayo,PacoMoncayo,alcalde puede chantajear nadie pide cuotas poder nadie lado chantajearme fragmento entrevista marzo 2019,2019-03-20
Paco,Moncayo,PacoMoncayo,Reinventemos fiestas quitenos Hagamos juntos,2019-03-20
Paco,Moncayo,PacoMoncayo,domingo votemos jovenes juntos hacer,2019-03-21
Paco,Moncayo,PacoMoncayo,Mantuvimos reunion Mision Observacion Electoral tratar temas proceso electoral domingo,2019-03-21
Paco,Moncayo,PacoMoncayo,llegue alcaldia 2000 momento dificil crisis pais miles quitenos buscaron mejor porvenir Europa sacamos adelante pulso ciudad dejamos mejores Latinoamerica volveremos hacerlo,2019-03-21
Paco,Moncayo,PacoMoncayo,Felicito candidatos alcalde concejales jovenes decia sorprendia lugares pobres ciudad bueno politica servido conozcan Quito cambiaremos voto quitenos,2019-03-21
Paco,Moncayo,PacoMoncayo,Invito quitenos revisen Plan Gobierno programas proyectos implementaremos juntos hacer,2019-03-22
Paco,Moncayo,PacoMoncayo,orgulloso tener equipo conformado experiencia juventud mujeres hombres comprometidos ciudad dispuestos trabajar esfuerzo dedicacion junto quitenos hacer,2019-03-22
Paco,Moncayo,PacoMoncayo,domingo votemos juntos hacer Cerramos campana entusiasmo esperanza Quito mejor Gracias quitenos afecto recorridos barrios confiar equipo trabajo,2019-03-22
Paco,Moncayo,PacoMoncayo,Amemos ciudad domingo votemos juntos hacer,2019-03-22
Paco,Moncayo,PacoMoncayo,Acompanamos jornada democratica voto juntos hacer Provincia,2019-03-24
Paco,Moncayo,PacoMoncayo,entusiasmo emocion voto juntos hagamos Juntos,2019-03-24
Paco,Moncayo,PacoMoncayo,felices apoyo recibido jornada democratica vivido Quito pais democratas debemos esperar anuncios oficiales Vamos trabajar juntos,2019-03-24
Paco,Moncayo,PacoMoncayo,Queremos agradecer quitenos pichinchanos afecto siempre generosamente recibidos cada recorrido cada barrio visitado gratitud medios cubierto forma imparcial candidatos,2019-03-24
Paco,Moncayo,PacoMoncayo,saludo contrincantes politicos Admiro vocacion servicio Hago llamado importar gane candidatos juntos trabajando Aceptaremos democraticamente resultados,2019-03-24
Paco,Moncayo,PacoMoncayo,deciden quitenos voto listo equipo transicion ordenada respetuosa administracion municipal saliente equipo conformado mujeres hombres combinan experiencia juventud,2019-03-24
Paco,Moncayo,PacoMoncayo,Vamos esperar resultados Gracias medios acompanado,2019-03-24
Paco,Moncayo,PacoMoncayo,Quiero agradecer quitenos votaron deseo mejor suertes Alcalde electo Quito ponemos disposicion plan trabajo unica beneficiaria ciudad,2019-03-25
Paco,Moncayo,PacoMoncayo,alcalde elegido voluntad pueblo desear mejor exitos Siempre dije partir lunes marzo deberia acabarse toda disputa toda forma ataque ponernos trabajar Quito,2019-03-28
Paco,Moncayo,PacoMoncayo,parte alcalde electo Jorge Yunda voluntad seria recibir recomendaciones escuchar voces experimentadas excelente iniciativa bien ciudad,2019-03-28
Paco,Moncayo,PacoMoncayo,recibido oficialmente propuesta Senior Fellow Agencia Naciones Unidas Entrenamiento Investigacion aceptado estare trabajando agencia pais objetivo apoyo 2030,2019-04-24
