nombre,apellidos,tweet_screen_name,tweet_text,tweet_date
Marlene Clementina,Montesinos Zabalu,MarleMontesinos,Mujeresconderechos JusticiaDignidadyTransparencia CPCCs,2019-02-21
Marlene Clementina,Montesinos Zabalu,MarleMontesinos,Cpccs MarleneMontesinos Casillero9 Elecciones2019EC,2019-03-06
Marlene Clementina,Montesinos Zabalu,MarleMontesinos,Hacer participacion ciudadana herramienta real hacer sociedad territorio democracia efectiva Cpccs MarleneMontesinos Casillero9 Elecciones2019EC,2019-03-07
Marlene Clementina,Montesinos Zabalu,MarleMontesinos,MarleneMontesinos compromiso ciudadania invito hacer parte transformacion recuperacion institucionalidad marzo Casillero9 Elecciones2019EC,2019-03-07
Marlene Clementina,Montesinos Zabalu,MarleMontesinos,MujeresConDerechos Hacemos actorias referencia etica coherencia transparencia gracias voto confianza MarleneMontesinos Casillero9 Elecciones2019EC,2019-03-07
Marlene Clementina,Montesinos Zabalu,MarleMontesinos,MujeresConDerechos Hacemos cada lugar mundo espacio rebeldia oportunidad hacer mundo mejor lucha constante queremos felicitaciones queremos justicia equidad respeto MarleneMontesinos CPCCS,2019-03-08
Marlene Clementina,Montesinos Zabalu,MarleMontesinos,participe junto mujeres diversas gracias cordial invitacion EmpoderateMujer marco Internacional Mujeres MujeresConDerechos agenda politica clara generar participacion inclusion,2019-03-08
Marlene Clementina,Montesinos Zabalu,MarleMontesinos,fortaleza siempre sera empatia necesidades personas Hace dias visitamos Manabi mision ayudar valores practica Solidaridad,2019-03-08
Marlene Clementina,Montesinos Zabalu,MarleMontesinos,Quito espacio conmemoracion compartir organizaciones mujeres diversas gracias CONSEJO CONSULTIVO MOVILIDAD HUMANA Casillero9 MarleneMontesinos CPCCS,2019-03-10
Marlene Clementina,Montesinos Zabalu,MarleMontesinos,Manabi Solidaridad Ayuda humanitaria ciudad Manta barrio santa Cecilia familias damnificadas entrega ayuda humanitaria MarleneMontesinos,2019-03-10
Marlene Clementina,Montesinos Zabalu,MarleMontesinos,Manta inundaciones torrencial lluvia ayer madrugada movilizamos junto equipo trabajo apoyar familias afectadas solidaridad moviliza MarleneMontesinos,2019-03-10
Marlene Clementina,Montesinos Zabalu,MarleMontesinos,Manta fuerte torrencial azoto Manabi movilizo ayuda humanitaria barrio Santa Cecilia solidaridad coherencia necesitados referencia MarleneMontesinos CPCCS,2019-03-10
Marlene Clementina,Montesinos Zabalu,MarleMontesinos,Mantuvimos reunion Servidores Judiciales Cristianos Guayaquil junto Jueza Esplendida Navarrete actual Directora Judiciales Cristianos Honrada invitacion MarleneMontesinos CPCCS Casillero9,2019-03-10
Marlene Clementina,Montesinos Zabalu,MarleMontesinos,Guayaquil Isla Trinitaria invitacion Asociacion Afroecuatorianos dialogue junto lideres comunitarios importancia participacion activa diversas organizaciones logros desafios MarleneMontesinos CPCCS Casillero9,2019-03-10
Marlene Clementina,Montesinos Zabalu,MarleMontesinos,voces respaldo aumentan abogado Jose Alava Avila Presidente FANAD Federacion Nacional Apoyo Democracia recordando MarleneMontesinos rumbo CPCCS Casillero9 MujeresConDerechos tctelevision ecuavisa,2019-03-11
Marlene Clementina,Montesinos Zabalu,MarleMontesinos,servicio solidaridad cartas presentacion valores familia comunidad deben fortalecidos Manta Barrio Villamarina compartimos practica discurso projimo MarleneMontesinos CPCCS Casillero9,2019-03-11
Marlene Clementina,Montesinos Zabalu,MarleMontesinos,sabes encontrarme papeleta Mujeres Casillero9 MarleneMontesinos garantia hacer posible forma real mecanismos participacion ciudadana CPCCS ConVozCiudadana,2019-03-12
Marlene Clementina,Montesinos Zabalu,MarleMontesinos,Rumbo CPCCS manana EcuavisaInforma mariuximosquera Haciendo propuestas llevaran hacer periodo ciudadano MarleneMontesinos Casillero9,2019-03-14
Marlene Clementina,Montesinos Zabalu,MarleMontesinos,Jueves PatricioAlarco2 pdte CeEcuatoriano Acuerdo creacion empleo HenryKronfle Acuerdo autorizacion asamblea MarleMontesinos candidata CPCCS Propuestas poder ContactoDirecto APinoargote ESTEFANIESPIN ecuavisa,2019-03-14
Marlene Clementina,Montesinos Zabalu,MarleMontesinos,empatia expresa valores sino palabras MarleneMontesinos CPCCS Casillero9 MujeresConDerechos,2019-03-14
Marlene Clementina,Montesinos Zabalu,MarleMontesinos,MujeresConDerechos mujer hace responsable fomentar equidad todas circunstancias MarleneMontesinos CPCCS Casillero9,2019-03-14
Marlene Clementina,Montesinos Zabalu,MarleMontesinos,MujeresConDerechos fomentar transparencia lucha corrupcion forma grata ciudadania MarleneMontesinos CPCCS Casillero9,2019-03-14
Marlene Clementina,Montesinos Zabalu,MarleMontesinos,MujeresConDerechos estaria aqui lucha todas mujeres antecedido MarleneMontesinos CPCCS Casillero9 voto confianza,2019-03-14
Marlene Clementina,Montesinos Zabalu,MarleMontesinos,MujeresConDerechos voces emergentes distintos mecanismos participacion merecen respeto oficial construccion comun ciudadana MarleneMontesinos CPCCS Casillero9,2019-03-14
Marlene Clementina,Montesinos Zabalu,MarleMontesinos,MujeresConDerechos participacion ciudadana privilegio cuantos derecho constituido toda ciudadania MarleneMontesinos CPCCS Casillero9,2019-03-14
Marlene Clementina,Montesinos Zabalu,MarleMontesinos,ENVIDEO MarleMontesinos candidata Cpccs dara prioridad fiscalizacion,2019-03-14
Marlene Clementina,Montesinos Zabalu,MarleMontesinos,ENVIDEO MarleMontesinos candidata Cpccs dara prioridad fiscalizacion,2019-03-15
Marlene Clementina,Montesinos Zabalu,MarleMontesinos,CiudadanosConVoz democracia siempre ruta participacion efectiva oportunidad transformar CPCCS MarleneMontesinos Casillero9 parte cambio real,2019-03-16
Marlene Clementina,Montesinos Zabalu,MarleMontesinos,CiudadanosConVoz Cada territorio Ecuador podra ejercer mecanismos participacion control social herramientas participacion persecucion bajo sigilo informacion receptada opcion MarleneMontesinos Casillero9 CPCCS,2019-03-18
Marlene Clementina,Montesinos Zabalu,MarleMontesinos,MarleMontesinos concientizando realidad migrantes MarleneMontesinos candidata CPCCS,2019-03-19
Marlene Clementina,Montesinos Zabalu,MarleMontesinos,Compartimos amigos Radio 1160Am ciudad Machala MarleneMontesinos candidata CPCCS Elecciones2019,2019-03-19
Marlene Clementina,Montesinos Zabalu,MarleMontesinos,agradecimiento Radio Machala permitirnos conocer propuestas Juntos lograremos mejor Ecuador MarleneMontesinos candidata CPCCS Elecciones2019,2019-03-19
Marlene Clementina,Montesinos Zabalu,MarleMontesinos,lucha incansable reivindicacion derechos mujeres seguira siendo prioridad RadioUtmach MarleneMontesinos candidata CPCCS Elecciones2019,2019-03-19
Marlene Clementina,Montesinos Zabalu,MarleMontesinos,Investigar fiscalizar instrucciones publicas pais principales propuesta Plan trabajo MarleneMontesinos candidata CPCCS Elecciones2019,2019-03-19
Marlene Clementina,Montesinos Zabalu,MarleMontesinos,Continuamos difundiendo propuesta trabajo bella provincia ElOro capital Bananera mundo Entrevista Diario Correo,2019-03-19
Marlene Clementina,Montesinos Zabalu,MarleMontesinos,comprometemos propiciar formacion ciudadana valores transparencia cero tolerancia corrupcion MarleneMontesinos candidata CPCCS Elecciones2019,2019-03-19
Marlene Clementina,Montesinos Zabalu,MarleMontesinos,Programa Opinion2019 Mario Pinto recibio ciudad Machala Expusimos propuestas agradecimos todas personas expresaron apoyo respaldo Capital Bananera mundo MarleneMontesinos candidata CPCCS Elecciones2019,2019-03-19
Marlene Clementina,Montesinos Zabalu,MarleMontesinos,Marzo escuchar participe transformacion nuevo Ecuador propuestas serias reales MarleneMontesinos candidata CPCCS Elecciones2019,2019-03-19
Marlene Clementina,Montesinos Zabalu,MarleMontesinos,Manabi tierra hermosa participe cambio Marzo voto podemos lograrlos MarleneMontesinos candidata CPCCS Elecciones2019 ListaDeMujeres,2019-03-19
Marlene Clementina,Montesinos Zabalu,MarleMontesinos,MarleneMontesinos historia vida trayectoria vida ensena posible superar obstaculos construir junto ustedes mejor pais Consejo Participacion Ciudadana Marzo Elecciones2019 CandidataAlCPCCS ListaDeMujeres,2019-03-19
Marlene Clementina,Montesinos Zabalu,MarleMontesinos,Junto Organizaciones Sociales Circulo Militar Ciudadania General MarleneMontesinos candidata CPCCS Elecciones2019 ListaDeMujeres,2019-03-19
Marlene Clementina,Montesinos Zabalu,MarleMontesinos,agradecimiento organizaciones sociales Circulo Militar Ciudadania brindaron respaldo confianza MarleneMontesinos candidata CPCCS Elecciones2019 ListaDeMujeres,2019-03-19
Marlene Clementina,Montesinos Zabalu,MarleMontesinos,cerro Montecristi CiudadAlfaro cobija cenizas Viejo Luchador simbolo democracia participativa vota candidata CPCCS MarleneMontesinos escuchar,2019-03-20
Marlene Clementina,Montesinos Zabalu,MarleMontesinos,cerro Montecristi CiudadAlfaro cobija cenizas Viejo Luchador simbolo verdadera democracia participativa vota candidata CPCCS MarleneMontesinos escuchar,2019-03-20
Marlene Clementina,Montesinos Zabalu,MarleMontesinos,Entrevista RadioCanelaEC dando conocer propuestas lucha reivindicacion derechos migrantes MarleneMontesinos candidata CPCCS Elecciones2019 ListaDeMujeres segunda linea centro,2019-03-20
Marlene Clementina,Montesinos Zabalu,MarleMontesinos,MarleneMontesinos candidata CPCCS invita participe transformacion pais traves voto Marzo Elecciones2019 NoAlVotoNulo,2019-03-20
Marlene Clementina,Montesinos Zabalu,MarleMontesinos,momentos MarleneMontesinos candidata CPCCS instalaciones cnegobec exigue respeto democracia derecho voto NoAlVotoNulo Elecciones2019 Basta manipular voluntad ciudadana,2019-03-20
Marlene Clementina,Montesinos Zabalu,MarleMontesinos,MarleneMontesinos candidata CPCCS exige cnegobec respete democracia voluntad ciudadana expresada urnas pasada consulta popular NoAlVotoNulo Elecciones2019,2019-03-21
Marlene Clementina,Montesinos Zabalu,MarleMontesinos,Ejerce derecho voto democracia hacemos voto NoAlVotoNulo Elecciones2019 MarleneMontesinos candidata CPCCS,2019-03-21
Marlene Clementina,Montesinos Zabalu,MarleMontesinos,Abogado activista fernandobalda expresa respaldo candidatura CPCCS MarleneMontesinos Elecciones2019 ListaDeMujeres segunda linea centro,2019-03-21
Marlene Clementina,Montesinos Zabalu,MarleMontesinos,MarleneMontesinos candidata CPCCS ListaDeMujeres segunda linea centro CPCCS,2019-03-23
Marlene Clementina,Montesinos Zabalu,MarleMontesinos,gratitud inmensa jovenes hermoso detalle Gracias apoyo ecuatorianos respalda candidatura MarleneMontesinos CPCCS Elecciones2019 ListaDeMujeres segunda linea centro,2019-03-23
Marlene Clementina,Montesinos Zabalu,MarleMontesinos,MarleneMontesinos candidata Consejo Participacion Ciudadana Control Social CPCCS Elecciones2019 ListaDeMujeres,2019-03-24
