nombre,apellidos,tweet_screen_name,tweet_text,tweet_date
Carlos Gonzalo,Mosquera Benalcazar,MosqueraCarlosB,PostDrCarlosMosquera PECULADO CarlosMosquera CPCCS VOTO UnMedicoHonrado,2019-02-19
Carlos Gonzalo,Mosquera Benalcazar,MosqueraCarlosB,PostDrCarlosMosquera VACACIONES CarlosMosquera CPCCS VOTO UnMedicoHonrado,2019-02-19
Carlos Gonzalo,Mosquera Benalcazar,MosqueraCarlosB,cero mata,2019-02-19
Carlos Gonzalo,Mosquera Benalcazar,MosqueraCarlosB,Marzo Compromiso patria Basta politicos Necesitamos persona Valiosa Honorable representarnos CPCCS CARLOS MOSQUERA Cirugia Mayor Corruptos Vota Puesto Paleta Hombres VOTO UnMedicoHonrado,2019-02-19
Carlos Gonzalo,Mosquera Benalcazar,MosqueraCarlosB,Quieres conocer Candidato Consejo Participacion Ciudadana Control Social MosqueraCarlosB Tendras Noticias primera mano haciendo frente corrupcion ecuador mantente informado pluma servidor COMPARTE,2019-02-19
Carlos Gonzalo,Mosquera Benalcazar,MosqueraCarlosB,Jubilados Pueblo desposeidos Jovenes haremos marzo diferencia defender Voto civismo patriotismo Carlos Mosquera politicos Medico Servidor Patria,2019-02-19
Carlos Gonzalo,Mosquera Benalcazar,MosqueraCarlosB,Conoce cerca actividades Candidato CPCCS MosqueraCarlosB Siguelo Instagram enterate potencial servidor ninguna duda llevara Pais riendas justicia Siguelo link Raya puesto,2019-02-20
Carlos Gonzalo,Mosquera Benalcazar,MosqueraCarlosB,ALERTA estan promoviendo Voto NULO Acaso cuenta alargar tema Elecciones gasto bolsillos Campana nivel nacional pais gastar plata campanas COMPARTE,2019-02-20
Carlos Gonzalo,Mosquera Benalcazar,MosqueraCarlosB,PostDrCarlosMosquera ELIMINATORIAS CarlosMosquera CPCCS VOTO UnMedicoHonrado,2019-02-20
Carlos Gonzalo,Mosquera Benalcazar,MosqueraCarlosB,PostDrCarlosMosquera ULTIMO CHANCE CarlosMosquera CPCCS VOTO UnMedicoHonrado,2019-02-21
Carlos Gonzalo,Mosquera Benalcazar,MosqueraCarlosB,pierdas entrevista RadioCanelaEC Pichincha forma Online Saludos marzo votaremos Carlos Mosquera CarlosMosqueraAlCPCCS Casillero VOTO UnMedicoHonrado,2019-02-21
Carlos Gonzalo,Mosquera Benalcazar,MosqueraCarlosB,40PM pierdas entrevista Radio Negra Latina Saludos CarlosMosqueraAlCPCCS Puesto VOTO UnMedicoHonrado,2019-02-21
Carlos Gonzalo,Mosquera Benalcazar,MosqueraCarlosB,invito seguirme nueva cuenta Twitter subire contenido exclusivo momento,2019-02-21
Carlos Gonzalo,Mosquera Benalcazar,MosqueraCarlosB,invito seguirme cuenta Twitter subo contenido exclusivo momento,2019-02-21
Carlos Gonzalo,Mosquera Benalcazar,MosqueraCarlosB,invito seguirme cuenta Twitter subo contenido exclusivo momen,2019-02-21
Carlos Gonzalo,Mosquera Benalcazar,MosqueraCarlosB,PostDrCarlosMosquera LOOR MEDICO CarlosMosquera CPCCS VOTO UnMedicoHonrado,2019-02-22
Carlos Gonzalo,Mosquera Benalcazar,MosqueraCarlosB,ArticulosDrCarlosMosquera Votar nulo elimina CPCCS votar alguien CarlosMosqueraAlCPCCS Puesto VOTO UnMedicoHonrado Fuente gracias eltelegrafo,2019-02-22
Carlos Gonzalo,Mosquera Benalcazar,MosqueraCarlosB,MANANA pierdas entrevista Radio Municipal Quito junto Feliz Narvaez Programa Entrevistas Escuchalo forma Online CarlosMosqueraAlCPCCS Puesto VOTO UnMedicoHonrado,2019-02-25
Carlos Gonzalo,Mosquera Benalcazar,MosqueraCarlosB,Sintoniza momentos Online CarlosMosqueraAlCPCCS Puesto VOTO UnMedicoHonrado,2019-02-25
Carlos Gonzalo,Mosquera Benalcazar,MosqueraCarlosB,Gracias Ecuavisa permitirme dirigir Nacion compatriotas pais mensaje proposito dentro Consejo Participacion Ciudadana Control Social CPCCS Despertemos ecuatorianos viene gran responsabilidad dentro organismo,2019-02-25
Carlos Gonzalo,Mosquera Benalcazar,MosqueraCarlosB,suma importancia tratar tema matando CORRUPCION ATENTOS demagogia orden elecciones solo propongo extirpar lacra Pillos aunque faltarian anos sacar elemento ecuavisa,2019-02-25
Carlos Gonzalo,Mosquera Benalcazar,MosqueraCarlosB,ArticulosDrCarlosMosquera resumen refrescar memoria Ecuatorianos CarlosMosquera CPCCS VOTO UnMedicoHonrado Fuente gracias Expresoec,2019-02-25
Carlos Gonzalo,Mosquera Benalcazar,MosqueraCarlosB,apoyo sustancial Gracias Vamos siendo fuerza CarlosMosqueraAlCPCCS Puesto VOTO UnMedicoHonrado,2019-02-25
Carlos Gonzalo,Mosquera Benalcazar,MosqueraCarlosB,Iniciar ejecutar concluir Cirugia Mayor ofrecida senor Presidente Republica Demagogia Vamos camino puede cumplir marzo votaremos Carlos Mosquera CarlosMosqueraAlCPCCS Casillero,2019-02-26
Carlos Gonzalo,Mosquera Benalcazar,MosqueraCarlosB,Abrazo fraterno toda Comunidad Ecuatoriana companeros lucha Jubilados lucha bandera compromiso ustedes fondos SAGRADOS pueden tocados nadie,2019-02-27
Carlos Gonzalo,Mosquera Benalcazar,MosqueraCarlosB,anos Correato ensano fondos haciendo Caja Chica mantener obeso puro capricho Correa,2019-02-27
Carlos Gonzalo,Mosquera Benalcazar,MosqueraCarlosB,Vamos Afiliado haciendo fuerza marzo hagamos historia votando puesto servidor CPCCS Papeleta Hombres,2019-02-27
Carlos Gonzalo,Mosquera Benalcazar,MosqueraCarlosB,Gracias todas muestras carino apoyo guerreros historia CarlosMosqueraEsLaVozDelJubidado CarlosMosqueraAlCPCCS Puesto VOTO UnMedicoHonrado,2019-02-27
Carlos Gonzalo,Mosquera Benalcazar,MosqueraCarlosB,CarlosMosqueraEsLaVozDelJubidado CarlosMosqueraAlCPCCS Puesto VOTO UnMedicoHonrado,2019-02-27
Carlos Gonzalo,Mosquera Benalcazar,MosqueraCarlosB,,2019-02-27
Carlos Gonzalo,Mosquera Benalcazar,MosqueraCarlosB,CarlosMosqueraEsLaVozDelJubidado CarlosMosqueraAlCPCCS Puesto VOTO UnMedicoHonrado,2019-02-27
Carlos Gonzalo,Mosquera Benalcazar,MosqueraCarlosB,PostDrCarlosMosquera JUSTICIA CarlosMosqueraAlCPCCS Puesto VOTO UnMedicoHonrado,2019-02-27
Carlos Gonzalo,Mosquera Benalcazar,MosqueraCarlosB,PostDrCarlosMosquera IESS SAQUEADO CarlosMosqueraAlCPCCS Puesto VOTO UnMedicoHonrado,2019-02-27
Carlos Gonzalo,Mosquera Benalcazar,MosqueraCarlosB,Muchas gracias apoyo respaldo Historia Casas Salud Ecuador gusto saber existen comunidades fuerte lucha impunidad abuso adulto mayor trabajador ecuatoriano fuerza marzo dejarnos,2019-02-27
Carlos Gonzalo,Mosquera Benalcazar,MosqueraCarlosB,Jubilados Ecuatorianos Carlos Mosquera Triunfo CarlosMosqueraAlCPCCS Puesto VOTO UnMedicoHonrado,2019-02-27
Carlos Gonzalo,Mosquera Benalcazar,MosqueraCarlosB,Comunicado Fundacion Clinica Mosquera Lunes febrero Pontificia Universidad Catolica Ecuador cumplio Graduacion Curso Auxiliares Enfermeria Fundacion Clinica Mosquera,2019-02-27
Carlos Gonzalo,Mosquera Benalcazar,MosqueraCarlosB,Gracias Negra Latina completa entrevista Saludos Jorge David excelentes comunicadores CarlosMosqueraAlCPCCS Puesto VOTO UnMedicoHonrado,2019-02-28
Carlos Gonzalo,Mosquera Benalcazar,MosqueraCarlosB,Gracias Negra Latina completa entrevista Saludos Jorge David excelentes comunicadores CarlosMosqueraAlCPCCS Puesto VOTO UnMedicoHonrado,2019-02-28
Carlos Gonzalo,Mosquera Benalcazar,MosqueraCarlosB,tambien hacer Patria Miles estudiantes salido aulas vinculandose servicio comunidad materia Salud campo Social enorgullece entidad MOSQUERA aportar pais miembros activos FELICIDADES Curso Na68 Auxiliares Enfermeria,2019-02-28
Carlos Gonzalo,Mosquera Benalcazar,MosqueraCarlosB,PostDrCarlosMosquera CONSEJO PARTICIPACION CIUDADANA CarlosMosqueraAlCPCCS Puesto VOTO UnMedicoHonrado,2019-02-28
Carlos Gonzalo,Mosquera Benalcazar,MosqueraCarlosB,ArticulosDrCarlosMosquera BUEN CPCCS TRANSITORIO CarlosMosqueraAlCPCCS Puesto VOTO UnMedicoHonrado Fuente gracias UNQuito,2019-02-28
Carlos Gonzalo,Mosquera Benalcazar,MosqueraCarlosB,,2019-03-01
Carlos Gonzalo,Mosquera Benalcazar,MosqueraCarlosB,defender corresponde Jubilado Trabajador ecuatoriano responsabilidad CPCCS velar bienestar venir afiliados marzo dile saqueo Vamos triunfar bien Patria MosqueraAlCPCCS Puesto,2019-03-01
Carlos Gonzalo,Mosquera Benalcazar,MosqueraCarlosB,Sigueme Twitter enterate noticias relevantes campana CPCCS,2019-03-01
Carlos Gonzalo,Mosquera Benalcazar,MosqueraCarlosB,ArticulosDrCarlosMosquera UNIDADES JUSTICIA SIRVEN CarlosMosqueraAlCPCCS Puesto VOTO UnMedicoHonrado Fuente gracias lahoraecuador,2019-03-01
Carlos Gonzalo,Mosquera Benalcazar,MosqueraCarlosB,ArticulosDrCarlosMosquera BUEN CONSEJO PARTICIPACION CIUDADANA TRANSITORIO CarlosMosqueraAlCPCCS Puesto VOTO UnMedicoHonrado Fuente gracias DIARIO Expresoec,2019-03-01
Carlos Gonzalo,Mosquera Benalcazar,MosqueraCarlosB,SUBMARINOS CORREISTAS TOMARSE CPCCS marzo votaremos Carlos Mosquera MosqueraAlCPCCS Puesto CarlosMosqueraLaVozDelPueblo VOTO UnMedicoHonrado LaPosta,2019-03-01
Carlos Gonzalo,Mosquera Benalcazar,MosqueraCarlosB,perderse Carlos MOSQUERA bien Pais marzo votaremos Carlos Mosquera TRIUNFO MosqueraAlCPCCS Puesto VOTO UnMedicoHonrado Politico,2019-03-02
Carlos Gonzalo,Mosquera Benalcazar,MosqueraCarlosB,Querias saber votar Consejero CPCCS CARLOS MOSQUERA Aqui dejamos simulador voto exacto encontraras Papeleta Elecciones marzo Difundelo amigos amigas conocidos DESPERDICIES VOTO,2019-03-02
Carlos Gonzalo,Mosquera Benalcazar,MosqueraCarlosB,largo trayectoria medico aprendi valor vida cuidado humano trabajo lugares reconditos Patria llevo sonrisas nuevas esperanzas velo haciendo compromiso contigo ecuatoriano,2019-03-02
Carlos Gonzalo,Mosquera Benalcazar,MosqueraCarlosB,garras oportunismo corrupcion atentado confianza VOTO clave desperdicies Juntos VENCEREMOS sacaremos Ecuador lodo querido hundir MosqueraAlCPCCS Puesto VOTO UnMedicoHonrado,2019-03-02
Carlos Gonzalo,Mosquera Benalcazar,MosqueraCarlosB,,2019-03-02
Carlos Gonzalo,Mosquera Benalcazar,MosqueraCarlosB,,2019-03-02
Carlos Gonzalo,Mosquera Benalcazar,MosqueraCarlosB,Queridos amigos comparto entrevista Radio Municipal Felix Narvaez mantuvimos temas relevantes acerca postulacion accion CPCCS olvides ecuatoriano voto responsabilidad Patria CarlosMosqueraAlCPCCS Puesto,2019-03-02
Carlos Gonzalo,Mosquera Benalcazar,MosqueraCarlosB,,2019-03-02
Carlos Gonzalo,Mosquera Benalcazar,MosqueraCarlosB,ensenar Consejo Participacion Ciudadana Control Social CPCCS marzo votaremos Carlos Mosquera MosqueraAlCPCCS Puesto CarlosMosqueraLaVozDelPueblo VOTO UnMedicoHonrado,2019-03-05
Carlos Gonzalo,Mosquera Benalcazar,MosqueraCarlosB,ArticulosDrCarlosMosquera Constitucion Montecristi Herramienta robar encubrir VIDEO SUBMARINOS CarlosMosqueraAlCPCCS Puesto VOTO UnMedicoHonrado Fuente gracias eltelegrafo,2019-03-05
Carlos Gonzalo,Mosquera Benalcazar,MosqueraCarlosB,ArticulosDrCarlosMosquera PRINCIPAL CULPABLE VIDEO SUBMARINOS CarlosMosqueraAlCPCCS Puesto VOTO UnMedicoHonrado Fuente gracias lahoraecuador,2019-03-05
Carlos Gonzalo,Mosquera Benalcazar,MosqueraCarlosB,,2019-03-05
Carlos Gonzalo,Mosquera Benalcazar,MosqueraCarlosB,marzo daremos voto golpe fuerte corrupcion MosqueraAlCPCCS Puesto CarlosMosqueraLaVozDelPueblo VOTO UnMedicoHonrado,2019-03-06
Carlos Gonzalo,Mosquera Benalcazar,MosqueraCarlosB,bien cierto unico preconizado campana lucha Corrupcion Impunidad ofrecen Moro sabiendo erradicar corrupcion necesitaria toda vida Pueblo miente pueblo tonto sabra elegir bien,2019-03-06
Carlos Gonzalo,Mosquera Benalcazar,MosqueraCarlosB,,2019-03-08
Carlos Gonzalo,Mosquera Benalcazar,MosqueraCarlosB,Feliz mujer valerosa CarlosMosqueraAlCPCCS Puesto VOTO UnMedicoHonrado,2019-03-08
Carlos Gonzalo,Mosquera Benalcazar,MosqueraCarlosB,PostDrCarlosMosquera DIANA FISCAL CarlosMosqueraAlCPCCS Puesto VOTO UnMedicoHonrado,2019-03-08
Carlos Gonzalo,Mosquera Benalcazar,MosqueraCarlosB,sabias Votar Candidatura CPCCS Aqui explicamos COMPARTELO marzo votaremos Carlos Mosquera CarlosMosqueraAlCPCCS Puesto VOTO UnMedicoHonrado,2019-03-08
Carlos Gonzalo,Mosquera Benalcazar,MosqueraCarlosB,Gracias Apoyo Carino agradecimiento especial Centro Medico Martha Bucaram Roldos Fundacion Clinica Mosquera apoyan viejo camino alcanzar recuperar dignidad ecuatorianos CarlosMosqueraAlCPCCS Puesto,2019-03-08
Carlos Gonzalo,Mosquera Benalcazar,MosqueraCarlosB,Gracias Apoyo Carino agradecimiento especial Centro Medico Martha Bucaram Roldos FCMecuador apoyan viejo camino alcanzar recuperar dignidad ecuatorianos CarlosMosqueraAlCPCCS Casillero,2019-03-08
Carlos Gonzalo,Mosquera Benalcazar,MosqueraCarlosB,Gracias Apoyo Carino agradecimiento especial Centro Medico Martha Bucaram Roldos FCMecuador apoyan viejo camino alcanzar recuperar dignidad ecuatorianos CarlosMosqueraAlCPCCS Casillero,2019-03-08
Carlos Gonzalo,Mosquera Benalcazar,MosqueraCarlosB,PostDrCarlosMosquera VOTO NULO CarlosMosqueraAlCPCCS Puesto VOTO UnMedicoHonrado,2019-03-08
Carlos Gonzalo,Mosquera Benalcazar,MosqueraCarlosB,cuidado ofrecimientos candidatos DEMAGOGIA orden Partamos logica principal importante CirugiaMayor marzo votaremos Carlos Mosquera MosqueraAlCPCCS Puesto,2019-03-09
Carlos Gonzalo,Mosquera Benalcazar,MosqueraCarlosB,CPCCS debe garantizar participacion ciudadania actuar Nadie quiere sentanrse silla vacia marzo votaremos Carlos Mosquera CarlosMosqueraAlCPCCS Puesto VOTO UnMedicoHonrado,2019-03-09
Carlos Gonzalo,Mosquera Benalcazar,MosqueraCarlosB,PostDrCarlosMosquera ACOSTUMBRADOS FRAUDE CarlosMosqueraAlCPCCS Puesto VOTO UnMedicoHonrado,2019-03-09
Carlos Gonzalo,Mosquera Benalcazar,MosqueraCarlosB,DILE DEMAGOGIA Aqui unica categorica propuesta Consejo Participacion Ciudadana Control Social CPCCS marzo votaremos Carlos Mosquera MosqueraAlCPCCS Puesto VOTO UnMedicoHonrado,2019-03-11
Carlos Gonzalo,Mosquera Benalcazar,MosqueraCarlosB,recaudado millones dolares segun Finanzas destino Gastos permanentes explicara cumplio Fomento Ambiental promotora impuesto marzo votaremos Carlos Mosquera MosqueraAlCPCCS ImpuestoVerde,2019-03-11
Carlos Gonzalo,Mosquera Benalcazar,MosqueraCarlosB,gracias honesto comentario MosqueraCarlosB,2019-03-11
Carlos Gonzalo,Mosquera Benalcazar,MosqueraCarlosB,tema robo titanico ecuador parte Manosa Constitucion Montecristi hecha Profugo Aqui declaraciones marzo votaremos Carlos Mosquera CarlosMosqueraAlCPCCS Puesto VOTO UnMedicoHonrado,2019-03-11
Carlos Gonzalo,Mosquera Benalcazar,MosqueraCarlosB,Gracias Metro Ecuador nota marzo votaremos Carlos Mosquera CarlosMosqueraAlCPCCS Puesto VOTO UnMedicoHonrado,2019-03-11
Carlos Gonzalo,Mosquera Benalcazar,MosqueraCarlosB,postura siempre sera franca frente quiera corten entrevista Gracias Radio Canela marzo votaremos Carlos Mosquera CarlosMosqueraAlCPCCS Puesto VOTO UnMedicoHonrado,2019-03-11
Carlos Gonzalo,Mosquera Benalcazar,MosqueraCarlosB,sigues Instagram hecho puedes seguirme aqui CarlosMosqueraAlCPCCS Casillero VOTO UnMedicoHonrado,2019-03-11
Carlos Gonzalo,Mosquera Benalcazar,MosqueraCarlosB,,2019-03-11
Carlos Gonzalo,Mosquera Benalcazar,MosqueraCarlosB,Ustedes Jovenes futuro pais ustedes legado adultos podemos dejarles Involucremonos Jovenes progreso nacion cambiemos podredumbre concepto Politica ustedes actividades pueden cambiarlo,2019-03-12
Carlos Gonzalo,Mosquera Benalcazar,MosqueraCarlosB,Ecuatorianos sabemos Vocacion Constancia Mosquera Esperanza recuperar Pais CPCCS marzo votaremos Carlos Mosquera MosqueraAlCPCCS Puesto VOTO UnMedicoHonrado,2019-03-12
Carlos Gonzalo,Mosquera Benalcazar,MosqueraCarlosB,Gracias RadioCanelaEC entrevista marzo votaremos Carlos Mosquera MosqueraAlCPCCS Puesto VOTO UnMedicoHonrado,2019-03-12
Carlos Gonzalo,Mosquera Benalcazar,MosqueraCarlosB,PostDrCarlosMosquera CANDIDATOS CarlosMosqueraAlCPCCS Puesto VOTO UnMedicoHonrado,2019-03-12
Carlos Gonzalo,Mosquera Benalcazar,MosqueraCarlosB,lejos realidad solo verdaderos valientes ecuatorianos Votaremos conciencia demagogias Gracias portal caballo siempre hace humor duras luchas elecciones marzo votaremos Carlos Mosquera,2019-03-12
Carlos Gonzalo,Mosquera Benalcazar,MosqueraCarlosB,PostDrCarlosMosquera GRAVISIMO PELIGROSISIMO CANDIDATOS CarlosMosqueraAlCPCCS Puesto VOTO UnMedicoHonrado,2019-03-13
Carlos Gonzalo,Mosquera Benalcazar,MosqueraCarlosB,proposito marcha Jueves Aqui articulo desmonta toda farsa impuesto Impuesto Verde forma meterle manos bolsillos ecuatorianos Fuente gracias eltelegrafo ImpuestoVerde,2019-03-13
Carlos Gonzalo,Mosquera Benalcazar,MosqueraCarlosB,PostDrCarlosMosquera CIRCO CarlosMosqueraAlCPCCS Puesto VOTO UnMedicoHonrado,2019-03-13
Carlos Gonzalo,Mosquera Benalcazar,MosqueraCarlosB,prohibio tipo campana apelo edio rcuerdo ustedes compatriotas gestion realizada vida profesional humano marzo daremos golpe certero corrupcion nuetsro Voto Cuento contigo CPCCS,2019-03-14
Carlos Gonzalo,Mosquera Benalcazar,MosqueraCarlosB,PostDrCarlosMosquera TERREMOTO CarlosMosqueraAlCPCCS Puesto VOTO UnMedicoHonrado,2019-03-14
Carlos Gonzalo,Mosquera Benalcazar,MosqueraCarlosB,PostDrCarlosMosquera AVIONES LLUCHOS CarlosMosqueraAlCPCCS Puesto VOTO UnMedicoHonrado CarlosVerareal,2019-03-14
Carlos Gonzalo,Mosquera Benalcazar,MosqueraCarlosB,prohibio tipo campana apelo medio recuerdo ustedes compatriotas gestion realizada vida profesional humano marzo daremos golpe certero corrupcion Voto Cuento contigo,2019-03-14
Carlos Gonzalo,Mosquera Benalcazar,MosqueraCarlosB,Queridos Compatriotas aqui forma Votar Candidatura Consejo Participacion Ciudadana Control Social Compartan medio mundo ecuatorianos nobles queremos bien Patria Juntos solo puno bien Pais,2019-03-15
Carlos Gonzalo,Mosquera Benalcazar,MosqueraCarlosB,pierdas pocos instantes entrevista Buenos Dias Diego Oquendo Radio Vision podran Facebook Live Vamos fuerza CPCCS marzo votaremos Carlos Mosquera MosqueraAlCPCCS PuestoRT,2019-03-15
Carlos Gonzalo,Mosquera Benalcazar,MosqueraCarlosB,Gracias Radio Vision invitacion programa Buenos Dias Diego Oquendo frase tomar toro cuernos corrupcion combate frente miedos Juntos marzo haremos diferencia patria necesita,2019-03-16
Carlos Gonzalo,Mosquera Benalcazar,MosqueraCarlosB,Gracias visionquito invitacion programa Buenos Dias diegooquendo frase tomar toro cuernos corrupcion combate frente miedos Juntos marzo haremos diferencia patria necesita,2019-03-16
Carlos Gonzalo,Mosquera Benalcazar,MosqueraCarlosB,Junto amigo diegooquendo luego amena entrevista poniendo constancia postura frente CPCCS frase tomar toro cuernos corrupcion combate frente miedos MosqueraAlCPCCS PuestoRT,2019-03-16
Carlos Gonzalo,Mosquera Benalcazar,MosqueraCarlosB,ArticulosDrCarlosMosquera defender Voto ecuatorianos CarlosMosqueraAlCPCCS Puesto VOTO UnMedicoHonrado Fuente gracias Diario Telegrafo,2019-03-16
Carlos Gonzalo,Mosquera Benalcazar,MosqueraCarlosB,ArticulosDrCarlosMosquera TANTA CONFUSION CarlosMosqueraAlCPCCS Puesto VOTO UnMedicoHonrado Fuente gracias Expresoec,2019-03-16
Carlos Gonzalo,Mosquera Benalcazar,MosqueraCarlosB,PostDrCarlosMosquera MENUDO CarlosMosqueraAlCPCCS Puesto VOTO UnMedicoHonrado,2019-03-16
Carlos Gonzalo,Mosquera Benalcazar,MosqueraCarlosB,PostDrCarlosMosquera REFINERIA CarlosMosqueraAlCPCCS Puesto VOTO UnMedicoHonrado,2019-03-16
Carlos Gonzalo,Mosquera Benalcazar,MosqueraCarlosB,PostDrCarlosMosquera POZO CarlosMosqueraAlCPCCS Puesto VOTO UnMedicoHonrado,2019-03-16
Carlos Gonzalo,Mosquera Benalcazar,MosqueraCarlosB,PostDrCarlosMosquera REELECCION CarlosMosqueraAlCPCCS Puesto VOTO UnMedicoHonrado,2019-03-16
Carlos Gonzalo,Mosquera Benalcazar,MosqueraCarlosB,Gracias respaldo carino queridos amigos Jubilados Responder cada preguntas conocer postura hacia camino CPCCS vital importancia Ustedes ejemplo lucha nuevas generaciones sera escuchada MosqueraAlCPCCS,2019-03-16
Carlos Gonzalo,Mosquera Benalcazar,MosqueraCarlosB,PostDrCarlosMosquera BALCON GONZALEZ CarlosMosqueraAlCPCCS Puesto VOTO UnMedicoHonrado,2019-03-16
Carlos Gonzalo,Mosquera Benalcazar,MosqueraCarlosB,PostDrCarlosMosquera BALCON GONZALEZ DEMAS CarlosMosqueraAlCPCCS Puesto VOTO UnMedicoHonrado,2019-03-16
Carlos Gonzalo,Mosquera Benalcazar,MosqueraCarlosB,Confianza honra lucha Venceremos marzo olvides MosqueraAlCPCCS Puesto VOTAMOS UnMedicoHonrado,2019-03-17
Carlos Gonzalo,Mosquera Benalcazar,MosqueraCarlosB,sigues Instagram hecho puedes seguirme aqui CarlosMosqueraAlCPCCS Casillero VOTO UnMedicoHonrado,2019-03-17
Carlos Gonzalo,Mosquera Benalcazar,MosqueraCarlosB,Queridos Compatriotas aqui forma Votar Candidatura Consejo Participacion Ciudadana Control Social Compartan medio mundo ecuatorianos nobles queremos bien Patria Juntos solo puno bien Pais,2019-03-17
Carlos Gonzalo,Mosquera Benalcazar,MosqueraCarlosB,burocracia obstaculiza progreso jovenes debe prioridad CPCCS Queremos jovenes participativos oportunidades empleo Ustedes motor nacion juntos conquistaremos venceremos CPCCS Vamos nuevo pais,2019-03-18
Carlos Gonzalo,Mosquera Benalcazar,MosqueraCarlosB,Saludos amigos Bordex Media gracias arte Aqui Trayectoria Propuestas CPCCS compartan marzo votaremos Carlos Mosquera MosqueraAlCPCCS Puesto VOTO UnMedicoHonrado,2019-03-18
Carlos Gonzalo,Mosquera Benalcazar,MosqueraCarlosB,Saludos amigos bordexmediaec gracias arte Aqui Trayectoria Propuestas CPCCS compartan marzo votaremos Carlos Mosquera MosqueraAlCPCCS Puesto VOTO UnMedicoHonrado,2019-03-18
Carlos Gonzalo,Mosquera Benalcazar,MosqueraCarlosB,marzo votaremos Carlos Mosquera MosqueraAlCPCCS Puesto VOTO UnMedicoHonrado COMPARTE,2019-03-18
Carlos Gonzalo,Mosquera Benalcazar,MosqueraCarlosB,Cuanto aguantaste Pueblo marzo votaremos Carlos Mosquera MosqueraAlCPCCS Puesto VOTO UnMedicoHonrado,2019-03-18
Carlos Gonzalo,Mosquera Benalcazar,MosqueraCarlosB,ArticulosDrCarlosMosquera MAYOTRIAS MINORIAS CarlosMosqueraAlCPCCS Puesto VOTO UnMedicoHonrado Fuente gracias lahoraecuador,2019-03-18
Carlos Gonzalo,Mosquera Benalcazar,MosqueraCarlosB,ArticulosDrCarlosMosquera MAYORIAS MINORIAS CarlosMosqueraAlCPCCS Puesto VOTO UnMedicoHonrado Fuente gracias Diario Hora,2019-03-18
Carlos Gonzalo,Mosquera Benalcazar,MosqueraCarlosB,PostDrCarlosMosquera PONER LADRONES PODER CarlosMosqueraAlCPCCS Puesto VOTO UnMedicoHonrado,2019-03-19
Carlos Gonzalo,Mosquera Benalcazar,MosqueraCarlosB,marzo recuperaremos justicia bien ecuatorianos VOTO CARLOS MOSQUERA MosqueraAlCPCCS Puesto VOTO UnMedicoHonrado,2019-03-19
Carlos Gonzalo,Mosquera Benalcazar,MosqueraCarlosB,Crear mecanismos generen fuentes Empleo menos necesidad delinquir causar inseguridad habitantes Vamos futuro prospero marzo votaremos Carlos Mosquera MosqueraAlCPCCS PuestoRT,2019-03-19
Carlos Gonzalo,Mosquera Benalcazar,MosqueraCarlosB,Vamos votar Civismo Fervor Alegria caracteriza ecuatorianos marzo vamos Triunfo Patria MosqueraAlCPCCS Puesto Papeleta Hombres,2019-03-20
Carlos Gonzalo,Mosquera Benalcazar,MosqueraCarlosB,Vamos votar Civismo Fervor Alegria caracteriza ecuatorianos marzo vamos Triunfo Patria MosqueraAlCPCCS Puesto Papeleta Hombres,2019-03-20
Carlos Gonzalo,Mosquera Benalcazar,MosqueraCarlosB,Reconozco Doctor Mosquera entrega dedicacion salud pobres deseo exitos,2019-03-20
Carlos Gonzalo,Mosquera Benalcazar,MosqueraCarlosB,Vamos votar Civismo Fervor Alegria caracteriza ecuatorianos marzo vamos Triunfo Patria MosqueraAlCPCCS Puesto Papeleta Hombres,2019-03-20
Carlos Gonzalo,Mosquera Benalcazar,MosqueraCarlosB,PostDrCarlosMosquera VOTE BLANCO CarlosMosqueraAlCPCCS Puesto VOTO UnMedicoHonrado,2019-03-21
Carlos Gonzalo,Mosquera Benalcazar,MosqueraCarlosB,DESPERDICIE VOTO Votar CPCCS extendera agonia patria coste millonario mismos bolsillos llamando nuevamente elecciones temen horas acabar corrupcion estan contadas pillos,2019-03-21
Carlos Gonzalo,Mosquera Benalcazar,MosqueraCarlosB,adultos mayores problema economico carga productiva ArticulosDrCarlosMosquera CarlosMosqueraAlCPCCS Puesto VOTO UnMedicoHonrado MosqueraLaVozDelJubilado MosqeraConElAfiliado MosqueraConElAdultoMayor Fuente gracias Expresoec,2019-03-21
Carlos Gonzalo,Mosquera Benalcazar,MosqueraCarlosB,adultos mayores problema economico carga productiva ArticulosDrCarlosMosquera CarlosMosqueraAlCPCCS Puesto VOTO UnMedicoHonrado MosqueraLaVozDelJubilado MosqueraConElAfiliado MosqueraConElAdultoMayor Fuente gracias Expresoec,2019-03-21
Carlos Gonzalo,Mosquera Benalcazar,MosqueraCarlosB,Aqui dejo opinion lectoras respecto Articulo publicado Diario Expreso titulado adultos mayores problema economico carga productiva Gracias comentarios nutren positivamente panorama vivir ecuatorianos,2019-03-21
Carlos Gonzalo,Mosquera Benalcazar,MosqueraCarlosB,andrespaezec,2019-03-21
Carlos Gonzalo,Mosquera Benalcazar,MosqueraCarlosB,DESPERDICIES VOTO DILE VOTO BLANCO NULO marzo votaremos Carlos Mosquera MosqueraAlCPCCS Puesto VOTO UnMedicoHonrado,2019-03-21
Carlos Gonzalo,Mosquera Benalcazar,MosqueraCarlosB,hecho ecuatorianos frente elecciones CarlosMosqueraAlCPCCS Puesto VOTO UnMedicoHonrado,2019-03-22
Carlos Gonzalo,Mosquera Benalcazar,MosqueraCarlosB,deberian ocupar Consejo Participacion Ciudadana Control Social CarlosMosqueraAlCPCCS Puesto VOTO UnMedicoHonrado,2019-03-22
Carlos Gonzalo,Mosquera Benalcazar,MosqueraCarlosB,deben ocupar Consejo Participacion Ciudadana Control Social CarlosMosqueraAlCPCCS Puesto VOTO UnMedicoHonrado,2019-03-22
Carlos Gonzalo,Mosquera Benalcazar,MosqueraCarlosB,Quito Poder litigio ArticulosDrCarlosMosquera CarlosMosqueraAlCPCCS Puesto VOTO UnMedicoHonrado Fuente gracias eltelegrafo,2019-03-23
Carlos Gonzalo,Mosquera Benalcazar,MosqueraCarlosB,PostDrCarlosMosquera CUCOS marzo votaremos Carlos Mosquera MosqueraAlCPCCS Puesto VOTO UnMedicoHonrado,2019-03-23
Carlos Gonzalo,Mosquera Benalcazar,MosqueraCarlosB,Gracias vamos Triunfo,2019-03-23
Carlos Gonzalo,Mosquera Benalcazar,MosqueraCarlosB,VotaInformado marzo votaremos Carlos Mosquera MosqueraAlCPCCS Puesto VOTO UnMedicoHonrado,2019-03-23
Carlos Gonzalo,Mosquera Benalcazar,MosqueraCarlosB,VotaInformado marzo votaremos Carlos Mosquera MosqueraAlCPCCS Puesto VOTO UnMedicoHonrado,2019-03-23
Carlos Gonzalo,Mosquera Benalcazar,MosqueraCarlosB,VotaInformado marzo votaremos Carlos Mosquera MosqueraAlCPCCS Puesto VOTO UnMedicoHonrado,2019-03-23
Carlos Gonzalo,Mosquera Benalcazar,MosqueraCarlosB,VotaInformado marzo votaremos Carlos Mosquera MosqueraAlCPCCS Puesto VOTO UnMedicoHonrado,2019-03-23
Carlos Gonzalo,Mosquera Benalcazar,MosqueraCarlosB,VotaInformado marzo votaremos Carlos Mosquera MosqueraAlCPCCS Puesto VOTO UnMedicoHonrado,2019-03-23
Carlos Gonzalo,Mosquera Benalcazar,MosqueraCarlosB,VotaInformado marzo votaremos Carlos Mosquera MosqueraAlCPCCS Puesto VOTO UnMedicoHonrado,2019-03-23
