nombre,apellidos,tweet_screen_name,tweet_text,tweet_date
Carlos Gonzalo,Mosquera Benalcazar,MosqueraCarlosB,ultimo mensaje ustedes Compatriotas marzo votaremos Carlos Mosquera MosqueraAlCPCCS Puesto Papeleta Hombres,2019-03-24
Carlos Gonzalo,Mosquera Benalcazar,MosqueraCarlosB,dejemos quiten Voto Correa sabe horas conmigo estan contadas puesto trolls trabajar desprestigiandonos calumniandonos dejaremos honestos ganas Carlos Mosquera Puesto papeleta hombres CPCCS,2019-03-24
Carlos Gonzalo,Mosquera Benalcazar,MosqueraCarlosB,Gracias Compatriotas escucha TRIUNFO,2019-03-24
Carlos Gonzalo,Mosquera Benalcazar,MosqueraCarlosB,Gracias queridos ecuatorianos apoyo masivo Urnas Quiero agradecer manera especial tambien pueblo Quiteno apostando recintos electorales defender Voto gallardia entusiasmo tendre noticias Saludos,2019-03-24
Carlos Gonzalo,Mosquera Benalcazar,MosqueraCarlosB,,2019-03-25
Carlos Gonzalo,Mosquera Benalcazar,MosqueraCarlosB,,2019-03-25
Carlos Gonzalo,Mosquera Benalcazar,MosqueraCarlosB,nueva denuncia canididato CPCCS definitivo canalizamos oficial Almagro OEA2015 pacoguerreroa65 gerardodeicaza brendaindc kevinCasasZ yerutimendez,2019-03-25
Carlos Gonzalo,Mosquera Benalcazar,MosqueraCarlosB,parte integramos Fundacion Clinica Mosquera queremos expresar ciudadania profundo agradecimiento habernos brindado carino apoyo candidatura honorable medico Carlos Mosquera Benalcazar CPCCS GRACIAS,2019-03-25
Carlos Gonzalo,Mosquera Benalcazar,MosqueraCarlosB,Quito correista ArticulosDrCarlosMosquera CarlosMosquera Fuente gracias telegrafo,2019-03-29
Carlos Gonzalo,Mosquera Benalcazar,MosqueraCarlosB,AGRADECIMIENTO ECUATORIANOS HONESTOS Carlos Mosquera Benalcazar,2019-04-13
