nombre,apellidos,tweet_screen_name,tweet_text,tweet_date
Juan Carlos,Solines,JCSolines,comparto agenda entrevistas manana QuitoSeLevanta,2019-02-21
Juan Carlos,Solines,JCSolines,compromiso barrios trabajaremos juntos resolver problemas tambien mios Vamos poner orden ciudad QuitoSeLevanta JuntosPodemos SolinesAlcalde PodemosQuito,2019-02-22
Juan Carlos,Solines,JCSolines,invito escucharme QuitoSeLevanta PodemosQuito,2019-02-22
Juan Carlos,Solines,JCSolines,convencer electorado estrategias candidatos importantes desafio caso campana seriedad decirle gente muchas veces quiere escuchar propuesta reales Quito volver levantarse JCSolines,2019-02-22
Juan Carlos,Solines,JCSolines,debe volver ojos barrios parroquias rurales dejar mega obras grande viene camino metro Quito JCSolines Siga transmision vivo interactue LaNoticiaenSucesos,2019-02-22
Juan Carlos,Solines,JCSolines,sido acercamiento barrios verocha16 iniquidad enorme tale caso existen hogares utilizan velas barrios capital JCSolines LaNoticiaenSucesos,2019-02-22
Juan Carlos,Solines,JCSolines,compromiso barrios Trabajaremos juntos resolver problemas tambien mios Quito tolera mediocridad improvisacion QuitoSeLevanta JuntosPodemos QuitoNecesitaOrden LosBarriosPrimero,2019-02-24
Juan Carlos,Solines,JCSolines,invito sintonizar entrevistas JuntosPodemos,2019-02-25
Juan Carlos,Solines,JCSolines,invito sintonizar entrevistas QuitoSeLevanta JuntosPodemo,2019-02-26
Juan Carlos,Solines,JCSolines,Espero descansado feriado Avanzamos firmes campana invito visitar redes Facebook Instagram escuchar entrevistas manana QuitoSeLevanta JuntosPodemos,2019-03-06
Juan Carlos,Solines,JCSolines,Juan Carlos Solines candidato Alcaldia Quito Juntos Podemos LaPalabraSonorama JCSolines,2019-03-06
Juan Carlos,Solines,JCSolines,invito acompanen entrevistas QuitoSeLevanta JuntosPodemos,2019-03-07
Juan Carlos,Solines,JCSolines,diferencias atacar plantear temas importantes Quito gente Esperamos Paco Moncayo cara puede aspirar Alcalde huyendo debates digo frente trolls QuitoSeLevanta JuntosPodemos SolinesAlcalde,2019-03-07
Juan Carlos,Solines,JCSolines,invito manana sintonicen nuevo debate Corral Holguin Montufar Radio Quito mrivadeneira entrevista radiosonorama 15pm importante escuchen candidatos analicen perfiles experiencia ejerzan voto informado,2019-03-08
Juan Carlos,Solines,JCSolines,comparto entrevista manana fmmundo gran cdaponce abordamos muchas propuestas Alcaldia Quito VotaInformadoPorQuito JuntosPodemos,2019-03-08
Juan Carlos,Solines,JCSolines,martes 7y30 segmento Conoce Candidato seguimos hablando propuestas acompanaran LuisaMaldonadoM JCSolines preguntas 24horasUIO teleamazonasec,2019-03-12
Juan Carlos,Solines,JCSolines,Dialogo candidatos alcaldia Quito organizado FECABE Ecuador postulantes juancaholguin JCSolines PabloDavalos63,2019-03-14
Juan Carlos,Solines,JCSolines,Dialogo candidatos alcaldia Quito organizado FECABE Ecuador postulantes juancaholguin JCSolines PabloDavalos63,2019-03-14
Juan Carlos,Solines,JCSolines,esencia feminismo lucha igualdad dice JCSolines HablemosdeGenero,2019-03-15
Juan Carlos,Solines,JCSolines,Empieza conversacion juancaholguin JCSolines candidatos aceptaron cumplieron invitacion better hablar genero 8medio moderado itsabela HablemosdeGenero,2019-03-15
Juan Carlos,Solines,JCSolines,Manana Descifrando 8amx97 superar desanimo quitenos hacer Centro Historico Alcaldias menores conectividad nuevos ejes desarrollo contaminacion radiacion PabloDavalos63 PaolaVintimilla JCSolines,2019-03-16
Juan Carlos,Solines,JCSolines,invito acompanen entrevistas,2019-03-16
Juan Carlos,Solines,JCSolines,NOTICIA URGENTE OPERACION METRO QUITO NEGOCIADA SILENCIOSAMENTE QuitoSeLevanta JuntosPodemos,2019-03-16
Juan Carlos,Solines,JCSolines,VIVA QUITO Concejal Norte Lista JCSolines Alcalde QuitoSeLevanta,2019-03-17
Juan Carlos,Solines,JCSolines,JuntosPodemos,2019-03-17
Juan Carlos,Solines,JCSolines,Federic51320921 YRamia juancaholguin CesarMontufar51 Tranquila Yvonne podras troll servicio tocayo Holguin talvez ignora buenos amigos Decide conciencia quitenos podemos seguir equivocando JuntosPodemos QuitoSeLevanta,2019-03-18
Juan Carlos,Solines,JCSolines,Federic51320921 YRamia juancaholguin CesarMontufar51 Tranquila Yvonne podras troll servicio tocayo Holguin talvez ignora buenos amigos politica debe limpia Decide conciencia quitenos podemos seguir equivocando JuntosPodemos QuitoSeLevanta,2019-03-18
Juan Carlos,Solines,JCSolines,Gracias Pablo Aprecio criterio,2019-03-18
Juan Carlos,Solines,JCSolines,andreagordong Federic51320921 YRamia juancaholguin CesarMontufar51 Habla serio Andrea Gordon verdadero nombre Empezaste interesarte politica enero primer tuit aborto juego limpio trolls plan trabajo construido gente experiencia larga lucha politica LoDigoDeFrente,2019-03-18
Juan Carlos,Solines,JCSolines,Federic51320921 YRamia juancaholguin CesarMontufar51 politico Twitter Facebook hecho politica luchando calle defendiendo derechos ideales espero trates carino mandes foto Simplemente IDENTIFICATE quedaras sospecho TROLL haciendo quedar tocayo,2019-03-18
Juan Carlos,Solines,JCSolines,andreagordong Federic51320921 YRamia juancaholguin CesarMontufar51 pica pierde caso haciendo perder candidato responsabilizo escribo troll center INCOMPATIBLE pulcritud tocayo Ahora Andrea cuentame haces dedicas Trabajaste Plan jactas,2019-03-18
Juan Carlos,Solines,JCSolines,Federic51320921 andreagordong YRamia juancaholguin CesarMontufar51 perdono metas Efectivamente titulo libro candidato apoyas voluntaria remuneradamente deberias consecuente Sigo esperando nombre completo hagas quedar tocayo,2019-03-18
Juan Carlos,Solines,JCSolines,andreagordong Federic51320921 YRamia juancaholguin CesarMontufar51 candidato hecho politica limpiamente toda vida tranquilo sereno Manana revele ciudadana detras cuenta ojala pierda tranquilidad serenidad candidato jefe PoliticaCorreaStyle,2019-03-18
Juan Carlos,Solines,JCSolines,Federic51320921 andreagordong YRamia juancaholguin CONFIRMADO TROLL servicio tocayo juancaholguin recomiendo hagas cosas Investigues bien plan paginas Compares Plan Rodas 2014 candidato creyo apoyo trabajo Cuantas paginas tenia,2019-03-18
Juan Carlos,Solines,JCSolines,friega again2 Federic51320921 andreagordong YRamia juancaholguin Altura decir cosas frente trolls hecho toda vida Frente Correa secuaces trollcenter jamas amilane hacer frente principiantes estan haciendo quedar tocayo LoDigoDeFrente,2019-03-18
Juan Carlos,Solines,JCSolines,friega again2 Federic51320921 andreagordong YRamia juancaholguin Ciudadano Federic51320921 tuitea febrero hostigado sistematicamente fecha solo seguidores primera candidata Concejal tocayo Ciudadana andreagordong tuitea enero seguidores companeros,2019-03-18
Juan Carlos,Solines,JCSolines,friega again2 Federic51320921 andreagordong YRamia juancaholguin preferible traten borrar evidencia notarizado abogado experto tecnologia enfrente incluso Ares Rights epoca Correa Alvarados tirania pena empanado campana imagen tocayo sabran,2019-03-18
Juan Carlos,Solines,JCSolines,friega again2 Federic51320921 andreagordong YRamia juancaholguin curioso Muchas coincidencias hacer notar muchas Ciudadano resulto troll innato Insisto lastima hecho quedar tocayo supone repudia practicas vieja politica NoALaCampanaSucia NoAlTrollcenter,2019-03-18
Juan Carlos,Solines,JCSolines,ultima semana campana invito escuchar atentamente entrevistas Empiezo momento debate Radio Democracia Montufar Holguin Davalos,2019-03-18
Juan Carlos,Solines,JCSolines,ariannacevallos democraciaec juancaholguin Estimada Arianna aunque decidido voto hace rato aclaro ataco nadie preguntaron mejor opcion Quito conteste pienso frente Ademas argumentos dado refutados ConQuitoNoSeExperimenta,2019-03-18
Juan Carlos,Solines,JCSolines,Rafael Lugo mayfevivanco Polificcion juancaholguin estimado Rafa conocemos tiempo aprecio respeto preferencia inexperiencia publica debo recordarte Correa Rodas precisamente resultado preferencia Espero sinceramente vuelvas arrepentir ConQuitoNoSeExperimenta,2019-03-18
Juan Carlos,Solines,JCSolines,mayfevivanco Rafael Lugo Polificcion juancaholguin Haces bien Fernanda actitud responsable invito leas hojas vida trayectoria experiencia candidatos favoritos equivoquemos Quito aguanta improvisacion mediocridad ConQuitoNoSeExperimenta,2019-03-18
Juan Carlos,Solines,JCSolines,Rafael Lugo mayfevivanco Polificcion juancaholguin Entonces deberias haber aprendido querido Rafa Jaja ultima decada ultima administracion Municipal Abrazo,2019-03-18
Juan Carlos,Solines,JCSolines,Rafael Lugo mayfevivanco Polificcion juancaholguin Medio extemporaneo comentario revela oportunidad politica concepto amistad Ahora entiendo totalmente preferencia inexperiencia publica recuerdas candidatos criticando obras metro aereopuerto anos retraso,2019-03-18
Juan Carlos,Solines,JCSolines,invito escuchar entrevistas QuitoSeLevanta,2019-03-19
Juan Carlos,Solines,JCSolines,Amparo Medina juancaholguin MarceChiriboga masusanar eribadeneirat lilyariasok Provida 2019 EcuadorProvida FalaciasProgres Adorador2013 Amor Movimiento FrenteJovenEC Amparo exactamente perfiles candidatos revisaron embargo respecto principios valores menciona respeto vida familia libertad religiosa sido claro frontal Creo vida concepcion respecto genero duda,2019-03-19
Juan Carlos,Solines,JCSolines,atapiaflores pamozaec amanecegallito LaRadioRedonda juancaholguin CesarMontufar51 abenavidesgol1 LuisaMaldonadoM Gracias Alex domingo daremos sorpresa,2019-03-19
Juan Carlos,Solines,JCSolines,pamozaec amanecegallito LaRadioRedonda Estimado Pablo alegra planteamientos agradado propuesta aleja demagogia producto contacto barrios ligas gente realidades abrazo,2019-03-19
Juan Carlos,Solines,JCSolines,reveladora entrevista gisella bayona candidato PacoMoncayo preguntado gobernar Garnica ALIADO Ricaurte puso ejemplo Jesucristo Judas respondio conmigo pillos Recomiendo verla completa,2019-03-20
Juan Carlos,Solines,JCSolines,,2019-03-20
Juan Carlos,Solines,JCSolines,YadiraNietoD Chulla515 gisella bayona PacoMoncayo Hola Yadira revisas historial tuits podras conocer mejor forma frontal limpia hacer politica Moncayo candidato rehuido debate ideas propuestas Exigio entrevista solo dijo varias cosas merecen escuchadas malo decirlo,2019-03-20
Juan Carlos,Solines,JCSolines,MisterSGT CesarMontufar51 Gracias voto confianza,2019-03-21
Juan Carlos,Solines,JCSolines,Ultimo campana invito escuchen QuitoSeLevanta JuntosPodemos,2019-03-21
Juan Carlos,Solines,JCSolines,mariavane00 CesarMontufar51 PacoMoncayo juancaholguin alla vocacion servicio debemos aprender condolernos situacion miles ciudadan enfrentan ciudad llena obstaculos peaton Sensibilizarnos rehabilitar veredas exigir duenos predios cumplir responsabilidades,2019-03-21
Juan Carlos,Solines,JCSolines,mayoria encuestadoras querido hacer creer vota Moncayo ganan Yunda Maldonado falacia falsa dicotomia voto menor preparado JCSolines SolinesAlcalde YoVotoPorSolines,2019-03-24
Juan Carlos,Solines,JCSolines,Felicito LoroHomero triunfo deseo Quito salga adelante enfrente denuncie tiempo atras tema frecuencias indagado FiscaliaEcuador Sigo atento tema tambien vigilante gestion cumplimiento barrios ContigoQuito,2019-03-26
Juan Carlos,Solines,JCSolines,mariajosevaqui leonard83111681 LoroHomero FiscaliaEcuador contrario,2019-03-26
Juan Carlos,Solines,JCSolines,melalapam democraciaec CesarMontufar51 encuestas equivocaron Ninguna acerto resultado final Montufar acerco alcanzo Moncayo quedo lugar Moncayo 3ero especulo pocos dias elecciones Declinar candidaturas alianzas podia 1era semana diciembre,2019-04-02
Juan Carlos,Solines,JCSolines,ClaudiaRoura hablo JCSolines diga interpretar decision Lenin retirar asilo Julian Assange,2019-04-21
Juan Carlos,Solines,JCSolines,JCSolines habla PoliticamenteCorrecto interpretar decision Lenin retirar asilo politico Julian Assange pierda 10h30 ecuavisa,2019-04-21
Juan Carlos,Solines,JCSolines,JCSolines explica importante investigar fondo alcances Ecuador montada Julian Assange materia ciberactivismo espionaja contactos politicos ClaudiaRoura,2019-04-24
Juan Carlos,Solines,JCSolines,Todas fuerzas oraciones pueblo hermano Venezuela lucha recuperar patria libertad vulneren derechos bloqueen redes respete periodistas cubren hechos derrame sangre VivaVenezuelaLibre,2019-04-30
