nombre,apellidos,tweet_screen_name,tweet_text,tweet_date
Teddy Gustavo,Tama Aguirre,TamaApoyo,PaolaCabezasC CarlaMaldonadoP Conmigo quiere construir historia sucia solo respetable vida proba academica estan cuestionamientos Espinosa Ministro permitio tantas violaciones CIENTOS NINOS JusticeVeraEC AlecCardenas PedritoExtranja ramirogarciaf larepublica,2019-02-19
Teddy Gustavo,Tama Aguirre,TamaApoyo,PaolaCabezasC CarlaMaldonadoP fotos usted debe subir JAMAS olvidar JCTrujilloCPCCS AleCevallos simonespinosa28 DrRobertoLopez2 omarmaluk AnaMinga pichondedino verdaderos perseguidos ROBOLUCION olvidamos,2019-02-19
Teddy Gustavo,Tama Aguirre,TamaApoyo,PaolaCabezasC CarlaMaldonadoP foto despreciable repudiable verguenza usted gran AMIGO Espinosa bailando MashiRafael mientras violaban cientos ninos usted hizo silencio usted complice ProhibidoOlvidarCompanerita PedritoExtranja 4pelagatos4,2019-02-19
Teddy Gustavo,Tama Aguirre,TamaApoyo,PaolaCabezasC CarlaMaldonadoP evento academico hace anos junto lenhurtado usted asume falso mentira quiere deslegitimar participacion candidato sola mancha vida natasha rojas davidroserow CORREISTA verguenza olvide,2019-02-19
Teddy Gustavo,Tama Aguirre,TamaApoyo,estare conversatorio organizado Asamblea Ciudadana Ecuador AsambleaEcu RadioMorena640 junto ALANDMOLESTINAM JovitaFonFay companeros candidatos CPCCS TEDDY TAMA Elecciones2019EC,2019-02-19
Teddy Gustavo,Tama Aguirre,TamaApoyo,estare conversatorio organizado Asamblea Ciudadana Ecuador AsambleaEcu RadioMorena640 junto ALANDMOLESTINAM JovitaFonFay companeros candidatos CPCCS TEDDY TAMA Elecciones2019EC 4pelagatos4,2019-02-19
Teddy Gustavo,Tama Aguirre,TamaApoyo,angsrm7 ALBERTOACOSTAB justicia siempre sido ideal permitire siga destruyendo pais menos silenciando ciudadania quiero ciudadania escuchada pueda juzgar controlar cada gobernantes hacen,2019-02-19
Teddy Gustavo,Tama Aguirre,TamaApoyo,Gracias Asamblea Ciudadana Ecuador AsambleaEcu magnifico evento contar espacios poder exponer propuestas RadioMorena640 sigue transmision vivo carlosrojasecu DrRobertoLopez2 andreselopeze,2019-02-20
Teddy Gustavo,Tama Aguirre,TamaApoyo,Conversatorio ciudadania Radio Morena junto companeros candidatos CPCCS,2019-02-20
Teddy Gustavo,Tama Aguirre,TamaApoyo,Charla escuela formacion politica Manuel Carrion Pinzano seguimos compartiendo ensenando importancia ciudadania CPCCS elecciones2019 faustoyepez ALANDMOLESTINAM RodolfoBB54 danilotayopanta elchuro DrRobertoLopez2,2019-02-21
Teddy Gustavo,Tama Aguirre,TamaApoyo,Jueves viernes febrero invito conocer propuestas candidato Consejo Participacion Ciudadana Control Social CPCCS Agenda Actividades LOJA Ecuador CPCCS TeddyTama democracia elecciones2019 Loja Hora25Ec ifpoveda IvaOveja,2019-02-21
Teddy Gustavo,Tama Aguirre,TamaApoyo,Loja compartiendo radio Vida propuestas CPCCS Consejo Participacion Ciudadana Control Social JovitaFonFay JCTrujilloCPCCS HonoSantistevan higuerahernan pichondedino,2019-02-21
Teddy Gustavo,Tama Aguirre,TamaApoyo,Sintonicen Radio Satelital conocer propuestas CPCCS,2019-02-21
Teddy Gustavo,Tama Aguirre,TamaApoyo,Loja honor haber podido compartir distintos medios pude conocer propuestas CPCCS cuan importante dentro organismos cadenaecotel tomebamba,2019-02-21
Teddy Gustavo,Tama Aguirre,TamaApoyo,LOJA Agradecido Diario Hora lojalahora entrevista candidato Consejo Participacion Ciudadana Control Social CPCCS Ecuador TeddyTama democracia elecciones2019 LaPosta 4pelagatos4,2019-02-21
Teddy Gustavo,Tama Aguirre,TamaApoyo,Agradecido entrevista Seguimos dando conocer propuestas candidato Consejo Participacion Ciudadana Control Social Ecuador CPCCS TeddyTama democracia elecciones2019 loja,2019-02-21
Teddy Gustavo,Tama Aguirre,TamaApoyo,agrado visitar MatovelleRadio comparti propuestas candidato Consejo Participacion Ciudadana Control Social resalte importancia ciudadania CPCCS omarmaluk NotiCarrousel FLACSOSG Cascabelito09 teleamazonasec,2019-02-22
Teddy Gustavo,Tama Aguirre,TamaApoyo,MatovelleRadio deseo ciudadania informe solo propuestas sino gran importancia CPCCS campana sucia VotoNulo podemos hacerle juego advierten constitucionalistas prestigio DrRobertoLopez2,2019-02-22
Teddy Gustavo,Tama Aguirre,TamaApoyo,FELICITACIONES PROGRAMA politikcorrecta carlosrojasecu VOTO NULO impulsado opinion Josernandez1 candidatos ahora TamaApoyo HernanUlloa FranklinMorenoQ,2019-02-24
Teddy Gustavo,Tama Aguirre,TamaApoyo,LassoGuillermo asesora menos mire programa suficiente FELICITACIONES PROGRAMA politikcorrecta carlosrojasecu VOTO NULO impulsado opinion Josernandez1 candidatos ahora TamaApoyo HernanUlloa FranklinMorenoQ omarmaluk,2019-02-25
Teddy Gustavo,Tama Aguirre,TamaApoyo,AGENDA ACTIVIDADES CUENCA Participacion encuentro Construir democracia participativa territorios Lugar Universidad Cuenca udecuenca 14h00 Entrevista radio line CONGOPE CongopeEcuador omarmaluk ManuelGonzagaG ceduaraujo diegooquendo,2019-02-25
Teddy Gustavo,Tama Aguirre,TamaApoyo,EnCortoTA Candidato Consejo Participacion Ciudadana TamaApoyo Comisionado Gordon criollo Gotika,2019-02-25
Teddy Gustavo,Tama Aguirre,TamaApoyo,Manana organizaciones sociales daran Rueda Prensa Hora 10am Lugar Junta Civica Guayaquil Malecon Olmedo NoAlVotoNulo campana voto CPCCS Quito Ecuador Elecciones2019EC elecciones2019 Guayaquil Cuenca,2019-02-25
Teddy Gustavo,Tama Aguirre,TamaApoyo,lahistoriaec CPCCS Candidatos Idoneos Honestos gran capacidad academica necesita Ecuador cambio conducta moral etica favor TamaApoyo HernanUlloa davidroserow peterbod1 xcastro RafaelCompte CarlosVerareal omarmaluk AzambranPas,2019-02-27
Teddy Gustavo,Tama Aguirre,TamaApoyo,Teddy Tama creador fundador Asamblea Populares Viudadanas Presenta Solidos argumentos rechazar manipulacion Voto Nulo,2019-02-27
Teddy Gustavo,Tama Aguirre,TamaApoyo,Teddy Tamma defiende voto positivo,2019-02-27
Teddy Gustavo,Tama Aguirre,TamaApoyo,Jodaveza81,2019-02-27
Teddy Gustavo,Tama Aguirre,TamaApoyo,celebramos especial conmemoramos todas grandes luchadoras madres hermanas hijas amigas todas mujeres deseamos feliz tinocotania Pueblomontuvio JovitaFonFay,2019-03-09
Teddy Gustavo,Tama Aguirre,TamaApoyo,Vamos juntos empoderamiento ciudadano juntos Tama Teddy CPCCS FOSPEecu HonoSantistevan DrRobertoLopez2,2019-03-19
Teddy Gustavo,Tama Aguirre,TamaApoyo,Teddy Tama candidato CPCCS cuento voto,2019-03-19
Teddy Gustavo,Tama Aguirre,TamaApoyo,agradezco confianza pasa contactos propuestas hagamos verdadero cambio Participacion Ciudadana derecho,2019-03-19
Teddy Gustavo,Tama Aguirre,TamaApoyo,FOSPEecu omarmaluk PedritoExtranja ahora ciudadania junto Participacion Ciudadana sera realidad,2019-03-19
Teddy Gustavo,Tama Aguirre,TamaApoyo,Apretadas jornadas trabajo Gracias medios comunicacion permitir explicar importancia derecho voto afirmativo empoderamiento ciudadano,2019-03-19
Teddy Gustavo,Tama Aguirre,TamaApoyo,Felicitaciones HernanUlloa TamaApoyo DMarcosmolina Carlos Espinosa demas candidatos defendido democracia impedido apruebe reglamento sedicioso favor voto nulo Felicito Presidenta DianaAtamaint abstenerse,2019-03-21
Teddy Gustavo,Tama Aguirre,TamaApoyo,Entrevista Teddy Tama candidato CPCCS TamaApoyo,2019-03-21
Teddy Gustavo,Tama Aguirre,TamaApoyo,lucha derechos participar unas elecciones trampas respuesta Teddy Tama candidatos CPCCS presionaron mecanismo conteo votos nulos traten gallos media noche democracia gano ultimahoraecua,2019-03-21
Teddy Gustavo,Tama Aguirre,TamaApoyo,,2019-03-21
Teddy Gustavo,Tama Aguirre,TamaApoyo,robinrobles omarmaluk carlosrojasecu ramirodiez omarmaluk PedritoExtranja Martinminguchi Pueblomontuvio EdgarEdurive JovitaFonFay larepublica HonoSantistevan SuExcelencia AsambleaEcu wambraEc simonespinosa28,2019-03-21
Teddy Gustavo,Tama Aguirre,TamaApoyo,robinrobles omarmaluk carlosrojasecu ramirodiez omarmaluk PedritoExtranja Martinminguchi Pueblomontuvio EdgarEdurive JovitaFonFay larepublica HonoSantistevan SuExcelencia AsambleaEcu wambraEc simonespinosa28 CPCCS ecuador elecciones2019,2019-03-21
Teddy Gustavo,Tama Aguirre,TamaApoyo,TamaApoyo junto candidatos CPCCS Quito dandose cita atendidos sesion Pleno tema tratarse conteo VOTO NULO cosas salieron manos consejeros resultado Ecuador FelizJueves,2019-03-21
Teddy Gustavo,Tama Aguirre,TamaApoyo,Vamos juntos empoderamiento ciudadano juntos Tama Teddy robinrobles omarmaluk carlosrojasecu ramirodiez omarmaluk PedritoExtranja Martinminguchi Pueblomontuvio EdgarEdurive JovitaFonFay larepublica HonoSantistevan AsambleaEcu wambraEc,2019-03-21
Teddy Gustavo,Tama Aguirre,TamaApoyo,sufragio sera 08h00 17h00 Centros Privacion Libertad Celebramos inicio fiesta democratica Elecciones2019 CPCCS Tama Teddy VotoPPL2019 DianaAtamaint PedritoExtranja RoqueRivasZ andreselopeze DrRobertoLopez2,2019-03-21
Teddy Gustavo,Tama Aguirre,TamaApoyo,eleccion CPCCS demuestra poderosos podemos ecuatorianos mitad mundo prometi permitiria politicos vuelvan meter mano Funcion Transparencia Control Social solo inicio CPCCS Ecuador,2019-03-21
Teddy Gustavo,Tama Aguirre,TamaApoyo,TeleRadio Teddy Tama explica intervencion cnegobec ayer mete participacion ciudadana mete conmigo transparencia proceso ciudadanos asumir responsabilidad FOSPEecu PedritoExtranja,2019-03-21
Teddy Gustavo,Tama Aguirre,TamaApoyo,janethinostroza Teddy Tama candidato consejero CPCCS plan trabajo promovera conformacion asambleas ciudadanas territorio nacional cumpla control social entidades publicas,2019-03-21
Teddy Gustavo,Tama Aguirre,TamaApoyo,VIVO estudio tema funcion Consejo Participacion Ciudadana protagonico cumples FOSPEecu Pueblomontuvio PedritoExtranja DrRobertoLopez2 EdgarEdurive larepublica omarmaluk ManuelGonzagaG JovitaFonFay,2019-03-22
Teddy Gustavo,Tama Aguirre,TamaApoyo,minuchelaw constante lahoraecuador cnegobec organismo poder debe ideologico Debe mesocratico meritocratico bien conocidos profesionales DMarcosmolina HernanUlloa FranklinMorenoM TamaApoyo,2019-03-22
Teddy Gustavo,Tama Aguirre,TamaApoyo,omarmaluk VeroGaby DMarcosmolina FranklinMorenoM HernanUlloa carlosfigueroa6 SofiaAlmeidaEc jobafonfay2019 davidroserow RosaChalaEc creador Participacion Ciudadana pido voto rescatar empoderamiento ciudadano,2019-03-24
Teddy Gustavo,Tama Aguirre,TamaApoyo,omarmaluk VeroGaby DMarcosmolina FranklinMorenoM HernanUlloa carlosfigueroa6 SofiaAlmeidaEc jobafonfay2019 davidroserow RosaChalaEc,2019-03-24
Teddy Gustavo,Tama Aguirre,TamaApoyo,participacion ciudadania procesos electorales importante Teddy Tama ejercera derecho voto manana domingo 9h00 teleamazonasec EcuavisaInforma tctelevision RadioMorena640 robinrobles pichondedino 4pelagatos4 larepublica,2019-03-24
Teddy Gustavo,Tama Aguirre,TamaApoyo,LuisVerdesotoo1 Consejero mienta protestando ustedes votos NECIO ANTIPATRIOTA,2019-03-24
Teddy Gustavo,Tama Aguirre,TamaApoyo,FOSPEecu jcarlostuarez IngCarlosVille2 PaulGranda raulclementelh jaimenebotsaadi andrespaezec mariapaularomo juanseroldan omarmaluk Gracias apoyo enviamos exitos sentimos honrados contar miembro integro representatividad CPCCS Padre Tuarez abrazo felicitaciones triunfo Avanti,2019-03-26
Teddy Gustavo,Tama Aguirre,TamaApoyo,Pueblomontuvio AgriculturaEc mariapaularomo Lenin EAyalaMora AProductivos Defender derechos Pueblomontuvio Resistencia defensa Acuerdos Minimos Dialogos Nacionales liderados Lenin incumplidos AgriculturaEc TamaApoyo dice compromisos respetan cumplen funcionario cumple RENDIRA CUENTAS,2019-03-28
Teddy Gustavo,Tama Aguirre,TamaApoyo,Defensa Derechos queridos Pueblo Montubio Ecuador,2019-03-28
