nombre,apellidos,tweet_screen_name,tweet_text,tweet_date
Jorge,Villacreses,jorgevillacrese,Turismo ciudad miedo alto grado percepcion inseguridad propuesta devolver tranquilidad guayaquilenos,2019-02-19
Jorge,Villacreses,jorgevillacrese,Vamos contar centros monitoreo estaran escuadrones estaran ubicados zonas conflictivas manejar sistema aporte herramientas,2019-02-19
Jorge,Villacreses,jorgevillacrese,listos microfonos,2019-02-19
Jorge,Villacreses,jorgevillacrese,estare 11h00 solicitar exija Provincial asigne pauta publicitaria corresponde candidato derecho mensaje difunda medios comunicacion,2019-02-19
Jorge,Villacreses,jorgevillacrese,excelente iniciando jornada invito seguirnos vivo,2019-02-20
Jorge,Villacreses,jorgevillacrese,crear escuadrones cada seran manejados Queremos tener,2019-02-20
Jorge,Villacreses,jorgevillacrese,buscar modelos exitosos paises haremos,2019-02-20
Jorge,Villacreses,jorgevillacrese,Entrevista junto Juan Manuel Bermudez tambien candidato Alcaldia denunciar pautas publicitarias parte directivas Guayas,2019-02-20
Jorge,Villacreses,jorgevillacrese,invito seguir entrevista contarles propuestas temas,2019-02-26
Jorge,Villacreses,jorgevillacrese,Buenos dias breve estare canal contar guayaquilenos propuestas,2019-02-27
Jorge,Villacreses,jorgevillacrese,objetivo fortalecer escuadrones capacitacion herramientas informales organizarlos ambas propuestas mano tecnologia,2019-02-27
Jorge,Villacreses,jorgevillacrese,vivo conversare propuestas,2019-02-27
Jorge,Villacreses,jorgevillacrese,invito 19h00 sintonizar conocer propuestas debate organizado,2019-02-28
Jorge,Villacreses,jorgevillacrese,Nota periodistica debate Gracias informar embargo debo aclarar minuto tiempo exponer imposible ampliar cifras detalles propuestas,2019-03-01
Jorge,Villacreses,jorgevillacrese,Estimada candidata habria gustado participe debate conocer nueva propuesta plan trabajo notariado,2019-03-01
Jorge,Villacreses,jorgevillacrese,Entiendo fijacion garrote gente apoyo candidato Jorge Villacreses Partido Social Cristiano Ahora bien turba senala pareceria comenzaron simpatizantes pancarta Villacreses estatica,2019-03-02
Jorge,Villacreses,jorgevillacrese,turbas socialcristianas ahora tambien duenas peaje Costa agredieron hombres mujeres reducido numero comenzaban organizarse SIEMPRE BASTA GARROTE,2019-03-02
Jorge,Villacreses,jorgevillacrese,Felicidades mejor manera saber candidatos proyectos alcaldia ciudad aquellos acudieron lastima estan altura Guayaquilenos GUERREROS,2019-03-04
Jorge,Villacreses,jorgevillacrese,Preparado contar guayaquilenos propuesta,2019-03-06
Jorge,Villacreses,jorgevillacrese,alcalde presidir Consejo Seguridad cantonal dare policia herramientas camaras reconocimiento facial detectar delincuente ciudad segura trae inversion,2019-03-06
Jorge,Villacreses,jorgevillacrese,vivo expondre propuestas,2019-03-06
Jorge,Villacreses,jorgevillacrese,Buenos dias invito escucharme ampliar propuesta,2019-03-11
Jorge,Villacreses,jorgevillacrese,testigos recorrido campana asalto logro someter delincuentes escapo muestra nivel inseguridad vamos combatir tecnologia,2019-03-11
Jorge,Villacreses,jorgevillacrese,Gracias entrevista Vamos votando candidatos,2019-03-11
Jorge,Villacreses,jorgevillacrese,invito acompanen escuchar propuesta,2019-03-11
Jorge,Villacreses,jorgevillacrese,Quiero experiencia bajare indices delictivos trabajando coordinacion implementar camaras reconocimiento facial,2019-03-11
Jorge,Villacreses,jorgevillacrese,Buenos dias invito escucharme ampliar propuesta,2019-03-11
Jorge,Villacreses,jorgevillacrese,invito escucharme,2019-03-12
Jorge,Villacreses,jorgevillacrese,Pasando gran momento candidatos seccionales,2019-03-13
Jorge,Villacreses,jorgevillacrese,Gabrando entrevista programa Jorge Escobar,2019-03-13
Jorge,Villacreses,jorgevillacrese,Seguimos informando propuestas,2019-03-13
Jorge,Villacreses,jorgevillacrese,preocupante consumo recorridos encontramos adolescentes consumiendo frente Construire centros rehabilitacion personal especializado areas adecuadas recuperacion,2019-03-13
Jorge,Villacreses,jorgevillacrese,22H00 conoceremos candidatos alcaldia,2019-03-14
Jorge,Villacreses,jorgevillacrese,listos informar propuestas,2019-03-14
Jorge,Villacreses,jorgevillacrese,Entrevista vivo 830Am,2019-03-14
Jorge,Villacreses,jorgevillacrese,Gracias recibimiento dieron pobladores Flor Bastion Bloque ustedes haremos productivo seguro,2019-03-17
Jorge,Villacreses,jorgevillacrese,Buenos dias contar propuestas,2019-03-18
Jorge,Villacreses,jorgevillacrese,Iniciamos grabacion programa canal,2019-03-19
Jorge,Villacreses,jorgevillacrese,vivo entrevista propuestas,2019-03-19
Jorge,Villacreses,jorgevillacrese,Preparado iniciar entrevista Conoceran propuestas,2019-03-20
Jorge,Villacreses,jorgevillacrese,Buenos dias conocer propuestas ultimo plazo campana electoral,2019-03-21
Jorge,Villacreses,jorgevillacrese,Cada invierno bache bache cambiare administracion usando material duradero menor costo Ahorraremos dinero negociados pocos,2019-03-21
Jorge,Villacreses,jorgevillacrese,voto escucha calles Gracias amado confiar,2019-03-22
Jorge,Villacreses,jorgevillacrese,,2019-03-22
Jorge,Villacreses,jorgevillacrese,,2019-03-22
Jorge,Villacreses,jorgevillacrese,Cada invierno bache bache cambiare administracion usando material duradero menor costo Ahorraremos dinero negociados pocos,2019-03-22
Jorge,Villacreses,jorgevillacrese,gran amigo Humberto gracias apoyo defraudare guayaquilenos conozco necesidades inquietudes resolverlas,2019-03-23
Jorge,Villacreses,jorgevillacrese,progreso seguridad Guayaquil estan cerca alcaldia procurare bienestar juntos disfrutemos ciudad linda marzo RAYA,2019-03-23
Jorge,Villacreses,jorgevillacrese,breve estare hablando,2019-05-07
Jorge,Villacreses,jorgevillacrese,Carro paso ambulancia seguimos cultura Seguridad,2019-05-07
Jorge,Villacreses,jorgevillacrese,invito sintonizar breve estare aire 8H00,2019-05-14
