nombre,apellidos,tweet_screen_name,tweet_text,tweet_date
Paola,Vintimilla,PaolaVintimilla,Manana Quito candidata alcaldia espero Fridays Quicentro,2019-02-17
Paola,Vintimilla,PaolaVintimilla,Paola Vintimilla camino Alcaldia Quito Conoce,2019-02-18
Paola,Vintimilla,PaolaVintimilla,barrio Pablo Arturo Suarez norte Quito compartimos gran manana vecinos sector Realizamos minga comunitaria calles encuentran Vamos seguir llegando quieren llegar,2019-02-19
Paola,Vintimilla,PaolaVintimilla,junto compartimos grupo lideresas sociales barriales centro Quito todas coincidimos hora Alcaldia hermosa ciudad encabezada mujeres,2019-02-20
Paola,Vintimilla,PaolaVintimilla,gusto conversar lideresas trabajadoras confirman necesidad cambio saben momento cambiar forma gobernar mujer Alcaldia,2019-02-20
Paola,Vintimilla,PaolaVintimilla,pocos minutos estare radio comunitaria 14h15 Jose Luis Castillo conversando plan trabajo Quito,2019-02-20
Paola,Vintimilla,PaolaVintimilla,unimos comunidad Municipio Ministerio Interior vamos combatir delincuentes Debemos volver casas barriales mantener buen bien iluminados lugares publicos trabajar conjunto Policia Nacional,2019-02-20
Paola,Vintimilla,PaolaVintimilla,primero haremos lleguemos Alcaldia auditoria procesos salgan todas personas necesarias entorpecido accionar Municipio,2019-02-20
Paola,Vintimilla,PaolaVintimilla,comparto agenda medios jueves temprano estare dialogo conocer propuesta transformar Quito 08h30 invito conocer chicos,2019-02-21
Paola,Vintimilla,PaolaVintimilla,Recorrimos junto candidata Distrito Centro Debemos mantener espacio publico seguro haga buen mismo ademas potenciar turismo motor indispensable desarrollo Quito,2019-02-21
Paola,Vintimilla,PaolaVintimilla,junto querida amiga manana,2019-02-21
Paola,Vintimilla,PaolaVintimilla,Gracias interesante,2019-02-22
Paola,Vintimilla,PaolaVintimilla,Jajajajajaja,2019-02-22
Paola,Vintimilla,PaolaVintimilla,pocos dias decide futuro Quito requiere buenas intenciones anos alcaldias perversas destruido ciudad trata solo cambiar gobierno forma gobernar conmigo cambio viene,2019-02-22
Paola,Vintimilla,PaolaVintimilla,pocos dias decide futuro Quito requiere buenas intenciones anos alcaldias perversas destruido ciudad trata solo cambiar gobierno forma gobernar conmigo cambio viene,2019-02-22
Paola,Vintimilla,PaolaVintimilla,barrio Kennedy norte Quito quitenos demostraron preocupacion sucia ciudad cambiar modelo gestion EMASEO haremos licitacion transparente empresa privada encargue administracion,2019-02-22
Paola,Vintimilla,PaolaVintimilla,comerciantes Mercado Chiriyacu comprometieron votar cambio hora turismo vuelva poner vision mercados debemos convertirlos punto atractivo turistas nacionales extranjeros,2019-02-22
Paola,Vintimilla,PaolaVintimilla,quebradas ciudad cambio empieza usemos botadero lugares naturales rodean queremos recuperar belleza Quito aprendamos cuidar,2019-02-22
Paola,Vintimilla,PaolaVintimilla,proposito viaje capital darle respaldo considero gran corazon servicio Francisco Quito,2019-02-23
Paola,Vintimilla,PaolaVintimilla,Gracias apoyo,2019-02-23
Paola,Vintimilla,PaolaVintimilla,Gran jornada recorrimos junto Jose Moran carino gente cada mirada apreton manos recibe SERVIR PASION,2019-02-23
Paola,Vintimilla,PaolaVintimilla,parroquia Calderon parroquias rurales Quito barrios sido olvidados crear mejores vias acceso regularizar terrenos luchar delincuencia compromiso juntos vamos cumplir,2019-02-23
Paola,Vintimilla,PaolaVintimilla,dictador quema ayuda humanitaria llegaba pueblo muere hambre dictadura Maduro debe caer Venezuela queremos libre total apoyo pueblo venezolano,2019-02-23
Paola,Vintimilla,PaolaVintimilla,nadie haga cumplir ordenanzas Quito necesita orden claro botada,2019-02-24
Paola,Vintimilla,PaolaVintimilla,VAMOS CAMBIAR FORMA GOBERNAR CIUDAD,2019-02-25
Paola,Vintimilla,PaolaVintimilla,Iniciamos semana dando conocer plan trabajo diferentes medios comunicacion invito seguir entrevistas,2019-02-25
Paola,Vintimilla,PaolaVintimilla,Excelente inicio semana empezamos jornada,2019-02-25
Paola,Vintimilla,PaolaVintimilla,Queremos Quito horas vida nocturna solo mejoramos turismo empleo sino tambien seguridad ciudad Ahora,2019-02-25
Paola,Vintimilla,PaolaVintimilla,Cambiaremos forma gobernar varios anos administradores solo pensaron amigos parientes aumentar burocracia municipal repartirse poder servir millones quitenos,2019-02-25
Paola,Vintimilla,PaolaVintimilla,fortalecer transporte publico municipal Trabajaremos extension trole Carapungo beneficiara miles quitenos,2019-02-25
Paola,Vintimilla,PaolaVintimilla,Capacitaremos agentes control cuidar ciudadania Reconstruiremos iluminaremos parques plazas familias delincuentes,2019-02-25
Paola,Vintimilla,PaolaVintimilla,Vamos cambiar forma gobernar Liberare recursos invertirlos obras necesitan familias quitenos VIDEO COMPLETO,2019-02-25
Paola,Vintimilla,PaolaVintimilla,18h30 acompanara candidata Alcaldia Escuchanos,2019-02-25
Paola,Vintimilla,PaolaVintimilla,Vamos mejorar sistema transporte publico crear paqueadero periferias,2019-02-26
Paola,Vintimilla,PaolaVintimilla,Vamos hacer primeros dias auditoria procesos,2019-02-26
Paola,Vintimilla,PaolaVintimilla,acompana candidata Alcaldia Escuchanos,2019-02-26
Paola,Vintimilla,PaolaVintimilla,cambiar forma gobernar reducimos burocracia Municipio dinero hacer absolutamente,2019-02-26
Paola,Vintimilla,PaolaVintimilla,martes estare 07h00 programa Radio Majestad 20h30 entretenida entrevista programa grupo Wazaak Facebook espero,2019-02-26
Paola,Vintimilla,PaolaVintimilla,Ahora acompana candidata alcaldesa Escuchanos Tambien,2019-02-26
Paola,Vintimilla,PaolaVintimilla,primeros dias haremos auditoria procesos quiere decir empresa revisara departamentos Municipio determinara cuantas personas necesarias puede ahorrar millones dolares invertiremos obras,2019-02-26
Paola,Vintimilla,PaolaVintimilla,sectorizacion rutas taxis cumplira Basta desorden taxis franjas verdes deben circular parroquias rurales franja roja periferia urbana amarillos franja zona urbana cumpla ordenanza recibira sanciones,2019-02-26
Paola,Vintimilla,PaolaVintimilla,volver trabajar comunidad alarmas comunitarias Debe haber coordinacion directa agentes metropolitanos,2019-02-26
Paola,Vintimilla,PaolaVintimilla,Conversamos socios Camara Industrias Produccion planes mejorar eficiencia Municipio promover desarrollo productivo inversion Quito,2019-02-26
Paola,Vintimilla,PaolaVintimilla,proyecto Sueno parque Ejido hara realidad Gracias vecinos recibieron emblematico parque Vamos seguir mejorando condiciones parques zonas seguras familias quitenas delincuencia,2019-02-26
Paola,Vintimilla,PaolaVintimilla,Puerta puerta llevamos mensaje cambio vecinos Quito Gracias recibirnos brazos abiertos compromiso cambiar forma gobernar ciudad obras servicios merecen,2019-02-26
Paola,Vintimilla,PaolaVintimilla,grupo Wazaak 20h30 pierdas entrevista,2019-02-27
Paola,Vintimilla,PaolaVintimilla,Ahora conversamos chicos Grupo Wazaak Mira entrevista facebook siguiente link,2019-02-27
Paola,Vintimilla,PaolaVintimilla,Oyacoto cambio prioridad sera siempre ciudadania trabajar hombro hombro desarrollo alcaldesa,2019-02-27
Paola,Vintimilla,PaolaVintimilla,Cumbaya ruralidad periferia sido olvidadas administraciones haremos Cada parroquia tendra atraccion turistica cultural generar emprendimientos crear unidad,2019-02-28
Paola,Vintimilla,PaolaVintimilla,Reduciremos burocracia llevado dinero bolsillos ahorro sera invertido servir millones quitenos obras generando empleo haciendo barrios seguros,2019-02-28
Paola,Vintimilla,PaolaVintimilla,Presentaremos proyecto creacion escuelas futbol ninos jovenes recibiran uniformes implementos practicas Incentivemos deporte ciudad debe constante prioritario Alcaldesa,2019-02-28
Paola,Vintimilla,PaolaVintimilla,invito seguir manana entrevista partir 07h00 lindo viernes,2019-03-01
Paola,Vintimilla,PaolaVintimilla,Crearemos corredores exclusivos buses vienen valles parroquias hacia casco urbano mejorar acceso brindar opciones movilidad viven sectores disminuir flujo vehicular,2019-03-01
Paola,Vintimilla,PaolaVintimilla,Vamos capacitar manera eficiente agentes metropolitanos cuidar ciudadania dotaremos armas disuasivas control actos delincuenciales ademas proporcionaremos camaras tambien sientan seguros,2019-03-01
Paola,Vintimilla,PaolaVintimilla,Junto empresa privada haremos recoleccion basura cumpla mantenga limpia ciudad genere recursos Municipio,2019-03-01
Paola,Vintimilla,PaolaVintimilla,perritos vemos calles dueno alcaldia haremos cumplir ordenanza incumplan seran sancionados perritos dueno acompanaran agentes metropolitanos Manana conversamos,2019-03-01
Paola,Vintimilla,PaolaVintimilla,Llego caravana Cambio Conocoto Gracias carino junto Lilia Aguirre vamos transformar parroquia,2019-03-02
Paola,Vintimilla,PaolaVintimilla,Recorrimos zona Jipijapa norte Quito dando conocer propuesta cambio conductores transeuntes Luego visitamos Pifo conversamos floricultores cada paso damos sentimos respaldo gente Gracias carino,2019-03-03
Paola,Vintimilla,PaolaVintimilla,Recorrimos zona Jipijapa norte Quito dando conocer propuesta cambio conductores transeuntes Luego visitamos Pifo conversamos floricultores cada paso damos sentimos respaldo gente Gracias carino,2019-03-03
Paola,Vintimilla,PaolaVintimilla,Esperamos 2deg Debate objetivo claro inicio Siempre daremos testimonio trabajo Paolita abrazo Amazonia recibido apoyan,2019-03-03
Paola,Vintimilla,PaolaVintimilla,competencia competencia haremos Quito ciudad segura Fortaleceremos agentes metropolitanos trabajaremos Ministerio Interior volveremos comunidad hora tomemos calles delincuentes,2019-03-03
Paola,Vintimilla,PaolaVintimilla,Fomentaremos competitividad sectores turisticos comerciales democratizaremos inversion capital semilla sera esencial nuevos emprendimientos procesos innovacion permitan vivir nueva productiva,2019-03-04
Paola,Vintimilla,PaolaVintimilla,Esras correcto ruido visual terrible Quito hace falta orden,2019-03-05
Paola,Vintimilla,PaolaVintimilla,digo falta orden Estan ordenanzas cumplen pueden existir vallas permiso municipal Insisto ruido visual Quito terrible,2019-03-05
Paola,Vintimilla,PaolaVintimilla,hablo falta orden Estan ordenanzas cumplen pueden existir vallas permiso municipal Insisto ruido visual Quito terrible,2019-03-05
Paola,Vintimilla,PaolaVintimilla,sentimos quitenos solo trata cambiar Alcalde sino cambiar forma gobernar,2019-03-05
Paola,Vintimilla,PaolaVintimilla,excelente miercoles Manana estare 07h40 invito escuchar entrevista,2019-03-06
Paola,Vintimilla,PaolaVintimilla,propuesta enfoca cambiar forma gobernar Ciudad Quito Aqui,2019-03-06
Paola,Vintimilla,PaolaVintimilla,necesitamos declarar emergencia primeros dias realizara auditoria gestion Municipio Quito Aqui,2019-03-06
Paola,Vintimilla,PaolaVintimilla,vamos quedarnos personas necesarias Municipio llevar partidarios mios peor familiares Aqui,2019-03-06
Paola,Vintimilla,PaolaVintimilla,creo encuestadoras fallado elecciones Aqui,2019-03-06
Paola,Vintimilla,PaolaVintimilla,administracion Metro debe concesionada transporte publico tarjeta inteligente Aqui,2019-03-06
Paola,Vintimilla,PaolaVintimilla,candidatos vemos,2019-03-07
Paola,Vintimilla,PaolaVintimilla,Queremos Quito horas noche tome vida turismo gastronomia ocupar parques activar cultura calles esten llenas delincuentes Queremos,2019-03-07
Paola,Vintimilla,PaolaVintimilla,Vamos paso firme marzo alcaldesa SERVIR PASION,2019-03-08
Paola,Vintimilla,PaolaVintimilla,recuerde lucha debe continuar conseguir sociedad justa equitativa,2019-03-08
Paola,Vintimilla,PaolaVintimilla,recuerde lucha debemos continuar conseguir sociedad justa equitativa,2019-03-08
Paola,Vintimilla,PaolaVintimilla,caminamos norte Quito junto Alcaldia cambiara forma gobernar capital compromiso invertir recursos obras necesitan familias quitenas,2019-03-09
Paola,Vintimilla,PaolaVintimilla,mocion apoyo SUMA negada votos morenismo abstenciones CREO,2019-03-09
Paola,Vintimilla,PaolaVintimilla,mocion apoyo SUMA negada votos morenismo abstenciones CREO,2019-03-09
Paola,Vintimilla,PaolaVintimilla,Calderon sigue confiando cambio Vamos transformar parroquias rurales olvidadas ultimos anos alcaldia Cambiaremos forma gobernar quitenos parroquianos beneficien obras servicios,2019-03-09
Paola,Vintimilla,PaolaVintimilla,Gracias Cotocollao confiar cambio viene momento mujer momento cambio forma gobernar hora Quito llegue Progreso Libertad,2019-03-10
Paola,Vintimilla,PaolaVintimilla,Ayer caravana cambio llego Guayabamba Quinche Tumbaco Cumbaya Impulsaremos turismo parroquias momento conozcan maravillas belleza natural rodea hermosa gente,2019-03-10
Paola,Vintimilla,PaolaVintimilla,Ayer caravana cambio llego Guayllabamba Quinche Tumbaco Cumbaya Impulsaremos turismo parroquias momento conozcan maravillas belleza natural rodea hermosa gente,2019-03-10
Paola,Vintimilla,PaolaVintimilla,Gracias carino equipo verdaderos planes cambio Junto norte Quito transformara,2019-03-10
Paola,Vintimilla,PaolaVintimilla,alcaldesa Quito necesita merece,2019-03-10
Paola,Vintimilla,PaolaVintimilla,imperativo cambio pertinente confiar vision administradora cometer error noverleria hizo Barrera Todas Votar entender capital carita Dios,2019-03-10
Paola,Vintimilla,PaolaVintimilla,Quito respalda cambio Jose Almeida Camila Pinzon concejalia volveremos seguro soluciones viales oportunidades,2019-03-10
Paola,Vintimilla,PaolaVintimilla,gran inicio semana lunes estare partir 07h00 diferentes medios comunicacion comparto detalles agenda,2019-03-11
Paola,Vintimilla,PaolaVintimilla,Ahora acompana conocer propuestas campana realiza analisis mucha gente sabe votaciones Siga transmision vivo,2019-03-11
Paola,Vintimilla,PaolaVintimilla,Gane pierda investigar contratos incluidos contratos hicieron regimen,2019-03-11
Paola,Vintimilla,PaolaVintimilla,candidata alcaldia menciona caso llegar propone trabajar ciudadania conocer problemas atraviesa ciudadania trafico calles baches solucionarlos,2019-03-11
Paola,Vintimilla,PaolaVintimilla,debe realizar analisis cuanta gente debe salir cuantas personas deben quedarse desperdiciar recursos destinar solucion problemas capital prioridad necesitan,2019-03-11
Paola,Vintimilla,PaolaVintimilla,Segun Union Taxis Pichincha cerca 20mil taxis ilegales circulando provincia Quito alcaldia vamos permitir aqui dejo muestra ocultan tener clientes Cero tolerancia ilegalidad,2019-03-11
Paola,Vintimilla,PaolaVintimilla,animales estan calle pertenecer policia metropolitana ocuparemos censar perritos viven Candidata Alcaldia Quito,2019-03-11
Paola,Vintimilla,PaolaVintimilla,perritos vemos calles dueno censaremos haremos cumplir ordenanza dejen solos calles,2019-03-11
Paola,Vintimilla,PaolaVintimilla,Amazonia cuenta beneficia region utilidades trabajadores supuestamente comunidades nunca reflejo obras responsable desarrollo cada ciudad provincia trabajadores,2019-03-11
Paola,Vintimilla,PaolaVintimilla,Rechazamos totalmente escrito diario aqui perjudicando nadie unicos perjudicados Trabajadores ustedes diario numero nivel Nacional deben informarse bien publicar nefasto estan haciendo desinformado,2019-03-11
Paola,Vintimilla,PaolaVintimilla,comparto agenda medios martes marzo Espero sintonia,2019-03-12
Paola,Vintimilla,PaolaVintimilla,Vamos cambiar ciudad unico modelo exitoso pais modelo,2019-03-12
Paola,Vintimilla,PaolaVintimilla,candidata Alcaldia,2019-03-12
Paola,Vintimilla,PaolaVintimilla,Quito Vivo queremos sera respaldado Policia Nacional proteger ciudadanos,2019-03-12
Paola,Vintimilla,PaolaVintimilla,tambien Quito alcaldia olvidaremos nadie cambiar,2019-03-13
Paola,Vintimilla,PaolaVintimilla,pocos minutos estare programa Dias Radio pueden escuchar entrevista,2019-03-13
Paola,Vintimilla,PaolaVintimilla,grato desayunos reunimos Concejo Camaras Asociaciones Pichincha Dimos conocer propuestas desarrollo ciudad traves Quito impulsara comercio turismo,2019-03-13
Paola,Vintimilla,PaolaVintimilla,grato desayuno reunimos Concejo Camaras Asociaciones Pichincha Dimos conocer propuestas desarrollo ciudad plan Quito impulsara comercio turismo,2019-03-13
Paola,Vintimilla,PaolaVintimilla,grato desayuno reunimos Consejo Camaras Asociaciones Pichincha Dimos conocer propuestas desarrollo ciudad plan Quito impulsara comercio turismo,2019-03-13
Paola,Vintimilla,PaolaVintimilla,candidata dijo principales problemas hara enfasis seguridad empleo movilidad basura Recalco pesima gestion gestion actual alcalde,2019-03-13
Paola,Vintimilla,PaolaVintimilla,Escuche debate candidatos alcaldia expusieron propuestas proximas basados ejes transportacion empleo seguridad,2019-03-13
Paola,Vintimilla,PaolaVintimilla,Ahora invito conectarse conversar Duende programa Travesuras Duende Espero disfruten divertida entrevista,2019-03-13
Paola,Vintimilla,PaolaVintimilla,Gooooooooooooooool liga,2019-03-14
Paola,Vintimilla,PaolaVintimilla,Excelente jueves comparto agenda medios,2019-03-14
Paola,Vintimilla,PaolaVintimilla,ayer gusto presidir recibir visita candidata alcaldia Quito,2019-03-14
Paola,Vintimilla,PaolaVintimilla,Compartiendo cabina chicas programa Trompas Falopio Sintoniza entrevista,2019-03-14
Paola,Vintimilla,PaolaVintimilla,Alcaldia trabajara forma espiral decir comenzando afuera hacia adentro barrios alejados cuentan servicios basicos hora trabajemos sectores olvidados vulnerables Quito,2019-03-14
Paola,Vintimilla,PaolaVintimilla,Quito referente innovacion progreso obras Ecuador capital convertido ciudad atrasada podemos permitir continue vamos cambiar sabemos hacerlo,2019-03-14
Paola,Vintimilla,PaolaVintimilla,Queremos turismo parte motor desarrollo ciudad familias puedan caminar disfrutar seguros noches Conmigo Alcaldia Quito anhelamos,2019-03-14
Paola,Vintimilla,PaolaVintimilla,Quiero Quito vivo horas generara empleo seguridad turismo Paola Vintimilla Alcaldesa Lista espacio promocionado,2019-03-15
Paola,Vintimilla,PaolaVintimilla,CARAVANA CAMBIO Gracias apoyo diferentes barrios Quito carino dias demostrado Trabajaremos puertas abiertas Alcaldesa Concejales,2019-03-15
Paola,Vintimilla,PaolaVintimilla,dudarlo Alcaldia jamas trabajaria familiares amigos,2019-03-15
Paola,Vintimilla,PaolaVintimilla,Llegamos presentarle jovenes propuestas tener Quito Vivo seguro limpio lleno arte,2019-03-15
Paola,Vintimilla,PaolaVintimilla,quitenos transporte publico necesitamos integre tarjeta inteligente logremos servicio eficiente,2019-03-15
Paola,Vintimilla,PaolaVintimilla,Vamos censar perritos ciudad colocaremos collar cedula dueno numero celular controlar tema,2019-03-15
Paola,Vintimilla,PaolaVintimilla,agentes metropolitanos control llevar body cams precautelar seguridad,2019-03-15
Paola,Vintimilla,PaolaVintimilla,recuperar confianza gente transitar Centro Quito,2019-03-15
Paola,Vintimilla,PaolaVintimilla,Vamos tener plataforma digital democracia directa ciudadanos podran conocer participar activamente decisiones toman Municipio bien ciudad,2019-03-15
Paola,Vintimilla,PaolaVintimilla,Gracias organizadores estudiantes permitirme compartir ideas transformar Quito espacios vitales democracia ciudadanos puedan realizar voto consciente,2019-03-15
Paola,Vintimilla,PaolaVintimilla,Seguimos conversando vecinos norte compartiendo mensaje cambio necesita Quito gente comprometida ciudad juntos vamos transformar,2019-03-16
Paola,Vintimilla,PaolaVintimilla,grupo hermoso recorremos Centro Historico Quito Vamos concejalia devolverle ciudad orgullo,2019-03-16
Paola,Vintimilla,PaolaVintimilla,vivo dando conocer plan trabajo Quito,2019-03-16
Paola,Vintimilla,PaolaVintimilla,Necesitamos reactivar turismo ciudad vamos apostar Quito nocturno plazas parques esten iluminadas teatros vuelvan abrir arte tome calles,2019-03-16
Paola,Vintimilla,PaolaVintimilla,Quiero Quito vivo horas generara empleo seguridad turismo Paola Vintimilla Alcaldesa Lista espacio promocionado,2019-03-16
Paola,Vintimilla,PaolaVintimilla,Quiero horas lograremos trabajamos juntos comunidad academia empresa privada,2019-03-17
Paola,Vintimilla,PaolaVintimilla,Recorrer Centro Historico hace sonar queremos arte quitenos tomen calles plazas parques sueno haremos realidad,2019-03-17
Paola,Vintimilla,PaolaVintimilla,buen chiste,2019-03-17
Paola,Vintimilla,PaolaVintimilla,marzo inicia nuevo amanecer Presidencia Junta Parroquial hare realidad Educacion Superior Cantonizacion Seguridad Ciudadana alcaldesa,2019-03-17
Paola,Vintimilla,PaolaVintimilla,surenos estan cambio Queremos solo sino Quito vuelva brillar Caminemos juntos Quito limpio seguro ordenado emprendedor vivo merecemos,2019-03-18
Paola,Vintimilla,PaolaVintimilla,Manana 08h00 estare Radio Vision Diego Oquendo invito sintonizar,2019-03-18
Paola,Vintimilla,PaolaVintimilla,Ahora vivo Radio Vision Puedes entrevista,2019-03-18
Paola,Vintimilla,PaolaVintimilla,impulsar desarrollo economico Quito trabajar verdaderos generadores empleo empresa privada reduciendo tecnificando tramitologia municipal rapido emprender crear plazas trabajo,2019-03-18
Paola,Vintimilla,PaolaVintimilla,trabajado ciudad anos persona transparente honesta pasado oscuro Quiero llegar Alcaldia servir servirme,2019-03-18
Paola,Vintimilla,PaolaVintimilla,Vamos cambio confio plenamente usted cambiar capital ecuatorianos Vamos terminar mucha confianza,2019-03-18
Paola,Vintimilla,PaolaVintimilla,Vamos incentivar visita nacionales extranjeros bellas parroquias Implementaremos proyecto Ruta Parroquias incentivar turismo religioso gastronomico ecoturismo agroturismo Quito,2019-03-19
Paola,Vintimilla,PaolaVintimilla,Comparto agenda miercoles marzo Espero gran,2019-03-20
Paola,Vintimilla,PaolaVintimilla,Comparto agenda miercoles marzo Espero gran,2019-03-20
Paola,Vintimilla,PaolaVintimilla,Vamos poner orden Municipio zonales minialcaldias administradas misma forma Municipio cuotas poder terminaron volveremos tener concejales grillete solo dedicaran legislar fiscalizar,2019-03-20
Paola,Vintimilla,PaolaVintimilla,Iniciamos Conversatorio Candidatos organizado,2019-03-20
Paola,Vintimilla,PaolaVintimilla,Necesitamos reactivar departamento permite coordinacion seguridad ciudadana Municipio ECU911 recepte rapidamente reportes Agentes Metropolitanos Control Policia actue forma eficaz,2019-03-20
Paola,Vintimilla,PaolaVintimilla,Paola Vintimilla promete Quito Vivo impulse turismo genere empleo,2019-03-20
Paola,Vintimilla,PaolaVintimilla,Quito Vivo queremos plazas parques esten llenos arte alegria familias amigos tomen calles disfrutando cultura patrimonio marzo votemos progreso Quito,2019-03-21
Paola,Vintimilla,PaolaVintimilla,Acompaname minutos,2019-03-21
Paola,Vintimilla,PaolaVintimilla,marzo nueva oportunidad Quitenos cambiar forma gestionar Alcaldia Aqui,2019-03-21
Paola,Vintimilla,PaolaVintimilla,Espero corazon concejales quiten bandera politica trabajen realmente ciudad Aqui,2019-03-21
Paola,Vintimilla,PaolaVintimilla,Gracias Quito cada paso dimos sentimos carino respeto ganas progresar gente Vamos defender Carita Dios vamos transformar comprometidos domingo empieza cambio,2019-03-22
Paola,Vintimilla,PaolaVintimilla,Palacio Municipal Quito quiero tener autoridad quiero tener amiga pueblo pueda saludar directamente dialogar persona Dios ilumine marzo cambiara historia Quito,2019-03-22
Paola,Vintimilla,PaolaVintimilla,Llego momento domingo debemos poner cambio Quito Alcadesa,2019-03-22
Paola,Vintimilla,PaolaVintimilla,Llego momento domingo debemos poner cambio Quito Alcadesa,2019-03-22
Paola,Vintimilla,PaolaVintimilla,Gracias apoyo confianza segura podemos cambiar modelo deja Quito prosperar marzo votemos,2019-03-22
Paola,Vintimilla,PaolaVintimilla,modesto criterio alla cualidades personas Quito necesita alguien rompa modelo perverso deja avanzar,2019-03-23
Paola,Vintimilla,PaolaVintimilla,falta planificacion ciudad permitido barrios enteros construyan zonas alto riesgo solidaridad familias esperamos autoridades apoyo inmediato Pinar Alto,2019-03-23
Paola,Vintimilla,PaolaVintimilla,Gracias apoyo confianza segura podemos cambiar modelo deja Quito prosperar marzo votemos,2019-03-23
Paola,Vintimilla,PaolaVintimilla,Manana oportunidad construir nuevo Quito Quito lleno oportunidades Agradezco Dios vida oportunidad puso camino,2019-03-23
Paola,Vintimilla,PaolaVintimilla,modesto criterio alla cualidades personas Quito necesita alguien rompa modelo perverso deja avanzar,2019-03-24
Paola,Vintimilla,PaolaVintimilla,Colegio Pablo Munoz Vega existen varias anomalias mesa hombres solo estan entregando papeletas respectivas actas cada junta delegados movimientos partidos politicos,2019-03-24
Paola,Vintimilla,PaolaVintimilla,abrazo Juan Carlos gusto conocerte tambien,2019-03-24
Paola,Vintimilla,PaolaVintimilla,unico ganador debe Quito quitenos merecemos ciudad brillar Gracias respaldaron camino vamos defraudar cuenten conmigo transformar capital GRACIAS,2019-03-24
Paola,Vintimilla,PaolaVintimilla,Felicidades querida duda Guayaquil queda mejores manos progreso continua,2019-03-25
Paola,Vintimilla,PaolaVintimilla,Jamas trabajado TVentas pena desinformacion,2019-03-25
Paola,Vintimilla,PaolaVintimilla,Gracias,2019-03-25
Paola,Vintimilla,PaolaVintimilla,limpiando tiempo cumpliremos,2019-03-30
Paola,Vintimilla,PaolaVintimilla,propuestas ojala acoja perritos estan calle dueno esten casas contrario deberia aplicarse ordenanza tenencia responsable,2019-03-30
Paola,Vintimilla,PaolaVintimilla,entiendo interesa educacion contesto reinita trabajado anos empresa privada buscare trabajo pais Saludos disfruta vida,2019-03-30
Paola,Vintimilla,PaolaVintimilla,renunciar,2019-03-30
Paola,Vintimilla,PaolaVintimilla,haciendo cumpliremos tiempos,2019-04-02
Paola,Vintimilla,PaolaVintimilla,haciendo cumpliremos tiempos,2019-04-02
Paola,Vintimilla,PaolaVintimilla,,2019-04-02
Paola,Vintimilla,PaolaVintimilla,Pienso igual abrazo,2019-04-02
Paola,Vintimilla,PaolaVintimilla,,2019-04-02
Paola,Vintimilla,PaolaVintimilla,limpiando cumpliremos tiempo,2019-04-02
Paola,Vintimilla,PaolaVintimilla,limpiando cumpliremos tiempo,2019-04-02
