nombre,apellidos,tweet_screen_name,tweet_text,tweet_date
Cynthia,Viteri,CynthiaViteri6,profunda tristeza fallecimiento querido amigo Julio Juan Romero grandes radiodifusion pais solidaridad familia amigos,2019-04-28
Cynthia,Viteri,CynthiaViteri6,profunda tristeza fallecimiento Julio Juan Romero querido amigo excelente profesional gran radiodifusor pais nota pesar digna familia amigos colaboradores prestigiosa Radio Cristal,2019-04-28
Cynthia,Viteri,CynthiaViteri6,profunda tristeza fallecimiento Julio Juan Romero querido amigo excelente profesional gran radiodifusor pais nota pesar digna familia amigos colaboradores prestigiosa Radio Cristal,2019-04-28
Cynthia,Viteri,CynthiaViteri6,corazon Municipio seguira siendo trabajo incesante bienestar guayaquilenos viene etapa salud Seguiremos atendiendo necesidades eficiencia siempre nuevas tecnologias innovacion,2019-05-02
Cynthia,Viteri,CynthiaViteri6,Gracias gestion voto casa obtuvimos datos varios ciudadanos empezamos atender domicilios pueden centros salud Vamos seguir enviando medicos cada hogar Continuamos cumpliendo necesidades guayaquilenos,2019-05-04
Cynthia,Viteri,CynthiaViteri6,trabajando ampliar progreso ciudad alegria optimismo siempre caracterizado vienen suenos bienestar,2019-05-08
Cynthia,Viteri,CynthiaViteri6,anos entrega progreso ciudad homenaje obra labor grito,2019-05-09
Cynthia,Viteri,CynthiaViteri6,siguen cumpliendo suenos guayaquilenos entregamos titulos propiedad 1307 familias Lote familias Monte Sinai camino seguiremos avanzando,2019-05-11
Cynthia,Viteri,CynthiaViteri6,siguen cumpliendo suenos guayaquilenos entregamos titulos propiedad 1307 familias Lote familias Monte Sinai camino seguiremos avanzando,2019-05-11
Cynthia,Viteri,CynthiaViteri6,carta escribi madre hace anos ahora cada linea madre alma reflejado valor sacarme adelante vivias peor momento Gracias Dios lado traves Feliz madres,2019-05-12
Cynthia,Viteri,CynthiaViteri6,Sesion simbolica Municipio Guayaquil agradeceremos Alcalde labor daremos bienvenida nuevo periodo misma causa,2019-05-14
Cynthia,Viteri,CynthiaViteri6,Gracias Alcalde anos batio Guayaquil calle Salon Contamos usted momento cuente siempre,2019-05-14
Cynthia,Viteri,CynthiaViteri6,Municipio vanguardista toma desafio utilizar tecnologia beneficiar guayaquilenos Juntos vamos llevar ciudad lider tecnologia,2019-05-14
Cynthia,Viteri,CynthiaViteri6,votaron casa tendran visita medicos permanentemente Iremos buscarlos dejarles salud bienestar dignidad,2019-05-14
Cynthia,Viteri,CynthiaViteri6,primer Centro Bienestar Animal contara tambien Canoterapia ninos algun tipo discapacidad fisica puedan potenciar terapias,2019-05-14
Cynthia,Viteri,CynthiaViteri6,Seguiremos pintando ciudad verde jardines verticales arboles nativos edificios jardines terrazas agricultura urbana Guayaquil suena grande,2019-05-14
Cynthia,Viteri,CynthiaViteri6,Instituto Artes Oficios carreras Gastronomia Mecanica Belleza tambien Enfermeria,2019-05-14
Cynthia,Viteri,CynthiaViteri6,atendimos ninos jovenes mujeres embarazados Programa piloto Ahora haremos Alcaldia Centros Desintoxicacion gratuitos caen chicos levantaremos caen levantaremos,2019-05-14
Cynthia,Viteri,CynthiaViteri6,Pondre alma servicio ciudad ello pido Dios sabiduria humildad bondad falte fuerzas voluntad elegir siempre elija debiles Viva Guayaquil,2019-05-14
Cynthia,Viteri,CynthiaViteri6,atendimos ninos jovenes mujeres embarazadas Programa piloto Ahora haremos Alcaldia Centros Desintoxicacion gratuitos caen chicos levantaremos caen levantaremos,2019-05-14
Cynthia,Viteri,CynthiaViteri6,Pondre alma servicio ciudad ello pido Dios sabiduria humildad bondad falte fuerzas voluntad elegir siempre elija debiles Viva Guayaquil,2019-05-14
Cynthia,Viteri,CynthiaViteri6,consciente desafio corresponde asumir progreso creciente Guayaquil cuento ustedes juntos camino guayaquileno solo necesitas poner alma corazon ciudad,2019-05-14
Cynthia,Viteri,CynthiaViteri6,seguridad competencia local retomaremos plan Seguridad poniendo camaras reconocimiento facial colegios transporte publico tambien tendra camaras botones panico,2019-05-15
Cynthia,Viteri,CynthiaViteri6,empieza nueva nuevo Concejo Municipal constituido perIodo 2019 2023 trabajaremos juntos ninguna bandera politica colores celeste blanco Guayaquil concejales velaran bienestar cada guayaquileno,2019-05-15
Cynthia,Viteri,CynthiaViteri6,Empezamos avances positivos inscribiendo Guayaquil Club Grandes Servicios Agua Mundo pertenecen grandes ciudades Realizaremos intercambio experiencias ayudaran mejorar calidad agua evitar fugas llegar toda ciudad,2019-05-16
Cynthia,Viteri,CynthiaViteri6,visita Puna encontre adolescente anos cuida hija clases mujer puede cosas siguen cambiando quieres hijos convierten motor jamas ancla,2019-05-17
Cynthia,Viteri,CynthiaViteri6,parroquias rurales seran parte progreso Guayaquil llegamos Isla Puna entregar tablets panaleras laboratorios computacion Puna tendra Hospital lancha ambulancia atender salud,2019-05-18
