nombre,apellidos,tweet_screen_name,tweet_text,tweet_date
Cynthia,Viteri,CynthiaViteri6,Buenos dias guayaquilenos vivo entrevista Vamos engrandecer ciudad,2019-02-19
Cynthia,Viteri,CynthiaViteri6,siempre vamos alla competencias demostrado seguiremos haciendo respecta educacion seguridad salud bienestar familias guayaquilenas,2019-02-19
Cynthia,Viteri,CynthiaViteri6,nueva Aerovia buses electricos puentes Samborondon Daule bicicletas publicas vamos seguir dando mayor facilidades conductores pasajeros lleguen tiempo destinos sonar grande,2019-02-19
Cynthia,Viteri,CynthiaViteri6,perfectamente sienten madres envian hijos escuelas implementaremos camaras seguridad afuera colegios escuelas alejar vendedores drogas hijos,2019-02-19
Cynthia,Viteri,CynthiaViteri6,Jovenes Cantera acompanaron candidata gran caravana junto candidatos futuro Prefecto Seguimos campana,2019-02-19
Cynthia,Viteri,CynthiaViteri6,Sergio Toral progreso Guayaquil Gracias calido recibimiento demuestra seguiremos cumpliendo suenos juntos manos estaran grandes obras ustedes,2019-02-20
Cynthia,Viteri,CynthiaViteri6,Buenos dias Guayaquil Conoce viene ciudad escuchandome vivo sintonizando espero,2019-02-20
Cynthia,Viteri,CynthiaViteri6,iremos Flor Bastion primer centro rehabilitacion gratuito tratamiento adicciones estaran ubicados Chongon Salitral Guasmo recupera futuro esperanza jovenes,2019-02-20
Cynthia,Viteri,CynthiaViteri6,plan Seguridad camaras reconocimiento facial analisis caminar embargo ninguna accion funcionara Asamblea hace hacer derogar leyes prodelincuenciales eliminar tabla consumo drogas,2019-02-20
Cynthia,Viteri,CynthiaViteri6,misma oficina podran juntas entidades intervienen permisos construccion funcionamiento manera solicitud podra gestionarse solo lugar,2019-02-20
Cynthia,Viteri,CynthiaViteri6,estare respondiendo inquietudes jovenes guayaquilenos debate ciudadano invito participar encuentro 00pm Facebook Live,2019-02-20
Cynthia,Viteri,CynthiaViteri6,centro tratamiento personas adicciones Flor Bastion grandes suenos cristalizando centros Guayaquil prometemos comprometemos,2019-02-20
Cynthia,Viteri,CynthiaViteri6,vivo debatir jovenes guayaquilenos ideas esfuerzo perseverancia haran Guayaquil ciudad admirable Siguenos Facebook live,2019-02-21
Cynthia,Viteri,CynthiaViteri6,Acuario Virtual vamos implementar consiste tunel podran vida marina cualquier parte mundo proteccion medio ambiente fundamental,2019-02-21
Cynthia,Viteri,CynthiaViteri6,Gracias Kevin pregunta encontrar empleo preocupaciones jovenes Distrito sera espacio innovacion emprendimiento impulsara ideas seguire fortaleciendo acciones permitan emprender,2019-02-21
Cynthia,Viteri,CynthiaViteri6,Maria Belen pequena papa enseno amar animales siempre animales abandonados rescato Ahora perros gatos dejado padre perros Alcaldesa implementare Centro Bienestar Animal,2019-02-21
Cynthia,Viteri,CynthiaViteri6,Cada accion traera empleo crearemos incentivos convertir Guayaquil entorno atractivo filmacion peliculas internacionales Gracias Alberto idea,2019-02-21
Cynthia,Viteri,CynthiaViteri6,Joan viene segunda fase Guayarte seguiremos impulsando tipo proyectos generan empleo turismo inversion,2019-02-21
Cynthia,Viteri,CynthiaViteri6,Vamos incentivar fortalecer proyectos deportivos medios vencer drogas Recuperaremos futuro jovenes,2019-02-21
Cynthia,Viteri,CynthiaViteri6,Gracias compartir experiencia Impulsaremos emprendimiento jovenes Guayaquil siga siendo ciudad ejemplar,2019-02-21
Cynthia,Viteri,CynthiaViteri6,Muchas gracias queridos jovenes Alcaldesa escuchare siempre impulsaremos ideas engrandecer Guayaquil,2019-02-21
Cynthia,Viteri,CynthiaViteri6,Ustedes hicieron mejor debate Guayaquil Gracias compartir conmigo suenos,2019-02-21
Cynthia,Viteri,CynthiaViteri6,ayer debatio tenia hacerlo jovenes presente futuro ciudad ideas claras propuestas exitosas camino trazado hacia progreso bienestar Guayaquilenos,2019-02-21
Cynthia,Viteri,CynthiaViteri6,Guayaquil seguira camino progreso bienestar cada familia corazon estara dedicado social manos trabajaran grandes obras Juntos hacemos futuro,2019-02-21
Cynthia,Viteri,CynthiaViteri6,Gracias Pascuales compartir conmigo hermosa manana jueves alegria carino fortalecen nuevos suenos lideraran futuro Guayaquil desarrollo progreso bienestar innovacion,2019-02-21
Cynthia,Viteri,CynthiaViteri6,Ayer conversamos jovenes guayaquilenos nuevas obras vienen Guayaquil hicimos tambien Pascuales reafirmaron respaldo incondicional equipo gran caravana progreso Gracias carino,2019-02-22
Cynthia,Viteri,CynthiaViteri6,Juntos hacemos futuro Guayaquil ciudad Pascuales apoya gran equipo concejales representamos Distrito Gracias confiar,2019-02-22
Cynthia,Viteri,CynthiaViteri6,Manana sabado febrero espero Brigada Desintoxicacion Atencion Medica Gratuita Llevaremos bienestar todas familias cada rincon ciudad juntos haremos futuro,2019-02-22
Cynthia,Viteri,CynthiaViteri6,Terminamos semana recibiendo respaldo incondicional Guayacanes compromiso seguir trabajando grandes obras llevar bienestar cada ustedes Juntos lograremos,2019-02-23
Cynthia,Viteri,CynthiaViteri6,manana tambien Progreso Posorja Ustedes parte progreso Guayaquil llegaremos grandes obras impulsaran turismo traeran empleo Juntos lograremos,2019-02-24
Cynthia,Viteri,CynthiaViteri6,Gracias Febres Cordero gran caravana demuestra Guayaquil seguira camino progreso Vamos llevar empleo seguridad rescatar jovenes drogas,2019-02-24
Cynthia,Viteri,CynthiaViteri6,semana reafirmamos compromiso seguir cumpliendo suenos Guayaquil Ustedes parte progreso gran ciudad,2019-02-24
Cynthia,Viteri,CynthiaViteri6,Manana arrancamos semana agenda medios pierdan entrevistas conocer nuevos suenos cumpliremos Guayaquil espero,2019-02-25
Cynthia,Viteri,CynthiaViteri6,Excelente inicio semana guayaquilenos Empezamos lunes conversando nuevas obras seguiran llenando progreso bienestar cada rincon Guayaquil,2019-02-25
Cynthia,Viteri,CynthiaViteri6,semana brigada desintoxicacion jovenes consumen drogas atendimos ademas ecografias rayos medicina general odontologia alrededor personas feria salud,2019-02-25
Cynthia,Viteri,CynthiaViteri6,Pondremos camaras reconocimiento facial analisis caminar escuelas colegios vendedores droga sepan estan siendo vigilados CSCG Policia Nacional camaras estaran ordenes fuerza publica,2019-02-25
Cynthia,Viteri,CynthiaViteri6,emocionante hablar nuevos suenos vienen Guayaquil Conocelos escuchando entrevista,2019-02-25
Cynthia,Viteri,CynthiaViteri6,sabado llovio fuerte Guayaquil plena lluvia gente salia casas negocios demostrarnos respaldo siguen dispuestos darlo crecimiento ciudad,2019-02-25
Cynthia,Viteri,CynthiaViteri6,seguimos hablando futuro Guayaquil Escuchame sintonizando 1050AM conoce seguiremos creciendo,2019-02-25
Cynthia,Viteri,CynthiaViteri6,momento Guayaquil cuenta escuelas deportivas municipales ademas entregan uniformes gratuitos Junto candidato Distrito fortaleceremos programas deportivos guayaquilenos,2019-02-25
Cynthia,Viteri,CynthiaViteri6,Guayaquil crecera equipo progreso Gracias Guasmo respaldo compromiso seguir camino suenos cumplidos,2019-02-26
Cynthia,Viteri,CynthiaViteri6,exito Guasmo,2019-02-26
Cynthia,Viteri,CynthiaViteri6,propuestas Juntos decidimos futuro Guayaquil,2019-02-26
Cynthia,Viteri,CynthiaViteri6,vivo entrevista ciudad jamas detiene seguiremos implementando nuevas obras pierdas,2019-02-26
Cynthia,Viteri,CynthiaViteri6,entregando titulos propiedad Monte Sinai Socio Vivienda Alcaldesa completare falta obras servicios,2019-02-26
Cynthia,Viteri,CynthiaViteri6,sitios construir rehabilitar potencias Mercados vendedores comerciantes autonomos podran trabajar manera ordenada comprometemos,2019-02-26
Cynthia,Viteri,CynthiaViteri6,sitios construir rehabilitar potenciar Mercados vendedores comerciantes autonomos podran trabajar manera ordenada comprometemos,2019-02-26
Cynthia,Viteri,CynthiaViteri6,jovenes Mesa Trabajo Guayaquil suenas llevamos ideas jovenes ciudad quieren ideas hara queremos,2019-02-26
Cynthia,Viteri,CynthiaViteri6,ninos recibieron uniformes seguir practicando deporte mantendremos ampliaremos cada accion impulse destrezas ninos jovenes Juntos hacemos futuro,2019-02-26
Cynthia,Viteri,CynthiaViteri6,Seguimos compartiendo suenos vamos cumplir Guayaquil partir mayo Sintoniza,2019-02-28
Cynthia,Viteri,CynthiaViteri6,Vamos seguir llegando bienestar cada rincon Guayaquil Registrate plan habitacional vivienda futuro aqui,2019-02-27
Cynthia,Viteri,CynthiaViteri6,Buen miercoles Guayaquil conversando nuevas obras seguiran llenando progreso bienestar cada familia guayaquilena,2019-02-27
Cynthia,Viteri,CynthiaViteri6,gente siempre quiere administracion municipal devuelva obras pagan traves impuestos modelo invierte ingresos grandes obras seguiremos haciendolo,2019-02-27
Cynthia,Viteri,CynthiaViteri6,37mil vendedores sido formalizados nuevos vendedores ampliaremos haremos nuevos mercados Posorja Mercado Mariscos Pescados muelle mercado minoristas Ademas contaran creditos Banca Oportunidades,2019-02-27
Cynthia,Viteri,CynthiaViteri6,buses urbanos cuentan tendran boton panico alertara Policia Nacional CSCG Ademas camaras reconocimiento facial analisis caminar cuales estaran ubicadas tambien colegios,2019-02-27
Cynthia,Viteri,CynthiaViteri6,Guayaquil seguira creciendo forma ordenada planificacion estrategica planes vivienda implementaremos partir mayo Juntos haremos posible,2019-02-28
Cynthia,Viteri,CynthiaViteri6,Crear empleo fortalecer seguridad rescatar jovenes drogas principales compromisos ustedes guayaquilenos Distrito Juntos seguiremos camino progreso bienestar Guayaquil,2019-02-28
Cynthia,Viteri,CynthiaViteri6,nuevo Plan Seguridad incluye colocacion camaras reconocimiento facial escuelas colegios alejar vendedores drogas hijos,2019-02-28
Cynthia,Viteri,CynthiaViteri6,Guayaquil Ciudad Digital ahora convertiremos Ciudad Inteligente primera Ecuador guayaquilenos Alcaldia estaran cerca,2019-02-28
Cynthia,Viteri,CynthiaViteri6,compartimos grata entrevista programa Medio conversamos fortalecimiento programa Amiga sola partir mayo Guayaquil sera ejemplo lucha violencia genero,2019-02-28
Cynthia,Viteri,CynthiaViteri6,visite laboratorios innovacion contamos ciudad Alcaldesa mantendre ampliare acceso tecnologias innovacion creatividad ninos jovenes lograremos progreso Guayaquil,2019-02-28
Cynthia,Viteri,CynthiaViteri6,visito candidata LabIN Ariana Leonor Mayra explicaron proyecto Lideres buscan soluciones creativas problemas construye cuidad pais,2019-02-28
Cynthia,Viteri,CynthiaViteri6,espero Conversatorio mujeres guayaquilenas aporte vital progreso Guayaquil Siguelo Facebook Live,2019-02-28
Cynthia,Viteri,CynthiaViteri6,Guayaquil cuenta ahora Centros Geriatricos primera Vamos tener tambien implementaremos Centro Rehabilitacion Fisica ancianos Sera primero equipos tecnologicos punta,2019-03-01
Cynthia,Viteri,CynthiaViteri6,combatir violencia intrafamiliar contamos programa Amiga sola puedes llamar 1800 puedes recibir apoyo Vamos seguir fortaleciendo acciones defender mujeres,2019-03-01
Cynthia,Viteri,CynthiaViteri6,cada accion municipal vamos generar empleo Guayaquil crecera esfuerzo,2019-03-01
Cynthia,Viteri,CynthiaViteri6,podemos victimas complices pasando hijos formando esposo mujer construir mejor sociedad familia,2019-03-01
Cynthia,Viteri,CynthiaViteri6,Escuela Padres sera parte programa prevencion hogar podamos promover ciudad Juntas haremos posible,2019-03-01
Cynthia,Viteri,CynthiaViteri6,empezar escucharnos mismas queremos avanzar mujeres ninos estaran desprotegidos,2019-03-01
Cynthia,Viteri,CynthiaViteri6,aplauso todas madres lucha ganado hijos rescatado drogas Cuenten conmigo pelear junto ustedes,2019-03-01
Cynthia,Viteri,CynthiaViteri6,escuchare siempre vamos juntas construir ciudad respeto valor fundamental familia,2019-03-01
Cynthia,Viteri,CynthiaViteri6,Gracias respaldo incondicional,2019-03-01
Cynthia,Viteri,CynthiaViteri6,Siempre escuchar ideas preocupaciones Mujeres ustedes parte importante progreso Guayaquil vamos protegerlas defenderlas impulsarlas Gracias respaldo,2019-03-01
Cynthia,Viteri,CynthiaViteri6,Llego viernes empezamos conversando nuevos suenos juntos cumpliremos Guayaquil Escuchame sintonizando,2019-03-01
Cynthia,Viteri,CynthiaViteri6,Ayer debate mujeres guayaquilenas escucharon propuestas tambien planteamientos hora vivo cortes respondiendo preguntas guayaquilenas semana anterior hicimos jovenes,2019-03-01
Cynthia,Viteri,CynthiaViteri6,Hace presentamos roben maten violen secuestren salgan carcel medidas alternativas COIP debe revisado Junto bloque seguiremos impulsando derogacion leyes prodelincuenciales,2019-03-01
Cynthia,Viteri,CynthiaViteri6,empezaron colocar botones panico buses activarlos patrulleros Policia Nacional podran rodear cuentan senal alerta llega centro control Policia Nacional CSCG,2019-03-01
Cynthia,Viteri,CynthiaViteri6,Seguimos jornada medios Conoce nuevas obras seguiran engrandeciendo ciudad Escuchame sintonizando pierdas entrevista,2019-03-01
Cynthia,Viteri,CynthiaViteri6,Mientras deba debate candidatos alcaldes debatiendo guayaquilenas Escuchamos mujeres discapacidad jovenes proyectos madres chicos consumen droga mujeres desempleadas profesionales tema violencia,2019-03-01
Cynthia,Viteri,CynthiaViteri6,Mientras daba debate candidatos Alcaldes debatiendo guayaquilenas Escuchamos mujeres discapacidad jovenes proyectos madres chicos consumen droga mujeres desempleadas profesionales temas violencia,2019-03-01
Cynthia,Viteri,CynthiaViteri6,Lomas Florida Socio Vivienda respaldo Guayaquil siga progresando equipo seguira convirtiendo ciudad ejemplo prosperidad desarrollo,2019-03-02
Cynthia,Viteri,CynthiaViteri6,Repotenciaremos centros atencion medica gracias Telemedicina vamos implementar partir mayo Llegaremos salud cada rincon Guayaquil,2019-03-02
Cynthia,Viteri,CynthiaViteri6,nunca debemos cuidar ciudad trabajo costado levantar Juntos seguiremos camino progreso Guayaquil,2019-03-02
Cynthia,Viteri,CynthiaViteri6,desarrollo Guayaquil construye educacion contaremos instituto carreras cortas capacitara jovenes carreras futuro seguiremos creciendo,2019-03-03
Cynthia,Viteri,CynthiaViteri6,Cada semana pasa acerca juntos construiremos Gracias respaldo,2019-03-04
Cynthia,Viteri,CynthiaViteri6,Fortaleceremos seguridad escuelas colegios camaras reconocimiento facial analisis caminar tecnologia eficiencia coordinacion protegeremos hijos,2019-03-04
Cynthia,Viteri,CynthiaViteri6,Ustedes razon Guayaquil sigue Continuare defendiendo cada sueno juntos lograremos ciudad progreso bienestar,2019-03-05
Cynthia,Viteri,CynthiaViteri6,Vamos proteger mujeres ninos violencia Guayaquil Ampliaremos fortaleceremos Programa Amiga sola,2019-03-06
Cynthia,Viteri,CynthiaViteri6,Seguimos conversando acerca Escuchame sintonizando 870AM,2019-03-06
Cynthia,Viteri,CynthiaViteri6,vive Venezuela tragedia humanitaria real nuevo Presidente reconocido varios paises recorrido distintas naciones encontrar fuerza permita recuperar economia bienestar tierra siempre prospera,2019-03-06
Cynthia,Viteri,CynthiaViteri6,ubicados sitios centros rehabilitacion gratuitos construiremos estara Guasmo Salitral Chongon Flor Bastion Juntos escudo protegera futuro,2019-03-06
Cynthia,Viteri,CynthiaViteri6,ubicados sitios centros rehabilitacion gratuitos construiremos estara Guasmo Salitral Chongon Flor Bastion Juntos escudo protegera futuro,2019-03-06
Cynthia,Viteri,CynthiaViteri6,hablo seguridad tecnologia implementaremos reconocer rostro movimientos delincuente Cada propuesta planificada guayaquilenos confian saben hablamos hacemos,2019-03-06
Cynthia,Viteri,CynthiaViteri6,Iniciamos tarde conversando nuevas obras vienen Guayaquil pierdas entrevista escuchame sintonizando,2019-03-06
Cynthia,Viteri,CynthiaViteri6,temor sienten madres dejan hijos escuelas puedan vender droga salir colocare camaras reconocimiento facial analisis caminar establecimientos Juntas protegeremos hijos,2019-03-06
Cynthia,Viteri,CynthiaViteri6,visito candidata Alcaldia Guayaquil Lista,2019-03-06
Cynthia,Viteri,CynthiaViteri6,visito candidata Alcaldia Guayaquil Lista,2019-03-06
Cynthia,Viteri,CynthiaViteri6,Hablar nuevos suenos juntos cumpliremos llena felicidad entusiasmo viene,2019-03-07
Cynthia,Viteri,CynthiaViteri6,Ejercito Gomez Rendon escuche cada necesidad sueno Ustedes razon Guayaquil sigue Continuare defendiendo cada sueno juntos lograremos ciudad progreso bienestar,2019-03-07
Cynthia,Viteri,CynthiaViteri6,Buenos dias Comenzamos agenda medios entrevista pierdas,2019-03-07
Cynthia,Viteri,CynthiaViteri6,Guayaquil progresado gracias eficiente administracion alianzas publico privadas hacer grandes obras beneficio todas familias,2019-03-07
Cynthia,Viteri,CynthiaViteri6,mamas hijos problemas aprendizaje podran llegar Centro atendidos manera adecuada competencia vamos seguir abrazando hijos Guayaquil,2019-03-07
Cynthia,Viteri,CynthiaViteri6,Seguimos conversando suenos vienen Guayaquil Sintoniza,2019-03-07
Cynthia,Viteri,CynthiaViteri6,Guayaquil seguira mejorando fluidez transito soluciones viales Aerovia renovacion buses buses electricos puentes,2019-03-07
Cynthia,Viteri,CynthiaViteri6,Programa Municipal Amiga sola protegemos mujeres sufren violencia intrafamiliar ayuda inmediata asesoria legal refugio alianza fundacion Hogar Cristo,2019-03-07
Cynthia,Viteri,CynthiaViteri6,vivo pierdas entrevista conocer nuevas obras implementaremos Guayaquil espero,2019-03-07
Cynthia,Viteri,CynthiaViteri6,planificados Centros Rehabilitacion Drogas Todas madres Flor Bastion Salitral Chongon Guasmo recuperaran futuro hijos atencion reinsercion estudiando construccion quinto Centro,2019-03-07
Cynthia,Viteri,CynthiaViteri6,compromiso familias Puna,2019-03-07
Cynthia,Viteri,CynthiaViteri6,propuestas estan enfocadas generar empleo Guayaquil crecera Costa inversion oportunidades emprendimiento soluciones habitacionales mayor movilidad sonar grande,2019-03-07
Cynthia,Viteri,CynthiaViteri6,Continuamos conversando pierdas entrevista sintonizando,2019-03-07
Cynthia,Viteri,CynthiaViteri6,mujeres sufren violencia intrafamiliar estaran cada protegidas,2019-03-07
Cynthia,Viteri,CynthiaViteri6,implementando plan piloto agentes municipales moto aprehender delincuentes Vamos aplicar nuevo Plan Seguridad firmeza Ningun acto violencia quedara impune,2019-03-07
Cynthia,Viteri,CynthiaViteri6,pequena alegrado corazon rescatar animalitos calle sigo haciendo ahora mayor alegrias Alcaldesa trabajare tambien construyendo Centro Bienestar Animal Guayaquil,2019-03-07
Cynthia,Viteri,CynthiaViteri6,alegria regalo Distrito solo puede significar cosa cerca grandes suenos seguiran engrandeciendo futuro ciudad,2019-03-08
Cynthia,Viteri,CynthiaViteri6,Terminamos semana conversando Guayaquil amamos Escuchame sintonizando conoce seguiremos creciendo juntos,2019-03-08
Cynthia,Viteri,CynthiaViteri6,atendido alrededor 1400 llamadas auxilio traves programa Amiga sola alli orienta victimas materia legal asisten tratamientos psicologicos reunificar familia otorgan refugios Hogar Cristo,2019-03-08
Cynthia,Viteri,CynthiaViteri6,Costa pasos peatonales inclusivos ascensores ampliaran carriles Bombero contaremos paso desnivel Delta tambien tendra camaras conectadas Ecu911 parte plan movilidad,2019-03-08
Cynthia,Viteri,CynthiaViteri6,Seguimos conversando futuro Guayaquil Escuchame conoce nuevas obras fortaleceran camino progreso,2019-03-08
Cynthia,Viteri,CynthiaViteri6,proposito guayaquilenas produzcan CAMIs expuesto centros comerciales vendan productos Haremos mismo geriatricos ademas otorgara creditos emprendimientos,2019-03-08
Cynthia,Viteri,CynthiaViteri6,Aqui leyes hechas proteger delincuente Debemos exigir Asamblea cumpla deber debe reformar COIP delincuentes salgan carcel medidas alternativas deroguen tabla consumo drogas,2019-03-08
Cynthia,Viteri,CynthiaViteri6,mujeres enfrentamos cada desafios impulsan fuertes valientes Seguiremos luchando junto violencia igualdad oportunidades,2019-03-08
Cynthia,Viteri,CynthiaViteri6,administracion ampliaremos sueno tener casa propia Lote Lotes servicios plan vivienda popular seran realidad experiencia Ingresa comienza hacer realidad sueno,2019-03-09
Cynthia,Viteri,CynthiaViteri6,administracion ampliaremos sueno tener casa propia Lote Lotes servicios plan vivienda popular seran realidad experiencia Ingresa comienza hacer realidad sueno,2019-03-09
Cynthia,Viteri,CynthiaViteri6,administracion ampliaremos sueno tener casa propia Lote Lotes servicios plan vivienda popular seran realidad experiencia Ingresa comienza hacer realidad sueno,2019-03-09
Cynthia,Viteri,CynthiaViteri6,grito ayer escucho cada rincon Guayaquil Distrito ciudad nadie aqui seguiremos sonando grande,2019-03-10
Cynthia,Viteri,CynthiaViteri6,grito ayer escucho cada rincon Guayaquil Distrito ciudad nadie aqui seguiremos sonando grande,2019-03-10
Cynthia,Viteri,CynthiaViteri6,grito ayer escucho cada rincon Guayaquil Distrito ciudad nadie aqui seguiremos sonando grande,2019-03-10
Cynthia,Viteri,CynthiaViteri6,Gracias Guayaquil demostrar juntos mejor equipo Vamos semana llena alegria respaldo,2019-03-11
Cynthia,Viteri,CynthiaViteri6,Buenos dias guayaquilenos lunes empieza conversando futuro progreso seguiremos ampliando Escuchame vivo,2019-03-11
Cynthia,Viteri,CynthiaViteri6,digo hare centros rehabilitacion ubicaran Guasmo Salitral Flor Bastion Chongon tambien financiamiento cantidad personas seran atendidas propongo estudiado,2019-03-11
Cynthia,Viteri,CynthiaViteri6,Puna haremos nuevo mercado construiremos tambien Hospital atencion Posorja muelle centro acopio mercado minoristas mariscos pescados parroquias rurales tambien seguiran creciendo,2019-03-11
Cynthia,Viteri,CynthiaViteri6,Seguimos jornada medios lunes Escuchame sintonizando 870AM conoce nuevos suenos seguiran engrandeciendo Guayaquil,2019-03-11
Cynthia,Viteri,CynthiaViteri6,Ahora vamos nueva etapa educacion tecnologia Distrito primer centro abierto innovacion tambien instituto tecnologico carreras futuro instituto tecnologico unira centros artes oficios,2019-03-11
Cynthia,Viteri,CynthiaViteri6,iniciativa personal logrado atender 2000 personas drogas hijos hijos hijos Guayaquil seguiran siendo atendidos mejor manera Juntos cambiaremos cadenas brazos madres,2019-03-11
Cynthia,Viteri,CynthiaViteri6,Ahora vamos nueva etapa educacion tecnologia Distrito primer centro abierto innovacion tambien instituto tecnologico carreras futuro instituto tecnico unira centros artes oficios,2019-03-11
Cynthia,Viteri,CynthiaViteri6,sabado parque acuatico multiproposito Fortin sera Brigada Desintoxicacion Atencion Medica Contaras psicologos medicina general odontologos atencion geriatrica rehabilitacion fisica medicamentos gratuitos,2019-03-11
Cynthia,Viteri,CynthiaViteri6,sonreir seguimos hablando manana nuevas obras llenaran bienestar cada familia Guayaquil Escuchame vivo sintonizando,2019-03-11
Cynthia,Viteri,CynthiaViteri6,madres interesa resuelvan falta empleo entregamos creditos Banca Oportunidades quieren protejan hijos pondremos camaras reconocimiento facial analisis caminar colegios,2019-03-11
Cynthia,Viteri,CynthiaViteri6,construyeron Guayaquil hicieron grande ustedes,2019-03-11
Cynthia,Viteri,CynthiaViteri6,agradecido Dios vida futbol pues permitido tener vinculo cercano suenos gente nunca convencido camino construir juventud feliz sana positiva,2019-03-11
Cynthia,Viteri,CynthiaViteri6,equipo progreso junto seguiremos transformando Guayaquil Vota toditititito Concejales Distrito,2019-03-11
Cynthia,Viteri,CynthiaViteri6,Isla Trinitaria recibio gran carino respaldo haran ciudad grande Juntos haremos posible suenos Guayaquil,2019-03-12
Cynthia,Viteri,CynthiaViteri6,Buenos dias Guayaquil seguira creciendo muchas obras servicios todas familias Conoce propuestas sintonizando,2019-03-12
Cynthia,Viteri,CynthiaViteri6,Todas familias guayaquilenas tendran titulos propiedad,2019-03-12
Cynthia,Viteri,CynthiaViteri6,Guayaquil debe crecer ordenadamente vamos impulsar desarrollo hacia Costa planes vivienda comercios emprendimientos optimizacion transito Generaremos empleo,2019-03-12
Cynthia,Viteri,CynthiaViteri6,confianza hijo significa mismo nivel deben saber autoridad,2019-03-12
Cynthia,Viteri,CynthiaViteri6,haber criado hijos manera necesiten estan solos,2019-03-12
Cynthia,Viteri,CynthiaViteri6,fuerza ponen madres rescatar hijos drogas admirable vamos seguir apoyando devolver futuro jovenes,2019-03-12
Cynthia,Viteri,CynthiaViteri6,Gracias invitacion Programa Club Manana mujeres madres seguiremos defendiendo impulsando hijos Juntas haremos posible,2019-03-12
Cynthia,Viteri,CynthiaViteri6,quiero ustedes lleguen conmigo Alcaldia mejor sido parte vidas acompanen Concejales permitiran cumplir suenos Distrito,2019-03-12
Cynthia,Viteri,CynthiaViteri6,Gracias divertida interesante entrevista Esperemos repita pronto,2019-03-13
Cynthia,Viteri,CynthiaViteri6,equipo seguira haciendo realidad nuevos suenos trabajaran junto llevar progreso familias Distrito Guayaquil,2019-03-13
Cynthia,Viteri,CynthiaViteri6,respaldo incondicional inspira seguir trabajando bienestar progreso futuro cada ustedes Gracias Distrito demostrar aqui seguiremos sonando grande,2019-03-14
Cynthia,Viteri,CynthiaViteri6,ultima etapa campana recibido apoyo cada barrio sentimos calles confianza gratitud certeza camino progreso seguira engrandeciendo Guayaquil,2019-03-14
Cynthia,Viteri,CynthiaViteri6,Seguimos hablando Guayaquil Escucha nuevas obras vienen futuro sintonizando,2019-03-14
Cynthia,Viteri,CynthiaViteri6,Alcaldesa seguire rescatando jovenes droga madres podran llevar hijos centros gratuitos rehabilitacion ubicados Chongon Salitral Flor Bastion Guasmo hijos seran atendidos especialistas primera,2019-03-14
Cynthia,Viteri,CynthiaViteri6,enfocada trabajar Guayaquil planificacion nuevas obras,2019-03-14
Cynthia,Viteri,CynthiaViteri6,Lucia Dhanna Anibal sumaran lucha delincuencia obras traeran empleo equipo cada grande cumplimos siempre compromisos,2019-03-14
Cynthia,Viteri,CynthiaViteri6,Centro Bienestar Animal implementaremos partir mayo sera mejores pais region Guayaquil,2019-03-14
