nombre,apellidos,tweet_screen_name,tweet_text,tweet_date
Francisco,Jimenez Sanchez,fcojimenez21,propongo novelerias botar plata vamos darle prioridad obra llegue sectores ciudad obras basicas legalizaciones alcantarillado agua potable asfaltado radioelite9971,2019-03-07
Francisco,Jimenez Sanchez,fcojimenez21,propuestas hechas consultor comodamente sentado sillon elaboradas base escuchamos gente dia dia recorridos Guayaquil radioelite9971 ElGuayaquilQueTuQuieres JimenezAlcalde VotaTodoCREO21,2019-03-07
Francisco,Jimenez Sanchez,fcojimenez21,Guayaquil CREO VotaTodoCREO21 JimenezAlcalde ElGuayaquilQueTuQuieres,2019-03-07
Francisco,Jimenez Sanchez,fcojimenez21,Gran jornada tarde recorrimos Pascuales recibimos carino apoyo quieren verdadero cambio Guayaquil Gracias ElGuayaquilQueTuQuieres JimenezAlcalde VotaTodoCREO21,2019-03-08
Francisco,Jimenez Sanchez,fcojimenez21,noche conversatorio Universidad Casa Grande ucasagrande estudiantes Ciencias Politicas Comunicacion Gracias amable invitacion,2019-03-08
Francisco,Jimenez Sanchez,fcojimenez21,noche compartimos Conversatorio moradores Ciudadela FAE Gracias recibirnos escuchar propuestas ElGuayaquilQueTuQuieres JimenezAlcalde VotaTodoCREO21,2019-03-08
Francisco,Jimenez Sanchez,fcojimenez21,Buenos dias Hoy 07h00 radioantena3 sintoniza 91 7 FM tambien via online siguiente link,2019-03-08
Francisco,Jimenez Sanchez,fcojimenez21,Agenda actividades dia hoy viernes 8 marzo ElGuayaquilQueTuQuieres JimenezAlcalde VotaTodoCREO21,2019-03-08
Francisco,Jimenez Sanchez,fcojimenez21,Vamos conciliar orden ciudad progreso merece gente Implementaremos corredores comerciales calles existe comercio censados carnetizados modulos plegables comerciantes desarrollen actividad comercial radioantena3,2019-03-08
Francisco,Jimenez Sanchez,fcojimenez21,Guayaquil hacer aprovechar recursos naturales vamos implementar Metro Fluvial medio transporte masivo lograr asi descongestionar transito ciudad radioantena3,2019-03-08
Francisco,Jimenez Sanchez,fcojimenez21,Guayaquil proyectarse futuro Acercaremos obra municipal gente vamos organizar ciudad 10 zonas cada Unidad Municipal Independiente presupuesto propio radioantena3,2019-03-08
Francisco,Jimenez Sanchez,fcojimenez21,Arriba mujeres suenan luchan alegria contagian hermoso dia FELIZ DIA MUJER DiaInternacionalDeLaMujer 8deMarzo 8M,2019-03-08
Francisco,Jimenez Sanchez,fcojimenez21,Hoy disfrutamos delicioso almuerzo mujeres emprendedoras guayaquilenas Gracias apoyo compartir junto dia DiaDeLaMujer,2019-03-08
Francisco,Jimenez Sanchez,fcojimenez21,24 marzo decides Guayaquil gris Guayaquil COLORES ECOLOGICO VotaTodoCREO21 JimenezAlcalde ElGuayaquilQueTuQuieres,2019-03-08
Francisco,Jimenez Sanchez,fcojimenez21,Recorrimos tarde viernes Av 9 Octubre compania candidatos concejal zoilitagomez Silviafabara LemosGaray GomezAlexV rommelramosec guayaquilenos quieren CAMBIO ElGuayaquilQueTuQuieres JimenezAlcalde VotaTodoCREO21,2019-03-08
Francisco,Jimenez Sanchez,fcojimenez21,Recorrimos tarde viernes Av 9 Octubre compania candidatos concejal zoilitagomez Silviafabara LemosGaray GomezAlexV rommelramosec guayaquilenos quieren CAMBIO ElGuayaquilQueTuQuieres JimenezAlcalde VotaTodoCREO21,2019-03-08
Francisco,Jimenez Sanchez,fcojimenez21,Lunes acompanara WQNoticias fcojimenez21 Candidato Alcalde Guayaquil CREOEcuador Escuchanos vivo WQRadio 102 1FM Guayas,2019-03-09
Francisco,Jimenez Sanchez,fcojimenez21,noche Bastion Popular Bloque 1 conversatorio moradores sector Gran recibimiento Gracias permitirnos visitarlos presentar propuesta ElGuayaquilQueTuQuieres JimenezAlcalde VotaTodoCREO21,2019-03-09
Francisco,Jimenez Sanchez,fcojimenez21,Agenda actividades sabado 9 marzo ElGuayaquilQueTuQuieres JimenezAlcalde VotaTodoCREO21,2019-03-09
Francisco,Jimenez Sanchez,fcojimenez21,Hoy 19h00 CastigoDivinoGuayaco,2019-03-09
Francisco,Jimenez Sanchez,fcojimenez21,noche invitados CastigoDivinoGuayaco LaPosta Ecu Salud luisevivanco Pueden ver transmision vivo cuenta Instagram fcojimenez21,2019-03-10
Francisco,Jimenez Sanchez,fcojimenez21,soportamos prepotencia creen duenos ciudad 24 marzo manifiestate abusos quieren perpetuarse poder JimenezAlcalde VotaTodoCREO21,2019-03-10
Francisco,Jimenez Sanchez,fcojimenez21,soportamos prepotencia creen duenos ciudad 24 marzo manifiestate abusos quieren perpetuarse poder JimenezAlcalde VotaTodoCREO21,2019-03-10
Francisco,Jimenez Sanchez,fcojimenez21,soportamos prepotencia creen duenos ciudad 24 marzo manifiestate abusos quieren perpetuarse poder JimenezAlcalde VotaTodoCREO21,2019-03-10
Francisco,Jimenez Sanchez,fcojimenez21,decides 24 marzo Estero olvidado Estero salvado VOTA CREO 21 JimenezAlcalde ElGuayaquilQueTuQuieres,2019-03-11
Francisco,Jimenez Sanchez,fcojimenez21,Hoy domingo Pascuales Gracias recibirnos apoyar alegria esperanza CAMBIO propuestas 24 marzo VOTA CREO 21 ElGuayaquilQueTuQuieres JimenezAlcalde,2019-03-11
Francisco,Jimenez Sanchez,fcojimenez21,Agenda actividades lunes 11 marzo ElGuayaquilQueTuQuieres JimenezAlcalde VotaTodoCREO21,2019-03-11
Francisco,Jimenez Sanchez,fcojimenez21,Buenos dias ucsgradiosintonicen 1190 AM pueden escucharlo via online siguiente link,2019-03-11
Francisco,Jimenez Sanchez,fcojimenez21,voy ser Alcalde EMPLEO Implementaremos Corredores Comerciales calles existe comercio comerciantes puedan trabajar orden tranquilidad ucsgradio ElGuayaquilQueTuQuieres JimenezAlcalde VotaTodoCREO21,2019-03-11
Francisco,Jimenez Sanchez,fcojimenez21,voy ser Alcalde EMPLEO Implementaremos Corredores Comerciales calles existe comercio comerciantes puedan trabajar orden tranquilidad ucsgradio ElGuayaquilQueTuQuieres JimenezAlcalde VotaTodoCREO21,2019-03-11
Francisco,Jimenez Sanchez,fcojimenez21,ahora RadioMorena640 VIVO sintonicen 640 AM tambien pueden escuchar entrevista via online siguiente link,2019-03-11
Francisco,Jimenez Sanchez,fcojimenez21,claro guayaquilenos quieren continuismo populismo gente quiere CAMBIO vamos llevar obra sectores ciudad RadioMorena640,2019-03-11
Francisco,Jimenez Sanchez,fcojimenez21,Guayaquil necesita policia integrada cooperativa Activaremos Policia Metropolitana patrullaje resguardo zonas inseguras control entrada salida escuelas colegios RadioMorena640 ElGuayaquilQueTuQuieres JimenezAlcalde VotaTodoCREO21,2019-03-11
Francisco,Jimenez Sanchez,fcojimenez21,Hoy recorrimos Pascuales junto futura Prefecta Guayas PolyUgarteG viene CAMBIO ElGuayaquilQueTuQuieres TeTocaATi JimenezAlcalde PolyPrefecta2019 VotaTodoCREO21,2019-03-11
Francisco,Jimenez Sanchez,fcojimenez21,tarde recorriendo Guerreros Fortin junto PolyUgarteG Gracias recibirnos ElGuayaquilQueTuQuieres TeTocaATi JimenezAlcalde PolyPrefecta VotaTodoCREO21,2019-03-11
Francisco,Jimenez Sanchez,fcojimenez21,Vamos crear Minga Municipal ElGuayaquilQueTuQuieres JimenezAlcalde VotaTodoCREO21,2019-03-11
Francisco,Jimenez Sanchez,fcojimenez21,tarde recorrimos Lomas Florida Nueva Prosperina Socio Vivienda Gran recibimiento propuestas lograr CAMBIO PolyUgarteG JimenezAlcalde PolyPrefecta VotaTodoCREO21,2019-03-12
Francisco,Jimenez Sanchez,fcojimenez21,Hoy PolyUgarteG fcojimenez21 equipo CAMBIO Guayaquil defendera derecho trabajar dignidad temor atropellos llevando obra sectores olvidados Perla Pacifico VotaTodoCREO21 ElGuayaquilQueTuQuieres TeTocaATi,2019-03-12
Francisco,Jimenez Sanchez,fcojimenez21,Vamos recuperar Estero Salado 24 marzo VOTA CREO 21 ElGuayaquilQueTuQuieres JimenezAlcalde,2019-03-12
Francisco,Jimenez Sanchez,fcojimenez21,Agenda actividades martes 12 marzo ElGuayaquilQueTuQuieres JimenezAlcalde VotaTodoCREO21,2019-03-12
Francisco,Jimenez Sanchez,fcojimenez21,Buenos dias Arrancamos jornada WQRadio EClos invito sintonizar ahora 102 1 FM via online,2019-03-12
Francisco,Jimenez Sanchez,fcojimenez21,gente quiere soluciones demagogicas mismo siempre quiere ciudad menos multas mas empleo menos cemento mas verde menos represion mas apoyo gestion mas cercana WQRadio EC ElGuayaquilQueTuQuieres JimenezAlcalde VotaTodoCREO21,2019-03-12
Francisco,Jimenez Sanchez,fcojimenez21,Guayaquil ciudad hecha distintos barrios realidades proponemos organizar ciudad 10 zonas cada Unidad Municipal Independiente presupuesto propio Queremos obra municipal llegue sectores ciudad WQRadio EC,2019-03-12
Francisco,Jimenez Sanchez,fcojimenez21,WQNoticias candidato alcaldia Guayaquil fcojimenez21 Hablamos plan trabajo ciudad Escucha WQRadio 102 1 FM,2019-03-12
Francisco,Jimenez Sanchez,fcojimenez21,Implementaremos politica permanente arborizacion ciudad priorizando rescate arboles nativos Guayaquil WQRadio EC,2019-03-12
Francisco,Jimenez Sanchez,fcojimenez21,WQNoticias Candidato alcaldia Guayaquil fcojimenez21 Escucha declaraciones vivo,2019-03-12
Francisco,Jimenez Sanchez,fcojimenez21,RadioForever925 VIVO sintonicen 92 5 FM ElGuayaquilQueTuQuieres JimenezAlcalde VotaTodoCREO21,2019-03-12
Francisco,Jimenez Sanchez,fcojimenez21,radiocentroec invito sintonizar 101 3 FM tambien via online siguiente link,2019-03-12
Francisco,Jimenez Sanchez,fcojimenez21,multas transito deben ser proporcionales realidad economica guayaquilenos vamos reducirlas 70 radiocentroec ElGuayaquilQueTuQuieres JimenezAlcalde VotaTodoCREO21,2019-03-12
Francisco,Jimenez Sanchez,fcojimenez21,problema drogas trabajaremos 3 ejes PREVENCION programas deportivos culturales REHABILITACION Centros Municipales subsidiados REINSERCION Bolsa Municipal Empleo programas emprendimiento radiocentroec,2019-03-12
Francisco,Jimenez Sanchez,fcojimenez21,aqui CAMBIO Queremos Guayaquil transparencia gestion obra llegue sectores ciudad solucionar problemas ciudad medidas efectivas ondapositiva941,2019-03-12
Francisco,Jimenez Sanchez,fcojimenez21,24 marzo decides Garrote EMPLEO VotaTodoCREO21 JimenezAlcalde ElGuayaquilQueTuQuieres,2019-03-12
Francisco,Jimenez Sanchez,fcojimenez21,Acompananos HOY GRAN CARAVANA junto PolyUgarteG,2019-03-12
Francisco,Jimenez Sanchez,fcojimenez21,Queremos ciudad segura incluyente obra municipal llegue sectores Guayaquil gente quiere continuismo populismo quiere CAMBIO RadioForever925,2019-03-12
Francisco,Jimenez Sanchez,fcojimenez21,principal necesidad guayaquilenos empleo todas propuestas estan enfocadas mejorar condiciones vida prosperidad guayaquilenos familias RadioForever925,2019-03-12
Francisco,Jimenez Sanchez,fcojimenez21,Seguimos recorriendo Guayaquil manana Mercado Sauces 9 junto PolyUgarteG,2019-03-12
Francisco,Jimenez Sanchez,fcojimenez21,Hoy 20h00 pierdas FacebookLive candidatos concejal amparoguillen12 Silviafabara GomezAlexV espero,2019-03-12
Francisco,Jimenez Sanchez,fcojimenez21,artista guayaquileno necesita oportunidades ElGuayaquilQueTuQuieres JimenezAlcalde VotaTodoCREO21,2019-03-12
Francisco,Jimenez Sanchez,fcojimenez21,GRAN CARAVANA PolyUgarteG Vamos lograr juntos CAMBIO queremos Gracias masivo apoyo VotaTodoCREO21 JimenezAlcalde PolyPrefecta,2019-03-12
Francisco,Jimenez Sanchez,fcojimenez21,VIVO via FacebookLive junto amparoguillen12 Silviafabara Conectate ahora,2019-03-13
Francisco,Jimenez Sanchez,fcojimenez21,Agenda actividades miercoles 13 marzo ElGuayaquilQueTuQuieres JimenezAlcalde VotaTodoCREO21,2019-03-13
Francisco,Jimenez Sanchez,fcojimenez21,Buenos dias Arrancamos jornada RADIOAMERICAEC sintonicen 93 3 FM tambien via online siguiente link,2019-03-13
Francisco,Jimenez Sanchez,fcojimenez21,Maltrato olvido dos palabras mas escuchado gente recorridos Guayaquil cosas llegan alma guayaquilenos quieren continuismo populismo quieren CAMBIO responsabilidad futuro RADIOAMERICAEC,2019-03-13
Francisco,Jimenez Sanchez,fcojimenez21,Vamos implementar Metro Fluvial medio transporte masivo complementario Metrovia Guayaquil necesita transporte publico integrado diversificado alternativa acorde realidad RADIOAMERICAEC,2019-03-13
Francisco,Jimenez Sanchez,fcojimenez21,radioi99 sintonicen 98 9 FM tambien via online siguiente link,2019-03-13
Francisco,Jimenez Sanchez,fcojimenez21,Organizaremos ciudad 10 zonas cada Unidad Municipal Independiente presupuesto propio implementaremos Polideportivos Municipales chicos hagan deporte ademas actividades recreativas jovenes adultos i99,2019-03-13
Francisco,Jimenez Sanchez,fcojimenez21,vision Guayaquil menos multas mas empleo menos represion mas apoyo menos cemento mas arboles menos trafico mas rio mas deporte libre drogas obra municipal llegue sectores ciudad radioi99,2019-03-13
Francisco,Jimenez Sanchez,fcojimenez21,Hoy Av Casuarina junto PolyUgarteG compartiendo recorriendo junto gente linda sector quiere CAMBIO Guayaquil ElGuayaquilQueTuQuieres JimenezAlcalde PolyPrefecta2019 VotaTodoCREO21,2019-03-14
Francisco,Jimenez Sanchez,fcojimenez21,Agenda actividades jueves 14 marzo ElGuayaquilQueTuQuieres JimenezAlcalde VotaTodoCREO21,2019-03-14
Francisco,Jimenez Sanchez,fcojimenez21,jueves CUARTOPODER Francisco Jimenez fcojimenez21 candidato Alcaldia Guayaquil Movimiento CREO tema Plan trabajo 107 3 FM RadioRumbaNetwork,2019-03-14
Francisco,Jimenez Sanchez,fcojimenez21,Buenos dias RadioHuancavilk 830 AM tambien puede escuchar entrevista via online siguiente link,2019-03-14
Francisco,Jimenez Sanchez,fcojimenez21,gente quiere continuismo populismo quiere CAMBIO Quieren propuestas forma Guayaquil cercano empleo RadioHuancavilk,2019-03-14
Francisco,Jimenez Sanchez,fcojimenez21,sucede ciudad compete Municipio si bien cierto funcion generar empleo si puede promoverlo facilitarlo ejemplo Bolsa Empleo Municipal Corredores Comerciales reduccion tramites mas RadioHuancavilk,2019-03-14
Francisco,Jimenez Sanchez,fcojimenez21,VIVO RadioRumbaEc noticiero Cuarto Poder sintonicen 107 3 FM via online siguiente link,2019-03-14
Francisco,Jimenez Sanchez,fcojimenez21,Vamos mejorar facilitar vida guayaquilenos organizando ciudad 10 zonas cada Unidad Municipal Independiente presupuesto propio RadioRumbaEc JimenzAlcalde VotaTodoCREO21 ElGuayaquilQueTuQuieres,2019-03-14
Francisco,Jimenez Sanchez,fcojimenez21,24 marzo decides Achicharrado fresquito VOTA CREO 21 JimenezAlcalde ElGuayaquilQueTuQuieres,2019-03-14
Francisco,Jimenez Sanchez,fcojimenez21,Seguimos recorriendo Guayaquil junto futura Prefecta Guayas PolyUgarteG Gran caravana Acuarela Rio Sauces 4 5 6 8 Guayacanes Alborada JimenezAlcalde PolyPrefecta2019 VotaTodoCREO21,2019-03-14
Francisco,Jimenez Sanchez,fcojimenez21,24 marzo llega Guayaquil quieres Guayaquil Jimenez VotaTodoCREO21 JimenezAlcalde,2019-03-14
Francisco,Jimenez Sanchez,fcojimenez21,Buenos dias Arrancamos jornada superk800radio sintonicen 800 AM via online,2019-03-15
Francisco,Jimenez Sanchez,fcojimenez21,visitado sectores Guayaquil escuchado testimonios impactado sectores llega obra Municipal propuestas fruto recorridos podemos defraudar esperanza quieren cambio superk800radio,2019-03-15
Francisco,Jimenez Sanchez,fcojimenez21,ser coherente proponer campana propuestas reales factibles mejoren condiciones vida guayaquilenos superk800radio,2019-03-15
Francisco,Jimenez Sanchez,fcojimenez21,procesos cambio hacen hechos palabras recorrido Guayaquil hace casi 2 anos queremos organizar ciudad 10 zonas cada Unidad Municipal Independiente obra llegue sectores Radio11Q,2019-03-15
Francisco,Jimenez Sanchez,fcojimenez21,Guayaquil ciudad puerto Necesitamos conciliar orden requiere ciudad apoyo trabajo requiere gente proponemos Corredores Comerciales calles existe comercio carnetizados censados puedan trabajar orden Radio11Q,2019-03-15
Francisco,Jimenez Sanchez,fcojimenez21,problematica drogas vamos trabajar 3 ejes Prevencion rehabilitacion reinsercion Construiremos polideportivos verticales alejar chicos drogas centros rehabilitacion implementaremos Bolsa Municipal Empleo Radio11Q,2019-03-15
Francisco,Jimenez Sanchez,fcojimenez21,multas mijo 24 marzo VOTA CREO 21 ElGuayaquilQueTuQuieres JimenezAlcalde,2019-03-15
Francisco,Jimenez Sanchez,fcojimenez21,Hoy acompananos GRAN CARAVANA CAMBIO ElGuayaquilQueTuQuieres JimenezAlcalde VotaTodoCREO21,2019-03-15
Francisco,Jimenez Sanchez,fcojimenez21,Junto PolyUgarteG seguimos recorriendo Guayaquil Vamos lograr CAMBIO queremos VotaTodoCREO21,2019-03-15
Francisco,Jimenez Sanchez,fcojimenez21,Hoy viernes recorrimos GRAN CARAVANA varias ciudadelas norte Guayaquil Alborada Sauces Guayacanes Urdesa junto candidatos Concejal amparoguillen12 Silviafabara GomezAlexV ElGuayaquilQueTuQuieres JimenezAlcalde VotaTodoCREO21,2019-03-16
Francisco,Jimenez Sanchez,fcojimenez21,Guayaquil Guayas entero quiere CAMBIO Junto equipo CREOEcuador candidatos Concejales Lista 21 fcojimenez21 recorrimos Sur Guayaquil gran caravana Gracias apoyo carino TeTocaATi PolyPrefecta2019,2019-03-16
Francisco,Jimenez Sanchez,fcojimenez21,Terminamos GRAN CARAVANA centro Guayaquil GRACIAS acompanarnos tarde noche 24 marzo VOTA CREO 21 ElGuayaquilQueTuQuieres JimenezAlcalde,2019-03-16
Francisco,Jimenez Sanchez,fcojimenez21,viene CAMBIO Junto amparoguillen12 Silviafabara GomezAlexV vamos lograr ElGuayaquilQueTuQuieres JimenezAlcalde VotaTodoCREO21,2019-03-16
Francisco,Jimenez Sanchez,fcojimenez21,manana Feria Libre Chemisse Parroquia Tarqui Gran recibimiento propuesta votaran CREO 21 24 marzo ElGuayaquilQueTuQuieres JimenezAlcalde VotaTodoCREO21,2019-03-16
Francisco,Jimenez Sanchez,fcojimenez21,Vamos implementar politica permanente Arborizacion Guayaquil 24 marzo VOTA CREO 21 JimenezAlcalde ElGuayaquilQueTuQuieres,2019-03-16
Francisco,Jimenez Sanchez,fcojimenez21,Hoy compartimos guayaquilenos Bingo Pascuales Recibimos carino gente sectores visitamos GRACIAS apoyo ElGuayaquilQueTuQuieres JimenezAlcalde VotaTodoCREO21,2019-03-16
Francisco,Jimenez Sanchez,fcojimenez21,Hoy almorzando Terminal Terrestre preguntaron quiero ser Alcalde respuesta Quiero Guayaquil menos multas mas empleo menos represion mas apoyo menos cemento mas arboles menos trafico mas rio mas deporte libre drogas,2019-03-17
Francisco,Jimenez Sanchez,fcojimenez21,Agenda actividades domingo 17 marzo ElGuayaquilQueTuQuieres JimenezAlcalde VotaTodoCREO21,2019-03-17
Francisco,Jimenez Sanchez,fcojimenez21,Gracias Cerecita Progreso Posorja recibirnos manana tarde domingo Masivo apoyo propuesta CAMBIO 24 marzo VOTA CREO 21 JimenezAlcalde ElGuayaquilQueTuQuieres,2019-03-17
Francisco,Jimenez Sanchez,fcojimenez21,Vamos Guayaquil contaminacion ElGuayaquilQueTuQuieres JimenezAlcalde VotaTodoCREO21,2019-03-18
Francisco,Jimenez Sanchez,fcojimenez21,Hoy domingo llevamos mensaje CAMBIO Morro Gracias recibirnos 24 marzo VOTA CREO 21 ElGuayaquilQueTuQuieres JimenezAlcalde,2019-03-18
Francisco,Jimenez Sanchez,fcojimenez21,Agenda actividades lunes 18 marzo JimenezAlcalde VotaTodoCREO21 ElGuayaquilQueTuQuieres,2019-03-18
Francisco,Jimenez Sanchez,fcojimenez21,Implementaremos Metro Fluvial Guayaquil complemento transporte masivo ciudad Ofrecemos soluciones impacten positivamente calidad vida guayaquilenos teleramaec,2019-03-18
Francisco,Jimenez Sanchez,fcojimenez21,VIVO radioestrellafm sintonicen 92 1 FM,2019-03-18
Francisco,Jimenez Sanchez,fcojimenez21,vision seguridad asociativa integrada Policia Metropolitana trabajara directamente Policia Nacional patrullaje ciudad represion delitos criterio cercania organizara ciudad radioestrellafm,2019-03-18
Francisco,Jimenez Sanchez,fcojimenez21,problema drogas trabajaremos 3 ejes PREVENCION programas deportivos culturales REHABILITACION Centros Municipales subsidiados REINSERCION Bolsa Municipal Empleo programas emprendimiento radioestrellafm,2019-03-18
Francisco,Jimenez Sanchez,fcojimenez21,Hoy GRAN CAMINATA Blvd 9 Octubre junto PolyUgarteG 16h00 Acompananos ElGuayaquilQueTuQuieres JimenezAlcalde VotaTodoCREO21,2019-03-18
Francisco,Jimenez Sanchez,fcojimenez21,Vamos implementar Metro Fluvial Guayaquil conectando ciudad guayaquilenos transporte publico rapido eficiente calidad 24 marzo VOTA CREO 21 JimenezAlcalde,2019-03-18
Francisco,Jimenez Sanchez,fcojimenez21,Vamos implementar Metro Fluvial Guayaquil Conectaremos ciudad guayaquilenos transporte publico rapido eficiente calidad 24 marzo VOTA CREO 21 JimenezAlcalde,2019-03-18
Francisco,Jimenez Sanchez,fcojimenez21,Dejemos lado continuismo abusivo vamos Guayaquil futuro 24 marzo gran decision tomar Vamos construir juntos ElGuayaquilQueTuQuieres JimenezAlcalde VotaTodoCreo21,2019-03-18
Francisco,Jimenez Sanchez,fcojimenez21,24 marzo VOTA CREO 21 JimenezAlcalde ElGuayaquilQueTuQuieres,2019-03-18
Francisco,Jimenez Sanchez,fcojimenez21,momento recorriendo centro Guayaquil junto futura Prefecta Guayas PolyUgarteG Ven acompananos ElGuayaquilQueTuQuieres JimenezAlcalde PolyPrefecta VotaTodoCREO21,2019-03-18
Francisco,Jimenez Sanchez,fcojimenez21,Todoparalosnio1 jaimenebotsaadi PaulEPalacios Flaiguana PolyUgarteG propuesta transporte fluvial justamente permitira movilizarte rio,2019-03-18
Francisco,Jimenez Sanchez,fcojimenez21,ENVIDEO fcojimenez21 propone implemetar Metro Fluvial complemento transporte Guayaquil,2019-03-18
Francisco,Jimenez Sanchez,fcojimenez21,Gran inicio semana Recorrimos centro ciudad junto PolyUgarteG masivo apoyo guayaquilenos quieren CAMBIO 24 marzo VOTA CREO 21 ElGuayaquilQueTuQuieres JimenezAlcalde PolyPrefecta,2019-03-19
Francisco,Jimenez Sanchez,fcojimenez21,Manana 11h00 GRAN CAMINATA Flor Bastion Acompananos ElGuayaquilQueTuQuieres JimenezAlcalde VotaTodoCREO21,2019-03-19
Francisco,Jimenez Sanchez,fcojimenez21,Agenda actividades martes 19 marzo ElGuayaquilQueTuQuieres JimenezAlcalde VotaTodoCREO21,2019-03-19
Francisco,Jimenez Sanchez,fcojimenez21,Buenos dias Guayaquil Arrancamos jornada dia martes Caravana750 750 AM VIVO ahora,2019-03-19
Francisco,Jimenez Sanchez,fcojimenez21,Necesitamos obra favor ciudadanos empleo llegue sectores ciudad vamos organizar ciudad 10 zonas casa Unidad Municipal Independiente presupuesto propio Caravana750,2019-03-19
Francisco,Jimenez Sanchez,fcojimenez21,Guayaquil necesita policia integrada cooperativa Activaremos Policia Metropolitana patrullaje resguardo zonas inseguras control entrada salida escuelas colegios Caravana750,2019-03-19
Francisco,Jimenez Sanchez,fcojimenez21,Necesitamos obra favor ciudadanos empleo llegue sectores ciudad vamos organizar ciudad 10 zonas cada Unidad Municipal Independiente presupuesto propio Caravana750,2019-03-19
Francisco,Jimenez Sanchez,fcojimenez21,ahora radiosonorama 103 7 FM Pueden escuchar entrevista via online siguiente link,2019-03-19
Francisco,Jimenez Sanchez,fcojimenez21,fcojimenez21 Guayaquil descuidada maltratada necesita cambio bien debe ser ciudada menos multas mas trabajo LaPalabraSonorama CREOEcuador,2019-03-19
Francisco,Jimenez Sanchez,fcojimenez21,vision Guayaquil menos multas mas empleo menos represion mas apoyo menos cemento mas arboles menos trafico mas rio mas deporte libre drogas obra municipal llegue sectores ciudad ecuantena,2019-03-19
Francisco,Jimenez Sanchez,fcojimenez21,Guayaquil 47 Mercados Municipales debemos tener 47 guarderias Necesitamos red guarderias madres trabajan dia dia necesitan tener seguridad hijos esten buenas manos ecuantena,2019-03-19
Francisco,Jimenez Sanchez,fcojimenez21,CAMBIO cada vez mas cerca 24 marzo VOTA CREO 21 JimenezAlcalde ElGuayaquilQueTuQuieres,2019-03-19
Francisco,Jimenez Sanchez,fcojimenez21,HOY Gran caminata Flor Bastion 11h00 Ven acompananos ElGuayaquilQueTuQuieres JimenezAlcalde VotaTodoCREO21,2019-03-19
Francisco,Jimenez Sanchez,fcojimenez21,680radioatalaya programa Hora Pocho pochoharb ferfloma invito sintonizar 680 AM via online,2019-03-19
Francisco,Jimenez Sanchez,fcojimenez21,vision seguridad asociativa integrada Policia Metropolitana trabajara directamente Policia Nacional patrullaje ciudad prevencion represion delitos criterio cercania organizara ciudad 680radioatalaya,2019-03-19
Francisco,Jimenez Sanchez,fcojimenez21,Vamos reducir multas transito desproporcionadas 70 afectan exageradamente bolsillo guayaquilenos complementaremos educacion vial horas trabajo comunitario 680radioatalaya,2019-03-19
Francisco,Jimenez Sanchez,fcojimenez21,Hoy GRAN CARAVANA junto PolyUgarteG 15h30 arrancamos Av Casuarina esperamos ElGuayaquilQueTuQuieres PolyPrefecta JimenezAlcalde VotaTodoCREO21,2019-03-19
Francisco,Jimenez Sanchez,fcojimenez21,GRAN CAMINATA Flor Bastion manana alcaldia vamos lograr obra municipal llegue sectores ciudad 24 marzo VOTA CREO 21 ElGuayaquilQueTuQuieres JimenezAlcalde,2019-03-19
Francisco,Jimenez Sanchez,fcojimenez21,Guayaquil quieres Guayaquil Jimenez llega CAMBIO 24 marzo VOTA CREO 21 JimenezAlcalde,2019-03-19
Francisco,Jimenez Sanchez,fcojimenez21,juventud necesita lugares puedan desarrollar potencial mantenerse alejados drogas ElGuayaquilQueTuQuieres construiremos Polideportivos Municipales JimenezAlcalde VotaTodoCREO21,2019-03-19
Francisco,Jimenez Sanchez,fcojimenez21,equipo CAMBIO sigue recorriendo Guayaquil GRAN CARAVANA Monte Sinai junto PolyUgarteG ElGuayaquilQueTuQuieres JimenezAlcalde PolyPrefecta VotaTodoCREO21,2019-03-19
Francisco,Jimenez Sanchez,fcojimenez21,Agenda actividades miercoles 20 marzo ElGuayaquilQueTuQuieres JimenezAlcalde VotaTodoCREO21,2019-03-20
Francisco,Jimenez Sanchez,fcojimenez21,Buenos dias Guayaquil Arrancamos momento jornada CREsatelital560AM via online siguiente link,2019-03-20
Francisco,Jimenez Sanchez,fcojimenez21,alcaldia Policia Metropolitana tendra rol apoyo cercano ciudadanos Trabajara coordinacion constante Policia Nacional base criterios zonificacion ciudad CREsatelital,2019-03-20
Francisco,Jimenez Sanchez,fcojimenez21,Vamos implementar Metro Fluvial Guayaquil Conectaremos ciudad guayaquilenos transporte publico rapido eficiente calidad estara integrado sistema Metrovia CREsatelital,2019-03-20
Francisco,Jimenez Sanchez,fcojimenez21,falta CAMBIO 24 marzo VOTA CREO 21 JimenezAlcalde ElGuayaquilQueTuQuieres,2019-03-20
Francisco,Jimenez Sanchez,fcojimenez21,ahora entrevista LosConfiables CanalUnoTv presentando propuesta guayaquilenos JimenezAlcalde VotaTodoCREO21 ElGuayaquilQueTuQuieres,2019-03-20
Francisco,Jimenez Sanchez,fcojimenez21,multas transito pueden ser equivalentes salario basico ElGuayaquilQueTuQuieres vamos reducirlas 70 24 marzo VOTA CREO 21,2019-03-20
