nombre,apellidos,tweet_screen_name,tweet_text,tweet_date
Francisco,Jimenez Sanchez,fcojimenez21,Gracias Martha Roldos recibirnos manana vienen grandes cosas Guayaquil llega CAMBIO ElGuayaquilQueTuQuieres JimenezAlcalde VotaTodoCREO21,2019-03-20
Francisco,Jimenez Sanchez,fcojimenez21,ondapositiva sintonicen 94 1 FM via online,2019-03-20
Francisco,Jimenez Sanchez,fcojimenez21,Recuperemos patrimonio natural JimenezAlcalde VotaTodoCREO21 ElGuayaquilQueTuQuieres,2019-03-20
Francisco,Jimenez Sanchez,fcojimenez21,Seguimos caravana Guayaquil CAMBIO viene fuerza 24 marzo Vota CREO 21 Silviafabara GomezAlexV ElGuayaquilQueTuQuieres JimenezAlcalde,2019-03-20
Francisco,Jimenez Sanchez,fcojimenez21,Casa llena Cerramos jornada hoy Flor Bastion GRACIAS vez mas carino 24 marzo VOTA CREO 21 voto vamos lograr ElGuayaquilQueTuQuieres JimenezAlcalde,2019-03-21
Francisco,Jimenez Sanchez,fcojimenez21,GRAN CIERRE CAMPANA Junto PolyUgarteG LassoGuillermo cerramos campana iniciamos CAMBIO quieres esperamos ElGuayaquilQueTuQuieres JimenezAlcalde PolyPrefecta VotaTodoCREO21,2019-03-21
Francisco,Jimenez Sanchez,fcojimenez21,Agenda actividades jueves 21 marzo ElGuayaquilQueTuQuieres JimenezAlcalde VotaTodoCREO21,2019-03-21
Francisco,Jimenez Sanchez,fcojimenez21,Buenos dias Arrancamos ultimo dia campana RADIOAMERICAEC sintonicen 93 3 FM JimenezAlcalde VotaTodoCREO21,2019-03-21
Francisco,Jimenez Sanchez,fcojimenez21,Hoy empezamos GRAN CARAVANA cierre campana 10h00 Vergeles vamos recorrer toda ciudad junto PolyUgarteG LassoGuillermo RADIOAMERICAEC,2019-03-21
Francisco,Jimenez Sanchez,fcojimenez21,esperamos HOY 10h00 recorreremos Guayaquil GRAN CARAVANA CIERRE CAMPANA,2019-03-21
Francisco,Jimenez Sanchez,fcojimenez21,ahora radioelite9971sintonicen 99 7 FM JimenezAlcalde ElGuayaquilQueTuQuieres VotaTodoCREO21,2019-03-21
Francisco,Jimenez Sanchez,fcojimenez21,Nadie regalado Meses atras dije recorreriamos toda ciudad hicimos Sabemos necesita Guayaquil propuestas carta presentacion llevar obra municipal sectores ciudad radioelite9971,2019-03-21
Francisco,Jimenez Sanchez,fcojimenez21,radiocentroecsintonicen 101 3 FM JimenezAlcalde VotaTodoCREO21 ElGuayaquilQueTuQuieres,2019-03-21
Francisco,Jimenez Sanchez,fcojimenez21,Guayaquil ciudad puerto existe comercio Vamos priorizar empleo medidas inteligentes Implementaremos Corredores Comerciales calles existe comercio modulos plegables censados carnetizados orden radiocentroec,2019-03-21
Francisco,Jimenez Sanchez,fcojimenez21,realidades guayaquilenos deben conocer JimenezAlcalde VotaTodoCREO21,2019-03-21
Francisco,Jimenez Sanchez,fcojimenez21,Empezamos GRAN CARAVANA cierre campana junto PolyUgarteG LassoGuillermo JimenezAlcalde PolyPrefecta ElGuayaquilQueTuQuieres VotaTodoCREO21,2019-03-21
Francisco,Jimenez Sanchez,fcojimenez21,Iniciamos gran caravana cambio junto PolyUgarteG fcojimenez21 domingo vota CAMBIO Guayas Guayaquil Vota CREOEcuador 21,2019-03-21
Francisco,Jimenez Sanchez,fcojimenez21,Apoyando caravana PolyUgarteG fcojimenez21 CAMBIO Guayaquil junto LassoGuillermo VotaTodoCREO21 21,2019-03-21
Francisco,Jimenez Sanchez,fcojimenez21,Reportaje Televistazo ecuavisa GRAN CARAVANA cierre campana,2019-03-21
Francisco,Jimenez Sanchez,fcojimenez21,Muchas gracias Guayaquil acompanarnos hoy GRAN CARAVANA CAMBIO cierre campana 24 marzo VOTA CREO 21 ElGuayaquilQueTuQuieres JimenezAlcalde,2019-03-21
Francisco,Jimenez Sanchez,fcojimenez21,Reportaje CanalUnoTv GRAN CARAVANA cierre campana,2019-03-21
Francisco,Jimenez Sanchez,fcojimenez21,falta CAMBIO lograr ElGuayaquilQueTuQuieres 24 marzo VOTA CREO 21 JimenezAlcalde,2019-03-22
Francisco,Jimenez Sanchez,fcojimenez21,Guayaquilenos 24 marzo nueva oportunidad cambiar ElGuayaquilQueTuQuieres JimenezAlcalde VotaTodoCREO21,2019-03-22
Francisco,Jimenez Sanchez,fcojimenez21,populismo continuismo Guayaquil quiere CAMBIO VotaTodoCREO21 JimenezAlcalde,2019-03-22
Francisco,Jimenez Sanchez,fcojimenez21,Guayaquilenos 24 marzo nueva oportunidad cambiar ElGuayaquilQueTuQuieres JimenezAlcalde VotaTodoCREO21,2019-03-23
Francisco,Jimenez Sanchez,fcojimenez21,Atencion VIVO via FacebookLive conectate ahora,2019-03-23
Francisco,Jimenez Sanchez,fcojimenez21,Gracias Guayaquil JimenezAlcalde VotaTodoCREO21,2019-03-23
Francisco,Jimenez Sanchez,fcojimenez21,Guayaquilenos Manana voto iniciaremos verdadero CAMBIO necesita Guayaquil ElGuayaquilQueTuQuieres JimenezAlcalde VotaTodoCREO21,2019-03-23
Francisco,Jimenez Sanchez,fcojimenez21,Gracias increibles meses Hoy gran oportunidad Vamos optimismo Fe construir sueno conjunto Vamos GuayaquilQueTuQuieres merecemos,2019-03-24
Francisco,Jimenez Sanchez,fcojimenez21,Ejerciendo derecho voto acompanado familia equipo seguro saldremos triunfantes jornada CAMBIO llegara favor guayaquilenos VotaTodoCREO21,2019-03-24
Francisco,Jimenez Sanchez,fcojimenez21,Elecciones2019 fcojimenez21 candidato Alcaldia movimiento CREO pidio respetar voluntad pueblo guayaquileno tras sufragar pasadas 10 30 colegio Matilde Amador Video victorhcarreno,2019-03-24
Francisco,Jimenez Sanchez,fcojimenez21,Acompanamos sufragar LassoGuillermo compania simpatizantes partidarios CREOEcuador VotaTodoCREO21,2019-03-24
Francisco,Jimenez Sanchez,fcojimenez21,Guayaquil,2019-03-25
Francisco,Jimenez Sanchez,fcojimenez21,Hoy dia concienciar inclusion tolerancia respeto hacia personas Autismo dejemos lado malas etiquetas facilitemos mejor herramientas metas ponen DiaMundialAutismo 2Abril,2019-04-02
Francisco,Jimenez Sanchez,fcojimenez21,Hoy hace 3 anos terremoto 16Abr solidaridad gran abrazo hermanos manabitas esmeraldenos familias victimas coraje valor trabajo van superando dia dia lamentable tragedia,2019-04-16
Francisco,Jimenez Sanchez,fcojimenez21,invito sintonizar entrevistas manana radioi99 radioelite9971 CREO21,2019-04-21
Francisco,Jimenez Sanchez,fcojimenez21,Hoy celebra DiaDeLaTierra reflexionemos cuidado planeta comprometamonos realizar acciones evitar siga contaminando Cuidemos hogar futuras generaciones,2019-04-22
Francisco,Jimenez Sanchez,fcojimenez21,Hoy celebra DiaDeLaTierra reflexionemos cuidado planeta comprometamonos realizar acciones evitar siga contaminando Cuidemos hogar futuras generaciones,2019-04-22
Francisco,Jimenez Sanchez,fcojimenez21,invito seguir entrevistas manana RadioHuancavilk RadioSantiagoec CREO21,2019-04-23
Francisco,Jimenez Sanchez,fcojimenez21,Hoy proposito DiaInternacionalDelLibro recomiendo gran libro Alquimistas narrativa apasionante poderosos mundo afrontan crisis financieras planetarias ustedes libro recomiendan,2019-04-23
Francisco,Jimenez Sanchez,fcojimenez21,invito seguir entrevistas manana RADIOAMERICAEC ecuantena Tropicana ec CREO21,2019-04-24
Francisco,Jimenez Sanchez,fcojimenez21,Hoy fallecio Julio Juan Romero Rivas director rcristal870AM hombre bueno siempre mostro apertura pluralismo radio descanse Paz abrazo fuerte consuelo familias hora pesar,2019-04-28
Francisco,Jimenez Sanchez,fcojimenez21,Hoy fallecio Julio Juan Romero Rivas director rcristal870AM hombre bueno siempre mostro apertura pluralismo radio descanse Paz abrazo fuerte consuelo familiares hora pesar,2019-04-28
Francisco,Jimenez Sanchez,fcojimenez21,Batalla tras batalla libertad lucha respaldo presidente jguaido pueblo venezolano Dios bendiga Venezuela,2019-04-30
Francisco,Jimenez Sanchez,fcojimenez21,Feliz DiaDelTrabajo aquellos esfuerzo dedicacion aportan construir mejor Ecuador cada dia 1deMayo DiaDelTrabajador,2019-05-01
Francisco,Jimenez Sanchez,fcojimenez21,Hoy ucasagrande Conversatorio Reformas Codigo Democracia expuesto LuisVerdesotoo1 Apreciamos espacio discusion dejamos claro necesitamos sistema electoral transparente eficiente,2019-05-10
Francisco,Jimenez Sanchez,fcojimenez21,fuerte abrazo todas madres dia capacidad amar incondicionalmente entrega compromiso familia especial feliz dia mama acompanado siempre cada momento vida FelizDiaDeLaMadre,2019-05-12
Francisco,Jimenez Sanchez,fcojimenez21,Arrastramos deficit instititucional agudizado correismo sistema pesos contrapesos destruido radiocentroec,2019-05-13
Francisco,Jimenez Sanchez,fcojimenez21,invito sintonizar manana entrevista superk800radio CREO21 Guayaquil,2019-05-15
Francisco,Jimenez Sanchez,fcojimenez21,Pongamos practica 3R planeta necesita DiaMundialDelReciclaje DiaReciclajeEC,2019-05-17
