nombre,apellidos,tweet_screen_name,tweet_text,tweet_date
Francisco,Jimenez Sanchez,fcojimenez21,Seguimos recorriendo Guayaquil Mercado Santa Teresita Parroquia Febres Cordero presentando propuesta comerciantes sector Vamos potenciar infraestructura mercados darles connotacion turistica ElGuayaquilQueTuQuieres,2019-02-19
Francisco,Jimenez Sanchez,fcojimenez21,Radio RadioLaPrensa 100 1 FM VIVO conversando propuestas ElGuayaquilQueTuQuieres JimenezAlcalde VotaTodoCREO21,2019-02-19
Francisco,Jimenez Sanchez,fcojimenez21,Vamos organizar ciudad 10 zonas cada Unidad Municipal Independiente presupuesto propio elaborado propuestas funcion buscar progreso guayaquilenos RadioLaPrensa ElGuayaquilQueTuQuieres JimenezAlcalde VotaTodoCREO21,2019-02-19
Francisco,Jimenez Sanchez,fcojimenez21,realidades duras Guayaquil veces cuesta aceptarlas vamos mejorarlas Queremos construir Guayaquil ilusiona RadioLaPrensa,2019-02-19
Francisco,Jimenez Sanchez,fcojimenez21,Gracias recibirme minutos conversar vida futbol pasion comparto pequeno superk800radio,2019-02-19
Francisco,Jimenez Sanchez,fcojimenez21,radio forever925sintonicen 92 5 FM pueden ver entrevista VIVO via FacebookLive,2019-02-19
Francisco,Jimenez Sanchez,fcojimenez21,Amigos Manana DebateGuayaco lacamaragye LaPosta Ecu presentando guayaquilenos propuestas ElGuayaquilQueTuQuieres Via FacebookLive Cuentanos temas gustaria debata DebateAlcaldes,2019-02-20
Francisco,Jimenez Sanchez,fcojimenez21,Hoy llevara cabo debate candidatos Alcaldes Guayaquil organizado Camara Comercio CynthiaViteri6 jimmyjairala negado asistir actitud antidemocratica falta respeto votantes,2019-02-20
Francisco,Jimenez Sanchez,fcojimenez21,Hoy llevara cabo debate candidatos Alcaldes Guayaquil organizado Camara Comercio CynthiaViteri6 jimmyjairala negado asistir actitud antidemocratica falta respeto votantes,2019-02-20
Francisco,Jimenez Sanchez,fcojimenez21,Candidato debate merece voto VotaTodoCREO21,2019-02-20
Francisco,Jimenez Sanchez,fcojimenez21,Amigos Hoy 20h00 presentes VIVO via streaming DebateGuayaco lacamaragye LaPosta Ecu HT oficial JimenezAlcalde,2019-02-20
Francisco,Jimenez Sanchez,fcojimenez21,listos breves momentos arranca DebateGuayaco lacamaragye LaPosta Ecu JimenezAlcalde CREOEcuador,2019-02-21
Francisco,Jimenez Sanchez,fcojimenez21,fcojimenez21 partido CREOEcuador tercero llegar DebateGuayaco Escucha propuestas hoy 20 Feb ViaStreaming 20h00 FbLive YouTube FelizMiercoles,2019-02-21
Francisco,Jimenez Sanchez,fcojimenez21,Vamos bajar multas transito desproporcionadas 70 JimenezAlcalde DebateGuayaco lacamaragye LaPosta Ecu CREOEcuador,2019-02-21
Francisco,Jimenez Sanchez,fcojimenez21,Vamos organizar ciudad 10 zonas cada Unidad Municipal Independiente presupuesto propio JimenezAlcalde DebateGuayaco lacamaragye LaPosta Ecu CREOEcuador,2019-02-21
Francisco,Jimenez Sanchez,fcojimenez21,Felicito candidatos asistieron hoy debate critico frontalmente asistieron CynthiaViteri6 jimmyjairala quitarle oportunidad guayaquilenos conocer propuestas,2019-02-21
Francisco,Jimenez Sanchez,fcojimenez21,Candidato debate merece voto JimenezAlcalde DebateGuayaco CREOEcuador,2019-02-21
Francisco,Jimenez Sanchez,fcojimenez21,Vamos recuperar navegabilidad Rio Guayas JimenezAlcalde DebateGuayaco lacamaragye LaPosta Ecu CREOEcuador,2019-02-21
Francisco,Jimenez Sanchez,fcojimenez21,voy ser Alcalde EMPLEO JimenezAlcalde DebateGuayaco,2019-02-21
Francisco,Jimenez Sanchez,fcojimenez21,candidato fcojimenez21 GANADOR DEBATEGUAYACO sera NUEVO ALCALDE Guayaquil hizo TurnDownForWhat candidatos,2019-02-21
Francisco,Jimenez Sanchez,fcojimenez21,vision futuro ElGuayaquilQueTuQuieres si posible JimenezAlcalde DebateGuayaco,2019-02-21
Francisco,Jimenez Sanchez,fcojimenez21,Vamos bajar multas transito 70 ElGuayaquilQueTuQuieres JimenezAlcalde DebateGuayaco,2019-02-21
Francisco,Jimenez Sanchez,fcojimenez21,DebateGuayaco fcojimenez21 GANADOR Excelentes propuestas JimenezAlcalde VotaTodoCREO21 ElGuayaquilQueTuQuieres todoslecopianaFrancisco,2019-02-21
Francisco,Jimenez Sanchez,fcojimenez21,Gracias apoyo noche Cumplimos guayaquilenos presentando propuestas DebateGuayaco Gracias lacamaragye LaPosta Ecu invitacion JimenezAlcalde VotaTodoCREO21,2019-02-21
Francisco,Jimenez Sanchez,fcojimenez21,Gracias apoyo noche Cumplimos guayaquilenos presentando propuestas DebateGuayaco Gracias lacamaragye LaPosta Ecu invitacion JimenezAlcalde VotaTodoCREO21,2019-02-21
Francisco,Jimenez Sanchez,fcojimenez21,Agenda actividades jueves 21 febrero ElGuayaquilQueTuQuieres JimenezAlcalde VotaTodoCREO21,2019-02-21
Francisco,Jimenez Sanchez,fcojimenez21,VIVO 680radioatalaya pueden acceder entrevista via FacebookLive siguiente link,2019-02-21
Francisco,Jimenez Sanchez,fcojimenez21,proponemos cosas ejemplo Metro Fluvial complemento transporte masivo ciudad Ofrecemos soluciones sencillas buscan impactar positivamente calidad vida guayaquilenos 680radioatalaya,2019-02-21
Francisco,Jimenez Sanchez,fcojimenez21,problematica drogas vamos trabajar 3 ejes Prevencion rehabilitacion reinsercion Construiremos Polideportivos Municipales alejar chicos drogas centros rehabilitacion implementaremos Bolsa Empleo Municipal 680radioatalaya,2019-02-21
Francisco,Jimenez Sanchez,fcojimenez21,Vamos bajar multas transito 70 busco combinar multas razonables educacion vial trabajo comunitario ConversatorioAER ElGuayaquilQueTuQuieres JimenezAlcalde VotaTodoCREO21,2019-02-21
Francisco,Jimenez Sanchez,fcojimenez21,Vamos lograr obra municipal llegue sectores ciudad vamos organizar ciudad 10 zonas cada Unidad Municipal Independiente presupuesto propio ConversatorioAER ElGuayaquilQueTuQuieres JimenezAlcalde VotaTodoCREO21,2019-02-21
Francisco,Jimenez Sanchez,fcojimenez21,Policia Metropolitana trabajara directamente colaboracion Policia Nacional patrullaje ciudad prevencion represion delitos criterio cercania organizara ciudad ConversatorioAER JimenezAlcalde VotaTodoCREO21,2019-02-21
Francisco,Jimenez Sanchez,fcojimenez21,juventud necesita lugares puedan desarrollar potencial mantenerse alejados drogas ElGuayaquilQueTuQuieres construiremos Polideportivos Municipales JimenezAlcalde VotaTodoCREO21,2019-02-21
Francisco,Jimenez Sanchez,fcojimenez21,Candidato debate merece voto VotaTodoCREO21 JimenezAlcalde CREOEcuador,2019-02-21
Francisco,Jimenez Sanchez,fcojimenez21,tarde Fortin Parroquia Tarqui recorriendo sector presentando propuesta Vamos lograr obra municipal llegue sectores ciudad ElGuayaquilQueTuQuieres JimenezAlcalde VotaTodoCREO21,2019-02-22
Francisco,Jimenez Sanchez,fcojimenez21,tarde Fortin Parroquia Tarqui recorriendo sector presentando propuesta Vamos lograr obra municipal llegue sectores ciudad ElGuayaquilQueTuQuieres JimenezAlcalde VotaTodoCREO21,2019-02-22
Francisco,Jimenez Sanchez,fcojimenez21,Atencion noche 20h00 transmision FacebookLive semanal junto Silviafabara acompanara conversar propuestas esperamos,2019-02-22
Francisco,Jimenez Sanchez,fcojimenez21,Amigos VIVO via FacebookLive conversando debate propuestas,2019-02-22
Francisco,Jimenez Sanchez,fcojimenez21,voy ser Alcalde EMPLEO ElGuayaquilQueTuQuieres JimenezAlcalde VotaTodoCREO21,2019-02-22
Francisco,Jimenez Sanchez,fcojimenez21,Manana 11h00 junto PolyUgarteG LassoGuillermo Flor Bastion Encuentro Mujeres Proyecto Emprende actua mujer VotaTodoCREO21,2019-02-22
Francisco,Jimenez Sanchez,fcojimenez21,Agenda actividades viernes 22 febrero ElGuayaquilQueTuQuieres JimenezAlcalde VotaTodoCREO21,2019-02-22
Francisco,Jimenez Sanchez,fcojimenez21,Agenda actividades viernes 22 febrero ElGuayaquilQueTuQuieres JimenezAlcalde VotaTodoCREO21,2019-02-22
Francisco,Jimenez Sanchez,fcojimenez21,tema habitacional Guayaquil afrontar tema legalizaciones estan pendientes sectores Monte Sinai Ciudad Dios lugares necesitan ser regularizados superk800radio,2019-02-22
Francisco,Jimenez Sanchez,fcojimenez21,Organizaremos ciudad 10 zonas cada unidad municipal independiente presupuesto propio implementaremos Polideportivos Municipales chicos hagan deporte ademas actividades recreativas jovenes adultos superk800radio,2019-02-22
Francisco,Jimenez Sanchez,fcojimenez21,Vamos construir Alcaldia rostro humano cercania obra municipal llegue sectores ciudad superk800radio,2019-02-22
Francisco,Jimenez Sanchez,fcojimenez21,guayaquilenos necesitan facilitemos empleo ElGuayaquilQueTuQuieres JimenezAlcalde VotaTodoCREO21,2019-02-22
Francisco,Jimenez Sanchez,fcojimenez21,manana Flor Bastion encuentro mujeres proyecto Emprende actua mujer junto PolyUgarteG equipo candidatos concejal alcaldia vamos apoyar emprendimiento Gracias invitacion ElGuayaquilQueTuQuieres,2019-02-22
Francisco,Jimenez Sanchez,fcojimenez21,VIVO Radio Comunicacion Efectiva via online,2019-02-22
Francisco,Jimenez Sanchez,fcojimenez21,candidato alcaldia Guayaquil fcojimenez21 enfatiza construira polideportivos alejar jovenes drogas,2019-02-22
Francisco,Jimenez Sanchez,fcojimenez21,voy fortalecer comercio tarde viernes recorrimos Bahia Guayaquil Gracias comerciantes gran recibimiento ElGuayaquilQueTuQuieres JimenezAlcalde VotaTodoCREO21,2019-02-23
Francisco,Jimenez Sanchez,fcojimenez21,Vamos implementar Metro Fluvial sistema transporte moderno agradable ElGuayaquilQueTuQuieres JimenezAlcalde VotaTodoCREO21,2019-02-23
Francisco,Jimenez Sanchez,fcojimenez21,tarde noche sabado recorrimos hermoso Barrio Penas lluvia detiene camino lograr ElGuayaquilQueTuQuieres,2019-02-24
Francisco,Jimenez Sanchez,fcojimenez21,Vamos construir administracion municipal mas cercana moderna segura ElGuayaquilQueTuQuieres JimenezAlcalde VotaTodoCREO21,2019-02-24
Francisco,Jimenez Sanchez,fcojimenez21,manana domingo visitamos Mercado Sauces IX Gran recibimiento GRACIAS escuchar propuestas ElGuayaquilQueTuQuieres JimenezAlcalde VotaTodoCREO21,2019-02-24
Francisco,Jimenez Sanchez,fcojimenez21,tarde realizamos minga Estero Salado alcaldia vamos recuperarlo base 3 criterios Oxigenacion agua restauracion redireccionamiento alcantarillado cumplimiento regulaciones medioambientales ElGuayaquilQueTuQuieres JimenezAlcalde,2019-02-24
Francisco,Jimenez Sanchez,fcojimenez21,Si CREO Vota CREO 21 ElGuayaquilQueTuQuieres JimenezAlcalde,2019-02-25
Francisco,Jimenez Sanchez,fcojimenez21,guayaquilenos necesitan facilitemos empleo ElGuayaquilQueTuQuieres JimenezAlcalde VotaTodoCREO21,2019-02-25
Francisco,Jimenez Sanchez,fcojimenez21,Hoy 18h00 VIVO ucsg tv canal 42 UHF Tv Cable canal 74 Claro TV canal 42 Univisa canal 318 Tambien pueden acceder via streaming,2019-02-25
Francisco,Jimenez Sanchez,fcojimenez21,Estero necesita necesitamos Estero ElGuayaquilQueTuQuieres JimenezAlcalde VotaTodoCREO21,2019-02-26
Francisco,Jimenez Sanchez,fcojimenez21,VIVO Ecuador Decide 2019 ucsg tv canal 42 UHF Tv Cable canal 74 Claro TV canal 42 Univisa canal 318 Tambien pueden acceder via streaming,2019-02-25
Francisco,Jimenez Sanchez,fcojimenez21,EcuadorDecide2019 entrevistado Ab Francisco Jimenez Sanchez candidato alcadia Guayaquil fcojimenez21,2019-02-25
Francisco,Jimenez Sanchez,fcojimenez21,noche semaforo Policentro saludando transitaban pie vehiculos ElGuayaquilQueTuQuieres cada vez mas cerca JimenezAlcalde VotaTodoCREO21,2019-02-26
Francisco,Jimenez Sanchez,fcojimenez21,Agenda actividades martes 26 febrero ElGuayaquilQueTuQuieres JimenezAlcalde VotaTodoCREO21,2019-02-26
Francisco,Jimenez Sanchez,fcojimenez21,Buenos dias VIVO radioi99 sintonicen 98 9 FM via FacebookLive,2019-02-26
Francisco,Jimenez Sanchez,fcojimenez21,candidatura distinta concebi escritorio sino caminando gente escuchando necesidades sentir presente proyectarse futuro radioi99 ElGuayaquilQueTuQuieres JimenezAlcalde VotaTodoCREO21,2019-02-26
Francisco,Jimenez Sanchez,fcojimenez21,Guayaquil vivido control politico eficiencia servicios quedado atras comparacion ciudades mundo proponemos organizacion ciudad 10 zonas cada presupuesto propio radioi99,2019-02-26
Francisco,Jimenez Sanchez,fcojimenez21,trata mirar pasado trata medir presente mirar futuro fcojimenez21 candidato Alcaldia Guayaquil CREOEcuador,2019-02-26
Francisco,Jimenez Sanchez,fcojimenez21,Vamos aumentar unidades Metrovia terminar Troncales 4 5 Ademas recuperaremos navegabilidad Rio Guayas Metro Fluvial radioi99,2019-02-26
Francisco,Jimenez Sanchez,fcojimenez21,Vamos inundar canchas deportivas ciudad Polideportivos Municipales medio alejar jovenes drogas mantenerlos ocupados practicas positivas construir disciplina radioi99,2019-02-26
Francisco,Jimenez Sanchez,fcojimenez21,comercio informal emprendimiento estan relacionados Guayaquil ciudad emprendedores legalizar corredores comerciales repontenciar mercados obra debe ir funcion gente fcojimenez21,2019-02-26
Francisco,Jimenez Sanchez,fcojimenez21,ciudad explotar rio Guayas habilitar 7 muelles ciudad Guayaquil conectar cantones vecinos fcojimenez21,2019-02-26
Francisco,Jimenez Sanchez,fcojimenez21,Proponemos organizacion Guayaquil nas distritalizada decentralizar presupuesto obras fcojimenez21,2019-02-26
Francisco,Jimenez Sanchez,fcojimenez21,noche VIVO via FacebookLive vamos conversar vamos recuperar Estero Salado pierdas ElGuayaquilQueTuQuieres JimenezAlcalde VotaTodoCREO21,2019-02-26
Francisco,Jimenez Sanchez,fcojimenez21,LebedJuan Hola Juan Hace meses hicimos video opinion respecto Saludos,2019-02-26
Francisco,Jimenez Sanchez,fcojimenez21,Hoy radioi99en programa Aprendiendo Valientes RafaellaM95 Muchas gracias invitacion,2019-02-26
Francisco,Jimenez Sanchez,fcojimenez21,Amigos Pueden ver FacebookLive noche siguiente link,2019-02-27
Francisco,Jimenez Sanchez,fcojimenez21,tarde recorrimos Avenida Victor Emilio Estrada Urdesa junto GomezAlexV Silviafabara Vamos lograr juntos ElGuayaquilQueTuQuieres,2019-02-27
Francisco,Jimenez Sanchez,fcojimenez21,Agenda actividades miercoles 27 febrero ElGuayaquilQueTuQuieres JimenezAlcalde VotaTodoCREO21,2019-02-27
Francisco,Jimenez Sanchez,fcojimenez21,ATENCION Hoy 11h00 convocamos medios RUEDA PRENSA Central CREOEcuador Av Quito Gomez Rendon denunciar hechos sucedidos Puente Unidad Nacional noche ayer,2019-02-27
Francisco,Jimenez Sanchez,fcojimenez21,invito ver RUEDA PRENSA hechos noche ayer Puente Unidad Nacional via FacebookLive siguiente link,2019-02-27
Francisco,Jimenez Sanchez,fcojimenez21,noche ayer acto prepotencia propaganda puente Unidad Nacional retirada Municipio Guayaquil Justicia Vigilancia solo dejaron propaganda 6 35 Abro hilo,2019-02-27
Francisco,Jimenez Sanchez,fcojimenez21,suceso recorrido tarde noche ayer Urdesa terminando mismo Guayarte increpo presencia solicito retirarnos pasando Acaso Guayaquil dueno guayaquilenos,2019-02-27
Francisco,Jimenez Sanchez,fcojimenez21,Hoy MasAllaDeLasUrnas acompanara Francisco Jimenez fcojimenez21 candidato Alcalde Guayaquil movimiento CREO Sintonizanos fmradiofuego 106 5 fm,2019-02-27
Francisco,Jimenez Sanchez,fcojimenez21,VIVO FMRadioFuego marielaviteri sintonicen 106 5 FM tambien via streaming siguiente link,2019-02-27
Francisco,Jimenez Sanchez,fcojimenez21,abuso,2019-02-27
Francisco,Jimenez Sanchez,fcojimenez21,gente cree duena ciudad Quieres saber paso Guayarte Enterate siguiente video ElGuayaquilQueTuQuieres JimenezAlcalde VotaTodoCREO21,2019-02-27
Francisco,Jimenez Sanchez,fcojimenez21,VIVO RadioRomanceFMen programa ContraLaPared sintonicen 90 1 FM tambien pueden acceder via FacebookLive siguiente link,2019-02-27
Francisco,Jimenez Sanchez,fcojimenez21,completar red Metrovia actualmente 400 unidades aumentaremos 500 unidades Terminaremos Troncales 4 5 lado implementaremos Metro Fluvial medio transporte asi recuperaremos navegabilidad Rio Guayas RadioRomanceFM,2019-02-27
Francisco,Jimenez Sanchez,fcojimenez21,24 marzo oportunidad dejar represion pasado ElGuayaquilQueTuQuieres JimenezAlcalde VotaTodoCREO21,2019-02-28
Francisco,Jimenez Sanchez,fcojimenez21,Buenos dias radio Tropicana ec sintonicen 98 9 FM ElGuayaquilQueTuQuieres JimenezAlcalde VotaTodoCREO21,2019-02-28
Francisco,Jimenez Sanchez,fcojimenez21,Vamos implementar Metro Fluvial servicio transporte masivo Guayaquil proyecto puede implementar 3 4 meses aportara descongestionar trafico ciudad Tropicana ec,2019-02-28
Francisco,Jimenez Sanchez,fcojimenez21,Vamos reducir multas transito desproporcionadas 70 afectan exageradamente bolsillo guayaquilenos Tropicana ec ElGuayaquilQueTuQuieres JimenezAlcalde VotaTodoCREO21,2019-02-28
Francisco,Jimenez Sanchez,fcojimenez21,Vamos reducir multas transito desproporcionadas 70 afectan exageradamente bolsillo guayaquilenos complementaremos educacion vial horas trabajo comunitario Tropicana ec ElGuayaquilQueTuQuieres JimenezAlcalde VotaTodoCREO21,2019-02-28
Francisco,Jimenez Sanchez,fcojimenez21,HOY noche DebatePorGuayaquil sera transmitido teleramaec via streaming eluniversocom GrupoFARO,2019-02-28
Francisco,Jimenez Sanchez,fcojimenez21,Guayaquil artista ElGuayaquilQueTuQuieres,2019-02-28
Francisco,Jimenez Sanchez,fcojimenez21,GRABA celular numero 099 764 8745 escribenos WhatsApp nombre apellido agregaremos Linea Oficial Francisco Jimenez Recibiras contenido EXCLUSIVO Francisco dias ademas podras contarnos ElGuayaquilQueTuQuieres,2019-02-28
Francisco,Jimenez Sanchez,fcojimenez21,HOY noche DebatePorGuayaquil sera transmitido teleramaec via streaming eluniversocom GrupoFARO ec decide,2019-02-28
Francisco,Jimenez Sanchez,fcojimenez21,HOY noche 21h00 DebatePorGuayaquil transmitido teleramaec via streaming eluniversocom ec decide GrupoFARO,2019-02-28
Francisco,Jimenez Sanchez,fcojimenez21,Arrancamos DebatePorGuayaquil Conoce perfil academico JimenezAlcalde ElGuayaquilQueTuQuieres,2019-03-01
Francisco,Jimenez Sanchez,fcojimenez21,Arrancamos DebatePorGuayaquil Conoce perfil academico JimenezAlcalde ElGuayaquilQueTuQuieres,2019-03-01
Francisco,Jimenez Sanchez,fcojimenez21,Guayaquil proyectarse futuro acercar obra municipal gente vamos organizar ciudad 10 zonas cada Unidad Municipal Independiente presupuesto propio DebatePorGuayaquil JimenezAlcalde,2019-03-01
Francisco,Jimenez Sanchez,fcojimenez21,problema drogas trabajaremos 3 ejes PREVENCION programas deportivos culturales REHABILITACION Centros Municipales subsidiados REINSERCION Bolsa Municipal Empleo programas emprendimiento DebatePorGuayaquil JimenezAlcalde,2019-03-01
Francisco,Jimenez Sanchez,fcojimenez21,voy ser Alcalde EMPLEO DebatePorGuayaquil JimenezAlcalde,2019-03-01
Francisco,Jimenez Sanchez,fcojimenez21,economia mueve incentivos desincentivos propuestas buscan alternativas jovenes superen DebatePorGuayaquil JimenezAlcalde,2019-03-01
Francisco,Jimenez Sanchez,fcojimenez21,economia mueve incentivos desincentivos propuestas buscan alternativas jovenes empleo DebatePorGuayaquil JimenezAlcalde,2019-03-01
Francisco,Jimenez Sanchez,fcojimenez21,Guayaquil necesita transporte publico calidad diversificado vamos implementar Metro Fluvial DebatePorGuayaquil JimenezAlcalde,2019-03-01
Francisco,Jimenez Sanchez,fcojimenez21,puede hacer propuesta transporte fluvial investigacion previa si hecho Escucha detalles DebatePorGuayaquil JimenezAlcalde,2019-03-01
Francisco,Jimenez Sanchez,fcojimenez21,mensaje acerca adolescentes mas importante informarse construir futuro hace apoyandolos olvidandolos DebatePorGuayaquil JimenezAlcalde,2019-03-01
Francisco,Jimenez Sanchez,fcojimenez21,vision futuro Guayaquil DebatePorGuayaquil JimenezAlcalde Visiten conozcan todas propuestas,2019-03-01
Francisco,Jimenez Sanchez,fcojimenez21,Agenda actividades 1 marzo ElGuayaquilQueTuQuieres JimenezAlcalde VotaTodoCREO21,2019-03-01
Francisco,Jimenez Sanchez,fcojimenez21,Implementaremos Metro Fluvial complemento medio transporte masivo Guayaquil Ademas reduciremos multas transito 70 complementado programas educacion vial horas trabajo comunitario Caravana750,2019-03-01
Francisco,Jimenez Sanchez,fcojimenez21,lograr obra municipal llegue sectores ciudad vamos organizar ciudad 10 zonas cada Unidad Municipal Independiente presupuesto propio Caravana750,2019-03-01
Francisco,Jimenez Sanchez,fcojimenez21,lograr obra municipal llegue sectores Guayaquil vamos organizar ciudad 10 zonas cada Unidad Municipal Independiente presupuesto propio Caravana750,2019-03-01
Francisco,Jimenez Sanchez,fcojimenez21,Vamos conciliar orden ciudad progreso merece gente Implementaremos corredores comerciales calles existe comercio censados carnetizados modulos plegables comerciantes desarrollen actividad comercial radioestrellafm,2019-03-01
Francisco,Jimenez Sanchez,fcojimenez21,radio forever925 VIVO sintonicen 92 5 FM via streaming,2019-03-01
Francisco,Jimenez Sanchez,fcojimenez21,voy ser alcalde EMPLEO Guayaquil solo ciudad trabajadores sino tambien emprendedores Vamos mejorar condiciones empleo guayaquilenos forever925 ElGuayaquilQueTuQuieres JimenezAlcalde VotaTodoCREO21,2019-03-01
Francisco,Jimenez Sanchez,fcojimenez21,Policia Metropolitana tendra rol apoyo cercano ciudadanos Trabajara coordinacion constante Policia Nacional base criterios zonificacion ciudad forever925 ElGuayaquilQueTuQuieres JimenezAlcalde VotaTodoCREO21,2019-03-01
Francisco,Jimenez Sanchez,fcojimenez21,VIVO via FacebookLive Canal TV Digital,2019-03-01
Francisco,Jimenez Sanchez,fcojimenez21,Quieres conocer propuestas Mira siguiente video Visita pagina web ElGuayaquilQueTuQuieres JimenezAlcalde VotaTodoCREO21,2019-03-01
Francisco,Jimenez Sanchez,fcojimenez21,tarde viernes recorrimos Monte Sinai PuertaAPuerta alcaldia vamos lograr obra municipal llegue sectores ciudad ElGuayaquilQueTuQuieres JimenezAlcalde VotaTodoCREO21,2019-03-01
Francisco,Jimenez Sanchez,fcojimenez21,Queremos Guayaquil conectado ElGuayaquilQueTuQuieres JimenezAlcalde VotaTodoCREO21,2019-03-02
Francisco,Jimenez Sanchez,fcojimenez21,peaje Via Costa Manejen cuidado Saludanos si quieres CAMBIO Guayaquil ElGuayaquilQueTuQuieres JimenezAlcalde,2019-03-02
Francisco,Jimenez Sanchez,fcojimenez21,Gran actividad manana tarde peaje Via Costa Aprovechamos saludar viajeros desearles buen viaje gente quiere CAMBIO ElGuayaquilQueTuQuieres JimenezAlcalde VotaTodoCREO21,2019-03-02
Francisco,Jimenez Sanchez,fcojimenez21,Vamos recuperar Estero Salado ElGuayaquilQueTuQuieres,2019-03-03
Francisco,Jimenez Sanchez,fcojimenez21,Vamos recuperar Estero Salado ElGuayaquilQueTuQuieres,2019-03-03
Francisco,Jimenez Sanchez,fcojimenez21,Vamos construir administracion municipal mas cercana moderna segura ElGuayaquilQueTuQuieres JimenezAlcalde VotaTodoCREO21,2019-03-04
Francisco,Jimenez Sanchez,fcojimenez21,Vamos llenar ciudad arboles ElGuayaquilQueTuQuieres JimenezAlcalde VotaTodoCREO21,2019-03-05
Francisco,Jimenez Sanchez,fcojimenez21,Agenda actividades miercoles 6 marzo ElGuayaquilQueTuQuieres JimenezAlcalde VotaTodoCREO21,2019-03-06
Francisco,Jimenez Sanchez,fcojimenez21,Buenos dias ecuantena VIVO sintonicen 1030 AM tambien via streaming,2019-03-06
Francisco,Jimenez Sanchez,fcojimenez21,Abuso olvido dos palabras ecuchado recorridos justamente vamos cambiar mas abuso maltrato comerciantes mas olvido lograremos obra llegue sectores ciudad ecuantena,2019-03-06
Francisco,Jimenez Sanchez,fcojimenez21,Guayaquil ciudad proyectarse futuro mas empleo medidas inteligentes mirada humana ganas generar cambio mas grandes cualquier obstaculo camino ecuantena,2019-03-06
Francisco,Jimenez Sanchez,fcojimenez21,pueden esperar trabajo comprension problemas aquejan Guayaquil hacer ciudad verdadero compromiso guayaquilenos ecuantena ElGuayaquilQueTuQuieres JimenezAlcalde VotaTodoCREO21,2019-03-06
Francisco,Jimenez Sanchez,fcojimenez21,hecho vamos seguir haciendo PorLaFamilia SinDrogasEsMejor SigueYolandaSigue YolandaConcejal distrito 2 JimenezAlcalde PolyPrefecta2019 PolyUgarteG fcojimenez21 LassoGuillermo CREOEcuador,2019-03-06
Francisco,Jimenez Sanchez,fcojimenez21,680radioatalaya VIVO Hora Pocho pochoharb ferfloma pueden verlo via FacebookLive siguiente link,2019-03-06
Francisco,Jimenez Sanchez,fcojimenez21,modelo administracion actual cumplio ciclo solo edificio puede administrar ciudad vamos organizar ciudad 10 zonas cada Unidad Municipal Independiente presupuesto propio 680radioatalaya ElGuayaquilQueTuQuieres,2019-03-06
Francisco,Jimenez Sanchez,fcojimenez21,modelo administracion actual cumplio ciclo solo edificio puede administrar Guayaquil vamos organizar ciudad 10 zonas cada Unidad Municipal Independiente presupuesto propio 680radioatalaya ElGuayaquilQueTuQuieres,2019-03-06
Francisco,Jimenez Sanchez,fcojimenez21,Si Guayaquil 47 Mercados Municipales debemos tener 47 guarderias Necesitamos red guarderias madres trabajan dia dia necesitan tener seguridad hijos esten buenas manos 680radioatalaya ElGuayaquilQueTuQuieres JimenezAlcalde,2019-03-06
Francisco,Jimenez Sanchez,fcojimenez21,manana Garcia Aviles Colon junto candidatos concejal zoilitagomez Silviafabara GomezAlexV LemosGaray JeremyRubioE rommelramosec DrLuisSerranoF presentando propuestas ciudadanos ElGuayaquilQueTuQuieres JimenezAlcalde,2019-03-06
Francisco,Jimenez Sanchez,fcojimenez21,Hoy 20h00 VIVO via FacebookLive conversando recientes inundaciones Guayaquil contestando todas inquietudes espero ElGuayaquilQueTuQuieres JimenezAlcalde VotaTodoCREO21,2019-03-06
Francisco,Jimenez Sanchez,fcojimenez21,Multas desproporcionadas multas justas 24 marzo DECIDETE cambiar VotaTodoCREO21 JimenezAlcalde ElGuayaquilQueTuQuieres,2019-03-06
Francisco,Jimenez Sanchez,fcojimenez21,9 marzo acompanara CastigoDivinoGuayaco fcojimenez21 candidato Alcadia Guayaquil Haz reservas,2019-03-06
Francisco,Jimenez Sanchez,fcojimenez21,tarde Isla Trintaria PuertaAPuerta presentando propuesta habitantes sector Gracias recibirnos carino esperanza CAMBIO ElGuayaquilQueTuQuieres JimenezAlcalde VotaTodoCREO21,2019-03-06
Francisco,Jimenez Sanchez,fcojimenez21,Agenda actividades jueves 7 marzo ElGuayaquilQueTuQuieres JimenezAlcalde VotaTodoCREO21,2019-03-07
Francisco,Jimenez Sanchez,fcojimenez21,Buenos dias manana Av Machala Padre Solano saludando presentando propuesta guayaquilenos temprano salen trabajar ElGuayaquilQueTuQuieres JimenezAlcalde VotaTodoCREO21,2019-03-07
Francisco,Jimenez Sanchez,fcojimenez21,VIVO radioelite9971 sintonicen 99 7 FM via streaming siguiente link,2019-03-07
