nombre,apellidos,tweet_screen_name,tweet_text,tweet_date
Martha,Macias,cedeno_marth,Hoy CREsatelital periodistas Nabor Reyes Ana Laura Grimaldi Gracias espacio socializar plan trabajo 24 marzo vota mujer preparada ser Alcaldesa Guayaquil DeUnSoloPlumazoVotaTodo3 MarthaMaciasAlcaldesa,2019-02-20
Martha,Macias,cedeno_marth,Gracias Radio ucatolicagye permitirnos llegar ciudadania propuestas 24 marzo DeUnSoloPlumazoVotaTodo3 MarthaMaciasAlcaldesa GuayaquilenoMiCompromisoEsContigo,2019-02-20
Martha,Macias,cedeno_marth,Hoy recorrimos IslaTrinitaria cuanto falta hacer sector haremos llegue Alcaldia gracias apoyo avanzamos mas fuerza DeUnSoloPlumazoVotaTodo3 MarthaMaciasAlcaldesa Guayaquil,2019-02-20
Martha,Macias,cedeno_marth,Hoy recorrimos IslaTrinitaria cuanto falta hacer sector haremos llegue Alcaldia gracias apoyo avanzamos mas fuerza DeUnSoloPlumazoVotaTodo3 MarthaMaciasAlcaldesa Guayaquil,2019-02-20
Martha,Macias,cedeno_marth,Recorriendo IslaTrinitaria cuanto falta hacer sector haremos llegue Alcaldia gracias apoyo avanzamos mas fuerza DeUnSoloPlumazoVotaTodo3 MarthaMaciasAlcaldesa Guayaquil,2019-02-20
Martha,Macias,cedeno_marth,Cuanto falta hacer IslaTrinitaria haremos llegue Alcaldia gracias apoyo ustedes avanzamos mas fuerza DeUnSoloPlumazoVotaTodo3 MarthaMaciasAlcaldesa Guayaquil,2019-02-20
Martha,Macias,cedeno_marth,Hoy RadioRumbaEc gracias espacio presentar propuestas candidata AlcaldiaDeGuayaquil MarthaMaciasAlcaldesa DeUnSoloPlumazoVota3 MiCompromisoEsContigoGuayaquileno,2019-02-21
Martha,Macias,cedeno_marth,,2019-02-21
Martha,Macias,cedeno_marth,,2019-02-21
Martha,Macias,cedeno_marth,Vamos creciendo socialcristianos miedo amenazan obligan gente ir marchas voto secreto 24 marzo DeUnSoloPlumazoVotaTodo3 hora mujer pueblo MarthaMaciasAlcaldesa,2019-02-21
Martha,Macias,cedeno_marth,Mercadito sector Peca comerciantes van sumando campana saben Martha Macias mujer pueblo Gracias recibirnos apoyarnos 24 marzo vota DeUnSoloPlumazoVotaTodo3 MarthaMaciasAlcaldesa,2019-02-21
Martha,Macias,cedeno_marth,mercadito sector Peca comerciantes van sumando campana saben Martha Macias mujer pueblo Gracias recibirnos apoyarnos 24 marzo vota DeUnSoloPlumazoVotaTodo3 MarthaMaciasAlcaldesa,2019-02-21
Martha,Macias,cedeno_marth,Mercadito sector Peca comerciantes van sumando campana saben Martha Macias mujer pueblo Gracias recibirnos apoyarnos 24 marzo vota DeUnSoloPlumazoVotaTodo3 MarthaMaciasAlcaldesa,2019-02-21
Martha,Macias,cedeno_marth,Mercadito sector Peca comerciantes van sumando campana saben Martha Macias mujer pueblo Gracias recibirnos apoyarnos 24 marzo vota DeUnSoloPlumazoVotaTodo3 MarthaMaciasAlcaldesa,2019-02-21
Martha,Macias,cedeno_marth,mercadito Peca encontramos tremendo personaje Oscar Leon ecuatoriano abrazo fuerte gracias creer palabra 24 marzo vota DeUnSoloPlumazoVotaTodo3 MarthaMaciasAlcaldesa,2019-02-21
Martha,Macias,cedeno_marth,Universidad Guayaquil seguimos compartiendo programa trabajo Alcaldesa Guayaquil 24 marzo DeUnSoloPlumazoVotaTodo3 MarthaMaciasAlcaldesa GuayaquilenoMiCompromisoEsContigo PartidoSociedadPatriotica,2019-02-22
Martha,Macias,cedeno_marth,Universidad Guayaquil seguimos compartiendo programa trabajo Alcaldesa Guayaquil 24 marzo DeUnSoloPlumazoVotaTodo3 MarthaMaciasAlcaldesa GuayaquilenoMiCompromisoEsContigo PartidoSociedadPatriotica,2019-02-22
Martha,Macias,cedeno_marth,Universidad Guayaquil seguimos compartiendo programa trabajo Alcaldesa Guayaquil 24 marzo DeUnSoloPlumazoVotaTodo3 MarthaMaciasAlcaldesa GuayaquilenoMiCompromisoEsContigo PartidoSociedadPatriotica,2019-02-22
Martha,Macias,cedeno_marth,Llegamos comedor dona Gina StellaMaris ahi Jose Jacome asamos deliciosos chuzos alitas maduros queso delicias Guayaquil querido Ahi dejamos recomendacion comida deliciosa precios pueblo DeUnSoloPlumazoVota3,2019-02-23
Martha,Macias,cedeno_marth,vamos conversando gente tradicional 29 Pancho Segura barrios 23 N 24 marzo vota mujer preparada ser Alcaldesa Guayaquil DeUnSoloPlumazoVotaTodo3 MarthaMaciasAlcaldesa,2019-02-23
Martha,Macias,cedeno_marth,Hoy iniciamos caravana pueblo tradicional 29 Pancho Segura barrios 23 N 24 marzo vota mujer preparada ser Alcaldesa Guayaquil DeUnSoloPlumazoVotaTodo3 MarthaMaciasAlcaldesa,2019-02-23
Martha,Macias,cedeno_marth,tradicional 29 Pancho Segura barrios 23 N cansa 24 marzo vota mujer preparada ser Alcaldesa Guayaquil DeUnSoloPlumazoVotaTodo3 MarthaMaciasAlcaldesa,2019-02-23
Martha,Macias,cedeno_marth,Muchas gracias CanalUnoTv espacio presentar propuestas Alcaldia Guayaquil ciudadania conoce mujer trabajadora honesta sabe Guayaquil necesita 24 marzo DeUnSoloPlumazoVotaTodo3 MarthaMaciasAlcaldesa,2019-02-23
Martha,Macias,cedeno_marth,Gracias Guayaquil apoyo fuerza dan seguir adelante Llegaremos juntos Alcaldia Guayaquil Hoy sector 19 Pedro Pablo Gomez 24 marzo DeUnSoloPlumazoVotaTodo3 MarthaMaciasAlcaldesa GuayaquilenoMiCompromisoEsContigo,2019-02-23
Martha,Macias,cedeno_marth,Seguimos paso firme junto concejales lograremos victoria sabado 23 febrero caravana alegria recorrio barios Esteros Fragata Fertisa Distrito1PSP DeUnSoloPlumazoVotaTodo3,2019-02-23
Martha,Macias,cedeno_marth,Guasmo Sur pesar lluvia recibieron presentar plan trabajo ayudarlos LucioGutierrez3,2019-02-24
Martha,Macias,cedeno_marth,Cerramos tarde sabado 23 febrero reunion enriquecedora dirigentes Distrito 1 Guasmo sur seguimos coordinando estrategias vamos seguir 24 marzo solo plumazo ganemos 3 LucioGutierrez3,2019-02-24
Martha,Macias,cedeno_marth,semilla va quedando cada rincones Guayaquuil oficialmente nueva central Fragata gracias concejales cada vez siguen abriendo puertas hogares LucioGutierrez3 MarthaMaciasAlcaldesa,2019-02-24
Martha,Macias,cedeno_marth,campana pueblo recorremos paso paso reciben alegria esperanza confian saben Martha Macias cumplira promesas Alcaldesa Guayaquil 24 marzo DeUnSoloPlumazoVotaTodo3 MarthaMaciasAlcaldesa,2019-02-25
Martha,Macias,cedeno_marth,campana pueblo recorremos paso paso reciben alegria esperanza confian saben Martha Macias cumplira promesas Alcaldesa Guayaquil 24 marzo DeUnSoloPlumazoVotaTodo3 MarthaMaciasAlcaldesa,2019-02-25
Martha,Macias,cedeno_marth,Urdenor candidatos concejales socializando plan trabajo alcaldia Guayaquil campana hacemos llegamos cada ciudadano mensaje 24 marzo DeUnSoloPlumazoVotaTodo3 MarthaMaciasAlcaldesa,2019-02-25
Martha,Macias,cedeno_marth,Hoy Urdenor candidatos concejales socializando plan trabajo alcaldiaDeGuayaquil campana hacemos llegamos cada ciudadano mensaje 24 DeUnSoloPlumazoVotaTodo3 MarthaMaciasAlcaldesa,2019-02-25
Martha,Macias,cedeno_marth,Esteros sur querida Guayaquil conversamos amas casa jovenes comerciantes gente necesitada obra municipio 24 marzo vamos elegir mujer pueblo DeUnSoloPlumazoVotaTodo3 MarthaMaciasAlcaldesa,2019-02-25
Martha,Macias,cedeno_marth,Esteros sur querida Guayaquil conversamos amas casa jovenes comerciantes gente necesitada obra municipio 24 marzo vamos elegir mujer pueblo DeUnSoloPlumazoVotaTodo3 MarthaMaciasAlcaldesa,2019-02-25
Martha,Macias,cedeno_marth,Esteros sur querida Guayaquil conversamos amas casa jovenes comerciantes gente necesitada obra municipio 24 marzo vamos elegir mujer pueblo DeUnSoloPlumazoVotaTodo3 MarthaMaciasAlcaldesa,2019-02-25
Martha,Macias,cedeno_marth,Guayaquil necesita soluciones urgentes municipio trabaje guayaquilenos apoye familia proteja ninos adolescentes DeUnSoloPlumazoVotaTodo3 MarthaMaciasAlcaldesa,2019-02-26
Martha,Macias,cedeno_marth,queremos mas ruedas moscovitas acuarios queremos servicios basicos funcionen persiga vendedor informal queremos apoyo emprendedor creditos bajos intereses DeUnSoloPlumazoVotaTodo3 MarthaMaciasAlcaldesa,2019-02-26
Martha,Macias,cedeno_marth,24 marzo DeUnSoloPlumazoVotaTodo3 MarthaMaciasAlcaldesa GuayaquilenoMiCompromisoEsContigo TuOpinionCuenta PartidoSociedadPatriotica,2019-02-26
Martha,Macias,cedeno_marth,Gracias EcuadorEnDirecto entrevista presente ciudadania plan trabajo beneficio Guayaquil DeUnSoloPlumazoVotaTodo3 MarthaMaciasAlcaldesa GuayaquilenoMiCompromisoEsContigo Distrito1PSP Distrito2PSP Distrito3PSP PartidoSociedadPatriotica,2019-02-26
Martha,Macias,cedeno_marth,unica candidata alcaldia Guayaquil propone devolverle pueblo dinero multas transito multas ATM cobrado forma ilegal 24 marzo vota mujer preparada decidida hara respetar derechos DeUnSoloPlumazoVotaTodo3,2019-02-26
Martha,Macias,cedeno_marth,vez recorriendo sectores MonteSinai mejor nadie saben hora terminar administracion socialcristiana 24 marzo vota mujer preparada decidida hara respetar derechos DeUnSoloPlumazoVotaTodo3 MarthaMaciasAlcaldesa,2019-02-26
Martha,Macias,cedeno_marth,vez recorriendo sectores MonteSinai mejor nadie saben hora terminar administracion socialcristiana 24 marzo vota mujer preparada decidida hara respetar derechos DeUnSoloPlumazoVotaTodo3 MarthaMaciasAlcaldesa,2019-02-26
Martha,Macias,cedeno_marth,Gracias FEsquel invitacion dialogo Desarrollo infraestructura ambiental Gracias LucioGutierrez3 confianza camino alcaldia Guayaquil,2019-02-26
Martha,Macias,cedeno_marth,Empezamos DialogoCiudadano candidata Alcaldia Guayaquil cedeno marth FEsquel FundacionAVINA FLACSOec cite ec FuturoLatinoame GrupoFARO GIZEcuador ODSTerritorioEc ec decide UEenEcuador,2019-02-26
Martha,Macias,cedeno_marth,naturaleza derechos campanas preventivas cuidar estero politicas claras empoderar familia derecho naturaleza Guayaquil DialogoCiudadano cedeno marth,2019-02-26
Martha,Macias,cedeno_marth,tema salud servicio publico calidad trabajo informal legalizar creditos directos emprendimiento bajas tasa interes cedeno marth DialogoCiudadano,2019-02-26
Martha,Macias,cedeno_marth,Transporte integral tarjeta Guayaquil despues 11 noche tendra transporte mismo precio vamos revisar multas cedeno marth DialogoCiudadano,2019-02-26
Martha,Macias,cedeno_marth,realiza entrega documentos elaborados Alianza DesarrolloUrbanoSostenible candidata Alcaldia Guayaquil cedeno marth FundacionAVINA FLACSOec cite ec FuturoLatinoame GrupoFARO GIZEcuador ODSTerritorioEc ec decide UEenEcuador,2019-02-26
Martha,Macias,cedeno_marth,Conozco necesidades Guayaquil solucionarlas mujer pueblo preparada capacitada mas importante vocacion social DeUnSoloPlumazoVotaTodo3 MarthaMaciasAlcaldesa GuayaquilenoMiCompromisoEsContigo LucioGutierrez3,2019-02-27
Martha,Macias,cedeno_marth,Companeros 28 febrero mas unidos nunca Transmision vivo Debate Guayaquil va exponer plan trabajo alcaldia VotaTodo3 DebateGuayaquil MarthaMaciasAlcaldesa Trasmitido vivo eluninversoec LucioGutierrez3 ec decide,2019-02-28
Martha,Macias,cedeno_marth,Martha Macias migrante trabaje banco italiano experiencia canalizar microcreditos realmente beneficien emprendedores Guayaquilen compromiso contigo MarthaMacias VotaTodito3 DebatePorGuayaquil LucioGutierrez3,2019-02-28
Martha,Macias,cedeno_marth,cedeno marth eluninversoEC LucioGutierrez3 ec decide TelediarioEC Vamos Alcaldesa Martha Macias 24 marzo solo Plumazo lista 3,2019-02-28
Martha,Macias,cedeno_marth,primer grupo candidatos candidata participaran debate Alcaldia Guayaquil conforman jimmyjairala cedeno marth jorgevillacrese GinoCornejoM BermudezBronson DebatePorGuayaquil,2019-03-01
Martha,Macias,cedeno_marth,abogada cedeno marth gano debate Asi ciudadania puede elegir forma responsable candidatos presente expongan plan trabajo voto MarthaMacias VotaTodito3 DebatePorGuayaquil MarthaAlcaldesa2019 MiVotoPorMarthaMacias,2019-03-01
Martha,Macias,cedeno_marth,ec decide GinoCornejoM abogada directora carcel mujeres Guayaquil mujer autoridad capacidad necesitamos alcaldia voto MarthaMacias VotaTodito3 DebatePorGuayaquil MarthaAlcaldesa2019 MiVotoPorMarthaMacias,2019-03-01
Martha,Macias,cedeno_marth,Gracias invitacion participar DebatePorGuayaquil ciudadania derecho presentemos propuestas,2019-03-01
Martha,Macias,cedeno_marth,Muchas gracias ec decide oportunidad presentar propuestas LucioGutierrez3 confianza equipo candidatos concejales trabajo diario Guayaquil apoyarnos Llegaremos alcaldia VotaTodito3 MarthaAlcaldesa2019,2019-03-01
Martha,Macias,cedeno_marth,Hoy DebatePorGuayaquil demostramos propuestas Guayaquil necesita Gracias apoyo 24 marzo MarthaMaciasAlcaldesa VotaTodito3 MarthaMacias LucioGutierrez3,2019-03-01
Martha,Macias,cedeno_marth,Diario Expreso presentando plan trabajo alcaldia Guayaquil seguimos sumando cada dia mas apoyo ciudadania sabe gente palabra 24 marzo vota mujer preparada ser Alcaldesa Guayaquil DeUnSoloPlumazoVotaTodo3,2019-03-01
Martha,Macias,cedeno_marth,Concluye primer bloque DebatePorGuayaquil participaron BermudezBronson jimmyjairala jorgevillacrese cedeno marth GinoCornejoM felicitamos compartir propuestas ciudad GrupoFARO eluniversocom corapesatelital teleramaec,2019-03-02
Martha,Macias,cedeno_marth,llegado Parroquia Tenguel alegria ganas trabajar mejor Guayaquil Recorremos calles junto concejales Gustavo Alcivar Junta parroquial DeUnSoloPlumazoVotaTodo3 MarthaMaciasAlcaldesa LucioGutierrez3,2019-03-02
Martha,Macias,cedeno_marth,hora tenguelenos autores ejecutores propio destino lograremos junto concejales juntas parroquiales cambiaremos historia Gracias Tenguel gracias Gustavo Alcivar DeUnSoloPlumazoVotaTodo3 LucioGutierrez3,2019-03-03
Martha,Macias,cedeno_marth,queda pedazo corazon tierra linda gente trabajadora bondadoza Llegaremos alcaldia van mas solos Guayaquileno compromiso contigo MarthaMacias DeUnSoloPlumazoVotaTodo3 EcuavisaInforma teleamazonasec CanalUnoTv,2019-03-03
Martha,Macias,cedeno_marth,Vamos legalizar terrenos tierra agricola mas fructifera todas familias Tenguel LucioGutierrez3 EcuavisaInforma teleamazonasec CanalUnoTv RTSEcuador Gamavisionecu,2019-03-03
Martha,Macias,cedeno_marth,Tenguel estan solos vamos legalizar terrenos tierra agricola mas fructifera todas familias Ademas crearemos oficina tecnica registro civil Martha Macias DeUnSoloPlumazoVotaTodo3 MarthaMaciasAlcaldesa LucioGutierrez3,2019-03-03
Martha,Macias,cedeno_marth,ec decide JairalaTeApoyo BermudezBronson jimmyjairala jorgevillacrese cedeno marth GinoCornejoM GrupoFARO eluniversocom corapesatelital teleramaec Felicidades mejor manera saber candidatos proyectos alcaldia ciudad aquellos acudieron lastima estan altura Guayaquilenos si GUERREROS,2019-03-03
Martha,Macias,cedeno_marth,lluvia mucha alegria carnaval 42 Nicolas Augusto Gonzalez Guayaquileno compromiso contigo MarthaMacias DeUnSoloPlumazoVotaTodo3 MarthaMaciasAlcaldesa GuayaquilenoMiCompromisoEsContigo Distrito1PSP Distrito2PSP Distrito3PSP,2019-03-04
Martha,Macias,cedeno_marth,Gracias recibirnos disfrutamos carnaval junto ustedes razon fortalece Guayaquileno compromiso contigo MarthaMacias DeUnSoloPlumazoVotaTodo3 MarthaMaciasAlcaldesa GuayaquilenoMiCompromisoEsContigo Distrito1PSP Distrito2PSP Distrito3PSP,2019-03-04
Martha,Macias,cedeno_marth,lluvia detiene fuerza pueblo apoya pide Martha Macias Alcaldia Gracias DeUnSoloPlumazoVotaTodo3 MarthaMaciasAlcaldesa GuayaquilenoMiCompromisoEsContigo Distrito1PSP Distrito2PSP Distrito3PSP PartidoSociedadPatriotica,2019-03-04
Martha,Macias,cedeno_marth,Mil gracias Magali Moran Felix Burgos presidente AMIGRAFE gentileza invitarnos deliciosa parrillada alegria multiplica queridos amigos Dios pague carino apoyo DeUnSoloPlumazoVotaTodo3 MarthaMaciasAlcaldesa,2019-03-05
Martha,Macias,cedeno_marth,,2019-03-05
Martha,Macias,cedeno_marth,Mil gracias Magali Moran Felix Burgos presidente AMIGRAFE gentileza invitarnos deliciosa parrillada alegria multiplica queridos amigos Dios pague carino apoyo DeUnSoloPlumazoVotaTodo3 MarthaMaciasAlcaldesa,2019-03-05
Martha,Macias,cedeno_marth,voto lograremos dar oportunidad creditos emprendedores rescataremos familia ordenaremos casa Guayaquil ciudad paz anhelamos Hoy Leonidas Plaza 10 agosto 24 marzo DeUnSoloPlumazoVotaTodo3 MarthaMaciasAlcaldesa,2019-03-05
Martha,Macias,cedeno_marth,voto lograremos dar oportunidad creditos emprendedores rescataremos familia ordenaremos casa Guayaquil ciudad paz anhelamos Hoy Leonidas Plaza 10 agosto 24 marzo DeUnSoloPlumazoVotaTodo3 MarthaMaciasAlcaldesa,2019-03-05
Martha,Macias,cedeno_marth,voto lograremos dar oportunidad creditos emprendedores rescataremos familia ordenaremos casa Guayaquil ciudad paz anhelamos Hoy Leonidas Plaza 10 agosto 24 marzo DeUnSoloPlumazoVotaTodo3 MarthaMaciasAlcaldesa,2019-03-05
Martha,Macias,cedeno_marth,Hoy IslaTrinitaria Gracias apoyarnos vamos rescate familia proteccion ninos respeto apoyo comerciantes 24 marzo DeUnSoloPlumazoVotaTodo3 MarthaMaciasAlcaldesa,2019-03-06
Martha,Macias,cedeno_marth,Cerramos feriado carnaval recorriendo IslaTrinitaria Gracias apoyarnos vamos rescate familia proteccion ninos respeto apoyo comerciantes 24 marzo DeUnSoloPlumazoVotaTodo3 MarthaMaciasAlcaldesa,2019-03-06
Martha,Macias,cedeno_marth,Cerramos feriado carnaval recorriendo IslaTrinitaria Gracias apoyarnos vamos rescate familia proteccion ninos respeto apoyo comerciantes 24 marzo DeUnSoloPlumazoVotaTodo3 MarthaMaciasAlcaldesa,2019-03-06
Martha,Macias,cedeno_marth,Hoy IslaTrinitaria Gracias apoyarnos vamos rescate familia proteccion ninos respeto apoyo comerciantes 24 marzo DeUnSoloPlumazoVotaTodo3 MarthaMaciasAlcaldesa,2019-03-06
Martha,Macias,cedeno_marth,Hoy IslaTrinitaria Gracias apoyarnos vamos rescate familia proteccion ninos respeto apoyo comerciantes 24 marzo DeUnSoloPlumazoVotaTodo3 MarthaMaciasAlcaldesa,2019-03-06
Martha,Macias,cedeno_marth,Hoy 8 marzo Dia Internacional Mujer quisimos conmemorarlo forma hacemos siempre trabajando optimismo sociedad justa equitativa DeUnSoloPlumazoVotaTodo3 MarthaMacias PSP3,2019-03-09
Martha,Macias,cedeno_marth,Hoy 8 marzo Dia Internacional Mujer quisimos conmemorarlo forma hacemos siempre trabajando optimismo sociedad justa equitativa DeUnSoloPlumazoVotaTodo3 MarthaMacias PSP3,2019-03-09
Martha,Macias,cedeno_marth,Dia Internacional Mujer quisimos conmemorarlo forma hacemos siempre trabajando optimismo sociedad justa equitativa DeUnSoloPlumazoVotaTodo3 MarthaMacias PSP3,2019-03-09
Martha,Macias,cedeno_marth,Cerramos 8 marzo compartiendo alegria chocolatada vamos juntos lograremos Guayaquil paz 24 marzo vota mujer preparada ser Alcaldesa Guayaquil DeUnSoloPlumazoVotaTodo3 MarthaMaciasAlcaldesa PSP3,2019-03-09
Martha,Macias,cedeno_marth,alcaldia sera inversion social atenderemos familia invertiremos bienestar plazas trabajo nueva policia comunitaria Transporte centros salud farmacias comunitarias atencion 24 horas dia MarthaMacias DeUnSoloPlumazoVotaTodo3,2019-03-10
Martha,Macias,cedeno_marth,alcaldia sera inversion social atenderemos familia invertiremos bienestar plazas trabajo nueva policia comunitaria Transporte centros salud farmacias comunitarias atencion 24 horas dia MarthaMacias DeUnSoloPlumazoVotaTodo3,2019-03-10
Martha,Macias,cedeno_marth,alcaldia sera inversion social atenderemos familia invertiremos bienestar plazas trabajo nueva policia comunitaria Transporte centros salud farmacias comunitarias atencion 24 horas dia MarthaMacias DeUnSoloPlumazoVotaTodo3,2019-03-10
Martha,Macias,cedeno_marth,alcaldia Guayaquil contara transporte seguro agil centros salud farmacias comunitarias atencion 24 horas dia MarthaMacias DeUnSoloPlumazoVotaTodo3,2019-03-10
Martha,Macias,cedeno_marth,alcaldia Guayaquil contara transporte seguro agil centros salud farmacias comunitarias atencion 24 horas dia MarthaMacias DeUnSoloPlumazoVotaTodo3,2019-03-10
Martha,Macias,cedeno_marth,alcaldia Guayaquil contara transporte seguro agil centros salud farmacias comunitarias atencion 24 horas dia MarthaMacias DeUnSoloPlumazoVotaTodo3,2019-03-10
Martha,Macias,cedeno_marth,Encuentro prensa presentar plan trabajo 30 presupuesto inversion social destacamos importancia rescatar familia proteger ninos adolescentes peligros adiccion LucioGutierrez3 VotaTodoTodito3,2019-03-12
Martha,Macias,cedeno_marth,Trabajare policia nacional combatir delincuencia implementare camaras reconocimiento facial erradicare violencia intrafamiliar mas femicidios ninos abusados sistema transporte integrado publico 24 horas DeUnSoloPlumazoVotaTodo3,2019-03-13
Martha,Macias,cedeno_marth,Conozco necesidades Guayaquil solucionarlas mujer pueblo preparada capacitada mas importante vocacion social Guayaquileno compromiso contigo Martha Macias DeUnSoloPlumazoVotaTodo3 MarthaMaciasAlcaldesa LucioGutierrez3,2019-03-14
Martha,Macias,cedeno_marth,14 marzo LasTablasGye programa TrasnochadosTC fcopinoargotti LucioGutierrez3,2019-03-15
Martha,Macias,cedeno_marth,VotoInformadoEc Elecciones2019EC Haz voto cuente informate toma mejor decision Conoce cedeno marth candidata Alcaldia Guayaquil Quieres conocer resto perfiles Ingresa aqui,2019-03-16
Martha,Macias,cedeno_marth,24 marzo vota mujer preparada ser Alcaldesa Guayaquil DeUnSoloPlumazoVotaTodo3 Distrito1PSP Distrito2PSP Distrito3PSP MarthaMaciasAlcaldesa GuayaquilenoMiCompromisoEsContigo TuOpinionCuenta PartidoSociedadPatriotica LucioPSP3,2019-03-16
Martha,Macias,cedeno_marth,24 marzo vota mujer preparada ser Alcaldesa Guayaquil DeUnSoloPlumazoVotaTodo3 Distrito1PSP Distrito2PSP Distrito3PSP MarthaMaciasAlcaldesa GuayaquilenoMiCompromisoEsContigo TuOpinionCuenta PartidoSociedadPatriotica LucioPSP3,2019-03-16
Martha,Macias,cedeno_marth,24 marzo vota mujer preparada ser Alcaldesa Guayaquil DeUnSoloPlumazoVotaTodo3 Distrito1PSP Distrito2PSP Distrito3PSP MarthaMaciasAlcaldesa GuayaquilenoMiCompromisoEsContigo TuOpinionCuenta PartidoSociedadPatriotica LucioPSP3,2019-03-16
Martha,Macias,cedeno_marth,24 marzo vota mujer preparada ser Alcaldesa Guayaquil DeUnSoloPlumazoVotaTodo3 Distrito1PSP Distrito2PSP Distrito3PSP MarthaMaciasAlcaldesa GuayaquilenoMiCompromisoEsContigo TuOpinionCuenta PartidoSociedadPatriotica LucioPSP3,2019-03-16
Martha,Macias,cedeno_marth,24 marzo vota mujer preparada ser Alcaldesa Guayaquil DeUnSoloPlumazoVotaTodo3 Distrito1PSP Distrito2PSP Distrito3PSP MarthaMaciasAlcaldesa GuayaquilenoMiCompromisoEsContigo TuOpinionCuenta PartidoSociedadPatriotica LucioPSP3,2019-03-16
Martha,Macias,cedeno_marth,recta final avanzamos entusiasmo 24 marzo vota mujer preparada ser Alcaldesa Guayaquil Vota Martha Macias concejales DeUnSoloPlumazoVotaTodo3 Toditito3 PartidoSociedadPatriotica MarthaMacias LucioGutierrez3,2019-03-17
Martha,Macias,cedeno_marth,mercado LaCaraguay gracias recibirnos apoyo 24 marzo DeUnSoloPlumazoVotaTodo3 MarthaMacias concejales llegaran municipio Guayaquil,2019-03-17
Martha,Macias,cedeno_marth,Solo dos candidatos alcaldiadeGuayaquil presentamos pruebadelpoligrafo mujer honesta habla siempre verdad MarthaMacias PSP3 LucioGutierrez3 DeUnSoloPlumazoVotaTodo3,2019-03-18
Martha,Macias,cedeno_marth,Llevamos mensaje esperanza lograr Guayaquil ciudad paz voto haremos realidad Alcaldia Guayaquil VOTA 3 Vota Martha Macias concejales DeUnSoloPlumazoVotaTodo3,2019-03-18
Martha,Macias,cedeno_marth,Seguimos campana pueblo Alcaldia Guayaquil VOTA 3 Vota Martha Macias concejales DeUnSoloPlumazoVotaTodo3 MarthaMaciasAlcaldesa GuayaquilenoMiCompromisoEsContigo Distrito1PSP Distrito2PSP Distrito3PSP PartidoSociedadPatriotica,2019-03-18
Martha,Macias,cedeno_marth,jueves 21 marzo 17h30 juntos vamos gran cierre campana Martha Macias concejales DeUnSoloPlumazoVotaTodo3 MarthaMaciasAlcaldesa GuayaquilenoMiCompromisoEsContigo Distrito1PSP Distrito2PSP Distrito3PSP PartidoSociedadPatriotica,2019-03-20
Martha,Macias,cedeno_marth,Hoy Monte Sinai cada vez mas cerca dia Guayaquil cambie logremos convertirla ciudad merecemos GuayaquilCiudadDePaz VOTATODO3 Vota Martha Macias concejales DeUnSoloPlumazoVotaTodo3 MarthaMaciasAlcaldesa PartidoSociedadPatriotica,2019-03-21
Martha,Macias,cedeno_marth,Hoy Monte Sinai cada vez mas cerca dia Guayaquil cambie logremos convertirla ciudad merecemos GuayaquilCiudadDePaz VOTATODO3 Vota Martha Macias concejales DeUnSoloPlumazoVotaTodo3 MarthaMaciasAlcaldesa PartidoSociedadPatriotica,2019-03-21
Martha,Macias,cedeno_marth,Hoy Monte Sinai cada vez mas cerca dia Guayaquil cambie logremos convertirla ciudad merecemos GuayaquilCiudadDePaz VOTATODO3 Vota Martha Macias concejales DeUnSoloPlumazoVotaTodo3 MarthaMaciasAlcaldesa PartidoSociedadPatriotica,2019-03-21
Martha,Macias,cedeno_marth,Hoy Monte Sinai cada vez mas cerca dia Guayaquil cambie logremos convertirla ciudad merecemos GuayaquilCiudadDePaz VOTATODO3 Vota Martha Macias concejales DeUnSoloPlumazoVotaTodo3 MarthaMaciasAlcaldesa PartidoSociedadPatriotica,2019-03-21
Martha,Macias,cedeno_marth,Hoy Monte Sinai cada vez mas cerca dia Guayaquil cambie logremos convertirla ciudad merecemos GuayaquilCiudadDePaz VOTATODO3 Vota Martha Macias concejales DeUnSoloPlumazoVotaTodo3 MarthaMaciasAlcaldesa PartidoSociedadPatriotica,2019-03-21
Martha,Macias,cedeno_marth,Hoy Monte Sinai cada vez mas cerca dia Guayaquil cambie logremos convertirla ciudad merecemos GuayaquilCiudadDePaz VOTATODO3 Vota Martha Macias concejales DeUnSoloPlumazoVotaTodo3 MarthaMaciasAlcaldesa PartidoSociedadPatriotica,2019-03-21
Martha,Macias,cedeno_marth,EnVivo BuenosDias cedeno marth candidata alcaldia Guayaquil,2019-03-21
Martha,Macias,cedeno_marth,listos seguros domingo 24 marzo voto dara oportunidad convertir Guayaquil ciudad paz Alcaldia Guayaquil DeUnSoloPlumazoVotaTodo3 MarthaMaciasAlcaldesa,2019-03-22
Martha,Macias,cedeno_marth,Gracias infinitas apoyo carino dado domingo 24 marzo voto dara oportunidad convertir Guayaquil ciudad paz Alcaldia Guayaquil DeUnSoloPlumazoVotaTodo3 MarthaMaciasAlcaldesa LucioGutierrez3,2019-03-22
Martha,Macias,cedeno_marth,Vamos votar juntos alegria optimismo domingo 24 marzo SOLO PLUMAZO VOTA 3 Guayaquil ciudad paz vota Martha Macias concejales MarthaAlcaldesa PartidoSociedasPatriotica LucioGutierrez3,2019-03-23
Martha,Macias,cedeno_marth,Hoy manana asisti ejercer derecho voto Vivamos jornada democratica orden optimismo Guayaquil ciudad paz,2019-03-24
Martha,Macias,cedeno_marth,Hoy manana asisti ejercer derecho voto Vivamos jornada democratica orden optimismo Guayaquil ciudad paz,2019-03-24
