nombre,apellidos,tweet_screen_name,tweet_text,tweet_date
Aland Javier,Molestina Malta,ALANDMOLESTINAM,"VIVO radio @ visionquito Diego Oquendo , compartiendo panel Karina Ponce . Tema : * Preguntas urgentes candidatos # CPCCS * https : //t.co/4ynOHsQsU5 # ConcertacionCivicaNacional # AlandMolestinaConsejero https : //t.co/DLafj31FBb",2019-02-19
Aland Javier,Molestina Malta,ALANDMOLESTINAM,"# CPCCS , debemos votar candidatos esten alejados compromiso politico garantizar independencia transparencia combate corrupcion '' . Hoy Radio Canela ciudad Quito . # AlandMolestinaConsejero # BolsillosHonestos https : //t.co/IlBpF3XiAn",2019-02-19
Aland Javier,Molestina Malta,ALANDMOLESTINAM,"Continuamos agenda programada region interandina , cumpliendo responsabilidad ecuatorianos . ! Vamos salvaguardar participacion ciudadana 24 marzo honestidad transparencia ! # AlandMolestinaConsejero # CPCCS # BolsillosHonestos https : //t.co/ywzVMaesqK",2019-02-19
Aland Javier,Molestina Malta,ALANDMOLESTINAM,"Consejo Participacion Ciudadana Control Social Transitorio , cuanto combate corrupcion queda debiendo pais . correspondera entonces # CPCCS definitivo asumir reto . Hoy Informativo Prisma , televisora ciudad Ibarra . # Elecciones2019EC https : //t.co/T7hgQ5KRcB",2019-02-20
Aland Javier,Molestina Malta,ALANDMOLESTINAM,Vientos fraude electoral soplan Ecuador eleccion Consejeros # CPCCS . Existe decision arbitraria CNE escrutar final votos dignidad ... 1/2 Radio Caracol-Ambato . # AlandMolestinaConsejero # BolsillosHonestos https : //t.co/t72GjANnCG,2019-02-21
Aland Javier,Molestina Malta,ALANDMOLESTINAM,`` ... Ley debe hacerse primero trata eleccion Nacional . olvidemos tampoco poseemos infraestructura permita Control Electoral '' . 2/2 Hoy Radio Caracol Ambato . # CPCCS # AlandMolestinaConsejero # Elecciones2019EC https : //t.co/5Hsy5WXiSG,2019-02-21
Aland Javier,Molestina Malta,ALANDMOLESTINAM,"Disfrutando musica alegria ambatenos , mantuvimos entrevista parque `` Montalvo '' hermosa ciudad , Ambato , UNIMAX TV . # AlandMolestinaConsejero # CPCCS # BolsillosHonestos https : //t.co/lA2xHLUyQg",2019-02-21
Aland Javier,Molestina Malta,ALANDMOLESTINAM,"Cumpliendo responsabilidad historica promover participacion ciudadana dar conocer * Plan Trabajo * , recorrido provincias Pichincha , Imbabura , Tungurahua , Bolivar , Loja , Cotopaxi , Oro Esmeraldas . Seguire recorriendo pais mas fuerza energia . # CPCCS https : //t.co/Kl6TEPdY83",2019-02-21
Aland Javier,Molestina Malta,ALANDMOLESTINAM,"Asi letreros todas instituciones publicas indicando norma sanciona ciudadanos falten respeto funcionario publico , debe haber senalen * cuales derechos , fin pueda ejercerlos libertad '' . Diario Regional Andes-Riobamba . https : //t.co/8qnExpZWCH",2019-02-22
Aland Javier,Molestina Malta,ALANDMOLESTINAM,"Condeno falta responsabilidad dicen anular voto # CPCCS , saben quieren ignorar CPCCS , sera organismo lidere lucha corrupcion firmeza honestidad ... 1/2 # AlandMolestinaConsejero # BolsillosHonestos https : //t.co/xBsdQEQKTK",2019-02-22
Aland Javier,Molestina Malta,ALANDMOLESTINAM,"`` ... Consejeros Gobierno nefasto , puestos `` dedo '' . Pido ciudadanos confien propuestas den oportunidad seguir sirviendo pais '' . 2/2 Radio Sol 96.5FM Riobamba . # CPCCS # AlandMolestinaConsejero # BolsillosHonestos https : //t.co/3bHzv9nq2n",2019-02-22
Aland Javier,Molestina Malta,ALANDMOLESTINAM,"| ECUATORIANOS | participacion candidato # CPCCS , obedece claro compromiso pais , * necesita bano honestidad * luego haber padecido largo periodo corrupcion liderado expresidente republica . # ConcertacionCivicaNacional https : //t.co/0vey6nyASM",2019-02-22
Aland Javier,Molestina Malta,ALANDMOLESTINAM,"responsabilidad encontrar mejores dias pais , convoca trabajar tregua descanso . Agradezco valiosos aportes . # Elecciones2019EC # BolsillosHonestos # CPCCS https : //t.co/8nRWIXbUFL",2019-02-25
Aland Javier,Molestina Malta,ALANDMOLESTINAM,"independencia toda linea partidista , da sustento moral rechazar falsos lideres politicos voces , peticion voto nulo @ CPCCS . Manabi , tierra hermosa , apoyo hombres mujeres bravios pundonor , sigo firme # CPCCS . https : //t.co/ektkQ1MsE0",2019-02-25
Aland Javier,Molestina Malta,ALANDMOLESTINAM,"Medios Comunicacion juegan papel importante orientar ciudadania Participacion Ciudadana , asi derecho elegir representantes proximo 24 marzo ... 1/2 Hoy medios comunicacion , provincia Manabi camino firme # CPCCS . https : //t.co/R6nTatSYc8",2019-02-26
Aland Javier,Molestina Malta,ALANDMOLESTINAM,"`` ... embargo advierto pais , confabulacion grupos politicos poder , echar traste eleccion # CPCCS , manera irresponsable llaman anular voto . 2/2 Manabi voy camino firme @ CPCCS # BolsillosHonestos # AlandMolestinaConsejero https : //t.co/ndCJAKFUT1",2019-02-26
Aland Javier,Molestina Malta,ALANDMOLESTINAM,"Tome desafio participar # CPCCS , hora gente honesta asuma compromiso pais . conocen saben actuare transparencia independencia . Camino firme , Manabi , @ CPCCS . # BolsillosHonestos # AlandMolestinaConsejero https : //t.co/j8ihrGSi05",2019-02-27
Aland Javier,Molestina Malta,ALANDMOLESTINAM,"Ecuador sera pais honesto , ! oportunidades ! jovenes , ! voz ! Disfrutemos feriado carnaval , alegria , cuidado , esperanza mejores dias patria Camino firme # CPCCS # BolsillosHonestos # AlandMolestinaConsejero https : //t.co/8l27yx5WIF",2019-03-02
Aland Javier,Molestina Malta,ALANDMOLESTINAM,balzarenos ejemplo pueblo pujante 24 marzo votara Participacion Ciudadana . # BolsillosHonestos # CPCCS # AlandMolestinaConsejero https : //t.co/Y9XwBt3w4M,2019-03-03
Aland Javier,Molestina Malta,ALANDMOLESTINAM,"mismos hoy plantean anule voto elimine # CPCCS , misma valentia pedir elimine Asamblea Nacional ... # Elecciones2019EC # AlandMolestinaConsejero https : //t.co/D2Eihf4rM1",2019-03-03
Aland Javier,Molestina Malta,ALANDMOLESTINAM,"@ ManuRecharged @ marialocorrea @ carlosfigueroa6 @ davidroserow Gracias confianza . hace referencia TARZ28 enunciado Ecuador Eterno falso casi totalidad . ano dice cargo frontera norte , Guayaquil , ( favor chequee google ) . Llegare CPCCS combatir corruptos",2019-03-06
Aland Javier,Molestina Malta,ALANDMOLESTINAM,"debemos dejarnos intimidar aquellos levantan voz participacion ciudadana . ! derecho defenderla ! @ radioaguila pais , camino firme # CPCCS . # ConcertacionCivicaNacional # Elecciones2019EC https : //t.co/OCiojbc2dX",2019-03-06
Aland Javier,Molestina Malta,ALANDMOLESTINAM,"Mientras gritan ! voto nulo ! , recorro Ecuador , empoderando ciudadania derecho participar toma decisiones pais . # CPCCS # BolsillosHonestos # AlandMolestinaConsejero https : //t.co/uNYUohHMIp",2019-03-07
Aland Javier,Molestina Malta,ALANDMOLESTINAM,"decision patriota ciudadanos denuncien actos corrupcion , sera protegida auspiciada # CPCCS . ! compromiso ! . @ splendid1040 https : //t.co/OI9QXQkiHw Atenas Ecuador , Cuenca , caminamos firme @ CPCCS . # BolsillosHonestos # Elecciones2019EC https : //t.co/GaH3M6DcHk",2019-03-07
Aland Javier,Molestina Malta,ALANDMOLESTINAM,"Cuenca excepcion , cada provincia visitada , encuentro apoyo solidaridad companeros militares servicio pasivo . ! Gracias , aporte fundamental llegar # CPCCS . # BolsillosHonestos # AlandMolestinaConsejero https : //t.co/vfgY5Mdf46",2019-03-08
Aland Javier,Molestina Malta,ALANDMOLESTINAM,"Conversatorios mas eventos sirven difundir plan trabajo imagen candidatos # CPCCS , constituyen aval importante ciudadania conozca importancia votar nulo . Felicitaciones organizadores companeros candidatos excelente desempeno . https : //t.co/ZHYo3PqIq6",2019-03-08
Aland Javier,Molestina Malta,ALANDMOLESTINAM,"! Feliz dia mujer ! Siempre escucho decir `` detras hombre exitoso gran mujer '' , pienso contrario & lt ; lado hombre exitoso encuentra gran mujer & gt ; Quiero agradecer esposa hija , mujeres pilar lucha ... https : //t.co/ieaV1Y7hX4 https : //t.co/1swIfudJdl",2019-03-08
Aland Javier,Molestina Malta,ALANDMOLESTINAM,Hipocritas aquellos ahora levantan voz @ CPCCS . 10 anos hacerlo embargo guardaron silencio . ! Vamos firmes # CPCCS ! # Elecciones2019EC # EleccionesCPCCS https : //t.co/eA2bHpXmg9,2019-03-08
Aland Javier,Molestina Malta,ALANDMOLESTINAM,"Hoy manana reuni lideres sector Cristo Consuelo Guayaquil , reunion importante dio oportunidad hacerles conocer Participacion Ciudadana . Gracias apoyo . Seguimos firmes seguros # CPCCS # Elecciones2019EC https : //t.co/rogf1Nobrw",2019-03-09
Aland Javier,Molestina Malta,ALANDMOLESTINAM,"Si jovenes involucran decisiones mas importantes pais , eligiendo gente honesta cargos poder politico , seguro combate corrupcion sera mas efectivo . # BolsillosHonestos . Caminando firme # CPCCS # Elecciones2019EC https : //t.co/1mpLjzoy2k",2019-03-09
Aland Javier,Molestina Malta,ALANDMOLESTINAM,"| reunion jovenes ciudad Guayaquil | Empoderar ciudadanos , cumpliendo propuestas , jovenes tambien deciden Ecuador honesto . Juntos , caminamos firme # CPCCS # Elecciones2019EC # AlandMolestinaConsejero https : //t.co/br74ADjnJD",2019-03-10
Aland Javier,Molestina Malta,ALANDMOLESTINAM,"`` arbol podrido raices , puede notar ramas '' ultima semana sido objeto varias calumnias , parte oposicion busca manchar imagen . Quiero sepan ! miedo ! 1/2 https : //t.co/FVEPEnV4UY # CPCCS # BolsillosHonestos https : //t.co/MmPDuuXtrw",2019-03-11
Aland Javier,Molestina Malta,ALANDMOLESTINAM,"cuestionamientos directos grupo Ingenieros Civiles hicieron hoy coloquio , permitio ver ciudadanos empoderados derechos . Seguimos firmes apoyo # CPCCS # BolsillosHonestos # ConcertacionCivicaNacional https : //t.co/hyRLs8dsSH",2019-03-12
Aland Javier,Molestina Malta,ALANDMOLESTINAM,"mas importante ciudadano honesto , servir pais dignidad patriotismo , lucha detendra , aun mas encarnizada calumnia . honestidad transparencia camino firme @ CPCCS # BolsillosHonestos # ConcertacionCivicaNacional https : //t.co/34LIlvRgjm",2019-03-12
Aland Javier,Molestina Malta,ALANDMOLESTINAM,"Continuamos cruzada patriotica vamos camino ciudad Machala , participar Foro Ciudadano Corte Provincial Justicia Oro . # AlandMolestinaConsejero # Elecciones2019EC # BolsillosHonestos https : //t.co/UPOzKpUSsD",2019-03-13
Aland Javier,Molestina Malta,ALANDMOLESTINAM,"| Democracia voluntad soberana urnas | vergonzoso J.C.Trujillo junto asesor Ab.Oyarte , confabulacion presidenta Asamblea ataquen forma artera proceso electoral pretendan detener eleccion # CPCCS proximo 24 marzo . 1/2 https : //t.co/YOCHGKoBHO",2019-03-14
Aland Javier,Molestina Malta,ALANDMOLESTINAM,... pueblo puede ser burlado . Detengamos boicot . votar proximo 24 marzo . 2/2 https : //t.co/tJ6l9K25bn Caminamos seguros firmes # CPCCS # BolsillosHonestos # ConcertacionCivicaNacional https : //t.co/YOM8GYTG58,2019-03-14
Aland Javier,Molestina Malta,ALANDMOLESTINAM,"* doble discurso * `` lideres '' Partidos Movimientos Politicos , develan & lt ; intereses personales partidistas estan encima intereses pais & gt ; . 1/2 # BolsillosHonestos # Elecciones2019EC # ConcertacionCivicaNacional https : //t.co/aEbJaT1k7J",2019-03-14
Aland Javier,Molestina Malta,ALANDMOLESTINAM,"... ello urgente necesario ciudadanos pronunciemos 24 marzo , masivamente favor @ CPCCS . ! historia escribe verdad ! 2/2 # BolsillosHonestos # ConcertacionCivicaNacional # EleccionesCPCCS https : //t.co/Z2zyjJI8Cm",2019-03-14
Aland Javier,Molestina Malta,ALANDMOLESTINAM,"| Ahora | destino puerto Manta fin participar debate organiza Camara Comercio . Llegare apoyo ecuatorianos # CPCCS , fundar nuevo pais , Ecuador honesto . # Elecciones2019EC # EleccionesCPCCS https : //t.co/WrFGtRETqn",2019-03-14
Aland Javier,Molestina Malta,ALANDMOLESTINAM,"agrado participare varios Conversatorios manana sabado 16 marzo . ! Vamos juntos ! honestidad transparencia 24 marzo , fundar Ecuador honesto . # CPCCS # EleccionesCPCCS # BolsillosHonestos https : //t.co/utyWswW2Sb",2019-03-15
Aland Javier,Molestina Malta,ALANDMOLESTINAM,! lucha descanso ! Gracias invitacion importante reunion Asociacion Aerotecnicos FAE Guayaquil . # BolsillosHonestos # Elecciones2019EC # EleccionesCPCCS https : //t.co/JMYUdFdamm,2019-03-16
Aland Javier,Molestina Malta,ALANDMOLESTINAM,"# FelizDomingo . honor volver `` Paris Chiquito '' Vinces , participando tradicional Regata . Vamos firmes # CPCCS # BolsillosHonestos # ConcertacionCivicaNacional https : //t.co/CyTu6nQlm4",2019-03-17
Aland Javier,Molestina Malta,ALANDMOLESTINAM,"Sigo recorriendo pais , orientando empoderando ciudadania . ! minuto descanso lucha corrupcion ! Caminando firme # CPCCS apoyo Ecuador . # EleccionesCPCCS # Elecciones2019EC https : //t.co/9Y4AK9cGWD",2019-03-18
Aland Javier,Molestina Malta,ALANDMOLESTINAM,Listos Conversatorio companeros candidatos # CPCCS Instituto Superior Tecnologico Bolivariano Guayaquil . @ ITBolivariano ! Caminamos firmes seguros apoyo ! # BolsillosHonestos # Elecciones2019EC https : //t.co/zDd1vqx6OM,2019-03-18
Aland Javier,Molestina Malta,ALANDMOLESTINAM,"! Si puede terminar corrupcion ! Si podemos . solo sera posible # CPCCS compuesto ciudadanos honestos , independientes transparentes ; mas participacion ustedes . ! Vamos adelante Ecuador ! # Elecciones2019EC @ ITBolivariano https : //t.co/6pMVJNDFU9",2019-03-19
Aland Javier,Molestina Malta,ALANDMOLESTINAM,"maestros forman parte activa cambio pais , pude palpar reunion sostenida profesores Frente Asociaciones `` Juan Montalvo '' . ! Avanzamos firmes # CPCCS ! # BolsillosHonestos # Elecciones2019EC # EleccionesCPCCS https : //t.co/SyNbLOctkm",2019-03-19
Aland Javier,Molestina Malta,ALANDMOLESTINAM,"@ CPCCS voz luchar corrupcion , vamos recuperar robado ; Ecuador sera pais honesto , ! jovenes voz ! Defendamos Democracia , caminemos seguros firmes # CPCCS . # Elecciones2019EC # EleccionesCPCCS https : //t.co/FfjeqUo5KO",2019-03-20
Aland Javier,Molestina Malta,ALANDMOLESTINAM,vigilantes respete proceso democratico Ecuador . permitiremos fraude electoral . ! lucha DEMOCRACIA defiende tambien calles ! https : //t.co/82wAzP49hn # ConcertacionCivicaNacional # CPCCS # EleccionesCPCCS # Elecciones2019EC https : //t.co/1EY5ibFipU,2019-03-21
Aland Javier,Molestina Malta,ALANDMOLESTINAM,vigilantes respete proceso democratico Ecuador . permitiremos fraude electoral . ! lucha DEMOCRACIA defiende tambien calles ! https : //t.co/K5V2TJQj4S # ConcertacionCivicaNacional # CPCCS # EleccionesCPCCS # Elecciones2019EC https : //t.co/FwmsOgkyWO,2019-03-21
Aland Javier,Molestina Malta,ALANDMOLESTINAM,"fuerza verdad impone artera traicion grupos politicos poder intentos acabar participacion ciudadana . CNE conoce valentia lucha , seguimos defendiendo democracia trinchera . # CPCCS # Elecciones2019EC https : //t.co/fxXCXKzepc",2019-03-21
Aland Javier,Molestina Malta,ALANDMOLESTINAM,"Quiero agradecer Dios , familia apoyo incondicional , ustedes ecuatorianos respaldo . invito juntos , 24 marzo demos bano honestidad pais , hare liderazgo , honestidad transparencia . # EleccionesCPCCS # Elecciones2019EC https : //t.co/W5A57M8c1v",2019-03-22
Aland Javier,Molestina Malta,ALANDMOLESTINAM,"salon Democracia CNE , observadores internacionales , denuncie violacion Ley Electoral CNE , ilegalidad escrutar primero votos autoridades seccionales lugar # CPCCS , dispone Ley . # ConcertacionCivicaNacional https : //t.co/yDfUZQmgCt",2019-03-23
Aland Javier,Molestina Malta,ALANDMOLESTINAM,"Asumo humildad responsabilidad compromiso servir pais , ejerciendo patriotismo derecho sufragio junta electoral # 17 Universidad Espiritu Santo , Samborondon-Guayas . ! Cuento voto ! # CPCCS # EleccionesCPCCS # Elecciones2019EC https : //t.co/hwYM1lc09z",2019-03-24
Aland Javier,Molestina Malta,ALANDMOLESTINAM,"cedido cedere principios verdadera vocacion participe # CPCCS , hice absoluta conviccion lucha firme honesta corrupcion , * puede desterrar * ayuda ecuatorianos anhelamos cambio pais . https : //t.co/dlLMOPVKY6",2019-03-28
Aland Javier,Molestina Malta,ALANDMOLESTINAM,"Dra . Diana Salazar , puede hacer `` oidos sordos '' grave denuncia consejero Jose Cabrera CNE . Inaugure cargo iniciando investigacion oficio . Demuestre voluntad terminar corrupcion ente pais . https : //t.co/FM55HIYOom",2019-04-02
Aland Javier,Molestina Malta,ALANDMOLESTINAM,"Reitero pedido doctora @ DianaSalazarM2 , antecedentes dominio publico , respeto democracia voluntad ecuatorianos , sirva oficio iniciar investigacion corresponda posible delito fraude cibernetico . https : //t.co/qBYcJoJodD https : //t.co/cDSYLp8nBa",2019-04-04
Aland Javier,Molestina Malta,ALANDMOLESTINAM,dudo `` Junta Notables '' llamado Julio Cesar Trujillo ayuden desaparecer # CPCCS . Dudo verdaderas intenciones pudieran detras eliminacion participacion ciudadanos toma decisiones . https : //t.co/5nqYmcg7Yn,2019-04-08
Aland Javier,Molestina Malta,ALANDMOLESTINAM,"Ramiro Gonzalez , delincuente atracador pais , sido detenido Lima - Peru . Pronto caera jefe banda . https : //t.co/U9eDdfUKPG",2019-04-10
Aland Javier,Molestina Malta,ALANDMOLESTINAM,"basta ser expectantes dardos venenosos lanzan , tocarse , Consejeros CNE . valentia dar primer disparo oculto salga estampida . https : //t.co/X3P0NSu13n",2019-04-10
Aland Javier,Molestina Malta,ALANDMOLESTINAM,Seis anos seis meses ecuatorianos soportamos abuso falta respeto mantenido embajada . Julian Assange debio retirar asilo hace tiempo . Ahora esperemos pajarito trine fuerte . ! prepararse sorpresas va soltar ! https : //t.co/g3M6L7vFmL,2019-04-11
Aland Javier,Molestina Malta,ALANDMOLESTINAM,"Departamento Justicia EEUU , levanta cargos asociacion ilicita Julian Assange . Mientras Pamela Anderson , pareja sentimental Assange , declaro sentirse * impactada * arresto hacker . ecuatorianos cambio , felicitamos salida . https : //t.co/qx3sue2h9k",2019-04-11
Aland Javier,Molestina Malta,ALANDMOLESTINAM,". @ RicardoPatinoEC , hiciste valiente mientras formabas parte banda asaltantes tambien lideraste . Artifice Pativideo , Pati Narcovalija quisiste atropellar gloriosas FF.AA . huyas , deja lado tanta cobardia . https : //t.co/qCYUwalMwV",2019-04-14
Aland Javier,Molestina Malta,ALANDMOLESTINAM,"Si jueza Benitez actua , demuestra justicia aun politizada . ecuatorianos seguimos asistiendo show monta gobierno . podemos admitir mas burlas pais . instruya @ PoliciaEcuador prohibicion salida . actue fiscal . https : //t.co/SQadAg27O3",2019-04-14
Aland Javier,Molestina Malta,ALANDMOLESTINAM,"verguenza repulsion , @ ccnecua rechaza tardia exhibicion videos aparece incomodo hacker # JulianAssange , haciendo `` regalada gana '' Embajada Ecuador Londres . video , seguro saldran , muestra artera complacencia ... 1/4 https : //t.co/HWrXHVeZc1",2019-04-14
Aland Javier,Molestina Malta,ALANDMOLESTINAM,"`` ... Espinosa , Long mas . pais demanda transparencia lucha corrupcion . ! Llego hora ! 4/4 https : //t.co/lYynGQWgn2 # ConcertacionCivicaNacional # BolsillosHonestos https : //t.co/MckoOwegsZ",2019-04-14
Aland Javier,Molestina Malta,ALANDMOLESTINAM,"Lamentable ocurre carceles pais . Hacinamiento falta agilidad tramites judiciales , hacen rebasan limite creadas . Ojala Correa secuaces visiten sientan vivir `` mejor carcel mundo '' . https : //t.co/M5A31y3Bsa",2019-04-15
Aland Javier,Molestina Malta,ALANDMOLESTINAM,! dolor traficaron ! Esperamos Correa secuaces visiten sientan vivir `` mejor carcel pais '' . https : //t.co/XWGUiDP5JV,2019-04-15
Aland Javier,Molestina Malta,ALANDMOLESTINAM,"increible cientos jovenes aspiran cupo estudiar carrera Medicina Universidad Guayaquil , soportar tanta ofensa vejamen . jovenes derecho estudiar ! carajo ! Solidaridad jovenes familias . https : //t.co/5iNp35hQ3K",2019-04-15
Aland Javier,Molestina Malta,ALANDMOLESTINAM,"padres siempre respaldaremos hijos , aunque siempre hagan correcto . Dag Gorel , padres ciudadano sueco Ola Bini , @ olabini , detenido Ecuador supuesta vinculacion @ wikileaks , llegaron pais . https : //t.co/Ii9immJYOU",2019-04-15
Aland Javier,Molestina Malta,ALANDMOLESTINAM,"Manabi , tierra gente honesta trabajadora , necesita mas accion palabras . ecuatorianos deuda . # 16A https : //t.co/YRD3dFYbUI",2019-04-16
Aland Javier,Molestina Malta,ALANDMOLESTINAM,"Manabi , tierra gente honesta trabajadora , necesita mas accion palabras . ecuatorianos hicimos gran esfuerzo Gobierno Nacional aun encuentra deuda . # 16A https : //t.co/DXffyHE28S",2019-04-16
Aland Javier,Molestina Malta,ALANDMOLESTINAM,https : //t.co/sJlDsKDzCI,2019-04-16
Aland Javier,Molestina Malta,ALANDMOLESTINAM,"Jaime Roldos Aguilera , justo homenaje sera inmortalizado junto conyuge Martha Bucaram , traves Memorial esculturas bronce , representara trayectoria . https : //t.co/CQfaJiyoQl",2019-04-17
Aland Javier,Molestina Malta,ALANDMOLESTINAM,justicia debe alcanzar resulten responsables corrupcion pais . ? Ecuador ? https : //t.co/CLbq87A4TO,2019-04-17
Aland Javier,Molestina Malta,ALANDMOLESTINAM,"ser cierta noticia , triste final ser humano cuya ambicion actos corrupcion llevo ocupar sitio miserable paginas historia . Fallecio expresidente peruano Alan Garcia , cuatro horas despues dispararse cabeza . https : //t.co/HDpT85Ce5N https : //t.co/wjbEAqhtgz",2019-04-17
Aland Javier,Molestina Malta,ALANDMOLESTINAM,"dije , Patino cobarde , solo demostro ser machito cantando `` amante amigo '' . ? Ahora , vamos echar culpa ? Senora Fiscal General ! actue ! https : //t.co/nM7XbcPeM5",2019-04-18
Aland Javier,Molestina Malta,ALANDMOLESTINAM,senora Maria Fernanda Espinosa autora intelectual material falsificacion documentos publicos favor hacker Julian Assange . duda ambicion poder llevo crear documentos falsos tapar inmundicias seguramente conoce Assange . https : //t.co/Dx2SKZs68x,2019-04-23
Aland Javier,Molestina Malta,ALANDMOLESTINAM,"? paso Dr.Trujillo ? Parece transparencia procesos seleccion funcionarios publicos , estan `` enlodando '' . Coherencia favor . @ CPCCS @ JCTrujilloCPCCS # ConcertacionCivicaCiudadana # BolsillosHonestos https : //t.co/32ZIFsH1Sy",2019-04-24
Aland Javier,Molestina Malta,ALANDMOLESTINAM,"! mas inoperancia ! Cancilleria utilice mecanismos internacionales otorga Convemar , frenar carniceria fauna marina alta mar . # Galapagos # ConcertacionCivicaNacional https : //t.co/OyvJFicWKJ",2019-04-25
Aland Javier,Molestina Malta,ALANDMOLESTINAM,"! Ecuador necesita rumbo ! domingo 28 abril estare Pajan-Manabi , seguimos avanzando consolidacion organizacion # ConcertacionCivicaNacional . https : //t.co/uI5ENHKNtR https : //t.co/6bfdbkXYKF",2019-04-27
Aland Javier,Molestina Malta,ALANDMOLESTINAM,exito inauguramos Escuela Capacitacion Politica . Anhelo conocimiento lleve encontrar mejor camino pais . # ConcertacionCivicaNacional https : //t.co/CMQ2VEdrrF https : //t.co/sHQQKVtmHA,2019-04-27
Aland Javier,Molestina Malta,ALANDMOLESTINAM,"! Ecuador salir adelante ! Gracias invitarme poder participar dia fiesta Pajan , provincia Manabi . Hoy Festival Gastronomico torta choclo mas grande mundo , midio 94 metros largo # ConcertacionCivicaNacional https : //t.co/lZyGogrkUj",2019-04-28
Aland Javier,Molestina Malta,ALANDMOLESTINAM,"Venezuela cada vez mas cerca encontrar camino hacia libertad . embargo , hace falta decision poder armas . ! Viva Venezuela libre ! # ConcertacionCivicaNacional https : //t.co/nirg4eSRtv https : //t.co/Dct37MkqkU",2019-04-30
Aland Javier,Molestina Malta,ALANDMOLESTINAM,Ahora mas nunca comunidad internacional debe apoyar Guaido . caida chavismo Venezuela fuertes repercusiones paises regimenes politicos totalitarios fascistas . 1/2 # ConcertacionCivicaNacional https : //t.co/VSQndtCLvc,2019-04-30
Aland Javier,Molestina Malta,ALANDMOLESTINAM,"... Cuba quedaria ayuda economica importante afectaria debil economia . pasara gran deuda Venezuela mantiene China Rusia . debilita foro Sao Paulo . DESMAYES GUAIDO , venezolanos deben bajar guardia . 2/2 https : //t.co/KBj1pZaHVZ",2019-04-30
Aland Javier,Molestina Malta,ALANDMOLESTINAM,"luchando pestilente corrupcion infame impunidad , mientras asambleistas hacen componendas . ! Venezuela libre ! # ConcertacionCivicaNacional https : //t.co/sxIBXTJu4N",2019-04-30
Aland Javier,Molestina Malta,ALANDMOLESTINAM,"CNE brazo ejecutor fraude electoral pais , sabemos . sabemos logrado perfeccionarlo . # ConcertacionCivicaNacional https : //t.co/uCOCZjUQ8I",2019-05-01
Aland Javier,Molestina Malta,ALANDMOLESTINAM,"Instalacion Asamblea Popular participacion distintas organizaciones sociales , fin estructurar acciones tendientes pro defensa # CPCCS , garantia derechos ciudadanos . # ConcertacionCivicaCiudadana https : //t.co/NItMm8E4m9",2019-05-09
Aland Javier,Molestina Malta,ALANDMOLESTINAM,"! Ecuador merece Nuevo Rumbo ! Seguimos fortaleciendo accionar Escuela Formacion Politica Ciudadana # CCN. , participaremos proximo taller : Sabado 11 mayo . > Politica nacional contemporanea siglo XXI , periodo 2000-2019 . > Introduccion campanas politicas . https : //t.co/0MAsmFkmMQ",2019-05-11
Aland Javier,Molestina Malta,ALANDMOLESTINAM,"@ viviecuador @ HernanUlloa Gracias confianza . proceso elecciones miembros CPCCS hecho tal forma , complejo hacer control electoral todas fases garantice respeto cumplimiento prohibiciones asi voto urnas .",2019-05-12
Aland Javier,Molestina Malta,ALANDMOLESTINAM,"Reunion trabajo integrantes Comision Asamblea Popular , elegidos defender Participacion Ciudadana . # ConcertacionCivicaNacional https : //t.co/8fsdAhngvs",2019-05-14
