nombre,apellidos,tweet_screen_name,tweet_text,tweet_date
James Byron,Montenegro Ordonez,JamesMcpccs,ceomespecuador CorporacionGES ONU derechos CPCCS SofiaAlmeidaEc jobafonfay2019 monka78 HernanUlloa FranklinMorenoQ davidroserow ALANDMOLESTINAM ChugchilanJaime JamesMontenegro Candidato CPCCS pongo conocimiento plan trabajo experiencia profesional perfil profesional tambien firmar LosPrincipiosyValoresNoSeNegocian,2019-02-20
James Byron,Montenegro Ordonez,JamesMcpccs,1029fmDistrito JamesMotenegro candidato CPCCS Elecciones2019EC gustaria compartir ustedes exclusiva audiencia propuesta,2019-02-20
James Byron,Montenegro Ordonez,JamesMcpccs,Conoce propuestas llegar CPCCS radio forever925 LuisaMaHeredia,2019-02-22
James Byron,Montenegro Ordonez,JamesMcpccs,Conoce propuestas llegar CPCCS radio forever925 LuisaMaHeredia,2019-02-22
James Byron,Montenegro Ordonez,JamesMcpccs,FelizDomingo Hoy estare radio forever925 92 5 FM Acompaname 11h00 programa AFondo JamesMontenegro,2019-02-24
James Byron,Montenegro Ordonez,JamesMcpccs,FelizDomingo Hoy estare radio forever925 92 5 FM Acompaname 11h00 programa AFondo JamesMontenegro,2019-02-24
James Byron,Montenegro Ordonez,JamesMcpccs,propuesta compuesta 3 ejes 1 designacion autoridades 2 fortalecer participacion ciudadana 3 Generar politica publica lucha corrupcion forever925 LuisaMaHeredia JamesMontenegro,2019-02-24
James Byron,Montenegro Ordonez,JamesMcpccs,radio forever925 LuisaMaHeredia Vamos proponer reforma Ley Participacion Ciudadana permita Consejo demas designar evaluar ratificar destituir autoridades JamesMontenegro,2019-02-24
James Byron,Montenegro Ordonez,JamesMcpccs,Generacion fortalecimiento principios valores trabajando ninos ninas jovenes objetivo fortalecer capacidades futuras autoridades forever925 LuisaMaHeredia JamesMontenegro,2019-02-24
James Byron,Montenegro Ordonez,JamesMcpccs,Fortalecer lucha corrupcion modelo triple helice poder Ejecutivo Funcion Judicial Funcion Transparencia Control Social forever925 LuisaMaHeredia JamesMontenegro,2019-02-24
James Byron,Montenegro Ordonez,JamesMcpccs,candidato CPCCS JamesMcpccs explico propuestas campana AFondo forever925,2019-02-24
James Byron,Montenegro Ordonez,JamesMcpccs,24 marzo 2019 encuentrame papeleta Hombres casillero 18 candidato CPCCS forever925 JamesMontenegro,2019-02-24
James Byron,Montenegro Ordonez,JamesMcpccs,JamesMontenegro,2019-02-25
James Byron,Montenegro Ordonez,JamesMcpccs,candidatura responde ningun partido movimiento politico debo ningun gobierno JamesMotenegro ciudadano Ecuatoriano independiente pido apoyo CPCCS juntos luchemos corrupcion Elecciones2019EC,2019-02-27
James Byron,Montenegro Ordonez,JamesMcpccs,VIDEO Gracias elcomerciocom entrevista JamesMontenegro propuesta,2019-03-01
James Byron,Montenegro Ordonez,JamesMcpccs,Ampoyo incondicional amigo JamesMontenegro Elecciones2019EC LosPrincipiosyValoredNoSeNegocian CNE,2019-03-01
James Byron,Montenegro Ordonez,JamesMcpccs,buen lider cambia mundo Ecuador JamesMontenegro Elecciones2019EC LuchaContraLaCorrupcion LosPrincipiosyValoresNoSeNegocian CNE,2019-03-01
James Byron,Montenegro Ordonez,JamesMcpccs,ONU derechos Papeleta elegir HOMBRES Vota Hernan Ulloa HernanUlloa David Rosero davidroserow James Montenegro JamesMcpccs IDONEOS ser tres Candidaturas INDEPENDIENTES ser Consejeros CPCCS Aceptaron firmar Pacto Etico 4 COMPROMISOS,2019-03-01
James Byron,Montenegro Ordonez,JamesMcpccs,ONU derechos Pacto Etico 4 COMPROMISOS identifica Consejeros INDEPENDIENTES debemos elegir 24 marzo 2019 VotoResponsableTransparente Papeletas HOMBRES sera HernanUlloa davidroserow JamesMcpccs NemySantacruz Directora CRS,2019-03-04
James Byron,Montenegro Ordonez,JamesMcpccs,YoNoVotoNulo YoVotoporJames JamesMontenegro,2019-03-06
James Byron,Montenegro Ordonez,JamesMcpccs,CorporacionGES ONU derechos HernanUlloa davidroserow KariPonce11 SofiaAlmeidaEc jobafonfay2019 ChugchilanJaime Comparto ustedes propuesta tecnica gracias contribucion elcomerciocom,2019-03-06
James Byron,Montenegro Ordonez,JamesMcpccs,FELIZ DIA MUJER Gracias incansable lucha construir mundo mas justo bueno digno ejemplo fuerza justicia 8M2019 mundo socialmente iguales humanamente diferentes totalmente libres Rosa Luxemburgo,2019-03-08
James Byron,Montenegro Ordonez,JamesMcpccs,FELIZ DIA MUJER Gracias incansable lucha construir mundo mas justo bueno digno ejemplo fuerza justicia 8M2019 mundo socialmente iguales humanamente diferentes totalmente libres Rosa Luxemburgo,2019-03-08
James Byron,Montenegro Ordonez,JamesMcpccs,CPCCS debe integrado Ciudadanos alta formacion profesional trayectoria servicio publico transparencia comprobada accionar gracias CorporacionGES difundir lista 7 candidatos responden ningun tipo compromiso politico,2019-03-11
James Byron,Montenegro Ordonez,JamesMcpccs,cvsimport 2015 NemySantacruz CorporacionGES ChugchilanJaime SofiaAlmeidaEc KariPonce11 HernanUlloa davidroserow JamesMcpccs,2019-03-12
James Byron,Montenegro Ordonez,JamesMcpccs,ONU derechos James Montenegro JamesMcpccs Candidatura nominada Papeleta Hombres Consejero INDEPENDIENTE dentro Pacto Etico COMPROMISOS propuesto CorporacionGES 7 Candidaturas Consejeros INDEPENDIENTES Perfil Video presentacion,2019-03-12
James Byron,Montenegro Ordonez,JamesMcpccs,ONU derechos respaldo Candidaturas Consejeros CPCCS INDEPENDIENTES aceptado firmar Pacto Etico 4 COMPROMISOS HernanUlloa davidroserow JamesMcpccs VotoResponsableTransparente ustedes ceomespecuador NemySantacruz KSantacruzM,2019-03-12
James Byron,Montenegro Ordonez,JamesMcpccs,CorporacionGES CPCCS AsambleaEcuador c larreategui diegoordonezg Josernandez1 JCTrujilloCPCCS PabloDavilaJ 4pelagatos4 LassoGuillermo jaimenebotsaadi mejor proponen desaparezca cuna mas grande corrupcion negociados AsambleaEcuador YoNoVotoNulo YoVotoporJames JamesMontenegro 6 candidatos nomino CorporacionGES davidroserow HernanUlloa SofiaAlmeidaEc,2019-03-12
James Byron,Montenegro Ordonez,JamesMcpccs,24 marzo cuento apoyo Juntos construiremos Ecuador sonamos Justo inclusivo solidario libre Corrupcion Encuentrame paleta hombres segunda fila izquierda aderecha 4to casillero,2019-03-12
James Byron,Montenegro Ordonez,JamesMcpccs,ONU derechos mantendre informados HernanUlloa davidroserow JamesMcpccs ChugchilanJaime KariPonce11 jobafonfay2019 SofiaAlmeidaEc ceomespecuador,2019-03-14
James Byron,Montenegro Ordonez,JamesMcpccs,43 candidatos CPCCS 18 conocen atribuciones sigue Link Debemos informarnos votar odio votar fanatismo Existen candidatos JamesMcpccs transparencia comprobada YoNoVotoNulo YoVotoporJames,2019-03-14
James Byron,Montenegro Ordonez,JamesMcpccs,ONU derechos onumujeresEcu VotoMujerJuventudINDEPENDIENTE PactoEticoConsejeros7COMPROMISOS Mujeres KariPonce11 SofiaAlmeidaEc jobafonfay2019 Hombres HernanUlloa davidroserow JamesMcpccs Pueblos Nacionalidades ChugchilanJaime NemySantacruz CorporacionGES,2019-03-18
James Byron,Montenegro Ordonez,JamesMcpccs,VotoMujerJuventudINDEPENDIENTE garanticen CPCCS Potencie Fortalecimiento Institucional permitan desaparezca pierda capacidad designar Autoridades Control Luche Corrupcion HernanUlloa davidroserow JamesMcpccs,2019-03-18
James Byron,Montenegro Ordonez,JamesMcpccs,VotoCiudadaniaINDEPENDIENTE ChugchilanJaime 3 jobafonfay2019 8 5 KariPonce11 2 9 SofiaAlmeidaEc 8 5 HernanUlloa 8 5 davidroserow 1 JamesMcpccs 1 Representan 6 9 Zonas Candidaturas CPCCS,2019-03-18
James Byron,Montenegro Ordonez,JamesMcpccs,Atentos escuchar propuestas JamesMcpccs candidato probado comprobado YoVotoPorJames,2019-03-20
James Byron,Montenegro Ordonez,JamesMcpccs,ONU ONU derechos Entrevista JamesMcpccs James Montenegro Candidatura CPCCS Contacto Directo ecuavisa Miercoles 20 marzo 2019 CorporacionGES promueve Voto 7 Candidaturas Consejeros INDEPENDIENTES Pacto Etico 7 COMPROMISOS defiendan OSC,2019-03-20
James Byron,Montenegro Ordonez,JamesMcpccs,ENVIDEO JamesMcpccs candidato Cpccs votar nulo desperdiciar voto,2019-03-20
James Byron,Montenegro Ordonez,JamesMcpccs,Votar nulo entregar atribuciones AsambleaEcuador siga negociando pais YoNoVotoNulo PorElNulo EleccionesCPCCS YoVotoporJames JamesMcpccs,2019-03-20
James Byron,Montenegro Ordonez,JamesMcpccs,dialogos demo CPCCS davalos2019 HernanUlloa FranklinMorenoM ayrtonruales JesusLongo Gabriel Reyes G Araca Araujo DavidLaraNovil1 davidjarrinc luisesgo Gracias difundir candidaturas Conoce mas propuesta JamesMcpccs JamesMotenegro ustedes saben papeletas numero encuentrame segunda fila 4to casillero PorElNulo 24 marzo cuento apoyo,2019-03-21
James Byron,Montenegro Ordonez,JamesMcpccs,dialogos demo CPCCS davalos2019 HernanUlloa FranklinMorenoM ayrtonruales JesusLongo Gabriel Reyes G Araca Araujo DavidLaraNovil1 davidjarrinc luisesgo Gracias difundir candidaturas Conoce mas propuesta JamesMcpccs JamesMotenegro ustedes saben papeletas numero encuentrame segunda fila 4to casillero PorElNulo 24 marzo cuento apoyo,2019-03-21
James Byron,Montenegro Ordonez,JamesMcpccs,MOFLETV mujer inteligente voto nulo irresponsabilidad 24 marzo PorElNulo YoVotoporJames JamesMcpccs,2019-03-21
James Byron,Montenegro Ordonez,JamesMcpccs,24 marzo oportunidad escribir nuevo capitulo historia Ecuador Aspiro ser primer indigena eleccion popular llegar CPCCS luchar corrupcion devolver esperanza dias mejores todas ecuatorianos,2019-03-22
James Byron,Montenegro Ordonez,JamesMcpccs,Manana primera vez elegimos 7 consejeros CPCCS voto popular Acudamos urnas defender ganado Constitucion 2008 Quinto Poder Encuentrame papeleta hombres Segunda fila 4to casillero Cuento contigo,2019-03-23
James Byron,Montenegro Ordonez,JamesMcpccs,SantiagoBasabeS romeltintin CPCCS Eliminar CPCCS sera segundo momento realidad vera manana Acudamos urnas defender ganado Constitucion 2008 CPCCS Elecciones2019EC votare JamesMcpccs pueblos nacionalidades ChugchilanJaime,2019-03-24
James Byron,Montenegro Ordonez,JamesMcpccs,cnegobec OEA oficial ecuavisa eluniversocom telegrafo notiecuadoradio tctelevision TelediarioEC Despues pronunciamiento ahora mas nunca Ecuatorianos acudamos urnas defender ganado Constitucion 2008 CPCCS EleccionesCPCCS votemos candidatos ataduras politicas dispuestos luchar corrupcion Cuento apoyo,2019-03-24
James Byron,Montenegro Ordonez,JamesMcpccs,Manana primera vez elegimos 7 consejeros CPCCS voto popular Acudamos urnas defender ganado Constitucion 2008 Quinto Poder Encuentrame papeleta hombres Segunda fila 4to casillero Cuento contigo,2019-03-24
James Byron,Montenegro Ordonez,JamesMcpccs,voto consejeros CPCCS sido HernanUlloa DavidRoseroW JamesMcpccs KariPonce11 SofiaAlmeidaEc VickyDesintonio ChugchilanJaime PoliticaEc Elecciones2019EC Elecciones2019 EcuadorDecide2019,2019-03-24
James Byron,Montenegro Ordonez,JamesMcpccs,Mas alla travesuras campearon elecciones respetar autoridades electas nuevo cpccs Aquellos sirvieron beneplacito Transitorio hoy quieren meterle mano voluntad popular mas manoseada decidio CUIDADO,2019-03-28
