nombre,apellidos,tweet_screen_name,tweet_text,tweet_date
Paola,Vintimilla,PaolaVintimilla,impulsar desarrollo economico Quito trabajar verdaderos generadores empleo empresa privada reduciendo tecnificando tramitologia municipal mas rapido emprender vez crear mas plazas trabajo ElCambioVieneSioSi,2019-03-18
Paola,Vintimilla,PaolaVintimilla,trabajado ciudad 27 anos persona transparente honesta pasado oscuro Quiero llegar Alcaldia servir servirme ElCambioVieneSioSi,2019-03-18
Paola,Vintimilla,PaolaVintimilla,Vamos cambio confio plenamente usted va cambiar capital ecuatorianos Vamos terminar mucha fe confianza,2019-03-18
Paola,Vintimilla,PaolaVintimilla,Vamos incentivar visita nacionales extranjeros bellas parroquias Implementaremos proyecto Ruta Parroquias incentivar turismo religioso gastronomico ecoturismo agroturismo Quito ElCambioVieneSioSi,2019-03-19
Paola,Vintimilla,PaolaVintimilla,Comparto agenda miercoles 20 marzo Espero gran dia,2019-03-20
Paola,Vintimilla,PaolaVintimilla,Comparto agenda miercoles 20 marzo Espero gran dia,2019-03-20
Paola,Vintimilla,PaolaVintimilla,Vamos poner orden Municipio zonales ser minialcaldias administradas misma forma Municipio cuotas poder terminaron volveremos tener concejales grillete solo dedicaran legislar fiscalizar radiosonorama,2019-03-20
Paola,Vintimilla,PaolaVintimilla,Iniciamos Conversatorio Candidatos organizado PUCE Ecuador,2019-03-20
Paola,Vintimilla,PaolaVintimilla,Necesitamos reactivar departamento permite coordinacion seguridad ciudadana Municipio ECU911 recepte rapidamente reportes Agentes Metropolitanos Control Policia actue forma eficaz,2019-03-20
Paola,Vintimilla,PaolaVintimilla,ENVIDEO Paola Vintimilla promete Quito Vivo impulse turismo genere empleo PaolaVintimilla,2019-03-20
Paola,Vintimilla,PaolaVintimilla,Quito Vivo queremos plazas parques esten llenos arte alegria familias amigos tomen calles disfrutando cultura patrimonio 24 marzo votemos progreso Quito ElCambioVieneSioSi,2019-03-21
Paola,Vintimilla,PaolaVintimilla,Acompaname minutos RADIOAMERICAEC,2019-03-21
Paola,Vintimilla,PaolaVintimilla,PaolaVintimilla 24 marzo nueva oportunidad Quitenos cambiar forma gestionar Alcaldia Aqui 104 5 FM Jorgeacato RamiroDiaz64 longogalo,2019-03-21
Paola,Vintimilla,PaolaVintimilla,PaolaVintimilla Espero corazon concejales quiten bandera politica trabajen realmente ciudad Aqui 104 5 FM Jorgeacato RamiroDiaz64 longogalo,2019-03-21
Paola,Vintimilla,PaolaVintimilla,Gracias Quito cada paso dimos sentimos carino respeto ganas progresar gente Vamos defender Carita Dios vamos transformar comprometidos domingo empieza cambio ElCambioVieneSioSi,2019-03-22
Paola,Vintimilla,PaolaVintimilla,Palacio Municipal Quito quiero tener autoridad quiero tener amiga pueblo pueda saludar directamente dialogar persona ud PaolaVintimilla Dios ilumine 24 marzo cambiara historia Quito,2019-03-22
Paola,Vintimilla,PaolaVintimilla,Llego momento domingo debemos poner cambio Quito 6 PaolaVintimilla Alcadesa,2019-03-22
Paola,Vintimilla,PaolaVintimilla,Llego momento domingo debemos poner cambio Quito 6 PaolaVintimilla Alcadesa,2019-03-22
Paola,Vintimilla,PaolaVintimilla,Gracias apoyo confianza segura podemos cambiar modelo deja Quito prosperar 24 marzo votemos 6,2019-03-22
Paola,Vintimilla,PaolaVintimilla,modesto criterio mas alla cualidades personas Quito necesita alguien rompa modelo perverso deja avanzar PaolaVintimilla,2019-03-23
Paola,Vintimilla,PaolaVintimilla,falta planificacion ciudad permitido barrios enteros construyan zonas alto riesgo solidaridad familias esperamos autoridades den apoyo inmediato Pinar Alto,2019-03-23
Paola,Vintimilla,PaolaVintimilla,Gracias apoyo confianza segura podemos cambiar modelo deja Quito prosperar 24 marzo votemos 6,2019-03-23
Paola,Vintimilla,PaolaVintimilla,Manana oportunidad construir nuevo Quito Quito lleno oportunidades Agradezco Dios vida oportunidad puso camino,2019-03-23
Paola,Vintimilla,PaolaVintimilla,modesto criterio mas alla cualidades personas Quito necesita alguien rompa modelo perverso deja avanzar PaolaVintimilla,2019-03-24
Paola,Vintimilla,PaolaVintimilla,cnegobec Colegio Pablo Munoz Vega Calderon existen varias anomalias 1 mesa 117 hombres solo estan entregando 6 7 papeletas 2 respectivas actas cada junta delegados movimientos partidos politicos TCE Ecuador PaolaVintimilla,2019-03-24
Paola,Vintimilla,PaolaVintimilla,juancaholguin mariasolcorral CesarMontufar51 JCSolines PabloDavalos63 abrazo Juan Carlos gusto conocerte tambien,2019-03-24
Paola,Vintimilla,PaolaVintimilla,unico ganador debe ser Quito quitenos merecemos ver ciudad brillar Gracias respaldaron camino vamos defraudar cuenten conmigo transformar capital GRACIAS,2019-03-24
Paola,Vintimilla,PaolaVintimilla,Felicidades querida CynthiaViteri6 duda Guayaquil queda mejores manos progreso continua,2019-03-25
Paola,Vintimilla,PaolaVintimilla,CapacityKilling CynthiaViteri6 Jamas trabajado TVentas pena desinformacion,2019-03-25
Paola,Vintimilla,PaolaVintimilla,luis matute20 CynthiaViteri6 Gracias,2019-03-25
Paola,Vintimilla,PaolaVintimilla,Carlitoxmo CesarMontufar51 PacoMoncayo 35PAIS fabriciovelav alexismoncayo limpiando CNE da tiempo cumpliremos,2019-03-30
Paola,Vintimilla,PaolaVintimilla,propuestas ojala LoroHomero acoja 85 perritos estan calle dueno esten casas contrario deberia aplicarse ordenanza tenencia responsable,2019-03-30
Paola,Vintimilla,PaolaVintimilla,carolcarolinap9 LoroHomero entiendo interesa educacion contesto reinita trabajado 30 anos 17 empresa privada buscare trabajo pais Saludos disfruta vida,2019-03-30
Paola,Vintimilla,PaolaVintimilla,edisonguadual LoroHomero renunciar,2019-03-30
Paola,Vintimilla,PaolaVintimilla,mariaantonia888 CesarMontufar51 PacoMoncayo MunicipioQuito haciendo cumpliremos tiempos da ley,2019-04-02
Paola,Vintimilla,PaolaVintimilla,CharlyCarrascoB juancaholguin PacoMoncayo haciendo cumpliremos tiempos da ley,2019-04-02
Paola,Vintimilla,PaolaVintimilla,CharlyCarrascoB juancaholguin PacoMoncayo Asi Cc renzolombeida gabo galan melo,2019-04-02
Paola,Vintimilla,PaolaVintimilla,mariaantonia888 CesarMontufar51 PacoMoncayo MunicipioQuito Pienso igual abrazo,2019-04-02
Paola,Vintimilla,PaolaVintimilla,mariaantonia888 CesarMontufar51 PacoMoncayo MunicipioQuito Cc gabo galan melo renzolombeida La6Pichincha,2019-04-02
Paola,Vintimilla,PaolaVintimilla,JOSEALTH CesarMontufar51 PacoMoncayo CapiZapataEC juancaholguin fabriciovelav Rafael Lugo N ramirodiez alexismoncayo fabricevallos limpiando cumpliremos tiempo da ley Cc gabo galan melo renzolombeida La6Pichincha,2019-04-02
Paola,Vintimilla,PaolaVintimilla,pauledu2017 Edward Coke pamozaec PacoMoncayo CesarMontufar51 limpiando cumpliremos tiempo da ley Cc gabo galan melo renzolombeida La6Pichincha,2019-04-02
Paola,Vintimilla,PaolaVintimilla,nataliappm CesarMontufar51 limpiando cumpliremos tiempo da ley Cc gabo galan melo renzolombeida La6Pichincha,2019-04-02
Paola,Vintimilla,PaolaVintimilla,oscar arrob CesarMontufar51 CapiZapataEC PacoMoncayo MauricioRodasEC luisevivanco limpiando cumpliremos tiempo da ley Cc gabo galan melo renzolombeida La6Pichincha,2019-04-02
Paola,Vintimilla,PaolaVintimilla,JuanKarlozN Carlitoxmo Sandinin CesarMontufar51 PacoMoncayo 35PAIS fabriciovelav alexismoncayo limpiando cumpliremos tiempo da ley Cc gabo galan melo renzolombeida La6Pichincha,2019-04-02
Paola,Vintimilla,PaolaVintimilla,CabildoCivico LoroHomero PacoMoncayo CesarMontufar51 jalaldubois rpadpre luisevivanco AndresCarrion2 AndreSamaniego malenasofiamf limpiando cumpliremos tiempo da ley Cc gabo galan melo renzolombeida La6Pichincha,2019-04-02
Paola,Vintimilla,PaolaVintimilla,jlecheverriac concertacionec CesarMontufar51 La6Ecuador PacoMoncayo ID12Ecuador CapiZapataEC DemocraciaaSI eduardodelp CREOEcuador PartidoAvanza PaolaPabonC Gabitegui limpiando cumpliremos tiempo da ley Cc gabo galan melo renzolombeida La6Pichincha,2019-04-02
Paola,Vintimilla,PaolaVintimilla,jlecheverriac concertacionec CesarMontufar51 La6Ecuador Gabitegui MauricioRodasEC limpiando cumpliremos tiempo da ley Cc gabo galan melo renzolombeida La6Pichincha,2019-04-02
Paola,Vintimilla,PaolaVintimilla,wendybarreiro CapiZapataEC LuisaMaldonadoM CesarMontufar51 limpiando cumpliremos tiempo da ley Cc gabo galan melo renzolombeida La6Pichincha,2019-04-02
Paola,Vintimilla,PaolaVintimilla,fin hoy escucharan voces involucrados LeyUtilidadesPetroleros asi podra aprobar informe Seguimos avanzando PaolaVintimilla VaPetrolero,2019-04-03
Paola,Vintimilla,PaolaVintimilla,cristiancaiza fabriciovelav luisevivanco gisella bayona LoroHomero MunicipioQuito La6Ecuador Sau sinpastor 24horasUIO CrudoEc7 SofiaMerinoRiv limpiando cumpliremos tiempo da ley Cc gabo galan melo renzolombeida La6Pichincha,2019-04-03
Paola,Vintimilla,PaolaVintimilla,PORFA compartan publicacion Alejandro Ludena sabe hace dias primo amigos cualquier dato puedan tener paradero x favor comunicarse numeros publicacion PaolaVintimilla teleamazonasec Hellenquinonez,2019-04-06
Paola,Vintimilla,PaolaVintimilla,mcbrujitar CesarMontufar51 PacoMoncayo Cc gabo galan melo renzolombeida La6Pichincha,2019-04-07
Paola,Vintimilla,PaolaVintimilla,mafergasa CesarMontufar51 CapiZapataEC LoroHomero Gracias decirme lugar quitamos,2019-04-08
Paola,Vintimilla,PaolaVintimilla,PaolaVintimilla Dentro documentos principio envio Cancilleria podiamos ver habia irregularidades otorgamiento cedula pasaporte JulianAssange,2019-04-11
Paola,Vintimilla,PaolaVintimilla,Leyendo noticia Assange expertos politica internacional comparten criterios pocas personas hablaba ejecutaba acciones tema coyuntural PaolaVintimilla LA6MDG,2019-04-11
Paola,Vintimilla,PaolaVintimilla,,2019-04-11
Paola,Vintimilla,PaolaVintimilla,Hoy conversaremos retiro nacionalidad asilo Assange espero,2019-04-11
Paola,Vintimilla,PaolaVintimilla,PaolaVintimilla correcto creado reglamento particular entregarle ciudadania Assange JulianAssange,2019-04-11
Paola,Vintimilla,PaolaVintimilla,PaolaVintimilla cosas empezaron transparentarse ValenciaJoseEc entro cancilleria evidente mfespinosaEC canciller escondia JulianAssange,2019-04-11
Paola,Vintimilla,PaolaVintimilla,NotiMundoalaCarta conversamos PaolaVintimilla caso JulianAssange Escuchanos 98 1 Quito web aqui,2019-04-11
Paola,Vintimilla,PaolaVintimilla,Hoy 11 abril 9 00 pm ECU PaolaVintimilla VillaFernando debaten NTN24 decision Ecuador retirarle asilo Julian Assange Participa programa RicardoPatinoEC excanciller Gobierno Rafael Correa Dirige conduce andrebernal26,2019-04-11
Paola,Vintimilla,PaolaVintimilla,AlAire Hizo bien Ecuador retirarle asilo diplomatico Julian Assange PaolaVintimilla VillaFernando debaten NTN24 senal vivo,2019-04-12
Paola,Vintimilla,PaolaVintimilla,ZoomAssange PaolaVintimilla Julian Assange habia roto hace tiempo excusas indispensables mantenerse asilado Embajada Londres AlAire,2019-04-12
Paola,Vintimilla,PaolaVintimilla,ZoomAssange PaolaVintimilla Ojala senor Ricardo Patino siga defendiendo Assange saque toda informacion podria tener Gobierno Rafael Correa AlAire,2019-04-12
Paola,Vintimilla,PaolaVintimilla,ZoomAssange PaolaVintimilla aqui adelante Reino Unido haga cuanto extradicion Assange tendra responder Reino Unido ver Ecuador AlAire,2019-04-12
Paola,Vintimilla,PaolaVintimilla,Increible Ahora resulta Cancilleria manos Espinosa enganada asi quieren salvarla primeros denunciarlo Aqui dejo denuncia sep 2018 pedido Contraloria investigue lizvalarezo,2019-04-12
Paola,Vintimilla,PaolaVintimilla,Lacl Collita Lenin AsambleaEcuador CorteConstEcu VaPorTiTrabajadorPetrolero ejemplo Demagogia pura dura politiqueria palabras embargo agradecer PaolaVintimilla lduranaguilar CristinaReyesec BaironValleP callimanta VicenteTaianoEC Raultellob LaboralAN,2019-04-13
Paola,Vintimilla,PaolaVintimilla,aaje25678 Lacl Collita Lenin AsambleaEcuador CorteConstEcu PaolaVintimilla lduranaguilar CristinaReyesec BaironValleP callimanta VicenteTaianoEC Raultellob LaboralAN trata luchar velar derechos trabajadores EXISTE BANDERA POLITICA quede claro aquellos tartan desinformar companeros Amazonia 15 corresponde justo hacer obras dinero bolsillos,2019-04-13
Paola,Vintimilla,PaolaVintimilla,Hoy Cable Noticias,2019-04-13
Paola,Vintimilla,PaolaVintimilla,Manana acompane entrevista programa QuitoTV Arq David Lopez telesucesos29,2019-04-15
Paola,Vintimilla,PaolaVintimilla,agenda medios manana excelente inicio semana,2019-04-15
Paola,Vintimilla,PaolaVintimilla,Llegando hermosa provincia Manabi deben gobiernos turno duda mejor comida mejores playas gente fantastica,2019-04-15
Paola,Vintimilla,PaolaVintimilla,Siniestrus MauJTH ani ec2 andrespaezec Educacion Ec Presidencia Ec Lenin AsambleaEcuador ESTEFANIESPIN tinocotania Segun nota haran tambien seria excelente si cambian malla curricular vuelve impartir materias logica etica civica septiembre sera educacion holistica,2019-04-16
Paola,Vintimilla,PaolaVintimilla,Segun nota eliminaran textos hablan logros revolucion ciudadana bien Tambien seria excelente si cambian malla curricular vuelve impartir materias logica etica civica Ahora daran educacion holistica,2019-04-16
Paola,Vintimilla,PaolaVintimilla,PaolaVintimilla Pao tema parte proyecto presente junto bloque ago 2018 afortunadamente incluido Informe Primer Debate debatido Pleno Asamblea abr 02 2019 necesario garantizar educacion integral jovenes,2019-04-16
Paola,Vintimilla,PaolaVintimilla,deberian debatir 1 000 dolares representa trabajo hacen Claro trabajan deberian pagarles asistencia pleno comisiones Si van pasa casos deberian reciben sueldo punto,2019-04-16
Paola,Vintimilla,PaolaVintimilla,deberian debatir 1 000 dolares representa trabajo hacen Claro trabajan deberian pagarles asistencia pleno comisiones Si van pasa casos deberian recibir sueldo punto,2019-04-16
Paola,Vintimilla,PaolaVintimilla,Dario1809 pamozaec LoroHomero QUITOVIGlLA MunicipioQuito Dario da ubicacion favor gabo galan melo renzolombeida La6Pichincha,2019-04-17
Paola,Vintimilla,PaolaVintimilla,mayo 2018 hable politikcorrecta aplicacion Doctrina Roldos casi ano despues deciden pedir situacion Venezuela sigue siendo cruel gente,2019-04-18
Paola,Vintimilla,PaolaVintimilla,mayo 2018 hable politikcorrecta aplicacion Doctrina Roldos casi ano despues deciden pedir situacion Venezuela sigue siendo cruel gente,2019-04-19
Paola,Vintimilla,PaolaVintimilla,mayo 2018 hable politikcorrecta aplicacion Doctrina Roldos casi ano despues deciden pedir situacion Venezuela sigue siendo cruel gente,2019-04-19
Paola,Vintimilla,PaolaVintimilla,Manana RADIOAMERICAEC hablaremos nacionalidad Assange responsabilidad politica administrativa ex Canciller Tambien aplicacion Doctrina Roldos situacion Venezuela Buen inicio semana,2019-04-22
Paola,Vintimilla,PaolaVintimilla,PaolaVintimilla analiza Dotrina Roldos marco panorama venezolano 104 5 FM Jorgeacato RamiroDiaz64 longogalo,2019-04-22
Paola,Vintimilla,PaolaVintimilla,PaolaVintimilla dio asilo Assange siendo acusado crimen comun violacion Suecia Ahi comienzan irregularidades 104 5 FM Jorgeacato RamiroDiaz64 longogalo,2019-04-22
Paola,Vintimilla,PaolaVintimilla,PaolaVintimilla Sr Assange autodenomino hacker habla ser periodista hacker bien visto mundo consecuencias Aqui 104 5 FM Jorgeacato RamiroDiaz64 longogalo,2019-04-22
Paola,Vintimilla,PaolaVintimilla,PaolaVintimilla habla dio conocer irregularidades Nacionalidad Assange 104 5 FM Jorgeacato RamiroDiaz64 longogalo,2019-04-22
Paola,Vintimilla,PaolaVintimilla,AHORA BuenosDiasAmerica acompana PaolaVintimilla ex asambleista hablar Nacionalidad Assange Aplicacion Doctrina Roldos 104 5 FM miranos Jorgeacato RamiroDiaz64 longogalo,2019-04-22
Paola,Vintimilla,PaolaVintimilla,PaolaVintimilla AsambleaEcuador inicio investigacion M Espinosa pidio retiro ciudadania Assange retiro sueldo vitalicio ex vice presidentes corruptos devolucion utilidades trabajadores ley 80 20 favor empleo nacional abro hilo,2019-04-23
Paola,Vintimilla,PaolaVintimilla,ATENCION QUITENOS Estaria quedar impune mayor trama corrupcion dio Municipio Quito Garnica Sanchez Tapia FiscaliaEcuador debe investigar ex Fiscal General Ruth Palacios designo Fiscal CANAR Abro hilo,2019-04-23
Paola,Vintimilla,PaolaVintimilla,ricrye SrWeikath Vivimonse LoroHomero fabovillamar CarlosVerareal organizarse,2019-04-23
Paola,Vintimilla,PaolaVintimilla,QuitoVivo alegra Alcalde electo LoroHomero acoja propuesta dije generara fuentes empleo seguridad si bien manejado,2019-04-23
Paola,Vintimilla,PaolaVintimilla,SoyPablinho NaturalFake84 sebasdeliga LoroHomero deberian,2019-04-23
Paola,Vintimilla,PaolaVintimilla,Jr Edu10 LoroHomero Justamente Quito 24 horas daria mas seguridad ciudadano debe tomarse calles delincuentes reto digo si bien manejado asesorado puede funcionar ciudades mundo,2019-04-23
Paola,Vintimilla,PaolaVintimilla,Asi debe venir mano varias medidas Iluminacion apoyo empresa privada M Interior nuevas modalidades contratacion,2019-04-23
Paola,Vintimilla,PaolaVintimilla,propuesta Alcalde electo escuche bares restaurantes propuesta mas amplia incluia tambien cines supermercados farmacias Debe empezarse sectores propuesta requiere apoyo,2019-04-23
Paola,Vintimilla,PaolaVintimilla,QuitoVivo alegra Alcalde electo LoroHomero acoja propuesta dije generara fuentes empleo seguridad si bien manejado,2019-04-24
Paola,Vintimilla,PaolaVintimilla,ATENCION QUITENOS Estaria quedar impune mayor trama corrupcion dio Municipio Quito Garnica Sanchez Tapia FiscaliaEcuador debe investigar ex Fiscal General Ruth Palacios designo Fiscal CANAR Abro hilo,2019-04-24
Paola,Vintimilla,PaolaVintimilla,PaolaVintimilla,2019-04-24
Paola,Vintimilla,PaolaVintimilla,Tal vez peco ingenua pronto confio DianaSalazarM2 hara correcto,2019-04-24
Paola,Vintimilla,PaolaVintimilla,Hoy operan manana donaciones deben hacerse directamente Cruz Roja nombre JAIMAR OLIVO Ayudemosla,2019-04-24
Paola,Vintimilla,PaolaVintimilla,acaban enviar carta habria sido entregada 24horasUIO Sr Dario Tapia pide derecho replica palabras vertidas reportaje cbuendiav Cumplo difundirla 1 2,2019-04-24
Paola,Vintimilla,PaolaVintimilla,2 2,2019-04-24
Paola,Vintimilla,PaolaVintimilla,Hoy ganamos VamosLiga CopaLibertadores,2019-04-25
Paola,Vintimilla,PaolaVintimilla,Goooooooooooooooooooooooooooooooooooool dare dare Liga hermosa dare cosa cosa empieza C CAMPEON CopaLibertadores 1 1,2019-04-25
Paola,Vintimilla,PaolaVintimilla,GOOOOOOOLAZO 2 1 CopaLibertadores,2019-04-25
Paola,Vintimilla,PaolaVintimilla,FABIANGALLARDOM DiegoArcos14 ROBINNOVOA michaelrosero portillaoscar EstebanPazR PaolaVintimilla LDU Oficial Polificcion golazo chicaiza Vamos Rey Copas,2019-04-25
Paola,Vintimilla,PaolaVintimilla,Acompanando jaimenebotsaadi ElAfterDeLaPosta,2019-04-26
Paola,Vintimilla,PaolaVintimilla,Plan MasSeguridad sera realidad Alcaldia CynthiaViteri6 lograremos Guayaquil ciudad segura vicenteenmedios,2019-04-26
Paola,Vintimilla,PaolaVintimilla,Gol gol gol gol gooooooooooooooooooooool VamosLiga,2019-04-28
Paola,Vintimilla,PaolaVintimilla,Gol gol gol gol gooooooooooooooooooooooooooooooooooooooooooooooooooool dare dare Liga hermosa dare cosa cosa empieza C CAMPEON LigaCampeon VamosLiga,2019-04-28
Paola,Vintimilla,PaolaVintimilla,Gol gol gol Liga 0 3,2019-04-28
Paola,Vintimilla,PaolaVintimilla,Aqui 0 3 Liga,2019-04-28
Paola,Vintimilla,PaolaVintimilla,penal termina partido cuarto gol Gooooooooooooooooooooooooooooooooooooooooooooooooooooooooooooleada Ldu 0 4 LigaCampeon,2019-04-28
Paola,Vintimilla,PaolaVintimilla,Espero Ecuador oportunidades trabajo dignifica trabajo da vida Trabajar honestamente manera correcta avanzar vida DiaDelTrabajo,2019-05-01
Paola,Vintimilla,PaolaVintimilla,hombre defienden aun admiran Mujica VenezuelaEstamosContigo,2019-05-02
Paola,Vintimilla,PaolaVintimilla,frases merecio millones aplausos condecoraciones Mujica vida milagro vale mas vida claro socialistas hablan bonito afectan intereses caso mantener dictador Maduro memoria falla,2019-05-02
Paola,Vintimilla,PaolaVintimilla,VamosLiga LDUvsIDV,2019-05-04
Paola,Vintimilla,PaolaVintimilla,JC260469 gusto feriado,2019-05-04
Paola,Vintimilla,PaolaVintimilla,Vamos liga LDUvsIDV,2019-05-04
Paola,Vintimilla,PaolaVintimilla,Goooooooooooooooooooooooooooooooooooooooooooooooooooooooooooool LDUvsIDV VamosLiga,2019-05-04
Paola,Vintimilla,PaolaVintimilla,Realmente asqueroso juegan vida personas pregunto obligan gente afiliada IESS cloaca corrupcion deberiamos tener derecho elegir propio seguro,2019-05-07
Paola,Vintimilla,PaolaVintimilla,Llego momento servir Ecuador jaimenebotsaadi,2019-05-08
Paola,Vintimilla,PaolaVintimilla,4 0 noche viste blanco vemos octavos final VamosLiga CopaLibertadores,2019-05-09
Paola,Vintimilla,PaolaVintimilla,invito escuchar entrevista,2019-05-09
Paola,Vintimilla,PaolaVintimilla,Janet tenia decirte hice siempre respeto comentario personal orquestado nadie dice Sra Espinosa hice ciudadana espera consecuencias politicas administrativas malas acciones,2019-05-09
Paola,Vintimilla,PaolaVintimilla,Asi despide hombre ama ciudad transformado cuidado 19 anos Felicitaciones guayaquilenos continuar modelo progreso pais reclama GraciasNebot,2019-05-10
Paola,Vintimilla,PaolaVintimilla,comparacion jaimenebotsaadi sale Alcaldia aplaudido miles personas MashiRafael pais orden prision Asi mas,2019-05-10
Paola,Vintimilla,PaolaVintimilla,Grabando programa CartasMesaTV cadena internacional ActualidadRT tema Assange Saldra aire pocos dias,2019-05-10
Paola,Vintimilla,PaolaVintimilla,PremiosPLATINO2019,2019-05-11
Paola,Vintimilla,PaolaVintimilla,Dios puede bendecir mas 4 hijos mayor regalo vida pudo dar Feliz dia todas festejen amor FelizDiaDeLasMadres,2019-05-12
Paola,Vintimilla,PaolaVintimilla,camilin86 michaelrosero ROBINNOVOA EstebanPazR PlanetaAlbo PrensaMonaPuta LiguistaOficial PaolaVintimilla clubldu Vamos Rey Copas Ecuador,2019-05-13
Paola,Vintimilla,PaolaVintimilla,esperamos Reserva mesa FReinadeQuito 2468820 mas 100 premios ayudas Centro Terapeutico Aprendiendo Vivir,2019-05-14
Paola,Vintimilla,PaolaVintimilla,78 votos AP CREO BIN independientes Cesar Litardo nuevo Presidente AsambleaEcuador,2019-05-14
Paola,Vintimilla,PaolaVintimilla,78 votos favor AP CREO BIN independientes Cesar Litardo Presidente AsambleaEcuador,2019-05-14
Paola,Vintimilla,PaolaVintimilla,Primer Vicepresidente Cesar Solorzano Partido Sociedad Patriotica votos todas bancadas menos correistas,2019-05-14
Paola,Vintimilla,PaolaVintimilla,Segundo Vicepresidente Patricio Donoso CREO,2019-05-14
Paola,Vintimilla,PaolaVintimilla,Vocales CAL Asamblea Nacional,2019-05-14
Paola,Vintimilla,PaolaVintimilla,JosueSanchezEc CynthiaViteri6 Felicitaciones Josue alegra noticia,2019-05-16
Paola,Vintimilla,PaolaVintimilla,PaolaVintimilla,2019-05-17
Paola,Vintimilla,PaolaVintimilla,Siempre cudro honor Equipo LDU Oficial PaolaVintimilla camilin86 EstebanPazR DavilaAurelio,2019-05-18
