nombre,apellidos,tweet_screen_name,tweet_text,tweet_date
Paola,Vintimilla,PaolaVintimilla,Manana CastigoDivino Quito PaolaVintimilla candidata 6 alcaldia espero 20 00 Fridays Quicentro,2019-02-17
Paola,Vintimilla,PaolaVintimilla,Paola Vintimilla camino Alcaldia Quito Conoce mas RevistaClave Clave86 BienesRaices DesarrolloUrbano CaridadVela PaolaVintimilla,2019-02-18
Paola,Vintimilla,PaolaVintimilla,barrio Pablo Arturo Suarez norte Quito compartimos gran manana vecinos sector Realizamos minga comunitaria calles encuentran mal Vamos seguir llegando quieren llegar ElCambioVieneSioSi,2019-02-19
Paola,Vintimilla,PaolaVintimilla,Hoy junto PaolaVintimilla compartimos grupo lideresas sociales barriales centro sur Quito todas coincidimos hora Alcaldia hermosa ciudad encabezada mujeres CompromisoDeCambio EscucharParaServir,2019-02-20
Paola,Vintimilla,PaolaVintimilla,gusto conversar lideresas trabajadoras confirman necesidad cambio saben momento cambiar forma gobernar mujer Alcaldia ElCambioVieneSioSi,2019-02-20
Paola,Vintimilla,PaolaVintimilla,pocos minutos estare radio comunitaria xyzradioec 14h15 radiosonorama Jose Luis Castillo conversando plan trabajo Quito,2019-02-20
Paola,Vintimilla,PaolaVintimilla,Si unimos comunidad Municipio Ministerio Interior vamos combatir delincuentes Debemos volver casas barriales mantener buen bien iluminados lugares publicos trabajar conjunto Policia Nacional xyzradioec,2019-02-20
Paola,Vintimilla,PaolaVintimilla,primero haremos lleguemos Alcaldia auditoria procesos salgan todas personas necesarias entorpecido accionar Municipio xyzradioec,2019-02-20
Paola,Vintimilla,PaolaVintimilla,comparto agenda medios jueves temprano estare panchitostereo dialogo dar conocer propuesta transformar Quito 08h30 invito conocer mas chicos voyyvuelvo2018 RadioLatinaEc,2019-02-21
Paola,Vintimilla,PaolaVintimilla,Recorrimos CentroHistorico junto mariabelenquito candidata Distrito Centro Sur Debemos mantener espacio publico seguro haga buen uso mismo ademas potenciar turismo motor indispensable desarrollo Quito ElCambioVieneSioSi,2019-02-21
Paola,Vintimilla,PaolaVintimilla,voyyvuelvo2018 junto querida amiga PaolaVintimilla manana RadioLatinaEc KBurraska LuisFVaras SamyRivadeneira,2019-02-21
Paola,Vintimilla,PaolaVintimilla,Gracias interesante,2019-02-22
Paola,Vintimilla,PaolaVintimilla,FannyZamudio1 PCEVALLOS juancaholguin ZULNELEA SofiaMerinoRiv Polificcion PacoMoncayo luisevivanco CesarMontufar51 LoroHomero fabovillamar 4pelagatos4 lahistoriaec 24horasUIO comunidadquito1 Jajajajajaja,2019-02-22
Paola,Vintimilla,PaolaVintimilla,pocos dias decide futuro Quito requiere mas buenas intenciones Mas 20 anos alcaldias perversas destruido ciudad trata solo cambiar gobierno si forma gobernar conmigo cambio viene Si Si,2019-02-22
Paola,Vintimilla,PaolaVintimilla,pocos dias decide futuro Quito requiere mas buenas intenciones Mas 20 anos alcaldias perversas destruido ciudad trata solo cambiar gobierno si forma gobernar conmigo cambio viene Si Si,2019-02-22
Paola,Vintimilla,PaolaVintimilla,barrio Kennedy norte Quito quitenos demostraron preocupacion sucia ciudad cambiar modelo gestion EMASEO haremos licitacion transparente empresa privada encargue administracion,2019-02-22
Paola,Vintimilla,PaolaVintimilla,comerciantes Mercado Chiriyacu comprometieron votar cambio hora turismo vuelva poner vision mercados debemos convertirlos punto atractivo turistas nacionales extranjeros ElCambioVieneSioSi,2019-02-22
Paola,Vintimilla,PaolaVintimilla,quebradas ciudad cambio empieza usemos botadero lugares naturales rodean Si queremos recuperar belleza Quito aprendamos cuidar,2019-02-22
Paola,Vintimilla,PaolaVintimilla,proposito viaje capital darle respaldo considero gran corazon dar servicio San Francisco Quito PaolaVintimilla ProgresoEnLibertad La6Ecuador LA6MDG,2019-02-23
Paola,Vintimilla,PaolaVintimilla,juanxagutierrez La6Ecuador LA6MDG jaimenebotsaadi La6Pichincha 6Cantera DennisMarinL diegosalgadorib marjoriechavezm VicenteTaianoEC CynthiaViteri6 CesarRohon dometabacchi Gracias apoyo,2019-02-23
Paola,Vintimilla,PaolaVintimilla,Gran jornada dia hoy recorrimos junto PaolaVintimilla San Jose Moran carino gente cada mirada apreton manos recibe SERVIR PASION ElCambioSeVieneSioSi JuntosTransformaremosCalderon,2019-02-23
Paola,Vintimilla,PaolaVintimilla,parroquia Calderon asi 32 parroquias rurales Quito barrios sido olvidados crear mejores vias acceso regularizar terrenos luchar delincuencia compromiso juntos vamos cumplir ElCambioVieneSioSi,2019-02-23
Paola,Vintimilla,PaolaVintimilla,dictador quema ayuda humanitaria llegaba pueblo muere hambre dictadura Maduro debe caer Venezuela queremos libre total apoyo jguaido pueblo venezolano FueraMaduro VenezuelaLibre 23FAvalanchaHumanitaria,2019-02-23
Paola,Vintimilla,PaolaVintimilla,peatonenquito PacoMoncayo LoroHomero CesarMontufar51 nadie haga cumplir ordenanzas Quito necesita orden Mas claro botada,2019-02-24
Paola,Vintimilla,PaolaVintimilla,VAMOS CAMBIAR FORMA GOBERNAR CIUDAD PaolaVintimilla ElCambioVieneSioSi,2019-02-25
Paola,Vintimilla,PaolaVintimilla,Iniciamos semana dando conocer plan trabajo diferentes medios comunicacion invito seguir entrevistas,2019-02-25
Paola,Vintimilla,PaolaVintimilla,Excelente inicio semana empezamos jornada TuDecides2019 Telerama Quito,2019-02-25
Paola,Vintimilla,PaolaVintimilla,Queremos Quito 24 horas vida nocturna asi solo mejoramos turismo empleo sino tambien seguridad ciudad ElCambioVieneSioSi Ahora Telerama Quito,2019-02-25
Paola,Vintimilla,PaolaVintimilla,Cambiaremos forma gobernar varios anos administradores solo pensaron amigos parientes aumentar burocracia municipal repartirse poder servir mas 2 7 millones quitenos,2019-02-25
Paola,Vintimilla,PaolaVintimilla,fortalecer transporte publico municipal Trabajaremos extension trole Carapungo beneficiara miles quitenos ElCambioVieneSioSi sensacion800am,2019-02-25
Paola,Vintimilla,PaolaVintimilla,Capacitaremos agentes control cuidar ciudadania Reconstruiremos iluminaremos parques plazas uso familias delincuentes sensacion800am,2019-02-25
Paola,Vintimilla,PaolaVintimilla,Vamos cambiar forma gobernar Liberare recursos invertirlos obras necesitan familias quitenos VIDEO COMPLETO,2019-02-25
Paola,Vintimilla,PaolaVintimilla,RumboalaAlcaldiadeQuito 18h30 NotiMundoEstelar acompanara PaolaVintimilla candidata Alcaldia Quito Escuchanos 98 1 web,2019-02-25
Paola,Vintimilla,PaolaVintimilla,PaolaVintimilla Vamos mejorar sistema transporte publico crear paqueadero periferias RumboalaAlcaldiadeQuito,2019-02-26
Paola,Vintimilla,PaolaVintimilla,PaolaVintimilla Vamos hacer primeros 100 dias auditoria procesos RumboalaAlcaldiadeQuito,2019-02-26
Paola,Vintimilla,PaolaVintimilla,RumboalaAlcaldiadeQuito NotiMundoEstelar acompana PaolaVintimilla candidata Alcaldia Quito Escuchanos 98 1 web,2019-02-26
Paola,Vintimilla,PaolaVintimilla,PaolaVintimilla cambiar forma gobernar si reducimos burocracia Municipio dinero hacer absolutamente RumboalaAlcaldiadeQuito,2019-02-26
Paola,Vintimilla,PaolaVintimilla,martes estare 07h00 programa aprimerahora ec Radio Majestad 20h30 entretenida entrevista jalaldubois programa grupo Wazaak Facebook espero,2019-02-26
Paola,Vintimilla,PaolaVintimilla,Ahora majestadfm acompana PaolaVintimilla candidata alcaldesa Quito Escuchanos 89 7 Pichincha Tambien FacebookLive,2019-02-26
Paola,Vintimilla,PaolaVintimilla,primeros 100 dias haremos auditoria procesos quiere decir empresa revisara departamentos Municipio determinara cuantas personas necesarias puede ahorrar 80 100 millones dolares invertiremos obras,2019-02-26
Paola,Vintimilla,PaolaVintimilla,sectorizacion rutas taxis cumplira Basta desorden taxis franjas verdes deben circular parroquias rurales franja roja periferia urbana amarillos franja zona urbana cumpla ordenanza recibira sanciones,2019-02-26
Paola,Vintimilla,PaolaVintimilla,PaolaVintimilla volver trabajar comunidad alarmas comunitarias Debe haber coordinacion directa ECU911 agentes metropolitanos Elecciones2019EC majestadfm,2019-02-26
Paola,Vintimilla,PaolaVintimilla,Conversamos socios Camara Industrias Produccion planes mejorar eficiencia Municipio promover desarrollo productivo inversion Quito,2019-02-26
Paola,Vintimilla,PaolaVintimilla,proyecto Sueno parque Ejido hara realidad Gracias vecinos recibieron emblematico parque Vamos seguir mejorando condiciones parques zonas seguras familias quitenas delincuencia,2019-02-26
Paola,Vintimilla,PaolaVintimilla,Puerta puerta llevamos mensaje cambio vecinos sur Quito Gracias recibirnos brazos abiertos compromiso cambiar forma gobernar ciudad obras servicios merecen ElCambioVieneSioSi,2019-02-26
Paola,Vintimilla,PaolaVintimilla,Hoy PaolaVintimilla grupo Wazaak 20h30 pierdas entrevista jalaldubois JeronimoMeneses ArsenioVivanco CompromisoDeCambio EscucharParaServir,2019-02-27
Paola,Vintimilla,PaolaVintimilla,Ahora conversamos chicos Grupo Wazaak Mira entrevista facebook siguiente link,2019-02-27
Paola,Vintimilla,PaolaVintimilla,Oyacoto une cambio prioridad sera siempre ciudadania trabajar hombro hombro desarrollo Calderon PaolaVintimilla alcaldesa ElCambioSeVieneSioSi JuntosTransformaremosCalderon,2019-02-27
Paola,Vintimilla,PaolaVintimilla,Cumbaya 6 ruralidad periferia sido olvidadas administraciones haremos Cada parroquia tendra atraccion turistica cultural generar emprendimientos crear unidad,2019-02-28
Paola,Vintimilla,PaolaVintimilla,Reduciremos burocracia llevado dinero bolsillos ahorro sera invertido servir 2 7 millones quitenos mas obras generando empleo haciendo barrios mas seguros ElCambioVieneSioSi,2019-02-28
Paola,Vintimilla,PaolaVintimilla,Presentaremos proyecto creacion escuelas futbol ninos jovenes recibiran uniformes implementos practicas Incentivemos deporte ciudad debe ser constante prioritario CerquitaDeLaGente PaolaVintimilla Alcaldesa,2019-02-28
Paola,Vintimilla,PaolaVintimilla,invito seguir manana entrevista radioquitoec partir 07h00 lindo viernes,2019-03-01
Paola,Vintimilla,PaolaVintimilla,Crearemos corredores exclusivos buses vienen valles parroquias hacia casco urbano mejorar acceso brindar opciones movilidad viven sectores disminuir flujo vehicular radioquitoec,2019-03-01
Paola,Vintimilla,PaolaVintimilla,Vamos capacitar manera eficiente agentes metropolitanos cuidar ciudadania dotaremos armas disuasivas control actos delincuenciales ademas proporcionaremos camaras tambien sientan seguros,2019-03-01
Paola,Vintimilla,PaolaVintimilla,Junto empresa privada haremos recoleccion basura cumpla mantenga limpia ciudad genere recursos Municipio ElCambioVieneSioSi,2019-03-01
Paola,Vintimilla,PaolaVintimilla,85 perritos vemos calles dueno alcaldia haremos cumplir ordenanza incumplan seran sancionados perritos dueno acompanaran agentes metropolitanos Manana conversamos mariabelenquito,2019-03-01
Paola,Vintimilla,PaolaVintimilla,Llego caravana Cambio Conocoto Gracias carino junto Lilia Aguirre vamos transformar parroquia ElCambioVieneSioSi VotaTodo6 CompromisoDeCambio,2019-03-02
Paola,Vintimilla,PaolaVintimilla,Recorrimos zona Jipijapa norte Quito dando conocer propuesta cambio conductores transeuntes Luego visitamos Pifo conversamos floricultores cada paso damos sentimos respaldo gente Gracias carino,2019-03-03
Paola,Vintimilla,PaolaVintimilla,Recorrimos zona Jipijapa norte Quito dando conocer propuesta cambio conductores transeuntes Luego visitamos Pifo conversamos floricultores cada paso damos sentimos respaldo gente Gracias carino,2019-03-03
Paola,Vintimilla,PaolaVintimilla,VaPorTiTrabajadorPetrolero Esperamos 2deg Debate ProyectoRecuperacionUtilidades objetivo claro inicio Siempre daremos testimonio d trabajo Paolita PaolaVintimilla abrazo Amazonia recibido apoyan AsambleaEcuador,2019-03-03
Paola,Vintimilla,PaolaVintimilla,competencia competencia haremos Quito ciudad segura Fortaleceremos agentes metropolitanos trabajaremos Ministerio Interior volveremos ser comunidad hora tomemos calles delincuentes,2019-03-03
Paola,Vintimilla,PaolaVintimilla,Fomentaremos competitividad sectores turisticos comerciales democratizaremos inversion capital semilla sera esencial nuevos emprendimientos procesos innovacion permitan vivir nueva productiva ElCambioVieneSioSi,2019-03-04
Paola,Vintimilla,PaolaVintimilla,marcelo aleman juancaholguin JCSolines LoroHomero mariasolcorral PaolaPabonC DiarioLaHora LaPosta Ecu janethinostroza 4pelagatos4 fabriciovelav Esras correcto ruido visual terrible Quito hace falta orden,2019-03-05
Paola,Vintimilla,PaolaVintimilla,marcelo aleman juancaholguin JCSolines LoroHomero mariasolcorral PaolaPabonC DiarioLaHora LaPosta Ecu janethinostroza 4pelagatos4 fabriciovelav digo falta orden Estan ordenanzas cumplen pueden existir vallas permiso municipal Insisto ruido visual Quito terrible,2019-03-05
Paola,Vintimilla,PaolaVintimilla,marcelo aleman juancaholguin JCSolines LoroHomero mariasolcorral PaolaPabonC DiarioLaHora LaPosta Ecu janethinostroza 4pelagatos4 fabriciovelav hablo falta orden Estan ordenanzas cumplen pueden existir vallas permiso municipal Insisto ruido visual Quito terrible,2019-03-05
Paola,Vintimilla,PaolaVintimilla,sentimos quitenos solo trata cambiar Alcalde sino cambiar forma gobernar ElCambioVieneSioSi,2019-03-05
Paola,Vintimilla,PaolaVintimilla,excelente miercoles Manana estare RADIOAMERICAEC 07h40 invito escuchar entrevista,2019-03-06
Paola,Vintimilla,PaolaVintimilla,PaolaVintimilla propuesta enfoca cambiar forma gobernar Ciudad Quito Aqui 104 5 FM Jorgeacato RamiroDiaz64 longogalo,2019-03-06
Paola,Vintimilla,PaolaVintimilla,PaolaVintimilla necesitamos declarar emergencia primeros 100 dias realizara auditoria gestion Municipio Quito Aqui 104 5 FM Jorgeacato RamiroDiaz64 longogalo,2019-03-06
Paola,Vintimilla,PaolaVintimilla,PaolaVintimilla vamos quedarnos personas necesarias Municipio voy llevar partidarios mios peor familiares Aqui 104 5 FM Jorgeacato RamiroDiaz64 longogalo,2019-03-06
Paola,Vintimilla,PaolaVintimilla,PaolaVintimilla creo encuestadoras fallado elecciones Aqui 104 5 FM Jorgeacato RamiroDiaz64 longogalo,2019-03-06
Paola,Vintimilla,PaolaVintimilla,PaolaVintimilla administracion Metro debe ser concesionada si transporte publico tarjeta inteligente Aqui 104 5 FM Jorgeacato RamiroDiaz64 longogalo,2019-03-06
Paola,Vintimilla,PaolaVintimilla,Hoy candidatos LDU Oficial vemos CasaBlanca CopaLibertadores2019 VamosLiga,2019-03-07
Paola,Vintimilla,PaolaVintimilla,Queremos Quito 24 horas noche tome vida turismo gastronomia ocupar parques activar cultura calles esten llenas delincuentes Queremos QuitoVivo,2019-03-07
Paola,Vintimilla,PaolaVintimilla,Vamos paso firme 24 marzo ElCambioSeVieneSioSi PaolaVintimilla alcaldesa SERVIR PASION JuntosTransformaremosCalderon,2019-03-08
Paola,Vintimilla,PaolaVintimilla,dia recuerde lucha debe continuar conseguir sociedad mas justa equitativa DiaDeLaMujer,2019-03-08
Paola,Vintimilla,PaolaVintimilla,dia recuerde lucha debemos continuar conseguir sociedad mas justa equitativa DiaDeLaMujer,2019-03-08
Paola,Vintimilla,PaolaVintimilla,Hoy caminamos norte Quito junto PaolaVintimilla Alcaldia cambiara forma gobernar capital compromiso invertir recursos obras necesitan familias quitenas VotaTodo6,2019-03-09
Paola,Vintimilla,PaolaVintimilla,FELICITAHall asi mocion apoyo PSC SUMA RC negada votos morenismo abstenciones CREO,2019-03-09
Paola,Vintimilla,PaolaVintimilla,lilivic4 ramirogarciaf asi mocion apoyo PSC SUMA RC negada votos morenismo abstenciones CREO,2019-03-09
Paola,Vintimilla,PaolaVintimilla,Calderon sigue confiando cambio Vamos transformar 33 parroquias rurales olvidadas ultimos 20 anos alcaldia Cambiaremos forma gobernar quitenos parroquianos beneficien obras servicios ElCambioVieneSioSi,2019-03-09
Paola,Vintimilla,PaolaVintimilla,Gracias Cotocollao confiar cambio viene si si momento mujer momento cambio forma gobernar hora Quito llegue Progreso Libertad ElCambioVieneSioSi,2019-03-10
Paola,Vintimilla,PaolaVintimilla,Ayer caravana cambio llego Guayabamba Quinche Tumbaco Cumbaya Impulsaremos turismo parroquias momento conozcan maravillas belleza natural rodea hermosa gente ElCambioVieneSioSi,2019-03-10
Paola,Vintimilla,PaolaVintimilla,Ayer caravana cambio llego Guayllabamba Quinche Tumbaco Cumbaya Impulsaremos turismo parroquias momento conozcan maravillas belleza natural rodea hermosa gente ElCambioVieneSioSi,2019-03-10
Paola,Vintimilla,PaolaVintimilla,Gracias carino equipo verdaderos planes cambio Junto Bosmediano NardaOrtiz4 RodrigoVivarG RobertTuquerrez norte Quito transformara ElCambioVieneSioSi,2019-03-10
Paola,Vintimilla,PaolaVintimilla,alcaldesa Quito necesita merece 6,2019-03-10
Paola,Vintimilla,PaolaVintimilla,Quito imperativo cambio pertinente confiar vision administradora cometer error noverleria hizo Barrera Todas Votar PaolaVintimilla entender amo capital carita Dios,2019-03-10
Paola,Vintimilla,PaolaVintimilla,Sur Quito respalda cambio MazapantaPaola CarlosErnestoT Jose Almeida Camila Pinzon concejalia volveremos sur mas seguro soluciones viales mas oportunidades ElCambioVieneSioSi,2019-03-10
Paola,Vintimilla,PaolaVintimilla,gran inicio semana lunes estare partir 07h00 diferentes medios comunicacion comparto detalles agenda,2019-03-11
Paola,Vintimilla,PaolaVintimilla,Ahora acompana PaolaVintimilla da conocer propuestas campana realiza analisis Quito mucha gente aun sabe votaciones Siga transmision vivo LaNoticiaenSucesos,2019-03-11
Paola,Vintimilla,PaolaVintimilla,Gane pierda voy investigar contratos MunicipioQuito incluidos contratos hicieron regimen PacoMoncayo PaolaVintimilla LaNoticiaenSucesos,2019-03-11
Paola,Vintimilla,PaolaVintimilla,candidata alcaldia Quito PaolaVintimilla menciona caso llegar MunicipioQuito propone trabajar ciudadania conocer problemas atraviesa ciudadania trafico calles baches solucionarlos,2019-03-11
Paola,Vintimilla,PaolaVintimilla,debe realizar analisis cuanta gente debe salir MunicipioQuito cuantas personas deben quedarse desperdiciar recursos destinar solucion problemas capital Voy dar prioridad necesitan PaolaVintimilla,2019-03-11
Paola,Vintimilla,PaolaVintimilla,Segun Union Taxis Pichincha cerca 20mil taxis ilegales circulando provincia Quito alcaldia vamos permitir aqui dejo muestra ocultan tener clientes Cero tolerancia ilegalidad ElCambioVieneSioSi,2019-03-11
Paola,Vintimilla,PaolaVintimilla,15 animales estan calle van pertenecer policia metropolitana ocuparemos censar perritos viven Quito PaolaVintimilla Candidata Alcaldia Quito LaNoticiaenSucesos Adoptanocompres,2019-03-11
Paola,Vintimilla,PaolaVintimilla,85 perritos vemos calles dueno censaremos haremos cumplir ordenanza dejen solos calles,2019-03-11
Paola,Vintimilla,PaolaVintimilla,Amazonia cuenta Ley beneficia region 12 utilidades trabajadores supuestamente iba comunidades nunca reflejo obras responsable desarrollo cada ciudad provincia trabajadores eluniversocom,2019-03-11
Paola,Vintimilla,PaolaVintimilla,PaolaVintimilla eluniversocom VaPetrolero Lacl Collita Rechazamos totalmente escrito diario eluniversocom aqui perjudicando nadie unicos perjudicados Trabajadores ustedes diario numero 1 nivel Nacional deben informarse bien publicar nefasto q estan haciendo desinformado,2019-03-11
Paola,Vintimilla,PaolaVintimilla,comparto agenda medios martes 12 marzo Espero sintonia,2019-03-12
Paola,Vintimilla,PaolaVintimilla,Vamos cambiar ciudad unico modelo exitoso pais modelo 6 ElCambioVieneSioSi,2019-03-12
Paola,Vintimilla,PaolaVintimilla,Envivo PaolaVintimilla candidata Alcaldia,2019-03-12
Paola,Vintimilla,PaolaVintimilla,Quito Vivo queremos sera respaldado Policia Nacional proteger ciudadanos PaolaVintimilla alcalde quito proteger vida nocturna 24 horas ecuador democraciatv,2019-03-12
Paola,Vintimilla,PaolaVintimilla,sur tambien Quito alcaldia olvidaremos nadie MazapantaPaola sur va cambiar si si ElCambioSeVieneSioSi,2019-03-13
Paola,Vintimilla,PaolaVintimilla,pocos minutos estare programa Dias Radio RayuelaRadioEC pueden escuchar entrevista,2019-03-13
Paola,Vintimilla,PaolaVintimilla,Hoy grato desayunos reunimos Concejo Camaras Asociaciones Pichincha Dimos conocer propuestas desarrollo ciudad traves Quito 24 7 impulsara comercio turismo,2019-03-13
Paola,Vintimilla,PaolaVintimilla,Hoy grato desayuno reunimos Concejo Camaras Asociaciones Pichincha Dimos conocer propuestas desarrollo ciudad plan Quito 24 7 impulsara comercio turismo,2019-03-13
Paola,Vintimilla,PaolaVintimilla,Hoy grato desayuno reunimos Consejo Camaras Asociaciones Pichincha Dimos conocer propuestas desarrollo ciudad plan Quito 24 7 impulsara comercio turismo,2019-03-13
Paola,Vintimilla,PaolaVintimilla,DiasDeRadio candidata PaolaVintimilla dijo principales problemas Quito hara enfasis seguridad empleo movilidad basura Recalco pesima gestion EmAseoQuito gestion actual alcalde MauricioRodasEC,2019-03-13
Paola,Vintimilla,PaolaVintimilla,Escuche podcast debate candidatos alcaldia Quito MunicipioQuito PaolaVintimilla xbuendia2019 expusieron propuestas proximas EleccionesEC2019 basados 3 ejes transportacion empleo seguridad,2019-03-13
Paola,Vintimilla,PaolaVintimilla,Ahora invito conectarse LaOtraRadioFm 91 3 FM voy conversar Duende programa Travesuras Duende Espero disfruten divertida entrevista,2019-03-13
Paola,Vintimilla,PaolaVintimilla,Gooooooooooooooool liga CONMEBOLLibertadores,2019-03-14
Paola,Vintimilla,PaolaVintimilla,Excelente jueves comparto agenda medios hoy,2019-03-14
Paola,Vintimilla,PaolaVintimilla,dia ayer gusto presidir consejocamaras recibir visita candidata alcaldia Quito PaolaVintimilla,2019-03-14
Paola,Vintimilla,PaolaVintimilla,Compartiendo cabina chicas programa Trompas Falopio RadioCanelaEC Sintoniza entrevista 106 5 FM,2019-03-14
Paola,Vintimilla,PaolaVintimilla,Alcaldia trabajara forma espiral decir comenzando afuera hacia adentro barrios alejados cuentan servicios basicos hora trabajemos sectores olvidados mas vulnerables Quito ElCambioVieneSioSi,2019-03-14
Paola,Vintimilla,PaolaVintimilla,Quito ser referente innovacion progreso obras Ecuador capital convertido ciudad atrasada podemos permitir continue asi vamos cambiar sabemos hacerlo LaVozDelMigrante,2019-03-14
Paola,Vintimilla,PaolaVintimilla,Queremos QuitoVivo turismo parte motor desarrollo ciudad familias puedan caminar disfrutar seguros noches Conmigo Alcaldia Quito 24 7 anhelamos,2019-03-14
Paola,Vintimilla,PaolaVintimilla,PaolaVintimilla Quiero Quito vivo 24 horas generara empleo seguridad turismo Paola Vintimilla Alcaldesa Lista 6 jaimenebotsaadi espacio promocionado,2019-03-15
Paola,Vintimilla,PaolaVintimilla,CARAVANA CAMBIO Gracias apoyo diferentes barrios Quito carino dias demostrado Trabajaremos puertas abiertas Alcaldesa PaolaVintimilla Concejales MazapantaPaola AlmeidaJose85 ElCambioVieneSioSi,2019-03-15
Paola,Vintimilla,PaolaVintimilla,lovatorami PacoMoncayo CesarMontufar51 xbuendia2019 juancaholguin JCSolines dudarlo Alcaldia jamas trabajaria familiares amigos,2019-03-15
Paola,Vintimilla,PaolaVintimilla,Llegamos uhemisferios presentarle jovenes propuestas tener Quito Vivo seguro limpio lleno arte,2019-03-15
Paola,Vintimilla,PaolaVintimilla,75 quitenos usa transporte publico necesitamos integre tarjeta inteligente asi logremos servicio mas eficiente,2019-03-15
Paola,Vintimilla,PaolaVintimilla,PaolaVintimilla Vamos censar perritos ciudad colocaremos collar cedula dueno numero celular controlar tema,2019-03-15
Paola,Vintimilla,PaolaVintimilla,PaolaVintimilla agentes metropolitanos control van llevar body cams precautelar seguridad ConoceATuCandidato ConCienciaPoliticaUDH,2019-03-15
Paola,Vintimilla,PaolaVintimilla,ConoceatuCandidato recuperar confianza gente transitar Centro Quito FCOMHemisferios uhemisferios PaolaVintimilla,2019-03-15
Paola,Vintimilla,PaolaVintimilla,Vamos tener plataforma digital democracia directa ciudadanos podran conocer participar activamente decisiones toman Municipio bien ciudad,2019-03-15
Paola,Vintimilla,PaolaVintimilla,Gracias organizadores estudiantes uhemisferios permitirme compartir ideas transformar Quito espacios vitales democracia ciudadanos puedan realizar voto consciente,2019-03-15
Paola,Vintimilla,PaolaVintimilla,Seguimos conversando vecinos norte sur compartiendo mensaje cambio necesita Quito gente comprometida ciudad juntos vamos transformar ElCambioVieneSioSi,2019-03-16
Paola,Vintimilla,PaolaVintimilla,grupo hermoso recorremos hoy Centro Historico Quito Vamos mariabelenquito concejalia devolverle ciudad orgullo ElCambioVieneSioSi,2019-03-16
Paola,Vintimilla,PaolaVintimilla,vivo dando conocer plan trabajo Quito,2019-03-16
Paola,Vintimilla,PaolaVintimilla,Necesitamos reactivar turismo ciudad vamos apostar Quito nocturno plazas parques esten iluminadas teatros vuelvan abrir arte tome calles,2019-03-16
Paola,Vintimilla,PaolaVintimilla,PaolaVintimilla Quiero Quito vivo 24 horas generara empleo seguridad turismo Paola Vintimilla Alcaldesa Lista 6 jaimenebotsaadi espacio promocionado,2019-03-16
Paola,Vintimilla,PaolaVintimilla,Quiero QuitoVivo 24 horas lograremos si trabajamos juntos comunidad academia empresa privada,2019-03-17
Paola,Vintimilla,PaolaVintimilla,Recorrer Centro Historico hace sonar QuitoVivo queremos arte quitenos tomen calles plazas parques sueno haremos realidad ElCambioVieneSioSi,2019-03-17
Paola,Vintimilla,PaolaVintimilla,FernandoCasadoG LuisaMaldonadoM PaolaPabonC buen chiste,2019-03-17
Paola,Vintimilla,PaolaVintimilla,25 marzo inicia nuevo amanecer Calderon Presidencia Junta Parroquial hare realidad Educacion Superior Cantonizacion Seguridad Ciudadana ElCambioSeVieneSioSi PaolaVintimilla alcaldesa La6Ecuador JuntosTransformaremosCalderon,2019-03-17
Paola,Vintimilla,PaolaVintimilla,surenos estan cambio Queremos solo sur sino Quito vuelva brillar Caminemos juntos Quito limpio seguro ordenado emprendedor vivo merecemos ElCambioVieneSioSi,2019-03-18
Paola,Vintimilla,PaolaVintimilla,Manana 08h00 estare Radio Vision Diego Oquendo invito sintonizar 91 7 FM,2019-03-18
Paola,Vintimilla,PaolaVintimilla,Ahora vivo Radio Vision Puedes ver entrevista,2019-03-18
