nombre,apellidos,tweet_screen_name,tweet_text,tweet_date
Sofía Yvette,Almeida Fuentes,SofiaAlmeidaEc,buen diir hoy Manabi invitado sintonizar medio estare invitado hablar CPCCS SofiaAlmeida,2019-02-20
Sofía Yvette,Almeida Fuentes,SofiaAlmeidaEc,ciudadano derecho conocer mas función CPCCS tambien candidato Consejo Participacion Ciudadana Control Social SofiaAlmeida SomosAnticorrupcion,2019-02-20
Sofía Yvette,Almeida Fuentes,SofiaAlmeidaEc,EcuadorALasUrnas SofiaAlmeidaEc candidata CPCCS conozcar propuesto institucion,2019-02-21
Sofía Yvette,Almeida Fuentes,SofiaAlmeidaEc,EcuadorALasUrnas SofiaAlmeidaEc entidades deber ser independiente deber revisar autoridad saber si persona indicado ocupar puesto tanto responsabilidad,2019-02-21
Sofía Yvette,Almeida Fuentes,SofiaAlmeidaEc,EcuadorALasUrnas sofiaalmeidaec deber luchar corrupcion prevencion Copiar aquel ejemplo internacional buen,2019-02-21
Sofía Yvette,Almeida Fuentes,SofiaAlmeidaEc,EcuadorALasUrnas SofiaAlmeidaEc creer lucha corrupcion deber tener informacion traves plataforma informatico hacer país poder tener ciudadano informacion hacer,2019-02-21
Sofía Yvette,Almeida Fuentes,SofiaAlmeidaEc,gracias medios comunicacion bella ciudad Ibarra SofiaAlmeida experiencia necesario cambiar falencia sector publico luchar corrupcion Juntos CPCCS SomosAnticorrupcion,2019-02-21
Sofía Yvette,Almeida Fuentes,SofiaAlmeidaEc,Empece trabajar abajo tropa él conocer manejar entidad publica CPCCS ir representar bien ciudadano sofiaalmeido PrevenirYSancionar SomosAnticorrupcion,2019-02-21
Sofía Yvette,Almeida Fuentes,SofiaAlmeidaEc,buen dia hoy Tulcan visitarir varios medio comunicacion gentilmente invitado hablar CPCCS,2019-02-22
Sofía Yvette,Almeida Fuentes,SofiaAlmeidaEc,recorrer lindo sierra ecuatoriano sofiaalmeido CPCCS,2019-02-23
Sofía Yvette,Almeida Fuentes,SofiaAlmeidaEc,vandocilla CPCCS davidroserow ChugchilanJaime Gracias respaldo Vladimir,2019-02-23
Sofía Yvette,Almeida Fuentes,SofiaAlmeidaEc,hermana Irene acompano recorridir varios ciudad 11 ano mayor veo recordar hacer 11 ano vivido tiempo alegria tristeza acierto errores Ahi ir resumir mejor graduacion universidad,2019-02-25
Sofía Yvette,Almeida Fuentes,SofiaAlmeidaEc,buen dia invitado sintonizar diferente radio estarar diar hoy invitado Hablare CPCCS propuesta SofiaAlmeida,2019-02-25
Sofía Yvette,Almeida Fuentes,SofiaAlmeidaEc,pregunto asesor politico Sr LassoGuillermo hacer cometer tanto error confabulado correismo promover voto nulo dejar candidato impulsado Correa tomar CPCCS SofiaAlmeida,2019-02-25
Sofía Yvette,Almeida Fuentes,SofiaAlmeidaEc,mas 11 ano auditora sector publico saber auditar conocer primero proceso conocer maneja administracion publicar conocer falencia cual solución,2019-02-25
Sofía Yvette,Almeida Fuentes,SofiaAlmeidaEc,auditado universidad ministerio municipio diferente empresa publica mucho institución experiencia 11 ano Contraloria General curso nacional internacional auditorio control validar,2019-02-25
Sofía Yvette,Almeida Fuentes,SofiaAlmeidaEc,experiencia 11 ano Contraloria General curso nacional internacional auditorio control validar CPCCS necesitar gente idoneo luchar corrupcion alto valor moral,2019-02-25
Sofía Yvette,Almeida Fuentes,SofiaAlmeidaEc,CPCCS necesitar gente idoneo luchar corrupcion alto valor moral invito investigar 43 candidato cpcc trayectoria propuesto SofiaAlmeida SomosAnticorrupcion,2019-02-26
Sofía Yvette,Almeida Fuentes,SofiaAlmeidaEc,epelsita galobonifaz LassoGuillermo DiarioExtraEc EcuavisaInforma lahoraecuador Expresoec elnorteadiario mercurioec eldiarioec 1alejandrogallo ChugchilanJaime Guillermolasso Asi,2019-02-26
Sofía Yvette,Almeida Fuentes,SofiaAlmeidaEc,FEUEnac Ecuador davidroserow ChugchilanJaime mauricio Fese Muchas gracia respaldo,2019-02-26
Sofía Yvette,Almeida Fuentes,SofiaAlmeidaEc,diar manana 08h00 estare Universidad Artes participar encuentro Construccion Democracia Participativa Territorio SofiaAlmeida CPCCS invitado,2019-02-27
Sofía Yvette,Almeida Fuentes,SofiaAlmeidaEc,voto nulo atentado democracia desobedecer Constitucion exigir eleccion CPCCS SofiaAlmeida,2019-02-28
Sofía Yvette,Almeida Fuentes,SofiaAlmeidaEc,ecuadordecide2019 espacio destinado ecuatoriano conocer candidato propuesto previo elección seccional 2019 hoy invitado sofiaalmeidaec candidata Consejo Participacion Ciudadana,2019-02-28
Sofía Yvette,Almeida Fuentes,SofiaAlmeidaEc,hoy estare EcuadorDecide2019 espacio destinado ecuatoriano conocer candidato propuesto previo elección seccional 2019 CPCCS SofiaAlmeida,2019-02-28
Sofía Yvette,Almeida Fuentes,SofiaAlmeidaEc,diar hoy Triunfo ciudad gente lindo gana saber mas cpccs conocer derecho informado saber elegir persona correcto 24 marzo sofiaalmeida SomosAnticorrupcion,2019-03-01
Sofía Yvette,Almeida Fuentes,SofiaAlmeidaEc,Ecuador pais tanto hermoso diverso costa maravilloso Islas Galapagos montana helado selva lleno flora faún fenomenal Sigamos disfrutar bello pais moderacion familia amigos SofiaAlmeida,2019-03-04
Sofía Yvette,Almeida Fuentes,SofiaAlmeidaEc,despu largo feriado presento pequeno resumen vido academico profesional gracias uees ec SofiaAlmeida junto SomosAnticorrupcion,2019-03-06
Sofía Yvette,Almeida Fuentes,SofiaAlmeidaEc,shyrisique elnorteadiario mercurioec DiarioExtraEc eldiarioec Expresoec lahoraecuador EcuavisaInforma diarioqueec galobonifaz 1alejandrogallo pertenecer ningun partido politico Solo buscar nombre adjunto video mas informado saludo,2019-03-06
Sofía Yvette,Almeida Fuentes,SofiaAlmeidaEc,shyrisique elnorteadiario mercurioec DiarioExtraEc eldiarioec Expresoec lahoraecuador EcuavisaInforma diarioqueec galobonifaz 1alejandrogallo pertenecer ningun partido politico Solo buscar nombre adjunto video mas informado saludo,2019-03-06
Sofía Yvette,Almeida Fuentes,SofiaAlmeidaEc,dia encontre RadioMorena640 davidroserow ChugchilanJaime candidato CPCCS conversar falta hacer lucha corrupcion coincidir punto SofiaAlmeida SomosAnticorrupcion,2019-03-07
Sofía Yvette,Almeida Fuentes,SofiaAlmeidaEc,hoy estare itbolivariano hablar CPCCS Estan invitado SofiaAlmeida SomosAnticorrupcion,2019-03-07
Sofía Yvette,Almeida Fuentes,SofiaAlmeidaEc,conversatorio Corruptos itbolivariano Gracias todo persona asistido SofiaAlmeida SomosAnticorrupcion,2019-03-08
Sofía Yvette,Almeida Fuentes,SofiaAlmeidaEc,recuperar valor robado acto corrupcion Vamos regresar dinero bolsillo ecuatoriano bastar ley blando permitir fuga politico corrupto dinero ciudadano SofiaAlmeida SomosAnticorrupcion CPCCS,2019-03-08
Sofía Yvette,Almeida Fuentes,SofiaAlmeidaEc,corazon orens gracias hermano Oro SofiaAlmeida CPCCS,2019-03-11
Sofía Yvette,Almeida Fuentes,SofiaAlmeidaEc,FelizDiaDeLaMujer querer ir dormir desear pasado feliz diar todo mujer fuente amor decir cancion dedico carino mama abuela familiar amigo todo ecuatoriana sofiaalmeido CPCCS,2019-03-09
Sofía Yvette,Almeida Fuentes,SofiaAlmeidaEc,FelizDiaDeLaMujer querer ir dormir desear pasado feliz diar todo mujer fuente amor decir cancion dedico carino mama abuela familiar amigo todo ecuatoriana sofiaalmeido CPCCS,2019-03-09
Sofía Yvette,Almeida Fuentes,SofiaAlmeidaEc,dia deber ser dio mujer nadie quitar nunca sueno FelizDiaDeLaMujer,2019-03-10
Sofía Yvette,Almeida Fuentes,SofiaAlmeidaEc,Amigos compartir agenda medio ciudad Machala Estare diar miercol 13 recorrer Provincia Oro SofiaAlmeida CPCCS,2019-03-11
Sofía Yvette,Almeida Fuentes,SofiaAlmeidaEc,Buenos dia radio Lider Internacional 101 5 FM bello ciudad Machala SofiaAlmeida CPCCS,2019-03-11
Sofía Yvette,Almeida Fuentes,SofiaAlmeidaEc,manifestado hora entregar ciudadano herramienta necesario participar activamente lucha corrupcion propuesta cualquiera persona celular podro ser fiscalizador sector publico sofiaalmeido CPCCS,2019-03-11
Sofía Yvette,Almeida Fuentes,SofiaAlmeidaEc,canalorovision luego entrevista ameno gracias afecto respaldo brindado Manana miercol seguire recorrer provincia Oro SofiaAlmeida CPCCS,2019-03-12
Sofía Yvette,Almeida Fuentes,SofiaAlmeidaEc,vivo Radio Infinita 97 5 FM Pasaje provincia Oro ciudadanos derecho conocer mas función CPCCS tambien candidato Consejo Participacion Ciudadana Control Social SofiaAlmeida,2019-03-12
Sofía Yvette,Almeida Fuentes,SofiaAlmeidaEc,seguir recorrer bello provincia Oro ciudadano estar informado poder exigir derecho cpccs ir empoderar ciudadano trav acceso todo informacion publicar SofiaAlmeida,2019-03-12
Sofía Yvette,Almeida Fuentes,SofiaAlmeidaEc,hoy visitar Huaquillas socializar propuesto crear plataforma tecnologico Anticorrupcion Asi informacion sero realmente publicar ciudadano poder hacer denuncia formar agil integrado necesidad hacer larga fila sofiaalmeido CPCCS,2019-03-13
Sofía Yvette,Almeida Fuentes,SofiaAlmeidaEc,gracias medios comunicacion Capital Bananera Mundo ciudad Machala SofiaAlmeida experiencia necesario cambiar falencia sector publico luchar corrupcion Juntos CPCCS SomosAnticorrupcion,2019-03-13
Sofía Yvette,Almeida Fuentes,SofiaAlmeidaEc,SofiaAlmeidaEc,2019-03-13
Sofía Yvette,Almeida Fuentes,SofiaAlmeidaEc,tierra amado padre bello prov Rios Estare visitar varios medio comunicacion preocupar Elecciones2019 buscar ciudadano estir informado saber elegir bien representante CPCCS SofiaAlmeida,2019-03-14
Sofía Yvette,Almeida Fuentes,SofiaAlmeidaEc,sofiaalmeida compartir 3 eje principal plan trabajo plataforma informatico lucha corrupcion recuperar dinero robado acto corrupcion despolitizar entidad deber ser independiente CPCCS SomosAnticorrupcion,2019-03-14
Sofía Yvette,Almeida Fuentes,SofiaAlmeidaEc,mejor proceso sido recorrer varios provincia lindo Ecuador aprovechar informar ciudadano pai elegiremo consejero consejera CPCCS proximo 24 marzo sofiaalmeida Elecciones2019Ec,2019-03-15
Sofía Yvette,Almeida Fuentes,SofiaAlmeidaEc,hermano Pedro Aaron encanto regresar Rios tierro querido padre familia pilar vida mayor 4 hermano si hermano nunca dejar compartir recuerdo quedar siempre sofiaalmeido CPCCS,2019-03-16
Sofía Yvette,Almeida Fuentes,SofiaAlmeidaEc,sofiaalmeida compartir 3 eje principal plan trabajo plataforma informatico lucha corrupcion recuperar dinero robado acto corrupcion despolitizar entidad deber ser independiente CPCCS SomosAnticorrupcion,2019-03-17
Sofía Yvette,Almeida Fuentes,SofiaAlmeidaEc,pequena musico ser grande pasión hoy querer compartir tú pasion musico aprovechado cantar corrupcion dano hacer pais SofiaAlmeida SomosAnticorrupcion RT si compart mismo sentir,2019-03-17
Sofía Yvette,Almeida Fuentes,SofiaAlmeidaEc,buen dia Estan invitado sintonizar medio hoy estare hablar CPCCS proxima eleccionesecuador2019 SofiaAlmeida,2019-03-18
Sofía Yvette,Almeida Fuentes,SofiaAlmeidaEc,empezar entrevista mucho energia positivo proximo domingo Elecciones2019Ec compartido lindo experiencia mucho gente alrededor pais gracias SofiaAlmeida CPCCS,2019-03-18
Sofía Yvette,Almeida Fuentes,SofiaAlmeidaEc,buen dia compartir agenda medio poder sintonizar diar hoy Estare medios nivel nacional hablar CPCCS función SofiaAlmeida Medios,2019-03-19
Sofía Yvette,Almeida Fuentes,SofiaAlmeidaEc,FRM87 MrsGubler2013 HernanUlloa davidroserow mucho gracia respaldo Felipe fuerte abrazo,2019-03-20
Sofía Yvette,Almeida Fuentes,SofiaAlmeidaEc,gracias medios comunicacion diario ayudar ciudadania informado ecuatoriano deber conocer mas función CPCCS candidato Consejo Participacion Ciudadana Control Social SofiaAlmeida Elecciones2019EC,2019-03-20
Sofía Yvette,Almeida Fuentes,SofiaAlmeidaEc,omarmaluk jobafonfay2019 Muchas gracia respaldo,2019-03-22
Sofía Yvette,Almeida Fuentes,SofiaAlmeidaEc,hacer poco dia comparti canal1 3 eje principal plan trabajo plataforma informatico lucha corrupcion recuperar dinero robado acto corrupcion despolitizar entidad deber ser independiente CPCCS SofiaAlmeida,2019-03-23
Sofía Yvette,Almeida Fuentes,SofiaAlmeidaEc,JessikJaramillo davidroserow Gracias respaldo Jessica,2019-03-23
Sofía Yvette,Almeida Fuentes,SofiaAlmeidaEc,kevinroja jcarlostuarez davidroserow ALANDMOLESTINAM jovitafonfay manababravo gracias respaldo,2019-03-23
Sofía Yvette,Almeida Fuentes,SofiaAlmeidaEc,votosofiaalmeidacpcc SofiaAlmeidaEc,2019-03-24
Sofía Yvette,Almeida Fuentes,SofiaAlmeidaEc,Manana poder acompanar votar esperar SofiaAlmeida CPCCS,2019-03-23
Sofía Yvette,Almeida Fuentes,SofiaAlmeidaEc,voto gente honesto capaz CPCSS davidroserow SofiaAlmeidaEc Jaime Cugchilan,2019-03-24
Sofía Yvette,Almeida Fuentes,SofiaAlmeidaEc,Consejo Participacion Ciudadana Mujeres ibethestupinar jobafonfay2019 SofiaAlmeidaEc Hombres franklinmorenom ALANDMOLESTINAM c espinozaec pueblo nacionalidad indigena ChugchilanJaime,2019-03-24
Sofía Yvette,Almeida Fuentes,SofiaAlmeidaEc,gracias apoyo SofiaAlmeidaEc,2019-03-24
Sofía Yvette,Almeida Fuentes,SofiaAlmeidaEc,voto CPCCS juventud rebeldia transparencia davidroserow SofiaAlmeidaEc ChugchilanJaime,2019-03-24
Sofía Yvette,Almeida Fuentes,SofiaAlmeidaEc,bonilcaricaturar vot nulo cpccs facilitar correismo tomar control crucial organismo control Vota SofiaAlmeidaEc Catalina Perez Francisco Bravo listar pueblo carlosfigueroa6 ALANDMOLESTINAM davidroserow,2019-03-24
Sofía Yvette,Almeida Fuentes,SofiaAlmeidaEc,hoy votar TamaApoyo ALANDMOLESTINAM hernanulloa jobafonfay2019 CatalinaPerez SofiaAlmeidaEc ChugchilanJaime losmejoressincorrupcion,2019-03-24
Sofía Yvette,Almeida Fuentes,SofiaAlmeidaEc,sofiaalmeidaec voto gusto propuesto parte tecnologico,2019-03-24
Sofía Yvette,Almeida Fuentes,SofiaAlmeidaEc,MashiRafael Hombres 6 Carlos Figueroa carlosfigueroa6 8 Aland Molestina ALANDMOLESTINAM 11 David Rosero davidroserow Mujeres 1 Ibeth Estupinan ibethestupinar 2 Maria Rivadeneira mrivadeneirac 10 Sofia Almeida SofiaAlmeidaEc Minorias 3 Jaime Chugchilan ChugchilanJaime,2019-03-24
Sofía Yvette,Almeida Fuentes,SofiaAlmeidaEc,MashiRafael 40 familiar USA Canada Spain Italy votarar asi Carlos Figueroa carlosfigueroa6 Aland Molestina ALANDMOLESTINAM David Rosero davidroserow Ibeth Estupinan ibethestupinar Maria Rivadeneira mrivadeneirac Sofia Almeida SofiaAlmeidaEc Jaime Chugchilan ChugchilanJaime,2019-03-24
Sofía Yvette,Almeida Fuentes,SofiaAlmeidaEc,elecciones2019ec votar aunque optativo Carlos Figueroa carlosfigueroa6 Aland Molestina ALANDMOLESTINAM David Rosero davidroserow Ibeth Estupinan ibethestupinar Maria Rivadeneira mrivadeneirac Sofia Almeida SofiaAlmeidaEc Jaime Chugchilan ChugchilanJaime,2019-03-24
Sofía Yvette,Almeida Fuentes,SofiaAlmeidaEc,AYUDEMOS CORRAN VOZ DAVID ROSERO SOFIA ALMEIDA JAIME CHUGCHILAN GANARAN CANDIDATOS CONSEJO PARTICIPACION CIUDADANA CONTROL SOCIAL davidroserow SofiaAlmeidaEc ChugchilanJaime,2019-03-24
Sofía Yvette,Almeida Fuentes,SofiaAlmeidaEc,vot nulo cpccs facilitar correismo tomar control crucial organismo control Vota SofiaAlmeidaEc Catalina Perez Francisco Bravo listar pueblo carlosfigueroa6 ALANDMOLESTINAM davidroserow,2019-03-24
Sofía Yvette,Almeida Fuentes,SofiaAlmeidaEc,hoy voto SofiaAlmeidaEc,2019-03-24
Sofía Yvette,Almeida Fuentes,SofiaAlmeidaEc,VotoSofiaAlmeidaCPCCS SofiaAlmeidaEc,2019-03-24
Sofía Yvette,Almeida Fuentes,SofiaAlmeidaEc,4 listar mujer recomeir votar Sofia Almeida profesional destacado fiscalizadoro honesta incorruptible Ecuador necesitar CPCCS SofiaAlmeidaEc,2019-03-24
Sofía Yvette,Almeida Fuentes,SofiaAlmeidaEc,olvidir cita hernanulloa ChugchilanJaime SofiaAlmeidaEc 24 anular voto CPCCS cnegobec,2019-03-24
Sofía Yvette,Almeida Fuentes,SofiaAlmeidaEc,JCTrujilloCPCCS radioquitoec expuesto considerar CPCCS deber fortalecer empezar votar gente bien desear mala practica Asamblea voto positivo davidroserow SofiaAlmeidaEc ChugchilanJaime,2019-03-24
Sofía Yvette,Almeida Fuentes,SofiaAlmeidaEc,joseakalil hernanulloa sofiaalmeidaec hernanulloa,2019-03-24
Sofía Yvette,Almeida Fuentes,SofiaAlmeidaEc,ayudar elección CPCCS Mujeres Cambio votar David Rosero casillero 11 hombre Sofia Almeida casillero 10 mujer Jaime Chugchilan casillero 3 Pueblos Nacionalidades davidroserow SofiaAlmeidaEc ChugchilanJaime,2019-03-24
Sofía Yvette,Almeida Fuentes,SofiaAlmeidaEc,desperdicies voto continuar lucha corrupcion 24 Marzo votar davidroserow SofiaAlmeidaEc ChugchilanJaime CPCCS,2019-03-24
Sofía Yvette,Almeida Fuentes,SofiaAlmeidaEc,Sugerencia tiempos incertidumbre democraciar papel Hombres jcarlostuarez davidroserow ALANDMOLESTINAM Mujeres SofiaAlmeidaEc JovitaFonFay Catalina Perez Avila Pueblos Nacionalidades manababravo,2019-03-24
Sofía Yvette,Almeida Fuentes,SofiaAlmeidaEc,equivoqu votar SofiaAlmeidaEc KariPonce11 carlosfigueroa6 PabloPonce RicardoRivasBr manababravo CPCCS,2019-03-24
Sofía Yvette,Almeida Fuentes,SofiaAlmeidaEc,gireyb hernanulloa DMarcosmolina faustomolinar SofiaAlmeidaEc,2019-03-24
Sofía Yvette,Almeida Fuentes,SofiaAlmeidaEc,jotacelirar personal considerar buena opción Mujeres Catalina Perez SofiaAlmeidaEc Hombres hernanulloa ALANDMOLESTINAM davidroserow RicardoRivasBr minoria ChugchilanJaime Francisco Bravo,2019-03-24
Sofía Yvette,Almeida Fuentes,SofiaAlmeidaEc,Sugerencia tiempos incertidumbre democraciar papel Hombres jcarlostuarez davidroserow ALANDMOLESTINAM Mujeres SofiaAlmeidaEc JovitaFonFay Catalina Perez Avila Pueblos Nacionalidades manababravo,2019-03-24
Sofía Yvette,Almeida Fuentes,SofiaAlmeidaEc,alandmolestinam jcarlostuarez RicardoRivasBr hernanulloa catalinaperez SofiaAlmeidaEc fovafonfay franciscobravo carlosfigueroo,2019-03-24
Sofía Yvette,Almeida Fuentes,SofiaAlmeidaEc,SofiaAlmeidaEc X ud seguro voto saludo,2019-03-24
Sofía Yvette,Almeida Fuentes,SofiaAlmeidaEc,escuchando candidato Candidata Consejera CPCCS SofiaAlmeidaEc saludo clase medico,2019-03-24
Sofía Yvette,Almeida Fuentes,SofiaAlmeidaEc,voto CPCCS davidroserow SofiaAlmeidaEc ChugchilanJaime,2019-03-24
Sofía Yvette,Almeida Fuentes,SofiaAlmeidaEc,Acertado tuit Voten SofiaAlmeidaEc gente nuevo honesta,2019-03-24
Sofía Yvette,Almeida Fuentes,SofiaAlmeidaEc,SofiaAlmeidaEc,2019-03-24
Sofía Yvette,Almeida Fuentes,SofiaAlmeidaEc,robertfriendm hernanulloa alexorlandogye CPCCS SofiaAlmeidaEc Buena tarde respetuosamente pongo consideracion candidatura KariPonce11 CarlosEscuderoS Gracias atencion,2019-03-24
Sofía Yvette,Almeida Fuentes,SofiaAlmeidaEc,alexorlandogye CPCCS sofiaalmeidaec unico dos voto decidido cpccs precisamente sofiaalmeidaec hernanulloa aun deber meditar voto confio persona llegar si voluntad pueblo desaparecer organismo primero apoyar postura,2019-03-24
Sofía Yvette,Almeida Fuentes,SofiaAlmeidaEc,davidroserow sofiaalmeidaec poner mejor gente construi pais mejor David noalnulo,2019-03-24
Sofía Yvette,Almeida Fuentes,SofiaAlmeidaEc,CPCCS tambien votare davidroserow sofiaalmeidaec mejor nombre veo listar votar noalnulo democracia participativo mirada ciudadano publico hacer ahi presupuesto participativo deuda,2019-03-24
Sofía Yvette,Almeida Fuentes,SofiaAlmeidaEc,apoyo SofiaAlmeidaEc jobafonfay2019,2019-03-24
Sofía Yvette,Almeida Fuentes,SofiaAlmeidaEc,gireyb hernanulloa DMarcosmolina faustomolinar SofiaAlmeidaEc CPCCS,2019-03-24
Sofía Yvette,Almeida Fuentes,SofiaAlmeidaEc,robertfriendm CPCCS Robert invito conozca vot SofiaAlmeidaEc,2019-03-24
Sofía Yvette,Almeida Fuentes,SofiaAlmeidaEc,votar CPCCS Grupo hernanulloa ALANDMOLESTINAM carlosfigueroa6 Grupo B SofiaAlmeidaEc Fon fay monka78 Grupo C ChugchilanJaime confirmado,2019-03-24
Sofía Yvette,Almeida Fuentes,SofiaAlmeidaEc,VotanteQueSeRespeta Vota pollar Hombres Ulloa hernanulloa Molina DMarcosmolina Lupera FaustoMolina AlandMolestina opcion Mujeres SofiaAlmeida SofiaAlmeidaEc CatalinaPerez JobaFonfay confiable Nacionalidades Bravo,2019-03-24
Sofía Yvette,Almeida Fuentes,SofiaAlmeidaEc,ONU derechos 7 Candidaturas Consejeros INDEPENDIENTES CPCCS KariPonce11 SofiaAlmeidaEc jobafonfay2019 HernanUlloa davidroserow JamesMcpccs ChugchilanJaime VOTOMujerJuventudExpertis corporaciongser NemySantacruz ksantacruzm ceomespecuador,2019-03-24
Sofía Yvette,Almeida Fuentes,SofiaAlmeidaEc,hernanulloa CPCCS janethinostrozar tinocotania galobonifaz davidroserow ChristianCruzLa ChugchilanJaime SofiaAlmeidaEc PabloPonce RicardoRivasBr ALANDMOLESTINAM Asi sero votacion dio d hora H 24 03 2019 08h00 PATRIA VER CARCEL CORRUPTOS Q DEVUELVAN robado completo,2019-03-24
Sofía Yvette,Almeida Fuentes,SofiaAlmeidaEc,ONU derecho votociudadanoprofesionaldirectivo Elecciones7ConsejerosCPCCS Mujeres KariPonce11 SofiaAlmeidaEc jobafonfay2019 Hombres hernanulloa davidroserow JamesMcpccs Pueblos Nacionalidades ChugchilanJaime ceomespecuador Presidente corporacionges,2019-03-24
Sofía Yvette,Almeida Fuentes,SofiaAlmeidaEc,onumujeresEcu VotoMujerProfesionalDirectiva Elecciones7ConsejerosCPCCS Mujeres KariPonce11 SofiaAlmeidaEc jobafonfay2019 Hombres hernanulloa davidroserow JamesMcpccs Pueblos Nacionalidades ChugchilanJaime KSantacruzM Vicepresidencia corporacionges,2019-03-24
Sofía Yvette,Almeida Fuentes,SofiaAlmeidaEc,ONU derechos VotoMujerJuventudINDEPENDIENTE Elecciones7ConsejerosCPCCS Mujeres KariPonce11 SofiaAlmeidaEc jobafonfay2019 Hombres hernanulloa davidroserow JamesMcpccs Pueblos Nacionalidades ChugchilanJaime NemySantacruz Directora CRS corporacionges,2019-03-24
Sofía Yvette,Almeida Fuentes,SofiaAlmeidaEc,trote salud DANDO APOYO CANDIDATOS cpccs cuales ChugchilanJaime SofiaAlmeidaEc monka78 hernanulloa ChristianCruzLa Graciela Estupinan Teddy Tama DIOS SIEMPRE bendigar,2019-03-24
Sofía Yvette,Almeida Fuentes,SofiaAlmeidaEc,Decidi votar CPCCS MUJRES Ibeth Estupinan 1 Sofia Almeida 10 Marlene Montesinos 9 ibethestupinar SofiaAlmeidaEc MarleneMontesinos CPCCS eleccciones2019ec ibethestupinar,2019-03-24
Sofía Yvette,Almeida Fuentes,SofiaAlmeidaEc,SofiaAlmeidaEc vot x ud sofiar saludo,2019-03-24
Sofía Yvette,Almeida Fuentes,SofiaAlmeidaEc,alegrio haber sufragar colegio ver crecer educo junto familia valor hombro padre recordar haber llegar primero grado junto brazo graduar yo luego 12 ano estudio ahora regreso candidata CPCCS SofiaAlmeida,2019-03-24
Sofía Yvette,Almeida Fuentes,SofiaAlmeidaEc,SofiaAlmeidaEc EcuavisaInforma elnorteadiario DiarioExtraEc eldiarioec RadioHuancavilk Expresoec lahoraecuador mercurioec diarioqueec Felicidades ING Sofia confiamos ud,2019-03-25
Sofía Yvette,Almeida Fuentes,SofiaAlmeidaEc,ir bien 2do lugar mujer CPCCS elecciones2019ec,2019-03-25
Sofía Yvette,Almeida Fuentes,SofiaAlmeidaEc,gracias ecuatoriano depositar confianza oficialmente voz tú cpccs envio abrazo fuerte lleno esperanza vision mejor Ecuador SofiaAlmeida CandidataElecta Elecciones2019Ec,2019-03-27
Sofía Yvette,Almeida Fuentes,SofiaAlmeidaEc,compartar contacto persona necesitar poder enterar felicitación mucho gracia labor constante Hospital Leon Becerra,2019-03-28
Sofía Yvette,Almeida Fuentes,SofiaAlmeidaEc,Feliz diar persona pendiente demostrandome amor incondicional mami reina abuelito Piedad angel viviente pilar fundamental vida tambien abuelita Pastorita sabio consejo lleno amor siempre,2019-05-12
