nombre,apellidos,tweet_screen_name,tweet_text,tweet_date
Jaime Rubén,Chugchilan Cisaguano,ChugchilanJaime,venir organización social Movimiento Indigena Ecuador pertenecer ninguno tendencia partidista Jipijapa CafeRadio TuParticipacionEsLaSolucion JaimeChugchilanEsParticipacion,2019-02-19
Jaime Rubén,Chugchilan Cisaguano,ChugchilanJaime,venir organización social Movimiento Indigena Ecuador pertenecer ninguno tendencia partidista Jipijapa CafeRadio TuParticipacionEsLaSolucion JaimeChugchilanEsParticipacion,2019-02-19
Jaime Rubén,Chugchilan Cisaguano,ChugchilanJaime,gracias periodista LimberChilanCh CesarDelgado CafeRadio Jipijapa entrevistar hoy TuParticipacionEsLaSolucion JaimeChugchilanEsParticipacion,2019-02-19
Jaime Rubén,Chugchilan Cisaguano,ChugchilanJaime,radiocaribir Manabi periodista Franklin Castro conversar propuesto CPCCS TuparticipacionEsLaSolucion JaimeChugchilanEsParticipacion,2019-02-19
Jaime Rubén,Chugchilan Cisaguano,ChugchilanJaime,gracias Jefferson Calle recibimiento invitar yo mercado Jipijaja degustar rico bolón chicharron socializar propuesta CPCCS TuparticipacionEsLaSolucion JaimeChugchilanEsParticipacion,2019-02-19
Jaime Rubén,Chugchilan Cisaguano,ChugchilanJaime,Fortalecimos participacion ciudadano Conversatorio candidato CPCCS Jipijaja Gracias Manabi acogidir,2019-02-19
Jaime Rubén,Chugchilan Cisaguano,ChugchilanJaime,buen diir hoy Manabi invitado sintonizar medio estare invitado hablar CPCCS SofiaAlmeida,2019-02-20
Jaime Rubén,Chugchilan Cisaguano,ChugchilanJaime,Manabi compartir joven importancia CPCCS joven vivir participacion TuparticipacionEsLaSolucion JaimeChugchilanEsParticipacion,2019-02-20
Jaime Rubén,Chugchilan Cisaguano,ChugchilanJaime,venir Movimiento Indigena Ecuador organización social pertenecer ninguno tendencia partidista represento ecuatoriano querer pais mejor RadioMorena Guayaquil TuparticipacionEsLaSolucion JaimeChugchilanEsParticipacion,2019-02-20
Jaime Rubén,Chugchilan Cisaguano,ChugchilanJaime,Guayaquil entrevistar WQRadio EC compartir microfono franklinmorenoquezado dialogar reto propuesto CPCCS TuparticipacionEsLaSolucion JaimeChugchilanEsParticipacion,2019-02-20
Jaime Rubén,Chugchilan Cisaguano,ChugchilanJaime,Guayaquil participar Asamblea Ciudadana Ecuador TuparticipacionEsLaSolucion JaimeChugchilanEsParticipacion,2019-02-20
Jaime Rubén,Chugchilan Cisaguano,ChugchilanJaime,Invito ecuatoriano escoger buen ciudadano cpccs 24 marzo manasurtv Manabi TuparticipacionEsLaSolucion JaimeChugchilanEsParticipacion,2019-02-20
Jaime Rubén,Chugchilan Cisaguano,ChugchilanJaime,Estimados colega feliz diar,2019-02-20
Jaime Rubén,Chugchilan Cisaguano,ChugchilanJaime,trabajo enseno responsabilidad dignifico vida impulsar joven participar proceso ciudadano cpccs escuchar TuparticipacionEsLaSolucion JaimeChugchilanEsParticipacion,2019-02-20
Jaime Rubén,Chugchilan Cisaguano,ChugchilanJaime,Feliz Dia colegas abogados,2019-02-20
Jaime Rubén,Chugchilan Cisaguano,ChugchilanJaime,importante medio comunicacion estir atento clamor ciudadano herramienta ser objetivo transparente Gracias Angelita Colegio Periodistas Guayas Franklin Moreno TuParticipacionEsLaSolucion JaimeChugchilanEsParticipacion,2019-02-20
Jaime Rubén,Chugchilan Cisaguano,ChugchilanJaime,vandocilla CPCCS davidroserow SofiaAlmeidaEc gracias amigo saludo,2019-02-23
Jaime Rubén,Chugchilan Cisaguano,ChugchilanJaime,voto nulo dejar sector secuestrar cpccs pasado regrese voto sero davidroserow SofiaAlmeidaEc ChugchilanJaime,2019-02-23
Jaime Rubén,Chugchilan Cisaguano,ChugchilanJaime,recorrer Guayaquil conversar gente dar conocer propuesta CPCCS Dr Franklin Moreno Quezada TuParticipacionEsLaSolucion JaimeChugchilanEsParticipacion,2019-02-24
Jaime Rubén,Chugchilan Cisaguano,ChugchilanJaime,ciudadano derecho conocer cual serar función CPCCS candidato participarar 24 marzo Guayaquil junto Dr Franklin Moreno Quezada TuParticipacionEsLaSolucion JaimeChugchilanEsParticipacion,2019-02-24
Jaime Rubén,Chugchilan Cisaguano,ChugchilanJaime,candidato cpccs Colectivo Integracion Democracia in democracia analizado hoja vido candidato establecido CORREISTAS VOTAREMOS eleccion ideal 1 RE PUEBLOS ChugchilanJaime,2019-02-24
Jaime Rubén,Chugchilan Cisaguano,ChugchilanJaime,Peguche Otavalo compartir disfrutar Pawkar Raymi Fiestas Florecimiento TuParticipacionEsLaSolucion JaimeChugchilanEsParticipacion,2019-02-24
Jaime Rubén,Chugchilan Cisaguano,ChugchilanJaime,aprovechar visita Peguche Otavalo Pawkar Raymi Fiestas Florecimiento conversar persona función CPCCS beneficio consejo ciudadania TuParticipacionEsLaSolucion JaimeChugchilanEsParticipacion,2019-02-24
Jaime Rubén,Chugchilan Cisaguano,ChugchilanJaime,pedrlucaspachay BERTHAMORALESC PoderCiuEC MaJosefaCoronel CarlosVerareal diegooquendo AndresCarrion2 ramirogarciaf janethinostroza JusticeVeraEC DrRobertoLopez2 raguilarandradar cesarmontufar51 Gracias amigo Pedro,2019-02-25
Jaime Rubén,Chugchilan Cisaguano,ChugchilanJaime,joven futuro participacion ciudadano gracias FEUE apoyo TuParticipacionEsLaSolucion JaimeChugchilanEsParticipacion,2019-02-26
Jaime Rubén,Chugchilan Cisaguano,ChugchilanJaime,Lxs Universitarios labor importante futuro EC 24 M elección CPCCS ir votar davidroserow SofiaAlmeidaEc ChugchilanJaime mano continuar lucha corrupcion Mensaje mauricio Fese,2019-02-26
Jaime Rubén,Chugchilan Cisaguano,ChugchilanJaime,joven futuro participacion ciudadano gracias FEUE apoyo TuParticipacionEsLaSolucion JaimeChugchilanEsParticipacion,2019-02-26
Jaime Rubén,Chugchilan Cisaguano,ChugchilanJaime,companero comunidad indigena rendicion cuenta Secretaria Agua TuparticipacionEsLaSolucion JaimeChugchilanEsParticipscion,2019-02-27
Jaime Rubén,Chugchilan Cisaguano,ChugchilanJaime,christiancruzla hernanulloa FaustoLupera ALANDMOLESTINAM PabloRicaurte73 gervasachi SofiaAlmeidaEc jcarlostuarez ChugchilanJaime mao chugchilar germanachi1 viviecuador,2019-02-27
Jaime Rubén,Chugchilan Cisaguano,ChugchilanJaime,hoy participar posesion coordinador provincial Nacionalidad Waorani Pastaza TuParticipacionEsLaSolucion JaimeChugchilanEsParticipacion,2019-02-28
Jaime Rubén,Chugchilan Cisaguano,ChugchilanJaime,junto companero Nacionalidad Waorani Pastaza,2019-02-28
Jaime Rubén,Chugchilan Cisaguano,ChugchilanJaime,Pastaza compartir hoy companero nacionalidad Waorani TuParticipacionEsLaSolucion JaimeChugchilanEsParticipacion,2019-02-28
Jaime Rubén,Chugchilan Cisaguano,ChugchilanJaime,ONU derechos 7 Candidaturas Consejeros CPCCS independiente ser elegir si aceptar firmar Pacto Etico 4 COMPROMISOS SofiaAlmeidaEc jobafonfay2019 MariaCatalinaPerezAvila HernanUlloa davidroserow JamesMcpccs ChugchilanJaime,2019-02-28
Jaime Rubén,Chugchilan Cisaguano,ChugchilanJaime,gracias invitacion Colectivo Quito Juventudes escuchar propuesta CPCCS apoyo participacion tambien joven TuParticipacionEsLaSolucion JaimeChugchilanEsParticipacion,2019-02-28
Jaime Rubén,Chugchilan Cisaguano,ChugchilanJaime,Mesa permanente Educacion Imbabura escuchir pedido reapertura escuela bilingues gracias confiar TuParticipacionEsLaSolucion JaimeChugchilanEsParticipacion,2019-02-28
Jaime Rubén,Chugchilan Cisaguano,ChugchilanJaime,cosa impulsar ser parte CPCCS poder escuchar gente saber necesidad aqui junto habitante barrio Sauces Valle Quito TuParticipacionEsLaSolucion JaimeChugchilanEsParticipacion,2019-02-28
Jaime Rubén,Chugchilan Cisaguano,ChugchilanJaime,explicar persona función CPCCS propuesta hacer cada dia TuParticipacionEsLaSolucion JaimeChugchilanEsParticipacion,2019-02-28
Jaime Rubén,Chugchilan Cisaguano,ChugchilanJaime,explicar persona función CPCCS propuesta hacer cada dia junto Jorge Leon dueno restaurante TuParticipacionEsLaSolucion JaimeChugchilanEsParticipacion,2019-02-28
Jaime Rubén,Chugchilan Cisaguano,ChugchilanJaime,RadioMia Sonovision Puyo gracia recibirno ayudar difundir propuesta CPCCS TuParticipacionEsLaSolucion JaimeChugchilanEsParticipacion,2019-03-01
Jaime Rubén,Chugchilan Cisaguano,ChugchilanJaime,gracios Asociacion Parque Ejido invitacion permitirno conocer mas fondo realidad hacerl conocer propuesta CPCCS junto Franklin Moreno Quezada TuParticipacionEsLaSolucion JaimeChugchilanEsParticipacion,2019-03-02
Jaime Rubén,Chugchilan Cisaguano,ChugchilanJaime,gracios Comite Desarrollo Integral Parroquia Rural Veintimilla Guaranda invitacion carnaval TuParticipacionEsLaSolucion JaimeChugchilanEsParticipacion,2019-03-03
Jaime Rubén,Chugchilan Cisaguano,ChugchilanJaime,Guaranda gracias recibimiento TuParticipacionEsLaSolucion JaimeChugchilanEsParticipacion,2019-03-03
Jaime Rubén,Chugchilan Cisaguano,ChugchilanJaime,Raul Mora activista derechos humanos carnavaldeguarandar TuParticipacionEsLaSolucion JaimeChugchilanEsParticipacion,2019-03-03
Jaime Rubén,Chugchilan Cisaguano,ChugchilanJaime,24 marzo saber votar ChugchilanJaime TuParticipacionEsLaSolucion,2019-03-04
Jaime Rubén,Chugchilan Cisaguano,ChugchilanJaime,ONU derechos corporacionges nominar 7 Candidaturas Consejeros CPCCS hernanulloa davidroserow JamesMcpccs SofiaAlmeidaEc jobafonfay2019 KariPonce11 ChugchilanJaime Firmar Pacto Etico 4 COMPROMISOS identificar independiente merito,2019-03-06
Jaime Rubén,Chugchilan Cisaguano,ChugchilanJaime,SofiaAlmeidaEc radiomorena640 informar ciudadania función cumplir CPCCS importancia existencia TuParticipacionEsLaSolucion JaimeChugchilanEsParticipacion,2019-03-06
Jaime Rubén,Chugchilan Cisaguano,ChugchilanJaime,dia encontre RadioMorena640 davidroserow ChugchilanJaime candidato CPCCS conversar falta hacer lucha corrupcion coincidir punto SofiaAlmeida SomosAnticorrupcion,2019-03-07
Jaime Rubén,Chugchilan Cisaguano,ChugchilanJaime,emprendimiento fundamental desarrollo sociedad conversar Gino Maquilon vicepresidente Asociacion Jovenes Emprendedores Ecuador Guayaquil TuParticipacionEsLaSolucion JaimeChugchilanEsParticipacion,2019-03-07
Jaime Rubén,Chugchilan Cisaguano,ChugchilanJaime,emprendimiento fundamental desarrollo sociedad conversar GINOMAQUILON miembro ajeecuadororg Asociacion Jovenes Emprendedores Ecuador Guayaquil TuParticipacionEsLaSolucion JaimeChugchilanEsParticipacion,2019-03-07
Jaime Rubén,Chugchilan Cisaguano,ChugchilanJaime,Asi empezam tú dia entrevista luisadelgadillo radioelite9971 TuParticipacionEsLaSolucion JaimeChugchilanEsParticipacion,2019-03-07
Jaime Rubén,Chugchilan Cisaguano,ChugchilanJaime,Asi empezam tú dia entrevista luisadelgadillo radioelite9971 TuParticipacionEsLaSolucion JaimeChugchilanEsParticipacion,2019-03-07
Jaime Rubén,Chugchilan Cisaguano,ChugchilanJaime,invitado hoy conversatorio itbolivariano hablarar CPCCS TuParticipacionEsLaSolucion JaimeChugchilanEsParticipacion,2019-03-07
Jaime Rubén,Chugchilan Cisaguano,ChugchilanJaime,CPCCS impulsarer veeduria herramienta efectivo control publico itbolivariano Guayaquil TuParticipacionEsLaSolucion JaimeChugchilanEsParticipacion,2019-03-08
Jaime Rubén,Chugchilan Cisaguano,ChugchilanJaime,gran representante sector Indigena Abogado ChugchilanJaime,2019-03-08
Jaime Rubén,Chugchilan Cisaguano,ChugchilanJaime,JaimeEsParticipacion Guayaquil participar ChugchilanJaime SofiaAlmeidaEc,2019-03-08
Jaime Rubén,Chugchilan Cisaguano,ChugchilanJaime,ChugchilanJaime SofiaAlmeidaEc Consejo Participacion Ciudadana Control Social JaimeesParticipacion voto2019 CONAIE Ecuador confeniae1 fenocinecuador,2019-03-08
Jaime Rubén,Chugchilan Cisaguano,ChugchilanJaime,ChugchilanJaime Consejo Participacion Ciudadana Control Social joven humilde valor JaimeesParticipacion voto2019 CONAIE Ecuador confeniae1 fenocinecuador,2019-03-08
Jaime Rubén,Chugchilan Cisaguano,ChugchilanJaime,conocer trayectoria companero ChugchilanJaime Consejo Participacion Coudadana ROSCGAE bchimborazo1 CONAIE Ecuador MujeresCONAIE davidroserow SofiaAlmeidaEc,2019-03-08
Jaime Rubén,Chugchilan Cisaguano,ChugchilanJaime,hoy DiaInternacionalDeLaMujer conmemorar todo mujer luchar derecho construir mundo mejor equitativo TuParticipacionEsLaSolucion JaimeChugchilanEsParticipacion,2019-03-08
Jaime Rubén,Chugchilan Cisaguano,ChugchilanJaime,CPCCS defenderar acción afirmativo minoria GualaceoMegatv TuParticipacionEsLaSolucion JaimeChugchilanEsParticipacion,2019-03-08
Jaime Rubén,Chugchilan Cisaguano,ChugchilanJaime,protegeremo trabajar autonomo ciudadano CPCCS RCV Gualaceo,2019-03-08
Jaime Rubén,Chugchilan Cisaguano,ChugchilanJaime,protegeremo trabajar autonomo ciudadano CPCCS RCV Gualaceo TuParticipacionEsLaSolucion JaimeChugchilanEsParticipacion,2019-03-08
Jaime Rubén,Chugchilan Cisaguano,ChugchilanJaime,FelizDiaDeLaMujer querer ir dormir desear pasado feliz diar todo mujer fuente amor decir cancion dedico carino mama abuela familiar amigo todo ecuatoriana sofiaalmeido CPCCS,2019-03-09
Jaime Rubén,Chugchilan Cisaguano,ChugchilanJaime,24 marzo invito ciudadania votar civicamente CPCCS demoster poder ciudadano ninguno tendencia incoherente pretender dirigir pais RadioNexoCuenca TuParticipacionEsLaSolucion JaimeChugchilanEsParticipacion,2019-03-09
Jaime Rubén,Chugchilan Cisaguano,ChugchilanJaime,itbolivariano hablar Radio Migrantes Unidos Acciones Afirmativas grupo minoritario Pueblos Indigenas Afroecuatorianos Montubios Ecuatorianos Exterior TuParticipacionEsLaSolucion JaimeChugchilanEsParticipacion,2019-03-09
Jaime Rubén,Chugchilan Cisaguano,ChugchilanJaime,CPCCS defenderar acción afirmativo minoria GualaceoMegatv TuParticipacionEsLaSolucion JaimeChugchilanEsParticipacion,2019-03-09
Jaime Rubén,Chugchilan Cisaguano,ChugchilanJaime,invitado hoy conversatorio itbolivariano hablarar CPCCS TuParticipacionEsLaSolucion JaimeChugchilanEsParticipacion,2019-03-09
Jaime Rubén,Chugchilan Cisaguano,ChugchilanJaime,CONAIE Consejo Ampliado resolver respaldar candidatura ChugchilanJaime CPCCS definitivo apoyo elecciones2019ec 24 marzo trayectoria luchar beneficio pueblo nacionalidad confeniae1 ecuachaskiecua SomosCONAIE,2019-03-09
Jaime Rubén,Chugchilan Cisaguano,ChugchilanJaime,cpccs proteger veedor dar herramienta proteccion concebimos sacrificar tranquilidad bienestar mucho vez amenazado radiosplendid Cuenca TuParticipacionEsLaSolucion JaimeChugchilanEsParticipacion,2019-03-09
Jaime Rubén,Chugchilan Cisaguano,ChugchilanJaime,CPCCS exigirer cumplir acción afirmativo minoria Pueblos Nacionalidades Indigenas Afroecuatorianos Montubios Ecuatorianos Exterior HernanUlloa SofiaAlmeidaEc Pachaa TuParticipacionEsLaSolucion JaimeChugchilanEsParticipacion,2019-03-09
Jaime Rubén,Chugchilan Cisaguano,ChugchilanJaime,gracias chicos Fundacion Jovenes Ecuador companero colectivo invitacion TuParticipacionEsLaSolucion JaimeChugchilanEsParticipacion,2019-03-09
Jaime Rubén,Chugchilan Cisaguano,ChugchilanJaime,Felicito Colegio Benigno Malo Cuenca sentir complacido participar festejo BenignoMalo TuParticipacionEsLaSolucion JaimeChugchilanEsParticipacion,2019-03-09
Jaime Rubén,Chugchilan Cisaguano,ChugchilanJaime,ChugchilanJaime radioelite9971 jaimevargasnae fenocinecuador SofiaAlmeidaEc hernanulloa excelente Dr si triunfir,2019-03-09
Jaime Rubén,Chugchilan Cisaguano,ChugchilanJaime,CONAIE Ecuador ChugchilanJaime CPCCS confeniae1 ecuachaskiecua adelante Jaime Chugchilan ejemplo perseverancio constancia,2019-03-09
Jaime Rubén,Chugchilan Cisaguano,ChugchilanJaime,coplacgprd VotoCiudadanoINDEPENDIENTE Considera 7 Candidaturas Consejeros nominada corporaciong destacar 4 COMPROMISOS Pacto Etico favoritar 5 HernanUlloa davidroserow SofiaAlmeidaEc KariPonce11 ChugchilanJaime,2019-03-10
Jaime Rubén,Chugchilan Cisaguano,ChugchilanJaime,voto CPCCS sofiaalmeidaec hernanulloa ChugchilanJaime ciudadano comprometido combatir corrupcion alto valor,2019-03-10
Jaime Rubén,Chugchilan Cisaguano,ChugchilanJaime,Suscribo davidroserow HernanUlloa SofiaAlmeidaEc jaimechugchilar opción esperanzadora gente preparado capaz serio,2019-03-10
Jaime Rubén,Chugchilan Cisaguano,ChugchilanJaime,eliminar Decreto Ejecutivo 193 tener Ley OSC Codigo Organico Sistema Participacion Ciudadana Control Social Reformar Codigo Democracia VotoMujerJuventudINDEPENDIENTE papeleto Pueblos Nacionalidades ChugchilanJaime Pacto Etico 4 COMPROMISOS,2019-03-10
Jaime Rubén,Chugchilan Cisaguano,ChugchilanJaime,jcaicedo86 HernanUlloa SofiaAlmeidaEc Muchas gracia,2019-03-11
Jaime Rubén,Chugchilan Cisaguano,ChugchilanJaime,gracias apoyo,2019-03-11
Jaime Rubén,Chugchilan Cisaguano,ChugchilanJaime,gracias apoyo,2019-03-11
Jaime Rubén,Chugchilan Cisaguano,ChugchilanJaime,amigo innumerable lucha social ChugchilanJaime respaldo incondicional nuevo reto candidato CPCCS JaimeChugchilanEsParticipacion,2019-03-12
Jaime Rubén,Chugchilan Cisaguano,ChugchilanJaime,gracias apoyo,2019-03-12
Jaime Rubén,Chugchilan Cisaguano,ChugchilanJaime,pueblomontubio respaldar Abogado ChugchilanJaime Ingeniera SofiaAlmeidaEc JaimeEsParticipacion SofiaLaSolucion CONAIE Ecuador MujeresCONAIE JuventudConaie,2019-03-12
Jaime Rubén,Chugchilan Cisaguano,ChugchilanJaime,amigo innumerable lucha social ChugchilanJaime respaldo incondicional nuevo reto candidato CPCCS JaimeChugchilanEsParticipacion,2019-03-12
Jaime Rubén,Chugchilan Cisaguano,ChugchilanJaime,jaimeesparticipacion mas firmezar nunca CPCCS ChugchilanJaime,2019-03-12
Jaime Rubén,Chugchilan Cisaguano,ChugchilanJaime,Amigos invito seguir agenda medio ProvinciaDeBolivar TuParticipacionEsLaSolucion JaimeEsParticipacion,2019-03-12
Jaime Rubén,Chugchilan Cisaguano,ChugchilanJaime,cvsimport 2015 NemySantacruz corporaciongser ChugchilanJaime SofiaAlmeidaEc KariPonce11 HernanUlloa davidroserow JamesMcpccs,2019-03-12
Jaime Rubén,Chugchilan Cisaguano,ChugchilanJaime,empezar jornada Guaranda Radio Universidad Bolivar TuParticipacionEsLaSolucion JaimeChugchilanEsParticipacion,2019-03-12
Jaime Rubén,Chugchilan Cisaguano,ChugchilanJaime,deber elegir mejor ciudadano 24 marzo CPCCS accioner ciudadania Guaranda RadioUniversidaddeBolivar TuParticipacionEsLaSolucion JaimeChugchilanEsParticipacion,2019-03-12
Jaime Rubén,Chugchilan Cisaguano,ChugchilanJaime,tendencia partidista promover voto nulo miedo lleguer cpccs persona responder interés fuerza votar mejor 24 marzo RadioMatiavi Guaranda TuParticipacionEsLaSolucion JaimeChugchilanEsParticipacion,2019-03-12
Jaime Rubén,Chugchilan Cisaguano,ChugchilanJaime,Pueblo nuevo frontera Manabi Esmeraldas autoridad llegar socializamos funcion cpccs morador agradecer invitacion TuParticipacionEsLaSolucion JaimeChugchilanEsParticipacion,2019-03-12
Jaime Rubén,Chugchilan Cisaguano,ChugchilanJaime,gracias Radio Mundo Guaranda TuParticipacionEsLaSolucion JaimeChugchilanEsParticipacion,2019-03-12
Jaime Rubén,Chugchilan Cisaguano,ChugchilanJaime,seguir Guaranda ahora canal 7 tv CPCCS TuParticipacionEsLaSolucion JaimeChugchilanEsParticipacion,2019-03-12
Jaime Rubén,Chugchilan Cisaguano,ChugchilanJaime,ovidiobayas exgobernador Bolivar celebrar carnaval segun tradicion extender domingo Pascua Ademas compartir informacion participacion ciudadano CPCCS TuParticipacionEsLaSolucion JaimeChugchilanEsParticipacion,2019-03-12
Jaime Rubén,Chugchilan Cisaguano,ChugchilanJaime,nuevafotodeperfil,2019-03-13
Jaime Rubén,Chugchilan Cisaguano,ChugchilanJaime,24 marzo oportunidad escribir nuevo capitulo historio Ecuador Aspiro ser primero miembro indigén CPCCS luchar corrupcion devolver esperanza dia mejor todo JaimeChugchilanEsParticipacion,2019-03-13
Jaime Rubén,Chugchilan Cisaguano,ChugchilanJaime,Echeandia Angel Rochina gracias recibimiento CPCCS TuParticipacionEsLaSolucion JaimeChugchilanEsParticipacion,2019-03-13
Jaime Rubén,Chugchilan Cisaguano,ChugchilanJaime,Bajo resolucion Consejo Ampliado CONAIE ChugchilanJaime candidato parte pueblo nacionalidad CPCCS 24 marzo 2019 decidir participacion Jaime Chugchilan SomosCONAIE,2019-03-14
Jaime Rubén,Chugchilan Cisaguano,ChugchilanJaime,mil gracia amigo Angel Rochina lider Canton Echeandia Provincia Bolivar apoyo incondicional candidatura Consejo Participacion Ciudadana Control Social confeniae1 CONAIE Ecuador cadhuecuador,2019-03-14
Jaime Rubén,Chugchilan Cisaguano,ChugchilanJaime,interés partidista poder voluntad popular ir firme hacia Consejo Participacion Ciudadana Control Social JaimeChugchilanEsParticipacion TuParticipacionEsLaSolucion SofiaAlmeidaEc hernanulloa CONAIE Ecuador cadhuecuador confeniae1,2019-03-14
Jaime Rubén,Chugchilan Cisaguano,ChugchilanJaime,viernes CUARTOPODER Ab Jaime Chugchilan ChugchilanJaime Candidato Consejo Participacion Ciudadana Control Social CPCCS temo Plan trabajo 107 3 FM RadioRumbaNetwork,2019-03-15
Jaime Rubén,Chugchilan Cisaguano,ChugchilanJaime,Leonidas Iza Salazar presidente Movimiento Indigena Campesino Cotopaxi MIC conversar importancia CPCCS inclusion sector indigenar sector publico TuParticipacionEsLaSolucion JaimeChugchilanEsParticipacion,2019-03-15
Jaime Rubén,Chugchilan Cisaguano,ChugchilanJaime,Guayaquil,2019-03-15
Jaime Rubén,Chugchilan Cisaguano,ChugchilanJaime,iniciar actividad Perla Pacifico Guayaquil,2019-03-15
Jaime Rubén,Chugchilan Cisaguano,ChugchilanJaime,necesidad crear mas burocracia cpccs solo nombrar mejor hombre mujer voluntad combatar corrupcion fomentar participacion RadioRumbaEc Guayaquil TuParticipacionEsLaSolucion JaimeChugchilanEsParticipacion,2019-03-15
Jaime Rubén,Chugchilan Cisaguano,ChugchilanJaime,Guayaquil junto hernanulloa solo debatimos voto nulo futuro cpccs tambien aprovechar degustar encebollado famoso PezAzul Puerto Principal TuParticipacionEsLaSolucion JaimeChugchilanEsParticipacion,2019-03-15
Jaime Rubén,Chugchilan Cisaguano,ChugchilanJaime,Luis Rivera presidente Asociacion 9 octubre mas 12 mil afiliado Guayaquil tratar fondo importancia CPCCS beneficio ciudadania TuParticipacionEsLaSolucion JaimeChugchilanEsParticipacion,2019-03-15
Jaime Rubén,Chugchilan Cisaguano,ChugchilanJaime,planteo 14 Candidaturas manifestacion inter explicito implicito aceptar Pacto Lista Hombres davidroserow David Rosero hernanulloa Hernan Ulloa JamesMcpccs James Montenegro Pueblos Nacionalidades ChugchilanJaime Jaime Chugchilan 3,2019-03-15
Jaime Rubén,Chugchilan Cisaguano,ChugchilanJaime,decir 7 desconocido querer ir CPCCS querer hacer bien ciudadania poder permitir caudillo cualquiera bancada politico tomar control pais radio sucre TuParticipacionEsLaSolucion JaimeChugchilanEsParticipacion,2019-03-16
Jaime Rubén,Chugchilan Cisaguano,ChugchilanJaime,agradecer espacio ABC Tv entrevistar Cristhian Cardenas permitirme llegar comunidad propuesto CPCCS TuParticipacionEsLaSolucion JaimeChugchilanEsParticipacion,2019-03-16
Jaime Rubén,Chugchilan Cisaguano,ChugchilanJaime,gracias amigo Movimiento Indigena Pueblo Kichwa Costa Ecuatoriana MOPKICE acompanemar actividad Guayaquil CPCCS TuParticipacionEsLaSolucion JaimeChugchilanEsParticipacion,2019-03-16
Jaime Rubén,Chugchilan Cisaguano,ChugchilanJaime,gracias amigo Movimiento Indigena Pueblo Kichwa Costa Ecuatoriana MOPKICE acompanar yo actividad Guayaquil CPCCS TuParticipacionEsLaSolucion JaimeChugchilanEsParticipacion,2019-03-16
Jaime Rubén,Chugchilan Cisaguano,ChugchilanJaime,corporaciongser hernanulloa Feliz cumpleanos amigo Hernan ulloa,2019-03-16
Jaime Rubén,Chugchilan Cisaguano,ChugchilanJaime,AniMeGalarza PabloRicaurte73 hernanulloa ChristianCruzLa ChugchilanJaime FaustoLupera ALANDMOLESTINAM bernieperezs miltonperezsh alperezs SofiaAlmeidaEc LuisAlmeidaM RadioMorena640 FRM87 FranklinMorenoM RicardoRivasBr jcarlostuarez fernandobaldar Lisset estradac,2019-03-16
Jaime Rubén,Chugchilan Cisaguano,ChugchilanJaime,malecon Salado Guayaquil Socializando propuesto representante Organizaciones Cristianas Fundacion Abogados Ecuador FACE Consejo Nacional Asociaciones Cristianas Ecuador CONASE Fernanda Aurelia Ortiz Olmedo hernanaria,2019-03-17
Jaime Rubén,Chugchilan Cisaguano,ChugchilanJaime,recorrido Ecuador compartido grande amig s especialmente aquell s preocupado comunidad gracia Frente Accion Ciudadana Ing Veronica Loaiza Vera Directora PabloAlvarado Director Juventudes TaniaUlloa Directora Frente Femenino,2019-03-17
Jaime Rubén,Chugchilan Cisaguano,ChugchilanJaime,solo voto correista ChristianCruzLa hernanulloa CarlosFigueroa SofiaAlmeidaEc JobaFonfay CatalinaPerez ChugchilanJaime PabloRicaurte73 RadioMorena640 carlosverareal fernandobaldar germanachi1 AniMeGalarza Lisset EstradaC ecuavisar teleamazonasec,2019-03-18
Jaime Rubén,Chugchilan Cisaguano,ChugchilanJaime,JohannaJesy radio sucre Micc Ec SofiaAlmeidaEc corporacionges jaimevargasnae fenocinecuador hernanulloa confeniae1 arub99090270 0995060491,2019-03-18
Jaime Rubén,Chugchilan Cisaguano,ChugchilanJaime,gracias Dr Juan Carlos Meneces apoyo camino CPCCS entender ciudadano necesitar organismo ser escuchado TuParticipacionEsLaSolucion JaimeChugchilanEsParticipacion,2019-03-18
Jaime Rubén,Chugchilan Cisaguano,ChugchilanJaime,Amigos compartir actividad buen dia,2019-03-18
Jaime Rubén,Chugchilan Cisaguano,ChugchilanJaime,consejero respondiar interés partidista hoy candidato CPCCS responder ciudadania compromiso politico 24 marzo poder sero ciudadano Corape TuParticipacionEsLaSolucion JaimeChugchilanEsParticipacion,2019-03-18
Jaime Rubén,Chugchilan Cisaguano,ChugchilanJaime,VotoMujerJuventudINDEPENDIENTE garantice CPCCS Potencie Fortalecimiento Institucional permitir desaparecer pierda capacidad designar Autoridades Control Luche Corrupcion Pueblos Nacionalidades ChugchilanJaime,2019-03-18
Jaime Rubén,Chugchilan Cisaguano,ChugchilanJaime,Amig s seguir actividad,2019-03-19
Jaime Rubén,Chugchilan Cisaguano,ChugchilanJaime,erickmacr CPCCS davidroserow RicardoRivasBr SofiaAlmeidaEc ChugchilanJaime sugiero propuesta complementar Candidatos 7 Candidaturas Consejeros INDEPENDIENTES representantiva 6 9 Zonas Ecuador,2019-03-19
Jaime Rubén,Chugchilan Cisaguano,ChugchilanJaime,votociudadaniaindependiente ChugchilanJaime 3 jobafonfay2019 8 5 KariPonce11 2 9 sofiaalmeidaec 8 5 hernanulloa 8 5 davidroserow 1 JamesMcpccs 1 Representan 6 9 Zonas Candidaturas CPCCS,2019-03-19
Jaime Rubén,Chugchilan Cisaguano,ChugchilanJaime,buen ciudadano decidir ChugchilanJaime CPCCS,2019-03-19
