nombre,apellidos,tweet_screen_name,tweet_text,tweet_date
César,Montufar,CesarMontufar51,recorrido Distrito Metropolitano brindar momento riqueza intensidad humano incomparabl ObrasSinCorrupcion,2019-02-17
César,Montufar,CesarMontufar51,plan trabajo hacer escuchar quiteno sector pagina formar pensar familia gremio colegio profesional equipo gran experiencia diseno plan 5 eje 20 politica publica 5 obra emblematica,2019-02-18
César,Montufar,CesarMontufar51,propaganda electoral fabricado tetrapak reutilizado vez termine campán comprometer retirar todo propaganda enviar él centro acopio,2019-02-18
César,Montufar,CesarMontufar51,manán madrugamo redondel Ciclista zón muchisimo trafico hora pico presentar propuesta junto CarrionQuinde EugenioCampove1 Monica Armendariz,2019-02-18
César,Montufar,CesarMontufar51,Manana 10h30 entregare Fiscal General documento probar Odebrecht realacer pago ilegal funcionario municipal construccion Metro actual Administracion deber ser investigar Quito recuperar recurso arrebatado,2019-02-18
César,Montufar,CesarMontufar51,noche compartir Union Ligas Independientes sur Quito,2019-02-19
César,Montufar,CesarMontufar51,pierda entrevista diar hoy 9y30am ObrasSinCorrupcion,2019-02-19
César,Montufar,CesarMontufar51,entregado Fiscalia General documento probar pago ilegal construccion Metro Quito Insto prensa ecuatoriano seguir cerca investigacion Quito debera recuperar recurso arrebatado,2019-02-19
César,Montufar,CesarMontufar51,entregado Fiscalia General documento probar pago ilegal construccion Metro Quito Insto prensa ecuatoriano seguir cerca investigacion Quito debera recuperar recurso arrebatado,2019-02-19
César,Montufar,CesarMontufar51,joven tambien querer cambio apoyar consigna ObrasSinCorrupcion,2019-02-19
César,Montufar,CesarMontufar51,1 2 Odebrecht creer sistema realizar pago ilegal denominado drousys primero vez aparecer prueba corrupcion contrato Metro Quito Fiscalia deber reabrir investigacion Luchare recuperar recurso arrebato corrupcion,2019-02-20
César,Montufar,CesarMontufar51,2 2 obrassincorrupcion,2019-02-20
César,Montufar,CesarMontufar51,Paso paso ir recorrer Quito Creemos comunicacion personalizado escuchar ciudadano,2019-02-20
César,Montufar,CesarMontufar51,sector Mariscal foco inseguridad Quito embargo barrio mas tradicional turistico conversar dirigente propietario zona escuchar problematicar garantizarl solución,2019-02-20
César,Montufar,CesarMontufar51,manán realizar recorrido casual equipo elcomerciocom compartimos proyecto plan trabajo Quito gracias amigo,2019-02-20
César,Montufar,CesarMontufar51,dispuesto asumir liderazgo ciudad recuperar recurso arrebatar Quito LaPosta Ecu,2019-02-21
César,Montufar,CesarMontufar51,conversar vendedor informal sur Quito proponer crear plaza comercio formal evitar mercado ambulante crear mas plaza empleo,2019-02-21
César,Montufar,CesarMontufar51,gratificante apoyo quiteno,2019-02-21
César,Montufar,CesarMontufar51,orgulloso equipo ir cada dia paso firme hacia objetivo Concertacion P ObrasSinCorrupcion,2019-02-22
César,Montufar,CesarMontufar51,Acompananos recorrido parroquia rural,2019-02-23
César,Montufar,CesarMontufar51,plan trabajo hacer escuchar quiteno sector formar pensar familia gremio colegio profesional diseno plan 5 eje 20 politica publica 5 obra emblematica Encuentralo,2019-02-23
César,Montufar,CesarMontufar51,orgulloso equipo ir cada dia paso firme hacia objetivo graciar apoyo recorrido Nayon Cumbaya Tumbaco Checa ObrasSinCorrupcion,2019-02-24
César,Montufar,CesarMontufar51,detendra Llueva truenir relampaguee luchar ciudad merecemo gracias carino gente Calderon ObrasSinCorrupcion,2019-02-24
César,Montufar,CesarMontufar51,orgulloso contar Juan Manuel Carrion primero candidato concejal distrito norte decir decidar mojar él poncho entrar justa electoral servir ciudad ObrasSinCorrupcion CesarMontufarAlcalde,2019-02-24
César,Montufar,CesarMontufar51,General Moncayo Alcalde Quito jamas autorizare firmarar contrato injusto ciudad voy robar dejare robir quiteno usted si permitio ObrasSinCorrupcion CesarMontufarAlcalde,2019-02-25
César,Montufar,CesarMontufar51,jornada intenso entrevista Ricky Cueva Bruja caminar calle Centro Historico escuchar ciudadano cuanto carino expresar quiteno gracios apoyo defraudare ObrasSinCorrupcion,2019-02-25
César,Montufar,CesarMontufar51,acción concreto ir mejorar potenciar turismo ciudad externo interno Volveremos sentir yo orgulloso vivir capital mas lindo America ObrasSinCorrupcion CesarMontufarAlcalde,2019-02-25
César,Montufar,CesarMontufar51,ayer castigar luisevivanco pronto podrar ver entrevista completo,2019-02-26
César,Montufar,CesarMontufar51,Entrevista Cesar Montufar CesarMontufar51 ecuavisa Sintetiza Plan Gobierno sistema integrado seguridad integrar sistema transporte torno Metro mayor reciclaje mas eficiencia mas transparencia ObrasSinCorrupcion,2019-02-26
César,Montufar,CesarMontufar51,proponer reestructuracion Concejo permitir Alcalde empresa publica trabajar bien colectivo 4pelagatos4 ObrasSinCorrupcion AlcaldiadeQuito,2019-02-27
César,Montufar,CesarMontufar51,campán sucio continuo circular panfleto falso propuesta campán,2019-02-27
César,Montufar,CesarMontufar51,cesarmontufar51 Mtalcat Mejor asi,2019-02-27
César,Montufar,CesarMontufar51,propuesta compromiso apoyar creatividad emprendimiento compromiso,2019-02-27
César,Montufar,CesarMontufar51,propuesta compromiso apoyar creatividad emprendimiento compromiso Jovenes Quito Emprendimiento ArteyCurtura CesarMontufarAlcalde CesarTeEscucha acaldiadequito Elecciones2019,2019-02-27
César,Montufar,CesarMontufar51,Amigos invito sintonizar 97 7,2019-02-28
César,Montufar,CesarMontufar51,proponer ciudad descontaminado respetuoso biodiversidad promover Distrito Metropolitano Quito provincia Pichincha estir libre mineria metalico,2019-03-01
César,Montufar,CesarMontufar51,LaPosta Ecu luisevivanco tomasciuffardi christianzr 4pelagatos4 Martinminguchi radiosucesosec elcomerciocom EcuavisaInforma,2019-03-01
César,Montufar,CesarMontufar51,GuayaquilQ xbuendia2019 mariasolcorral pablodavalos63 CesarMontufar51 AndresPasquel8 edgarjacomet victorhugoerazo JCSolines dialogo candidato alcaldio Quito,2019-03-01
César,Montufar,CesarMontufar51,querido quiteno invitar formar parte importante compromiso,2019-03-01
César,Montufar,CesarMontufar51,Jajaja hoy llego memir manera tanto creativo graficar ir cosa campán Pese jalón seguir posicion balon punto ganar partido hecho mucho gracia,2019-03-01
César,Montufar,CesarMontufar51,Jajaja hoy llego memir manera tanto creativo graficar ir cosa campán Pese jalón seguir posicion balon punto ganar partido hecho mucho gracia,2019-03-01
César,Montufar,CesarMontufar51,gracias Carlos Michelena elmiche ecuador confianza compromiso tú quiteno Alcaldia policia metropolitanos podrar utilizar celular chatear mirar red social dedicarar hacer trabajo tú,2019-03-01
César,Montufar,CesarMontufar51,tipo politico requerir pesar tanto podredumbre si existir bien juancaholguin aplauso cesarmontufar51,2019-03-02
César,Montufar,CesarMontufar51,arrancar feriado Carnaval ola honestidad Acompananos recorrido noroccidente,2019-03-02
César,Montufar,CesarMontufar51,acto conviccion firmamos junto Juan Manuel Carrion Esteban Moscoso compromiso mantener Distrito Metropolitano Quito provincia Pichincha libre mineria metalico ObrasSinCorrupcion MoscosoPrefecto CarrionQuinde,2019-03-02
César,Montufar,CesarMontufar51,Alcaldia dedicarar nino Si lograr construir ciudad buen sera buen ciudad seguro limpia sano garantice derechos futuro CesarMontufarAlcalde Quito Elecciones2019 Carnaval2019,2019-03-03
César,Montufar,CesarMontufar51,Alcaldia dedicarar nino Si lograr construir ciudad buen sera buen ciudad seguro limpia sano garantice derechos futuro CesarMontufarAlcalde Quito Elecciones2019 Carnaval2019,2019-03-03
César,Montufar,CesarMontufar51,mil quiteno demostrar afecto apoyo recuperar ciudad junto lograremo construirer Quito merecemos Muchisimas gracias carino compromiso tú ObrasSinCorrupcion CesarMontufarAlcalde,2019-03-04
César,Montufar,CesarMontufar51,feriado trabajar intensamente llegar propuesto mil familia peaj Oyacoto valle Chillos cambio recibir apoyo bendición sugerencia carino mucho gracias tú ObrasSinCorrupcion,2019-03-05
César,Montufar,CesarMontufar51,Bienvenid s casa Gracias apoyo propuesto cada vez mas seguro triunfo 24 marzo Quito vencera ObrasSinCorrupcion,2019-03-05
César,Montufar,CesarMontufar51,ver alegria crecer propuesto sentir apoyo enorme elección tomar decision tres candidato ligado correismo candidatura ciudadano libre corrupcion tres apoyo 24 marzo Quito vencerar,2019-03-06
César,Montufar,CesarMontufar51,ver alegria crecer propuesto sentir apoyo enorme elección tomar decision tres candidato ligado correismo candidatura ciudadano libre corrupcion tres apoyo 24 marzo Quito vencerar,2019-03-06
César,Montufar,CesarMontufar51,iniciar etapa final campán satisfecho haber lograr consolidar voto norte parroquia semán ir disputar voto voto sur centro Quito Vamos ganar decir gente ObrasSinCorrupcion,2019-03-06
César,Montufar,CesarMontufar51,negociacion aeropuerto Quiport totalmente lesivo Quito PacoMoncayo responder Si equivocado reconoceria visionquito CesarMontufarAlcalde ObrasSinCorrupcion,2019-03-06
César,Montufar,CesarMontufar51,satisfecho conversatorio mantuvimos miembro Camara Pequena Industria analizar varios tema interesante coincidencia fomentar productividad oportunidad empleo Gracias idea,2019-03-07
César,Montufar,CesarMontufar51,Aqui agendir entrevista jueves 7 marzo 2019 Escuchanos partir 6h00 majestadfm fabriciovelav alexismoncayo MariaBelenArro1 CesarMontufar51 augustobarrerag Elecciones2019EC,2019-03-07
César,Montufar,CesarMontufar51,hoy acerco senor esposa estrecho mano firmezar hablar voz experiencia Alcaldia adulto mayor tendrar espacio ir ayudar educar formar contagiar orgullo ser quiteno obrassincorrupcion,2019-03-07
César,Montufar,CesarMontufar51,Gobierno Central gobiernos local deberiar generar empleo adulto mayor capaz gana detra seguro social quebrado brindo soporte alguno cesarmontufar51,2019-03-07
César,Montufar,CesarMontufar51,Acompaname entrevista converser Plan Trabajo poder descargar él,2019-03-07
César,Montufar,CesarMontufar51,Acompaname entrevista converser Plan Trabajo poder descargar él,2019-03-07
César,Montufar,CesarMontufar51,invitar escuchar propuesta Quito poco minuto radiomajestadfm,2019-03-07
César,Montufar,CesarMontufar51,aeropuerto Quito mas caro capital America Latina renegociar Quiport recuperar recurso ciudad seguir emplazar PacoMoncayo responda negociacion aprimerahoro ec majestadfm,2019-03-07
César,Montufar,CesarMontufar51,cesarmontufar51 deber fortalecer administración zonal deber ser unidad gestion efectivo perspectiva realizar obra deber tener presupuesto elecciones2019ec majestadfm,2019-03-07
César,Montufar,CesarMontufar51,recta final agenda apretado medio hora visionquito diegooquendo,2019-03-07
César,Montufar,CesarMontufar51,junto cesarmontufar51 construirer sistema integral recoleccion articule municipio empresa privado reciclador base Quito sero ciudad completamente limpio Vota Todo51,2019-03-07
César,Montufar,CesarMontufar51,,2019-03-07
César,Montufar,CesarMontufar51,pacomoncayo realizado grave cuestionamiento concesion aeropuerto Quito Ud responder Pruebelo necesitar ninguno comision él Demuestre autorizo concesion lesivo Quito Si hacer retracto Si seguir silencio estar dandome razon,2019-03-07
César,Montufar,CesarMontufar51,pacomoncayo realizado grave cuestionamiento concesion aeropuerto Quito Ud responder Pruebelo necesitar ninguno comision él Demuestre autorizo concesion lesivo Quito Si hacer retracto Si seguir silencio estar dandome razon,2019-03-07
César,Montufar,CesarMontufar51,listo conversatorio grupofaro compartir idea Quito,2019-03-07
César,Montufar,CesarMontufar51,Alcaldia decencia honestidad valentio seran bandera cumplir promesa ObrasSinCorrupcion mano equipo calificado lograremos recuperar ciudad Descarga Plan Trabajo CesarMontufarAlcalde,2019-03-07
César,Montufar,CesarMontufar51,conversatorio Colegio Ingenieros Pichincha acordamos Quito necesitar experiencia profesionalismo institucion construir ObrasSinCorrupcion,2019-03-08
César,Montufar,CesarMontufar51,conversatorio Colegio Ingenieros Civiles Pichincha acordamos Quito deber contar experiencia profesionalismo institucion construir ObrasSinCorrupcion CesarMontufarAlcalde,2019-03-08
César,Montufar,CesarMontufar51,hoy siempre homenaje mujer tú tú igualdad derechos empoderamiento seguridad lucha admiro,2019-03-08
César,Montufar,CesarMontufar51,momento radioquitoec debatir movilidad seguridad junto juancaholguin JCSolines masolcorral,2019-03-08
César,Montufar,CesarMontufar51,dinero obra quiteno pagar 500 millón Metro Necesitamos recuperar recurso corrupcion Quito radioquitoec,2019-03-08
César,Montufar,CesarMontufar51,Feliz diar internacional mujer construyar Quito incluyente equitativo diverso,2019-03-08
César,Montufar,CesarMontufar51,pacomoncayo realizado cuestionamiento grave concesion aeropuerto Quito Ud autoracer Demuestre acerto erroneo concesion vigente 2041 terriblemente lesivo Quito Si hacer retractare silencio dar razon,2019-03-08
César,Montufar,CesarMontufar51,Senor PacoMoncayo realizado cuestionamiento grave concesion aeropuerto Quito Ud autoracer Demuestre acerto erroneo concesion vigente 2041 terriblemente lesivo Quito Si hacer retractare silencio dar razon,2019-03-08
César,Montufar,CesarMontufar51,alcaldia crearer mejor sistema mercado comercio autonomo regularizado pais compromiso,2019-03-08
César,Montufar,CesarMontufar51,campán quiteno dejar sorprenderme carino apoyo volverer ser Municipio servicio deber ciudadano ObrasSinCorrupcion CesarMontufarAlcalde,2019-03-08
César,Montufar,CesarMontufar51,gracias Alangasi respaldo realidad falso encuesta pagado mafia electorera total apoyo futuro Alcalde Quito CesarMontufar51 candidato Junta Parroquial encabezado Rodrigo Balseca,2019-03-09
César,Montufar,CesarMontufar51,apoyo cada casa cada calle cada parroquia ciudadano querer cambio querer abrir puerta futuro ir fallar doy palabra ir construir ObrasSinCorrupcion,2019-03-09
César,Montufar,CesarMontufar51,24 marzo elegiremo corrupcion honestidad alcalde mano libre someter obra sobreprecio obra corrupcion 24 03 2019 voto familiar honesto Quito vencerar CesarMontufarAlcalde,2019-03-11
César,Montufar,CesarMontufar51,concesion Aeropuerto Quito deber verificar él puesto lesivo ciudad cesarmontufar51 municipio aeropuerto ciudad ecuador democraciatv,2019-03-11
César,Montufar,CesarMontufar51,gracias apoyo compromiso devolver él Quito ciudadano,2019-03-11
César,Montufar,CesarMontufar51,tarde compartir vision centro historico conversatorio candidato Alcaldia Quito tipo encuentro fundamental debatir escuchar proponer Asi construir ciudad,2019-03-11
César,Montufar,CesarMontufar51,joven ciudad delante enorme desafio recuperar tiempo perdido despues 10 ano ser relegado autoridad serar conductor proceso Alcaldia CesarGanara quitovencero CesarMontufarAlcalde,2019-03-11
César,Montufar,CesarMontufar51,Manana comenzar temprano Estare Telerama Quito noticiero Fernando Correa,2019-03-12
César,Montufar,CesarMontufar51,quiteno primero ir llegar Alcaldia devolverl ciudad secuestrado gracios apoyo confianza voy defraudar ObrasSinCorrupcion CesarMontufarAlcalde ElMontufarEstaPrimero,2019-03-12
César,Montufar,CesarMontufar51,Centro Historico corazon ciudad tradición arquitectura gente construir identidad ir recuperar esplendor Centro Historico volvera ser quiteno ObrasSinCorrupcion CesarMontufarAlcalde,2019-03-12
César,Montufar,CesarMontufar51,hoy emmop departamento parques jardines recordar carino MoscosoPrefecto q grande apoyo lista51 total Garcias ir llegar cesarmontufar51 alcalde estebanmoscoso prefecto 51,2019-03-12
César,Montufar,CesarMontufar51,cesarmontufar51 idea Quito hacer él ciudad policentricay mas compacto rumboalaalcaldiadequito,2019-03-13
César,Montufar,CesarMontufar51,cesarmontufar51 proyecto carecer transparencia RumboalaAlcaldiadeQuito,2019-03-13
César,Montufar,CesarMontufar51,cesarmontufar51 investigar grande contrato municipio iniciar Metro Quito RumboalaAlcaldiadeQuito,2019-03-13
César,Montufar,CesarMontufar51,hoy querer seguir secuestrar cuidad querer amedrentarno condescendencia Quito honestidad juego entero Viva Quito Carajo,2019-03-13
César,Montufar,CesarMontufar51,hoy querer seguir secuestrar cuidad querer amedrentarno condescendencia Quito honestidad juego entero Viva Quito Carajo,2019-03-13
César,Montufar,CesarMontufar51,Manana comenzar temprano recorrer barrio alto noroccidente,2019-03-13
César,Montufar,CesarMontufar51,realizamos recorridir barrio alto noroccidente comprometido reformar ordenanza 147 regularizar barrio entregar ciudadano titulo propiedad vivienda quiteno necesitar seguridad juridico predio,2019-03-13
César,Montufar,CesarMontufar51,levante mano cansado escuchar siguiente querer votar cesarmontufar51 dar miedo ganar Yunda Querer poder votar usted querer vero ganar,2019-03-14
César,Montufar,CesarMontufar51,tambiir espacio bromear hablar cotidiano,2019-03-14
César,Montufar,CesarMontufar51,sector Guajalo recibir apoyo quiteno sur fervor ciudadano existir ObrasSinCorrupcion,2019-03-14
César,Montufar,CesarMontufar51,sector Guajalo recibir apoyo quiteno sur fervor ciudadano existir ObrasSinCorrupcion,2019-03-14
César,Montufar,CesarMontufar51,dialogo virtud siempre darir tiempo hablar medio comunicacion responder inquietud manán ser intenso radiosucesosec visionquito lahoraecuador,2019-03-15
César,Montufar,CesarMontufar51,Ven familia amigo honesto mas Acompaname Caravana Honestidad encontraremos sabar 16 marzo redondel frente UNASUR demostrar quitovencero,2019-03-15
César,Montufar,CesarMontufar51,Sigo campán pie presentar ciudadano propuesto Quito calle poder conocer necesidad inquietudes gente tarde Comite Pueblo,2019-03-15
César,Montufar,CesarMontufar51,invitar revisar discutir compartir Plan Gobierno Quito voto familia quitovencero,2019-03-16
César,Montufar,CesarMontufar51,solo poder decir Gracias quiteno decidir Quito vencera Muchisimos auto seguir sumar Ven acompaname,2019-03-16
César,Montufar,CesarMontufar51,seguir unir él caravanaporlahonestidad 24 marzo Quito vencerar,2019-03-16
César,Montufar,CesarMontufar51,seguir recorrer ciudad caravanaporlahonestidad Sentimos apoyo quiteno decidido voto 24 marzo Quito vencerar,2019-03-16
César,Montufar,CesarMontufar51,,2019-03-16
César,Montufar,CesarMontufar51,momento honestidad momento Quito lider politico momento Quito lider ejecutor momento recuperar ciudad YoYaMeDecidiPorMontufar,2019-03-16
César,Montufar,CesarMontufar51,politico decepcionado probablemente importar elección deber ser asi campán visto Quito cada invito inicier caminar ciudad diferente Decidete acompaname,2019-03-18
César,Montufar,CesarMontufar51,quedar cuatro dia campán electoral Aprovechare cada dia cada hora cada minuto llevar propuesta quiteno DecidetePorCesarMontufar,2019-03-18
César,Montufar,CesarMontufar51,democraciatvec democraciaec Pablo Davalos Juan Carlos Holguin Juan Carlos Solines,2019-03-18
César,Montufar,CesarMontufar51,gracias medio abrir microfono escuchar propuesta,2019-03-18
César,Montufar,CesarMontufar51,diegosalgadorib kimontare carlosfigueroa6 defraudarer ciudadano creer momento recuperar ciudad ciudadano,2019-03-19
César,Montufar,CesarMontufar51,paulinaaraujog juancaholguin JCSolines Estimada Paulina plan consideracion general contaminacion incluir auditivo querer controlar ruido hacer recolector basura tecnificar servicio gas domicilio regular ruido espacio publico,2019-03-19
César,Montufar,CesarMontufar51,Quito ir votar PacoMoncayo candidato Mauricio Rodas RadioLatinaEc,2019-03-19
César,Montufar,CesarMontufar51,estrategia candidato fantasma pasado factura PacoMoncayo varios ocasión emplazado nunca poder conversar notihoyecuador,2019-03-20
César,Montufar,CesarMontufar51,alcalde Quito PERMITIRE REGRESO MashiRafael LoroHomero LuisaMaldonadoM PacoMoncayo ver correismo decir cesarmontufar51 candidato alcaldio Quito 101 7 miltonperezsh verocha16,2019-03-20
César,Montufar,CesarMontufar51,Metro ir exigir articular corredor norte sur potenciar ruta oriente occidente fijar controlar frecuencia solo asi poder potenciar proyecto costado ciudad radiosucesosec,2019-03-20
César,Montufar,CesarMontufar51,MetrodeQuito CesarMontufar51 mencionar ridiculez inagurar metro hacer recorrido estacion tambien dar conocer opinion hara caso llegar alcaldio transporte publico lanoticiaensuceso,2019-03-20
César,Montufar,CesarMontufar51,ayer presentir equipo trabajo grupo profesional experto distinto areas Alcalde gobernar solo hacer equipo competente,2019-03-20
César,Montufar,CesarMontufar51,manán teleamazonasec 24horasUIO general PacoMoncayo decir debatir Yunda Luisa Maldonado Montufar Debatamos General manán gusto podriar asistir canal,2019-03-20
César,Montufar,CesarMontufar51,liderar contienda campán sucio ahora metido vida personal tratar desprestigiar yo correismo corrupcion dia contado 24 marzo Quito vencerar,2019-03-20
César,Montufar,CesarMontufar51,Teleamazonas 24horasuio dado respuesta oficial carta envie mail tampoco pronunciado General vez silencio decir mas mil palabra,2019-03-20
César,Montufar,CesarMontufar51,hoy medio noche inicio caminata nuevo Quito acto cierre campán uniremos ciudad norte sur solo abrazo Acompaname caminemos junto Informate fan page punto pararer compartir esperar,2019-03-20
César,Montufar,CesarMontufar51,hoy medio noche inicio caminata nuevo Quito acto cierre campán uniremos ciudad norte sur solo abrazo Acompaname caminemos junto Informate fan page punto pararer compartir esperar,2019-03-21
César,Montufar,CesarMontufar51,gracias confianzar apoyo cada paso ObrasSinCorrupcion,2019-03-21
César,Montufar,CesarMontufar51,ser campán gratificante apoyo cada paso 24 marzo Quito vencera ObrasSinCorrupcion CesarMontufarAlcalde,2019-03-21
César,Montufar,CesarMontufar51,honestidad nadie detener avanzar cobijado bandera Quito Decidete unetir Caminemos futuro,2019-03-21
César,Montufar,CesarMontufar51,diar equinoccio quiteno claridad elegir nuevo Quito ObrasSinCorrupcion CesarMontufarAlcalde,2019-03-21
César,Montufar,CesarMontufar51,corrupcion costado quiteno mas 2 000 millón dolar corrupcion recurso construir universidad Sur sistema recoleccion si funcionar sistema integrado transporte publico Haz voto util Cuento contigo,2019-03-22
César,Montufar,CesarMontufar51,obra haremos corrupcion ObrasSinCorrupcion CesarMontufarAlcalde,2019-03-22
César,Montufar,CesarMontufar51,mucho gracia apoyo revisar mensaje luego gran caminata ayer prometo contestar él cuanto poder abrazo grande ir ganar ObrassinCorrupcion CesarMontufarAlcalde,2019-03-22
César,Montufar,CesarMontufar51,cumplir reto caminar 24 hora nuevoquito 0 hora ayer parque calderon arribar 22h10 parque Chillogallo ahi decidir continuar caminar completar desafio terminamo iglesia Arcadia sur profundo Quito Gracias apoyo,2019-03-22
César,Montufar,CesarMontufar51,Quitena VOTO cesarmontufar51 unicar opcion Quito libre CORRUPCION saber enfrentar él,2019-03-22
César,Montufar,CesarMontufar51,companero luchar derechos humanos tiempo mas sombrio persecucion correista luchador corrupcion academico autocensura trayectoria cesarmontufar51 voto Quito querio extender él saludo,2019-03-22
César,Montufar,CesarMontufar51,reuni equipo OEA coordinador analisis politico Raquel Chanto coordinador regional Martin Ferreiro realizarar veedurio proceso electoral manifeste inquietud fal él proceso electoral anterior,2019-03-23
César,Montufar,CesarMontufar51,ir sabar disfrutar junto persona mas importante vida,2019-03-23
César,Montufar,CesarMontufar51,Manana encontrarer gran abrazo futuro empezar hacer Quito parecer cada vez mas ciudad sonar pedir votar fuerza amor ciudad invitar votar 51 quitovencero CesarMontufarAlcalde,2019-03-24
César,Montufar,CesarMontufar51,tener ciudad libre corrupcion Si posible Tener Municipio servicio ciudadano Si posible tener ciudad libre correismo Si posible voto posible,2019-03-24
César,Montufar,CesarMontufar51,juancaholguin mariasolcorral JCSolines PabloDavalos63 PaolaVintimilla Gracias juancaholguin ser gusto tener contendiente,2019-03-24
César,Montufar,CesarMontufar51,querer agradecer quiteno apoyo mayoritario ir reflejar urna hoy Quito vencerar hoy dia mas importante historia futuro hoy Quito empezar cambiar gracias voto decidido quiteno,2019-03-24
César,Montufar,CesarMontufar51,Llego diar votar Municipio servicio ciudadano Quiero agradecer respaldo apoyo carino reafirmar compromiso trabajar manán mismo ciudad voy defraudar,2019-03-24
César,Montufar,CesarMontufar51,agradezco 1238 voluntario estar desplazado recinto electoral Distrito Metropolitano verdadero guardián democracia vigilarar decision respetado,2019-03-24
César,Montufar,CesarMontufar51,creer Quito Pichincha caber reconteo exigir Montufar Zapata,2019-03-26
César,Montufar,CesarMontufar51,gracias mucho gracia apoyo dar campana comprometido objetivo ciudad Quito merecer futuro construir GraciasQuito CesarMontufar,2019-03-29
César,Montufar,CesarMontufar51,migueltobarf PacoMoncayo CapiZapataEC Estimado Miguel equipo brigado operativo 10 dia plazo retirar él toda hacer Gracias observacion,2019-03-29
César,Montufar,CesarMontufar51,nativusquito CarrionQuinde PacoMoncayo juancaholguin querer apoyar iniciativo poder escribir cesarmontufarcomunicacion gmail com,2019-04-03
César,Montufar,CesarMontufar51,siempre guindolo rezagado aparecer Aqui bajandola hija,2019-04-14
César,Montufar,CesarMontufar51,Comparto reflexion vacio politico nacional crisis capitalidad Quito poder leer él completo aqui Ustedes opinar,2019-04-17
