nombre,apellidos,tweet_screen_name,tweet_text,tweet_date
Pablo Eduardo,Ponce Cerda,PabloPonce,modelo977 principal propuesta realizar Asambleas Itinerantes todo provincia pais YoSoyTuVoz YosoyPabloPonce,2019-02-20
Pablo Eduardo,Ponce Cerda,PabloPonce,modelonoticia Entrevista Dr Pablo Ponce candidato cpccs yosoytuvoz pabloponce PabloPonce,2019-02-20
Pablo Eduardo,Ponce Cerda,PabloPonce,TelevisionManabita Casillero 12 sorteo primero vez elegirar 7 representante cpccs,2019-02-20
Pablo Eduardo,Ponce Cerda,PabloPonce,Gestion Publica deber ser responsable RadioGaviota YoSoyTuVoz PabloPonce,2019-02-20
Pablo Eduardo,Ponce Cerda,PabloPonce,querer saludar dia colega Abogados pais noble profesion esfuerzo preparacion luchar constante hacer prevalecer derecho client DiaDelAbogadoEcuatoriano YoSoyTuVoz PabloPonce,2019-02-20
Pablo Eduardo,Ponce Cerda,PabloPonce,Radio Costamar abrir espacio hablar proxima elección Ecuador elegirar 7 representante Consejo Participacion Ciudadana Control Social casillero12 YoSoyTuVoz PabloPonce,2019-02-20
Pablo Eduardo,Ponce Cerda,PabloPonce,seguir recorrer pais hoy Portoviejo iniciar Manavision hablar Consejo Participacion Ciudadana Control Social elección proximo 24 marzo elegiran primero vez consejero voto popular,2019-02-21
Pablo Eduardo,Ponce Cerda,PabloPonce,Radio Capital 103 3 RNC borron contar nuevo pais necesitar respetir norma problema institución persona hacer buena base educacion incentivar verdadero participacion ciudadano activo,2019-02-21
Pablo Eduardo,Ponce Cerda,PabloPonce,Radio Capital 103 3 borron contar nuevo pais necesitar respetir norma problema institución persona hacer buena base educacion incentivar verdadero participacion ciudadano activo YoSoyTuVoz,2019-02-21
Pablo Eduardo,Ponce Cerda,PabloPonce,invitar escuchar propuesta candidato CPCCS siguiente medio comunicacion ecuavisa radiopublicaEC gkcity radiosonoramar CanalUnoTv RadioUnica720 Yosoytuvoz,2019-02-25
Pablo Eduardo,Ponce Cerda,PabloPonce,invitar ver entrevista contactodirecto ecuavisar Hablare propuesta candidato CPCCS yosoytuvoz,2019-02-25
Pablo Eduardo,Ponce Cerda,PabloPonce,yosoytuvoz,2019-02-25
Pablo Eduardo,Ponce Cerda,PabloPonce,ecuavisa listo dar conocer propuesta candidato CPCCS YoSoyTuVoz FelizLunes,2019-02-25
Pablo Eduardo,Ponce Cerda,PabloPonce,participacion ciudadano ingrediente principal fomentar democracia via ecuavisa YoSoyTuVoz,2019-02-25
Pablo Eduardo,Ponce Cerda,PabloPonce,ecuadoralasurna PabloPonce mingar deber apoyar hombro fomentar participacion ciudadania,2019-02-25
Pablo Eduardo,Ponce Cerda,PabloPonce,CPCCS deber tener apoyo gremio tecnico fin incentivar verdadero participacion ciudadano YoSoyTuVoz ecuavisa,2019-02-25
Pablo Eduardo,Ponce Cerda,PabloPonce,voluntad politico abrir espacio dialogo joven principal actor via ecuavisa YoSoyTuVoz,2019-02-25
Pablo Eduardo,Ponce Cerda,PabloPonce,ver tanto lejano CPCCS Quito propongo hacer manera itinerante 24 provincia YoSoyTuVoz ecuavisa,2019-02-25
Pablo Eduardo,Ponce Cerda,PabloPonce,concejal Quito vi participacion ciudadano generar cambio Asi sucedio venta centro historico hablar ciudadano ubico Centros Comerciales Ahorro via PublicaFM,2019-02-25
Pablo Eduardo,Ponce Cerda,PabloPonce,responsable fomentar participacion ciudadano via PublicaFM yosoytuvoz,2019-02-25
Pablo Eduardo,Ponce Cerda,PabloPonce,seguir trabajar incentivar verdadera activo participacion ciudadano invitar escuchar propuesta candidato CPCCS YoSoyTuVoz Pichincha Quito,2019-02-26
Pablo Eduardo,Ponce Cerda,PabloPonce,dialogar babadmerchan propuestas candidato CPCCS yosoytuvoz,2019-02-26
Pablo Eduardo,Ponce Cerda,PabloPonce,Inicia entrevistar PabloPonce senal pichinchauniver,2019-02-26
Pablo Eduardo,Ponce Cerda,PabloPonce,PabloPonce destacar impulso primero Ordenanza Participacion Ciudadana periodo ConcejalDeQuito,2019-02-26
Pablo Eduardo,Ponce Cerda,PabloPonce,Participacion Ciudadana virtuoso empodero ciudadania explicar PabloPonce via pichinchauniver YoSoyTuVoz,2019-02-26
Pablo Eduardo,Ponce Cerda,PabloPonce,gestion publicar deber ser auditar colegio especializado criterio tecnico decir PabloPonce via pichinchauniver YoSoyTuVoz,2019-02-26
Pablo Eduardo,Ponce Cerda,PabloPonce,importante rescatar principio valor familia decir PabloPonce via pichinchauniver YoSoyTuVoz,2019-02-26
Pablo Eduardo,Ponce Cerda,PabloPonce,hacer minga ecuatoriano involucremo quehacer publico impulser gestion transparente subrayar pabloponce via pichinchauniver YoSoyTuVoz,2019-02-26
Pablo Eduardo,Ponce Cerda,PabloPonce,brinda accion publicar autoridad hacer bien cosa subrayar PabloPonce via pichinchauniver YoSoyTuVoz CPCCS,2019-02-26
Pablo Eduardo,Ponce Cerda,PabloPonce,nunca ser afiliar ningun partido politico intension ser servir patria educador ser mas 30 ano decir PabloPonce via pichinchauniver YoSoyTuVoz,2019-02-26
Pablo Eduardo,Ponce Cerda,PabloPonce,hoy Director pactomundial trabajado varios ano organización social informar PabloPonce via pichinchauniver YoSoyTuVoz,2019-02-26
Pablo Eduardo,Ponce Cerda,PabloPonce,persón obra decir hago decir PabloPonce via pichinchauniver YoSoyTuVoz,2019-02-26
Pablo Eduardo,Ponce Cerda,PabloPonce,importante dignificar poder palabra importante incentivar asamblea popular explicar PabloPonce via pichinchauniver YoSoyTuVoz,2019-02-26
Pablo Eduardo,Ponce Cerda,PabloPonce,24 marzo participar activamente participacion ciudadano traves votacion responsable CPCCS tener veeduria profesional decir PabloPonce via pichinchauniver YoSoyTuVoz CPCCS,2019-02-26
Pablo Eduardo,Ponce Cerda,PabloPonce,nunca defraudado ciudadania elegido si fallo derecho pedir revocatorio decir PabloPonce via pichinchauniver YoSoyTuVoz CPCCS,2019-02-26
Pablo Eduardo,Ponce Cerda,PabloPonce,Termina entrevistar PabloPonce via pichinchauniver YoSoyTuVoz CPCCS,2019-02-26
Pablo Eduardo,Ponce Cerda,PabloPonce,YoSoyTuVoz CPCCS,2019-02-26
Pablo Eduardo,Ponce Cerda,PabloPonce,YoSoyTuVoz CPCCS,2019-02-26
Pablo Eduardo,Ponce Cerda,PabloPonce,YoSoyTuVoz CPCCS,2019-02-26
Pablo Eduardo,Ponce Cerda,PabloPonce,YoSoyTuVoz CPCCS,2019-02-26
Pablo Eduardo,Ponce Cerda,PabloPonce,YoSoyTuVoz CPCCS,2019-02-26
Pablo Eduardo,Ponce Cerda,PabloPonce,mucho gracias mercurioec lindo nota YoSoyTuVoz CPCCS novotesnuloporelcpccs,2019-02-26
Pablo Eduardo,Ponce Cerda,PabloPonce,necesario impulsar participacion ciudadano asamblea popular decir PabloPonce via EcosdeRuminahui YoSoyTuVoz CPCCS elecciones2019ec Elecciones2019,2019-02-27
Pablo Eduardo,Ponce Cerda,PabloPonce,Concejal propusar primero ordenanza participacion ciudadano mismo sirvio referencia construccion Ley CPCCS explicar PabloPonce via EcosdeRuminahui YoSoyTuVoz CPCCS elecciones2019ec Elecciones2019,2019-02-27
Pablo Eduardo,Ponce Cerda,PabloPonce,mucho EcosdeRuminahui entrevistar YoSoyTuVoz CPCCS elecciones2019ec Elecciones2019,2019-02-27
Pablo Eduardo,Ponce Cerda,PabloPonce,YoSoyTuVoz CPCCS Elecciones2019 Elecciones2019EC Ecuador eleccionescpccs,2019-02-28
Pablo Eduardo,Ponce Cerda,PabloPonce,imposible ganar voto nulo eleccion dignidad Cpccs necesitar mitad mas ganar voto nulo,2019-02-28
Pablo Eduardo,Ponce Cerda,PabloPonce,necesario incentivar fomentar ciudadania derechos poder ejercer control social Yosoytuvoz eleccionesCpccs,2019-02-28
Pablo Eduardo,Ponce Cerda,PabloPonce,deber CPCCS incentivar mecanismo rendicion cuenta institución publica yosoytuvoz,2019-02-28
Pablo Eduardo,Ponce Cerda,PabloPonce,convencido atribución cpccs art 206 Constitucion YoSoyTuVoz CPCCS GiraDeMedios telegrafo,2019-02-28
Pablo Eduardo,Ponce Cerda,PabloPonce,CPCCS deber ser itinerante escuchar ciudadania deber hacer minga ciudadano luchar corrupcion transparencia YoSoyTuVoz GiraDeMedios telegrafo,2019-02-28
Pablo Eduardo,Ponce Cerda,PabloPonce,yosoytuvoz,2019-02-28
Pablo Eduardo,Ponce Cerda,PabloPonce,educacion deber ser proceso vivencial joven Lee entrevista completo PabloPonce experto educacion,2019-03-02
Pablo Eduardo,Ponce Cerda,PabloPonce,Agradezco lindo gente Cangahua lider recibir yo sentir apoyo seguir trabajar junto cultura paz participacion ciudadano bendición Yosoytuvoz casillero12,2019-03-02
Pablo Eduardo,Ponce Cerda,PabloPonce,mucho Gracias Incrementa compromiso nunca defraudado ahora menos,2019-03-02
Pablo Eduardo,Ponce Cerda,PabloPonce,YoSoyTuVoz CPCCS Elecciones2019 casillero12,2019-03-02
Pablo Eduardo,Ponce Cerda,PabloPonce,Agradezco lindo gente Cangahua lideres 58 comunidad 4 parroquia recibir yo sentir apoyo seguir trabajar junto cultura paz participacion ciudadano bendición Yosoytuvoz casillero12 cpccs,2019-03-02
Pablo Eduardo,Ponce Cerda,PabloPonce,evidenciar compromiso hermano pais planeta proyectaremos Consejo Participacion Ciudadana Recuerda PabloPonce soytuvoz pactoglobalecuo,2019-03-03
Pablo Eduardo,Ponce Cerda,PabloPonce,gracias RADIOAMERICAEC entrevista Recuerda YoSoyTuVoz CPCCS,2019-03-06
Pablo Eduardo,Ponce Cerda,PabloPonce,mucho gracia Canal RTU entrevistar hora incentivar participacion ciudadano asamblea itinerant siguiente elección votar CPCCS YoSoyTuVoz EleccionesEc,2019-03-04
Pablo Eduardo,Ponce Cerda,PabloPonce,mucho gracia canalrtu entrevista hora incentivar participacion ciudadano asamblea itinerant siguiente elección votar CPCCS YoSoyTuVoz Elecciones2019EC,2019-03-04
Pablo Eduardo,Ponce Cerda,PabloPonce,Escuchar ciudadania espacio importante construir verdadero democracia participativo YoSoyTuVoz CPCCS Vota Casillero12 Elecciones2019EC,2019-03-04
Pablo Eduardo,Ponce Cerda,PabloPonce,Escuchar ciudadania espacio importante construir sociedad participacion ciudadano YoSoyTuVoz cpccs casillero12  PabloPonce,2019-03-04
Pablo Eduardo,Ponce Cerda,PabloPonce,Amig s miercol 10 30nos reuniremo Salon d Democracia p defender derecho tanto importante q vot importante dueno d destino dej q t quitar politiquero q proponer votonulo YoSoyTuVoz casillero12 ,2019-03-04
Pablo Eduardo,Ponce Cerda,PabloPonce,Escuchar ciudadania espacio importante construir verdadero democracia participativo YoSoyTuVoz CPCCS Vota Casillero12 Elecciones2019EC,2019-03-05
Pablo Eduardo,Ponce Cerda,PabloPonce,500 000 arbol sembrar quitodm colegio comprometido ODS15 evidenciar posible participacion CIUDADANA q vital mejorar condición vida salvar planeta YoSoyTuVoz casillero12  PabloPonce,2019-03-05
Pablo Eduardo,Ponce Cerda,PabloPonce,miercol 6 marzo reuniremo Salon Democracia cnegobec defender derecho elegir abrazo amigo esperar SiALaDemocracia Casillero12 YoSoyTuVoz,2019-03-05
Pablo Eduardo,Ponce Cerda,PabloPonce,posicion respetar actuado CpccsT cumplimento normativa vigente yosoytuvoz,2019-03-06
Pablo Eduardo,Ponce Cerda,PabloPonce,casillero 12 papeleta caer jugado voto nulo Estare listo servir ciudadania YoSoyTuVoz EleccionesCpccs,2019-03-06
Pablo Eduardo,Ponce Cerda,PabloPonce,SiALaDemocracia yosoytuvoz,2019-03-06
Pablo Eduardo,Ponce Cerda,PabloPonce,Christi47851199 cnegobec karicordovam notimundoec stereofamiliar asomacanalvida  pichinchauniver Modelo977 PactoGlobalEcua PublicaFM radiofutura1049 RadioRumbaEc Estimados amigo reunion manán dar cnegobec presto salon Democracia saber bien publico ciudadano politiquero ir detener PabloPonce yosoytuvoz caslliero12,2019-03-06
Pablo Eduardo,Ponce Cerda,PabloPonce,mucho gracia atleta Sur Quito carino apoyo Prometo fallarl ser voz cpccs,2019-03-06
Pablo Eduardo,Ponce Cerda,PabloPonce,VickyDesintonio gracielamoraec candidata CPCCS contar apoyo solidario repudiable todo accion violencia politico vulnerar derecho mujer NoAlMachismo niunameno,2019-03-07
Pablo Eduardo,Ponce Cerda,PabloPonce,PabloPonce aqui propuesta fortalecer participacion ciudadano marco rendicion cuenta 104 5 FM Jorgeacato RamiroDiaz64 longogalo CPCCS,2019-03-07
Pablo Eduardo,Ponce Cerda,PabloPonce,PabloPonce karicordovam cnegobec Modelo977 radiofutura1049 stereofamiliar RadioRumbaEc notimundoec radiohola989 PactoGlobalEcua PublicaFM SiALaDemocracia incentivar voto nulo mejorar politico pais contrario ayudar continuismo analizar candidato compromiso todo dignidad PabloPonce asamblea ciudadana proponer escuchado,2019-03-07
Pablo Eduardo,Ponce Cerda,PabloPonce,PabloPonce cnegobec karicordovam notimundoec stereofamiliar asomacanalvida  pichinchauniver Modelo977 PactoGlobalEcua PublicaFM radiofutura1049 RadioRumbaEc Sugiero amigo pensar voto anular él gente capaz pertenecer consejo exigir respete recurso leido trayectoria PabloPonce,2019-03-07
Pablo Eduardo,Ponce Cerda,PabloPonce,PabloPonce canalrtu Excelente propuesta sero Ecuador mejor tambien si podriar fiscalizar proceso contratacion personal ahijado puesto competente afuero corrupcion comenzar cimiento,2019-03-07
Pablo Eduardo,Ponce Cerda,PabloPonce,pabloponce candidato CPCCS respetarer actuado supuesto ir ver profundidad proceso cumplido marco ley 104 5 FM Jorgeacato RamiroDiaz64 longogalo CPCCS,2019-03-07
Pablo Eduardo,Ponce Cerda,PabloPonce,PabloPonce obligacion cnegobec dar informacion ecuatoriano decir dignidad ir elegir cual función cumplirar CNE deuda saber significar CPCCS Jorgeacato RamiroDiaz64 longogalo CPCCS,2019-03-07
Pablo Eduardo,Ponce Cerda,PabloPonce,ahora buenosdiasamerico acompana PabloPonce candidato CPCCS hablar Agenda Campana 104 5 FM miranos Jorgeacato RamiroDiaz64 longogalo,2019-03-07
Pablo Eduardo,Ponce Cerda,PabloPonce,AdolfoL66196032 ALANDMOLESTINAM davidroserow PabloPonce c espinozaec davalos2019 FaustoRLuperaM RicardoRivasBr edgallegosbayos carlosrpauta mmolinaj12 hugo ludena wgomezr CarlosEscuderoS TamaApoyo seguro esfuerzo sacrificio poder viajar dar él lujo Asi desatinado tweet causa gracia llorar parque,2019-03-07
Pablo Eduardo,Ponce Cerda,PabloPonce,SiALaDemocracia,2019-03-07
Pablo Eduardo,Ponce Cerda,PabloPonce,pabloponce ejercer control social necesitar unicamente sociedad civil organizado CPCCS institucion superfluo q deber desaparecer,2019-03-07
Pablo Eduardo,Ponce Cerda,PabloPonce,PabloPonce aqui función CPCCS segun Constitucion Ecuador 104 5 FM Jorgeacato RamiroDiaz64 longogalo CPCCS,2019-03-07
Pablo Eduardo,Ponce Cerda,PabloPonce,bastar violencia machista hoy entregue delegacion OEA oficial Quito denunciar epiteto denigrant violento nefasto personaje creer pasado historia Ecuador infirio candidata CPCCS,2019-03-07
Pablo Eduardo,Ponce Cerda,PabloPonce,GracielaMoraEc VickyDesintonio GracielaMoraEc usted contar respaldo apoyo envio fuerte abrazo mucho bendición,2019-03-07
Pablo Eduardo,Ponce Cerda,PabloPonce,mucho gracia apoyo zoommediaec fuerte abrazo,2019-03-07
Pablo Eduardo,Ponce Cerda,PabloPonce,invitado escuchar entrevista UNSIONTV YoSoyTuVoz VotaCasillero12 elecciones2019ec CPCCS,2019-03-07
Pablo Eduardo,Ponce Cerda,PabloPonce,hoy cumplire siguiente agenda medio Cuenca YoSoyTuVoz CPCCS Ecuador,2019-03-07
Pablo Eduardo,Ponce Cerda,PabloPonce,querer fortalecer Cpccs efecto cumplir objetivo creado via unsiontv YoSoyTuVoz Elecciones2019Ec casillero12 CPCCS Cuenca,2019-03-07
Pablo Eduardo,Ponce Cerda,PabloPonce,querer dar conocer ciudadania servir cpccs manera tener legitimidad via unsiontv YoSoyTuVoz Elecciones2019Ec casillero12 CPCCS Cuenca,2019-03-07
Pablo Eduardo,Ponce Cerda,PabloPonce,Propiciare realmente existir participacion control ciudadano todo instancia Sector Publico Contraloria ciudadano manera evitar tiempo caso corrupcion via unsiontv YoSoyTuVoz Elecciones2019Ec casillero12 CPCCS,2019-03-07
Pablo Eduardo,Ponce Cerda,PabloPonce,creer importante incentivar participacion ciudadano trav Asambleas itinerant territorio via unsiontv YoSoyTuVoz Elecciones2019Ec casillero12 CPCCS Cuenca,2019-03-07
Pablo Eduardo,Ponce Cerda,PabloPonce,necesario impulsar veeduria tecnica ciudadana fiscalizacion gestion publicar ser necesario via unsiontv YoSoyTuVoz Elecciones2019Ec casillero12 CPCCS Cuenca,2019-03-07
Pablo Eduardo,Ponce Cerda,PabloPonce,participacion ciudadano deber impulsar juventud proporcionar espacio adecuado incentiven dialogo via unsiontv YoSoyTuVoz Elecciones2019Ec casillero12 CPCCS Cuenca,2019-03-07
Pablo Eduardo,Ponce Cerda,PabloPonce,Termina entrevista PrimeraHora unsiontv gabbycadme WILOPRADO YoSoyTuVoz Elecciones2019Ec casillero12 CPCCS Cuenca,2019-03-07
Pablo Eduardo,Ponce Cerda,PabloPonce,CPCCS Participacion Ciudadana Activa,2019-03-07
Pablo Eduardo,Ponce Cerda,PabloPonce,Supervigilare estamento publico aplique Participacion Ciudadana Control Social traves Silla Vacia Asambleas Participativas Presupuestos Participativos via complicefm YoSoyTuVoz Elecciones2019Ec casillero12 CPCCS,2019-03-07
Pablo Eduardo,Ponce Cerda,PabloPonce,Solicitare CPCCS realizar reunión Consejo Pleno manera itinerante territorio Ecuatoriano via complicefm YoSoyTuVoz Elecciones2019Ec casillero12 CPCCS Cuenca,2019-03-07
Pablo Eduardo,Ponce Cerda,PabloPonce,cpccs deber visitar territorio proposito conocer ciudadania autoridad avanzar requerimiento hacer efectivo verdadero participacion ciudadano efectivo control social via complicefm YoSoyTuVoz Elecciones2019Ec casillero12 CPCCS,2019-03-07
Pablo Eduardo,Ponce Cerda,PabloPonce,Gracias complicefm tanto lindo entrevista YoSoyTuVoz Elecciones2019Ec casillero12 CPCCS Cuenca,2019-03-07
Pablo Eduardo,Ponce Cerda,PabloPonce,DialogoDirecto conversar Candidato Consejo Participacion Ciudadana Control Social CPCCS Pablo Ponce PabloPonce propuesta plar trabajo EnVivo 106 1fm Azuay Canar web Elecciones2019EC ecuadordecidir,2019-03-07
Pablo Eduardo,Ponce Cerda,PabloPonce,pabloponce UNSIONTV primero fortaleza persón dialogo gracias apoyar joven presente pais buscar salir adelante desarrollar cada vez mas potencial riqueza economico confio gente piense voto YoSoyTuVoz,2019-03-07
Pablo Eduardo,Ponce Cerda,PabloPonce,seguir cumplir AgendaDeMedios Cuenca radialvision presentar propuesta cpccs elecciones2019ec YoSoyTuVoz casillero12,2019-03-07
Pablo Eduardo,Ponce Cerda,PabloPonce,cpccs deber ser ente activo proceso legal parte procesal via radialvision elecciones2019ec YoSoyTuVoz casillero12 Cuenca Ecuador,2019-03-07
Pablo Eduardo,Ponce Cerda,PabloPonce,continuaremos aspecto positivo cpccs Transitorio mejorar aquel deber mejorar él fin mantener institucionalidad pais via radialvision elecciones2019ec YoSoyTuVoz casillero12 Cuenca,2019-03-07
Pablo Eduardo,Ponce Cerda,PabloPonce,ser maravilloso compartir tú elecciones2019ec YoSoyTuVoz casillero12 Cuenca,2019-03-07
Pablo Eduardo,Ponce Cerda,PabloPonce,Solicitare CPCCS realizar reunión Consejo Pleno manera itinerante territorio Ecuatoriano via Tropicana ec YoSoyTuVoz Elecciones2019Ec casillero12 CPCCS Cuenca,2019-03-07
Pablo Eduardo,Ponce Cerda,PabloPonce,deber hacer minga unamos esfuerzo joven luchaber corrupcion via Tropicana ec YoSoyTuVoz CPCCS casillero12 ,2019-03-07
Pablo Eduardo,Ponce Cerda,PabloPonce,mucho gracia apoyo Yosoytuvoz CPCCS elecciones2019ec,2019-03-07
Pablo Eduardo,Ponce Cerda,PabloPonce,mucho gracia entrevista telecuencir siempre placer visitarlos abrazo,2019-03-07
Pablo Eduardo,Ponce Cerda,PabloPonce,Inicia entrevista tomebamba YoSoyTuVoz Elecciones2019Ec casillero12 CPCCS Cuenca,2019-03-07
Pablo Eduardo,Ponce Cerda,PabloPonce,Pedire CPCCS realizar reunión Consejo manera itinerante territorio Ecuatoriano via tomebamba YoSoyTuVoz Elecciones2019Ec casillero12 CPCCS Cuenca,2019-03-07
Pablo Eduardo,Ponce Cerda,PabloPonce,continuaremos aspecto positivo cpccs Transitorio mejorar aquel deber mejorar él fin mantener institucionalidad pais via ondasazuayas elecciones2019ec YoSoyTuVoz casillero12 Cuenca,2019-03-07
Pablo Eduardo,Ponce Cerda,PabloPonce,ser maravilloso compartir tú trav senal ondasazuaya elecciones2019ec YoSoyTuVoz casillero12 Cuenca,2019-03-07
Pablo Eduardo,Ponce Cerda,PabloPonce,mucho gracias mercurioec entrevista placer compartir tú abrazo,2019-03-07
Pablo Eduardo,Ponce Cerda,PabloPonce,hoy ser largo jornada trabajo Cuenca gracias telegrafo abrir yo puerta mucho bendición,2019-03-07
Pablo Eduardo,Ponce Cerda,PabloPonce,participacion ciudadano esencial ejercicio publico proponer colegio especialista fiscalicir acción publica ser necesario via splendid1040 cuenco eleccionesCPCSS YoSoyTuVoz,2019-03-07
Pablo Eduardo,Ponce Cerda,PabloPonce,deber existir reunión pleno CPCCS territorio solo territorio conocer realidad pai incentivar verdadero proceso participacion ciudadano via splendid1040 Cuenca YoSoyTuVoz eleccionesCPCCS,2019-03-07
Pablo Eduardo,Ponce Cerda,PabloPonce,gracias splendid1040 recibirme ser gran entrevista cuenco EleccionesCPCCS YoSoyTuVoz,2019-03-07
Pablo Eduardo,Ponce Cerda,PabloPonce,ir adelante amigo ejerzar derecho escoger derecho tenrer CPCCS democratico participativo cumplidor ley,2019-03-08
Pablo Eduardo,Ponce Cerda,PabloPonce,recorrido 18 provincia propongo realizar asamblea itinerant territorio via CanalRTU YoSoyTuVoz casillero12,2019-03-08
Pablo Eduardo,Ponce Cerda,PabloPonce,educador mas treinta ano solo aula poder impulsar etica evitar acto corrupcion via CanalRTU YoSoyTuVoz Elecciones2019EC,2019-03-08
Pablo Eduardo,Ponce Cerda,PabloPonce,necesario involucrar colegio especialista gestion publicar forma incentivar participacion ciudadano via CanalRTU YoSoyTuVoz Elecciones2019ec,2019-03-08
Pablo Eduardo,Ponce Cerda,PabloPonce,Formulare alianza estrategica organismo publico privado optimizar recurso humano material via CanalRTU YoSoyTuVoz Elecciones2019Ec casillero12 CPCCS,2019-03-08
Pablo Eduardo,Ponce Cerda,PabloPonce,querer fortalecer Cpccs efecto cumplir objetivo creado via CanalRTU YoSoyTuVoz Elecciones2019Ec casillero12 CPCCS,2019-03-08
Pablo Eduardo,Ponce Cerda,PabloPonce,querer dar conocer ciudadania servir cpccs manera tener legitimidad via CanalRTU YoSoyTuVoz Elecciones2019Ec casillero12 CPCCS,2019-03-08
Pablo Eduardo,Ponce Cerda,PabloPonce,mujer rol historico humanidad precisamente hacer él mas humano mas justo saludo especial todo mujer 8 marzo MujeresQueConstruyenEcuador YoSoyTuVoz,2019-03-08
Pablo Eduardo,Ponce Cerda,PabloPonce,conagopare1 gracias apoyo 55 Juntas Parroquiales bello provincia Esmeraldas hoy escuchar propuesta CPCCS YoSoyTuVoz Casillero12,2019-03-08
Pablo Eduardo,Ponce Cerda,PabloPonce,querer fortalecer Cpccs efecto cumplir objetivo creado via StarNoticia YoSoyTuVoz Elecciones2019Ec casillero12 CPCCS esmeralda,2019-03-08
Pablo Eduardo,Ponce Cerda,PabloPonce,zoommediaec ConagopareN PabloPonce Mas claro PabloPonce har buen cambio eleccion poder seguir mismo excelente Propuestas,2019-03-08
Pablo Eduardo,Ponce Cerda,PabloPonce,hoy presente graduacion 60 mujer programa formacion Minga agricultura urbano comunitario mejorar economia popular solidario organizado Iglesia Evangelica Nueva Jerusalen YoSoyTuVoz EleccionesCPCCS,2019-03-10
Pablo Eduardo,Ponce Cerda,PabloPonce,dilesialademocracia,2019-03-11
Pablo Eduardo,Ponce Cerda,PabloPonce,VotoInformadoCNE2019 Ecuador PabloPonce SiALaDemocracia cpccs,2019-03-11
Pablo Eduardo,Ponce Cerda,PabloPonce,buen dia compartir agenda medio hoy abrazo bendición yosoytuvoz casillero12 eleccionescpccs,2019-03-11
Pablo Eduardo,Ponce Cerda,PabloPonce,Formulare alianza estrategica organismo publico privado optimizar recurso humano material via complicefm YoSoyTuVoz Elecciones2019Ec casillero12 CPCCS Cuenca,2019-03-11
Pablo Eduardo,Ponce Cerda,PabloPonce,Inicia entrevista complicefm YoSoyTuVoz Elecciones2019Ec casillero12 CPCCS Cuenca,2019-03-11
Pablo Eduardo,Ponce Cerda,PabloPonce,SiALaDemocracia YoSoyTuVoz,2019-03-11
Pablo Eduardo,Ponce Cerda,PabloPonce,poder incentivar voto nulo CPCCS existir proceso debate YoSoyTuVoz dilesialademocracia,2019-03-11
Pablo Eduardo,Ponce Cerda,PabloPonce,impulsar debate libertad expresion sesgado YoSoyTuVoz DileSiALaDemocracia Elecciones2019EC,2019-03-11
Pablo Eduardo,Ponce Cerda,PabloPonce,Gracias ecuainm  entrevista importante abrir espacio dialogo participacion ciudadano YoSoyTuVoz dilesialademocracio,2019-03-11
Pablo Eduardo,Ponce Cerda,PabloPonce,Formulare alianza estrategica organismo publico privado optimizar recurso humano material via ecuainm YoSoyTuVoz Elecciones2019Ec casillero12 CPCCS,2019-03-11
Pablo Eduardo,Ponce Cerda,PabloPonce,dilesialademocracia YoSoyTuVoz CPCCS,2019-03-11
Pablo Eduardo,Ponce Cerda,PabloPonce,dilesialademocracia YoSoyTuVoz CPCCS,2019-03-11
Pablo Eduardo,Ponce Cerda,PabloPonce,mucho gracias apoyo carino claudi4s fuerte abrazo bendición YoSoyTuVoz,2019-03-11
Pablo Eduardo,Ponce Cerda,PabloPonce,mucho gracias apoyo alar g0mez mando fuerte abrazo mucho bendición,2019-03-11
Pablo Eduardo,Ponce Cerda,PabloPonce,dilesialademocracia YoSoyTuVoz CPCCS,2019-03-11
Pablo Eduardo,Ponce Cerda,PabloPonce,dilesialademocracia YoSoyTuVoz CPCCS,2019-03-11
Pablo Eduardo,Ponce Cerda,PabloPonce,dilesialademocracia YoSoyTuVoz CPCCS,2019-03-11
Pablo Eduardo,Ponce Cerda,PabloPonce,dilesialademocracia YoSoyTuVoz CPCCS,2019-03-11
Pablo Eduardo,Ponce Cerda,PabloPonce,dilesialademocracia YoSoyTuVoz CPCCS,2019-03-11
Pablo Eduardo,Ponce Cerda,PabloPonce,Consejo Participacion Ciudadana Control social educar recuperar valor honestidad autoridad sujeto rendir cuenta beneficio sociedad,2019-03-12
Pablo Eduardo,Ponce Cerda,PabloPonce,Concejo Participacion Ciudadana Control social educar recuperar valor honestidad autoridad sujeto rendir cuenta beneficio sociedad dilesialademocracia YoSoyTuVoz CPCCS,2019-03-13
Pablo Eduardo,Ponce Cerda,PabloPonce,caso diezmos traer profundo preocupacion embargo momento frenar idea q cobrar diezmo perdonenme nunca cobrado diezmo vido poder generalizar ninguno colaborador poder decir incurrido similar,2019-03-13
Pablo Eduardo,Ponce Cerda,PabloPonce,venir promover cultura paz designacion autoridad manzán discordia mas importante consejo ciudadania participativo activo dejar autoridad hacer gana corapesatelital CPCCS,2019-03-13
Pablo Eduardo,Ponce Cerda,PabloPonce,caso diezmo traer profundo preocupacion embargo momento frenar idea cobrar diezmo Perdonenme nunca cobrado diezmo vido poder generalizar ninguno colaborador poder decir incurrido similar,2019-03-13
Pablo Eduardo,Ponce Cerda,PabloPonce,YoSoyTuVoz Queridos amigo amigo felizjuev hoy estarir varios medio bello Provincia Santo Domingo Tsachilas,2019-03-14
