nombre,apellidos,tweet_screen_name,tweet_text,tweet_date
José Carlos,Tuarez Zambrano,jcarlostuarez,ramirogarciaf jcarlostuarez comentario demostrar pensamiento ser si jcarlostuarez elegido voto necesitario rezar ColdasiceV Astrea1014 YoSoyDiamante12 redfamiliarpf,2019-05-15
José Carlos,Tuarez Zambrano,jcarlostuarez,Manana 07 30 estarir invitado UnCafeConJJ xzeg jcarlostuarez luzmilanicolald MusicAnaPaula jluna oficial Sintoniza 1350 AM Teleradio informacionenmovimiento,2019-05-16
José Carlos,Tuarez Zambrano,jcarlostuarez,jcarlostuarez palabra reflejo gran formacion humildad Aprovecho felicitar él designacion Consejero CPCCS amigo Papa Pepe digno Madre Dona Cleofe ser oriundo Parroquia Pueblo nuevo,2019-05-16
José Carlos,Tuarez Zambrano,jcarlostuarez,jcarlostuarez manifiesta UnCafeConJJ confiir designación hecho Consejo Participacion Transitorio embargo descartar nuevo Consejo poder recibir duda impugnación sociedad civil deberar evaluar,2019-05-16
José Carlos,Tuarez Zambrano,jcarlostuarez,poder eliminar CPCCS traves  consulta popular Seria necesario Asamblea Constituyente eliminar él fortalecer él indicar jcarlostuarez UnCafeConJJ jimmyjairala jo él toledog luisadelgadillo RafaelCamposSa,2019-05-16
José Carlos,Tuarez Zambrano,jcarlostuarez,META IMPORTANTE CPCCS deber ser defender VIDA FAMILIA MAFIAS corrupto SIGLO 21 Q FINANCIAN FORO SAO PAULO NEOMARXISMO CULTURAL MUERTE FAMILIA SALVO QUEDA RESCATAR DEFENDER jcarlostuarez RosaChalaEc SofiaAlmeidaEc hernanulloa,2019-05-17
José Carlos,Tuarez Zambrano,jcarlostuarez,cnegobec hoy sesion Pleno proclamar resultado definitivo CPCCS definitivo via Elecciones 24marzo Consejeros CPCCS principal mrivadeneirac SofiaAlmeidaEc VickyDesintonio jcarlostuarez wgomezr ChristianCruz RosaChalaEc,2019-05-18
José Carlos,Tuarez Zambrano,jcarlostuarez,Gracias ecuatoriar s confianza puesto humilde servidor trabajare ahinco mas necesitado sere voz voz Nace nuevo ciudadano verdadero mandant Dios guie,2019-05-18
