nombre,apellidos,tweet_screen_name,tweet_text,tweet_date
José Carlos,Tuarez Zambrano,jcarlostuarez,yabasta sobreprecio esmeralda transparentar contratación recurso utilizado eficientemente corrupcion atente familia cada dolar robado hacer falta hijo PadreJoseTuarez ListaHombres Puesto7 CPCCS,2019-03-15
José Carlos,Tuarez Zambrano,jcarlostuarez,Fomentare velarir transparencia luchare ciudadano honesto trabajador necesitar ser escuchado 24marzo Cpccs2019 ListaHombres Casillero7 PadreJoseTuarez megatv7 Quininde,2019-03-15
José Carlos,Tuarez Zambrano,jcarlostuarez,yabasta sobreprecio esmeralda transparentar contratación recurso utilizado eficientemente corrupcion atente familia cada dolar robado hacer falta hijo PadreJoseTuarez ListaHombres Puesto7 CPCCS,2019-03-16
José Carlos,Tuarez Zambrano,jcarlostuarez,Fomentare velarir transparencia luchare ciudadano honesto trabajador necesitar ser escuchado 24marzo Cpccs2019 ListaHombres Casillero7 PadreJoseTuarez megatv7 Quininde,2019-03-16
José Carlos,Tuarez Zambrano,jcarlostuarez,gracias Dios momento encontrar compartir bello diir junto maravillosa Isabel Robalino Conocida actividad abogado lidersindical activistasocial ecuatoriano Actualmente Isabel miembro comision ANTICORRUPCION Ecuador,2019-03-16
José Carlos,Tuarez Zambrano,jcarlostuarez,gracias Provincia Santo Domingo Tsachilas video querer compartir tú agradecimiento bello provincia visitar hacer dia conoci multipl tradición dialoguir diverso ciudadano necesidad inter,2019-03-16
José Carlos,Tuarez Zambrano,jcarlostuarez,saludo amigo agradecer elcomerciocom haber realizar ameno entrevista presento candidatura comparto propuesto CPCCS siempre preocupado pais valor provido profamilia lleno oportunidad,2019-03-18
José Carlos,Tuarez Zambrano,jcarlostuarez,Manana lunes 18 Marzo grata dinamicar Provincia Pichincha invitar seguir agenda medio actividad todossomosecuador EC Ecuador CPCCS Familia Union Paz Elecciones2019EC CandidatoCPCCS eleccionescpccs CPCCS ListaHombres Puesto7,2019-03-18
José Carlos,Tuarez Zambrano,jcarlostuarez,Manana lunes 18 Marzo grata dinamicar Provincia Pichincha invitar seguir agenda medio actividad todossomosecuador EC Ecuador CPCCS Familia Union Paz Elecciones2019EC CandidatoCPCCS eleccionescpccs CPCCS ListaHombres Puesto7,2019-03-18
José Carlos,Tuarez Zambrano,jcarlostuarez,gracias Esmeraldas Agradezco bello provincia recibirme 24 MARZO ESMERALDENOS VOTARAN padre JOSE CARLOS TUAREZ CONSEJO PARTICIPACION CIUDADANA CONTROL social,2019-03-18
José Carlos,Tuarez Zambrano,jcarlostuarez,gracias Dios momento gracias completo apoyo candidatura CONSEJO PARTICIPACION CIUDADANA CONTROL SOCIAL Dra Isabel Robalino Bolle figura legendario Ecuador,2019-03-18
José Carlos,Tuarez Zambrano,jcarlostuarez,gracias Provincia Santo Domingo Tsachilas TIERRITA video querer compartir tú agradecimiento bello provincia 24 MARZO VOTARAN padre JOSE CARLOS TUAREZ CONSEJO PARTICIPACION CIUDADANA CONTROL social,2019-03-18
José Carlos,Tuarez Zambrano,jcarlostuarez,Amigos comparto fotografia podran encontrar papeleta 24 Marzo OLVIDES PUESTO 7 PAPELETA hombre medio papeleta JOSE CARLOS TUAREZ CONSEJO PARTICIPACION CIUDADANA CONTROL social CPCCS,2019-03-18
José Carlos,Tuarez Zambrano,jcarlostuarez,ahora buenosdiasamerico acompán Jcarlostuarez candidato CPCCS hablar Propuesta Trabajo 104 5 FM miranos Jorgeacato RamiroDiaz64 longogalo,2019-03-18
José Carlos,Tuarez Zambrano,jcarlostuarez,QUITO hoy programa buenosdiasamerico expusar propuesto trabajo beneficio ecuatoriano pueblo primero fiscalizador UnaVidaAlServicioDeLosDemas,2019-03-18
José Carlos,Tuarez Zambrano,jcarlostuarez,Amigos olvidar domingo cambio mano 6 dia proceso electoral Elecciones2019EC CPCCS recuerdir CONSEJO PARTICIPACION CIUDADANA CONTROL SOCIAL PapeletaHombres Puesto7 JOSE CARLOS TUAREZ CENTRO PAPELETA,2019-03-18
José Carlos,Tuarez Zambrano,jcarlostuarez,Amigos compartir agendir actividad diar manana martes 19 Marzo Provincia Pichincha 24demarzo VOTA padre JOSE TUAREZ CONSEJO PARTICIPACION CIUDADANA CONTROL SOCIAL PUESTO7 MEDIO PAPELETA hombre,2019-03-19
José Carlos,Tuarez Zambrano,jcarlostuarez,Amigos 24 MARZO tú harar cambio necesitar pais domingo VOTA padre JOSE CARLOS TUAREZ CONSEJO PARTICIPACION CIUDADANA CONTROL social CPCCS PapeletaHombres EnElCentro Puesto7 Elecciones2019EC,2019-03-20
José Carlos,Tuarez Zambrano,jcarlostuarez,FALTAN 5 DIAS 24 MARZO mejor participacion CIUDADANA VOTA padre JOSETUAREZ CONSEJO PARTICIPACION CIUDADANA CONTROL social CPCCS PapeletaHombres EnElCentro Puesto7 Elecciones2019,2019-03-20
José Carlos,Tuarez Zambrano,jcarlostuarez,MANANA 20 marzo provincia Guayas invito seguir agenda medio actividad RECUERDEN 24 marzo VOTA padre JOSE CARLOS TUAREZ CPCCS PapeletaHombres EnElCentro Puesto7 Elecciones2019EC EleccionesCPCCS,2019-03-20
José Carlos,Tuarez Zambrano,jcarlostuarez,BuenMiercoles hoy Perla Pacifico Gye cresatelital PorElNulo CPCCS 24marzo defender derecho elegir ser elegir sigo candidatura eleccciones2019ec PapeletaHombres Puesto7 EnElCentro JoseTuarez Guayas Ecuador,2019-03-20
José Carlos,Tuarez Zambrano,jcarlostuarez,gracias Virginia teleradio1350 compromiso pueblo ecuatoriano poder politico economico impulsar votonulo CPCCS sigoconmicandidaturo Guayas Ecuador porelnulo,2019-03-20
José Carlos,Tuarez Zambrano,jcarlostuarez,Falto debate informacion CPCCS voto sero jcarlostuarez parecer candidato idoneo,2019-03-20
José Carlos,Tuarez Zambrano,jcarlostuarez,5 peor malo sacerdote saber asi parir cabeza Padre jcarlostuarez igual participarar elección CPCCS campán malo fe solo buscar desprestigio participante Vayan confesion hipocritas,2019-03-20
José Carlos,Tuarez Zambrano,jcarlostuarez,felizmierco él ahora ecuadordirecto TeQuieroTV comparto ciudadania importancia CPCCS si poder politico economico estar porelnulo mas fuerza conviccion dil VotoNulo PadreJoseTuarez Elecciones2019EC PapeletaHombres Puesto7,2019-03-20
José Carlos,Tuarez Zambrano,jcarlostuarez,Amigos invito seguir entrevista radiohuancavilk siguiente enlace porelnulo RECUERDEN 24 Marzo elecciones2019ec VOTA padre JOSE TUAREZ CPCCS ListaHombres puesto7 EnElCentro PAPELETA,2019-03-20
José Carlos,Tuarez Zambrano,jcarlostuarez,porelnulir luchar poder politico economico ciudadano honesto humilde salir diar dio sudar pan ir respaldar candidatura PadreJoseTuarez CPCCS domingo 24marzo EnElCentro PapeletaHombres Puesto7 Dios gente,2019-03-20
José Carlos,Tuarez Zambrano,jcarlostuarez,ahora senalpositivo programa HECHOS invito seguir grata entrevista junto WALTER RUIZ PadreJoseTuarez CPCCS domingo 24marzo EnElCentro PapeletaHombres Puesto7 Dios gente,2019-03-20
José Carlos,Tuarez Zambrano,jcarlostuarez,ahora senalpositivo programa HECHOS invito seguir grata entrevista junto WALTER RUIZ PadreJoseTuarez CPCCS domingo 24marzo EnElCentro PapeletaHombres Puesto7 Dios gente,2019-03-20
José Carlos,Tuarez Zambrano,jcarlostuarez,eluniversocom FEDEBASG ESUNCANDIDATO presentar Jcarlostuarez Aqui lugar papeleta cpccs 104 5 FM Jorgeacato RamiroDiaz64 longogalo CPCCS,2019-03-21
José Carlos,Tuarez Zambrano,jcarlostuarez,Amigos compartir agendir actividad diar manana 21 marzo Perla Pacifico 24demarzo VOTA padre JOSE CARLOS TUAREZ CONSEJO PARTICIPACION CIUDADANA CONTROL social CPCCS PUESTO7 ENELCENTRO PAPELETAHOMBRES,2019-03-21
José Carlos,Tuarez Zambrano,jcarlostuarez,felizjuev hoy teleradio1350 FacebookLive junto HugoGavilanes pongo disposicion candidatura CPCCS LaFamilia LaVida domingo 24marzo PadreJoseTuarez PapeletaHombres Puesto7,2019-03-21
José Carlos,Tuarez Zambrano,jcarlostuarez,Saludos PerlaDelPacifico Caravana750 afirmo compromiso pueblo compromiso politico nadie civismo conviccion 24marzo El24 CPCCS PadreJoseTuarez Centro PapeletaHombres puesto7 felizjuev,2019-03-21
José Carlos,Tuarez Zambrano,jcarlostuarez,ahora radio sucre invito seguir ameno entrevista vivo sigo FIRME FELIZ candidatura ahora MAS nunca 24 MARZO VOTA padre JOSE CARLOS TUAREZ CPCCS PapeletaHombres Puesto7 EnElCentro PAPELETA,2019-03-21
José Carlos,Tuarez Zambrano,jcarlostuarez,felizjuev 680radioatalair junto pochoharb hacer llamar conciencia ecuatoriano prestar oido llamado votonulo 24marzo amor patria ir Votar PadreJoseTuarez CPCCS Centro PapeletaHombres Puesto7,2019-03-21
José Carlos,Tuarez Zambrano,jcarlostuarez,ahora ecuantén ver entrevista vivo candidatura cuidar migrant dignidad enfermo futuro familia ecuatoriano VOTA PADRE JOSE CARLOS TUAREZ CPCCS puesto7 EnElCentro PAPELETA,2019-03-21
José Carlos,Tuarez Zambrano,jcarlostuarez,ahora ecuantén comparto entrevista candidatura cuidar migrant dignidad enfermo futuro familia ecuatoriano VOTA PADRE JOSE CARLOS TUAREZ CPCCS puesto7 EnElCentro PAPELETA,2019-03-21
José Carlos,Tuarez Zambrano,jcarlostuarez,Tuarez pidio licenciar ano participar elección Vistazo Claro padre jcarlostuarez liderar encuesta cierto grupo queriar campán sucio hacer él lado voto sero Jose Tuarez puesto 7 cpccs definitivo,2019-03-22
José Carlos,Tuarez Zambrano,jcarlostuarez,FALTAN 2 DIAS 24 MARZO VOTA padre JOSE CARLOS TUAREZ CONSEJO PARTICIPACION CIUDADANA CONTROL social CPCCS papeletahombr enelcentro PAPELETA puesto7 Elecciones2019 Saludos DiaMundialdelAgua,2019-03-22
José Carlos,Tuarez Zambrano,jcarlostuarez,FernandoMideros jcarlostuarez mio amigo familia tambien,2019-03-23
José Carlos,Tuarez Zambrano,jcarlostuarez,MarleMontesinos jcarlostuarez CPCCS,2019-03-23
José Carlos,Tuarez Zambrano,jcarlostuarez,FALTAN 1 DIA USTEDES SERAN HAGAN CAMBIO NECESITA PAIS 24 MARZO VOTA padre JOSE CARLOS TUAREZ CONSEJO PARTICIPACION CIUDADANA CONTROL social CPCCS papeletahombr enelcentro PAPELETA puesto7 Elecciones2019,2019-03-23
José Carlos,Tuarez Zambrano,jcarlostuarez,falta 1 DIA USTEDES SERAN HAGAN CAMBIO NECESITA PAIS 24 MARZO VOTA padre JOSE CARLOS TUAREZ CONSEJO PARTICIPACION CIUDADANA CONTROL social CPCCS papeletahombr enelcentro PAPELETA puesto7 Elecciones2019,2019-03-23
José Carlos,Tuarez Zambrano,jcarlostuarez,falta 1 DIA Doy gracias mil ecuatoriano brindado confianza regalado grato recuerdo Juntos devolveremos dignidad politico ecuatoriano GRACIAS ECUADOR 24demarzo Vota PadreJoseTuarez CPCCS PapeletaHombres Puesto7,2019-03-23
José Carlos,Tuarez Zambrano,jcarlostuarez,gracias Guayaquil gracias teleradio1350 confianzo humildad recibo nuevo reto disciplina ir luchar mas desprotegido CPCCS ProVida profamilia FelizMartes,2019-03-26
José Carlos,Tuarez Zambrano,jcarlostuarez,Gracias ecuantén Francisco ecuatoriano oportunidad dar servirl disciplina amor ganas transparentar sector publico favor pueblo CPCCS felizmart,2019-03-26
José Carlos,Tuarez Zambrano,jcarlostuarez,realmente vencio ningun partido politico Vencio vida familia pues seguro autoridad electo mostrar pleno posicion provido CynthiaViteri6 LoroHomero jcarlostuarez LuisAlmeidaM ursulastrengech vivián bonilla henrycucalon HectorYepezM,2019-03-27
José Carlos,Tuarez Zambrano,jcarlostuarez,eluniversocom mmcuesta vicenteopi ahora entender desear ferviente desaparecer CPCCS actual consejero jcarlostuarez electo pueblo investigar absolutamente caso corrupcion conocer AsambleaEcuador SOSECUADOR CPCCSelectos salvenlapatriar,2019-03-27
José Carlos,Tuarez Zambrano,jcarlostuarez,llevar calma transparencia paz CPCCS trabajarer unido devolver confianza valor Ecuador perdido radioaguilar Paneleando,2019-03-27
José Carlos,Tuarez Zambrano,jcarlostuarez,Felicitaciones jcarlostuarez gran victoria partir comunidad estudiantil UGJURIS extend apoyo lexdaesjurisprudencia,2019-03-27
José Carlos,Tuarez Zambrano,jcarlostuarez,jueves 28 ottosonnenh vicepdte 100 dia cargo proceso electoral inundación jcarlostuarez candidato mejor votado competencia CPCCS MerckBenavides 2do mejor puntuado Fiscal Replica Impugnacion ContactoDirecto 7 ecuavisa,2019-03-28
José Carlos,Tuarez Zambrano,jcarlostuarez,Felicitaciones padrecito jcarlostuarez gusto conocer él convertido fan desear mejor nuevo etapa miembro CPCCS Dios iluminar exito exito pais,2019-03-28
José Carlos,Tuarez Zambrano,jcarlostuarez,jcarlostuarez FOSPEecu YoSoyDiamante12 RTSEcuador eluniversocom tctelevision eps red EcuadorTV joesgu SofiaAlmeidaEc Astrea1014 Felicitaciones estimado Padre romper paradigma hacer bien trinchera llamado cpccs devolver él poder Pueblo traves Participacion ciudadanar Exitos bendición,2019-03-28
José Carlos,Tuarez Zambrano,jcarlostuarez,Conformacion CPCCS voto popular HOMBRES jcarlostuarez wgomezr ChristianCruzL7 MUJERES mrivadeneirac SofiaAlmeidaEc VickyDesintonio PUEBLOS NACIONALIDADES RosaChalaEc Fuente cnegobec eleccionescpccs,2019-03-29
José Carlos,Tuarez Zambrano,jcarlostuarez,gracias Ecuador vigilante Respete Voluntad Pueblo Urnas Principios Valores Padre Jose Tuarez Zambrano mejor Votado CPCCS jcarlostuarez IngCarlosVille2 Lenin AsambleaEcuador omarmaluk jaimenebotsaadi PaulGranda,2019-03-30
José Carlos,Tuarez Zambrano,jcarlostuarez,jcarlostuarez CPCCS radioaguilar leonardescobarb JohnCoppianoC Astrea1014 eluniversocom tctelevision FOSPEecu eps red YoSoyDiamante12 joesgu ASOLIMVER Asociacion sector EPS economico popular solidario FELICITA jcarlostuarez gran triunfo candidato votado contar respaldo pais necesitar bano verdad transparencia honestidad principio valor gracias,2019-03-30
José Carlos,Tuarez Zambrano,jcarlostuarez,jcarlostuarez CPCCS radioaguilar leonardescobarb JohnCoppianoC Astrea1014 eluniversocom tctelevision FOSPEecu eps red YoSoyDiamante12 joesgu FEDEBAS agradecer jcarlostuarez tener valor salir palestra politico candidato consejero CPCCS ganar barrio suburbano Guayaquil respaldamos candidatura seguir respaldar gestion Exitos Padre Tuarez,2019-03-30
José Carlos,Tuarez Zambrano,jcarlostuarez,manera imprevista encuentro capitalarrocero Daule agradecer radio online LaVozDeDaule hermano dau él yo voto confianzo brindar ir junto transparentar Ecuador ecuadoresahora CPCCS ente servicio,2019-03-30
José Carlos,Tuarez Zambrano,jcarlostuarez,pablofgl jcarlostuarez CPCCS radioaguilar leonardescobarb JohnCoppianoC Astrea1014 eluniversocom tctelevision FOSPEecu eps red YoSoyDiamante12 joesgu bueno realidad usted conociar organización social sector EPS millón conocer bien confiamos excelente labor jcarlostuarez CPCCS ser posible respaldar candidatura PRESIDENCIA usted,2019-03-31
José Carlos,Tuarez Zambrano,jcarlostuarez,JCTrujilloCPCCS Ud elegir x Presidente Republica nuevo Consejeros elegido x 7 votante desicion soberano x x preocupo desaparecer CPCCS si ganar derecho urna douglastorresfe jcarlostuarez,2019-03-31
José Carlos,Tuarez Zambrano,jcarlostuarez,jcarlostuarez FOSPEecu YoSoyDiamante12 RTSEcuador eluniversocom tctelevision eps red EcuadorTV joesgu SofiaAlmeidaEc Astrea1014 Creo confio ud Schoensttatiana ahora ir trabajar pueblo ecuatoriano eligio Dios seguir bendecir Mater protejar,2019-04-01
José Carlos,Tuarez Zambrano,jcarlostuarez,deber exigir CNE resultado final,2019-04-01
José Carlos,Tuarez Zambrano,jcarlostuarez,Digan decir promover voto nulo q querer cpccs actue todo atribución pueblo eligio mejor,2019-04-03
José Carlos,Tuarez Zambrano,jcarlostuarez,hoy excelente oportunidad entrevistar Padre Jose Tuarez CPCCS definitivo excelente consejero social humano jcarlostuarez,2019-04-06
José Carlos,Tuarez Zambrano,jcarlostuarez,Revise cerca 6 000 acta 38 000 nivel nacional 900 robar voto decir comparar dato obtengo urnas informacion cnegobec diferenciar mas 11 000 voto mantener él tendencia habriar quitado 70 000 voto,2019-04-06
José Carlos,Tuarez Zambrano,jcarlostuarez,omarmaluk jcarlostuarez Concuerdo usted omarmaluk padre jcarlostuarez poco elección acertado apoyar momento elegir contento,2019-04-07
José Carlos,Tuarez Zambrano,jcarlostuarez,gustavonoboab clementepn rosaliaarteaga ricardonoboab CapitanDubrok Alguien podrio explicar significar supervisar eliminacion CPCCS supervisa muerte anticipado jcarlostuarez RosaChalaEc SofiaAlmeidaEc,2019-04-07
José Carlos,Tuarez Zambrano,jcarlostuarez,omarmaluk JCTrujilloCPCCS consejero electo pueblo CPCCS fin conversacion Vaya casa JCTrujilloCPCCS disfrutar familia jcarlostuarez davalos2019 hernanulloa,2019-04-07
José Carlos,Tuarez Zambrano,jcarlostuarez,LMRuminahui jcarlostuarez CPCCS bastar seguir repetir mismo capitulo opereta tragicomico politico Ecuatoriana Dejen democraciar CPCCS funcionar beneficio decencia mas reparto haciendo,2019-04-08
José Carlos,Tuarez Zambrano,jcarlostuarez,jimmyjairala CPCCS Respaldo nuevo CPCCS Voluntad Pueblo Urnas encima acto apegado Democracia SR TRUJILLO VAYA DESCANSAR DEJE TRABAJAR Coherentes decir mes mas usted sero Ciudadano mas voz Pueblo,2019-04-08
José Carlos,Tuarez Zambrano,jcarlostuarez,jcarlostuarez FOSPEecu YoSoyDiamante12 RTSEcuador eluniversocom tctelevision eps red EcuadorTV joesgu SofiaAlmeidaEc Padre usted sero voz devolvera Paz tranquilidad familia ecuatoriano,2019-04-08
José Carlos,Tuarez Zambrano,jcarlostuarez,necio JCTrujilloCPCCS PabloDavilaJ ver cifra seguir consigna grupo poder ventajar papeleta valida frente nula mas 2 1 Esperamos consultar decir él jcarlostuarez,2019-04-09
José Carlos,Tuarez Zambrano,jcarlostuarez,omarmaluk jcarlostuarez JCTrujilloCPCCS PabloDavilaJ completamente acuerdo JCTrujilloCPCCS ir ahora si cerrar peor nombra comision integrante nelsacurbeloc defensorar derechos humanos pedir aborto grito clase gente INDIGNANTE,2019-04-09
José Carlos,Tuarez Zambrano,jcarlostuarez,falso Cura Julian Cruzalta recibido honor comision justicia FAVOR aborto AsambleaEcuador vivián bonilla marcelaguinago henrycucalon LourdesCuestaO henrycucalon EncaDuchi jcarlostuarez PMoysam redfamiliarpf LaCristiFranco PedroCurichumbi,2019-04-09
José Carlos,Tuarez Zambrano,jcarlostuarez,padre jcarlostuarez recordar q Manabi Alma siempre lado correcto historia x dar triunfo popular mas votado miembro CPCCS defraude defraudado,2019-04-09
José Carlos,Tuarez Zambrano,jcarlostuarez,Empezamos Semana Santa Jesus realacer verdadero acto amor morir limpiar pecado tiempo reflexion meditacion paz familia vido Bendito venir nombre Senor hosannir altura,2019-04-15
José Carlos,Tuarez Zambrano,jcarlostuarez,TejeroAlexander jcarlostuarez radio sucre700 lahistoriaec tctelevision ecuantén RTSEcuador eluniversocom YoSoyDiamante12 JulietaSagnay joesgu Asi jcarlostuarez tiempo reflexion pedir Dios salve Ecuador mafia querer imponer AsambleaEcuador agendo elite GLOBALUSTA cultura MUERTE Pidamos vida salud familia liberar él mafia,2019-04-15
José Carlos,Tuarez Zambrano,jcarlostuarez,GLORIA dios ALTURAS PAZ HOMBRES buen VOLUNTAD DIOS BENDIGA SIEMPRE ECUADOR,2019-04-15
José Carlos,Tuarez Zambrano,jcarlostuarez,hoy 16abr recordar dolor pasar hora panico terror incertidumbre increible pasado tres ano aquel momento cambio vida ecuatoriano Manabi esmeralda vivir saber invencible 16a,2019-04-16
José Carlos,Tuarez Zambrano,jcarlostuarez,Eucaristia encuentramos jesus compartir vido sentir amor alli experimentar murio resucito juevessanto Dia lavar pies dia humildad diar servir mas necesitado felizjuev,2019-04-18
José Carlos,Tuarez Zambrano,jcarlostuarez,Eucaristia encontrar jesus compartir vido sentir amor alli experimentar murio resucito juevessanto Dia lavar pies dia humildad diar servir mas necesitado felizjuev diosesamor,2019-04-18
José Carlos,Tuarez Zambrano,jcarlostuarez,inocente ofrecio si mismo bien amigo incluso enemigo cerrar ojo miralo corazon brazo abierto esperar hoy viernessanto diar reflexionar entrega todo carga perdón actuar odio rencor amar,2019-04-19
José Carlos,Tuarez Zambrano,jcarlostuarez,vivir hoy verdadero resurreccion ver alrededor dar mas amor Ecuador mundo volver tener esperanza Feliz Pascua Pascua PascuaDeResurreccion FelizDomingo,2019-04-21
José Carlos,Tuarez Zambrano,jcarlostuarez,FelizLunes Celebremos vidar hogar hacer conciencia cuid planeta contamine Recicle mas Cuide agua Ahorre energiar Produzca producto organico Ame Vida Feliz DiadelaTierra,2019-04-22
José Carlos,Tuarez Zambrano,jcarlostuarez,cafecito jcarlostuarez trabajar agenda favor vida familia salud YoSoyDiamante12 JulietaSagnay cuenco,2019-04-28
José Carlos,Tuarez Zambrano,jcarlostuarez,FOSPEecu IngCarlosVille2 jcarlostuarez omarmaluk eps red EcuavisaInforma ElCaminante007 ecuainm rescate valor principio Ecuador Padre Tuarez mano esperanza regresar Ecuador decir q pasado pasado SI Ecuador consagrado Jesus Maria,2019-04-24
José Carlos,Tuarez Zambrano,jcarlostuarez,gracias LosRios todo organización social respaldar candidatura luchare derechos mas necesitado Pro familia salud vido naturaleza CPCCS odio resentimiento politico Ecuador necesitar Paz felizjuev,2019-04-25
José Carlos,Tuarez Zambrano,jcarlostuarez,WorldPadelTour defensa vida salud familio YoSoyDiamante12 ElianaCabrera9 Astrea1014 PolyUgarteG HectorYepezM elianacabrera9 redfamiliarpf KrystelEstrella CynthiaViteri6 drwilliamgarzon GomezRobertoA HD Galarza ColdasiceV marcelaaguinag1,2019-04-27
José Carlos,Tuarez Zambrano,jcarlostuarez,hoy instalación AsambleaEcuador participar ponente foro tanto verde Impuesto Verde propusimos posible reforma leyfomentoambiental cuanto propuesta derogatorio impuestoverde FelizLunes,2019-04-29
José Carlos,Tuarez Zambrano,jcarlostuarez,hoy instalación AsambleaEcuador participar ponente foro tanto verde Impuesto Verde propusimos posible reforma leyfomentoambiental cuanto propuesta derogatorio impuestoverde FelizLunes,2019-05-01
José Carlos,Tuarez Zambrano,jcarlostuarez,Vergonzoso JCTrujilloCPCCS terminar Comodato Inmobiliar dejar oficina nuevo cpccs definitivo demostrar mahuadista compliz malo perdedor malo democrata jcarlostuarez RosaChalaEc enfociudadano,2019-05-01
José Carlos,Tuarez Zambrano,jcarlostuarez,jcarlostuarez padre dejar pelotitar DPUBLICO hacer cargo delicado mismo deber hacer superbanco amarrir saqueador feriado bancario raton cuidar queso mismo siempre Seria bueno reveer designacion,2019-05-01
José Carlos,Tuarez Zambrano,jcarlostuarez,omarmaluk JCTrujilloCPCCS jcarlostuarez RosaChalaEc enfociudadano Trujillo demostrar ser producto descartable d juegos oscuro grupo factico mafioso cerca d 60 nombramiento d AMIGOS PARCIALIZADOS SIEMBRAN inseguridad juridico REPUBLICA,2019-05-01
José Carlos,Tuarez Zambrano,jcarlostuarez,jcarlostuarez NECESITAMOS gente nuevo honesta defiendo valor concepto fuerza vigor MIEDO ECUATORIANOS atento respaldamo,2019-05-01
José Carlos,Tuarez Zambrano,jcarlostuarez,hoy recordar 1demayo 1886 diar trabajador iniciar lucha defender derecho derechos deber conquistar dia unido pelearemo él Familia Vida Feliz DiaDelTrabajador vivo lucha clase obrero,2019-05-01
José Carlos,Tuarez Zambrano,jcarlostuarez,hoy recordar 1demayo 1886 diar trabajador iniciar lucha defender derecho derechos deber conquistar diar dio unido pelearemo él Familia Vida Feliz DiaDelTrabajador vivo lucha clase obrero,2019-05-01
José Carlos,Tuarez Zambrano,jcarlostuarez,hoy recordar 1demayo 1886 diar trabajador iniciar lucha defender derecho derechos deber conquistar diar dio unido pelearemo él Familia Vida Feliz DiaDelTrabajador vivo lucha clase obrero,2019-05-01
José Carlos,Tuarez Zambrano,jcarlostuarez,Vergonzoso desleal JCTrujilloCPCCS ser cierto define ud persona egoista egocentrica verguenzo,2019-05-01
José Carlos,Tuarez Zambrano,jcarlostuarez,jcarlostuarez Ojala Alcalde electo Playas sepa ley Senores CPCCS ejercicio mostrar bien podrio ser Playas Necesitamos transparente acción gobierno territorial manejar hacienda ano,2019-05-01
José Carlos,Tuarez Zambrano,jcarlostuarez,jcarlostuarez criterio escuchar deber ser evaluar detalladamente BASE respuesta obvia DEBEN ser escuchado diferenciar SI TITULO PERSONAL TITULO GRUPITO amigos CRITERIO NACIONAL,2019-05-02
José Carlos,Tuarez Zambrano,jcarlostuarez,100 acta procesado Tras verificacion reconteo voto realizado 112 junta doce provincia pai aprobar resultado numerico eleccion CPCCS cnegobec deberio realizar entrega credencial autoridad CPCCS,2019-05-06
José Carlos,Tuarez Zambrano,jcarlostuarez,Atencion ecuatoriano poder permitir enganir querer eliminar CPCCS eliminir 50 asambleista vicepresidencia poco credibilidad Saben ahora poblar poder estir asustado nonosdejemosenganar,2019-05-07
José Carlos,Tuarez Zambrano,jcarlostuarez,jcarlostuarez CPCCS eps red FOSPEecu joesgu radio sucre700 JulietaSagnay yosoydiamante12 eluniversocom lahistoriaec Astrea1014 ecuantén nonosdejemosenganar presidente deber respetar voto popular querer nuevo dignidad ejecutir auditoria completo combatir corrupcion esclarecer motivo campán eliminar CPCCS apoyamos totalmente postura jcarlostuarez,2019-05-07
José Carlos,Tuarez Zambrano,jcarlostuarez,Tiemblan ud padre jcarlostuarez saber pueblo necesidad lider principio creer politico ninguno integridad Astrea1014 ColdasiceV YoSoyDiamante12 elianacabrera9,2019-05-07
José Carlos,Tuarez Zambrano,jcarlostuarez,jcarlostuarez FOSPEecu CPCCS eps red joesgu radio sucre700 JulietaSagnay yosoydiamante12 eluniversocom lahistoriaec Astrea1014 ecuantén inaudito q despues d q pueblo pronuncio consulto q elegir miembro dl CPCCS urna hoy convenir interés protervo d cuanto politiquero pretender eliminar él querer coartar soberano derecho d designar autoridad,2019-05-07
José Carlos,Tuarez Zambrano,jcarlostuarez,gracias primero amor ser luz vida companera guia consejera mejor amiga Felicito madre todo madre Ecuador ser motivacion vida siempre fiel entregado FelizDiadeLaMadre FelizDiaMama,2019-05-12
José Carlos,Tuarez Zambrano,jcarlostuarez,jcarlostuarez Dios bendiga PadreTuarez,2019-05-12
José Carlos,Tuarez Zambrano,jcarlostuarez,Felicitaciones richardcarapazm tanto impresionante victoria 4ta etapa girodeitalia vez mas ecuatoriano dejar alto nombre pais Ecuador,2019-05-14
José Carlos,Tuarez Zambrano,jcarlostuarez,lamentable ocurrido senor JCTrujilloCPCCS humanos ecuatoriano Espero recuperar pronto Dios guardar Estare orar pronta recuperacion ProVida prosalud,2019-05-15
