nombre,apellidos,tweet_screen_name,tweet_text,tweet_date
María Sol,Corral,mariasolcorral,dificil campana electoral puerto puerta caminar calle gente gustas gustas empezar hacer candidato solo camina,2019-02-17
María Sol,Corral,mariasolcorral,entender infraccion cometido vulneracion derechos spot problema agresion ofensa impedir candidata ejerzo libre derecho expresar injusticia,2019-02-17
María Sol,Corral,mariasolcorral,admirar mujer empoderada gracias amparo estimu deporte femenino futbol,2019-02-18
María Sol,Corral,mariasolcorral,propongo cambio ciudad incluyente tolerante ciudad pensado mujer buen mujer buen nino abuelos joven buen,2019-02-18
María Sol,Corral,mariasolcorral,,2019-02-18
María Sol,Corral,mariasolcorral,,2019-02-18
María Sol,Corral,mariasolcorral,basura problema nuevo administracion deber responder eficiencia invito conocer propuesta recoleccion basura alternativa moderno,2019-02-18
María Sol,Corral,mariasolcorral,,2019-02-19
María Sol,Corral,mariasolcorral,estar repartir puesto,2019-02-19
María Sol,Corral,mariasolcorral,venir cuatro ano mexico aprendido ciudad logrado mantener primero turismo latinoamerico primero sudamerico,2019-02-19
María Sol,Corral,mariasolcorral,consul mexico aprendizaje permanente tema poder aprender mexico promocion turistico lider gastronomia arte musico folclore quito lugar maravilloso potenciar,2019-02-20
María Sol,Corral,mariasolcorral,gualo puembo proyecto estudio listo costario millón dolar podriar concesionar fijar tarifa peaje trayecto serio minuto ayudario aliviar movilidad aeropuerto,2019-02-20
María Sol,Corral,mariasolcorral,actualmente promedio tasar promedio crecimiento turista anual 2009 2015 vicealcaldés tener crecimiento paso resultar mala politica,2019-02-20
María Sol,Corral,mariasolcorral,necesitar conexion eficiente aeropuerto trayecto hacia aeropuerto poder tardar hora medio afectar directamente querer visitar quito,2019-02-20
María Sol,Corral,mariasolcorral,concesion centro convención bicentenario revisar dar ano serio cuestionamiento sector,2019-02-20
María Sol,Corral,mariasolcorral,quito inmensamente aburrido propuesta revertir ampliar hora productividad comercio articulado ecu911 sello calidad aplicacion movil turismo,2019-02-20
María Sol,Corral,mariasolcorral,expresidentar comision presupuesto entender perfectamente funcionamiento municipio hacer presupuesto justo administrar recurso medio escasez,2019-02-20
María Sol,Corral,mariasolcorral,,2019-02-20
María Sol,Corral,mariasolcorral,quito inmensamente aburrido propuesta revertir ampliar hora productividad comercio articulado ecu911 sello calidad aplicacion movil turismo,2019-02-21
María Sol,Corral,mariasolcorral,,2019-02-21
María Sol,Corral,mariasolcorral,decir maria lucha propiedad nadie cada nadie derecho descalificarno tratarno ofensivamente especialmente mujer transitado espacio duro mujer,2019-02-21
María Sol,Corral,mariasolcorral,candidata alcaldio ofrecer extender horario comercio ampliar productividad dentro ciudad,2019-02-21
María Sol,Corral,mariasolcorral,carta abierto nessa teran,2019-02-22
María Sol,Corral,mariasolcorral,feminismo machismo,2019-02-23
María Sol,Corral,mariasolcorral,juventud peor alcaldio joven tendran siempre lugar preferencial,2019-02-23
María Sol,Corral,mariasolcorral,iniciar semán programa poder exponer propuesta tercero edad cuidad humano uncambio,2019-02-25
María Sol,Corral,mariasolcorral,probemo saber hacer,2019-02-25
María Sol,Corral,mariasolcorral,problematicar movilidad eje importante tratar nuevo administracion empezam debate,2019-02-27
María Sol,Corral,mariasolcorral,disenacer sistema transporte multimodal sustentable sostenible megaviclovia carcelir quitumbe nuevo corredor sistema inteligente semaforizacion,2019-02-27
María Sol,Corral,mariasolcorral,problematicar movilidad eje importante tratar nuevo administracion empezam debate,2019-02-27
María Sol,Corral,mariasolcorral,establecera tarifa plano sistema integrado transporte publico quiteno podrar trasladar todo ciudad solo pago traves tarjeta electronico,2019-02-27
María Sol,Corral,mariasolcorral,deber incentivar trasporte publico descongestionar ciudad mejorar funcionamiento movil obligacion caja comun,2019-02-27
María Sol,Corral,mariasolcorral,deber incentivar trasporte publico descongestionar ciudad mejorar funcionamiento movil obligacion caja comun,2019-02-27
María Sol,Corral,mariasolcorral,invito acompanir dialogo medio,2019-02-27
María Sol,Corral,mariasolcorral,transporte formal calidad,2019-02-27
María Sol,Corral,mariasolcorral,dentro plan propongo movilidad renovado bus electrico poder evitar contaminacion mejorar corredor existente incentivar transporte publico uncambio,2019-02-27
María Sol,Corral,mariasolcorral,nuevo solucion guayasamin deber obligar ciudadano adquirir telepeaje manera mejoraro fluidez sector,2019-02-27
María Sol,Corral,mariasolcorral,nuevo solucion guayasamin deber obligar ciudadano adquirir telepeaje manera mejoraro fluidez sector,2019-02-27
María Sol,Corral,mariasolcorral,regularizacion barrio prioridad permitirar municipio mayor recaudacion evitar riesgo desastr natural,2019-02-27
María Sol,Corral,mariasolcorral,cuidad sufrir migración grande historia partir hermano venezolano necesario secretaria seguridad mantener control mediante censo migrant ingresar,2019-02-27
María Sol,Corral,mariasolcorral,querido lector manán estare invito seguir agenda medio,2019-02-28
María Sol,Corral,mariasolcorral,juventud peor alcaldio joven tendran siempre lugar preferencial,2019-02-28
María Sol,Corral,mariasolcorral,dialogo candidato alcaldio proponer fomente comercio empleo productividad ciudad,2019-02-28
María Sol,Corral,mariasolcorral,deber mirar hacia ciudad ecologicar transporte publico moderno adecuado norma euro junto construccion plantar biodiesel poner circulacion bus menor emision dioxido carbono,2019-02-28
María Sol,Corral,mariasolcorral,deber recuperar cuenca hidrica rio machangara pita intag pedro estar totalmente muerto cerca enfermedad ningun procesamiento tratamiento,2019-02-28
María Sol,Corral,mariasolcorral,basura enterrado necesitar nuevo planta adecuado procesamiento basura adema fortalecer existente,2019-02-28
María Sol,Corral,mariasolcorral,deber recuperar cuenca hidrica rio machangara pita intag pedro estar totalmente muerto cerca enfermedad ningun procesamiento tratamiento,2019-03-01
María Sol,Corral,mariasolcorral,basura enterrado necesitar nuevo planta adecuado procesamiento basura adema fortalecer existente,2019-03-01
María Sol,Corral,mariasolcorral,construir nuevo corredor bus megaciclovia quitumbe carcelir tarjeta electronico pago articulandolo forma eficaz metro quito,2019-03-01
María Sol,Corral,mariasolcorral,manán invitar seguir entrevista conocer fondo plan,2019-03-01
María Sol,Corral,mariasolcorral,invitar seguir entrevista expondre plan,2019-03-01
María Sol,Corral,mariasolcorral,manán parque ejido expuse plan propongo hacer parque zona seguro iluminacion adecuado sitio cultural encontrar familiar poder fortalecer sitio expresion arte cultura,2019-03-01
María Sol,Corral,mariasolcorral,festejar ciudad carnaval decorar todo calle ronda paragua rosa,2019-03-03
María Sol,Corral,mariasolcorral,dedicar,2019-03-03
María Sol,Corral,mariasolcorral,merecido reeleccion mejor opcion administrar ciudad,2019-03-03
María Sol,Corral,mariasolcorral,querer ciudad calle destrozada sucio recuperar casa,2019-03-03
María Sol,Corral,mariasolcorral,ciudad mujer buen,2019-03-03
María Sol,Corral,mariasolcorral,festejar ciudad carnaval decorar todo calle ronda paragua rosa,2019-03-03
María Sol,Corral,mariasolcorral,historia deber rescatar turismo gastronomia artesania,2019-03-03
María Sol,Corral,mariasolcorral,festejar ciudad carnaval decorar todo calle ronda paragua rosa,2019-03-03
María Sol,Corral,mariasolcorral,,2019-03-03
María Sol,Corral,mariasolcorral,necesitar joven espacio carapunguir caminar saludar puerta puerta,2019-03-03
María Sol,Corral,mariasolcorral,ciudad mujer buen,2019-03-03
María Sol,Corral,mariasolcorral,eslogar agusto bandera quito querer ahora quito sonar tambien presto,2019-03-03
María Sol,Corral,mariasolcorral,ver camión recolector basuro publicidad paco moncayo,2019-03-04
María Sol,Corral,mariasolcorral,quito abierto,2019-03-04
María Sol,Corral,mariasolcorral,cesar propuesto ciudad mujer buen nino abuelo persona discapacidad buen,2019-03-04
María Sol,Corral,mariasolcorral,manán junto varios candidato concejal recorrimo caravana call cuidad evidenciar necesidad recibir respaldo gracia carino,2019-03-05
María Sol,Corral,mariasolcorral,invitar seguir entrevista profundizare plan,2019-03-06
María Sol,Corral,mariasolcorral,invitar seguir entrevista profundizare plan,2019-03-06
María Sol,Corral,mariasolcorral,profundidad udla,2019-03-06
María Sol,Corral,mariasolcorral,democracia,2019-03-06
María Sol,Corral,mariasolcorral,dejar correr enlace final peor democracia,2019-03-06
María Sol,Corral,mariasolcorral,quiteno tonto evidente alianza gobierno central ayudar campana soportar descaro ilegalidad senor moncayo deber renunciar candidatura decencia,2019-03-06
María Sol,Corral,mariasolcorral,iniciar dialogo junto candidato alcaldio,2019-03-06
María Sol,Corral,mariasolcorral,iniciar dialogo junto candidato alcaldio,2019-03-06
María Sol,Corral,mariasolcorral,municipio existir 20mil servidor publico obligar potenciar labor mejorar servicio municipal,2019-03-07
María Sol,Corral,mariasolcorral,respetar acuerdo vigente trabajador apoyar plan carrero crecimiento funcionario,2019-03-07
María Sol,Corral,mariasolcorral,necesario evaluacion tecnico plaza empleo acuerdo carga laboral presupuesto siempre concordancia prestacion servicio eficiente calidad,2019-03-07
María Sol,Corral,mariasolcorral,alianza publico privado necesario generar recurso mejorar infraestructura ciudad,2019-03-07
María Sol,Corral,mariasolcorral,necesario evaluacion tecnico plaza empleo acuerdo carga laboral presupuesto siempre concordancia prestacion servicio eficiente calidad,2019-03-07
María Sol,Corral,mariasolcorral,trabajar empresa publica municipal eficient auto sustentabl generador recurso referente nivel nacional,2019-03-07
María Sol,Corral,mariasolcorral,invitar seguir dialogo medio,2019-03-07
María Sol,Corral,mariasolcorral,moncayo continuismo roda mismo equipo segundo parte verdad quiteno deber saber elegir voto,2019-03-07
María Sol,Corral,mariasolcorral,primero grupo candidato candidata participarar estara conformado,2019-03-07
María Sol,Corral,mariasolcorral,propuesto plan propongo revision manejo responsable presupuesto adema generar mayor productividad horario 00pm 00am patente persona natural apoyo sector privado,2019-03-08
María Sol,Corral,mariasolcorral,propuesta proponer crear ciudad perspectivo genero vinculado todo organización social fundación velar derecho mujer manera coordinar mejor proyecto vivienda rós mujer jefa hogar,2019-03-08
María Sol,Corral,mariasolcorral,lograr movilidad sustentable incluyente atenderar todo persona diseno sistema transporte multimodal comenzar reconstruir todo vereda megaciclovio aplicación movil tarjeta pago electronicar,2019-03-08
María Sol,Corral,mariasolcorral,mayor productividad lindo ciudad cambio,2019-03-08
María Sol,Corral,mariasolcorral,valiente creativa emprendedora apasionado intuitiva inspiradora todo mujer desear feliz sigar marcar historia,2019-03-08
María Sol,Corral,mariasolcorral,valiente creativa emprendedora apasionado intuitiva inspiradora todo mujer desear feliz sigar marcar historia,2019-03-08
María Sol,Corral,mariasolcorral,dialogo candidato alcaldio sano manán expusir plan,2019-03-08
María Sol,Corral,mariasolcorral,presente denuncia formal documento probar inequidad ilegalidad cometer campana,2019-03-08
María Sol,Corral,mariasolcorral,evidencia bien publico favor candidato moncayo deber investigado pelea dificil acostumbrado clase lucha exijo igualdad condiciones mismo oportunidad,2019-03-08
María Sol,Corral,mariasolcorral,soportar falta nadie tipo atropello padrino poderoso poder pasar todo norma ley encima quiteno empezar imaginir terminaro reflexionar voto,2019-03-10
María Sol,Corral,mariasolcorral,recorrer calle vicentín exponer propuesto genere productividad dinamismo cuidad,2019-03-10
María Sol,Corral,mariasolcorral,dirigente morador coop venecia informar conversatorio manana regularizacion sector mayor necesidad regularizacion barrio construcción serar prioritario,2019-03-10
María Sol,Corral,mariasolcorral,realmente encontrar preocupado situacion turubamba salubridad inaceptable municipio poder tener quebrado descuidado lleno basura quito salud habitante poder permitir,2019-03-10
María Sol,Corral,mariasolcorral,alcaldio compromiso acabar problema basura primero dias regularizar barrio estar pendiente,2019-03-10
María Sol,Corral,mariasolcorral,hablar propongo ciudad incluyente mejor sistema braile vident poder ciudad excluir discapacitado necesitar construir ciudad,2019-03-11
María Sol,Corral,mariasolcorral,hablar propongo ciudad incluyente mejor sistema braile vident poder ciudad excluir discapacitado necesitar construir ciudad,2019-03-11
María Sol,Corral,mariasolcorral,carino centro historico trabajado ano sector mujer vicealcaldés ciudad necesitar plan contemplar solución real problema capital,2019-03-11
María Sol,Corral,mariasolcorral,enfatacer campán mujer protagonista saber construir capital buen mujer tambien sero buen nino persona tercero edad discapacitado,2019-03-11
María Sol,Corral,mariasolcorral,tema movilidad senalo necesidad aplicar caja comun impulsar forma electronico pago establecer politico tarifaria mediante mesa dialogo llevar adelante sector involucrado,2019-03-11
María Sol,Corral,mariasolcorral,candidata alcaldio plantear propuesta politico tarifaria transporte publico cero estudiante persona discapacidad tercero edad,2019-03-11
María Sol,Corral,mariasolcorral,enfatacer campán mujer protagonista construir capital buen mujer tambien sero nino persona tercero edad discapacitado escucha entrevisto,2019-03-11
María Sol,Corral,mariasolcorral,iniciar manana acompán candidata alcaldio contarno propuesto plar trabajo conectate participar pregunta,2019-03-11
María Sol,Corral,mariasolcorral,proponer mejorar movilidad centro historico eliminar acceso vehiculo municipal sector alcaldiar nadie tendra chofer vehiculo pagado quiteno incentivare exclusivo transporte publico,2019-03-11
María Sol,Corral,mariasolcorral,alcaldio quito abrirar publico hora dia semana todo grande metropolis nivel mundial promover productividad ciudad crearer nuevo plaza trabajar mayor ingreso local comercial,2019-03-11
María Sol,Corral,mariasolcorral,activara cultura centro historico quito permitir apropiacion espacio publico artista gestor cultural calle plazo convertir zona esparcimiento recreacion propio extranjero,2019-03-11
María Sol,Corral,mariasolcorral,necesitar ciudad humano amable inclusivo buen,2019-03-12
María Sol,Corral,mariasolcorral,manán ampliar plan fomentare productividad bienestar armonio poder rescatar nuevamente quitena quiteno sentar orgulloso ciudad,2019-03-12
María Sol,Corral,mariasolcorral,manán chillogallo presente plan vivienda rós propuesta dirigido mujer situacion vulnerabilidad grupos atencion prioritaria propongo construccion 4000 casa mejorar condición vida,2019-03-12
María Sol,Corral,mariasolcorral,recorrido mercado cuadra encontre mujer trabajador sacar familia adelante impulsareno comercio incentivaremos programa regular veta informal,2019-03-12
María Sol,Corral,mariasolcorral,plan buscar potenciar cuidad humano respeto inclusion buen,2019-03-14
María Sol,Corral,mariasolcorral,manán exponer plan dinamismo productividad,2019-03-14
María Sol,Corral,mariasolcorral,conocer trayectoria experiencia,2019-03-15
María Sol,Corral,mariasolcorral,importante saber votar razón,2019-03-15
María Sol,Corral,mariasolcorral,plan vivienda rosa dirigido mujer situacion vulnerabilidad grupos atencion prioritaria,2019-03-15
María Sol,Corral,mariasolcorral,tarde sector solandar llevar plan vivienda rosa cada persona necesitar recibir carino gracia respaldo,2019-03-15
María Sol,Corral,mariasolcorral,tarde pedir exponer plan extendi agradecimientir todo quitena quiteno respaldar,2019-03-15
María Sol,Corral,mariasolcorral,solandar recibir carino respaldo mujer hombr emprendedor anhelar quito productivo bueno plan fomentare productividad ciudad abierto hora ciudad seguro,2019-03-16
María Sol,Corral,mariasolcorral,acabo hora zanahorio proponer ciudad activo transporte seguro hora manera reactivar comercio fomentarar empleo capital,2019-03-16
María Sol,Corral,mariasolcorral,compromiso reactivar ciudad potenciar plaza traves apropiacion espacio publico unimos cada barrio poder lograr cotocollao realizamos mingar morador sector,2019-03-17
María Sol,Corral,mariasolcorral,llamar conciencia mantener limpio parqu vereda poder disfrutar junto familia lugar seguro,2019-03-17
María Sol,Corral,mariasolcorral,plan vivienda rosa mujer jefa hogar luego labor comunitario cotocollao dejar limpiar plazita principal conversar asociacion comerciante morador sector comentar necesidad tener casa propio,2019-03-17
María Sol,Corral,mariasolcorral,propongo construccion vivienda rosa dirigido grupo atencion prioritaria,2019-03-17
María Sol,Corral,mariasolcorral,manán dialoguir recta final campán esperanza lograr productivo seguro igualitario,2019-03-18
María Sol,Corral,mariasolcorral,manán conver recta final campán esperanza lograr productivo seguro igualitario,2019-03-18
María Sol,Corral,mariasolcorral,hijo motor vida inspiracion diario cada lucho conseguir profundamente,2019-03-18
María Sol,Corral,mariasolcorral,manán canal armony music conversar plan mejor opcion cambio necesitar ciudad,2019-03-18
María Sol,Corral,mariasolcorral,metropolitanos bajandonos vallar permiso aprobado pasar,2019-03-19
María Sol,Corral,mariasolcorral,podran hacer trampa podran quitar voto unico podrar vencer gente,2019-03-19
María Sol,Corral,mariasolcorral,plar oportunidad madre jefa hogar grupo vulnerable poder acceder casa propio credito tasa preferencial beneficio inscribete aqui,2019-03-19
María Sol,Corral,mariasolcorral,,2019-03-19
María Sol,Corral,mariasolcorral,mejor respaldo hijo luchar tras nunca dar vencido siempre seguir adelante,2019-03-20
María Sol,Corral,mariasolcorral,hijo aliento detenga amor madre hacia hijo inigualable hijo gracia brindarme fortaleza saber siempre estara lado,2019-03-20
María Sol,Corral,mariasolcorral,gran democracia paco moncayo entrevista minuto solo teleamazona creer tonto,2019-03-20
María Sol,Corral,mariasolcorral,ahora recordar entrevista candidato alcaldia quito converso propuesta deportivo caso ganar alcaldio marzo miralo aqui,2019-03-20
María Sol,Corral,mariasolcorral,siempre cable cruzar foto bonito,2019-03-20
María Sol,Corral,mariasolcorral,atropello candidatura pesar contar aprobación documento necesario publicidad personal actual municipio coloco sello ningun respaldo danar imagen companero detra,2019-03-21
María Sol,Corral,mariasolcorral,noche cerrir campán desigual llenar grande recuerdo experiencia mejor caminar calle ciudad gente ilusion sentir respaldo gracias quitena quiteno gracias apoyo carino,2019-03-21
María Sol,Corral,mariasolcorral,raro carlita parecer super bien apoy candidato desconozca favor luchar mujer vida politico deportiva social,2019-03-21
María Sol,Corral,mariasolcorral,pasar atra,2019-03-21
María Sol,Corral,mariasolcorral,junto hacer historio ciudad recobre identidad bueno,2019-03-21
María Sol,Corral,mariasolcorral,domingo invito parte nuevo historia ciudad junto lograrer votar,2019-03-22
María Sol,Corral,mariasolcorral,,2019-03-23
María Sol,Corral,mariasolcorral,empiezo domingo agradecer dios acompanado madre convencido cada batalla dare corazon biblia decir capaz enfrentar todo prueba vencer poder lograr imposible,2019-03-24
María Sol,Corral,mariasolcorral,candidata alcaldio quito dialogar medio comunicacion votar liceo policial recinto electoral distrito norte,2019-03-24
María Sol,Corral,mariasolcorral,candidata alcaldio quito movimiento ecuatoriano unido partido socialista voto unidad educativo liceo policial norte quito luego consignar voto hacer cuestionamiento proceso electoral,2019-03-24
María Sol,Corral,mariasolcorral,mucho alegria ilusion acabo votar mucho suerte grato conocerlo conociar debatir contrastar deber cambiar ciudad pais forma hacer politico,2019-03-24
María Sol,Corral,mariasolcorral,explicar manipular fotografia mande foto blanco negro,2019-03-24
María Sol,Corral,mariasolcorral,explicar manipular fotografia mande foto blanco negro,2019-03-24
María Sol,Corral,mariasolcorral,caballero gracias saludo correspondido,2019-03-24
María Sol,Corral,mariasolcorral,explicar manipular fotografia mande foto blanco negro,2019-03-24
María Sol,Corral,mariasolcorral,candidata alcaldio quito movimiento ecuatoriano unido partido socialista voto unidad educativo liceo policial norte quito luego consignar voto hacer cuestionamiento proceso electoral,2019-03-24
María Sol,Corral,mariasolcorral,contralorio responder denuncia aceptar municipio ayudar paco,2019-03-24
María Sol,Corral,mariasolcorral,desear exito proximo alcalde quito felicito segundo lugar obtener primero mujer trabajar candidato alcaldio quito,2019-03-25
María Sol,Corral,mariasolcorral,guayaquil primero alcaldesa felicitación,2019-03-25
María Sol,Corral,mariasolcorral,inmenso diferencia corto tiempo,2019-03-25
María Sol,Corral,mariasolcorral,,2019-03-25
María Sol,Corral,mariasolcorral,luchar brazo partido conquistar voto quiteno alcalde nuevo concejo metropolitano fuerzo dios bendigar camino exito quito,2019-03-25
María Sol,Corral,mariasolcorral,poder reir mirar tuit,2019-03-25
María Sol,Corral,mariasolcorral,manda foto favor gracios aviso,2019-04-01
María Sol,Corral,mariasolcorral,quedar propaganda quitar todo responsabilidad dejar espacio publico listo encontro,2019-04-01
María Sol,Corral,mariasolcorral,invitar politico participar ultima elección post esperar limpiamo responsabilidad pego pancarta alto quedar,2019-04-01
María Sol,Corral,mariasolcorral,pactariar gobernabilidad concejo concejal hariar mayorio,2019-04-01
María Sol,Corral,mariasolcorral,poner regla septiembre 2018 registrar movimiento elección ahora gustar resultado,2019-04-01
María Sol,Corral,mariasolcorral,quedar propaganda quitar todo responsabilidad dejar espacio publico listo encontro,2019-04-02
María Sol,Corral,mariasolcorral,ciudad caminar admirar,2019-04-03
María Sol,Corral,mariasolcorral,kennedy poder pasar oficina avisame maria saludo cordial,2019-04-08
María Sol,Corral,mariasolcorral,quitar color plazas parqu poder sentir orgulloso,2019-04-08
María Sol,Corral,mariasolcorral,desastre gestion residuo solido administracion cangrejo,2019-04-10
María Sol,Corral,mariasolcorral,alcalde revisar presupuesto comprometido cuanto quedar 2019 arreglar problema importante querer saber,2019-04-11
María Sol,Corral,mariasolcorral,medellin ciudad diferente quito modelo financiero dista grandemente quito poder medellin quedar cerca visita revise modelo transporte adema profundo componente cultura arte,2019-04-11
María Sol,Corral,mariasolcorral,ordenanza obligo frentista empezar proceso reconstruccion acera emop poder empezar trabajo cobrar predial,2019-04-11
María Sol,Corral,mariasolcorral,soportar ineficiencia sistema gestion residuo cuidad llevar semana recojo basura favor ayuda urgente,2019-04-11
María Sol,Corral,mariasolcorral,gravisimo problema origen dentro emaseo flota camión recolector creer conoscar tema residuo solido,2019-04-11
María Sol,Corral,mariasolcorral,elección estar dado quito escogio alcalde roguer asesore bien plar gobierno creer conoscar residuo solido,2019-04-11
María Sol,Corral,mariasolcorral,estimado alcalde gentil compartir informacion agradecerio entregado presupuesto equipo completo considerar perspectiva genero,2019-04-13
María Sol,Corral,mariasolcorral,esperar experto temo residuo poder seguir,2019-04-13
María Sol,Corral,mariasolcorral,tiempo delicado trabajo sagrado necesitamos politico austeridad,2019-04-14
María Sol,Corral,mariasolcorral,alianza publico privado lograr hacer proyecto envergadurar permitir municipio concentrar recurso servicio basico poder impulsar desarrollo urbano infraestructura turismo traer cosa buena empleo innovacion desarrollo,2019-04-15
María Sol,Corral,mariasolcorral,tuiter nombre jorge yunda enviar mensaje favor aclarar tuit oficial,2019-04-15
María Sol,Corral,mariasolcorral,parecer sencillo embargo serio gran debate idea acerca democracia dinero,2019-04-22
María Sol,Corral,mariasolcorral,empezar debate candidato minuto propuesto imagen,2019-04-22
María Sol,Corral,mariasolcorral,imagen sumar factor personalidad conocimiento desenvolvimiento habilidad presencia espana elegir presidente abril,2019-04-22
María Sol,Corral,mariasolcorral,aaayyy pena querios botox verdad acusalo mama habio mujer relleno hule cabeza rodar paja desierto volar lado movido aire abundar,2019-04-23
María Sol,Corral,mariasolcorral,mejor intervención estudio presupuesto necesario,2019-04-23
María Sol,Corral,mariasolcorral,estar quindes artista ecuatoriano tambien hacer mejor esfuerzo art,2019-05-01
María Sol,Corral,mariasolcorral,solidarizo contigo sensacion horrible querer ciudad vigilado poder hacer 5000 policia ciudad doblar policia metropolitano tener camara vigilancia moderno iluminacion,2019-04-28
María Sol,Corral,mariasolcorral,acaso robo delincuencia abundar quito,2019-04-28
María Sol,Corral,mariasolcorral,robar pleno gonzal suarez,2019-04-28
María Sol,Corral,mariasolcorral,suerte alfredo dele gracias dios preguntelir madre marin magdalén toctiuco bosque pinar alto mismo suerte,2019-04-28
María Sol,Corral,mariasolcorral,sonrisa favor,2019-05-01
