nombre,apellidos,tweet_screen_name,tweet_text,tweet_date
María Sol,Corral,mariasolcorral,problema poder ocasionar grande problema violencio inequidad manejar comercio ambulante migracion analisis,2019-05-05
María Sol,Corral,mariasolcorral,genero fuerte claro ayuda genero ayuda,2019-05-05
María Sol,Corral,mariasolcorral,ayudar ojala solo arupo arbol maravilloso banco semillas pedazos,2019-05-11
María Sol,Corral,mariasolcorral,estimado juan carlos roda populista bien casi politico empresario cargo publico,2019-05-14
María Sol,Corral,mariasolcorral,espiritu cuerpo aqui afrontar enfrentar defenderno tipo violencia mujer nino ancianos ciudad violencia esperaremos nuevo alcalde,2019-05-16
María Sol,Corral,mariasolcorral,dia nuevo alcalde quito problema estrategico ingreso basura lixiviado inseguridad,2019-05-16
