nombre,apellidos,tweet_screen_name,tweet_text,tweet_date
James Byron,Montenegro Ordonez,JamesMcpccs,candidato poner conocimiento plan trabajo experiencia profesional perfil profesional tambien firmar,2019-02-20
James Byron,Montenegro Ordonez,JamesMcpccs,candidato gustario compartir exclusiva audiencia propuesto,2019-02-20
James Byron,Montenegro Ordonez,JamesMcpccs,conocer propuesto llegar radio,2019-02-22
James Byron,Montenegro Ordonez,JamesMcpccs,conocer propuesto llegar radio,2019-02-22
James Byron,Montenegro Ordonez,JamesMcpccs,estare radio acompaname 11h00 programa,2019-02-24
James Byron,Montenegro Ordonez,JamesMcpccs,estare radio acompaname 11h00 programa,2019-02-24
James Byron,Montenegro Ordonez,JamesMcpccs,propuesta compuesto eje designacion autoridad fortalecer participacion ciudadano generar politico publicar lucha corrupcion,2019-02-24
James Byron,Montenegro Ordonez,JamesMcpccs,radio proponer reforma participacion ciudadano permitir consejo dema designar evaluar ratificar destituir autoridad,2019-02-24
James Byron,Montenegro Ordonez,JamesMcpccs,generacion fortalecimiento principio valor trabajar nino nina joven objetivo fortalecer capacidad futuro autoridad,2019-02-24
James Byron,Montenegro Ordonez,JamesMcpccs,fortalecer lucha corrupcion modelo triple helizar poder ejecutivo funcion judicial funcion transparencia control social,2019-02-24
James Byron,Montenegro Ordonez,JamesMcpccs,candidato explico propuesta campán,2019-02-24
James Byron,Montenegro Ordonez,JamesMcpccs,marzo 2019 encuentrame papeleto hombre casillero candidato,2019-02-24
James Byron,Montenegro Ordonez,JamesMcpccs,,2019-02-25
James Byron,Montenegro Ordonez,JamesMcpccs,candidatura responder ningun partido movimiento politico debo ningun gobierno ciudadano ecuatoriano independiente pedir apoyo junto luchaber corrupcion,2019-02-27
James Byron,Montenegro Ordonez,JamesMcpccs,video gracias entrevista propuesta,2019-03-01
James Byron,Montenegro Ordonez,JamesMcpccs,ampoyo incondicional amigo,2019-03-01
James Byron,Montenegro Ordonez,JamesMcpccs,buen lider cambiar mundo,2019-03-01
James Byron,Montenegro Ordonez,JamesMcpccs,papeleto elegir hombre voto hernar ulloa david rosero james montenegro idoneo tres candidatura independiente consejero cpcc aceptar firmar pacto etico compromiso,2019-03-01
James Byron,Montenegro Ordonez,JamesMcpccs,pacto etico compromiso identifico consejero independiente deber elegir marzo 2019 papeleta hombr sero directora,2019-03-04
James Byron,Montenegro Ordonez,JamesMcpccs,,2019-03-06
James Byron,Montenegro Ordonez,JamesMcpccs,compartir propuesta tecnicar gracias contribucion,2019-03-06
James Byron,Montenegro Ordonez,JamesMcpccs,feliz gracia incansable lucha construir mundo justo bueno digno ejemplo fuerza justicia mundir socialmente igual humanamente diferente totalmente libre rosa luxemburgo,2019-03-08
James Byron,Montenegro Ordonez,JamesMcpccs,feliz gracia incansable lucha construir mundo justo bueno digno ejemplo fuerza justicia mundir socialmente igual humanamente diferente totalmente libre rosa luxemburgo,2019-03-08
James Byron,Montenegro Ordonez,JamesMcpccs,deber integrar ciudadano alto formacion profesional trayectoria servicio publico transparencia comprobado accionar gracia difundir listo candidato responder ningun tipo compromiso politico,2019-03-11
James Byron,Montenegro Ordonez,JamesMcpccs,,2019-03-12
James Byron,Montenegro Ordonez,JamesMcpccs,james montenegro candidatura nominado papeleto hombre consejero independiente dentro pacto etico compromiso propuesto candidatura consejero independiente perfil video presentacion,2019-03-12
James Byron,Montenegro Ordonez,JamesMcpccs,respaldo candidatura consejero independiente aceptado firmar pacto etico compromiso,2019-03-12
James Byron,Montenegro Ordonez,JamesMcpccs,mejor proponer desaparezca cuna grande corrupcion negociado candidato nomino,2019-03-12
James Byron,Montenegro Ordonez,JamesMcpccs,marzo cuento apoyo junto construirer sonar justo inclusivo solidario libre encuentrame paletar hombre segundo fila izquierdo aderecha casillero,2019-03-12
James Byron,Montenegro Ordonez,JamesMcpccs,mantendre informado,2019-03-14
James Byron,Montenegro Ordonez,JamesMcpccs,candidato conocer atribución seguir link deber informar votar odio votar fanatismo existir candidato transparenciar comprobado,2019-03-14
James Byron,Montenegro Ordonez,JamesMcpccs,mujer hombr pueblo nacionalidad,2019-03-18
James Byron,Montenegro Ordonez,JamesMcpccs,garantizar potencie fortalecimiento institucional permitir desaparecer pierda capacidad designar autoridad control luche corrupcion,2019-03-18
James Byron,Montenegro Ordonez,JamesMcpccs,representar zona candidatura,2019-03-18
James Byron,Montenegro Ordonez,JamesMcpccs,atento escuchar propuesta candidato probado comprobado,2019-03-20
James Byron,Montenegro Ordonez,JamesMcpccs,entrevistar james montenegro candidatura contacto directo miercol marzo 2019 promover voto candidatura consejero independiente pacto etico compromiso defiendar,2019-03-20
James Byron,Montenegro Ordonez,JamesMcpccs,candidato cpccs votar nulo desperdiciar voto,2019-03-20
James Byron,Montenegro Ordonez,JamesMcpccs,votar nulo entregar atribución seguir negociar pai,2019-03-20
James Byron,Montenegro Ordonez,JamesMcpccs,gracias difundir candidatura conocer propuesta saber papeleta numero encuentrame segundo fila casillero marzo cuento apoyo,2019-03-21
James Byron,Montenegro Ordonez,JamesMcpccs,gracias difundir candidatura conocer propuesta saber papeleta numero encuentrame segundo fila casillero marzo cuento apoyo,2019-03-21
James Byron,Montenegro Ordonez,JamesMcpccs,mujer inteligente voto nulo irresponsabilidad marzo,2019-03-21
James Byron,Montenegro Ordonez,JamesMcpccs,marzo oportunidad escribir nuevo capitulo historio ecuador aspirar primero indigena eleccion popular llegar luchar corrupcion devolver esperanza dia mejor todo ecuatoriano,2019-03-22
James Byron,Montenegro Ordonez,JamesMcpccs,manán primero elegir consejero voto popular acudar urna defender ganado constitucion 2008 quinto poder encuentrame papeleto hombre segundo fila casillero cuento contigo,2019-03-23
James Byron,Montenegro Ordonez,JamesMcpccs,eliminar sera segundo momento realidad vera manana acudar urna defender ganado constitucion 2008 votarir pueblo nacionalidad,2019-03-24
James Byron,Montenegro Ordonez,JamesMcpccs,despues pronunciamientir ahora nunca acudar urna defender ganado constitucion 2008 voter candidato atadura politica dispuesto luchar corrupcion cuento apoyo,2019-03-24
James Byron,Montenegro Ordonez,JamesMcpccs,manán primero elegir consejero voto popular acudar urna defender ganado constitucion 2008 quinto poder encuentrame papeleto hombre segundo fila casillero cuento contigo,2019-03-24
James Byron,Montenegro Ordonez,JamesMcpccs,voto consejero ser,2019-03-24
James Byron,Montenegro Ordonez,JamesMcpccs,allo travesura campear elección respetar autoridad electo nuevo aquel servir beneplacito transitorio querer meter mano voluntad popular manoseada decidar cuidado,2019-03-28
