nombre,apellidos,tweet_screen_name,tweet_text,tweet_date
Carlos,Sevilla,SevilaCarlos,ponte camisetar ciudad cuidemos junto patrimonio ciudadequipo sevillaalcaldeuio libertadespueblo lista9,2019-02-17
Carlos,Sevilla,SevilaCarlos,ir recuperar organizacion barrial hacer ciudadequipo sevillaalcaldeuio libertadespueblo lista9,2019-02-17
Carlos,Sevilla,SevilaCarlos,cultura vial via serar seguro trabajar ciudadequipo accident via sevillaalcaldeuio libertadespueblo lista9,2019-02-18
Carlos,Sevilla,SevilaCarlos,ir gobernar sector gobernarer ciudadequipo sevillaalcaldeuio libertadespueblo lista9,2019-02-19
Carlos,Sevilla,SevilaCarlos,ayuda sumar voluntad lograremos construir ciudad moderno desear sevillaalcaldeuio libertadespueblo lista9,2019-02-19
Carlos,Sevilla,SevilaCarlos,conociendoalcandidatir alcaldiaquito continuacion propuesto sevilacarlo decision2019,2019-02-23
Carlos,Sevilla,SevilaCarlos,ciudadequipo quito ciudad oportunidad junto poder generar bienestar calidad vida sevillaalcaldeuio libertadespueblo lista9,2019-02-19
Carlos,Sevilla,SevilaCarlos,ciudadequipo agendir actividad llevar cabo profesevilla manán sevillaalcaldeuio libertadespueblo lista9,2019-02-20
Carlos,Sevilla,SevilaCarlos,ciudadequipo creer juventud ir apoyar dotandol herramienta necesario poder sacar adelante emprendimiento sevillaalcaldeuio libertadespueblo lista9,2019-02-20
Carlos,Sevilla,SevilaCarlos,junto trabajar ciudadequipo lograrar construir ciudad moderno desear ciudad sevillaalcaldeuio libertadespueblo lista9,2019-02-20
Carlos,Sevilla,SevilaCarlos,ciudadequipo presentamos agenda profesevilla manán jueves sevillaalcaldeuio libertadespueblo lista9,2019-02-21
Carlos,Sevilla,SevilaCarlos,ciudadequipo capacitacion fundamental sevillaalcaldeuio libertadespueblo lista9,2019-02-21
Carlos,Sevilla,SevilaCarlos,dedicacion paciencia constancia hacer sumamente especial feliz medico ecuatoriano ciudadequipo libertadespueblo lista9,2019-02-21
Carlos,Sevilla,SevilaCarlos,ciudadequipo agendir actividad llevar cabo profesevilla manán sevillaalcaldeuio libertadespueblo lista9,2019-02-22
Carlos,Sevilla,SevilaCarlos,ciudadequipo quito trabajaremos pensar bienestar sevillaalcaldeuio libertadespueblo lista9,2019-02-22
Carlos,Sevilla,SevilaCarlos,ciudadequipo ir trabajar movilidad eficiente incluyente respetuoso sevillaalcaldeuio libertadespueblo lista9,2019-02-22
Carlos,Sevilla,SevilaCarlos,ponte camisetar ciudad hacer junto ciudadequipo sevillaalcaldeuio libertadespueblo lista9,2019-02-23
Carlos,Sevilla,SevilaCarlos,ciudadequipo ir trabajar garantizar seguridad peatón sevillaalcaldeuio libertadespueblo lista9,2019-02-23
Carlos,Sevilla,SevilaCarlos,ponte camisetar ciudad hacer junto ciudadequipo sevillaalcaldeuio libertadespueblo lista9,2019-02-23
Carlos,Sevilla,SevilaCarlos,ciudadequipo generarar evento deportivo cultural espacio publico comunidad apropie lugar cuidir sevillaalcaldeuio libertadespueblo lista9,2019-02-23
Carlos,Sevilla,SevilaCarlos,conociendoalcandidato alcaldiaquito conozcar perfil candidato alcaldio movimiento libertad pueblo sevilacar él decision2019,2019-02-23
Carlos,Sevilla,SevilaCarlos,ciudadequipo gestion transparente mano limpio sevillaalcaldeuio libertadespueblo lista9,2019-02-23
Carlos,Sevilla,SevilaCarlos,ciudadequipo quito ciudad oportunidades trabajo buen vecino sevillaalcaldeuio libertadespueblo lista9,2019-02-23
Carlos,Sevilla,SevilaCarlos,buen inicio semana construyar junto ciudadequipo sevillaalcaldeuio libertadespueblo lista9,2019-02-25
Carlos,Sevilla,SevilaCarlos,ir devolver ciudad institucion respeto servicio interés habitante ciudadequipo sevillaalcaldeuio libertadespueblo lista9,2019-02-25
Carlos,Sevilla,SevilaCarlos,quito ciudad oportunidad trabajo futuro sevillaalcaldeuio libertadespueblo lista9,2019-02-26
Carlos,Sevilla,SevilaCarlos,noche compartir amigo dirigente federacion liga barrial quito grato juntar él persona comprometido serar fundamental construccion ciudadequipo sevillaalcaldeuio libertadespueblo lista9,2019-02-26
Carlos,Sevilla,SevilaCarlos,ponte camisetar ciudad hacer junto ciudadequipo sevillaalcaldeuio libertadespueblo lista9,2019-02-26
Carlos,Sevilla,SevilaCarlos,ciudadequipo ir poner alto delincuencia sevillaalcaldeuio libertadespueblo lista9,2019-02-27
Carlos,Sevilla,SevilaCarlos,trabajar junto construirer ciudadequipo sevillaalcaldeuio libertadespueblo lista9,2019-02-27
Carlos,Sevilla,SevilaCarlos,ciudadequipo responsabilidad compromiso apoyar talento artista representar pais respalder dayanara peralto loor festival vín dayanarasisepuedir vina2019,2019-02-27
Carlos,Sevilla,SevilaCarlos,ciudadequipo invito seguir vivo entrevista radio quito manán 07h00 podran conocer propuesta ciudad sevillaalcaldeuio libertadespueblo lista9,2019-02-28
Carlos,Sevilla,SevilaCarlos,recorrer centro quito encontre recibimiento especial cuento apoyo construir junto ciudadequipo gente amable honesta comprometido sevillaalcaldeuio libertadespueblo lista9,2019-02-28
Carlos,Sevilla,SevilaCarlos,buen jueves todo ciudadequipo sevillaalcaldeuio libertadespueblo lista9,2019-02-28
Carlos,Sevilla,SevilaCarlos,iniciar megacaraván unidad alegrio luchar lista9 libertadespueblo unido ciudadequipo lograremos construir quito oportunidad trabajo futuro sevillaalcaldeuio consevillaquitobrilla,2019-02-28
Carlos,Sevilla,SevilaCarlos,ciudadequipo alegria recorrimo quito megacaraván pudir disfrutar carino respaldo compromiso vecino cada querer ciudad moderno oportunidad futuro sevillaalcaldeuio libertadespueblo lista9,2019-03-01
Carlos,Sevilla,SevilaCarlos,excelente viernes ciudadequipo sevillaalcaldeuio libertadespueblo lista9,2019-03-01
Carlos,Sevilla,SevilaCarlos,felicitar dayanar peraltar impactarno talento cautivarno magistral presentacion ecuador apoyar admirar perseverancia entrega festival vín ecuadorcontigo,2019-03-01
Carlos,Sevilla,SevilaCarlos,excelente viernes ciudadequipo sevillaalcaldeuio libertadespueblo lista9,2019-03-01
Carlos,Sevilla,SevilaCarlos,excelente viernes ciudadequipo sevillaalcaldeuio libertadespueblo lista9,2019-03-01
Carlos,Sevilla,SevilaCarlos,trabajar construir ciudad oportunidad trabajo futuro recorrer cumbayar recibir carino compromiso gente armar ciudadequipo sevillaalcaldeuio libertadespueblo lista9,2019-03-02
Carlos,Sevilla,SevilaCarlos,ciudadequipo excelente semana compania ser querido sevillaalcaldeuio libertadespueblo lista9,2019-03-03
Carlos,Sevilla,SevilaCarlos,excelente domingo ciudadequipo sevillaalcaldeuio libertadespueblo lista9,2019-03-03
Carlos,Sevilla,SevilaCarlos,buen lunes ciudadequipo sevillaalcaldeuio libertadespueblo lista9,2019-03-04
Carlos,Sevilla,SevilaCarlos,feliz martes todo ciudadequipo sevillaalcaldeuio libertadespueblo lista9,2019-03-05
Carlos,Sevilla,SevilaCarlos,preguntar disfruto etapa vido dirar fortalecer lazo amistad confianza ciudadequipo agradecido respaldo quiteno sumar construir ciudad moderno oportunidad trabajo futuro,2019-03-06
Carlos,Sevilla,SevilaCarlos,excelente miercol ciudadequipo sevillaalcaldeuio libertadespueblo lista9,2019-03-06
Carlos,Sevilla,SevilaCarlos,excelente miercol ciudadequipo sevillaalcaldeuio libertadespueblo lista9,2019-03-06
Carlos,Sevilla,SevilaCarlos,agradecer click radio udla udla quito invitacion programa elecciones2019 cada juntamo construir quito oportunidad trabajo futuro ciudadequipo sevillaalcaldeuio libertadespueblo lista9,2019-03-06
Carlos,Sevilla,SevilaCarlos,ciudadequipo invito seguir vivo entrevista telerama quito manán 07h00 conocerar propuesta construir ciudad moderno mire frente futuro sevillaalcaldeuio libertadespueblo lista9,2019-03-07
Carlos,Sevilla,SevilaCarlos,excelente jueves todo ciudadequipo sevillaalcaldeuio libertadespueblo lista9,2019-03-07
Carlos,Sevilla,SevilaCarlos,gracias hacer ciudadequipo lugar especial ternura valentio perseverancia feliz mujer sevillaalcaldeuio libertadespueblo lista9,2019-03-08
Carlos,Sevilla,SevilaCarlos,municipio honesto mano limpio servidor comprometido quito posible ciudadequipo sevillaalcaldeuio libertadespueblo lista9,2019-03-08
Carlos,Sevilla,SevilaCarlos,noche comparti entrevista ameno david silva marcela caicedo programa sportvec telesuceso quito siempre bueno exponer propuesta invitar quiteno sumir ciudadequipo sevillaalcaldeuio libertadespueblo lista9,2019-03-09
Carlos,Sevilla,SevilaCarlos,excelente semana disfrutenlo junto ser querido ciudadequipo sevillaalcaldeuio libertadespueblo lista9,2019-03-09
Carlos,Sevilla,SevilaCarlos,ir trabajar ciudadequipo junto lograremos construir quito moderno oportunidad futuro visitar feria auto guamani agradecido acogido respaldo brindar sevillaalcaldeuio libertadespueblo lista9,2019-03-09
Carlos,Sevilla,SevilaCarlos,ciudadequipo encontrarer mejor alternativa fortalecer municipio sevillaalcaldeuio libertadespueblo lista9,2019-03-09
Carlos,Sevilla,SevilaCarlos,compartir tarde emotivo concejal lista9 gente nuevo respaldo quiteno ir construir quito moderno oportunidad trabajo futuro ciudadequipo sevillaalcaldeuio libertadespueblo,2019-03-10
Carlos,Sevilla,SevilaCarlos,feliz domingo todo ciudadequipo sevillaalcaldeuio libertadespueblo lista9,2019-03-10
Carlos,Sevilla,SevilaCarlos,visitar parroquia cutuglaguo senti carino gente compartir tarde emotivo musico baile amigo ciudadequipo sevillaalcaldeuio libertadespueblo lista9,2019-03-10
Carlos,Sevilla,SevilaCarlos,buen inicio semana ciudadequipo sevillaalcaldeuio libertadespueblo lista9,2019-03-11
Carlos,Sevilla,SevilaCarlos,agradecido wilson moposito radio sonorama permitirme conocer ciudadequipo propuestas quito junto ir construir ciudad moderno oportunidad futuro sevillaalcaldeuio libertadespueblo lista9,2019-03-11
Carlos,Sevilla,SevilaCarlos,excelente martes todo ciudadequipo sevillaalcadeuio libertadespueblo lista9,2019-03-12
Carlos,Sevilla,SevilaCarlos,compartir noche dialogo junto andr pasquel candidato lista8 programa directoalgrano choclo politico agradecer iir ulchur rota invitacion permitirme conocer propuesta ciudadequipo,2019-03-13
Carlos,Sevilla,SevilaCarlos,excelente miercol ciudadequipo sevillaalcadeuio libertadespueblo lista9,2019-03-13
Carlos,Sevilla,SevilaCarlos,disfrutir dialogar milton perez veronico larreo radio suceso musico excepcional agradecer invitacion programa noticierosuceso trabajaremos ciudadequipo construir quito moderno oportunidad futuro sevillaalcaldeuio,2019-03-13
Carlos,Sevilla,SevilaCarlos,trabajar junto construirer ciudadequipo sevillaalcaldeuio libertadespueblo lista9,2019-03-14
Carlos,Sevilla,SevilaCarlos,queproponir candidato alcaldia listo sevilacarlos plantear fomentar turismo generador empleo foto lahoraecuador,2019-03-15
Carlos,Sevilla,SevilaCarlos,construyar junto ciudadequipo sevillaalcaldeuio libertadespueblo lista9,2019-03-15
Carlos,Sevilla,SevilaCarlos,vida lleno prueba rendir él opcion comparti joven grupo futbol amputado ecuador joven pesar condición sonrien vida motivo seguir siempre adelante cualquiera adversidad ciudadequipo,2019-03-15
Carlos,Sevilla,SevilaCarlos,recorrimos sector cotocollao gratificante recibir carino compromiso gente apoyo cada integramo ciudadequipo sevillaalcadeuio libertadespueblo lista9,2019-03-16
Carlos,Sevilla,SevilaCarlos,anoche recorri barrio representativo quitar nuevo aurora martha bucaram gracias confianza respaldo brindar seguro apoyo ir construir ciudad moderno oportunidad futuro ciudadequipo,2019-03-16
Carlos,Sevilla,SevilaCarlos,orgullo haber ser parte incorporacion cuatro nuevo profesional felicito dedicacion esfuerzo deseo vida seguir cosechar triunfo graciar centro investigacion produccion pedagogico invitacion ciudadequipo,2019-03-16
Carlos,Sevilla,SevilaCarlos,gracias programa latrinka993 radio areo deportivo invitacion disfrutar compartir tú unido ciudadequipo lograremos construir quito moderno oportunidad futuro sevillaalcaldeuio libertadespueblo lista9,2019-03-16
Carlos,Sevilla,SevilaCarlos,recorrimos parque carolín compartir manán alegrio sumar voluntad construccion ciudadequipo gratificante sentir respaldo carino compromiso quiteno,2019-03-16
Carlos,Sevilla,SevilaCarlos,excelente domingo ciudadequipo sevillaalcaldeuio libertadespueblo lista9,2019-03-17
Carlos,Sevilla,SevilaCarlos,gracias radio areadeportivafm permitir yo exponer propuesta ciudadequipo junto construirer quito moderno oportunidad futuro sevillaalcaldeuio libertadespueblo lista9,2019-03-17
Carlos,Sevilla,SevilaCarlos,gracia estimado victor hugo quishpe invitacion radio siempre bueno exponer propuesta ciudadequipo cada unimos construir quito moderno oportunidad futuro sevillaalcaldeuio libertadespueblo,2019-03-17
Carlos,Sevilla,SevilaCarlos,jornada barrio visite argelia senti compromiso gente trabajar salir adelante administracion poner especial enfasis generar oportunidad devolver confianza vecino,2019-03-18
Carlos,Sevilla,SevilaCarlos,armar ciudadequipo gestion motivo comparti vecino ciudad futuro enorgullecer saber cada persona sumar construir quito oportunidad trabajo futuro sevillaalcaldeuio libertadespueblo,2019-03-18
Carlos,Sevilla,SevilaCarlos,visitir liga barrial enero gratificante compartir grande amigo dejar futbol emocionante saber respladan construccion ciudadequipo sevillaalcaldeuio libertadespueblo lista9,2019-03-18
Carlos,Sevilla,SevilaCarlos,recorrer barrio escuchar gente necesidad cada comprometido quito ciudad ciudadequipo sevillaalcadeuio libertadespueblo lista9,2019-03-18
Carlos,Sevilla,SevilaCarlos,excelente lunes ciudadequipo sevillaalcaldeuio libertadespueblo lista9,2019-03-18
Carlos,Sevilla,SevilaCarlos,notimundoalacarta acompán sevilacarlos candidato alcaldia quito libertad pueblo presentar plan trabajo trayectoria politico rumboalaalcaldiadequito elección 2019 escuchano fmmundo,2019-03-19
Carlos,Sevilla,SevilaCarlos,sevilacar él venir grupo gente preparado europa ayudarno resolver problema ciudad rumboalaalcaldiadequito elecciones2019 notimundoestelar,2019-03-19
Carlos,Sevilla,SevilaCarlos,excelente martes ciudadequipo sevillaalcaldeuio libertadespueblo lista9,2019-03-19
Carlos,Sevilla,SevilaCarlos,junto construirer ciudadequipo marzo votatodo9 sevillaalcaldeuio libertadespueblo lista9,2019-03-22
Carlos,Sevilla,SevilaCarlos,gracias carino confianza brindado parte grata inolvidable experiencia ir trabajar junto ciudadequipo marzo votatodo9,2019-03-23
Carlos,Sevilla,SevilaCarlos,buen semana solidaridad familia afectado aluvion ayer fuerte lluvia ultimos dia ciudadequipo sevillalcaldeuio libertadespueblo lista9,2019-03-23
Carlos,Sevilla,SevilaCarlos,depender cambio junto construirer ciudadequipo marzo votatodo9 sevillaalcaldeuio libertadespueblo lista9,2019-03-23
Carlos,Sevilla,SevilaCarlos,manán 08h00 elprofesevilla llegar colegio militar eloy alfaro sufragar construccion ciudadequipo manos marzo votatodo9 sevillaalcaldeuio libertadespueblo lista9,2019-03-23
