nombre,apellidos,tweet_screen_name,tweet_text,tweet_date
José Carlos,Tuarez Zambrano,jcarlostuarez,seguir recorrer hermoso provincia rio jornado medio quevedo ser entrevistar comparti propuesto compromiso velar estabilidad cuidado familia,2019-02-19
José Carlos,Tuarez Zambrano,jcarlostuarez,fiscalizaremos recurso ingresar cada provincia designar autoridad cumplido debido concurso merito oposicion compromiso ciudadania quevedo resto pai,2019-02-19
José Carlos,Tuarez Zambrano,jcarlostuarez,claudicare seguir luchar junto ecuatoriano pai trasparente existir oportunidad cada ecuatoriano importar apellido condicion social procedencia mensaje comparti radio quevedo,2019-02-19
José Carlos,Tuarez Zambrano,jcarlostuarez,manabi provincia natal encuentro recorrer temprana hora varios medio comunicacion primero medio comparti propuesta,2019-02-22
José Carlos,Tuarez Zambrano,jcarlostuarez,dejaremos pais seguir silencio luchar junto corrupcion comparti ecuatoriano propuesto compromiso construir junto mejor pai,2019-02-22
José Carlos,Tuarez Zambrano,jcarlostuarez,tarde recibido instalación comparti opinión situacion pai proceso electoral propuesto,2019-02-22
José Carlos,Tuarez Zambrano,jcarlostuarez,finalizar espectacular jornada invitados estudio hablar propuesta motivación llevar parte proceso electoral,2019-02-22
José Carlos,Tuarez Zambrano,jcarlostuarez,votar padre tuarez consejo participacion ciudadano control social buscalo papeleto hombre cuello clerical,2019-02-22
José Carlos,Tuarez Zambrano,jcarlostuarez,seguir manabi bello provincia comunicare ciudadano propuesto opinión continuacion presento agenda medio viernes febrero,2019-02-22
José Carlos,Tuarez Zambrano,jcarlostuarez,dio guardar hermano ecuatoriano diferente provincia bendecido patria esperar quite ningun amado,2019-02-22
José Carlos,Tuarez Zambrano,jcarlostuarez,agradecer invitacion grato recibimiento trabajar olvidado sere,2019-02-22
José Carlos,Tuarez Zambrano,jcarlostuarez,gracia maravilloso recibido calidez vigilar recurso destinado diferente sector evitar sobreprecio,2019-02-22
José Carlos,Tuarez Zambrano,jcarlostuarez,felicitación sentir gusto provincia apoyamos siempre seguir hacer buen campana,2019-02-22
José Carlos,Tuarez Zambrano,jcarlostuarez,estimado amigo excelente inicio semana seguir informado comparto agendir actividad manán febrero realizar hermoso provincia guaya,2019-02-25
José Carlos,Tuarez Zambrano,jcarlostuarez,saludo estimado amigo bello productivo comenzar actividad guaya encontrar compartir propuesta mejor junto pai,2019-02-25
José Carlos,Tuarez Zambrano,jcarlostuarez,bendición padre humano excepcional abrazo fuerte distancia,2019-02-25
José Carlos,Tuarez Zambrano,jcarlostuarez,instalación ecuador directo compartido fuerte sincero dialogo importancia comprometo ecuatoriano luchar transparencia largo vida,2019-02-25
José Carlos,Tuarez Zambrano,jcarlostuarez,parar seguir compartir propuesta opinión importancia pais ser silenciar callare nunca compromiso ecuatoriano,2019-02-25
José Carlos,Tuarez Zambrano,jcarlostuarez,estimado padre votare usted contar manabita lindo dio bendiga padre,2019-02-25
José Carlos,Tuarez Zambrano,jcarlostuarez,estimado padre llegar electo esperar ayudar reconstruir institucionalidad pais destruir diestro siniestra moreno,2019-02-25
José Carlos,Tuarez Zambrano,jcarlostuarez,padre dios guie proteger buen inicio semán fuerza ecuador decente solidario contar voto apoyo siempre,2019-02-25
José Carlos,Tuarez Zambrano,jcarlostuarez,deber luchar verdad junto hacer mejor pai junto nuevo invito seguir entrevista compartir contacto,2019-02-25
José Carlos,Tuarez Zambrano,jcarlostuarez,votar conviccion futuro familia comparto sentimiento rechazo dirigente organización social guaya junto rechazar eliminacion,2019-02-26
José Carlos,Tuarez Zambrano,jcarlostuarez,hacer culmine ferviente grata reunion gremio profesional distrito compartir diverso opinión importancia escuche necesidad noble grupo,2019-02-26
José Carlos,Tuarez Zambrano,jcarlostuarez,dejar componenda politica seguir danar ecuador votemos decencia casillero hombre cpccs,2019-02-26
José Carlos,Tuarez Zambrano,jcarlostuarez,reunion candidato concejero dar conocer problematica sector aportar propuesta gracia sector contar usted,2019-02-26
José Carlos,Tuarez Zambrano,jcarlostuarez,excelente tendencia padre carlos tuarez cpccs votar casillero,2019-02-26
José Carlos,Tuarez Zambrano,jcarlostuarez,calido provincia guaya informo agenda medio febrero invito compartir informe junto llever mensaje unidad verdadero,2019-02-26
José Carlos,Tuarez Zambrano,jcarlostuarez,motivacion padre fuerza hogar madre familia hijo inspirar comprometo luchar familia,2019-02-26
José Carlos,Tuarez Zambrano,jcarlostuarez,espectacular revista online encuentro compartir ameno dialogo motivación propuesto invito compartir disfrutir encuentro,2019-02-26
José Carlos,Tuarez Zambrano,jcarlostuarez,querer pais abundir sonrisa escaseir lagrima honesto unido vencer invito construyar junto gran historia,2019-02-26
José Carlos,Tuarez Zambrano,jcarlostuarez,luchar junto dejarar silenciado compromiso todo ciudadania,2019-02-26
José Carlos,Tuarez Zambrano,jcarlostuarez,tambien palabra ciudadano honesto estar cansado silenciado comparti propuesto mensaje apoyo union ciudadano duran,2019-02-27
José Carlos,Tuarez Zambrano,jcarlostuarez,seguir luchar fuerte transparente hacer varios hora dialoguir propuesta organismo,2019-02-27
José Carlos,Tuarez Zambrano,jcarlostuarez,seguir luchar fuerte transparente hacer varios hora dialoguir propuesta organismo,2019-02-27
José Carlos,Tuarez Zambrano,jcarlostuarez,canal daule comparti propuesto opinión junto lograr dar transparencia pai,2019-02-27
José Carlos,Tuarez Zambrano,jcarlostuarez,estimado amigo excelente feliz miercol febrero compartir agenda medio actividad realizar todo bello provincia santa elena invito compartir informe,2019-02-27
José Carlos,Tuarez Zambrano,jcarlostuarez,estimado amigo excelente feliz miercol febrero compartir agenda medio actividad realizar todo bello provincia santa elena invito compartir informe,2019-02-27
José Carlos,Tuarez Zambrano,jcarlostuarez,interés cura ateo tuit tuarez gano voto,2019-02-27
José Carlos,Tuarez Zambrano,jcarlostuarez,saludo amigo empiezo conocer bello provincia candidatura luchar amor familia recuperar valor vida,2019-02-27
José Carlos,Tuarez Zambrano,jcarlostuarez,poner permitir poco robir recurso esperanza poder politico estar promover humilde pueblo pobre permitir rico decir pobre diremos,2019-02-27
José Carlos,Tuarez Zambrano,jcarlostuarez,radio enlacir ciudadano solucionar queja pedido denuncia,2019-02-27
José Carlos,Tuarez Zambrano,jcarlostuarez,poner permitir poco robir recurso esperanza poder politico estar promover humilde pueblo pobre permitir traidor decir poder ciudadano dirar,2019-02-27
José Carlos,Tuarez Zambrano,jcarlostuarez,ninguno tendencia politico derecho izquierdo candidatura padre trabajador madre luchador hijo comprometido estudios amor vida familio respondo ningun movimiento politico,2019-02-27
José Carlos,Tuarez Zambrano,jcarlostuarez,buen candidato carlos votario papeleto hombre tres padre servicio gente todo vida inteligente resultado probo bueno anuler voto cpccs definitivo saludo,2019-02-27
José Carlos,Tuarez Zambrano,jcarlostuarez,luchar valor valentio firmeza honor defenderar interés,2019-02-27
José Carlos,Tuarez Zambrano,jcarlostuarez,promover igualdad derechos participacion ciudadano decisión tomar sera principal propuesta,2019-02-27
José Carlos,Tuarez Zambrano,jcarlostuarez,promover igualdad derechos participacion ciudadano decisión tomar sera principal propuesta,2019-02-27
José Carlos,Tuarez Zambrano,jcarlostuarez,estimado amigo excelente feliz miercol febrero compartir agenda medio actividad realizar todo bello provincia santa elena invito compartir informe,2019-02-27
José Carlos,Tuarez Zambrano,jcarlostuarez,agradecer hombre mujer valiente conmemoramos victoria saludo respeto,2019-02-27
José Carlos,Tuarez Zambrano,jcarlostuarez,poner disposicion hermoso candidatura servido siempre trayectoria basado hacer falta,2019-02-27
José Carlos,Tuarez Zambrano,jcarlostuarez,correista afirmo usted ecuatoriano,2019-02-27
José Carlos,Tuarez Zambrano,jcarlostuarez,esperar despues analisis poder contar respaldo venir labor social resentimiento politico bendición,2019-02-27
José Carlos,Tuarez Zambrano,jcarlostuarez,prentendir pueblo tendencia perdure contar astucia defenderir unica unico poder poder penetrar cualquiera sector apoyo respaldo,2019-02-27
José Carlos,Tuarez Zambrano,jcarlostuarez,manán provincia estare recorrer varios medio comunicacion compartir ciudadania propuesto compromiso mejor pais comparto agenda medio jueves febrero,2019-02-28
José Carlos,Tuarez Zambrano,jcarlostuarez,buen amigo conocer mucho humildad candidatura hermano orens,2019-02-28
José Carlos,Tuarez Zambrano,jcarlostuarez,luchar promover pueblo ecuatoriano empoderamiento unido salver bello tanto,2019-02-28
José Carlos,Tuarez Zambrano,jcarlostuarez,luchar promover pueblo ecuatoriano empoderamiento unido salver bello tanto,2019-02-28
José Carlos,Tuarez Zambrano,jcarlostuarez,saludo cantón machalar arenilla atahualpa balsa chilla guabo huaquilla laja marcabeli pasaje pina portovelo santa rosa zaruma pongo disposicion humilde candidatura,2019-02-28
José Carlos,Tuarez Zambrano,jcarlostuarez,continuo ardua tarea firmezar compromiso vote,2019-02-28
José Carlos,Tuarez Zambrano,jcarlostuarez,continuo ardua tarea firmezar compromiso vote,2019-02-28
José Carlos,Tuarez Zambrano,jcarlostuarez,gracias atender poder conocer candidatura ciudadano servicio favor familia valor,2019-02-28
José Carlos,Tuarez Zambrano,jcarlostuarez,saludo encuentro conocer hermano propuesto candidatura ciudadano unido hijo poner,2019-02-28
José Carlos,Tuarez Zambrano,jcarlostuarez,culmino jornado enfasis indico compromiso recuperar tanto falta hacer,2019-03-01
José Carlos,Tuarez Zambrano,jcarlostuarez,saludo amigo inicio mucho gana luchare enlace ciudadania solicitud queja atendido manera oportuno eficiencia transparencia,2019-03-01
José Carlos,Tuarez Zambrano,jcarlostuarez,provincia recorrerir varios medio comunicacion compartir ciudadania propuesto compromiso mejor pais comparto agenda medio marzo,2019-03-01
José Carlos,Tuarez Zambrano,jcarlostuarez,continuo preguntar motivo candidato motivo familia padre primero salir casa ultimo llegar madre primero despertar despedir hijo esposo ultimo acostar,2019-03-01
José Carlos,Tuarez Zambrano,jcarlostuarez,provincia recorrerir varios medio comunicacion mantendre dialogo ciudadania propuesto compromiso mejor pais comparto agenda medio marzo,2019-03-01
José Carlos,Tuarez Zambrano,jcarlostuarez,provincia hablarar varios medio comunicacion gremios mantendre dialogo ciudadania propuesto compromiso mejor pais comparto agenda medio marzo,2019-03-01
José Carlos,Tuarez Zambrano,jcarlostuarez,sere territorio solo promoverir sesión todo provincia representante diferente organismo escuchar queja propuesto,2019-03-01
José Carlos,Tuarez Zambrano,jcarlostuarez,recuerdir siempre poder tropezar deber caer poder llorar deber perder poder feliz bastar vivir inspiracion junto construirer mejor ecuador gracias apoyo feliz feriado feliz carnaval,2019-03-02
José Carlos,Tuarez Zambrano,jcarlostuarez,recuerdir siempre poder tropezar deber caer poder llorar deber perder poder feliz bastar vivir inspiracion junto construirer mejor ecuador gracias apoyo feliz feriado feliz carnaval,2019-03-02
José Carlos,Tuarez Zambrano,jcarlostuarez,querer pais abundir sonrisa escaseir lagrima honesto unido vencer invito construyar junto gran historia,2019-03-02
José Carlos,Tuarez Zambrano,jcarlostuarez,termino feriado manán vuelvo natal provincia manabi seguir compartir ciudadania compromiso construir junto mejor pai,2019-03-06
José Carlos,Tuarez Zambrano,jcarlostuarez,gracias provincia querer compartir sincero mensaje agradecimiento realizar todo ciudadania hacer dia recordandol siempre compromisir cada ciudadano noble lucha mejor futuro familia,2019-03-06
José Carlos,Tuarez Zambrano,jcarlostuarez,seguir comunicado miercol marzo invito suscribir canal oficial youtube encontrarar contenido creado carino serar,2019-03-06
José Carlos,Tuarez Zambrano,jcarlostuarez,seguir comunicado miercol marzo invito suscribir canal oficial youtube encontrarar contenido creado carino serar,2019-03-06
José Carlos,Tuarez Zambrano,jcarlostuarez,saludo amigo natal solicito humildad apoyo respaldo total candidatura ciudadano pueblo,2019-03-06
José Carlos,Tuarez Zambrano,jcarlostuarez,sensibilidad solidaridad funcionario publico ser despedir detra cada funcionario familia sufrir consecuencia corrupto,2019-03-06
José Carlos,Tuarez Zambrano,jcarlostuarez,ahora actuare enlace ciudadano nunca ser escuchar candidatura,2019-03-07
José Carlos,Tuarez Zambrano,jcarlostuarez,solidarizo cada trabajador publico ser retirar cargo periodo carnaval triste conocer centenar familia ecuatoriano afectado situación,2019-03-07
José Carlos,Tuarez Zambrano,jcarlostuarez,manán jueves marzo seguire recorrer manabi continuare contactar ecuatoriano grupo social compartir propuesta escuchar sugerencia construir junto mejor pais comparto agenda medio actividad,2019-03-07
José Carlos,Tuarez Zambrano,jcarlostuarez,jueves marzo seguire recorrer manabi continuare contactar ecuatoriano grupo social compartir propuesta escuchar sugerencia construir junto mejor pais comparto agenda medio actividad,2019-03-07
José Carlos,Tuarez Zambrano,jcarlostuarez,compromiso esclarecer recurso destinado afectado cooperacion internacional propondre auditor externo ayudar transparentar fondo,2019-03-07
José Carlos,Tuarez Zambrano,jcarlostuarez,politico pedir anular voto candidato preguntar sentiria politico pueblo pedir anular voto todo dignidad pueblo harto politico corrupto,2019-03-08
José Carlos,Tuarez Zambrano,jcarlostuarez,excelente logico pedir anular voto deber pedir pueblo dignidad participar politico soberano mandante considerar corrupto,2019-03-08
José Carlos,Tuarez Zambrano,jcarlostuarez,viernes marzo provincia manabi comparto agenda medio actividad estare conversar diverso gremio social escuchar problematica plantear solución justo,2019-03-08
José Carlos,Tuarez Zambrano,jcarlostuarez,gracias mujer felicitación todo mujer mundo gracias darno templanza guia consejo apoyo dudar pilar fundamental familia vido gracias especial mujer importante vida amado madre,2019-03-08
José Carlos,Tuarez Zambrano,jcarlostuarez,pueblo conviccion votar respaldar soberano,2019-03-08
José Carlos,Tuarez Zambrano,jcarlostuarez,dejar firme compromiso territorio solo escritorio recorrer enlace pueblo servir perseguir sacerdote odio resentimiento politico,2019-03-08
José Carlos,Tuarez Zambrano,jcarlostuarez,gracias todo darno templanza guia apoyo dudar pilar fundamental familia vido gracias especial importante vida,2019-03-08
José Carlos,Tuarez Zambrano,jcarlostuarez,total respaldo emprendimiento contar padre manabi aspecto necesitar aguacero verdad,2019-03-09
José Carlos,Tuarez Zambrano,jcarlostuarez,candidato elijo voto casillero cpccs,2019-03-09
José Carlos,Tuarez Zambrano,jcarlostuarez,porq creer gente honesta idoneo querer enterrar siempre lacrir correista respeto proponer lista poder acuerdo favor,2019-03-11
José Carlos,Tuarez Zambrano,jcarlostuarez,voto candidato cpccs,2019-03-11
José Carlos,Tuarez Zambrano,jcarlostuarez,saludo amigo agradecido brindarme espacio medio comunicacion comparto entrevista realizar mismo reitero compromiso recuperar dinero robado corrupcion,2019-03-11
José Carlos,Tuarez Zambrano,jcarlostuarez,saludo amigo comprometo transparentar fondo destinado reconstruccion manabi esmeralda invitar leer entrevista,2019-03-11
José Carlos,Tuarez Zambrano,jcarlostuarez,saludo amigo comprometo transparentar fondo destinado reconstruccion manabi esmeralda invitar leer entrevista,2019-03-11
José Carlos,Tuarez Zambrano,jcarlostuarez,partido recomendar candidato menos padre tuarez parecer convenir alguien incorruptible sacar verdad,2019-03-12
José Carlos,Tuarez Zambrano,jcarlostuarez,saludo amigo promoverir propuesta politica acuerdo convenio organismo internacional fomentar transparencia pedir respaldo,2019-03-12
José Carlos,Tuarez Zambrano,jcarlostuarez,poner disciplina transparencia evitar acto corrupcion fomentar valor hacer falta sector publico,2019-03-12
José Carlos,Tuarez Zambrano,jcarlostuarez,doctrina servicio filosofia transparencia querer devolver dignidad politico ecuatoriano traves control social encontrar casillero siete papeleto hombre voto guia dio llegarer,2019-03-13
José Carlos,Tuarez Zambrano,jcarlostuarez,proponer generar propuesta fomentar fortalecerir,2019-03-13
José Carlos,Tuarez Zambrano,jcarlostuarez,sere enlace ciudadano fortalecer,2019-03-13
José Carlos,Tuarez Zambrano,jcarlostuarez,recuperarar valor favor familia fomentar investigacion denuncia peticion parte afectar participacion generen corrupcion inter evitar sobreprecio acto corrupcion,2019-03-13
José Carlos,Tuarez Zambrano,jcarlostuarez,manán calido provincia esmeralda reunire multipl gremio social escuchar primero mano necesidad estare difundir propuesta medio varios medio comunicacion comparto agenda medio marzo,2019-03-13
José Carlos,Tuarez Zambrano,jcarlostuarez,trabajar mesa dialogo atender queja solicitud ciudadano transparentar disciplina valor sobretodo compromiso politico,2019-03-14
José Carlos,Tuarez Zambrano,jcarlostuarez,bello recibir carino invito disfrutar fiesta democratico votar conviccion civismo amor,2019-03-14
José Carlos,Tuarez Zambrano,jcarlostuarez,saludo hermano pueblo nacionalidad norte epero chachi afro saludo kopanoro sanguir kopanora defenderar cultura tradición conocimiento saber comunidad,2019-03-14
José Carlos,Tuarez Zambrano,jcarlostuarez,comparti federacion provincial trabajador afirmo compromiso recuperar confianza sector publico trabajo transparente sobretodo honestidad seguro,2019-03-15
José Carlos,Tuarez Zambrano,jcarlostuarez,amigo fotografiar encontrarar compromiso ningun partido politico compromiso pueblo junto rescatarer pai,2019-03-15
José Carlos,Tuarez Zambrano,jcarlostuarez,manán estare recorrer diverso lugar hermoso parte pais compartir ciudadano propuesto compromiso perdido invito compartir,2019-03-15
José Carlos,Tuarez Zambrano,jcarlostuarez,gracias agradecer bello recibir brindarme grato recuerdo regalar sonrisa ultimo recorrido querer dedicar agradecimiento bello lugar,2019-03-15
José Carlos,Tuarez Zambrano,jcarlostuarez,transparentar contratación recurso utilizado eficientemente corrupcion atente familia cada dolar robado hacer falta hijo,2019-03-15
José Carlos,Tuarez Zambrano,jcarlostuarez,fomentare velare transparencia luchare ciudadano honesto trabajador necesitar escuchado,2019-03-15
José Carlos,Tuarez Zambrano,jcarlostuarez,transparentar contratación recurso utilizado eficientemente corrupcion atente familia cada dolar robado hacer falta hijo,2019-03-16
José Carlos,Tuarez Zambrano,jcarlostuarez,fomentare velare transparencia luchare ciudadano honesto trabajador necesitar escuchado,2019-03-16
José Carlos,Tuarez Zambrano,jcarlostuarez,gracias dio momento encontrar compartir bello junto maravillosa isabel robalino conocido actividad ecuatoriano actualmente isabel miembro comision,2019-03-16
José Carlos,Tuarez Zambrano,jcarlostuarez,gracias provincia santo domingo tsachila video querer compartir agradecimiento bello provincia visitar hacer dia conoci multipl tradición dialoguir diverso ciudadano necesidad inter,2019-03-16
José Carlos,Tuarez Zambrano,jcarlostuarez,saludo amigo agradecer haber realizar ameno entrevista presento candidatura comparto propuesto siempre preocupado pai valor provido profamilia lleno oportunidad,2019-03-18
José Carlos,Tuarez Zambrano,jcarlostuarez,manana lunes marzo grata dinamicar provincia pichincho invitar seguir agenda medio actividad,2019-03-18
José Carlos,Tuarez Zambrano,jcarlostuarez,manana lunes marzo grata dinamicar provincia pichincho invitar seguir agenda medio actividad,2019-03-18
José Carlos,Tuarez Zambrano,jcarlostuarez,gracias agradecer bello recibir marzo esmeraldeno votarar padre carlos tuarez consejo participacion ciudadanar control social,2019-03-18
José Carlos,Tuarez Zambrano,jcarlostuarez,gracias dio momento gracias completo apoyo candidatura consejo participacion ciudadano control social isabel robalino bolle figura legendario ecuador,2019-03-18
José Carlos,Tuarez Zambrano,jcarlostuarez,gracias provincia santo domingo tsachila tierrito querer compartir agradecimiento bello provincia marzo votarar padre carlos tuarez consejo participacion ciudadanar control social,2019-03-18
José Carlos,Tuarez Zambrano,jcarlostuarez,amigo comparto fotografia podran encontrar papeleta marzo olvid puesto papeleto hombre medio papeleto carlos tuarez consejo participacion ciudadanar control social,2019-03-18
José Carlos,Tuarez Zambrano,jcarlostuarez,ahora acompán candidato hablar propuesto trabajar mirano,2019-03-18
José Carlos,Tuarez Zambrano,jcarlostuarez,quito programa expuse propuestas trabajo beneficio ecuatoriano pueblo primero fiscalizador,2019-03-18
José Carlos,Tuarez Zambrano,jcarlostuarez,amigo olvidar domingo cambio mano dia proceso electoral recuerdir consejo participacion ciudadanar control social carlos tuarez centro papeleto,2019-03-18
José Carlos,Tuarez Zambrano,jcarlostuarez,amigo compartir agendir actividad manana martes marzo provincia pichincho padre tuarez consejo participacion ciudadano control social medio papeleto hombre,2019-03-19
José Carlos,Tuarez Zambrano,jcarlostuarez,amigo marzo harar cambio necesitar pais domingo votar padre carlos tuarez consejo participacion ciudadanar control social,2019-03-20
José Carlos,Tuarez Zambrano,jcarlostuarez,faltar dia marzo mejor participacion ciudadano votar padre consejo participacion ciudadanar control social,2019-03-20
José Carlos,Tuarez Zambrano,jcarlostuarez,manán marzo provincia invitar seguir agenda medio actividad recuerdir marzo votar padre carlos tuarez,2019-03-20
José Carlos,Tuarez Zambrano,jcarlostuarez,per pacifico defender derecho elegir elegido sigo candidatura,2019-03-20
José Carlos,Tuarez Zambrano,jcarlostuarez,gracias compromiso pueblo ecuatoriano poder politico economico impulsar,2019-03-20
José Carlos,Tuarez Zambrano,jcarlostuarez,falto debate informacion voto sero parecer candidato idoneo,2019-03-20
José Carlos,Tuarez Zambrano,jcarlostuarez,peor malo sacerdote saber parir cabeza padre igual participarar elección campán mala solo buscar desprestigio participante vayan confesion hipocrita,2019-03-20
José Carlos,Tuarez Zambrano,jcarlostuarez,ahora compartir ciudadania importancia poder politico economico estar fuerza conviccion dil,2019-03-20
José Carlos,Tuarez Zambrano,jcarlostuarez,amigo invito seguir entrevista siguiente enlace recuerdir marzo votar padre tuarez papeleto,2019-03-20
José Carlos,Tuarez Zambrano,jcarlostuarez,luchar poder politico economico ciudadano honesto humilde salir sudar respaldar candidatura domingo dio gente,2019-03-20
José Carlos,Tuarez Zambrano,jcarlostuarez,ahora programa hecho invito seguir grata entrevista junto walter ruiz domingo dio gente,2019-03-20
José Carlos,Tuarez Zambrano,jcarlostuarez,ahora programa hecho invito seguir grata entrevista junto walter ruiz domingo dio gente,2019-03-20
José Carlos,Tuarez Zambrano,jcarlostuarez,presentar aqui lugar papeleto,2019-03-21
José Carlos,Tuarez Zambrano,jcarlostuarez,amigo compartir agendir actividad manán marzo per pacifico padre carlos tuarez consejo participacion ciudadanar control social,2019-03-21
José Carlos,Tuarez Zambrano,jcarlostuarez,junto pongo disposicion candidatura domingo,2019-03-21
José Carlos,Tuarez Zambrano,jcarlostuarez,saludo afirmo compromiso pueblo compromiso politico nadie civismo conviccion,2019-03-21
José Carlos,Tuarez Zambrano,jcarlostuarez,ahora invitar seguir ameno entrevista vivo seguir firme feliz candidatura ahora nunca marzo votar padre carlos tuarez papeleto,2019-03-21
José Carlos,Tuarez Zambrano,jcarlostuarez,junto hago llamar conciencia ecuatoriano prestar oido llamado amor patria,2019-03-21
José Carlos,Tuarez Zambrano,jcarlostuarez,ahora entrevista vivo candidatura cuidar migrant dignidad enfermo futuro familia ecuatoriano votar padre carlos tuarez papeleto,2019-03-21
José Carlos,Tuarez Zambrano,jcarlostuarez,ahora compartir entrevista candidatura cuidar migrant dignidad enfermo futuro familia ecuatoriano votar padre carlos tuarez papeleto,2019-03-21
José Carlos,Tuarez Zambrano,jcarlostuarez,tuarez pidio licencia participar elección vistazo claro padre liderar encuesta cierto grupo queriar campán sucio hacer lado voto sero tuarez puesto cpccs definitivo,2019-03-22
José Carlos,Tuarez Zambrano,jcarlostuarez,faltar dia marzo votar padre carlos tuarez consejo participacion ciudadano control social papeleta saludo,2019-03-22
José Carlos,Tuarez Zambrano,jcarlostuarez,amigo familia tambien,2019-03-23
José Carlos,Tuarez Zambrano,jcarlostuarez,cpccs,2019-03-23
José Carlos,Tuarez Zambrano,jcarlostuarez,faltar serar hacer cambio necesitar pais marzo votar padre carlos tuarez consejo participacion ciudadano control social papeleta,2019-03-23
José Carlos,Tuarez Zambrano,jcarlostuarez,falta serar hacer cambio necesitar pais marzo votar padre carlos tuarez consejo participacion ciudadano control social papeleta,2019-03-23
José Carlos,Tuarez Zambrano,jcarlostuarez,faltar gracia mil ecuatoriano brindado confianza regalado grato recuerdo junto devolveremos dignidad politico ecuatoriano gracias ecuador,2019-03-23
José Carlos,Tuarez Zambrano,jcarlostuarez,gracias gracias confianza humildad recibo nuevo reto disciplina luchar desprotegido,2019-03-26
José Carlos,Tuarez Zambrano,jcarlostuarez,gracias ecuatoriano oportunidad servirl disciplina amor ganas transparentar sector publico favor pueblo,2019-03-26
