nombre,apellidos,tweet_screen_name,tweet_text,tweet_date
José Carlos,Tuarez Zambrano,jcarlostuarez,realmente vencio ningun partido politico vencio vida familia pues seguro autoridad electo mostrar pleno posicion provido,2019-03-27
José Carlos,Tuarez Zambrano,jcarlostuarez,ahora entender desear ferviente desaparecer actual consejero electo pueblo investigar absolutamente caso corrupcion conocer,2019-03-27
José Carlos,Tuarez Zambrano,jcarlostuarez,llevar calma transparencia trabajar unido devolver confianza valor ecuador perdido,2019-03-27
José Carlos,Tuarez Zambrano,jcarlostuarez,felicitación gran victoria partir comunidad estudiantil extend apoyo,2019-03-27
José Carlos,Tuarez Zambrano,jcarlostuarez,jueves vicepdte dia cargo proceso electoral inundación candidato mejor votado competencia mejor puntuado fiscal replico impugnacion,2019-03-28
José Carlos,Tuarez Zambrano,jcarlostuarez,felicitación padrecito gusto conocer convertido deseo mejor nuevo etapa miembro dio iluminar exito exito pais,2019-03-28
José Carlos,Tuarez Zambrano,jcarlostuarez,felicitación estimado padre romper paradigma hacer bien trinchera llamado cpccs devolver poder pueblo trav participacion ciudadano exito bendición,2019-03-28
José Carlos,Tuarez Zambrano,jcarlostuarez,conformacion voto popular hombre mujer pueblo nacionalidad fuente,2019-03-29
José Carlos,Tuarez Zambrano,jcarlostuarez,gracias ecuador vigilante respetar voluntad pueblo urna principio valor padre tuarez zambrano mejor votado cpccs,2019-03-30
José Carlos,Tuarez Zambrano,jcarlostuarez,asociacion sector economico popular solidario gran triunfo candidato contar respaldo pais necesitar bano verdad transparencia honestidad principio valor gracias,2019-03-30
José Carlos,Tuarez Zambrano,jcarlostuarez,agradecer tener valor salir palestra politico candidato consejero ganar barrio suburbano guayaquil respaldamos candidatura seguir respaldar gestion exito padre tuarez,2019-03-30
José Carlos,Tuarez Zambrano,jcarlostuarez,manera imprevista encuentro agradecer radio onlinar hermano dauleno voto confianzo brindar junto transparentar ecuador ente servicio,2019-03-30
José Carlos,Tuarez Zambrano,jcarlostuarez,bueno realidad usted conociar organización social sector conocer bien confiamos excelente labor posible respaldarer candidatura usted,2019-03-31
José Carlos,Tuarez Zambrano,jcarlostuarez,elegido presidente republico nuevo consejero elegido votante desicion soberano preocupar desaparecer cpcc ganar derecho urna,2019-03-31
José Carlos,Tuarez Zambrano,jcarlostuarez,creer confio schoensttatián ahora trabajar pueblo ecuatoriano eligio dio seguir bendecir mater protejo,2019-04-01
José Carlos,Tuarez Zambrano,jcarlostuarez,deber exigir resultado final,2019-04-01
José Carlos,Tuarez Zambrano,jcarlostuarez,decir decir promover voto nulo querer actue todo atribución pueblo eligio mejor,2019-04-03
José Carlos,Tuarez Zambrano,jcarlostuarez,excelente oportunidad entrevistar padre tuarez cpccs definitivo excelente consejero social humano,2019-04-06
José Carlos,Tuarez Zambrano,jcarlostuarez,revise cerca acta nivel nacional robar voto decir comparar dato obtengo urnas informacion diferenciar voto mantener tendencia habriar quitado voto,2019-04-06
José Carlos,Tuarez Zambrano,jcarlostuarez,concuerdo usted padre poco elección acertado apoyar momento elegir contento,2019-04-07
José Carlos,Tuarez Zambrano,jcarlostuarez,alguien podrio explicar significar supervisar eliminacion cpccs supervisa muerte anticipado,2019-04-07
José Carlos,Tuarez Zambrano,jcarlostuarez,consejero electo pueblo conversacion vaya casa disfrute familia,2019-04-07
José Carlos,Tuarez Zambrano,jcarlostuarez,bastar seguir repetir mismo capitulo opereta tragicomico politico ecuatoriano dejar democracia cpccs funcionar beneficio decencia reparto hacienda,2019-04-08
José Carlos,Tuarez Zambrano,jcarlostuarez,respaldo nuevo cpccs voluntad pueblo urna encima acto apegado democracia trujillo descansar dejar trabajar coherente decir usted sero ciudadano pueblo,2019-04-08
José Carlos,Tuarez Zambrano,jcarlostuarez,padre usted sero devolvera tranquilidad familia ecuatoriano,2019-04-08
José Carlos,Tuarez Zambrano,jcarlostuarez,necio cifra seguir consigna grupo poder ventajar papeleta valida frente nulo esperar consulta decir,2019-04-09
José Carlos,Tuarez Zambrano,jcarlostuarez,completamente acuerdo ahora cerrar peor nombra comision integrante defensorar derechos humanos pedir aborto grito clase gente,2019-04-09
José Carlos,Tuarez Zambrano,jcarlostuarez,falso cura juliar cruzalta recibido honor comision justicia favor aborto,2019-04-09
José Carlos,Tuarez Zambrano,jcarlostuarez,padre recordar manabi alma siempre lado correcto historia dar triunfo popular votado miembro defraude defraudado,2019-04-09
José Carlos,Tuarez Zambrano,jcarlostuarez,empezar semana santo jesus realacer verdadero acto amor morir limpiar pecado tiempo reflexion meditacion familia vida bendito venir nombre senor hosanna altura,2019-04-15
José Carlos,Tuarez Zambrano,jcarlostuarez,tiempo reflexion pedir dio salvir ecuador mafia querer imponer agenda elite globalusta cultura pidar vida salud familia liberar,2019-04-15
José Carlos,Tuarez Zambrano,jcarlostuarez,gloria dio altura hombre buen voluntad dios bendigo siempre ecuador,2019-04-15
José Carlos,Tuarez Zambrano,jcarlostuarez,recordar dolor pasar hora panico terror incertidumbre increible pasado tres ano aquel momento cambio vida ecuatoriano vivimo saber invencible,2019-04-16
José Carlos,Tuarez Zambrano,jcarlostuarez,eucaristia encontrar jesus compartimos vido sentir amor alli experimentar murio resucito lavar humildad servir necesitado,2019-04-18
José Carlos,Tuarez Zambrano,jcarlostuarez,eucaristia encontrar jesus compartimos vida sentir amor alli experimentar murio resucito lavar humildad servir necesitado,2019-04-18
José Carlos,Tuarez Zambrano,jcarlostuarez,inocente ofrecio mismo bien amigo incluso enemigo cerrar ojo miralo corazon brazo abierto esperar reflexionar entrega todo carga perdón actuar odio rencor,2019-04-19
José Carlos,Tuarez Zambrano,jcarlostuarez,vivir verdadero resurreccion ver alrededor demo amor ecuador mundo volver tener esperanza feliz pascua,2019-04-21
José Carlos,Tuarez Zambrano,jcarlostuarez,celebrar vido hogar hacer conciencia cuid planeta contamine recicle cuidir agua ahorre energiar produzca producto organico vida feliz,2019-04-22
José Carlos,Tuarez Zambrano,jcarlostuarez,cafecitir trabajar agenda favor vida familia salud,2019-04-28
José Carlos,Tuarez Zambrano,jcarlostuarez,rescate valor principio ecuador padre tuarez mano esperanza regresar ecuador decir pasado pasado ecuador consagrado jesus maria,2019-04-24
José Carlos,Tuarez Zambrano,jcarlostuarez,gracias todo organización social respaldar candidatura luchare derechos necesitado familia salud vido naturaleza odio resentimiento politico ecuador necesitar,2019-04-25
José Carlos,Tuarez Zambrano,jcarlostuarez,defensa vida salud familia,2019-04-27
José Carlos,Tuarez Zambrano,jcarlostuarez,instalación participar ponente foro verde impuesto verde propusimos posible reforma cuanto propuesta derogatorio,2019-04-29
José Carlos,Tuarez Zambrano,jcarlostuarez,instalación participar ponente foro verde impuesto verde propusimos posible reforma cuanto propuesta derogatorio,2019-05-01
José Carlos,Tuarez Zambrano,jcarlostuarez,vergonzoso terminar comodato inmobiliar dejar oficina nuevo cpccs definitivo demostrar mahuadista compliz malo perdedor malo democrata,2019-05-01
José Carlos,Tuarez Zambrano,jcarlostuarez,padre dejar pelotita dpublico hacer cargo delicado mismo deber hacer superbanco amarrir saqueador feriado bancario raton cuidar queso mismo siempre serio bueno reveer designacion,2019-05-01
José Carlos,Tuarez Zambrano,jcarlostuarez,trujillo demostro producto descartable juegos oscuro grupo factico mafioso cerca nombramiento amigo parcializado sembrar inseguridad juridico republico,2019-05-01
José Carlos,Tuarez Zambrano,jcarlostuarez,necesitar gente nuevo honesta defiendo valor concepto fuerza vigor miedo ecuatoriano atento respaldamo,2019-05-01
José Carlos,Tuarez Zambrano,jcarlostuarez,recordar 1886 trabajador iniciar lucha defender derecho derechos deber conquistar dia unido pelearer feliz vivo lucha clase obrero,2019-05-01
José Carlos,Tuarez Zambrano,jcarlostuarez,recordar 1886 trabajador iniciar lucha defender derecho derechos deber conquistar unido pelearar feliz vivo lucha clase obrero,2019-05-01
José Carlos,Tuarez Zambrano,jcarlostuarez,recordar 1886 trabajador iniciar lucha defender derecho derechos deber conquistar unido pelearar feliz vivo lucha clase obrero,2019-05-01
José Carlos,Tuarez Zambrano,jcarlostuarez,vergonzoso desleal cierto definar persona egoista egocentrica verguenzo,2019-05-01
José Carlos,Tuarez Zambrano,jcarlostuarez,ojala alcalde electo playa sepa ley senor cpccs ejercicio mostrar bien podrio playa necesitar transparente acción gobierno territorial manejar hacienda ano,2019-05-01
José Carlos,Tuarez Zambrano,jcarlostuarez,criterio escuchar deber evaluar detalladamente base respuesta obvia deber escuchado diferenciar titulo personal titulo grupito amigo criterio nacional,2019-05-02
José Carlos,Tuarez Zambrano,jcarlostuarez,acta procesado tras verificacion reconteo voto realizado junto doce provincia pai aprobar resultado numerico eleccion deberio realizar entrega credencial autoridad,2019-05-06
José Carlos,Tuarez Zambrano,jcarlostuarez,atencion ecuatoriano poder permitir enganir querer eliminar eliminir asambleista vicepresidencia poco credibilidad saber ahora poblar poder estir asustado,2019-05-07
José Carlos,Tuarez Zambrano,jcarlostuarez,presidente deber respetar voto popular querer nuevo dignidad ejecutir auditoria completo combatir corrupcion esclarecer motivo campán eliminar apoyamos totalmente postura,2019-05-07
José Carlos,Tuarez Zambrano,jcarlostuarez,temblar padre saber pueblo necesidad lider principio creer politico ninguno integridad,2019-05-07
José Carlos,Tuarez Zambrano,jcarlostuarez,inaudito despues pueblo pronuncio consulta elegir miembro urna convenir interés protervo cuanto politiquero pretender eliminar querer coartar soberano derecho designar autoridad,2019-05-07
José Carlos,Tuarez Zambrano,jcarlostuarez,gracias primero amor vida companerar guia consejera mejor amiga felicito madre todo madre ecuador motivacion vida siempre fiel entregado,2019-05-12
José Carlos,Tuarez Zambrano,jcarlostuarez,dio bendiga,2019-05-12
José Carlos,Tuarez Zambrano,jcarlostuarez,felicitación impresionante victoria etapa ecuatoriano dejar alto nombre pais ecuador,2019-05-14
José Carlos,Tuarez Zambrano,jcarlostuarez,lamentable ocurrido senor humano ecuatoriano espero recuperar pronto dio guardar estare orar pronta recuperacion,2019-05-15
José Carlos,Tuarez Zambrano,jcarlostuarez,comentario demostrar pensamiento elegido voto necesitario rezar,2019-05-15
José Carlos,Tuarez Zambrano,jcarlostuarez,manán estarir invitado sintonizar 1350,2019-05-16
José Carlos,Tuarez Zambrano,jcarlostuarez,palabra reflejo gran formacion humildad aprovechar felicitar designacion consejero amigo papa pepe digno madre dón cleofe oriundo parroquia pueblo nuevo,2019-05-16
José Carlos,Tuarez Zambrano,jcarlostuarez,manifiesta confia designación hecho consejo participacion transitorio embargo descartar nuevo consejo poder recibir duda impugnación sociedad civil deberar evaluar,2019-05-16
José Carlos,Tuarez Zambrano,jcarlostuarez,poder eliminar trav consulta popular serio necesario asamblea constituyente eliminar fortalecer indicar,2019-05-16
José Carlos,Tuarez Zambrano,jcarlostuarez,meta importante deber defender vida familia mafia corrupto siglo financiar foro paulo neomarxismo cultural muerte familia salvo quedar rescatar defender,2019-05-17
José Carlos,Tuarez Zambrano,jcarlostuarez,sesion pleno proclamar resultado definitivo definitivo elección 24marzo consejero cpccs principal,2019-05-18
José Carlos,Tuarez Zambrano,jcarlostuarez,gracia ecuatoriar confianza puesto humilde servidor trabajare ahinco necesitado sere nace nuevo ciudadano verdadero mandant dio guie,2019-05-18
