nombre,apellidos,tweet_screen_name,tweet_text,tweet_date
Cynthia,Viteri,CynthiaViteri6,gracias luisevivanco divertido interesante entrevista esperer castigoguayaco repita pronto,2019-03-13
Cynthia,Viteri,CynthiaViteri6,equipo seguirar hacer realidad nuevo sueno ursulastrengech aguschmer jrodriguezecu trabajarar junto llevar progreso familia distrito guayaquil sigueguayaquilsigar,2019-03-13
Cynthia,Viteri,CynthiaViteri6,respaldo incondicional inspirar seguir trabajar bienestar progreso futuro cada gracia distrito demostrar aqui seguir sonar grande sigueguayaquilsigar,2019-03-14
Cynthia,Viteri,CynthiaViteri6,ultimo etapa campán recibido apoyo cada barrio sentir calle confianza gratitud certeza camino progreso seguirar engrandeceir guayaquil radiomorena640,2019-03-14
Cynthia,Viteri,CynthiaViteri6,seguir hablar guayaquil escucha nuevo obra venir futuro sintonizar,2019-03-14
Cynthia,Viteri,CynthiaViteri6,alcaldesa seguire rescatar joven drogar madre podran llevar hijo centro gratuito rehabilitacion ubicado chongon salitral flor bastion guasmo hijos serar atendido especialista primero radiocentroec,2019-03-14
Cynthia,Viteri,CynthiaViteri6,enfocado trabajar guayaquil planificacion nuevo obra radiocentroec,2019-03-14
Cynthia,Viteri,CynthiaViteri6,lucia dhanna anibal sumar lucha delincuencio obra traerar empleo equipo cada grande cumplir siempre compromiso sigueguayaquilsiguir,2019-03-14
Cynthia,Viteri,CynthiaViteri6,centro bienestar animal implementarer partir mayo sera mejor pais region guayaquil sigueguayaquilsigar,2019-03-14
Cynthia,Viteri,CynthiaViteri6,marzo distrito rayar todititito la6mdg gracia confianza camino progreso bienestar construido sigueguayaquilsiguir,2019-03-15
Cynthia,Viteri,CynthiaViteri6,buen dia guayaquil empecer viernes conversar guayaquilfuturo acerca escuchame vivo radioforever925 sintonizar,2019-03-15
Cynthia,Viteri,CynthiaViteri6,formalizado alrededor 37mil trabajador seguir impulsandolo nuevo mercado municipal credito banco oportunidades propongo financiado sostenible tiempo aqui hablar hacer radioforever925,2019-03-15
Cynthia,Viteri,CynthiaViteri6,faltar poco dia elección voto construir centro geriatrico voto har nuevo centro rehabilitacion voto har nuevo aerovia verdadero constructor guayaquil hacer sueno real radioforever925,2019-03-15
Cynthia,Viteri,CynthiaViteri6,mientras arranco construccion centro rehabilitacion arrancare estudio nuevo aerovia nuevo puente samborondon guayaquil construccion centro bienestar animal arrancare manera simultaneo radioelite9971,2019-03-15
Cynthia,Viteri,CynthiaViteri6,actualmente bus rampa hidraulica persona movilidad reducido venir adema existir line especifico localizar tipo unidad convertir ciudad transportarte publico inclusivo radioelite9971,2019-03-15
Cynthia,Viteri,CynthiaViteri6,parroquia rural guayaquil serar cada parte progreso ciudad equipo seguirar transformar guayaquil rayar toditititir la6mdg sigueguayaquilsiguir,2019-03-15
Cynthia,Viteri,CynthiaViteri6,ayudar familia jorge elias encontrar él perder esperanza difunde informacion,2019-03-15
Cynthia,Viteri,CynthiaViteri6,poco dia seguir cumplir grande sueno hecho grande ciudad marzo volver gritar fuerza sigueguayaquilsigar hacer gracias distrito respaldo lleno corazon alegrio,2019-03-16
Cynthia,Viteri,CynthiaViteri6,poco dia seguir cumplir grande sueno hecho grande ciudad marzo volver gritar fuerza sigueguayaquilsigar hacer gracias distrito respaldo lleno corazon alegrio,2019-03-16
Cynthia,Viteri,CynthiaViteri6,realizamos brigado desintoxicacion atencion medica parque multiproposito fortin lleno guayaquileno atendido medicina general odontologia rehabilitacion fisico ecografia dema servicio salud prioridad,2019-03-16
Cynthia,Viteri,CynthiaViteri6,propuesta concejal josecabreraec junto josuesanchezec egiscaicedo guayaquil sueno poder sonar trabajar duro progresar junto familia cynthiaviteri6 sigueguayaquilsiguir lacanteraec paolajaramilloz,2019-03-16
Cynthia,Viteri,CynthiaViteri6,todo gente distrito salir casa balcón asomar él ventana darno respaldo medio lluvia inspiro seguir defender ampliar logrado junto aqui sueno imposible prometo comprometo,2019-03-16
Cynthia,Viteri,CynthiaViteri6,todo gente distrito salir casa balcón asomar él ventana darno respaldo medio lluvia inspiro seguir defender ampliar junto logrado aqui sueno imposible prometo comprometo,2019-03-17
Cynthia,Viteri,CynthiaViteri6,multitud unio solo grito sigueguayaquilsigar guasmo central vivio alegrio poco dia guayaquilfuturo generara empleo fortalecerir seguridad recatar joven droga,2019-03-17
Cynthia,Viteri,CynthiaViteri6,multitud unio solo grito sigueguayaquilsigar guasmo central vivio alegrio poco dia guayaquilfuturo generara empleo fortalecerir seguridad rescatar joven droga,2019-03-17
Cynthia,Viteri,CynthiaViteri6,semana recibimos apoyo cada guayaquileno convencido camino progreso permitirar cumplir sueno grande junto guayaquil sigueguayaquilsigar,2019-03-17
Cynthia,Viteri,CynthiaViteri6,buen dia guayaquileno empezar semana gran alegrio conversar nuevo obra engrandeceran ciudad escuchame radiomorena640 sintonizar 640am,2019-03-18
Cynthia,Viteri,CynthiaViteri6,ahora ciudad digital 6000 punto internet gratuito cable bachiller hogar tablets pasarar ciudad digital ciudad inteligente radiomorena640,2019-03-18
Cynthia,Viteri,CynthiaViteri6,domingo votar votar guayaquil seguir crecer rayar todititito mano habran construir nuevo aerovia nuevo puente nuevo centro rehabilitacion salvar futuro joven voto construyes ciudad radiomorena640,2019-03-18
Cynthia,Viteri,CynthiaViteri6,junto representar causa causa guayaquil rcristal870am,2019-03-18
Cynthia,Viteri,CynthiaViteri6,propuesta enfocado generar empleo fortalecer seguridad camara reconocimiento facial construir centro rehabilitacion consumir droga centro rehabilitacion fisico construy voto rcristal870am,2019-03-18
Cynthia,Viteri,CynthiaViteri6,propuesta enfocado generar empleo fortalecer seguridad camara reconocimiento facial construir centro rehabilitacion consumir droga centro rehabilitacion fisico construy voto rcristal870am,2019-03-18
Cynthia,Viteri,CynthiaViteri6,guayaquileno gracias gracias corazon hecho mejor campán todo vida senti campán casa ciudad gracias confianza estare alturar sueno expectativa rcristal870am,2019-03-18
Cynthia,Viteri,CynthiaViteri6,luchar delincuencia firmezar construir guayaquil cada seguro junto hacer posible sigueguayaquilsigue,2019-03-18
Cynthia,Viteri,CynthiaViteri6,acerca voto seguirar construir grandeza guayaquil amamos defendemo valentia,2019-03-18
Cynthia,Viteri,CynthiaViteri6,optimismo conviccion pueblo respaldar masivamente propuesto guayaquilfuturo cynthiaviteri6 capacidad honestidad tenacidad servicio ciudadano,2019-03-18
Cynthia,Viteri,CynthiaViteri6,gracias cada gesto respaldo guayaquileno distrito harar camino progreso continue cumplir sueno ciudad sigueguayaquilsigar,2019-03-19
Cynthia,Viteri,CynthiaViteri6,compartir alegrio respaldo distrito cynthiaviteri6 equipo la6mdg sigueguayaquilsigar,2019-03-19
Cynthia,Viteri,CynthiaViteri6,gracias dometabacchi  formar parte gran equipo compartir objetivo generar bienestar guayaquileno junto seguir cumplir sueno guayaquil,2019-03-19
Cynthia,Viteri,CynthiaViteri6,buen dia guayaquil pierda entrevista radiohuancavilk conocer detalle nuevo sueno cumplirer ciudad espero,2019-03-19
Cynthia,Viteri,CynthiaViteri6,guayaquil acostumbro crecer pedir favor nadie radiohuancavilk,2019-03-19
Cynthia,Viteri,CynthiaViteri6,hacer hacer bien guayaquileno merecer buen servicio seguir bien seguir crecer radiohuancavilk,2019-03-19
Cynthia,Viteri,CynthiaViteri6,domingo votar votar mejor obra venir ciudad guayaquil detener siempre mejor radiohuancavilk,2019-03-19
Cynthia,Viteri,CynthiaViteri6,seguir conversar grande obra venir guayaquil pierda entrevista radio sucre,2019-03-19
Cynthia,Viteri,CynthiaViteri6,guayaquil aventura realidad propuesto generar empleo fortalecer seguridad rescatar joven droga completar servicio basica movilidad social radio sucre,2019-03-19
Cynthia,Viteri,CynthiaViteri6,joven tendran posibilidad desarrollar él carrera tecnica gracias instituto tecnico implementarer guayaquil siempre recibirar grande obra radio sucre,2019-03-19
Cynthia,Viteri,CynthiaViteri6,celebrar junto triunfo la6mdg jueves marzo barcelona esperar junto familiar amigo sigueguayaquilsigar,2019-03-19
Cynthia,Viteri,CynthiaViteri6,inspeccionamos avance construccion aerovia estacion duran administracion ampliar gran obra unir guayaquil samborondon sonar grande,2019-03-19
Cynthia,Viteri,CynthiaViteri6,voto construirar centro bienestar animal atendera carino profesionalismo animalitos calle guayaquil sigueguayaquilsigar,2019-03-19
Cynthia,Viteri,CynthiaViteri6,resultado trabajo social futuro alcaldesa cynthiaviteri6 claro brigado desintoxicacion atencion medica gratuito exito bienestar prioridad,2019-03-19
Cynthia,Viteri,CynthiaViteri6,solo dia votar guayaquil seguirar sonar grande gente distrito saber demostrar respaldo gran alegria decir junto solo sigueguayaquilsigar,2019-03-19
Cynthia,Viteri,CynthiaViteri6,voto hacer grande guayaquil rayatodititititola6,2019-03-20
Cynthia,Viteri,CynthiaViteri6,fortin seguirar recibir grande obra progreso gracias respaldo incondicional equipo demostrado cumplir sueno domingo votar todititito la6mdg sigueguayaquilsiguir,2019-03-20
Cynthia,Viteri,CynthiaViteri6,fortin seguirar recibir grande obra progreso gracias respaldo incondicional equipo demostrado cumplir sueno domingo votar toditititito la6mdg sigueguayaquilsigar,2019-03-20
Cynthia,Viteri,CynthiaViteri6,seguir conversar propuesta seguirar engrandeceir futuro ciudad escuchala radioamericaec,2019-03-20
Cynthia,Viteri,CynthiaViteri6,invito guayaquileno gran cierre campán realizarer manán saldremos avenida barcelona terminarer octubre junto celebrar gran alegria radioamericaec,2019-03-20
Cynthia,Viteri,CynthiaViteri6,llegar bus electrico rampa hidraulica nuevo aerovia duran guayaquil reducirar tiempo viaje solo pasaje adema aerovia unirar samborondon guayaquil ciudad seguirar mejorar radioamericaec,2019-03-20
Cynthia,Viteri,CynthiaViteri6,querer decirte representar causa progreso bienestar ciudad guayaquil aventurar certeza junto domingo votar voto seguir camino progreso rayatodititititola6 radioamericaec,2019-03-20
Cynthia,Viteri,CynthiaViteri6,radioelite9971 junto jrodriguezecu conversar nuevo obra seguirar asegurar progreso bienestar cada rincon ciudad,2019-03-20
Cynthia,Viteri,CynthiaViteri6,apenas iniciar administracion arrancare construccion centro rehabilitacion paso peatonal inclusivo costa deltar instituto joven trabajo simultaneo radioelite9971,2019-03-20
Cynthia,Viteri,CynthiaViteri6,domingo marzo votar vota guayaquil rayatodititititola6 radioelite9971,2019-03-20
Cynthia,Viteri,CynthiaViteri6,seguir posicionar guayaquil destino turistico lider nivel nacional internacional generarar empleo impulsar turismo sigueguayaquilsigar,2019-03-20
Cynthia,Viteri,CynthiaViteri6,11ava agosto iniciar gran caravana cierre distrito confianza lleno alegrio esperanza haro ciudad seguir crecer domingo votar guayaquilfuturo hecho sigueguayaquilsiguir,2019-03-21
Cynthia,Viteri,CynthiaViteri6,solamente proteger mantener modelo hacer grande obra guayaquil defender ciudad rtsecuador,2019-03-21
Cynthia,Viteri,CynthiaViteri6,alcaldesa estare alturar todo esperanza anhelo gran ciudad agradecer confianza gran mayoria guayaquileno dado rtsecuador,2019-03-21
Cynthia,Viteri,CynthiaViteri6,proteger hijo drogo convertir ciudad inteligente generaremo empleo cada obra emprenderir guayaquil rtsecuador,2019-03-21
Cynthia,Viteri,CynthiaViteri6,empezar plan piloto agente moto resguardar centro ciudad atrapar delincuente entregarlo autoridad competente resultado sido excelente ampliar nuevo plan seguridad rtsecuador,2019-03-21
Cynthia,Viteri,CynthiaViteri6,seguir conversar guayaquilfuturo venir bienestar grande obra pierda entrevista teleamazonasec,2019-03-21
Cynthia,Viteri,CynthiaViteri6,bienestar cada familia guayaquilén seguirar ser prioridad llegarer cada rincon ciudad salud teleamazonasec,2019-03-21
Cynthia,Viteri,CynthiaViteri6,guayaquil modelo modelo trabajar mano empresa privado sociedad civil resultado ingreso municipal dirigen grande obra guayaquileno teleamazonasec,2019-03-21
Cynthia,Viteri,CynthiaViteri6,fomentar cultura reciclaje implementarer programa especializado recoleccion basura fomentaremos educacion aspecto seguir cuidar ciudad teleamazonasec,2019-03-21
Cynthia,Viteri,CynthiaViteri6,programa piloto porunfuturosindroga demostro medicina atencion adecuado poder rescatar hijo droga seguir hacer centro rehabilitacion droga implementar alcaldio teleamazonasec,2019-03-21
Cynthia,Viteri,CynthiaViteri6,sintonizar canalunotv conocer nuevo sueno cumplirer todo familia guayaquil esperar,2019-03-21
Cynthia,Viteri,CynthiaViteri6,guayaquil siempre votado mismo progreso bienestar sigar junto mismo causa causa guayaquil canalunotv,2019-03-21
Cynthia,Viteri,CynthiaViteri6,lograr convertir ciudad ahora alcaldio seguir camino progreso guayaquil conversatorioaer,2019-03-21
Cynthia,Viteri,CynthiaViteri6,seguir combatir delincuencia frente posible conversatorioaer,2019-03-21
Cynthia,Viteri,CynthiaViteri6,seguir trabajar prevencion droga evitar joven caer adiccion conversatorioaer,2019-03-21
Cynthia,Viteri,CynthiaViteri6,segundo etapa guayarte acuario virtual turismo ecologico aventura parroquia rural impulsar turismo generar empleo guayaquil conversatorioaer,2019-03-21
Cynthia,Viteri,CynthiaViteri6,guayaquil seguirar ser ejemplo ecuador conversatorioaer,2019-03-21
Cynthia,Viteri,CynthiaViteri6,guayaquileno serar beneficiado obra llegar monte sinai llegaremo obra servicio guayaquil conversatorioaer,2019-03-21
Cynthia,Viteri,CynthiaViteri6,alcaldia seguir innovar mejorar movilidad guayaquileno puente paso desnivel paso peatonal inclusivo aerovia bus electrico conversatorioaer,2019-03-21
Cynthia,Viteri,CynthiaViteri6,domingo construira voto centro rehabilitacion gratuito salvarar joven droga faltar solo dia celebrar victoria guayaquil seguirar ampliar progreso bienestar,2019-03-21
Cynthia,Viteri,CynthiaViteri6,vivio gran fiesta respaldo guayaquil barcelona recorrimos todo ciudad recibir carino guayaquileno guayaquil entero decidio domingo seguirar sonar grande rayatodititititola6,2019-03-21
Cynthia,Viteri,CynthiaViteri6,entusiasmo alegria valentia define guayaquileno caraván vinimos gritar junto sigueguayaquilsiguir domingo gana ganar guayaquil rayatodititititola6,2019-03-22
Cynthia,Viteri,CynthiaViteri6,llegar octubre recibir gran fiesta respaldo guayaquil seguirar crecer camino progreso rayatodititititola6 sigueguayaquilsiguir,2019-03-22
Cynthia,Viteri,CynthiaViteri6,cada cuadra avanzar recibimos apoyo joven madre viejito hombre mujer guayaquileno camino progreso fortalecido junto seguirar ampliar él rayatodititititola6 sigueguayaquilsigar,2019-03-22
Cynthia,Viteri,CynthiaViteri6,ganador cynthiaviteri6,2019-03-22
Cynthia,Viteri,CynthiaViteri6,progreso guayaquil continuara cynthiaviteri6 sigueguayaquilsigar,2019-03-22
Cynthia,Viteri,CynthiaViteri6,ser campán hermoso todo vida hacer cada respaldo cada idea cada sonrisa cerrar inicio guayaquilfuturo construira voto domingo rayatodititititola6,2019-03-22
Cynthia,Viteri,CynthiaViteri6,ser testigo amor futuro alcaldesa guayaquil prueba guayaquileno decidir votar salud bienestar seguridad educacion innovacion muchisimo rayatodititititola6 cynthiaviteri6,2019-03-22
Cynthia,Viteri,CynthiaViteri6,equipo progreso seguir cumplir sueno guayaquil junto hacer posible sigueguayaquilsiguir rayatodititititola6,2019-03-22
Cynthia,Viteri,CynthiaViteri6,faltar dia guayaquil seguir ser referente grande sueno cumplido voto convertirer ciudad inteligente rayatodititititola6 sigueguayaquilsiguir,2019-03-22
Cynthia,Viteri,CynthiaViteri6,campán alegrio idea solución respaldo ser mejor gracias agradecer apoyo recibido cada rincon guayaquil permitirar sigar junto camino progreso rayatodititititola6 sigueguayaquilsiguir,2019-03-22
Cynthia,Viteri,CynthiaViteri6,solo seguir cumplir grande sueno seguirar liderar progreso bienestar guayaquileno domingo votar futuro votar guayaquil rayatoditititito6,2019-03-23
Cynthia,Viteri,CynthiaViteri6,guayaquil rayatoditititito6,2019-03-23
Cynthia,Viteri,CynthiaViteri6,partir equipo trabajaro seguridad generara empleo cumplir siempre hablar verdad domingo votar votar guayaquil rayatoditititito6,2019-03-24
Cynthia,Viteri,CynthiaViteri6,partir equipo trabajaro seguridad generara empleo cumplir siempre hablar verdad domingo votar votar guayaquil rayatoditititito6,2019-03-24
Cynthia,Viteri,CynthiaViteri6,votar vota guayaquil rayatoditititito6,2019-03-24
Cynthia,Viteri,CynthiaViteri6,ciudad detener sigar crecer junto domingo marzo rayatoditititito6,2019-03-24
Cynthia,Viteri,CynthiaViteri6,construira progreso bienestar voto seguira llevar guayaquil puntal alto desarrollo votar futuro ciudad rayatoditititito6,2019-03-24
Cynthia,Viteri,CynthiaViteri6,camino recorrer junto rayatoditititito6,2019-03-24
Cynthia,Viteri,CynthiaViteri6,alcaldesa cynthiaviteri6 grande,2019-03-25
Cynthia,Viteri,CynthiaViteri6,guayaquil decidar seguir camino progreso bienestar sigueguayaquilsigar,2019-03-25
Cynthia,Viteri,CynthiaViteri6,guayaquil seguir,2019-03-25
Cynthia,Viteri,CynthiaViteri6,comprometido trabajar fervientemente guayaquil mano dejar trabajar grande obra ciudad desayunos24,2019-03-25
Cynthia,Viteri,CynthiaViteri6,guayaquileno saber decimo hacer estar acostumbrado crecer ciudad desayunos24,2019-03-25
Cynthia,Viteri,CynthiaViteri6,comenzar primero rueda prenso equipo buen noticia amplio mayorio concejo municipal momento contar concejal integrar cynthiaalcaldesa,2019-03-25
Cynthia,Viteri,CynthiaViteri6,agradecer cada guayaquileno creer confiar hacer seguro ganar corazon trabajo arduo cynthiaalcaldesa,2019-03-25
Cynthia,Viteri,CynthiaViteri6,trabajo puntual distrito empezamos legalizacion monte sinai socio viviendo gobierno llegar guayaquil obra servicios cynthiaalcaldesar,2019-03-25
Cynthia,Viteri,CynthiaViteri6,segundo etapa guayarte seguir feria emprendimiento generarar empleo guayaquil cynthiaalcaldesar,2019-03-25
Cynthia,Viteri,CynthiaViteri6,heredo ciudad mundo heredo ciudad nuevo sueno suenos partir proyecto hacerlo realidad cynthiaalcaldesar,2019-03-25
Cynthia,Viteri,CynthiaViteri6,gracias guayaquil,2019-03-25
Cynthia,Viteri,CynthiaViteri6,gracias cada decidir guayaquil seguir comprometo cumplir obra seguirar transformar vida guayaquileno sigueguayaquilsigar,2019-03-26
Cynthia,Viteri,CynthiaViteri6,guayaquil eligio camino progreso bienestar alcaldesar ciudad cumplire prometo comprometo sigueguayaquilsigar,2019-03-27
Cynthia,Viteri,CynthiaViteri6,buen dia invito seguir entrevista vivo teleramaec perder,2019-03-28
Cynthia,Viteri,CynthiaViteri6,metroviar implementar bus fase evaluacion poner aire acondicionado adema incluir seguridad botones panico teleramaec,2019-03-28
Cynthia,Viteri,CynthiaViteri6,guayaquil seguirar crecer sintoniza radiocentroec conocer venir gran ciudad,2019-03-28
Cynthia,Viteri,CynthiaViteri6,guayaquil dejar ciudad politico hacer tiempo guayaquil votar resultado eficiencia sabido altura sueno radiocentroec,2019-03-28
Cynthia,Viteri,CynthiaViteri6,necesidad guayaquileno esperar atenderemo forma inmediato radiocentroec,2019-03-28
Cynthia,Viteri,CynthiaViteri6,vivo canalunotv pierda,2019-03-28
Cynthia,Viteri,CynthiaViteri6,abril nuevo brigada desintoxicacion atencion medica porunfuturosindroga seguir rescatar joven adicción canalunotv,2019-03-28
Cynthia,Viteri,CynthiaViteri6,informativoforever acompana cynthiaviteri6 alcaldesar electa guayaquil sintonizano 925fm,2019-03-29
Cynthia,Viteri,CynthiaViteri6,felicito valentia christian avilo cesar cagua colaborador puerto limpio haber rescatar bebe perimetral altura bastion gracias acto heroico amor losconfiables,2019-03-28
Cynthia,Viteri,CynthiaViteri6,comparto agenda medio manán perder conocer nuevo sueno cumplirer guayaquil,2019-03-28
Cynthia,Viteri,CynthiaViteri6,seguir jornada medio escuchame forever925 conocer seguir engrandeceir guayaquil nuevo obra elegir,2019-03-29
Cynthia,Viteri,CynthiaViteri6,sentir gratitud comprometer profundamente gracias guayaquileno gracias votar votar guayaquil hacer seguro trabajo ganaremos corazon forever925,2019-03-29
Cynthia,Viteri,CynthiaViteri6,ciudad digital ahora ciudad inteligente implementar herramienta comunicacion directo municipio ciudadania tecnologia innovacion forever925,2019-03-29
Cynthia,Viteri,CynthiaViteri6,venir nuevo programa nuevo sueno guayaquileno proxima semana empezar mesa trabajo cada director concejal adelantar proyecto empezaremo ejecutar proximo mayo forever925,2019-03-29
Cynthia,Viteri,CynthiaViteri6,seguir hablar grande proyecto venir ciudad amamos escuchame 680radioatalaya conocer seguir fortalecer bienestar cada familia guayaquilén,2019-03-29
Cynthia,Viteri,CynthiaViteri6,cada concejal proyecto interesante guayaquil ejemplo ursulastrengech llenara familia sufrir violencia jrodriguezecu cumplira diverso proyecto inclusion aguschmer incentivaro deporte 680radioatalaya,2019-03-29
Cynthia,Viteri,CynthiaViteri6,trabajo conjunto modelo progreso guayaquil sera replicado distinto parte pai 680radioatalaya,2019-03-29
Cynthia,Viteri,CynthiaViteri6,seguire escuchar primero mano guayaquileno visitar barrio casa querer ano proxima alcaldio 680radioatalaya,2019-03-29
Cynthia,Viteri,CynthiaViteri6,gracias general tanya varela invitacion acto reconocimiento mujer policia ejemplo valentia esfuerzo lograr guayaquil cada seguro,2019-03-29
Cynthia,Viteri,CynthiaViteri6,gracias general tanya varela invitacion acto reconocimiento mujer policia ejemplo valentia esfuerzo lograr guayaquil cada seguro,2019-03-30
Cynthia,Viteri,CynthiaViteri6,profundo admiracion reconocimiento mujer policia valentia arduo trabajo beneficio seguridad ciudadano junto coordinar acción proteger vida bienes,2019-03-30
Cynthia,Viteri,CynthiaViteri6,semana terminar atender necesidad anciano persona discapacidad habiar identificado ultimos recorrido alcaldesa seguire cerca junto cumplir sueno,2019-03-31
Cynthia,Viteri,CynthiaViteri6,saber dentro cabecita mundo entero magia amor aplauso dedicacion entregar hacia maravilloso hijo seguir trabajar junto ciudad inclusivo diamundialautismo,2019-04-02
Cynthia,Viteri,CynthiaViteri6,comparto agenda medio manán perder conocer trabajaremos junto guayaquil,2019-04-03
Cynthia,Viteri,CynthiaViteri6,comparto agenda medio perder conocer trabajaremos junto guayaquil,2019-04-03
Cynthia,Viteri,CynthiaViteri6,buen dia guayaquileno radio sucre700 conversar nuevo obra usted comenzar construir gracias voto,2019-04-03
Cynthia,Viteri,CynthiaViteri6,tendre cargo cerca millón guayaquileno deber velar trabajar fortalecer seguridad generar tanto obra servicio gente poder tener empleo rescatar hijo droga radio sucre700,2019-04-03
Cynthia,Viteri,CynthiaViteri6,todo propuesta campán estar debidamente planificado hacer prometimos radio sucre700,2019-04-03
Cynthia,Viteri,CynthiaViteri6,empezar trabajar incorporado software reconocimiento facial analisis caminar 1000 camara guayaquil tambien megafono iran camara seguridad acentuarar prevencion alerta radio sucre700,2019-04-03
Cynthia,Viteri,CynthiaViteri6,via comunicacion convertir guayaquil ciudad inteligente ciudadano podran decirno necesitar trav medio digital manera poder actuar rapido eficientemente guayaquil mejor radio sucre700,2019-04-03
Cynthia,Viteri,CynthiaViteri6,seguir jornada medio conversar ciudad amar escuchame radioelite9971 conocer seguir generar empleo fortalecer seguridad guayaquil,2019-04-03
Cynthia,Viteri,CynthiaViteri6,guayaquil hacer ano dejar pensar partido politico ciudad pensar progreso aqui trabajaremo equipo bienestar gente todo idea beneficien familia guayaquilena serar bienvenido radioelite9971,2019-04-03
Cynthia,Viteri,CynthiaViteri6,triunfo guayaquil guayaquileno decidir blindar ciudad seguir crecer cynthiaviteri6 momento cabinasucre,2019-04-03
Cynthia,Viteri,CynthiaViteri6,centro rehabilitacion fisico paralisis cerebral atenderar persona discapacidad intelectual centro rehabilitacion rescatar joven droga radioelite9971,2019-04-03
Cynthia,Viteri,CynthiaViteri6,iniciar rueda prenso conocer conformacion comite innovacion guayaquil trabajaremos conjunto institución educativo empresa privado organización junto lograrer ciudad inteligente innovadoro,2019-04-04
Cynthia,Viteri,CynthiaViteri6,heredoir ciudad mundo guayaquil nuevo sueno sueno parte proyecto corresponder hacerlo realidad,2019-04-04
Cynthia,Viteri,CynthiaViteri6,permitir ningun acto violencia quedar impune administracion alcaldio junto fortalecerer justicia ciudad,2019-04-05
Cynthia,Viteri,CynthiaViteri6,buen politico deber fantastico fanatico sino tener talento politico entrevistar cynthia viteri descubri cuyo vida pasado color todo cicatriz saber escuchar talento politico cynthiaviteri6 holaec,2019-04-06
Cynthia,Viteri,CynthiaViteri6,bienestar guayaquileno sero prioridad administracion alcaldesar guayaquil seguirar ser ejemplo eficiencia,2019-04-08
Cynthia,Viteri,CynthiaViteri6,seguir rescatar joven adicción 10ma brigado desintoxicacion atencion medica gratuito sabado abril hablar hacer porunfuturosindroga,2019-04-09
Cynthia,Viteri,CynthiaViteri6,junto seguir progresar alcanzar sueno,2019-04-10
Cynthia,Viteri,CynthiaViteri6,invitar sintonizar radiorumbaec rcristal870am conocer obra venir progreso guayaquil perder entrevista,2019-04-11
Cynthia,Viteri,CynthiaViteri6,vivo entrevista radiorumbaec sintonizar pierda,2019-04-11
Cynthia,Viteri,CynthiaViteri6,ampliar guarderia madre poder confianza trabajar implementar tambien dentro municipalidad radiorumbaec,2019-04-11
Cynthia,Viteri,CynthiaViteri6,guayaquil premiir excelencia logrado tener estudiante profesional excelencio ciudad radiorumbaec,2019-04-11
Cynthia,Viteri,CynthiaViteri6,seguir agenda medio entrevista rcristal870am perder guayaquil detener,2019-04-11
