nombre,apellidos,tweet_screen_name,tweet_text,tweet_date
Cynthia,Viteri,CynthiaViteri6,dijimos campana trabajar rcristal870am,2019-04-11
Cynthia,Viteri,CynthiaViteri6,continuaremos optimizar movilidad conectividad guayaquil cantón vecino rcristal870am,2019-04-11
Cynthia,Viteri,CynthiaViteri6,10ma brigada desintoxicacion atencion medica realizado socio vivienda seguir demostrar guayaquileno hablar hacer seguir transformar bien vida,2019-04-13
Cynthia,Viteri,CynthiaViteri6,eficiencia administracion municipal seguirar ser pilar fundamental,2019-04-15
Cynthia,Viteri,CynthiaViteri6,trabajar progreso desarrollo llegar cada rincon guayaquil,2019-04-16
Cynthia,Viteri,CynthiaViteri6,edison siempre saber contar amor incondicional madre cada minuto cada hora dia ocurrio tragedia hoja volante colegio adio solo nino dios consuelir corazon padre,2019-04-16
Cynthia,Viteri,CynthiaViteri6,buen dia guayaquileno rtsecuador conversar obra nuevo proyecto hacer posible pierda entrevista,2019-04-17
Cynthia,Viteri,CynthiaViteri6,defenderar siempre absoluto frontalidad bienestar grande mayoria rtsecuador,2019-04-17
Cynthia,Viteri,CynthiaViteri6,reunir dia distinto dirección analizar proyecto estar marcha nuevo venir comprometo altura nuevo sueno guayaquileno camino guayaquil siempre sera hacia progreso rtsecuador,2019-04-17
Cynthia,Viteri,CynthiaViteri6,seguir jornada medio sintonizar escuchame vivo radioamericaec conocer seguir crecer junto,2019-04-17
Cynthia,Viteri,CynthiaViteri6,iniciativa personal devuelto sociedad 1000 joven libre droga alcaldesar electa construirar centro rehabilitacion gratuito rescatare poder seguir rescatar devolverar brazo madre radioamericaec,2019-04-17
Cynthia,Viteri,CynthiaViteri6,seguridad trabajar ciudad punto dotar herramienta tecnologica fortalecer prevencion atrapar delincuente impulsar equipo derogacion ley prodelincuencial eliminar tabla droga radioamericaec,2019-04-17
Cynthia,Viteri,CynthiaViteri6,seguir conversar guayaquil escuchame tropicán conocer nuevo sueno junto cumplirer,2019-04-17
Cynthia,Viteri,CynthiaViteri6,aprendi muchisimo campán aprendi pelear gente salir calle causa aprendi caracter seguir ser parte deber encaminar gente querer necesitar tropicán,2019-04-17
Cynthia,Viteri,CynthiaViteri6,guayaquil acostumbro gente colaborar defender cuidar hacer crecer ciudad todo idea serar siempre bienvenido,2019-04-18
Cynthia,Viteri,CynthiaViteri6,entrevista cynthiaviteri6 revista holaec mujer fuerte saber convertir tragedia ejemplo superacion llegar nuevo alcaldesa guayaquil encuentro sincero lagrima risa anecdota finalmente poco politica,2019-04-22
Cynthia,Viteri,CynthiaViteri6,mano usado sanar conservar amor planeta lugar usado contaminar destruir riqueza celebrar diadelatierrir comprometiendono preservacion hogar,2019-04-22
Cynthia,Viteri,CynthiaViteri6,reunion alcalde alcaldesa partido junto fortalecer dedicacion eficiencia bienestar progresar cada cantón,2019-04-23
Cynthia,Viteri,CynthiaViteri6,trabajar fortalecer seguridad bienestar progreso guayaquileno todo obra elegir serar realidad,2019-04-24
Cynthia,Viteri,CynthiaViteri6,prioridad seguir transformar vida cada guayaquileno,2019-04-26
Cynthia,Viteri,CynthiaViteri6,profundo tristeza fallecimiento querido amigo julio juan romero grande radiodifusion pais solidaridad familia amigo,2019-04-28
Cynthia,Viteri,CynthiaViteri6,profundo tristeza fallecimiento julio juan romero querido amigo excelente profesional gran radiodifusor pais nota pesar digno familia amigo colaborador prestigioso radio cristal,2019-04-28
Cynthia,Viteri,CynthiaViteri6,profundo tristeza fallecimiento julio juan romero querido amigo excelente profesional gran radiodifusor pais nota pesar digno familia amigo colaborador prestigioso radio cristal,2019-04-28
Cynthia,Viteri,CynthiaViteri6,corazon municipio seguirar ser trabajo incesante bienestar guayaquileno venir etapa salud seguir atender necesidad eficiencia siempre nuevo tecnologia innovacion,2019-05-02
Cynthia,Viteri,CynthiaViteri6,gracias gestion voto casa obtuvir dato varios ciudadano empezar atender domicilio poder centro salud seguir enviar medico cada hogar continuar cumplir necesidad guayaquileno,2019-05-04
Cynthia,Viteri,CynthiaViteri6,trabajar ampliar progreso ciudad alegrio optimismo siempre caracterizado venir sueno bienestar,2019-05-08
Cynthia,Viteri,CynthiaViteri6,graciasnebot ano entrega progreso ciudad homenaje obra labor grito sigueguayaquilsiguir jaimenebotsaadi,2019-05-09
Cynthia,Viteri,CynthiaViteri6,seguir cumplir sueno guayaquileno entregar titulo propiedad 1307 familia lotar familia monte sinai camino seguir avanzar,2019-05-11
Cynthia,Viteri,CynthiaViteri6,seguir cumplir sueno guayaquileno entregar titulo propiedad 1307 familia lotar familia monte sinai camino seguir avanzar,2019-05-11
Cynthia,Viteri,CynthiaViteri6,carta escribi madre hacer ano ahora cada linea madre alma reflejado valor sacarme adelante vivia peor momento gracias dio lado traves feliz madre,2019-05-12
Cynthia,Viteri,CynthiaViteri6,sesion simbolico municipio guayaquil agradeceremo alcalde jaimenebotsaadi labor dar bienvenida nuevo periodo mismo causa,2019-05-14
Cynthia,Viteri,CynthiaViteri6,gracias alcalde jaimenebotsaadi ano batio guayaquil calle salon contar usted momento contar siempre graciasgye,2019-05-14
Cynthia,Viteri,CynthiaViteri6,municipio vanguardista tomar desafio utilizar tecnologia beneficiar guayaquileno junto llevar ciudad lider tecnologia graciasgye,2019-05-14
Cynthia,Viteri,CynthiaViteri6,votar casa tendrar visita medico permanentemente buscarlo dejarl salud bienestar dignidad graciasgye,2019-05-14
Cynthia,Viteri,CynthiaViteri6,primero centro bienestar animal contar tambien canoterapio nino algun tipo discapacidad fisico poder potenciar terapia graciasgye,2019-05-14
Cynthia,Viteri,CynthiaViteri6,seguir pintar ciudad verde jardines vertical arbol nativo edificio jardín terraza agricultura urbano guayaquil sonar grande graciasgye,2019-05-14
Cynthia,Viteri,CynthiaViteri6,instituto art oficio carrera gastronomia mecanico belleza tambien enfermeria graciasgye,2019-05-14
Cynthia,Viteri,CynthiaViteri6,atender nino joven mujer embarazado programa piloto porunfuturosindroga ahora hacer alcaldio centro desintoxicacion gratuito caer chico levantarer caer levantarer graciasgye,2019-05-14
Cynthia,Viteri,CynthiaViteri6,pondre alma servicio ciudad pedir dio sabidurio humildad bondad faltar fuerza voluntad elegir siempre elijo debil vivo guayaquil graciasgye,2019-05-14
Cynthia,Viteri,CynthiaViteri6,atender nino joven mujer embarazado programa piloto porunfuturosindroga ahora hacer alcaldio centro desintoxicacion gratuito caer chico levantarer caer levantarer graciasgye,2019-05-14
Cynthia,Viteri,CynthiaViteri6,pondre alma servicio ciudad pedir dio sabidurio humildad bondad faltar fuerza voluntad elegir siempre elijo debil vivo guayaquil graciasgye,2019-05-14
Cynthia,Viteri,CynthiaViteri6,consciente desafio corresponder asumir progreso creciente guayaquil cuento junto camino guayaquileno solo necesitas poner alma corazon ciudad graciasguayaquil,2019-05-14
Cynthia,Viteri,CynthiaViteri6,seguridad competencia local retomaremos plan seguridad poner camara reconocimiento facial colegio transporte publico tambien tendra camara botón panico ecuavisar,2019-05-15
Cynthia,Viteri,CynthiaViteri6,empezar nuevo nuevo concejo municipal constituido periodo 2019 2023 trabajaremos junto ninguno bandera politico color celestir blanco guayaquil concejal velar bienestar cada guayaquileno,2019-05-15
Cynthia,Viteri,CynthiaViteri6,empecer avance positivo inscribir guayaquil club grande servicio aguo mundo pertenecer grande ciudad realizarer intercambio experiencia ayudarar mejorar calidad agua evitar fuga llegar todo ciudad,2019-05-16
Cynthia,Viteri,CynthiaViteri6,visita puna encontre adolescente anos cuidar hija clase mujer poder cosa seguir cambiar quier hijo convertir motor jamas anclo,2019-05-17
Cynthia,Viteri,CynthiaViteri6,parroquia rural serar parte progreso guayaquil llegar isla poner entregar tablet panalera laboratorio computacion puna tendra hospital lancha ambulanciar atender salud,2019-05-18
