nombre,apellidos,tweet_screen_name,tweet_text,tweet_date
Cynthia,Viteri,CynthiaViteri6,buen dia guayaquileno vivo entrevista radio sucre engrandecer ciudad,2019-02-19
Cynthia,Viteri,CynthiaViteri6,siempre allar competencia demostrado seguir hacer respecta educacion seguridad salud bienestar familia guayaquilena radio sucre,2019-02-19
Cynthia,Viteri,CynthiaViteri6,nuevo aerovia bus electrico puente samborondon daule bicicleta publica seguir dar mayor facilidad conductor pasajero llegar tiempo destino sonar grande radio sucre,2019-02-19
Cynthia,Viteri,CynthiaViteri6,perfectamente sentir madre enviar hijo escuela implementarer camara seguridad aser colegio escuela alejar vendedor droga hijos radio sucre,2019-02-19
Cynthia,Viteri,CynthiaViteri6,joven cantera acompanar candidata cynthiaviteri6 gran caravana distrito2 junto candidato josuesanchezec luzmilanicolald caicedoegis consueloflor jxcabrer futuro prefecto clmoralesb seguir campana,2019-02-19
Cynthia,Viteri,CynthiaViteri6,sergio toral progreso guayaquil gracia calido recibimiento demostrar seguir cumplir sueno junto mano estarir grande obra sigueguayaquilsigar,2019-02-20
Cynthia,Viteri,CynthiaViteri6,buen dia guayaquil conocer venir ciudad escuchandomar vivo radiocentroec sintonizar esperar,2019-02-20
Cynthia,Viteri,CynthiaViteri6,flor bastion primero centro rehabilitacion gratuito tratamiento adicción estarir ubicado chongon salitral guasmo recuperar futuro esperanza joven radiocentroec,2019-02-20
Cynthia,Viteri,CynthiaViteri6,plan seguridad camara reconocimiento facial analisis caminar embargo ninguno accion funcionar asamblea hacer hacer derogar ley prodelincuencial eliminar tabla consumo droga radiocentroec,2019-02-20
Cynthia,Viteri,CynthiaViteri6,mismo oficina podrar junto entidad intervenir permiso construccion funcionamiento manero solicitud podro gestionar él solo lugar radiocentroec,2019-02-20
Cynthia,Viteri,CynthiaViteri6,estarir responder inquietud joven guayaquileno debate ciudadano invito participar encuentro 00pm facebook live jovenesconcynthia,2019-02-20
Cynthia,Viteri,CynthiaViteri6,centro tratamiento persona adicción flor bastion grande sueno cristalizar centro guayaquil prometemo comprometer,2019-02-20
Cynthia,Viteri,CynthiaViteri6,vivo debatir joven guayaquileno idea esfuerzo perseverancia harar guayaquil ciudad admirable sigueno facebook live jovenesconcynthia,2019-02-21
Cynthia,Viteri,CynthiaViteri6,acuario virtual implementar consiste tunel podrar vida marino cualquiera parte mundo proteccion medio ambiente fundamental jovenesconcynthia,2019-02-21
Cynthia,Viteri,CynthiaViteri6,gracias kevin preguntar encontrar empleo preocupación joven distrito sero espacio innovacion emprendimiento impulsara idea seguire fortalecer acción permitir emprender jovenesconcynthio,2019-02-21
Cynthia,Viteri,CynthiaViteri6,maria belir pequena papa enseno amar animal siempre animal abandonado rescato ahora perro gato dejado padre perro alcaldesar implementare centro bienestar animal jovenesconcynthia,2019-02-21
Cynthia,Viteri,CynthiaViteri6,cada accion traero empleo crearer incentivo convertir guayaquil entorno atractivo filmacion pelicula internacional gracias alberto idea jovenesconcynthio,2019-02-21
Cynthia,Viteri,CynthiaViteri6,joan venir segundo fase guayarte seguir impulsar tipo proyecto generar empleo turismo inversion jovenesconcynthia,2019-02-21
Cynthia,Viteri,CynthiaViteri6,incentivar fortalecer proyecto deportivo medio vencer droga recuperarer futuro joven jovenesconcynthia,2019-02-21
Cynthia,Viteri,CynthiaViteri6,gracia ursulastrengech compartir experiencia impulsarer emprendimiento joven guayaquil seguir ser ciudad ejemplar jovenesconcynthio,2019-02-21
Cynthia,Viteri,CynthiaViteri6,mucho gracia querido joven alcaldesar escuchare siempre impulsar idea engrandecer guayaquil jovenesconcynthia,2019-02-21
Cynthia,Viteri,CynthiaViteri6,hacer mejor debate guayaquil gracias compartir sueno jovenesconcynthia,2019-02-21
Cynthia,Viteri,CynthiaViteri6,cynthiaviteri6 ayer debatio teniar hacer él joven presente futuro ciudad idea claro propuesta exitoso camino trazado hacia progreso bienestar guayaquileno cynthia2019,2019-02-21
Cynthia,Viteri,CynthiaViteri6,guayaquil seguirar camino progreso bienestar cada familia corazon estara dedicado social mano trabajarir grande obra junto hacer futuro sigueguayaquilsigar,2019-02-21
Cynthia,Viteri,CynthiaViteri6,gracias pascua él compartir hermoso manán jueves alegrio carino fortalecer nuevo sueno liderar futuro guayaquil desarrollo progreso bienestar innovacion,2019-02-21
Cynthia,Viteri,CynthiaViteri6,ayer conversar joven guayaquileno nuevo obra venir guayaquil hacer tambien pascual reafirmar respaldo incondicional equipo gran caravana progreso gracias carino sigueguayaquilsigar,2019-02-22
Cynthia,Viteri,CynthiaViteri6,junto hacer futuro guayaquil ciudad pascuales apoyar cynthiaviteri6 clmoralesb gran equipo concejal representar distrito gracias confiar rayatodititititola6 luzmilaconcejal cynthiaalcaldesar,2019-02-22
Cynthia,Viteri,CynthiaViteri6,manán sabado febrero esperar brigado desintoxicacion atencion medica gratuito llevar bienestar todo familia cada rincon ciudad junto hacer futuro porunfuturosindroga,2019-02-22
Cynthia,Viteri,CynthiaViteri6,terminar semana recibir respaldo incondicional guayacán compromiso seguir trabajar grande obra llevar bienestar cada junto lograremo sigueguayaquilsigue,2019-02-23
Cynthia,Viteri,CynthiaViteri6,manán tambien progreso posorgir parte progreso guayaquil llegarer grande obra impulsar turismo traerar empleo junto lograrer,2019-02-24
Cynthia,Viteri,CynthiaViteri6,gracias febr cordero gran caravana demostrar guayaquil seguirar camino progreso llevar empleo seguridad rescatar joven droga sigueguayaquilsigar,2019-02-24
Cynthia,Viteri,CynthiaViteri6,semana reafirmar compromiso seguir cumplir sueno guayaquil parte progreso gran ciudad sigueguayaquilsigar,2019-02-24
Cynthia,Viteri,CynthiaViteri6,manana arrancar semana agendo medio perder entrevista conocer nuevo sueno cumplirer guayaquil esperar,2019-02-25
Cynthia,Viteri,CynthiaViteri6,excelente inicio semana guayaquileno empezar lunes conversar radiomorena640 nuevo obra seguirar llenar progreso bienestar cada rincon guayaquil,2019-02-25
Cynthia,Viteri,CynthiaViteri6,semana brigado desintoxicacion joven consumir droga atender adema ecografia rayos medicina general odontologiar alrededor persona ferio salud radiomorena640,2019-02-25
Cynthia,Viteri,CynthiaViteri6,pondrer camara reconocimiento facial analisis caminar escuela colegio vendedor drogo saber estan ser vigilar cscg policia nacional camara estarir orden fuerza publicar radiomorena640,2019-02-25
Cynthia,Viteri,CynthiaViteri6,emocionante hablar nuevo sueno venir guayaquil conocelo escuchar entrevista rcristal870am,2019-02-25
Cynthia,Viteri,CynthiaViteri6,sabado llovio fuerte guayaquil pleno lluvia gente saliar casa negocio demostrarno respaldo seguir dispuesto dar él crecimiento ciudad rcristal870am,2019-02-25
Cynthia,Viteri,CynthiaViteri6,seguir hablar futuro guayaquil escuchame radioaguilar sintonizar 1050am conocer seguir crecer,2019-02-25
Cynthia,Viteri,CynthiaViteri6,momento guayaquil contar escuela deportivo municipal adema entregar uniforme gratuito junto candidato aguschmer distrito fortalecerer programa deportivo guayaquileno radioaguilar,2019-02-25
Cynthia,Viteri,CynthiaViteri6,guayaquil crecera equipo progreso gracias guasmo respaldo compromiso seguir camino sueno cumplido sigueguayaquilsiguir,2019-02-26
Cynthia,Viteri,CynthiaViteri6,exito cynthiaviteri6 guasmo sigueguayaquilsigar,2019-02-26
Cynthia,Viteri,CynthiaViteri6,propuesta junto decidir futuro guayaquil,2019-02-26
Cynthia,Viteri,CynthiaViteri6,vivo entrevista radio sucre ciudad jamas detener seguir implementar nuevo obra pierda,2019-02-26
Cynthia,Viteri,CynthiaViteri6,entregar titulo propiedad monte sinai socio vivienda alcaldesa completare faltar obra servicio radio sucre,2019-02-26
Cynthia,Viteri,CynthiaViteri6,sitio construir rehabilitar potencia mercado vendedor comerciant autonomos podrar trabajar manera ordenado comprometer radio sucre,2019-02-26
Cynthia,Viteri,CynthiaViteri6,sitio construir rehabilitar potenciar mercado vendedor comerciant autonomos podrar trabajar manera ordenado comprometer radio sucre,2019-02-26
Cynthia,Viteri,CynthiaViteri6,joven lacanteraec mesa trabajo guayaquil suena llevar idea joven ciudad querer idea cynthiaviteri6 hara guayaquil querer,2019-02-26
Cynthia,Viteri,CynthiaViteri6,nino recibir uniforme seguir practicar deporte mantendremo ampliar cada accion impulse destreza nino joven junto hacer futuro,2019-02-26
Cynthia,Viteri,CynthiaViteri6,seguir compartir sueno cumplir guayaquil partir mayo sintonizar 680radioatalaya,2019-02-28
Cynthia,Viteri,CynthiaViteri6,seguir llegar bienestar cada rincon guayaquil registratar plan habitacional vivienda futuro aqui sigueguayaquilsigar,2019-02-27
Cynthia,Viteri,CynthiaViteri6,buen miercol guayaquil radiosantiagoec conversar nuevo obra seguirar llenar progreso bienestar cada familia guayaquilén,2019-02-27
Cynthia,Viteri,CynthiaViteri6,gente siempre querer administracion municipal devolver obra pagar trav impuesto modelo invierte ingreso grande obra seguir haciendolo radiosantiagoec,2019-02-27
Cynthia,Viteri,CynthiaViteri6,37mil vendedor sido formalizar nuevo vendedor ampliar haremo nuevo mercado posorgir mercado marisco pescado muelle mercado minorista adema contarar credito banco oportunidad radiosantiagoec,2019-02-27
Cynthia,Viteri,CynthiaViteri6,bus urbano contar tendrar boton panico alertaro policia nacional cscg adema camara reconocimiento facial analisis caminar cual estarir ubicado tambien colegio radiosantiagoec,2019-02-27
Cynthia,Viteri,CynthiaViteri6,guayaquil seguirar crecer forma ordenado planificacion estrategico plan viviendo implementarer partir mayo junto hacer posible sigueguayaquilsigue,2019-02-28
Cynthia,Viteri,CynthiaViteri6,crear empleo fortalecer seguridad rescatar joven droga principal compromiso guayaquileno distrito junto seguir camino progreso bienestar guayaquil sigueguayaquilsigar,2019-02-28
Cynthia,Viteri,CynthiaViteri6,nuevo plan seguridad incluir colocacion camara reconocimiento facial escuela colegio alejar vendedor droga hijos 680radioatalaya,2019-02-28
Cynthia,Viteri,CynthiaViteri6,guayaquil ciudad digital ahora convertir ciudad inteligente primero ecuador guayaquileno alcaldio estarir cerca sigueguayaquilsigar,2019-02-28
Cynthia,Viteri,CynthiaViteri6,compartir grata entrevista programa medio canalunotv conversar fortalecimiento programa amiga solo partir mayo guayaquil sero ejemplo luchar violencia genero,2019-02-28
Cynthia,Viteri,CynthiaViteri6,visitar laboratorio innovacion labinplus contar ciudad alcaldesa mantendre ampliare acceso tecnologia innovacion creatividad nino joven lograrer progreso guayaquil,2019-02-28
Cynthia,Viteri,CynthiaViteri6,visitar candidata cynthiaviteri6 labin arián leonor mayra explicar proyecto veredaslimpia lider buscar solución creativo problema construir cuidad pais innovador guayaquilin piesain,2019-02-28
Cynthia,Viteri,CynthiaViteri6,esperar conversatorio mujer guayaquilena aporte vital progreso guayaquil siguelo facebook live mujeresconcynthio,2019-02-28
Cynthia,Viteri,CynthiaViteri6,guayaquil contar ahora centro geriatrico primero tener tambien implementaremos centro rehabilitacion fisico anciano sero primero equipo tecnologico puntar mujeresconcynthio,2019-03-01
Cynthia,Viteri,CynthiaViteri6,combatir violencia intrafamiliar contar programa amiga solo poder llamar 1800 poder recibir apoyo seguir fortalecer acción defender mujer mujeresconcynthio,2019-03-01
Cynthia,Viteri,CynthiaViteri6,cada accion municipal generar empleo guayaquil crecera esfuerzo mujeresconcynthio,2019-03-01
Cynthia,Viteri,CynthiaViteri6,poder victima compliz pasar hijo formar esposo mujer construir mejor sociedad familia mujeresconcynthio,2019-03-01
Cynthia,Viteri,CynthiaViteri6,escuela padre sero parte programa prevencion hogar poder promover ciudad junto hacer posible mujeresconcynthio,2019-03-01
Cynthia,Viteri,CynthiaViteri6,empezar escucharno mismo querer avanzar mujer nino estarir desprotegido mujeresconcynthio,2019-03-01
Cynthia,Viteri,CynthiaViteri6,aplauso todo madre lucha ganado hijo rescatado droga contar conmigo pelear junto mujeresconcynthio,2019-03-01
Cynthia,Viteri,CynthiaViteri6,escucharir siempre junto construir ciudad respeto valor fundamental familia mujeresconcynthio,2019-03-01
Cynthia,Viteri,CynthiaViteri6,gracias respaldo incondicional mujeresconcynthio,2019-03-01
Cynthia,Viteri,CynthiaViteri6,siempre escuchar idea preocupación mujer parte importante progreso guayaquil proteger él defenderla impulsarla gracia respaldo mujeresconcynthia,2019-03-01
Cynthia,Viteri,CynthiaViteri6,llego viernes empecer conversar nuevo sueno junto cumplirer guayaquil escuchame radioamericaec sintonizar,2019-03-01
Cynthia,Viteri,CynthiaViteri6,ayer debate mujer guayaquilena escuchar propuesta tambien planteamiento horo vivo corte responder pregunta guayaquilena semana anterior hicimo joven radioamericaec,2019-03-01
Cynthia,Viteri,CynthiaViteri6,hacer presentamo robir maten violen secuestrar salir carcel medida alternativo coip deber revisar junto bloque seguir impulsar derogacion ley prodelincuencial radioamericaec,2019-03-01
Cynthia,Viteri,CynthiaViteri6,empezar colocar botón panico bus activarlo patrullero policia nacional podrar rodear contar senal alerta llegar centro control policia nacional cscg radioamericaec,2019-03-01
Cynthia,Viteri,CynthiaViteri6,seguir jornada medio conocer nuevo obra seguirar engrandeceir ciudad escuchame radioelite9971 sintonizar pierda entrevista,2019-03-01
Cynthia,Viteri,CynthiaViteri6,mientras deber debate candidato alcald debatir guayaquilena escuchamo mujer discapacidad joven proyecto madr chico consumir droga mujer desempleado profesional temo violencia radioelite9971,2019-03-01
Cynthia,Viteri,CynthiaViteri6,mientras dar debate candidato alcald debatir guayaquilena escuchamo mujer discapacidad joven proyecto madr chico consumir droga mujer desempleado profesional tema violencia radioelite9971,2019-03-01
Cynthia,Viteri,CynthiaViteri6,loma florido socio vivienda respaldo guayaquil seguir progresar equipo seguirar convertir ciudad ejemplo prosperidad desarrollo sigueguayaquilsigar,2019-03-02
Cynthia,Viteri,CynthiaViteri6,repotenciarer centro atencion medico gracias telemedicina implementar partir mayo llegaremos salud cada rincon guayaquil sigueguayaquilsigar,2019-03-02
Cynthia,Viteri,CynthiaViteri6,nunca deber cuidar ciudad trabajo costado levantar junto seguir camino progreso guayaquil sigueguayaquilsigar,2019-03-02
Cynthia,Viteri,CynthiaViteri6,desarrollo guayaquil construir educacion contaremos instituto carrera corto capacitar joven carrera futuro seguir crecer,2019-03-03
Cynthia,Viteri,CynthiaViteri6,cada semana pasar acerca guayaquilfuturo junto construirer gracia respaldo sigueguayaquilsiguir,2019-03-04
Cynthia,Viteri,CynthiaViteri6,fortalecerer seguridad escuela colegio camara reconocimiento facial analisis caminar tecnologia eficiencia coordinacion protegeremos hijo,2019-03-04
Cynthia,Viteri,CynthiaViteri6,razon guayaquil seguir continuare defender cada sueno junto lograrer ciudad progreso bienestar sigueguayaquilsigar,2019-03-05
Cynthia,Viteri,CynthiaViteri6,proteger mujer nino violencia guayaquil ampliar fortalecerer programa amiga solo sigueguayaquilsigar,2019-03-06
Cynthia,Viteri,CynthiaViteri6,seguir conversar rcristal870am guayaquilfuturo acerca escuchamir sintonizar 870am,2019-03-06
Cynthia,Viteri,CynthiaViteri6,vivir venezuela tragedia humanitario real nuevo presidente reconocido varios país recorridir distinto nación encontrar fuerza permitir recuperar economia bienestar tierrar siempre prospero rcristal870am,2019-03-06
Cynthia,Viteri,CynthiaViteri6,ubicado sitio centro rehabilitacion gratuito construirer estaro guasmo salitral chongon flor bastion junto escudo protegera futuro rcristal870am,2019-03-06
Cynthia,Viteri,CynthiaViteri6,ubicado sitio centro rehabilitacion gratuito construirer estaro guasmo salitral chongon flor bastion junto escudo protegera futuro rcristal870am,2019-03-06
Cynthia,Viteri,CynthiaViteri6,hablar seguridad tecnologia implementarer reconocer rostro movimiento delincuente cada propuesta planificado guayaquileno confiar saber hablar hacer rcristal870am ,2019-03-06
Cynthia,Viteri,CynthiaViteri6,iniciar tarde conversar nuevo obra venir guayaquil pierda entrevista escuchame radioi99 sintonizar,2019-03-06
Cynthia,Viteri,CynthiaViteri6,temor sentir madre dejar hijo escuela poder vender droga salir colocare camara reconocimiento facial analisis caminar establecimiento junto protegeremos hijo radioi99,2019-03-06
Cynthia,Viteri,CynthiaViteri6,aquiparatoda visito candidata alcaldia guayaquil lista cynthiaviteri6,2019-03-06
Cynthia,Viteri,CynthiaViteri6,aquiparatoda visito candidata alcaldia guayaquil lista cynthiaviteri6,2019-03-06
Cynthia,Viteri,CynthiaViteri6,hablar nuevo sueno junto cumplirer lleno felicidad entusiasmo venir guayaquilfuturo sigueguayaquilsigar,2019-03-07
Cynthia,Viteri,CynthiaViteri6,ejercito gomez rendon escuche cada necesidad sueno razon guayaquil seguir continuare defender cada sueno junto lograrer ciudad progreso bienestar sigueguayaquilsigar,2019-03-07
Cynthia,Viteri,CynthiaViteri6,buen dia comenzar agendo medio entrevista radiomorena640 pierda,2019-03-07
Cynthia,Viteri,CynthiaViteri6,guayaquil progresado gracias eficiente administracion alianza publico privado hacer grande obra beneficio todo familia radiomorena640,2019-03-07
Cynthia,Viteri,CynthiaViteri6,mama hijo problema aprendizaje podran llegar centro atendido manera adecuado competencia seguir abrazar hijo guayaquil radiomorena640,2019-03-07
Cynthia,Viteri,CynthiaViteri6,seguir conversar sueno venir guayaquil radiorumbaec sintonizar,2019-03-07
Cynthia,Viteri,CynthiaViteri6,guayaquil seguirar mejorar fluidez transito solución vial aerovia renovacion buses bus electrico puente radiorumbaec,2019-03-07
Cynthia,Viteri,CynthiaViteri6,programa municipal amiga solo protegar mujer sufrir violencia intrafamiliar ayuda inmediato asesoria legal refugio alianza fundacion hogar cristo radiorumbaec,2019-03-07
Cynthia,Viteri,CynthiaViteri6,vivo 680radioatalaya pierda entrevista conocer nuevo obra implementarer guayaquil esperar,2019-03-07
Cynthia,Viteri,CynthiaViteri6,planificado centro rehabilitacion droga todo madre flor bastion salitral chongon guasmo recuperar futuro hijo atencion reinsercion estudiar construccion quinto centro 680radioatalaya,2019-03-07
Cynthia,Viteri,CynthiaViteri6,compromiso familia pún 680radioatalaya,2019-03-07
Cynthia,Viteri,CynthiaViteri6,propuesta estar enfocado generar empleo guayaquil crecerar costa inversion oportunidad emprendimiento solución habitacional mayor movilidad sonar grande 680radioatalaya,2019-03-07
Cynthia,Viteri,CynthiaViteri6,continuar conversar guayaquilfuturo pierda entrevista radiocanelaec sintonizar,2019-03-07
Cynthia,Viteri,CynthiaViteri6,mujer sufrir violencia intrafamiliar estarir cada protegida radiocanelaec,2019-03-07
Cynthia,Viteri,CynthiaViteri6,implementar plan piloto agente municipal moto aprehender delincuente aplicar nuevo plan seguridad firmezar ningun acto violencia quedar impune radiocanelaec,2019-03-07
Cynthia,Viteri,CynthiaViteri6,pequena alegrado corazon rescatar animalito calle seguir hacer ahora mayor alegria alcaldesar trabajare tambien construir centro bienestar animal guayaquil,2019-03-07
Cynthia,Viteri,CynthiaViteri6,alegrio regalo distrito solo poder significar cosa guayaquilfuturo cerca grande sueno seguirar engrandeceir futuro ciudad sigueguayaquilsigar,2019-03-08
Cynthia,Viteri,CynthiaViteri6,terminar semana conversar guayaquil amar escuchame tropicán sintonizar conocer seguir crecer junto,2019-03-08
Cynthia,Viteri,CynthiaViteri6,atendido alrededor 1400 llamado auxilio trav programa amiga solo alli orientar victima materia legal asistir tratamiento psicologico reunificar familia otorgar refugio hogar cristo tropicán,2019-03-08
Cynthia,Viteri,CynthiaViteri6,costa paso peatonal inclusivo ascensor ampliarar carril bombero contaremos paso desnivel deltar tambien tendra camara conectado ecu911 parte plan movilidad tropicán,2019-03-08
Cynthia,Viteri,CynthiaViteri6,seguir conversar futuro guayaquil escuchame radioamericaec conocer nuevo obra fortalecerar camino progreso,2019-03-08
Cynthia,Viteri,CynthiaViteri6,proposito guayaquilena producir camis expuesto centro comercial vendar producto hacer mismo geriatrico adema otorgar credito emprendimiento radioamericaec,2019-03-08
Cynthia,Viteri,CynthiaViteri6,aqui ley hecho proteger delincuente deber exigir asamblea cumplir deber deber reformar coip delincuent salgar carcel medida alternativo derogar tabla consumo droga radioamericaec,2019-03-08
Cynthia,Viteri,CynthiaViteri6,mujer enfrentar cada desafio impulsar fuerte valiente seguir luchar junto violencia igualdad oportunidad felizdiadelamujer,2019-03-08
Cynthia,Viteri,CynthiaViteri6,administracion ampliar sueno tener casa propio lote lot servicio plan vivienda popular serar realidad experiencia ingrés comenzar hacer realidad sueno,2019-03-09
Cynthia,Viteri,CynthiaViteri6,administracion ampliar sueno tener casa propio lote lot servicio plan vivienda popular serar realidad experiencia ingrés comenzar hacer realidad sueno,2019-03-09
Cynthia,Viteri,CynthiaViteri6,administracion ampliar sueno tener casa propio lote lot servicio plan vivienda popular serar realidad experiencia ingrés comenzar hacer realidad sueno,2019-03-09
Cynthia,Viteri,CynthiaViteri6,sigueguayaquilsiguir grito ayer escuchar cada rincon guayaquil distrito ciudad nadie aqui seguir sonar grande,2019-03-10
Cynthia,Viteri,CynthiaViteri6,sigueguayaquilsiguir grito ayer escuchar cada rincon guayaquil distrito ciudad nadie aqui seguir sonar grande,2019-03-10
Cynthia,Viteri,CynthiaViteri6,sigueguayaquilsiguir grito ayer escuchar cada rincon guayaquil distrito ciudad nadie aqui seguir sonar grande,2019-03-10
Cynthia,Viteri,CynthiaViteri6,gracias guayaquil demostrar junto mejor equipo semana lleno alegrio respaldo sigueguayaquilsiguir,2019-03-11
Cynthia,Viteri,CynthiaViteri6,buen dias guayaquileno lunes empezar conversar futuro progreso seguir ampliar escuchame vivo radiohuancavilk,2019-03-11
Cynthia,Viteri,CynthiaViteri6,decir hare centro rehabilitacion ubicaran guasmo salitral flor bastion chongon tambien financiamiento cantidad persona serar atendido propongo estudiado radiohuancavilk,2019-03-11
Cynthia,Viteri,CynthiaViteri6,puno hacer nuevo mercado construirer tambien hospital atencion posorja muelle centro acopio mercado minorista marisco pescado parroquia rural tambien seguiran crecer radiohuancavilk,2019-03-11
Cynthia,Viteri,CynthiaViteri6,seguir jornada medio lunes escuchame rcristal870am sintonizar 870am conocer nuevo sueno seguirar engrandeceir guayaquil,2019-03-11
Cynthia,Viteri,CynthiaViteri6,ahora nuevo etapa educacion tecnologia distrito primero centro abierto innovacion tambien instituto tecnologico carrera futuro instituto tecnologico unirar centro art oficio rcristal870am,2019-03-11
Cynthia,Viteri,CynthiaViteri6,iniciativa personal logrado atender 2000 persona droga hijo hijo hijo guayaquil seguirar ser atender mejor manera junto cambiar cadena brazo madr rcristal870am,2019-03-11
Cynthia,Viteri,CynthiaViteri6,ahora nuevo etapa educacion tecnologia distrito primero centro abierto innovacion tambien instituto tecnologico carrera futuro instituto tecnico unirar centro art oficio rcristal870am,2019-03-11
Cynthia,Viteri,CynthiaViteri6,sabado parque acuatico multiproposito fortin sero brigado desintoxicacion atencion medica contara psicologo medicina general odontologos atencion geriatrico rehabilitacion fisico medicamento gratuito rcristal870am,2019-03-11
Cynthia,Viteri,CynthiaViteri6,sonreir seguir hablar manana nuevo obra llenarar bienestar cada familia guayaquil escuchame vivo radioi99 sintonizar,2019-03-11
Cynthia,Viteri,CynthiaViteri6,madre interés resuelir falta empleo entregar credito banco oportunidad querer proteger hijo poner camara reconocimiento facial analisis caminar colegio radioi99,2019-03-11
Cynthia,Viteri,CynthiaViteri6,construir guayaquil hacer grande radioi99,2019-03-11
Cynthia,Viteri,CynthiaViteri6,agradecido dio vida futbol pues permitido tener vinculo cercano suenos gente nunca convencido camino construir juventud feliz sano positivo sigueguayaquilsiguir cynthiaviteri6,2019-03-11
Cynthia,Viteri,CynthiaViteri6,equipo progreso junto montanomayra luisalmeidam lauritaarteaga6 seguir transformar guayaquil votar toditititito concejal distrito sigueguayaquilsigar,2019-03-11
Cynthia,Viteri,CynthiaViteri6,isla trinitario recibio gran carino respaldo harar ciudad grande junto hacer posible sueno guayaquil sigueguayaquilsigar,2019-03-12
Cynthia,Viteri,CynthiaViteri6,buen dia guayaquil seguirar crecer mucho obra servicio todo familia conocer propuesta sintonizar radio sucre,2019-03-12
Cynthia,Viteri,CynthiaViteri6,todo familia guayaquilena tendrar titulo propiedad radio sucre,2019-03-12
Cynthia,Viteri,CynthiaViteri6,guayaquil deber crecer ordenadamente impulsar desarrollo hacia costa plan viviendo comercio emprendimiento optimizacion transito generarar empleo radio sucre,2019-03-12
Cynthia,Viteri,CynthiaViteri6,confianza hijo significar mismo nivel deber saber autoridad elclubec,2019-03-12
Cynthia,Viteri,CynthiaViteri6,haber criar hijo manero necesitar estir solo elclubec,2019-03-12
Cynthia,Viteri,CynthiaViteri6,fuerza poner madre rescatar hijo droga admirable seguir apoyar devolver futuro joven elclubec,2019-03-12
Cynthia,Viteri,CynthiaViteri6,gracias invitacion programa club manán elclubec mujer madr seguir defender impulsar hijo junto hacer posible,2019-03-12
Cynthia,Viteri,CynthiaViteri6,querer llegar conmigo alcaldia mejor ser parte vida acompanir concejal josuesanchezec luzmilanicolal2 caicedoegis consueloflor permitiran cumplir sueno distrito sigueguayaquilsigar,2019-03-12
