nombre,apellidos,tweet_screen_name,tweet_text,tweet_date
Jorge,Yunda,LoroHomero,disfrutar linda noche barrio elconde4 gracias recibimiento emotivo permitirno compartir plan trabajo lorohomero futuro alcalde quito votatodo19 quitograndeotravez,2019-02-17
Jorge,Yunda,LoroHomero,gran recibimiento alangasi tingo futuro concejal rural listo jorge yunda alcalde quito lorohomero panasjorgeyundo jorenpanyun3 renebedon santiguarderas joseph maurici tvclacomunidad bolivararmijo mauriciorodasec luisfer593 stalindo1977,2019-02-18
Jorge,Yunda,LoroHomero,animal viral lorohomero mimado novia,2019-02-18
Jorge,Yunda,LoroHomero,henry descanso 2019 alangasi jorge yunda alcalde quito lorohomero santiguardera panasjorgeyundo jorenpanyun3 joseph maurici rpcjorge luisfer593,2019-02-18
Jorge,Yunda,LoroHomero,felizmart mil persona cantar cancion letro lorohomero artista alcalde apoyar joven tarde hacer deporte danza musico teatro quitograndeotravez lilianayundar santiguardera patricioubidiab,2019-02-19
Jorge,Yunda,LoroHomero,terminar recorrido mercado cuadra querido quito junto lorohomero hacer regresen obra empleo seguridad gracias apoyo,2019-02-19
Jorge,Yunda,LoroHomero,martes agosto 1938 alangasi sufrio terremoto asolo pueblo iglesia perdio cupular quedo cuarteado poco dias empezo reconstruccion unidad alangaseno lorohomero 24horasuio tvclacomunidad mauriciorodasec patrimonioyc,2019-02-20
Jorge,Yunda,LoroHomero,sportv junto juanmaguirre1 presidente sdquito candidato concejal capital lista19 lorohomero,2019-02-20
Jorge,Yunda,LoroHomero,quito lorohomero moncayo liderar encuesta alcalde personal lorohomero plan trabajo bien organizado real venir marzo,2019-02-20
Jorge,Yunda,LoroHomero,compartir gran lorohomero liga barrial andr king quitograndeotravez panasjorgeyundo antoniojosedesucre concejal2019,2019-02-20
Jorge,Yunda,LoroHomero,mientras gastar millón campán politico hospital eugenio espejo atencion quimioterapia medicamento lenin lorohomero patodiazguevara alejaduquer,2019-02-20
Jorge,Yunda,LoroHomero,doctor jorge yunda lorohomero seguir recorrer rincón capital escuchar mandant quitograndeotravez yundaes19 yundaalcalde19,2019-02-20
Jorge,Yunda,LoroHomero,miercol reunir gran equipo subir ilalo llegar cruz futuro concejal rural candidato gads parroquia alangasi merced lista porunalangasituristico lorohomero santiguardera,2019-02-20
Jorge,Yunda,LoroHomero,futuro alcalde lorohomero dar quito pichincho seguridad preventivo camara video barrio drón monitorear majestadfm,2019-02-20
Jorge,Yunda,LoroHomero,querer obligación pesimo servicio srioficialec lorohomero patodiazguevara,2019-02-21
Jorge,Yunda,LoroHomero,buen dias caminant vida,2019-02-21
Jorge,Yunda,LoroHomero,feliz colega,2019-02-21
Jorge,Yunda,LoroHomero,lorohomero lorito bien claro comparti poner gente querer hacer mando saludo miami espero llegar alcaldio danny,2019-02-21
Jorge,Yunda,LoroHomero,lorohomero feliz doctor exito quito espero visite barrio rancho pino,2019-02-21
Jorge,Yunda,LoroHomero,lorohomero usted quitar salir adelante poder feliz medico abrazo,2019-02-21
Jorge,Yunda,LoroHomero,lorohomero feliz medic gracias gran labor,2019-02-21
Jorge,Yunda,LoroHomero,lorohomero feliz,2019-02-21
Jorge,Yunda,LoroHomero,xavierozevallos pablo serrano88 creer 2016 elnacionalec llegar copa libertadores influencia equipo lorohomero dejar 2015 estabilidad inicial manjarrez cosecho,2019-02-21
Jorge,Yunda,LoroHomero,siempre junto pueblo hacer pequenos hermano jorge yunda lorohomero contigo quitograndeotravez yundaalcalde19 yundaes19,2019-02-21
Jorge,Yunda,LoroHomero,lorohomero propuesta taxista,2019-02-22
Jorge,Yunda,LoroHomero,lorohomero votar cambiar seria bueno variar dias pico placar carro nuevo matriculado salio ordenanza municipal nunca poder salir viaje realizar alguno actividad viernes descuidado tema tiempo,2019-02-22
Jorge,Yunda,LoroHomero,lorohomero cultura solo hacia cierto espacio cierto elit candidato decir importante masificar elecciones2019ec,2019-02-23
Jorge,Yunda,LoroHomero,reunion comunidad barrio cocho parroquia alangasi merced recibir apoyo listo jorge yunda alcalde quito lorohomero panasjorgeyundo santiguardera joseph maurici renebedon jorenpanyun3 luisfer593,2019-02-23
Jorge,Yunda,LoroHomero,lorohomero ferroviario junto futuro alcalde,2019-02-23
Jorge,Yunda,LoroHomero,alangasi henry deacnsa 2019 votar lorohomero santiguardera panasjorgeyundo jorenpanyun3,2019-02-24
Jorge,Yunda,LoroHomero,doctor lorohomero dispensador encontrar centro metropolitano cultura casi desconocido existencia esperar retome iniciativo poder poner todo ciudad,2019-02-24
Jorge,Yunda,LoroHomero,todo parada metro deberar haber dispensador,2019-02-24
Jorge,Yunda,LoroHomero,todo parada metro deberar haber dispensador,2019-02-25
Jorge,Yunda,LoroHomero,jota lorohomero favor caso deber contactar saludquito saludo,2019-02-25
Jorge,Yunda,LoroHomero,pensar amigo fiel votar todo19 jorge yunda lorohomero alcalde quitograndeotravez,2019-02-26
Jorge,Yunda,LoroHomero,gracias mercadomayoristadequito recibirno brazo abierto apoyo incondicional transformamoselmayoristadequito antoniojosedesucre concejal2019 lista19 lorohomero panasjorgeyundo,2019-02-26
Jorge,Yunda,LoroHomero,lorohomero comunicador social avisar gallado paso restringido aloag domingo estir precavido feriado,2019-02-27
Jorge,Yunda,LoroHomero,perfil jorge yunda lorohomero multipl faceta alguien buscar ayudar entorno video ecuavisa quitograndeotravez,2019-02-27
Jorge,Yunda,LoroHomero,tarde jorge yunda lorohomero tendra reunion union taxi frente tribuna quitograndeotravez,2019-02-27
Jorge,Yunda,LoroHomero,reunido surdequito conversar sector estrategico alegrio difundimos plan trabajo quitograndeotravez lorohomero santiguardera,2019-02-27
Jorge,Yunda,LoroHomero,exclusivo entrevista lorohomero candidato alcaldia quito partido union ecuatoriano,2019-02-27
Jorge,Yunda,LoroHomero,quito necesitar tipo campanas felicidad lorohomero gran iniciativa ecuadorescarnaval,2019-02-28
Jorge,Yunda,LoroHomero,quitocarnaval2019 viernes sabado marzo esperar carapungo caupicho disfrutar evento totalmente gratuito esperar lorohomero panasjorgeyundo,2019-02-28
Jorge,Yunda,LoroHomero,buscar electrico buscar modalidad transporte reordenamiento movilidad deber tambien mejoramiento todo linea transporte juanmanuelaguirre concejal distritonorte quitograndeotravez votatodo19 lorohomero,2019-02-28
Jorge,Yunda,LoroHomero,coherente lorohomero quitonecesitauncambio,2019-02-28
Jorge,Yunda,LoroHomero,ejemplo lorohomero candidato objetivo,2019-02-28
Jorge,Yunda,LoroHomero,favor ayudar compartir auto amigo robar laradioredondo xavierozevallos pablo serrano88 lorohomero pamozaec xaguilarv,2019-02-28
Jorge,Yunda,LoroHomero,acuerda bibliotecanacional miren bús tiempo postal inspira transformar ciudad honestamente lorohomero,2019-02-28
Jorge,Yunda,LoroHomero,pena cuenco hacer doble trabajo arreglar calle dejar cabl mismo hacer mismo quito lorohomero,2019-02-28
Jorge,Yunda,LoroHomero,gracias crack 10christianlara dejaste huella imborrable patodiazguevara lorohomero lilianayunda bitri1964 elnacionaloys elnacionalbitri infernalrojo infiernorojoec1 marearojaec patriciopalau,2019-02-28
Jorge,Yunda,LoroHomero,emprendimiento ciencia arte practica seguir apoyar medio comunicacion emprendedor alangaseno 2019 votar henry quimbiulco presidencia trabajo continuo lorohomero,2019-02-28
Jorge,Yunda,LoroHomero,persona humor aceptar mem broma hacer seguro aceptar humildad critica observación ciudadania bien lorohomero,2019-03-01
Jorge,Yunda,LoroHomero,buen lorohomero jajajajajar,2019-03-01
Jorge,Yunda,LoroHomero,gracias amigo tingo grupo juan xxiii recibirnos casa darno apoyo candidatura prometo mejor construir junto equipo mejor manán alangasi 2019 votar jorge yunda alcalde quito lorohomero renebedon,2019-03-01
Jorge,Yunda,LoroHomero,deberio volver construir biblioteca municipal mismo diseno casa derrocado dar vida centro plantear lorohomero mantener belleza arquitectonico colonial lugar,2019-03-01
Jorge,Yunda,LoroHomero,lorohomero presentir proyecto regula serie derechos usuario pasajero aereo cosa autoridad regule evite fecha abusar precio proyecto calificado duerme sueno justo comision,2019-03-01
Jorge,Yunda,LoroHomero,negar,2019-03-01
Jorge,Yunda,LoroHomero,negar,2019-03-01
Jorge,Yunda,LoroHomero,buen meme empezar feriado,2019-03-01
Jorge,Yunda,LoroHomero,carlosalomoto1 lorohomero bravo lorito sera magnifico alcalde quito,2019-03-01
Jorge,Yunda,LoroHomero,jajajajar solo falta patita gallo lorohomero,2019-03-01
Jorge,Yunda,LoroHomero,lorohomero casa madre visitar almuerzo pregunte amigo votar alcalde horonda responder yoooo raya loromero jajajajar ser guaguo,2019-03-01
Jorge,Yunda,LoroHomero,lorohomero radiocanelaec perrito goldir perdido ayudemos encontrar dueno,2019-03-01
Jorge,Yunda,LoroHomero,gracias vecino ecuador futuro apoyo lista19 quitograndeotravez jorge yunda lorohomero alcalde oscarhoyosec concejal,2019-03-01
Jorge,Yunda,LoroHomero,lorohomero jajajajar igual votare,2019-03-02
Jorge,Yunda,LoroHomero,impresionante apoyo jorge yunda lorohomero carapungo pueblo saber yundaes camino quitograndeotravez,2019-03-02
Jorge,Yunda,LoroHomero,lorohomero bien tomar humor indicar madurez,2019-03-02
Jorge,Yunda,LoroHomero,yosry2012 lorohomero,2019-03-02
Jorge,Yunda,LoroHomero,conocer buena idea lindo quito serviras ciudad merecer desear mejor lorohomero quitograndeotravez,2019-03-03
Jorge,Yunda,LoroHomero,persona gritar 2019 gracias querido amigo vecino cada aprender mejor persona lorohomero antoniojosedesucre concejal2019 distritosur,2019-03-03
Jorge,Yunda,LoroHomero,gracias caupicho espectacular recibimiento enorme carino jorgeyundaalcalde votatodo19 lorohomero,2019-03-03
Jorge,Yunda,LoroHomero,exito rotundo respaldo quito demostrar quito necesitar ayundo hacer historia hacer quitograndeotravez lorohomero,2019-03-03
Jorge,Yunda,LoroHomero,oscarhoyosec lorohomero lilianayunda patricioubidiab esperar cochapamba demostrar respaldo,2019-03-03
Jorge,Yunda,LoroHomero,lorohomero quito barrio olvidado impuesto igual obra barrio periferico ejemplo carlos atucucho cochabamba occidental arriba olvidado terreno abandonado parqu,2019-03-03
Jorge,Yunda,LoroHomero,emboscar lanzar carioca felizferiadodecarnaval alegria gente nunca acabar querido lorohomero venga querer hacer consulta antoniojosedesucre concejal2019,2019-03-03
Jorge,Yunda,LoroHomero,marzo caminar alangasi cada paso converso vecino estrechar mano gracias palabra apoyo querer junto cambiar bien alangasi 2019 votar jorge yunda alcalde quito lorohomero,2019-03-03
Jorge,Yunda,LoroHomero,panasjorgeyundo lorohomero yundar encarecidamente pedir alcalde capital aplicar ordenanza correspondar ciudadano mascota cumplar recoleccion hez fecal saqu via parqu publico gracias,2019-03-04
Jorge,Yunda,LoroHomero,querer saber candidato alcalde quito comprometido bienestar animal derechos naturaleza dudar jorge yunda lorohomero conozca historia verodriguezd karenisabelm oscarhoyosec achanguin patodiazguevar mnalvear chulla515,2019-03-04
Jorge,Yunda,LoroHomero,deber saludar supercines1 compromiso ambiente sorbet papel envase plastico mundo hacer asambleaecuador dormir proyecto plastico lorohomero proyecto posterior complementario,2019-03-04
Jorge,Yunda,LoroHomero,parolerosec lorohomero saludo ayudar perrito adoptado compartir telefono 0987838596,2019-03-04
Jorge,Yunda,LoroHomero,alcalde bogota enriquepenalós analizamos solución grande problema ciudad,2019-03-04
Jorge,Yunda,LoroHomero,lorohomero enriquepenalosa bien formar alcalde corbata evento formal jajajar abrazo,2019-03-04
Jorge,Yunda,LoroHomero,jorge yunda dialogo alcalde bogota enriquepenalós encontrar solución grande problema capital quitograndeotravez,2019-03-04
Jorge,Yunda,LoroHomero,asueto feriado aplico transformado ciudad reunion lider futuro alcalde lorohomero continuar planificar desarrollo quitograndeotravez,2019-03-04
Jorge,Yunda,LoroHomero,alcalde bogota enriquepenalós analizamos solución grande problema ciudad,2019-03-05
Jorge,Yunda,LoroHomero,carlosalomoto1 lorohomero verodriguezd karenisabelm oscarhoyosec achanguin patodiazguevar mnalvear chulla515 dar apoyo causa animalista asamblear tambien,2019-03-05
Jorge,Yunda,LoroHomero,lindo tuit teafundacion bajo liderazgo jorge lorohomero hacer mucho cosa positivo bienestar animal asambleaecuador seguros jorge municipio har muchisima cosa favor bienestar animal,2019-03-05
Jorge,Yunda,LoroHomero,mejor batalla ganar gran compromiso propuesta claro seguir construir nuevo esperanza junto lorohomero gracias entusiasmo optimismo transmitir gente rincón quito quitograndeotravez,2019-03-05
Jorge,Yunda,LoroHomero,carlosalomoto1 lorohomero asambleaecuador pionero ecuador 1995 saludo,2019-03-05
Jorge,Yunda,LoroHomero,lorohomero tesoro atractivo capital turistico destino mundo quitograndeotravez jorgeyundaes jorgeyundaalcalde19 quitoturisticootravez,2019-03-05
Jorge,Yunda,LoroHomero,pequeno extracto reunión mantuvimos junto lorohomero bello ciudad bogota parte compromiso comunidad quitenar mejoramiento continuo ciudad hacer quitograndeotravez oscarhoyos19 camaracomerbog,2019-03-06
Jorge,Yunda,LoroHomero,liderazgo alcalde implicar conocer detalle necesidades ciudad compartir experiencia ejecutar solución lorohomero enriquepenalós quitograndeotravez yundaes19,2019-03-06
Jorge,Yunda,LoroHomero,listar centro norte encabezado juanmanuelaguirre contar gente capaz trabajador gran pasion hacer quitograndeotravez lorohomero panasjorgeyundo,2019-03-06
Jorge,Yunda,LoroHomero,lorohomero,2019-03-06
Jorge,Yunda,LoroHomero,siyofueraalcalde jorge yunda lorohomero candidato alcaldia quito union ecuatoriano listo centrar plan mejorar seguridad ciudadano conozca propuesto video,2019-03-06
Jorge,Yunda,LoroHomero,alejaduquer lorohomero ayudenme,2019-03-06
Jorge,Yunda,LoroHomero,lorohomero radiocanelaec aparecer dueno poder ayudar alguien querer adoptar lizzfarfan llamar numero gracias,2019-03-06
Jorge,Yunda,LoroHomero,buen dia dio,2019-03-07
Jorge,Yunda,LoroHomero,lorohomero favor ayudame hermano desaparecio sabado riobambar mario iir flor santillar gato santy cualquiera informacion 0988613701 cooperativo bus puruhir mucho gracia ayuda,2019-03-07
Jorge,Yunda,LoroHomero,panasjorgeyunda lorohomero gracias incluir animal humano quito sera grande,2019-03-07
Jorge,Yunda,LoroHomero,alegre feliz todo,2019-03-08
Jorge,Yunda,LoroHomero,aqui entrepana lorohomero patodiazguevara alejaduquer diegocastrohh,2019-03-08
Jorge,Yunda,LoroHomero,conmemoramos lucha mujer trabajar espacio equidad respetar dentro sociedad feliz mujer quitograndeotravez yundaalcalde19 lorohomero,2019-03-09
Jorge,Yunda,LoroHomero,feliz semana,2019-03-09
Jorge,Yunda,LoroHomero,nadie querio adoptar negro termino adoptandomir,2019-03-09
Jorge,Yunda,LoroHomero,lorohomero ciudadana cumplo obligación tributario gustario hacer llamado quiteno autoridad municipal cooperir ciudad mantener limpio lugar venta proponer sanción ejemplar gracias,2019-03-09
Jorge,Yunda,LoroHomero,lorohomero totalment agradecido ayuda perrita atendido esperar pronta recuperacion angelito 4pata podran decir mirada transmitir agradecimiento puro sincero dio sero encargado devolver favor angelito,2019-03-09
Jorge,Yunda,LoroHomero,documental realizado amigo loro lorohomero dele,2019-03-09
Jorge,Yunda,LoroHomero,nadie querio adoptar negro termino adoptandomir,2019-03-09
Jorge,Yunda,LoroHomero,canelaradioec radiocanelaec lorohomero diegocastrohh patodiazguevara pasantecanela alejaduquer elshafadj exxondj felicidad mashifrago serdotado crear magia musico escuchar mezclar canción gracia total,2019-03-10
Jorge,Yunda,LoroHomero,manana domingo marzo desfile bandera blanco listo junto diablada pillarén nochero cayambe bando tropi kalisimo henry quimbiulco presidencia alangasi 10hoo tingo parque central lorohomero panasjorgeyundo,2019-03-10
Jorge,Yunda,LoroHomero,panasjorgeyunda estimado lorohomero favor alcaldia mariscal elijo empresario residente mariscaleno comprometido barrio volver zona rosa cosmopolita turistica antano,2019-03-10
Jorge,Yunda,LoroHomero,luckylisto elcomerciocom anniecanizar lorohomero panoramatvn,2019-03-10
Jorge,Yunda,LoroHomero,hugo desnutrido sarnar enfermo moribundo rescatado quito alegrar vida feliz domingo,2019-03-10
Jorge,Yunda,LoroHomero,amigo pana sumar respaldar plan trabajo jorge yunda lorohomero alcalde quito,2019-03-10
Jorge,Yunda,LoroHomero,lorohomero rodolfoasar jajajajaja loro mejor respuesta desconocer tema arreglarer mucho persona estar cargo publicidad dificultar controlar todo manera arreglaremos disculpa ciudadania luego subir foto vehiculo regulado,2019-03-10
Jorge,Yunda,LoroHomero,lorohomero inseguridad delincuencia tolerar vivir miedo ciudad seguro ecuador quitoseguraotravez jorgeyundaalcalde listo,2019-03-10
Jorge,Yunda,LoroHomero,centro historico hermoso mundo quito poder vivir turismo alcalde poder lograr llamar jorge yunda machado lorohomero,2019-03-10
Jorge,Yunda,LoroHomero,hugo desnutrido sarnar enfermo moribundo rescatado quito alegrar vida feliz domingo,2019-03-10
Jorge,Yunda,LoroHomero,administracion habra solo barrio regularizar pueblo requerir alcalde defender quitograndeotravez lorohomero yundaalcalde19 oscarhoyosec concejal,2019-03-10
Jorge,Yunda,LoroHomero,hacer mercado quito sitio turistico fomentar cultura gastronomia tradición gran potencial mostrar quitograndeotravez lorohomero yundaes19 oscarhoyosec concejal,2019-03-10
Jorge,Yunda,LoroHomero,pán lorohomero verdadero animalista candidato alcalde exponer proyecto fauna urbano tener ciudad maltrato animal quitograndeotravez oscarhoyosec concejal felizdomingo,2019-03-10
Jorge,Yunda,LoroHomero,negritar encontrar perdido perdio guasmo tratamiento medico necesitar regresar casa sepa negritar comunicar 593992912893 danielar muirragui silvitabuendiar masoltrujillo1 lorohomero josuesanchezec jonathaber parra,2019-03-11
Jorge,Yunda,LoroHomero,serio buen idea amigo cuatro pata lorohomero municipioquito elcomerciocom rescateanimalec animalgp paeecuador yoamoanimal,2019-03-11
Jorge,Yunda,LoroHomero,reservado baile candidato alangasi lorohomero santiguarderas joseph maurici stalindo1977 panasjorgeyunda diablado pillarén aooyar henry quimbiulco presidencia alangasi,2019-03-11
Jorge,Yunda,LoroHomero,agenda jorge yunda lorohomero acompananos quitograndeotravez,2019-03-11
Jorge,Yunda,LoroHomero,estimado persona perdio empleo debido recorte sector publico favor gentil retweet querer poner consideracion comercial experiencia banco finanza atencion cliente lorohomero estebanavila,2019-03-11
Jorge,Yunda,LoroHomero,compartir parte vida jorge yunda lorohomero historia vencer adversidad salir adelante representante pueblo luchador quitovuelveasonreir quitograndeotravez,2019-03-11
Jorge,Yunda,LoroHomero,lilianayundar lorohomero pues entender decir hermano doctor orgullo hermano marcar formalidad creer decir preguntado aqui dudar dire dicho amigo jefe aprecio parecer buen humano claro familia tambien,2019-03-11
Jorge,Yunda,LoroHomero,necesitar solución gran problema trafico cantidad vehiculo quito aqui solucion propuesta jorge yunda lorohomero quitograndeotravez,2019-03-11
Jorge,Yunda,LoroHomero,vera quito luego 24demarzo jorge yunda lorohomero ganar alcaldio capital construirar segundo piso quitograndeotravez jorgeyundaalcalde listo,2019-03-12
Jorge,Yunda,LoroHomero,colegio medico pichincha dar conocer plan trabajo gobierno municipal vera quiteno lorohomero quitograndeotravez juanmanuelaguirreconcejal distritonortar votatodo19 eldelquito,2019-03-12
Jorge,Yunda,LoroHomero,cuidarer animalito alcaldio hermano jorge yunda lorohomero hospital veterinario ciudad presupuesto municipal campanas esterilizacion habran animal abandonado maltratado quito quitovuelveasonreir,2019-03-12
Jorge,Yunda,LoroHomero,historia amigo medico empresario compositor interpetir activista derechos animal historia jorge yunda machado lorohomero lista alcalde patodiazguevara oscarhoyosec karenisabelm ferbustamanteg luis aguilar33 fxcarrion,2019-03-12
Jorge,Yunda,LoroHomero,lorohomero buena recuerdo mercado arenal,2019-03-14
Jorge,Yunda,LoroHomero,lorohomero cuchito1940 alejaduquer patodiazguevar slds aqui luchar aprobacion licencia conducir mil inmigrante albany,2019-03-12
Jorge,Yunda,LoroHomero,gracias lorohomero,2019-03-12
Jorge,Yunda,LoroHomero,lorohomero quito producir tonelada basura promoverar reciclaje clasificacion residuo traves incentivo permitiran generacion nuevo recurso ciudad quitograndeotravez precioparacompartir,2019-03-12
Jorge,Yunda,LoroHomero,regresar despu tiempo yundar lorohomero primero empresario ofrecerme oportunidad dedicarme pasion escribir crear alcalde quito seguro generara mucho oportunidad tambien panasjorgeyunda,2019-03-12
Jorge,Yunda,LoroHomero,calle buen jorge yunda lorohomero alcalde19 quitograndeotravez,2019-03-12
Jorge,Yunda,LoroHomero,estimado lorohomero informado tema rellenosanitario ubicado pifo sector inguir alcalde quito sero problema resolver comuna aledana afectado saludo lilianayundo,2019-03-13
Jorge,Yunda,LoroHomero,campán sucio ultimo recurso resultar,2019-03-13
Jorge,Yunda,LoroHomero,campán sucio secuestrar persona creativo danar honra candidato,2019-03-13
Jorge,Yunda,LoroHomero,fer1975julio lorohomero peaje urbano funcionado exitosamente país,2019-03-13
Jorge,Yunda,LoroHomero,excelente propuesta hora pensar ejecutar solución creativo efectivo mejorar movilidad quito quitar tiempo productividad serio importante detractor proponer alternativa solo criticar criticar felicitación lorohomero,2019-03-13
Jorge,Yunda,LoroHomero,alguien generador empleo creador oportunidad joven emprendedor profesional lorohomero poder,2019-03-13
Jorge,Yunda,LoroHomero,compartir fecha lugar dialogar gente lindo quito precio caminar junto quitograndeotravez juanmanuelaguirre concejal votatodo19 eldelquitir distritonor lorohomero,2019-03-13
Jorge,Yunda,LoroHomero,angellobarahonar lorohomero angello decir verdad conocer jorge alguno trabajar poder jorge quito,2019-03-13
Jorge,Yunda,LoroHomero,pamozaec lorohomero gran decision votare mismo persona,2019-03-13
Jorge,Yunda,LoroHomero,vamosaganar gran equipo trabajo promovido propuesta lorohomero distritosurdequito antoniojosedesucre,2019-03-13
Jorge,Yunda,LoroHomero,joven quito tendrar universidad preparar todo documentacion aquel jorge yunda lorohomero alcalde19 quitograndeotravez quitovuelveasonreir,2019-03-13
Jorge,Yunda,LoroHomero,lorohomero reciba cordial saludo sarah deseo exito todo actividad compartir siguiente link consejo proteccion derechos informacion valioso grupos atencion,2019-03-13
Jorge,Yunda,LoroHomero,bienestar nino nina prioridad alcaldio lorohomero destinar presupuesto general municipio quito construccion guaguascentro anualmente mejoraremo infraestructuro existir votatodo19,2019-03-13
Jorge,Yunda,LoroHomero,quito trabajo mayor oferta inmobiliario jorge yunda lorohomero alcalde19 quitograndeotravez quitovuelveasonreir,2019-03-13
Jorge,Yunda,LoroHomero,quito arte artistas cultura musico 2019 votar decir nicoespinosatv jorge yunda lorohomero alcalde quitograndeotravez quitovuelveasonreir,2019-03-13
Jorge,Yunda,LoroHomero,lorohomero saludos trabajams empresa corrido apoyo usted alcalde claro acercamiento usted ablado companero concuerdar migo,2019-03-13
Jorge,Yunda,LoroHomero,patodiazguevar lorohomero favor pedir ayud compartir perrita madre encontrar ayudano encontrar favor cualquiera informacion 0992763992 0987556324 0960766666 gracias,2019-03-14
Jorge,Yunda,LoroHomero,lorohomero perdio quito barrio nuevo raza shih llamar panchito perdio domingo marzo,2019-03-14
Jorge,Yunda,LoroHomero,lorohomero buen dia senor yunda nombre pablo enriquez sector vivo ciudadelar ibarra vendedor veredar dia embargo mercado grande solo abrir domingo serio bueno reubicarl,2019-03-14
Jorge,Yunda,LoroHomero,deber erradicar trabajo infantil call quito querido compromiso alcaldio jorge yunda lorohomero junto quitograndeotravez quitovuelveasonreir,2019-03-14
Jorge,Yunda,LoroHomero,devolver orden espacio publico confiscara mercaderio comerciante informal pueblo merecer respeto jorge yunda lorohomero proponer crear nuevo punto comercial repotenciar existente aqui detalle quitograndeotravez,2019-03-14
Jorge,Yunda,LoroHomero,barrio importante educacion campán educativo gabyquirogaconcejal2019 lista19 lorohomero panasjorgeyundo,2019-03-14
Jorge,Yunda,LoroHomero,lorohomero teleamazonasec general huir soldado yunda,2019-03-15
Jorge,Yunda,LoroHomero,momento lorohomero caminar mercadomayoristadequito junto construir mercadodelfuturo antoniojosedesucre concejaldistritosur 2019,2019-03-15
Jorge,Yunda,LoroHomero,opcionanimalistaalcaldiaquito lorohomero teafundacion,2019-03-15
Jorge,Yunda,LoroHomero,allo preparacion academico cuarto nivel compromiso medio ambiente ciudad merecer apoyo,2019-03-15
Jorge,Yunda,LoroHomero,elnortegrandeotravez noche esperar pisuli vivir gran fiesta apoyar candidato concejal jorge yunda lorohomero distrito norte concejal todo19 plancha quitograndeotravez,2019-03-15
Jorge,Yunda,LoroHomero,campán sucio surte efecto conocer persona caso vida ser publicar gente conocer,2019-03-15
Jorge,Yunda,LoroHomero,conoceatucandidato lorohomero importante sensibilizar ciudadano problema fauna humano parte salud publicar fcomhemisferio uhemisferio,2019-03-15
Jorge,Yunda,LoroHomero,conoceatucandidato ecuador poder discriminar alguien quito reflejo mestizaje lorohomero uhemisferio fcomhemisferio,2019-03-15
Jorge,Yunda,LoroHomero,oportunidad conversar lorohomero candidato alcaldia quito marco foro conoceatuscandidato organizar uhemisferio importante academia genere espacio dialogo democratico reflexion soyhemisferio,2019-03-15
Jorge,Yunda,LoroHomero,lorohomero,2019-03-15
Jorge,Yunda,LoroHomero,palabra sabio amiga paulinaaguirre7 alentar seguir trabajar ciudad,2019-03-15
Jorge,Yunda,LoroHomero,lorohomero naci pugna poder rumboalaalcaldiadequito notimundoestelar,2019-03-16
Jorge,Yunda,LoroHomero,lorohomero reciclaje serio ingreso millonario ciudad rumboalaalcaldiadequito notimundoestelar,2019-03-16
