nombre,apellidos,tweet_screen_name,tweet_text,tweet_date
Jorge,Yunda,LoroHomero,lorohomero mega obra recuperar machangaro rumboalaalcaldiadequito notimundoestelar,2019-03-16
Jorge,Yunda,LoroHomero,uhemisferio acompanar lorohomero conversatorio conoceatucandidato gracias joven invitado escuchar propuesta listo haremos quito pichinchagrandeotravez,2019-03-16
Jorge,Yunda,LoroHomero,puntoelectoral ahora recordar entrevista candidato alcaldia quito lorohomero converso propuesta deportivo caso ganar alcaldio quito marzo miralo aqui elecciones2019,2019-03-16
Jorge,Yunda,LoroHomero,lorohomero propuesto taxista quito crear plataforma digital quitenizado competir plataforma internacional notimundoestelar rumboalaalcaldiadequito,2019-03-16
Jorge,Yunda,LoroHomero,lorohomero usted decir doctor valiente entrar politico animo gran oportunidad servir quito yunda alcalde,2019-03-16
Jorge,Yunda,LoroHomero,jorge yunda lorohomero iniciativo animanaturali ecuador proteger animal politico responsable comprometer usar pirotecnia acto campán resultar electo regularizar mismo politicostaurinosnuncama,2019-03-16
Jorge,Yunda,LoroHomero,defensoresar lorohomero teafundacion gano voto alcaldia favor mantener ofrecimiento buen vida angelito peludo saludo,2019-03-16
Jorge,Yunda,LoroHomero,bueno decir decir unico propuesta real considerar ayudara mejor humanos ojala aprendar apoyar tambien gano voto alcaldedequito,2019-03-16
Jorge,Yunda,LoroHomero,opcionanimalistaalcaldiaquito lorohomero teafundacion,2019-03-16
Jorge,Yunda,LoroHomero,lorohomero necesidad conocer todo trayectoria bastar acción realizar tantoas persona escaso recurso animalito inocente todo acción grata ojo dio aunque querer ensuciar nombre podran buen,2019-03-16
Jorge,Yunda,LoroHomero,lorohomero gusto grande compartir momento musico mensaje estimado jorge yunda exito nuevo viaje,2019-03-16
Jorge,Yunda,LoroHomero,manán encontrar estadio federacion ligas campán alegrio jorge yunda lorohomero continuo compartir junto pueblo querido esperar quitograndeotravez,2019-03-16
Jorge,Yunda,LoroHomero,lista concejal lista uhemisferio lorohomero exponer plan trabajo votatodo19 propuesta beneficiar igualdad condiciones quiteno querer llevar cabildo realidad demagogia juanmanuelaguirre concejal,2019-03-16
Jorge,Yunda,LoroHomero,gracias apoyo,2019-03-16
Jorge,Yunda,LoroHomero,multitudinario respaldo listo barrio pisuli junto futuro alcalde lorohomero gracias carino,2019-03-16
Jorge,Yunda,LoroHomero,palabra sabio amiga paulinaaguirre7 alentar seguir trabajar ciudad,2019-03-16
Jorge,Yunda,LoroHomero,jorgeyundaes animalista quitograndeotravez oscarhoyosec concejaldistritosur lorohomero alcalde,2019-03-18
Jorge,Yunda,LoroHomero,claro desesperacion estar preocupado ascenso yundar corrupto volver artimana insulto desprestigiar hacer dano persona nacido pueblo perdonar haberl ganado clase poderoso querer dejar teta,2019-03-17
Jorge,Yunda,LoroHomero,informacion falso tras monitoreo entrevista posta encontro frase atribuir lorohomero nocomascuento revisa,2019-03-17
Jorge,Yunda,LoroHomero,opcionanimalistaalcaldiaquito teafundacion lorohomero,2019-03-17
Jorge,Yunda,LoroHomero,ofelia encuesta quitograndeotravez jorgeyundaes lista lorohomero jorgeyundaalcalde,2019-03-17
Jorge,Yunda,LoroHomero,quitograndeotravez ofelia norte quito gran respaldo lorohomero futuro alcalde quito,2019-03-18
Jorge,Yunda,LoroHomero,gente pueblo alcaldia quitograndeotravez juanmaguirre1 lorohomero,2019-03-18
Jorge,Yunda,LoroHomero,perdio floresta vicentín anos enfermita saber andar calle asusta lorohomero paeecuador ralvarezw,2019-03-18
Jorge,Yunda,LoroHomero,cotocollao barrio crecido empuje gente cotocollao plan gobierno abierto querer hacer quitograndeotravez juanmanuelaguirre concejal votatodo19 eldelquito lorohomero,2019-03-18
Jorge,Yunda,LoroHomero,quitocanta2019 junto alcalde lorohomero candidato listar gracias quito caluroso recibimiento ubidiaprefecto2019 votatodo19,2019-03-18
Jorge,Yunda,LoroHomero,lorohomero alcaldiar apoyar mucho gente quitar poner boca,2019-03-18
Jorge,Yunda,LoroHomero,invitado lorohomero,2019-03-18
Jorge,Yunda,LoroHomero,jorgeyundaser via alto estandar calidad quitograndeotravez oscarhoyosec concejaldistritosur lorohomero alcalde,2019-03-18
Jorge,Yunda,LoroHomero,jorgeyundaes universidad quitograndeotravez oscarhoyosec concejaldistritosur lorohomero alcalde,2019-03-18
Jorge,Yunda,LoroHomero,jorgeyunda seguridad quito quitograndeotravez oscarhoyosec concejaldistritosur lorohomero alcalde,2019-03-18
Jorge,Yunda,LoroHomero,jorgeyundaes erradicacion trabajo infantil quitograndeotravez oscarhoyosec concejaldistritosur lorohomero alcalde,2019-03-18
Jorge,Yunda,LoroHomero,jorgeyundaes solucion tecnologico inteligente problema movilidad quitograndeotravez oscarhoyosec concejaldistritosur lorohomero alcalde,2019-03-18
Jorge,Yunda,LoroHomero,jorgeyundaes cero problema basuro quito limpio quitograndeotravez oscarhoyosec concejaldistritosur lorohomero alcalde,2019-03-18
Jorge,Yunda,LoroHomero,perrito abandonado problema salud publicar insensibilidad lorohomero construirar hospital veterinario publico clinica movil esterilizacion quitograndeotravez quitosensibleotravez jorgeyundaes lista jorgeyundaalcalde,2019-03-18
Jorge,Yunda,LoroHomero,excelente semana,2019-03-18
Jorge,Yunda,LoroHomero,estimado lorohomero caso llegar alcaldia serio importante revisar extension metro hacia norte actualidad parado labrador ubicado centro norte,2019-03-18
Jorge,Yunda,LoroHomero,excelente semana,2019-03-18
Jorge,Yunda,LoroHomero,desear mismo querido yunda semán existo usted proyecto cambiar aspecto saludo bendición parte conductor profecional parroquia calderon,2019-03-18
Jorge,Yunda,LoroHomero,lorohomero excelente semana lorito semana clave cambio quitar exito,2019-03-18
Jorge,Yunda,LoroHomero,gracias gran apoyo pueblo quiteno trabajarar territorio escritorio jorgeyundaalcalde amparitonarvaezconcejal distrito lorohomero panasjorgeyundo,2019-03-18
Jorge,Yunda,LoroHomero,alangasi cierre campán listo total apoyo jorge yunda alcalde quito lorohomero santiguarderas panasjorgeyundo joseph maurici stalindo1977 24horasuio tvclacomunidad ecuavisainforma canalrtu gamavisionecu elcomerciocom,2019-03-18
Jorge,Yunda,LoroHomero,exito total distrito norte gracia todo gente carino apoyo entregado ayer sector ofelia jorge yunda lorohomero alcalde equipo concejales lista19 quitovuelveasonreir,2019-03-18
Jorge,Yunda,LoroHomero,lorohomero exelente futuro buen gestion lorito ganado voto espós salir bien suerte abrazo,2019-03-18
Jorge,Yunda,LoroHomero,metro planificacion original preveiar extensión extension poder llegar norte hara lorohomero,2019-03-18
Jorge,Yunda,LoroHomero,pisuli candidato alcaldia quito lorohomero todo capacidad asumir rienda ciudad quitograndeotravez,2019-03-18
Jorge,Yunda,LoroHomero,ver noche conocoto encuentro sero estadio moyo compartir campana alegrio jorge yunda lorohomero camino alcaldia quitograndeotravez,2019-03-18
Jorge,Yunda,LoroHomero,lorohomero manabi voto aqui quito tiempo quitar crecer tiempo quedo atra loro homero hora hacer grande cosa ciudad quedar solo palabra escuchar radio siempre apoyo total decir hacer realidad,2019-03-18
Jorge,Yunda,LoroHomero,quitograndeotravez alcaldio jorge yunda lorohomero alcalde oscarhoyos concejaldistritosur cuento voto,2019-03-19
Jorge,Yunda,LoroHomero,lorohomero,2019-03-19
Jorge,Yunda,LoroHomero,facilitar ciudadano temo movilidad tren cercania trabajo conjunto lorohomero tema vialidad construir nuevo perimetral quito conversatorio pucir ecuador,2019-03-19
Jorge,Yunda,LoroHomero,jorge yunda lorohomero conformar equipo experto solucionar definitivamente trafico ciudad quito quitar tiempo dar quitograndeotravez quitoamigootravez jorgeyundaes lista jorgeyundaalcalde,2019-03-19
Jorge,Yunda,LoroHomero,acerca metrodequito lorohomero opinar desear agua fiesta solucionar problema movilidad embargo deber buscar manera conectar machachi cumbayar tumbaco lanoticiaensuceso,2019-03-19
Jorge,Yunda,LoroHomero,lorohomero hacer ano vivo elección cambiar domicilio loján dare voto usted simplemente pedir trabajo desempleado profesional salio origen buscar mejor saber ganar abrazo,2019-03-19
Jorge,Yunda,LoroHomero,quitar tocar puerta municipio encontrar completamente cerrado sdquito padrino campán violencia droga visto apoyado institución bien quito cerrado puerta lorohomero,2019-03-19
Jorge,Yunda,LoroHomero,amcquito teafundacion lorohomero eluniversocom,2019-03-19
Jorge,Yunda,LoroHomero,estar publicar voto medio voto marzo alcalde quito sera jorge yunda lorohomero,2019-03-19
Jorge,Yunda,LoroHomero,voto secreto voto siempre yundar lorohomero,2019-03-19
Jorge,Yunda,LoroHomero,jorge yunda alcalde amparito narvaez concejal distrito enel2019todo19 amparitoparaquito panasjorgeyunda lorohomero,2019-03-19
Jorge,Yunda,LoroHomero,alangasi apoyo total jorge yunda alcalde quito votar listo panasjorgeyundo lorohomero santiguarderas joseph maurici gabobedon stalindo1977 bolivararmijo jorenpanyun3 renebedon rpcjorge alexandracast80,2019-03-19
Jorge,Yunda,LoroHomero,lorohomero,2019-03-19
Jorge,Yunda,LoroHomero,estar publicar voto medio tambien voto marzo alcalde quito sera unico persona sensibilizado caso desaparecido voto jorge yunda lorohomero,2019-03-20
Jorge,Yunda,LoroHomero,plan ambicioso movilidad vialidad pichinchano lorohomero trenes cercania conectado line metro quito nuevo perimetral quito nuevo occidental quito junto construirer pichinchagrandeotravez,2019-03-20
Jorge,Yunda,LoroHomero,lorohomero radiocanelaec poner adopcion hermosa cachorrita dulce educado necesitar hogar entregar amor cuidados,2019-03-20
Jorge,Yunda,LoroHomero,ahora buenosdiasamerico acompana lorohomero candidato alcaldia quito hablar propuesto trabajo miranos jorgeacato ramirodiaz64 longogalo,2019-03-20
Jorge,Yunda,LoroHomero,lorohomero analizar panorama transporte publico aqui jorgeacato ramirodiaz64 longogalo,2019-03-20
Jorge,Yunda,LoroHomero,lorohomero campán comenzado declarar quito ciudad miedo aqui jorgeacato ramirodiaz64 longogalo,2019-03-20
Jorge,Yunda,LoroHomero,lorohomero tema movilidad racionalizar transito aqui analisis jorgeacato ramirodiaz64 longogalo,2019-03-20
Jorge,Yunda,LoroHomero,lorohomero metrodequito deber considerar obra inter nacional aqui jorgeacato ramirodiaz64 longogalo,2019-03-20
Jorge,Yunda,LoroHomero,decir poder fama lorohomero,2019-03-20
Jorge,Yunda,LoroHomero,patriciopalau saludos guaranda pena poder sufragar quito favor lorohomero humilde honesto emprendedor politiquero siempre unido desprestigiar pueblo diro yunda alcalde quito vota laradioredonda deportivo,2019-03-20
Jorge,Yunda,LoroHomero,domingo alegrio demostrar pueblo desear quitograndeotravez 2019 yundaalcalde19 yundaes19 todatodo19 graciasquito lorohomero,2019-03-20
Jorge,Yunda,LoroHomero,entrevistar lorohomero segmento conocer candidato alcaldio quito 10h30 fmmundo,2019-03-20
Jorge,Yunda,LoroHomero,fmmundo aguantamijin lorohomero enorme humildad caracterizar senor llevado alto felicidad mejor deseo contar apoyo porelnulo,2019-03-20
Jorge,Yunda,LoroHomero,lorohomero correcto recurso invertido imagino respectivo cambio tecnico bien gestionado temar contenedor sumado idea clasificacion desecho mejorariar gran manera tema gran problema,2019-03-20
Jorge,Yunda,LoroHomero,,2019-03-20
Jorge,Yunda,LoroHomero,juro hacer hueco cesped zeus adoptado comparto evolucion,2019-03-20
Jorge,Yunda,LoroHomero,llano grande calle garcia moreno esquina escuela doloroso decado alcantarillado pavimentado lorohomero futuro alcalde favor incluir barrio plan calle hormigon municipioquito,2019-03-20
Jorge,Yunda,LoroHomero,elnacionalbitri lorohomero laradioredonda entrado jorge yunda equipo trabajo acompanar poner tiempo trabajo elnacional descendido depquito contar testigo honradez capacidad lorohomero apoyo,2019-03-20
Jorge,Yunda,LoroHomero,elnacionalbitri lorohomero laradioredondo equivocado adema desinformar hinchado equivoco apoyar manjarrez campán ahora andar despotricar verdad jorge yunda salvo club poder certificar demostrar renunciar dias eleccion,2019-03-20
Jorge,Yunda,LoroHomero,elnacionalbitri lorohomero laradioredondir solo lista manjarrez permitio recoger firma recinto militar sino habrio ganar nuevamente luego manjarrez paso echar culpa queriar devolver plata presto hermana centavo interes,2019-03-20
Jorge,Yunda,LoroHomero,lorohomero estebanavila patodiazguevar patofortuny terrible gracias policia metropolitabo corriente seguia arrastrar comun sociedad gente poner filmar ayudar,2019-03-20
Jorge,Yunda,LoroHomero,convencido lorohomero quito volvera grande marzo quitograndeotravez lilianayundo panasjorgeyundo,2019-03-20
Jorge,Yunda,LoroHomero,entero conviccion domingo quitovuelveasonreir camino jorge yunda lorohomero alcalde junto quitograndeotravez,2019-03-20
Jorge,Yunda,LoroHomero,campán respetado ciudad hecho campán limpio ensuciar quito ensuciar honra nadie objetivo hacer quitograndeotravez votatodo19 juanmanuelaguirrir concejal distritonorte votatodo19 lorohomero,2019-03-20
Jorge,Yunda,LoroHomero,manán pacomoncayo terminar campán politico debate lorohomero habra,2019-03-20
Jorge,Yunda,LoroHomero,lorohomero doctor jorge yunda alcalde devolvera bello ciudad dignidad parques limpio aire saludable seguridad quiteno responsable fauna urbano gracias devolverno esperanza,2019-03-20
Jorge,Yunda,LoroHomero,jorgeyundaser sistema movilidad grande ciudad mundo quitograndeotravez oscarhoyosconcejal lorohomero alcalde porelnulo,2019-03-21
Jorge,Yunda,LoroHomero,programa grupo wazaak lorohomero,2019-03-21
Jorge,Yunda,LoroHomero,programa grupo wazaak lorohomero,2019-03-21
Jorge,Yunda,LoroHomero,programa grupo wazaak lorohomero,2019-03-21
Jorge,Yunda,LoroHomero,manán ver estadio liga barrial ciudadelar ibarra cerrar campán alegrio compartir pueblo quito domingo quitovuelveasonreir jorge yunda lorohomero alcalde19 quitograndeotravez,2019-03-21
Jorge,Yunda,LoroHomero,lorohomero gustario tener prueba siguiente acabar pasar tribuna agente transito cerrar paso vehiculo municipal trabajar cierre campán paco moncayo zapata indignacion abuso,2019-03-21
Jorge,Yunda,LoroHomero,recorridir barrio quito apoyo vecino vecino hacia candidatura lorohomero equipo concejal profesional etico experiencia trabajarar solución real transformar vida quiteno votatodo19,2019-03-21
Jorge,Yunda,LoroHomero,encontrar plan trabajo jorge yunda lorohomero domingo decidir quitoquerido quitograndeotravez,2019-03-21
Jorge,Yunda,LoroHomero,excelente entrevista jorge yunda lorohomero teleamazonasec domingo quitovuelveasonreir vota quitograndeotravez,2019-03-21
Jorge,Yunda,LoroHomero,ayer paco paso verguenza vida aceptar debatir yunda lorohomero teleamazonasec,2019-03-21
Jorge,Yunda,LoroHomero,lorohomero yunda visto ultima entrevista teleamazona apoyo esperar propuesta quedar palabra unicamente mucho suerte pues ciudad merecer salir desastre permitido pase,2019-03-21
Jorge,Yunda,LoroHomero,juro hacer hueco cesped zeus adoptado comparto evolucion,2019-03-21
Jorge,Yunda,LoroHomero,quito sero ciudad libre maltrato animal jorge yunda lorohomero quitovuelveasonreir quitograndeotravez,2019-03-21
Jorge,Yunda,LoroHomero,quito necesitar contar clinica veterinario movil brindir servicio esterilizacion desparasitacion vacunacion llevare concejo propuesto solucionar problematica fauna urbano ciudad quitograndeotravez juanmanuelaguirre concejal lorohomero,2019-03-21
Jorge,Yunda,LoroHomero,quitograndeotravez lorohomero alcalde oscarhoyosconcejal felizjuev,2019-03-21
Jorge,Yunda,LoroHomero,cerrar campán alegrio propuesto proyecto esperanzar gracias quito gracias,2019-03-22
Jorge,Yunda,LoroHomero,disculpar buen entrevista lorohomero teleamazonasec asertivo terminos comunicacion politico hablar propuesta explico claramente proposito campán dejo claro forma personal pensar eleccionesec2019,2019-03-21
Jorge,Yunda,LoroHomero,cerrar campán alegrio propuesto proyecto esperanzar gracias quito gracias,2019-03-22
Jorge,Yunda,LoroHomero,cuanto domingo quito volver sonreir junto hacer quito alegrio jorge yunda lorohomero quitograndeotravez,2019-03-22
Jorge,Yunda,LoroHomero,quito libre trabajo infantil yundaalcalde votatodo19 oscarhoyosconcejal lorohomero alcalde,2019-03-22
Jorge,Yunda,LoroHomero,listo entregar material colegio alangasi gracias jorge yunda alcalde quito hombre pueblo panasjorgeyundo lorohomero santiguarderas jorenpanyun3 joseph maurici stalindo1977 24horasuio tvclacomunidad mauriciorodasec,2019-03-22
Jorge,Yunda,LoroHomero,calle bonito calidad yundaalcalde votatodo19 oscarhoyosconcejal lorohomero alcalde,2019-03-22
Jorge,Yunda,LoroHomero,lorohomero hacer delincuencia romper vidrio carro llevar mochilo shyrys camara verificar pedido fiscal demoro menos dia total camara hacer,2019-03-22
Jorge,Yunda,LoroHomero,gran oportunidad hombre pueblo llegar alcaldio marzo reflexionem voto base propuesto trayectorio candidato lorohomero quitograndeotravez yundaalcalde19,2019-03-22
Jorge,Yunda,LoroHomero,lorohomero oscarhoyosec siempre puesto alcalde poner usted vecino silencioelectoralec,2019-03-22
Jorge,Yunda,LoroHomero,lilianayundar lorohomero lorohomero joven trabajo noviembre pasado capital querer emprender negocio pequeno visto detenido tanto permiso solicitar favor ayudeno agilitar unico desear trabajar honradamente,2019-03-22
Jorge,Yunda,LoroHomero,pleno seguridad prefecturadepichincho alcalde lorohomero trabajarar obra beneficiarar necesitado saber hacer ubidiaprefecto2019,2019-03-22
Jorge,Yunda,LoroHomero,lorohomero quito primero alcalde animalista historia,2019-03-22
Jorge,Yunda,LoroHomero,sanciir lorohomero pena sucedio amigo camara servir solo pasa semaforo rojo adecuado serio estir coordinado ojala cambiar estimado loro ganar todo familia votar decepcionir noma,2019-03-22
Jorge,Yunda,LoroHomero,cesarmontufar51 cesar ayer encontraste acercaste saludar cordialmente desear suerte caiga insulto,2019-03-22
Jorge,Yunda,LoroHomero,lilianayundar lorohomero panasjorgeyundo carlosalomoto1 chernandezy nicoespinosatv chipilaso93 santiguardera patodiazguevar yoapoyoayundo ofrecer disculpa respecto tweet observo politica contenido,2019-03-22
Jorge,Yunda,LoroHomero,humorandanimals lorohomero,2019-03-23
Jorge,Yunda,LoroHomero,seguir noticia falso entretenimiento quito deber torturar maltrato animal violencia humano comenzar,2019-03-23
Jorge,Yunda,LoroHomero,radio novela ingratar producido hermano migrant eeuu gracias muchachos soastibrother,2019-03-23
Jorge,Yunda,LoroHomero,trav pagina falso mentirosa buscar desacreditar jorge lorohomero poco unico candidato animalista ambientalisto denunciar pagina falso mentirós,2019-03-23
Jorge,Yunda,LoroHomero,paseo obligado sabado buen semana,2019-03-23
Jorge,Yunda,LoroHomero,gusto trabajar ano hombre emprendedor poses energico sensible humano siempre atento sientes destaques ramar loro lorohomero decir justo necesario,2019-03-23
Jorge,Yunda,LoroHomero,vida trabajo dado oportunidad tener companero empresa nunca empleado respetar derecho,2019-03-23
Jorge,Yunda,LoroHomero,gracias jorge yunda machado lorohomero trabajo ano desinteresado favor bienestar animal,2019-03-23
Jorge,Yunda,LoroHomero,vida trabajo dado oportunidad tener companero empresa nunca empleado respetar derecho,2019-03-23
Jorge,Yunda,LoroHomero,lorohomero cesarmontufar51 encanta respuesta jorge yunda odio insulto campán sucio deber desaparecer politica ecuatoriano,2019-03-23
Jorge,Yunda,LoroHomero,buen dia dio,2019-03-24
Jorge,Yunda,LoroHomero,conoci lorohomero hacer ano vuelo houston 2016 verdad sabio idea parecio super dato hablar quito reina tesoro cheverar alguien llevar ciudad vaya,2019-03-24
Jorge,Yunda,LoroHomero,acompanado mascota zeus lorohomero candidato alcalde quito ejercer derecho voto vicenteopi elecciones2019,2019-03-24
Jorge,Yunda,LoroHomero,acompanado mascota zeus lorohomero candidato alcalde quito ejercer derecho voto eluniversocom,2019-03-24
Jorge,Yunda,LoroHomero,lorohomero candidato alcaldia quito lista llegar recinto electoral escuela general artigar centro historico ciudad ejercer voto vicenteopi elecciones2019,2019-03-24
Jorge,Yunda,LoroHomero,lorohomero candidato alcaldia quito triunfe democracia propuesto resultado recibirar casa eluniversocom,2019-03-24
Jorge,Yunda,LoroHomero,zeus acompano votar hermano jorge yunda lorohomero definitivamente perrito mejor amigo poder tener,2019-03-24
Jorge,Yunda,LoroHomero,sonrisa siempre alegre positivo eleccion contigo jorge lorohomero,2019-03-24
Jorge,Yunda,LoroHomero,esperarer resultado casa dio pueblo quiteno decidar,2019-03-24
Jorge,Yunda,LoroHomero,lorohomero esperar partido voly str armar bien preocupacion dejar amarrar darar mucho ventaja quinz noma mucho suerte voly tambien,2019-03-24
Jorge,Yunda,LoroHomero,esperarer resultado casa dio pueblo quiteno decidar,2019-03-24
Jorge,Yunda,LoroHomero,yunda esperar triunfe democracia propuesto lorohomero,2019-03-24
Jorge,Yunda,LoroHomero,cada domingo lorohomero salio pasear mascota canino votar elecciones2019ec,2019-03-24
Jorge,Yunda,LoroHomero,lilianayundar lorohomero apoyo lorohomero fuerza,2019-03-24
Jorge,Yunda,LoroHomero,colectivoney lorohomero gracias lorohomero parte pionera ecuador,2019-03-24
Jorge,Yunda,LoroHomero,colectivoney lorohomero provincias unidas bloque respaldo yunda,2019-03-24
Jorge,Yunda,LoroHomero,pipo votar quito seguro derechos respetar lorohomero,2019-03-24
Jorge,Yunda,LoroHomero,elecciones2019 candidato alcaldiadequito jorge yunda lorohomero acudio manán votar junto mascota seguir proceso electoral aqui,2019-03-24
Jorge,Yunda,LoroHomero,lorohomero conteo acta,2019-03-25
Jorge,Yunda,LoroHomero,oficial cnegobec,2019-03-25
Jorge,Yunda,LoroHomero,bien momento hijo,2019-03-25
Jorge,Yunda,LoroHomero,declaración momento lorohomero caballero politico honesto hacer campana transparente propuesto positivo injuriar adversario quito tendrio caballero alcalde primero lugar elecciones2019ec ecuadorelige2019 votoec,2019-03-25
Jorge,Yunda,LoroHomero,jorge yunda lorohomero realizo campán troll center descalificar rival empapelar ciudad caravana,2019-03-25
Jorge,Yunda,LoroHomero,escrutado jorge yunda lorohomero nuevo alcalde quito bienvenidoalcalde,2019-03-25
Jorge,Yunda,LoroHomero,quito milenario,2019-03-25
Jorge,Yunda,LoroHomero,quito milenario,2019-03-25
Jorge,Yunda,LoroHomero,andreo yepez artifice victoria lorohomero buen estrategia moderno estrategia creer tradicional estratega deber revisar tecnico,2019-03-25
Jorge,Yunda,LoroHomero,lilianayundar lorohomero quito poner alcalde ningun alcalde poner olvide lorohomero bienvenidoalcalde,2019-03-25
Jorge,Yunda,LoroHomero,gracias lorohomero compartir radiacion temprano programa radial mayor sintonia ecuador ano ser mejor campán pueblo poder conocerte ahora convocar mision dios bendiga,2019-03-26
Jorge,Yunda,LoroHomero,juancaholguin mucho gracia juan carlos ciudad necesitar,2019-03-26
Jorge,Yunda,LoroHomero,transicion ordenado merece quitoquerido reunion alcalde mauriciorodasec elalcaldedetodo jorge yunda lorohomero quitograndeotravez foto jcarlosaizpruo,2019-03-26
Jorge,Yunda,LoroHomero,mantuvimo reunion alcalde electo quito lorohomero establecer prioridad sector productivo ciudad fomentar empleo inversion,2019-03-27
Jorge,Yunda,LoroHomero,jorge yunda lorohomero elalcaldedetodo quitograndeotravez,2019-03-27
Jorge,Yunda,LoroHomero,jaja poder negar lorohomero humildad hacer campana sucio reir propio fake news aceptar experiencia alcald avanzar desbaratar hacer bien,2019-03-27
Jorge,Yunda,LoroHomero,defensoresar lorohomero perrito aprox meses jugueton lindo vacuna desparasitado raza pequén lamentablemente cuestión fuerzo mayor poder tener quiza alguien dispuesto cuidar dar hogar,2019-03-27
Jorge,Yunda,LoroHomero,gamanoticiasec lorohomero ojala mantener humildad alegria caracterizo venir trabajo duro trabajar quito,2019-03-27
Jorge,Yunda,LoroHomero,lorohomero luisevivanco gustar lorohomero manera responder inteligencia buen humor leccion amigo luisevivanco,2019-03-28
Jorge,Yunda,LoroHomero,petulante clasismo quiteno lorohomero desear mejor alcaldio rodeese bien fallir ciudad quito necesitar solución urgente grande problema adema planificar futuro mediato arrimar hombre capital critico,2019-03-28
Jorge,Yunda,LoroHomero,acabar encontrar senor luisevivanco aeropuerto quito salir vivir ciudad triunfo electoral,2019-03-28
Jorge,Yunda,LoroHomero,tomar palabra lorohomero trabajar propuesta tiendar puente nuevo administracion municipal construir vision colectivo quito municipioquito franciscopunina soynorris ouishare ciclopoli fenodis1 humanasecuador,2019-03-30
Jorge,Yunda,LoroHomero,ahora serar encargado limpiar ciudad politico bien sucio seguir ser patrimonio favor hacer campanas poco argumento limpien lorohomero cnegobec teleamazonasec carlosverareal,2019-03-30
Jorge,Yunda,LoroHomero,lahoradelplaneta solandar quito planeta contaminacion plastico visitante quiosco dejo mensaje alcalde electo lorohomero alcaldeyundaprohibelafunda,2019-03-30
Jorge,Yunda,LoroHomero,lahoradelplaneta nino quito dejar mensaje inhibicion ingenuidad ilusion alcalde lorohomero recordar futuro asumir elimine plastico desechabl solo,2019-03-30
Jorge,Yunda,LoroHomero,gracias quitoquerido defraudaremos yundaalcalde19 lorohomero,2019-03-31
Jorge,Yunda,LoroHomero,maximo lorohomero segun investigador gorila sonrien jugar senal amistad explicandol resto companero simple gesto mostrar diente intencion atacarl trabajar sonrisa corazon,2019-03-31
Jorge,Yunda,LoroHomero,pobre impedir cuidar amor peludito lorohomero lilianayunda ecanimal rescateanimalec,2019-03-31
Jorge,Yunda,LoroHomero,lunes 7h30 24horasuio entrevistar alcalde electo jorge yunda lorohomero teleamazonasec,2019-04-01
Jorge,Yunda,LoroHomero,contar jorgeyundauio falso unico cuenta oficial momento alcalde electo quito lorohomero,2019-04-01
Jorge,Yunda,LoroHomero,gracias querido lorohomero compartir vivencia camino musical noteheolvidado concierto quimera musicaec musicalatinoamericana ecuador abril 20h00 teatro nacional entrada ticketshow,2019-04-01
Jorge,Yunda,LoroHomero,buen dia dio,2019-04-01
